data,id,mois,jour,annee,numero_de_message,temperature_partie_entiere,temperature_partie_decimale,humidite,pluie_en_augets,direction_du_vecteur_moyen_de_vent,force_moyenne_du_vecteur_de_vent,pression_a_decoder,direction_du_vecteur_de_vent_max,force_du_vecteur_de_vent_max,pluie_la_plus_intense_durant_1_min,type_station,pluie_intensite_max,heure,annee_reelle,minute,pression,temperature_decodee,direction_du_vecteur_vent_moyen,type_de_station,pluie,direction_du_vecteur_de_vent_max_en_degres,force_moyenne_du_vecteur_vent,force_rafale_max,jour_mois,dd_mm_yy_utc,hh_mm_utc,dd_mm_yy_hh_mm,temperature_en_degre_c,false_message,dd_mm_yy_hh_mm_utc,heure_paris_dd_mm_yy_hh_mm,heure_de_paris,heure_utc
aaf0a4f2f2f2f2f2f2f2f2f3,85,7,16,10,39,75,12,94.0,47,47,23,151,9.0,60,11,51,2.2,9,2029,30,105100.0,25,94.0,sous station,9.4,202.5,23.0,60.0,16/7,16/7/2029,9:30,2029-07-16T09:30:00,25.12,267125272015603,2029-07-16T09:30:00+00:00,2029-07-16T09:30:00+02:00,2029-07-16T09:30:00+00:00,2029-07-16T09:30:00+00:00
aaf0b2f2f2f2f2f2f2f2f2f3,85,7,16,11,23,75,12,94.0,47,47,23,151,9.0,60,11,51,2.2,5,2030,30,105100.0,25,94.0,sous station,9.4,202.5,23.0,60.0,16/7,16/7/2030,5:30,2030-07-16T05:30:00,25.12,267125272015603,2030-07-16T05:30:00+00:00,2030-07-16T05:30:00+02:00,2030-07-16T05:30:00+00:00,2030-07-16T05:30:00+00:00
aaf094f2f2f2f2f2f2f2f2f3,85,7,16,9,39,75,12,94.0,47,47,23,151,9.0,60,11,51,2.2,9,2028,30,105100.0,25,94.0,sous station,9.4,202.5,23.0,60.0,16/7,16/7/2028,9:30,2028-07-16T09:30:00,25.12,267125272015603,2028-07-16T09:30:00+00:00,2028-07-16T09:30:00+02:00,2028-07-16T09:30:00+00:00,2028-07-16T09:30:00+00:00
aaf0baf2f2f2f2f2f2f2f2f3,85,7,16,11,87,75,12,94.0,47,47,23,151,9.0,60,11,51,2.2,21,2030,30,105100.0,25,94.0,sous station,9.4,202.5,23.0,60.0,16/7,16/7/2030,21:30,2030-07-16T21:30:00,25.12,267125272015603,2030-07-16T21:30:00+00:00,2030-07-16T21:30:00+02:00,2030-07-16T21:30:00+00:00,2030-07-16T21:30:00+00:00
ab6898f2f2f2f2f2f2f2f2f3,85,11,8,9,71,75,12,94.0,47,47,23,151,9.0,60,11,51,2.2,17,2028,30,105100.0,25,94.0,sous station,9.4,202.5,23.0,60.0,8/11,8/11/2028,17:30,2028-11-08T17:30:00,25.12,267125272015603,2028-11-08T17:30:00+00:00,2028-11-08T17:30:00+01:00,2028-11-08T17:30:00+00:00,2028-11-08T17:30:00+00:00
ab5c88f2f2f2f2f2f2f2f2f3,85,10,28,8,71,75,12,94.0,47,47,23,151,9.0,60,11,51,2.2,17,2027,30,105100.0,25,94.0,sous station,9.4,202.5,23.0,60.0,28/10,28/10/2027,17:30,2027-10-28T17:30:00,25.12,267125272015603,2027-10-28T17:30:00+00:00,2027-10-28T17:30:00+02:00,2027-10-28T17:30:00+00:00,2027-10-28T17:30:00+00:00
aad4a6f2f2f2f2f2f2f2f2f3,85,6,20,10,55,75,12,94.0,47,47,23,151,9.0,60,11,51,2.2,13,2029,30,105100.0,25,94.0,sous station,9.4,202.5,23.0,60.0,20/6,20/6/2029,13:30,2029-06-20T13:30:00,25.12,267125272015603,2029-06-20T13:30:00+00:00,2029-06-20T13:30:00+02:00,2029-06-20T13:30:00+00:00,2029-06-20T13:30:00+00:00
ab90b4f2f2f2f2f2f2f2f2f3,85,12,16,11,39,75,12,94.0,47,47,23,151,9.0,60,11,51,2.2,9,2030,30,105100.0,25,94.0,sous station,9.4,202.5,23.0,60.0,16/12,16/12/2030,9:30,2030-12-16T09:30:00,25.12,267125272015603,2030-12-16T09:30:00+00:00,2030-12-16T09:30:00+01:00,2030-12-16T09:30:00+00:00,2030-12-16T09:30:00+00:00
ab649af2f2f2f2f2f2f2f2f3,85,11,4,9,87,75,12,94.0,47,47,23,151,9.0,60,11,51,2.2,21,2028,30,105100.0,25,94.0,sous station,9.4,202.5,23.0,60.0,4/11,4/11/2028,21:30,2028-11-04T21:30:00,25.12,267125272015603,2028-11-04T21:30:00+00:00,2028-11-04T21:30:00+01:00,2028-11-04T21:30:00+00:00,2028-11-04T21:30:00+00:00
ab8480f2f2f2f2f2f2f2f2f3,85,12,4,8,7,75,12,94.0,47,47,23,151,9.0,60,11,51,2.2,1,2027,30,105100.0,25,94.0,sous station,9.4,202.5,23.0,60.0,4/12,4/12/2027,1:30,2027-12-04T01:30:00,25.12,267125272015603,2027-12-04T01:30:00+00:00,2027-12-04T01:30:00+01:00,2027-12-04T01:30:00+00:00,2027-12-04T01:30:00+00:00
ab849af2f2f2f2f2f2f2f2f3,85,12,4,9,87,75,12,94.0,47,47,23,151,9.0,60,11,51,2.2,21,2028,30,105100.0,25,94.0,sous station,9.4,202.5,23.0,60.0,4/12,4/12/2028,21:30,2028-12-04T21:30:00,25.12,267125272015603,2028-12-04T21:30:00+00:00,2028-12-04T21:30:00+01:00,2028-12-04T21:30:00+00:00,2028-12-04T21:30:00+00:00
ab88b2f2f2f2f2f2f2f2f2f3,85,12,8,11,23,75,12,94.0,47,47,23,151,9.0,60,11,51,2.2,5,2030,30,105100.0,25,94.0,sous station,9.4,202.5,23.0,60.0,8/12,8/12/2030,5:30,2030-12-08T05:30:00,25.12,267125272015603,2030-12-08T05:30:00+00:00,2030-12-08T05:30:00+01:00,2030-12-08T05:30:00+00:00,2030-12-08T05:30:00+00:00
ab9c84f2f2f2f2f2f2f2f2f3,85,12,28,8,39,75,12,94.0,47,47,23,151,9.0,60,11,51,2.2,9,2027,30,105100.0,25,94.0,sous station,9.4,202.5,23.0,60.0,28/12,28/12/2027,9:30,2027-12-28T09:30:00,25.12,267125272015603,2027-12-28T09:30:00+00:00,2027-12-28T09:30:00+01:00,2027-12-28T09:30:00+00:00,2027-12-28T09:30:00+00:00
ab9c88f2f2f2f2f2f2f2f2f3,85,12,28,8,71,75,12,94.0,47,47,23,151,9.0,60,11,51,2.2,17,2027,30,105100.0,25,94.0,sous station,9.4,202.5,23.0,60.0,28/12,28/12/2027,17:30,2027-12-28T17:30:00,25.12,267125272015603,2027-12-28T17:30:00+00:00,2027-12-28T17:30:00+01:00,2027-12-28T17:30:00+00:00,2027-12-28T17:30:00+00:00
ab9892f2f2f2f2f2f2f2f2f3,85,12,24,9,23,75,12,94.0,47,47,23,151,9.0,60,11,51,2.2,5,2028,30,105100.0,25,94.0,sous station,9.4,202.5,23.0,60.0,24/12,24/12/2028,5:30,2028-12-24T05:30:00,25.12,267125272015603,2028-12-24T05:30:00+00:00,2028-12-24T05:30:00+01:00,2028-12-24T05:30:00+00:00,2028-12-24T05:30:00+00:00
ab4896f2f2f2f2f2f2f2f2f3,85,10,8,9,55,75,12,94.0,47,47,23,151,9.0,60,11,51,2.2,13,2028,30,105100.0,25,94.0,sous station,9.4,202.5,23.0,60.0,8/10,8/10/2028,13:30,2028-10-08T13:30:00,25.12,267125272015603,2028-10-08T13:30:00+00:00,2028-10-08T13:30:00+02:00,2028-10-08T13:30:00+00:00,2028-10-08T13:30:00+00:00
ab4898f2f2f2f2f2f2f2f2f3,85,10,8,9,71,75,12,94.0,47,47,23,151,9.0,60,11,51,2.2,17,2028,30,105100.0,25,94.0,sous station,9.4,202.5,23.0,60.0,8/10,8/10/2028,17:30,2028-10-08T17:30:00,25.12,267125272015603,2028-10-08T17:30:00+00:00,2028-10-08T17:30:00+02:00,2028-10-08T17:30:00+00:00,2028-10-08T17:30:00+00:00
ab44b2f2f2f2f2f2f2f2f2f3,85,10,4,11,23,75,12,94.0,47,47,23,151,9.0,60,11,51,2.2,5,2030,30,105100.0,25,94.0,sous station,9.4,202.5,23.0,60.0,4/10,4/10/2030,5:30,2030-10-04T05:30:00,25.12,267125272015603,2030-10-04T05:30:00+00:00,2030-10-04T05:30:00+02:00,2030-10-04T05:30:00+00:00,2030-10-04T05:30:00+00:00
ab44b8f2f2f2f2f2f2f2f2f3,85,10,4,11,71,75,12,94.0,47,47,23,151,9.0,60,11,51,2.2,17,2030,30,105100.0,25,94.0,sous station,9.4,202.5,23.0,60.0,4/10,4/10/2030,17:30,2030-10-04T17:30:00,25.12,267125272015603,2030-10-04T17:30:00+00:00,2030-10-04T17:30:00+02:00,2030-10-04T17:30:00+00:00,2030-10-04T17:30:00+00:00
ab8484f2f2f2f2f2f2f2f2f3,85,12,4,8,39,75,12,94.0,47,47,23,151,9.0,60,11,51,2.2,9,2027,30,105100.0,25,94.0,sous station,9.4,202.5,23.0,60.0,4/12,4/12/2027,9:30,2027-12-04T09:30:00,25.12,267125272015603,2027-12-04T09:30:00+00:00,2027-12-04T09:30:00+01:00,2027-12-04T09:30:00+00:00,2027-12-04T09:30:00+00:00
ab9088f2f2f2f2f2f2f2f2f3,85,12,16,8,71,75,12,94.0,47,47,23,151,9.0,60,11,51,2.2,17,2027,30,105100.0,25,94.0,sous station,9.4,202.5,23.0,60.0,16/12,16/12/2027,17:30,2027-12-16T17:30:00,25.12,267125272015603,2027-12-16T17:30:00+00:00,2027-12-16T17:30:00+01:00,2027-12-16T17:30:00+00:00,2027-12-16T17:30:00+00:00
ab4cb8f2f2f2f2f2f2f2f2f3,85,10,12,11,71,75,12,94.0,47,47,23,151,9.0,60,11,51,2.2,17,2030,30,105100.0,25,94.0,sous station,9.4,202.5,23.0,60.0,12/10,12/10/2030,17:30,2030-10-12T17:30:00,25.12,267125272015603,2030-10-12T17:30:00+00:00,2030-10-12T17:30:00+02:00,2030-10-12T17:30:00+00:00,2030-10-12T17:30:00+00:00
ab90b0f2f2f2f2f2f2f2f2f3,85,12,16,11,7,75,12,94.0,47,47,23,151,9.0,60,11,51,2.2,1,2030,30,105100.0,25,94.0,sous station,9.4,202.5,23.0,60.0,16/12,16/12/2030,1:30,2030-12-16T01:30:00,25.12,267125272015603,2030-12-16T01:30:00+00:00,2030-12-16T01:30:00+01:00,2030-12-16T01:30:00+00:00,2030-12-16T01:30:00+00:00
ab90baf2f2f2f2f2f2f2f2f3,85,12,16,11,87,75,12,94.0,47,47,23,151,9.0,60,11,51,2.2,21,2030,30,105100.0,25,94.0,sous station,9.4,202.5,23.0,60.0,16/12,16/12/2030,21:30,2030-12-16T21:30:00,25.12,267125272015603,2030-12-16T21:30:00+00:00,2030-12-16T21:30:00+01:00,2030-12-16T21:30:00+00:00,2030-12-16T21:30:00+00:00
ab9898f2f2f2f2f2f2f2f2f3,85,12,24,9,71,75,12,94.0,47,47,23,151,9.0,60,11,51,2.2,17,2028,30,105100.0,25,94.0,sous station,9.4,202.5,23.0,60.0,24/12,24/12/2028,17:30,2028-12-24T17:30:00,25.12,267125272015603,2028-12-24T17:30:00+00:00,2028-12-24T17:30:00+01:00,2028-12-24T17:30:00+00:00,2028-12-24T17:30:00+00:00
ab64b0f2f2f2f2f2f2f2f2f3,85,11,4,11,7,75,12,94.0,47,47,23,151,9.0,60,11,51,2.2,1,2030,30,105100.0,25,94.0,sous station,9.4,202.5,23.0,60.0,4/11,4/11/2030,1:30,2030-11-04T01:30:00,25.12,267125272015603,2030-11-04T01:30:00+00:00,2030-11-04T01:30:00+01:00,2030-11-04T01:30:00+00:00,2030-11-04T01:30:00+00:00
ab6890f2f2f2f2f2f2f2f2f3,85,11,8,9,7,75,12,94.0,47,47,23,151,9.0,60,11,51,2.2,1,2028,30,105100.0,25,94.0,sous station,9.4,202.5,23.0,60.0,8/11,8/11/2028,1:30,2028-11-08T01:30:00,25.12,267125272015603,2028-11-08T01:30:00+00:00,2028-11-08T01:30:00+01:00,2028-11-08T01:30:00+00:00,2028-11-08T01:30:00+00:00
ab54b0f2f2f2f2f2f2f2f2f3,85,10,20,11,7,75,12,94.0,47,47,23,151,9.0,60,11,51,2.2,1,2030,30,105100.0,25,94.0,sous station,9.4,202.5,23.0,60.0,20/10,20/10/2030,1:30,2030-10-20T01:30:00,25.12,267125272015603,2030-10-20T01:30:00+00:00,2030-10-20T01:30:00+02:00,2030-10-20T01:30:00+00:00,2030-10-20T01:30:00+00:00
ab1c98f2f2f2f2f2f2f2f2f3,85,8,28,9,71,75,12,94.0,47,47,23,151,9.0,60,11,51,2.2,17,2028,30,105100.0,25,94.0,sous station,9.4,202.5,23.0,60.0,28/8,28/8/2028,17:30,2028-08-28T17:30:00,25.12,267125272015603,2028-08-28T17:30:00+00:00,2028-08-28T17:30:00+02:00,2028-08-28T17:30:00+00:00,2028-08-28T17:30:00+00:00
ab7492f2f2f2f2f2f2f2f2f3,85,11,20,9,23,75,12,94.0,47,47,23,151,9.0,60,11,51,2.2,5,2028,30,105100.0,25,94.0,sous station,9.4,202.5,23.0,60.0,20/11,20/11/2028,5:30,2028-11-20T05:30:00,25.12,267125272015603,2028-11-20T05:30:00+00:00,2028-11-20T05:30:00+01:00,2028-11-20T05:30:00+00:00,2028-11-20T05:30:00+00:00
ab78baf2f2f2f2f2f2f2f2f3,85,11,24,11,87,75,12,94.0,47,47,23,151,9.0,60,11,51,2.2,21,2030,30,105100.0,25,94.0,sous station,9.4,202.5,23.0,60.0,24/11,24/11/2030,21:30,2030-11-24T21:30:00,25.12,267125272015603,2030-11-24T21:30:00+00:00,2030-11-24T21:30:00+01:00,2030-11-24T21:30:00+00:00,2030-11-24T21:30:00+00:00
ab04b2f2f2f2f2f2f2f2f2f3,85,8,4,11,23,75,12,94.0,47,47,23,151,9.0,60,11,51,2.2,5,2030,30,105100.0,25,94.0,sous station,9.4,202.5,23.0,60.0,4/8,4/8/2030,5:30,2030-08-04T05:30:00,25.12,267125272015603,2030-08-04T05:30:00+00:00,2030-08-04T05:30:00+02:00,2030-08-04T05:30:00+00:00,2030-08-04T05:30:00+00:00
ab0caaf2f2f2f2f2f2f2f2f3,85,8,12,10,87,75,12,94.0,47,47,23,151,9.0,60,11,51,2.2,21,2029,30,105100.0,25,94.0,sous station,9.4,202.5,23.0,60.0,12/8,12/8/2029,21:30,2029-08-12T21:30:00,25.12,267125272015603,2029-08-12T21:30:00+00:00,2029-08-12T21:30:00+02:00,2029-08-12T21:30:00+00:00,2029-08-12T21:30:00+00:00
ab1892f2f2f2f2f2f2f2f2f3,85,8,24,9,23,75,12,94.0,47,47,23,151,9.0,60,11,51,2.2,5,2028,30,105100.0,25,94.0,sous station,9.4,202.5,23.0,60.0,24/8,24/8/2028,5:30,2028-08-24T05:30:00,25.12,267125272015603,2028-08-24T05:30:00+00:00,2028-08-24T05:30:00+02:00,2028-08-24T05:30:00+00:00,2028-08-24T05:30:00+00:00
ab84aaf2f2f2f2f2f2f2f2f3,85,12,4,10,87,75,12,94.0,47,47,23,151,9.0,60,11,51,2.2,21,2029,30,105100.0,25,94.0,sous station,9.4,202.5,23.0,60.0,4/12,4/12/2029,21:30,2029-12-04T21:30:00,25.12,267125272015603,2029-12-04T21:30:00+00:00,2029-12-04T21:30:00+01:00,2029-12-04T21:30:00+00:00,2029-12-04T21:30:00+00:00
ab8880f2f2f2f2f2f2f2f2f3,85,12,8,8,7,75,12,94.0,47,47,23,151,9.0,60,11,51,2.2,1,2027,30,105100.0,25,94.0,sous station,9.4,202.5,23.0,60.0,8/12,8/12/2027,1:30,2027-12-08T01:30:00,25.12,267125272015603,2027-12-08T01:30:00+00:00,2027-12-08T01:30:00+01:00,2027-12-08T01:30:00+00:00,2027-12-08T01:30:00+00:00
ab88a4f2f2f2f2f2f2f2f2f3,85,12,8,10,39,75,12,94.0,47,47,23,151,9.0,60,11,51,2.2,9,2029,30,105100.0,25,94.0,sous station,9.4,202.5,23.0,60.0,8/12,8/12/2029,9:30,2029-12-08T09:30:00,25.12,267125272015603,2029-12-08T09:30:00+00:00,2029-12-08T09:30:00+01:00,2029-12-08T09:30:00+00:00,2029-12-08T09:30:00+00:00
ab8cb0f2f2f2f2f2f2f2f2f3,85,12,12,11,7,75,12,94.0,47,47,23,151,9.0,60,11,51,2.2,1,2030,30,105100.0,25,94.0,sous station,9.4,202.5,23.0,60.0,12/12,12/12/2030,1:30,2030-12-12T01:30:00,25.12,267125272015603,2030-12-12T01:30:00+00:00,2030-12-12T01:30:00+01:00,2030-12-12T01:30:00+00:00,2030-12-12T01:30:00+00:00
ab9098f2f2f2f2f2f2f2f2f3,85,12,16,9,71,75,12,94.0,47,47,23,151,9.0,60,11,51,2.2,17,2028,30,105100.0,25,94.0,sous station,9.4,202.5,23.0,60.0,16/12,16/12/2028,17:30,2028-12-16T17:30:00,25.12,267125272015603,2028-12-16T17:30:00+00:00,2028-12-16T17:30:00+01:00,2028-12-16T17:30:00+00:00,2028-12-16T17:30:00+00:00
a94484f2f2f2f2f2f2f2f2f3,84,10,4,8,39,75,12,94.0,47,47,23,151,9.0,60,11,51,2.2,9,2027,30,105100.0,25,94.0,sous station,9.4,202.5,23.0,60.0,4/10,4/10/2027,9:30,2027-10-04T09:30:00,25.12,267125272015603,2027-10-04T09:30:00+00:00,2027-10-04T09:30:00+02:00,2027-10-04T09:30:00+00:00,2027-10-04T09:30:00+00:00
a94c82f2f2f2f2f2f2f2f2f3,84,10,12,8,23,75,12,94.0,47,47,23,151,9.0,60,11,51,2.2,5,2027,30,105100.0,25,94.0,sous station,9.4,202.5,23.0,60.0,12/10,12/10/2027,5:30,2027-10-12T05:30:00,25.12,267125272015603,2027-10-12T05:30:00+00:00,2027-10-12T05:30:00+02:00,2027-10-12T05:30:00+00:00,2027-10-12T05:30:00+00:00
a94c80f2f2f2f2f2f2f2f2f3,84,10,12,8,7,75,12,94.0,47,47,23,151,9.0,60,11,51,2.2,1,2027,30,105100.0,25,94.0,sous station,9.4,202.5,23.0,60.0,12/10,12/10/2027,1:30,2027-10-12T01:30:00,25.12,267125272015603,2027-10-12T01:30:00+00:00,2027-10-12T01:30:00+02:00,2027-10-12T01:30:00+00:00,2027-10-12T01:30:00+00:00
ac24b6f2f2f2f2f2f2f2f2f3,86,1,4,11,55,75,12,94.0,47,47,23,151,9.0,60,11,51,2.2,13,2030,30,105100.0,25,94.0,sous station,9.4,202.5,23.0,60.0,4/1,4/1/2030,13:30,2030-01-04T13:30:00,25.12,267125272015603,2030-01-04T13:30:00+00:00,2030-01-04T13:30:00+01:00,2030-01-04T13:30:00+00:00,2030-01-04T13:30:00+00:00
a944aaf2f2f2f2f2f2f2f2f3,84,10,4,10,87,75,12,94.0,47,47,23,151,9.0,60,11,51,2.2,21,2029,30,105100.0,25,94.0,sous station,9.4,202.5,23.0,60.0,4/10,4/10/2029,21:30,2029-10-04T21:30:00,25.12,267125272015603,2029-10-04T21:30:00+00:00,2029-10-04T21:30:00+02:00,2029-10-04T21:30:00+00:00,2029-10-04T21:30:00+00:00
a954a8f2f2f2f2f2f2f2f2f3,84,10,20,10,71,75,12,94.0,47,47,23,151,9.0,60,11,51,2.2,17,2029,30,105100.0,25,94.0,sous station,9.4,202.5,23.0,60.0,20/10,20/10/2029,17:30,2029-10-20T17:30:00,25.12,267125272015603,2029-10-20T17:30:00+00:00,2029-10-20T17:30:00+02:00,2029-10-20T17:30:00+00:00,2029-10-20T17:30:00+00:00
a99494f2f2f2f2f2f2f2f2f3,84,12,20,9,39,75,12,94.0,47,47,23,151,9.0,60,11,51,2.2,9,2028,30,105100.0,25,94.0,sous station,9.4,202.5,23.0,60.0,20/12,20/12/2028,9:30,2028-12-20T09:30:00,25.12,267125272015603,2028-12-20T09:30:00+00:00,2028-12-20T09:30:00+01:00,2028-12-20T09:30:00+00:00,2028-12-20T09:30:00+00:00
ab10a4f2f2f2f2f2f2f2f2f3,85,8,16,10,39,75,12,94.0,47,47,23,151,9.0,60,11,51,2.2,9,2029,30,105100.0,25,94.0,sous station,9.4,202.5,23.0,60.0,16/8,16/8/2029,9:30,2029-08-16T09:30:00,25.12,267125272015603,2029-08-16T09:30:00+00:00,2029-08-16T09:30:00+02:00,2029-08-16T09:30:00+00:00,2029-08-16T09:30:00+00:00
aa38a8f2f2f2f2f2f2f2f2f3,85,1,24,10,71,75,12,94.0,47,47,23,151,9.0,60,11,51,2.2,17,2029,30,105100.0,25,94.0,sous station,9.4,202.5,23.0,60.0,24/1,24/1/2029,17:30,2029-01-24T17:30:00,25.12,267125272015603,2029-01-24T17:30:00+00:00,2029-01-24T17:30:00+01:00,2029-01-24T17:30:00+00:00,2029-01-24T17:30:00+00:00
aa3cb0f2f2f2f2f2f2f2f2f3,85,1,28,11,7,75,12,94.0,47,47,23,151,9.0,60,11,51,2.2,1,2030,30,105100.0,25,94.0,sous station,9.4,202.5,23.0,60.0,28/1,28/1/2030,1:30,2030-01-28T01:30:00,25.12,267125272015603,2030-01-28T01:30:00+00:00,2030-01-28T01:30:00+01:00,2030-01-28T01:30:00+00:00,2030-01-28T01:30:00+00:00
aa68b4f2f2f2f2f2f2f2f2f3,85,3,8,11,39,75,12,94.0,47,47,23,151,9.0,60,11,51,2.2,9,2030,30,105100.0,25,94.0,sous station,9.4,202.5,23.0,60.0,8/3,8/3/2030,9:30,2030-03-08T09:30:00,25.12,267125272015603,2030-03-08T09:30:00+00:00,2030-03-08T09:30:00+01:00,2030-03-08T09:30:00+00:00,2030-03-08T09:30:00+00:00
ab6c88f2f2f2f2f2f2f2f2f3,85,11,12,8,71,75,12,94.0,47,47,23,151,9.0,60,11,51,2.2,17,2027,30,105100.0,25,94.0,sous station,9.4,202.5,23.0,60.0,12/11,12/11/2027,17:30,2027-11-12T17:30:00,25.12,267125272015603,2027-11-12T17:30:00+00:00,2027-11-12T17:30:00+01:00,2027-11-12T17:30:00+00:00,2027-11-12T17:30:00+00:00
ab6c8af2f2f2f2f2f2f2f2f3,85,11,12,8,87,75,12,94.0,47,47,23,151,9.0,60,11,51,2.2,21,2027,30,105100.0,25,94.0,sous station,9.4,202.5,23.0,60.0,12/11,12/11/2027,21:30,2027-11-12T21:30:00,25.12,267125272015603,2027-11-12T21:30:00+00:00,2027-11-12T21:30:00+01:00,2027-11-12T21:30:00+00:00,2027-11-12T21:30:00+00:00
ab68a8f2f2f2f2f2f2f2f2f3,85,11,8,10,71,75,12,94.0,47,47,23,151,9.0,60,11,51,2.2,17,2029,30,105100.0,25,94.0,sous station,9.4,202.5,23.0,60.0,8/11,8/11/2029,17:30,2029-11-08T17:30:00,25.12,267125272015603,2029-11-08T17:30:00+00:00,2029-11-08T17:30:00+01:00,2029-11-08T17:30:00+00:00,2029-11-08T17:30:00+00:00
aa6882f2f2f2f2f2f2f2f2f3,85,3,8,8,23,75,12,94.0,47,47,23,151,9.0,60,11,51,2.2,5,2027,30,105100.0,25,94.0,sous station,9.4,202.5,23.0,60.0,8/3,8/3/2027,5:30,2027-03-08T05:30:00,25.12,267125272015603,2027-03-08T05:30:00+00:00,2027-03-08T05:30:00+01:00,2027-03-08T05:30:00+00:00,2027-03-08T05:30:00+00:00
ab78a2f2f2f2f2f2f2f2f2f3,85,11,24,10,23,75,12,94.0,47,47,23,151,9.0,60,11,51,2.2,5,2029,30,105100.0,25,94.0,sous station,9.4,202.5,23.0,60.0,24/11,24/11/2029,5:30,2029-11-24T05:30:00,25.12,267125272015603,2029-11-24T05:30:00+00:00,2029-11-24T05:30:00+01:00,2029-11-24T05:30:00+00:00,2029-11-24T05:30:00+00:00
ab789af2f2f2f2f2f2f2f2f3,85,11,24,9,87,75,12,94.0,47,47,23,151,9.0,60,11,51,2.2,21,2028,30,105100.0,25,94.0,sous station,9.4,202.5,23.0,60.0,24/11,24/11/2028,21:30,2028-11-24T21:30:00,25.12,267125272015603,2028-11-24T21:30:00+00:00,2028-11-24T21:30:00+01:00,2028-11-24T21:30:00+00:00,2028-11-24T21:30:00+00:00
ab6cbaf2f2f2f2f2f2f2f2f3,85,11,12,11,87,75,12,94.0,47,47,23,151,9.0,60,11,51,2.2,21,2030,30,105100.0,25,94.0,sous station,9.4,202.5,23.0,60.0,12/11,12/11/2030,21:30,2030-11-12T21:30:00,25.12,267125272015603,2030-11-12T21:30:00+00:00,2030-11-12T21:30:00+01:00,2030-11-12T21:30:00+00:00,2030-11-12T21:30:00+00:00
ab8c80f2f2f2f2f2f2f2f2f3,85,12,12,8,7,75,12,94.0,47,47,23,151,9.0,60,11,51,2.2,1,2027,30,105100.0,25,94.0,sous station,9.4,202.5,23.0,60.0,12/12,12/12/2027,1:30,2027-12-12T01:30:00,25.12,267125272015603,2027-12-12T01:30:00+00:00,2027-12-12T01:30:00+01:00,2027-12-12T01:30:00+00:00,2027-12-12T01:30:00+00:00
aa24b8f2f2f2f2f2f2f2f2f3,85,1,4,11,71,75,12,94.0,47,47,23,151,9.0,60,11,51,2.2,17,2030,30,105100.0,25,94.0,sous station,9.4,202.5,23.0,60.0,4/1,4/1/2030,17:30,2030-01-04T17:30:00,25.12,267125272015603,2030-01-04T17:30:00+00:00,2030-01-04T17:30:00+01:00,2030-01-04T17:30:00+00:00,2030-01-04T17:30:00+00:00
aa2888f2f2f2f2f2f2f2f2f3,85,1,8,8,71,75,12,94.0,47,47,23,151,9.0,60,11,51,2.2,17,2027,30,105100.0,25,94.0,sous station,9.4,202.5,23.0,60.0,8/1,8/1/2027,17:30,2027-01-08T17:30:00,25.12,267125272015603,2027-01-08T17:30:00+00:00,2027-01-08T17:30:00+01:00,2027-01-08T17:30:00+00:00,2027-01-08T17:30:00+00:00
aa2c96f2f2f2f2f2f2f2f2f3,85,1,12,9,55,75,12,94.0,47,47,23,151,9.0,60,11,51,2.2,13,2028,30,105100.0,25,94.0,sous station,9.4,202.5,23.0,60.0,12/1,12/1/2028,13:30,2028-01-12T13:30:00,25.12,267125272015603,2028-01-12T13:30:00+00:00,2028-01-12T13:30:00+01:00,2028-01-12T13:30:00+00:00,2028-01-12T13:30:00+00:00
aa2cb0f2f2f2f2f2f2f2f2f3,85,1,12,11,7,75,12,94.0,47,47,23,151,9.0,60,11,51,2.2,1,2030,30,105100.0,25,94.0,sous station,9.4,202.5,23.0,60.0,12/1,12/1/2030,1:30,2030-01-12T01:30:00,25.12,267125272015603,2030-01-12T01:30:00+00:00,2030-01-12T01:30:00+01:00,2030-01-12T01:30:00+00:00,2030-01-12T01:30:00+00:00
aa3882f2f2f2f2f2f2f2f2f3,85,1,24,8,23,75,12,94.0,47,47,23,151,9.0,60,11,51,2.2,5,2027,30,105100.0,25,94.0,sous station,9.4,202.5,23.0,60.0,24/1,24/1/2027,5:30,2027-01-24T05:30:00,25.12,267125272015603,2027-01-24T05:30:00+00:00,2027-01-24T05:30:00+01:00,2027-01-24T05:30:00+00:00,2027-01-24T05:30:00+00:00
aa5cb6f2f2f2f2f2f2f2f2f3,85,2,28,11,55,75,12,94.0,47,47,23,151,9.0,60,11,51,2.2,13,2030,30,105100.0,25,94.0,sous station,9.4,202.5,23.0,60.0,28/2,28/2/2030,13:30,2030-02-28T13:30:00,25.12,267125272015603,2030-02-28T13:30:00+00:00,2030-02-28T13:30:00+01:00,2030-02-28T13:30:00+00:00,2030-02-28T13:30:00+00:00
aafc98f2f2f2f2f2f2f2f2f3,85,7,28,9,71,75,12,94.0,47,47,23,151,9.0,60,11,51,2.2,17,2028,30,105100.0,25,94.0,sous station,9.4,202.5,23.0,60.0,28/7,28/7/2028,17:30,2028-07-28T17:30:00,25.12,267125272015603,2028-07-28T17:30:00+00:00,2028-07-28T17:30:00+02:00,2028-07-28T17:30:00+00:00,2028-07-28T17:30:00+00:00
ab1caaf2f2f2f2f2f2f2f2f3,85,8,28,10,87,75,12,94.0,47,47,23,151,9.0,60,11,51,2.2,21,2029,30,105100.0,25,94.0,sous station,9.4,202.5,23.0,60.0,28/8,28/8/2029,21:30,2029-08-28T21:30:00,25.12,267125272015603,2029-08-28T21:30:00+00:00,2029-08-28T21:30:00+02:00,2029-08-28T21:30:00+00:00,2029-08-28T21:30:00+00:00
ab1cb0f2f2f2f2f2f2f2f2f3,85,8,28,11,7,75,12,94.0,47,47,23,151,9.0,60,11,51,2.2,1,2030,30,105100.0,25,94.0,sous station,9.4,202.5,23.0,60.0,28/8,28/8/2030,1:30,2030-08-28T01:30:00,25.12,267125272015603,2030-08-28T01:30:00+00:00,2030-08-28T01:30:00+02:00,2030-08-28T01:30:00+00:00,2030-08-28T01:30:00+00:00
ab0892f2f2f2f2f2f2f2f2f3,85,8,8,9,23,75,12,94.0,47,47,23,151,9.0,60,11,51,2.2,5,2028,30,105100.0,25,94.0,sous station,9.4,202.5,23.0,60.0,8/8,8/8/2028,5:30,2028-08-08T05:30:00,25.12,267125272015603,2028-08-08T05:30:00+00:00,2028-08-08T05:30:00+02:00,2028-08-08T05:30:00+00:00,2028-08-08T05:30:00+00:00
ab0498f2f2f2f2f2f2f2f2f3,85,8,4,9,71,75,12,94.0,47,47,23,151,9.0,60,11,51,2.2,17,2028,30,105100.0,25,94.0,sous station,9.4,202.5,23.0,60.0,4/8,4/8/2028,17:30,2028-08-04T17:30:00,25.12,267125272015603,2028-08-04T17:30:00+00:00,2028-08-04T17:30:00+02:00,2028-08-04T17:30:00+00:00,2028-08-04T17:30:00+00:00
ab04a4f2f2f2f2f2f2f2f2f3,85,8,4,10,39,75,12,94.0,47,47,23,151,9.0,60,11,51,2.2,9,2029,30,105100.0,25,94.0,sous station,9.4,202.5,23.0,60.0,4/8,4/8/2029,9:30,2029-08-04T09:30:00,25.12,267125272015603,2029-08-04T09:30:00+00:00,2029-08-04T09:30:00+02:00,2029-08-04T09:30:00+00:00,2029-08-04T09:30:00+00:00
ab08a0f2f2f2f2f2f2f2f2f3,85,8,8,10,7,75,12,94.0,47,47,23,151,9.0,60,11,51,2.2,1,2029,30,105100.0,25,94.0,sous station,9.4,202.5,23.0,60.0,8/8,8/8/2029,1:30,2029-08-08T01:30:00,25.12,267125272015603,2029-08-08T01:30:00+00:00,2029-08-08T01:30:00+02:00,2029-08-08T01:30:00+00:00,2029-08-08T01:30:00+00:00
ab10a6f2f2f2f2f2f2f2f2f3,85,8,16,10,55,75,12,94.0,47,47,23,151,9.0,60,11,51,2.2,13,2029,30,105100.0,25,94.0,sous station,9.4,202.5,23.0,60.0,16/8,16/8/2029,13:30,2029-08-16T13:30:00,25.12,267125272015603,2029-08-16T13:30:00+00:00,2029-08-16T13:30:00+02:00,2029-08-16T13:30:00+00:00,2029-08-16T13:30:00+00:00
ab08b4f2f2f2f2f2f2f2f2f3,85,8,8,11,39,75,12,94.0,47,47,23,151,9.0,60,11,51,2.2,9,2030,30,105100.0,25,94.0,sous station,9.4,202.5,23.0,60.0,8/8,8/8/2030,9:30,2030-08-08T09:30:00,25.12,267125272015603,2030-08-08T09:30:00+00:00,2030-08-08T09:30:00+02:00,2030-08-08T09:30:00+00:00,2030-08-08T09:30:00+00:00
ab10baf2f2f2f2f2f2f2f2f3,85,8,16,11,87,75,12,94.0,47,47,23,151,9.0,60,11,51,2.2,21,2030,30,105100.0,25,94.0,sous station,9.4,202.5,23.0,60.0,16/8,16/8/2030,21:30,2030-08-16T21:30:00,25.12,267125272015603,2030-08-16T21:30:00+00:00,2030-08-16T21:30:00+02:00,2030-08-16T21:30:00+00:00,2030-08-16T21:30:00+00:00
ab2892f2f2f2f2f2f2f2f2f3,85,9,8,9,23,75,12,94.0,47,47,23,151,9.0,60,11,51,2.2,5,2028,30,105100.0,25,94.0,sous station,9.4,202.5,23.0,60.0,8/9,8/9/2028,5:30,2028-09-08T05:30:00,25.12,267125272015603,2028-09-08T05:30:00+00:00,2028-09-08T05:30:00+02:00,2028-09-08T05:30:00+00:00,2028-09-08T05:30:00+00:00
ab24b2f2f2f2f2f2f2f2f2f3,85,9,4,11,23,75,12,94.0,47,47,23,151,9.0,60,11,51,2.2,5,2030,30,105100.0,25,94.0,sous station,9.4,202.5,23.0,60.0,4/9,4/9/2030,5:30,2030-09-04T05:30:00,25.12,267125272015603,2030-09-04T05:30:00+00:00,2030-09-04T05:30:00+02:00,2030-09-04T05:30:00+00:00,2030-09-04T05:30:00+00:00
ab48b6f2f2f2f2f2f2f2f2f3,85,10,8,11,55,75,12,94.0,47,47,23,151,9.0,60,11,51,2.2,13,2030,30,105100.0,25,94.0,sous station,9.4,202.5,23.0,60.0,8/10,8/10/2030,13:30,2030-10-08T13:30:00,25.12,267125272015603,2030-10-08T13:30:00+00:00,2030-10-08T13:30:00+02:00,2030-10-08T13:30:00+00:00,2030-10-08T13:30:00+00:00
ab8c84f2f2f2f2f2f2f2f2f3,85,12,12,8,39,75,12,94.0,47,47,23,151,9.0,60,11,51,2.2,9,2027,30,105100.0,25,94.0,sous station,9.4,202.5,23.0,60.0,12/12,12/12/2027,9:30,2027-12-12T09:30:00,25.12,267125272015603,2027-12-12T09:30:00+00:00,2027-12-12T09:30:00+01:00,2027-12-12T09:30:00+00:00,2027-12-12T09:30:00+00:00
ab908af2f2f2f2f2f2f2f2f3,85,12,16,8,87,75,12,94.0,47,47,23,151,9.0,60,11,51,2.2,21,2027,30,105100.0,25,94.0,sous station,9.4,202.5,23.0,60.0,16/12,16/12/2027,21:30,2027-12-16T21:30:00,25.12,267125272015603,2027-12-16T21:30:00+00:00,2027-12-16T21:30:00+01:00,2027-12-16T21:30:00+00:00,2027-12-16T21:30:00+00:00
ab90a8f2f2f2f2f2f2f2f2f3,85,12,16,10,71,75,12,94.0,47,47,23,151,9.0,60,11,51,2.2,17,2029,30,105100.0,25,94.0,sous station,9.4,202.5,23.0,60.0,16/12,16/12/2029,17:30,2029-12-16T17:30:00,25.12,267125272015603,2029-12-16T17:30:00+00:00,2029-12-16T17:30:00+01:00,2029-12-16T17:30:00+00:00,2029-12-16T17:30:00+00:00
ab1c82f2f2f2f2f2f2f2f2f3,85,8,28,8,23,75,12,94.0,47,47,23,151,9.0,60,11,51,2.2,5,2027,30,105100.0,25,94.0,sous station,9.4,202.5,23.0,60.0,28/8,28/8/2027,5:30,2027-08-28T05:30:00,25.12,267125272015603,2027-08-28T05:30:00+00:00,2027-08-28T05:30:00+02:00,2027-08-28T05:30:00+00:00,2027-08-28T05:30:00+00:00
aaa48af2f2f2f2f2f2f2f2f3,85,5,4,8,87,75,12,94.0,47,47,23,151,9.0,60,11,51,2.2,21,2027,30,105100.0,25,94.0,sous station,9.4,202.5,23.0,60.0,4/5,4/5/2027,21:30,2027-05-04T21:30:00,25.12,267125272015603,2027-05-04T21:30:00+00:00,2027-05-04T21:30:00+02:00,2027-05-04T21:30:00+00:00,2027-05-04T21:30:00+00:00
aaa898f2f2f2f2f2f2f2f2f3,85,5,8,9,71,75,12,94.0,47,47,23,151,9.0,60,11,51,2.2,17,2028,30,105100.0,25,94.0,sous station,9.4,202.5,23.0,60.0,8/5,8/5/2028,17:30,2028-05-08T17:30:00,25.12,267125272015603,2028-05-08T17:30:00+00:00,2028-05-08T17:30:00+02:00,2028-05-08T17:30:00+00:00,2028-05-08T17:30:00+00:00
ab74a0f2f2f2f2f2f2f2f2f3,85,11,20,10,7,75,12,94.0,47,47,23,151,9.0,60,11,51,2.2,1,2029,30,105100.0,25,94.0,sous station,9.4,202.5,23.0,60.0,20/11,20/11/2029,1:30,2029-11-20T01:30:00,25.12,267125272015603,2029-11-20T01:30:00+00:00,2029-11-20T01:30:00+01:00,2029-11-20T01:30:00+00:00,2029-11-20T01:30:00+00:00
ae747af2f2f2f2f2f2f2f2f3,87,3,20,7,87,75,12,94.0,47,47,23,151,9.0,60,11,51,2.2,21,2026,30,105100.0,25,94.0,sous station,9.4,202.5,23.0,60.0,20/3,20/3/2026,21:30,2026-03-20T21:30:00,25.12,267125272015603,2026-03-20T21:30:00+00:00,2026-03-20T21:30:00+01:00,2026-03-20T21:30:00+00:00,2026-03-20T21:30:00+00:00
aa8896f2f2f2f2f2f2f2f2f3,85,4,8,9,55,75,12,94.0,47,47,23,151,9.0,60,11,51,2.2,13,2028,30,105100.0,25,94.0,sous station,9.4,202.5,23.0,60.0,8/4,8/4/2028,13:30,2028-04-08T13:30:00,25.12,267125272015603,2028-04-08T13:30:00+00:00,2028-04-08T13:30:00+02:00,2028-04-08T13:30:00+00:00,2028-04-08T13:30:00+00:00
aa78b6f2f2f2f2f2f2f2f2f3,85,3,24,11,55,75,12,94.0,47,47,23,151,9.0,60,11,51,2.2,13,2030,30,105100.0,25,94.0,sous station,9.4,202.5,23.0,60.0,24/3,24/3/2030,13:30,2030-03-24T13:30:00,25.12,267125272015603,2030-03-24T13:30:00+00:00,2030-03-24T13:30:00+01:00,2030-03-24T13:30:00+00:00,2030-03-24T13:30:00+00:00
a8b48af2f2f2f2f2f2f2f2f3,84,5,20,8,87,75,12,94.0,47,47,23,151,9.0,60,11,51,2.2,21,2027,30,105100.0,25,94.0,sous station,9.4,202.5,23.0,60.0,20/5,20/5/2027,21:30,2027-05-20T21:30:00,25.12,267125272015603,2027-05-20T21:30:00+00:00,2027-05-20T21:30:00+02:00,2027-05-20T21:30:00+00:00,2027-05-20T21:30:00+00:00
ab8c98f2f2f2f2f2f2f2f2f3,85,12,12,9,71,75,12,94.0,47,47,23,151,9.0,60,11,51,2.2,17,2028,30,105100.0,25,94.0,sous station,9.4,202.5,23.0,60.0,12/12,12/12/2028,17:30,2028-12-12T17:30:00,25.12,267125272015603,2028-12-12T17:30:00+00:00,2028-12-12T17:30:00+01:00,2028-12-12T17:30:00+00:00,2028-12-12T17:30:00+00:00
a8c886f2f2f2f2f2f2f2f2f3,84,6,8,8,55,75,12,94.0,47,47,23,151,9.0,60,11,51,2.2,13,2027,30,105100.0,25,94.0,sous station,9.4,202.5,23.0,60.0,8/6,8/6/2027,13:30,2027-06-08T13:30:00,25.12,267125272015603,2027-06-08T13:30:00+00:00,2027-06-08T13:30:00+02:00,2027-06-08T13:30:00+00:00,2027-06-08T13:30:00+00:00
a8d4a4f2f2f2f2f2f2f2f2f3,84,6,20,10,39,75,12,94.0,47,47,23,151,9.0,60,11,51,2.2,9,2029,30,105100.0,25,94.0,sous station,9.4,202.5,23.0,60.0,20/6,20/6/2029,9:30,2029-06-20T09:30:00,25.12,267125272015603,2029-06-20T09:30:00+00:00,2029-06-20T09:30:00+02:00,2029-06-20T09:30:00+00:00,2029-06-20T09:30:00+00:00
a8d8a2f2f2f2f2f2f2f2f2f3,84,6,24,10,23,75,12,94.0,47,47,23,151,9.0,60,11,51,2.2,5,2029,30,105100.0,25,94.0,sous station,9.4,202.5,23.0,60.0,24/6,24/6/2029,5:30,2029-06-24T05:30:00,25.12,267125272015603,2029-06-24T05:30:00+00:00,2029-06-24T05:30:00+02:00,2029-06-24T05:30:00+00:00,2029-06-24T05:30:00+00:00
ab9c96f2f2f2f2f2f2f2f2f3,85,12,28,9,55,75,12,94.0,47,47,23,151,9.0,60,11,51,2.2,13,2028,30,105100.0,25,94.0,sous station,9.4,202.5,23.0,60.0,28/12,28/12/2028,13:30,2028-12-28T13:30:00,25.12,267125272015603,2028-12-28T13:30:00+00:00,2028-12-28T13:30:00+01:00,2028-12-28T13:30:00+00:00,2028-12-28T13:30:00+00:00
a8f4baf2f2f2f2f2f2f2f2f3,84,7,20,11,87,75,12,94.0,47,47,23,151,9.0,60,11,51,2.2,21,2030,30,105100.0,25,94.0,sous station,9.4,202.5,23.0,60.0,20/7,20/7/2030,21:30,2030-07-20T21:30:00,25.12,267125272015603,2030-07-20T21:30:00+00:00,2030-07-20T21:30:00+02:00,2030-07-20T21:30:00+00:00,2030-07-20T21:30:00+00:00
a8ec96f2f2f2f2f2f2f2f2f3,84,7,12,9,55,75,12,94.0,47,47,23,151,9.0,60,11,51,2.2,13,2028,30,105100.0,25,94.0,sous station,9.4,202.5,23.0,60.0,12/7,12/7/2028,13:30,2028-07-12T13:30:00,25.12,267125272015603,2028-07-12T13:30:00+00:00,2028-07-12T13:30:00+02:00,2028-07-12T13:30:00+00:00,2028-07-12T13:30:00+00:00
aadcaaf2f2f2f2f2f2f2f2f3,85,6,28,10,87,75,12,94.0,47,47,23,151,9.0,60,11,51,2.2,21,2029,30,105100.0,25,94.0,sous station,9.4,202.5,23.0,60.0,28/6,28/6/2029,21:30,2029-06-28T21:30:00,25.12,267125272015603,2029-06-28T21:30:00+00:00,2029-06-28T21:30:00+02:00,2029-06-28T21:30:00+00:00,2029-06-28T21:30:00+00:00
a8fc94f2f2f2f2f2f2f2f2f3,84,7,28,9,39,75,12,94.0,47,47,23,151,9.0,60,11,51,2.2,9,2028,30,105100.0,25,94.0,sous station,9.4,202.5,23.0,60.0,28/7,28/7/2028,9:30,2028-07-28T09:30:00,25.12,267125272015603,2028-07-28T09:30:00+00:00,2028-07-28T09:30:00+02:00,2028-07-28T09:30:00+00:00,2028-07-28T09:30:00+00:00
a90c82f2f2f2f2f2f2f2f2f3,84,8,12,8,23,75,12,94.0,47,47,23,151,9.0,60,11,51,2.2,5,2027,30,105100.0,25,94.0,sous station,9.4,202.5,23.0,60.0,12/8,12/8/2027,5:30,2027-08-12T05:30:00,25.12,267125272015603,2027-08-12T05:30:00+00:00,2027-08-12T05:30:00+02:00,2027-08-12T05:30:00+00:00,2027-08-12T05:30:00+00:00
a968a4f2f2f2f2f2f2f2f2f3,84,11,8,10,39,75,12,94.0,47,47,23,151,9.0,60,11,51,2.2,9,2029,30,105100.0,25,94.0,sous station,9.4,202.5,23.0,60.0,8/11,8/11/2029,9:30,2029-11-08T09:30:00,25.12,267125272015603,2029-11-08T09:30:00+00:00,2029-11-08T09:30:00+01:00,2029-11-08T09:30:00+00:00,2029-11-08T09:30:00+00:00
a944a6f2f2f2f2f2f2f2f2f3,84,10,4,10,55,75,12,94.0,47,47,23,151,9.0,60,11,51,2.2,13,2029,30,105100.0,25,94.0,sous station,9.4,202.5,23.0,60.0,4/10,4/10/2029,13:30,2029-10-04T13:30:00,25.12,267125272015603,2029-10-04T13:30:00+00:00,2029-10-04T13:30:00+02:00,2029-10-04T13:30:00+00:00,2029-10-04T13:30:00+00:00
a958a6f2f2f2f2f2f2f2f2f3,84,10,24,10,55,75,12,94.0,47,47,23,151,9.0,60,11,51,2.2,13,2029,30,105100.0,25,94.0,sous station,9.4,202.5,23.0,60.0,24/10,24/10/2029,13:30,2029-10-24T13:30:00,25.12,267125272015603,2029-10-24T13:30:00+00:00,2029-10-24T13:30:00+02:00,2029-10-24T13:30:00+00:00,2029-10-24T13:30:00+00:00
a96cb4f2f2f2f2f2f2f2f2f3,84,11,12,11,39,75,12,94.0,47,47,23,151,9.0,60,11,51,2.2,9,2030,30,105100.0,25,94.0,sous station,9.4,202.5,23.0,60.0,12/11,12/11/2030,9:30,2030-11-12T09:30:00,25.12,267125272015603,2030-11-12T09:30:00+00:00,2030-11-12T09:30:00+01:00,2030-11-12T09:30:00+00:00,2030-11-12T09:30:00+00:00
a964a0f2f2f2f2f2f2f2f2f3,84,11,4,10,7,75,12,94.0,47,47,23,151,9.0,60,11,51,2.2,1,2029,30,105100.0,25,94.0,sous station,9.4,202.5,23.0,60.0,4/11,4/11/2029,1:30,2029-11-04T01:30:00,25.12,267125272015603,2029-11-04T01:30:00+00:00,2029-11-04T01:30:00+01:00,2029-11-04T01:30:00+00:00,2029-11-04T01:30:00+00:00
a894a0f2f2f2f2f2f2f2f2f3,84,4,20,10,7,75,12,94.0,47,47,23,151,9.0,60,11,51,2.2,1,2029,30,105100.0,25,94.0,sous station,9.4,202.5,23.0,60.0,20/4,20/4/2029,1:30,2029-04-20T01:30:00,25.12,267125272015603,2029-04-20T01:30:00+00:00,2029-04-20T01:30:00+02:00,2029-04-20T01:30:00+00:00,2029-04-20T01:30:00+00:00
a898a6f2f2f2f2f2f2f2f2f3,84,4,24,10,55,75,12,94.0,47,47,23,151,9.0,60,11,51,2.2,13,2029,30,105100.0,25,94.0,sous station,9.4,202.5,23.0,60.0,24/4,24/4/2029,13:30,2029-04-24T13:30:00,25.12,267125272015603,2029-04-24T13:30:00+00:00,2029-04-24T13:30:00+02:00,2029-04-24T13:30:00+00:00,2029-04-24T13:30:00+00:00
a884a4f2f2f2f2f2f2f2f2f3,84,4,4,10,39,75,12,94.0,47,47,23,151,9.0,60,11,51,2.2,9,2029,30,105100.0,25,94.0,sous station,9.4,202.5,23.0,60.0,4/4,4/4/2029,9:30,2029-04-04T09:30:00,25.12,267125272015603,2029-04-04T09:30:00+00:00,2029-04-04T09:30:00+02:00,2029-04-04T09:30:00+00:00,2029-04-04T09:30:00+00:00
a8909af2f2f2f2f2f2f2f2f3,84,4,16,9,87,75,12,94.0,47,47,23,151,9.0,60,11,51,2.2,21,2028,30,105100.0,25,94.0,sous station,9.4,202.5,23.0,60.0,16/4,16/4/2028,21:30,2028-04-16T21:30:00,25.12,267125272015603,2028-04-16T21:30:00+00:00,2028-04-16T21:30:00+02:00,2028-04-16T21:30:00+00:00,2028-04-16T21:30:00+00:00
a8a4a2f2f2f2f2f2f2f2f2f3,84,5,4,10,23,75,12,94.0,47,47,23,151,9.0,60,11,51,2.2,5,2029,30,105100.0,25,94.0,sous station,9.4,202.5,23.0,60.0,4/5,4/5/2029,5:30,2029-05-04T05:30:00,25.12,267125272015603,2029-05-04T05:30:00+00:00,2029-05-04T05:30:00+02:00,2029-05-04T05:30:00+00:00,2029-05-04T05:30:00+00:00
a884a2f2f2f2f2f2f2f2f2f3,84,4,4,10,23,75,12,94.0,47,47,23,151,9.0,60,11,51,2.2,5,2029,30,105100.0,25,94.0,sous station,9.4,202.5,23.0,60.0,4/4,4/4/2029,5:30,2029-04-04T05:30:00,25.12,267125272015603,2029-04-04T05:30:00+00:00,2029-04-04T05:30:00+02:00,2029-04-04T05:30:00+00:00,2029-04-04T05:30:00+00:00
a994a0f2f2f2f2f2f2f2f2f3,84,12,20,10,7,75,12,94.0,47,47,23,151,9.0,60,11,51,2.2,1,2029,30,105100.0,25,94.0,sous station,9.4,202.5,23.0,60.0,20/12,20/12/2029,1:30,2029-12-20T01:30:00,25.12,267125272015603,2029-12-20T01:30:00+00:00,2029-12-20T01:30:00+01:00,2029-12-20T01:30:00+00:00,2029-12-20T01:30:00+00:00
a994a4f2f2f2f2f2f2f2f2f3,84,12,20,10,39,75,12,94.0,47,47,23,151,9.0,60,11,51,2.2,9,2029,30,105100.0,25,94.0,sous station,9.4,202.5,23.0,60.0,20/12,20/12/2029,9:30,2029-12-20T09:30:00,25.12,267125272015603,2029-12-20T09:30:00+00:00,2029-12-20T09:30:00+01:00,2029-12-20T09:30:00+00:00,2029-12-20T09:30:00+00:00
a994b2f2f2f2f2f2f2f2f2f3,84,12,20,11,23,75,12,94.0,47,47,23,151,9.0,60,11,51,2.2,5,2030,30,105100.0,25,94.0,sous station,9.4,202.5,23.0,60.0,20/12,20/12/2030,5:30,2030-12-20T05:30:00,25.12,267125272015603,2030-12-20T05:30:00+00:00,2030-12-20T05:30:00+01:00,2030-12-20T05:30:00+00:00,2030-12-20T05:30:00+00:00
a91080f2f2f2f2f2f2f2f2f3,84,8,16,8,7,75,12,94.0,47,47,23,151,9.0,60,11,51,2.2,1,2027,30,105100.0,25,94.0,sous station,9.4,202.5,23.0,60.0,16/8,16/8/2027,1:30,2027-08-16T01:30:00,25.12,267125272015603,2027-08-16T01:30:00+00:00,2027-08-16T01:30:00+02:00,2027-08-16T01:30:00+00:00,2027-08-16T01:30:00+00:00
a91092f2f2f2f2f2f2f2f2f3,84,8,16,9,23,75,12,94.0,47,47,23,151,9.0,60,11,51,2.2,5,2028,30,105100.0,25,94.0,sous station,9.4,202.5,23.0,60.0,16/8,16/8/2028,5:30,2028-08-16T05:30:00,25.12,267125272015603,2028-08-16T05:30:00+00:00,2028-08-16T05:30:00+02:00,2028-08-16T05:30:00+00:00,2028-08-16T05:30:00+00:00
a908baf2f2f2f2f2f2f2f2f3,84,8,8,11,87,75,12,94.0,47,47,23,151,9.0,60,11,51,2.2,21,2030,30,105100.0,25,94.0,sous station,9.4,202.5,23.0,60.0,8/8,8/8/2030,21:30,2030-08-08T21:30:00,25.12,267125272015603,2030-08-08T21:30:00+00:00,2030-08-08T21:30:00+02:00,2030-08-08T21:30:00+00:00,2030-08-08T21:30:00+00:00
a90880f2f2f2f2f2f2f2f2f3,84,8,8,8,7,75,12,94.0,47,47,23,151,9.0,60,11,51,2.2,1,2027,30,105100.0,25,94.0,sous station,9.4,202.5,23.0,60.0,8/8,8/8/2027,1:30,2027-08-08T01:30:00,25.12,267125272015603,2027-08-08T01:30:00+00:00,2027-08-08T01:30:00+02:00,2027-08-08T01:30:00+00:00,2027-08-08T01:30:00+00:00
a91c9af2f2f2f2f2f2f2f2f3,84,8,28,9,87,75,12,94.0,47,47,23,151,9.0,60,11,51,2.2,21,2028,30,105100.0,25,94.0,sous station,9.4,202.5,23.0,60.0,28/8,28/8/2028,21:30,2028-08-28T21:30:00,25.12,267125272015603,2028-08-28T21:30:00+00:00,2028-08-28T21:30:00+02:00,2028-08-28T21:30:00+00:00,2028-08-28T21:30:00+00:00
a93084f2f2f2f2f2f2f2f2f3,84,9,16,8,39,75,12,94.0,47,47,23,151,9.0,60,11,51,2.2,9,2027,30,105100.0,25,94.0,sous station,9.4,202.5,23.0,60.0,16/9,16/9/2027,9:30,2027-09-16T09:30:00,25.12,267125272015603,2027-09-16T09:30:00+00:00,2027-09-16T09:30:00+02:00,2027-09-16T09:30:00+00:00,2027-09-16T09:30:00+00:00
a93894f2f2f2f2f2f2f2f2f3,84,9,24,9,39,75,12,94.0,47,47,23,151,9.0,60,11,51,2.2,9,2028,30,105100.0,25,94.0,sous station,9.4,202.5,23.0,60.0,24/9,24/9/2028,9:30,2028-09-24T09:30:00,25.12,267125272015603,2028-09-24T09:30:00+00:00,2028-09-24T09:30:00+02:00,2028-09-24T09:30:00+00:00,2028-09-24T09:30:00+00:00
a92496f2f2f2f2f2f2f2f2f3,84,9,4,9,55,75,12,94.0,47,47,23,151,9.0,60,11,51,2.2,13,2028,30,105100.0,25,94.0,sous station,9.4,202.5,23.0,60.0,4/9,4/9/2028,13:30,2028-09-04T13:30:00,25.12,267125272015603,2028-09-04T13:30:00+00:00,2028-09-04T13:30:00+02:00,2028-09-04T13:30:00+00:00,2028-09-04T13:30:00+00:00
a92498f2f2f2f2f2f2f2f2f3,84,9,4,9,71,75,12,94.0,47,47,23,151,9.0,60,11,51,2.2,17,2028,30,105100.0,25,94.0,sous station,9.4,202.5,23.0,60.0,4/9,4/9/2028,17:30,2028-09-04T17:30:00,25.12,267125272015603,2028-09-04T17:30:00+00:00,2028-09-04T17:30:00+02:00,2028-09-04T17:30:00+00:00,2028-09-04T17:30:00+00:00
a91ca2f2f2f2f2f2f2f2f2f3,84,8,28,10,23,75,12,94.0,47,47,23,151,9.0,60,11,51,2.2,5,2029,30,105100.0,25,94.0,sous station,9.4,202.5,23.0,60.0,28/8,28/8/2029,5:30,2029-08-28T05:30:00,25.12,267125272015603,2029-08-28T05:30:00+00:00,2029-08-28T05:30:00+02:00,2029-08-28T05:30:00+00:00,2029-08-28T05:30:00+00:00
a91ca4f2f2f2f2f2f2f2f2f3,84,8,28,10,39,75,12,94.0,47,47,23,151,9.0,60,11,51,2.2,9,2029,30,105100.0,25,94.0,sous station,9.4,202.5,23.0,60.0,28/8,28/8/2029,9:30,2029-08-28T09:30:00,25.12,267125272015603,2029-08-28T09:30:00+00:00,2029-08-28T09:30:00+02:00,2029-08-28T09:30:00+00:00,2029-08-28T09:30:00+00:00
a91cb8f2f2f2f2f2f2f2f2f3,84,8,28,11,71,75,12,94.0,47,47,23,151,9.0,60,11,51,2.2,17,2030,30,105100.0,25,94.0,sous station,9.4,202.5,23.0,60.0,28/8,28/8/2030,17:30,2030-08-28T17:30:00,25.12,267125272015603,2030-08-28T17:30:00+00:00,2030-08-28T17:30:00+02:00,2030-08-28T17:30:00+00:00,2030-08-28T17:30:00+00:00
a9309af2f2f2f2f2f2f2f2f3,84,9,16,9,87,75,12,94.0,47,47,23,151,9.0,60,11,51,2.2,21,2028,30,105100.0,25,94.0,sous station,9.4,202.5,23.0,60.0,16/9,16/9/2028,21:30,2028-09-16T21:30:00,25.12,267125272015603,2028-09-16T21:30:00+00:00,2028-09-16T21:30:00+02:00,2028-09-16T21:30:00+00:00,2028-09-16T21:30:00+00:00
a9308af2f2f2f2f2f2f2f2f3,84,9,16,8,87,75,12,94.0,47,47,23,151,9.0,60,11,51,2.2,21,2027,30,105100.0,25,94.0,sous station,9.4,202.5,23.0,60.0,16/9,16/9/2027,21:30,2027-09-16T21:30:00,25.12,267125272015603,2027-09-16T21:30:00+00:00,2027-09-16T21:30:00+02:00,2027-09-16T21:30:00+00:00,2027-09-16T21:30:00+00:00
a948a8f2f2f2f2f2f2f2f2f3,84,10,8,10,71,75,12,94.0,47,47,23,151,9.0,60,11,51,2.2,17,2029,30,105100.0,25,94.0,sous station,9.4,202.5,23.0,60.0,8/10,8/10/2029,17:30,2029-10-08T17:30:00,25.12,267125272015603,2029-10-08T17:30:00+00:00,2029-10-08T17:30:00+02:00,2029-10-08T17:30:00+00:00,2029-10-08T17:30:00+00:00
a99896f2f2f2f2f2f2f2f2f3,84,12,24,9,55,75,12,94.0,47,47,23,151,9.0,60,11,51,2.2,13,2028,30,105100.0,25,94.0,sous station,9.4,202.5,23.0,60.0,24/12,24/12/2028,13:30,2028-12-24T13:30:00,25.12,267125272015603,2028-12-24T13:30:00+00:00,2028-12-24T13:30:00+01:00,2028-12-24T13:30:00+00:00,2028-12-24T13:30:00+00:00
a9689af2f2f2f2f2f2f2f2f3,84,11,8,9,87,75,12,94.0,47,47,23,151,9.0,60,11,51,2.2,21,2028,30,105100.0,25,94.0,sous station,9.4,202.5,23.0,60.0,8/11,8/11/2028,21:30,2028-11-08T21:30:00,25.12,267125272015603,2028-11-08T21:30:00+00:00,2028-11-08T21:30:00+01:00,2028-11-08T21:30:00+00:00,2028-11-08T21:30:00+00:00
a970a8f2f2f2f2f2f2f2f2f3,84,11,16,10,71,75,12,94.0,47,47,23,151,9.0,60,11,51,2.2,17,2029,30,105100.0,25,94.0,sous station,9.4,202.5,23.0,60.0,16/11,16/11/2029,17:30,2029-11-16T17:30:00,25.12,267125272015603,2029-11-16T17:30:00+00:00,2029-11-16T17:30:00+01:00,2029-11-16T17:30:00+00:00,2029-11-16T17:30:00+00:00
aa2492f2f2f2f2f2f2f2f2f3,85,1,4,9,23,75,12,94.0,47,47,23,151,9.0,60,11,51,2.2,5,2028,30,105100.0,25,94.0,sous station,9.4,202.5,23.0,60.0,4/1,4/1/2028,5:30,2028-01-04T05:30:00,25.12,267125272015603,2028-01-04T05:30:00+00:00,2028-01-04T05:30:00+01:00,2028-01-04T05:30:00+00:00,2028-01-04T05:30:00+00:00
a95c80f2f2f2f2f2f2f2f2f3,84,10,28,8,7,75,12,94.0,47,47,23,151,9.0,60,11,51,2.2,1,2027,30,105100.0,25,94.0,sous station,9.4,202.5,23.0,60.0,28/10,28/10/2027,1:30,2027-10-28T01:30:00,25.12,267125272015603,2027-10-28T01:30:00+00:00,2027-10-28T01:30:00+02:00,2027-10-28T01:30:00+00:00,2027-10-28T01:30:00+00:00
a97098f2f2f2f2f2f2f2f2f3,84,11,16,9,71,75,12,94.0,47,47,23,151,9.0,60,11,51,2.2,17,2028,30,105100.0,25,94.0,sous station,9.4,202.5,23.0,60.0,16/11,16/11/2028,17:30,2028-11-16T17:30:00,25.12,267125272015603,2028-11-16T17:30:00+00:00,2028-11-16T17:30:00+01:00,2028-11-16T17:30:00+00:00,2028-11-16T17:30:00+00:00
a954a2f2f2f2f2f2f2f2f2f3,84,10,20,10,23,75,12,94.0,47,47,23,151,9.0,60,11,51,2.2,5,2029,30,105100.0,25,94.0,sous station,9.4,202.5,23.0,60.0,20/10,20/10/2029,5:30,2029-10-20T05:30:00,25.12,267125272015603,2029-10-20T05:30:00+00:00,2029-10-20T05:30:00+02:00,2029-10-20T05:30:00+00:00,2029-10-20T05:30:00+00:00
a990b2f2f2f2f2f2f2f2f2f3,84,12,16,11,23,75,12,94.0,47,47,23,151,9.0,60,11,51,2.2,5,2030,30,105100.0,25,94.0,sous station,9.4,202.5,23.0,60.0,16/12,16/12/2030,5:30,2030-12-16T05:30:00,25.12,267125272015603,2030-12-16T05:30:00+00:00,2030-12-16T05:30:00+01:00,2030-12-16T05:30:00+00:00,2030-12-16T05:30:00+00:00
a950b6f2f2f2f2f2f2f2f2f3,84,10,16,11,55,75,12,94.0,47,47,23,151,9.0,60,11,51,2.2,13,2030,30,105100.0,25,94.0,sous station,9.4,202.5,23.0,60.0,16/10,16/10/2030,13:30,2030-10-16T13:30:00,25.12,267125272015603,2030-10-16T13:30:00+00:00,2030-10-16T13:30:00+02:00,2030-10-16T13:30:00+00:00,2030-10-16T13:30:00+00:00
ae6474f2f2f2f2f2f2f2f2f3,87,3,4,7,39,75,12,94.0,47,47,23,151,9.0,60,11,51,2.2,9,2026,30,105100.0,25,94.0,sous station,9.4,202.5,23.0,60.0,4/3,4/3/2026,9:30,2026-03-04T09:30:00,25.12,267125272015603,2026-03-04T09:30:00+00:00,2026-03-04T09:30:00+01:00,2026-03-04T09:30:00+00:00,2026-03-04T09:30:00+00:00
a94c98f2f2f2f2f2f2f2f2f3,84,10,12,9,71,75,12,94.0,47,47,23,151,9.0,60,11,51,2.2,17,2028,30,105100.0,25,94.0,sous station,9.4,202.5,23.0,60.0,12/10,12/10/2028,17:30,2028-10-12T17:30:00,25.12,267125272015603,2028-10-12T17:30:00+00:00,2028-10-12T17:30:00+02:00,2028-10-12T17:30:00+00:00,2028-10-12T17:30:00+00:00
aa28b4f2f2f2f2f2f2f2f2f3,85,1,8,11,39,75,12,94.0,47,47,23,151,9.0,60,11,51,2.2,9,2030,30,105100.0,25,94.0,sous station,9.4,202.5,23.0,60.0,8/1,8/1/2030,9:30,2030-01-08T09:30:00,25.12,267125272015603,2030-01-08T09:30:00+00:00,2030-01-08T09:30:00+01:00,2030-01-08T09:30:00+00:00,2030-01-08T09:30:00+00:00
aa2ca6f2f2f2f2f2f2f2f2f3,85,1,12,10,55,75,12,94.0,47,47,23,151,9.0,60,11,51,2.2,13,2029,30,105100.0,25,94.0,sous station,9.4,202.5,23.0,60.0,12/1,12/1/2029,13:30,2029-01-12T13:30:00,25.12,267125272015603,2029-01-12T13:30:00+00:00,2029-01-12T13:30:00+01:00,2029-01-12T13:30:00+00:00,2029-01-12T13:30:00+00:00
aa48a6f2f2f2f2f2f2f2f2f3,85,2,8,10,55,75,12,94.0,47,47,23,151,9.0,60,11,51,2.2,13,2029,30,105100.0,25,94.0,sous station,9.4,202.5,23.0,60.0,8/2,8/2/2029,13:30,2029-02-08T13:30:00,25.12,267125272015603,2029-02-08T13:30:00+00:00,2029-02-08T13:30:00+01:00,2029-02-08T13:30:00+00:00,2029-02-08T13:30:00+00:00
aa48b6f2f2f2f2f2f2f2f2f3,85,2,8,11,55,75,12,94.0,47,47,23,151,9.0,60,11,51,2.2,13,2030,30,105100.0,25,94.0,sous station,9.4,202.5,23.0,60.0,8/2,8/2/2030,13:30,2030-02-08T13:30:00,25.12,267125272015603,2030-02-08T13:30:00+00:00,2030-02-08T13:30:00+01:00,2030-02-08T13:30:00+00:00,2030-02-08T13:30:00+00:00
aa48b8f2f2f2f2f2f2f2f2f3,85,2,8,11,71,75,12,94.0,47,47,23,151,9.0,60,11,51,2.2,17,2030,30,105100.0,25,94.0,sous station,9.4,202.5,23.0,60.0,8/2,8/2/2030,17:30,2030-02-08T17:30:00,25.12,267125272015603,2030-02-08T17:30:00+00:00,2030-02-08T17:30:00+01:00,2030-02-08T17:30:00+00:00,2030-02-08T17:30:00+00:00
aa3ca8f2f2f2f2f2f2f2f2f3,85,1,28,10,71,75,12,94.0,47,47,23,151,9.0,60,11,51,2.2,17,2029,30,105100.0,25,94.0,sous station,9.4,202.5,23.0,60.0,28/1,28/1/2029,17:30,2029-01-28T17:30:00,25.12,267125272015603,2029-01-28T17:30:00+00:00,2029-01-28T17:30:00+01:00,2029-01-28T17:30:00+00:00,2029-01-28T17:30:00+00:00
aa3094f2f2f2f2f2f2f2f2f3,85,1,16,9,39,75,12,94.0,47,47,23,151,9.0,60,11,51,2.2,9,2028,30,105100.0,25,94.0,sous station,9.4,202.5,23.0,60.0,16/1,16/1/2028,9:30,2028-01-16T09:30:00,25.12,267125272015603,2028-01-16T09:30:00+00:00,2028-01-16T09:30:00+01:00,2028-01-16T09:30:00+00:00,2028-01-16T09:30:00+00:00
ae6c76f2f2f2f2f2f2f2f2f3,87,3,12,7,55,75,12,94.0,47,47,23,151,9.0,60,11,51,2.2,13,2026,30,105100.0,25,94.0,sous station,9.4,202.5,23.0,60.0,12/3,12/3/2026,13:30,2026-03-12T13:30:00,25.12,267125272015603,2026-03-12T13:30:00+00:00,2026-03-12T13:30:00+01:00,2026-03-12T13:30:00+00:00,2026-03-12T13:30:00+00:00
ae6878f2f2f2f2f2f2f2f2f3,87,3,8,7,71,75,12,94.0,47,47,23,151,9.0,60,11,51,2.2,17,2026,30,105100.0,25,94.0,sous station,9.4,202.5,23.0,60.0,8/3,8/3/2026,17:30,2026-03-08T17:30:00,25.12,267125272015603,2026-03-08T17:30:00+00:00,2026-03-08T17:30:00+01:00,2026-03-08T17:30:00+00:00,2026-03-08T17:30:00+00:00
aa34b2f2f2f2f2f2f2f2f2f3,85,1,20,11,23,75,12,94.0,47,47,23,151,9.0,60,11,51,2.2,5,2030,30,105100.0,25,94.0,sous station,9.4,202.5,23.0,60.0,20/1,20/1/2030,5:30,2030-01-20T05:30:00,25.12,267125272015603,2030-01-20T05:30:00+00:00,2030-01-20T05:30:00+01:00,2030-01-20T05:30:00+00:00,2030-01-20T05:30:00+00:00
aa34b4f2f2f2f2f2f2f2f2f3,85,1,20,11,39,75,12,94.0,47,47,23,151,9.0,60,11,51,2.2,9,2030,30,105100.0,25,94.0,sous station,9.4,202.5,23.0,60.0,20/1,20/1/2030,9:30,2030-01-20T09:30:00,25.12,267125272015603,2030-01-20T09:30:00+00:00,2030-01-20T09:30:00+01:00,2030-01-20T09:30:00+00:00,2030-01-20T09:30:00+00:00
a9889af2f2f2f2f2f2f2f2f3,84,12,8,9,87,75,12,94.0,47,47,23,151,9.0,60,11,51,2.2,21,2028,30,105100.0,25,94.0,sous station,9.4,202.5,23.0,60.0,8/12,8/12/2028,21:30,2028-12-08T21:30:00,25.12,267125272015603,2028-12-08T21:30:00+00:00,2028-12-08T21:30:00+01:00,2028-12-08T21:30:00+00:00,2028-12-08T21:30:00+00:00
aa38b0f2f2f2f2f2f2f2f2f3,85,1,24,11,7,75,12,94.0,47,47,23,151,9.0,60,11,51,2.2,1,2030,30,105100.0,25,94.0,sous station,9.4,202.5,23.0,60.0,24/1,24/1/2030,1:30,2030-01-24T01:30:00,25.12,267125272015603,2030-01-24T01:30:00+00:00,2030-01-24T01:30:00+01:00,2030-01-24T01:30:00+00:00,2030-01-24T01:30:00+00:00
a884b4f2f2f2f2f2f2f2f2f3,84,4,4,11,39,75,12,94.0,47,47,23,151,9.0,60,11,51,2.2,9,2030,30,105100.0,25,94.0,sous station,9.4,202.5,23.0,60.0,4/4,4/4/2030,9:30,2030-04-04T09:30:00,25.12,267125272015603,2030-04-04T09:30:00+00:00,2030-04-04T09:30:00+02:00,2030-04-04T09:30:00+00:00,2030-04-04T09:30:00+00:00
ae347af2f2f2f2f2f2f2f2f3,87,1,20,7,87,75,12,94.0,47,47,23,151,9.0,60,11,51,2.2,21,2026,30,105100.0,25,94.0,sous station,9.4,202.5,23.0,60.0,20/1,20/1/2026,21:30,2026-01-20T21:30:00,25.12,267125272015603,2026-01-20T21:30:00+00:00,2026-01-20T21:30:00+01:00,2026-01-20T21:30:00+00:00,2026-01-20T21:30:00+00:00
a8d8a8f2f2f2f2f2f2f2f2f3,84,6,24,10,71,75,12,94.0,47,47,23,151,9.0,60,11,51,2.2,17,2029,30,105100.0,25,94.0,sous station,9.4,202.5,23.0,60.0,24/6,24/6/2029,17:30,2029-06-24T17:30:00,25.12,267125272015603,2029-06-24T17:30:00+00:00,2029-06-24T17:30:00+02:00,2029-06-24T17:30:00+00:00,2029-06-24T17:30:00+00:00
a8fcbaf2f2f2f2f2f2f2f2f3,84,7,28,11,87,75,12,94.0,47,47,23,151,9.0,60,11,51,2.2,21,2030,30,105100.0,25,94.0,sous station,9.4,202.5,23.0,60.0,28/7,28/7/2030,21:30,2030-07-28T21:30:00,25.12,267125272015603,2030-07-28T21:30:00+00:00,2030-07-28T21:30:00+02:00,2030-07-28T21:30:00+00:00,2030-07-28T21:30:00+00:00
aac480f2f2f2f2f2f2f2f2f3,85,6,4,8,7,75,12,94.0,47,47,23,151,9.0,60,11,51,2.2,1,2027,30,105100.0,25,94.0,sous station,9.4,202.5,23.0,60.0,4/6,4/6/2027,1:30,2027-06-04T01:30:00,25.12,267125272015603,2027-06-04T01:30:00+00:00,2027-06-04T01:30:00+02:00,2027-06-04T01:30:00+00:00,2027-06-04T01:30:00+00:00
a8f4a2f2f2f2f2f2f2f2f2f3,84,7,20,10,23,75,12,94.0,47,47,23,151,9.0,60,11,51,2.2,5,2029,30,105100.0,25,94.0,sous station,9.4,202.5,23.0,60.0,20/7,20/7/2029,5:30,2029-07-20T05:30:00,25.12,267125272015603,2029-07-20T05:30:00+00:00,2029-07-20T05:30:00+02:00,2029-07-20T05:30:00+00:00,2029-07-20T05:30:00+00:00
aabca0f2f2f2f2f2f2f2f2f3,85,5,28,10,7,75,12,94.0,47,47,23,151,9.0,60,11,51,2.2,1,2029,30,105100.0,25,94.0,sous station,9.4,202.5,23.0,60.0,28/5,28/5/2029,1:30,2029-05-28T01:30:00,25.12,267125272015603,2029-05-28T01:30:00+00:00,2029-05-28T01:30:00+02:00,2029-05-28T01:30:00+00:00,2029-05-28T01:30:00+00:00
a910b2f2f2f2f2f2f2f2f2f3,84,8,16,11,23,75,12,94.0,47,47,23,151,9.0,60,11,51,2.2,5,2030,30,105100.0,25,94.0,sous station,9.4,202.5,23.0,60.0,16/8,16/8/2030,5:30,2030-08-16T05:30:00,25.12,267125272015603,2030-08-16T05:30:00+00:00,2030-08-16T05:30:00+02:00,2030-08-16T05:30:00+00:00,2030-08-16T05:30:00+00:00
aa34aaf2f2f2f2f2f2f2f2f3,85,1,20,10,87,75,12,94.0,47,47,23,151,9.0,60,11,51,2.2,21,2029,30,105100.0,25,94.0,sous station,9.4,202.5,23.0,60.0,20/1,20/1/2029,21:30,2029-01-20T21:30:00,25.12,267125272015603,2029-01-20T21:30:00+00:00,2029-01-20T21:30:00+01:00,2029-01-20T21:30:00+00:00,2029-01-20T21:30:00+00:00
aad8a0f2f2f2f2f2f2f2f2f3,85,6,24,10,7,75,12,94.0,47,47,23,151,9.0,60,11,51,2.2,1,2029,30,105100.0,25,94.0,sous station,9.4,202.5,23.0,60.0,24/6,24/6/2029,1:30,2029-06-24T01:30:00,25.12,267125272015603,2029-06-24T01:30:00+00:00,2029-06-24T01:30:00+02:00,2029-06-24T01:30:00+00:00,2029-06-24T01:30:00+00:00
aa24a0f2f2f2f2f2f2f2f2f3,85,1,4,10,7,75,12,94.0,47,47,23,151,9.0,60,11,51,2.2,1,2029,30,105100.0,25,94.0,sous station,9.4,202.5,23.0,60.0,4/1,4/1/2029,1:30,2029-01-04T01:30:00,25.12,267125272015603,2029-01-04T01:30:00+00:00,2029-01-04T01:30:00+01:00,2029-01-04T01:30:00+00:00,2029-01-04T01:30:00+00:00
aa2896f2f2f2f2f2f2f2f2f3,85,1,8,9,55,75,12,94.0,47,47,23,151,9.0,60,11,51,2.2,13,2028,30,105100.0,25,94.0,sous station,9.4,202.5,23.0,60.0,8/1,8/1/2028,13:30,2028-01-08T13:30:00,25.12,267125272015603,2028-01-08T13:30:00+00:00,2028-01-08T13:30:00+01:00,2028-01-08T13:30:00+00:00,2028-01-08T13:30:00+00:00
aa6ca0f2f2f2f2f2f2f2f2f3,85,3,12,10,7,75,12,94.0,47,47,23,151,9.0,60,11,51,2.2,1,2029,30,105100.0,25,94.0,sous station,9.4,202.5,23.0,60.0,12/3,12/3/2029,1:30,2029-03-12T01:30:00,25.12,267125272015603,2029-03-12T01:30:00+00:00,2029-03-12T01:30:00+01:00,2029-03-12T01:30:00+00:00,2029-03-12T01:30:00+00:00
aac4a8f2f2f2f2f2f2f2f2f3,85,6,4,10,71,75,12,94.0,47,47,23,151,9.0,60,11,51,2.2,17,2029,30,105100.0,25,94.0,sous station,9.4,202.5,23.0,60.0,4/6,4/6/2029,17:30,2029-06-04T17:30:00,25.12,267125272015603,2029-06-04T17:30:00+00:00,2029-06-04T17:30:00+02:00,2029-06-04T17:30:00+00:00,2029-06-04T17:30:00+00:00
aa38b8f2f2f2f2f2f2f2f2f3,85,1,24,11,71,75,12,94.0,47,47,23,151,9.0,60,11,51,2.2,17,2030,30,105100.0,25,94.0,sous station,9.4,202.5,23.0,60.0,24/1,24/1/2030,17:30,2030-01-24T17:30:00,25.12,267125272015603,2030-01-24T17:30:00+00:00,2030-01-24T17:30:00+01:00,2030-01-24T17:30:00+00:00,2030-01-24T17:30:00+00:00
aa3cb4f2f2f2f2f2f2f2f2f3,85,1,28,11,39,75,12,94.0,47,47,23,151,9.0,60,11,51,2.2,9,2030,30,105100.0,25,94.0,sous station,9.4,202.5,23.0,60.0,28/1,28/1/2030,9:30,2030-01-28T09:30:00,25.12,267125272015603,2030-01-28T09:30:00+00:00,2030-01-28T09:30:00+01:00,2030-01-28T09:30:00+00:00,2030-01-28T09:30:00+00:00
aabc84f2f2f2f2f2f2f2f2f3,85,5,28,8,39,75,12,94.0,47,47,23,151,9.0,60,11,51,2.2,9,2027,30,105100.0,25,94.0,sous station,9.4,202.5,23.0,60.0,28/5,28/5/2027,9:30,2027-05-28T09:30:00,25.12,267125272015603,2027-05-28T09:30:00+00:00,2027-05-28T09:30:00+02:00,2027-05-28T09:30:00+00:00,2027-05-28T09:30:00+00:00
a88ca0f2f2f2f2f2f2f2f2f3,84,4,12,10,7,75,12,94.0,47,47,23,151,9.0,60,11,51,2.2,1,2029,30,105100.0,25,94.0,sous station,9.4,202.5,23.0,60.0,12/4,12/4/2029,1:30,2029-04-12T01:30:00,25.12,267125272015603,2029-04-12T01:30:00+00:00,2029-04-12T01:30:00+02:00,2029-04-12T01:30:00+00:00,2029-04-12T01:30:00+00:00
aa68a4f2f2f2f2f2f2f2f2f3,85,3,8,10,39,75,12,94.0,47,47,23,151,9.0,60,11,51,2.2,9,2029,30,105100.0,25,94.0,sous station,9.4,202.5,23.0,60.0,8/3,8/3/2029,9:30,2029-03-08T09:30:00,25.12,267125272015603,2029-03-08T09:30:00+00:00,2029-03-08T09:30:00+01:00,2029-03-08T09:30:00+00:00,2029-03-08T09:30:00+00:00
ae5c78f2f2f2f2f2f2f2f2f3,87,2,28,7,71,75,12,94.0,47,47,23,151,9.0,60,11,51,2.2,17,2026,30,105100.0,25,94.0,sous station,9.4,202.5,23.0,60.0,28/2,28/2/2026,17:30,2026-02-28T17:30:00,25.12,267125272015603,2026-02-28T17:30:00+00:00,2026-02-28T17:30:00+01:00,2026-02-28T17:30:00+00:00,2026-02-28T17:30:00+00:00
aabcb4f2f2f2f2f2f2f2f2f3,85,5,28,11,39,75,12,94.0,47,47,23,151,9.0,60,11,51,2.2,9,2030,30,105100.0,25,94.0,sous station,9.4,202.5,23.0,60.0,28/5,28/5/2030,9:30,2030-05-28T09:30:00,25.12,267125272015603,2030-05-28T09:30:00+00:00,2030-05-28T09:30:00+02:00,2030-05-28T09:30:00+00:00,2030-05-28T09:30:00+00:00
aac8b0f2f2f2f2f2f2f2f2f3,85,6,8,11,7,75,12,94.0,47,47,23,151,9.0,60,11,51,2.2,1,2030,30,105100.0,25,94.0,sous station,9.4,202.5,23.0,60.0,8/6,8/6/2030,1:30,2030-06-08T01:30:00,25.12,267125272015603,2030-06-08T01:30:00+00:00,2030-06-08T01:30:00+02:00,2030-06-08T01:30:00+00:00,2030-06-08T01:30:00+00:00
aad0a2f2f2f2f2f2f2f2f2f3,85,6,16,10,23,75,12,94.0,47,47,23,151,9.0,60,11,51,2.2,5,2029,30,105100.0,25,94.0,sous station,9.4,202.5,23.0,60.0,16/6,16/6/2029,5:30,2029-06-16T05:30:00,25.12,267125272015603,2029-06-16T05:30:00+00:00,2029-06-16T05:30:00+02:00,2029-06-16T05:30:00+00:00,2029-06-16T05:30:00+00:00
ae547af2f2f2f2f2f2f2f2f3,87,2,20,7,87,75,12,94.0,47,47,23,151,9.0,60,11,51,2.2,21,2026,30,105100.0,25,94.0,sous station,9.4,202.5,23.0,60.0,20/2,20/2/2026,21:30,2026-02-20T21:30:00,25.12,267125272015603,2026-02-20T21:30:00+00:00,2026-02-20T21:30:00+01:00,2026-02-20T21:30:00+00:00,2026-02-20T21:30:00+00:00
a8c898f2f2f2f2f2f2f2f2f3,84,6,8,9,71,75,12,94.0,47,47,23,151,9.0,60,11,51,2.2,17,2028,30,105100.0,25,94.0,sous station,9.4,202.5,23.0,60.0,8/6,8/6/2028,17:30,2028-06-08T17:30:00,25.12,267125272015603,2028-06-08T17:30:00+00:00,2028-06-08T17:30:00+02:00,2028-06-08T17:30:00+00:00,2028-06-08T17:30:00+00:00
a8c8a2f2f2f2f2f2f2f2f2f3,84,6,8,10,23,75,12,94.0,47,47,23,151,9.0,60,11,51,2.2,5,2029,30,105100.0,25,94.0,sous station,9.4,202.5,23.0,60.0,8/6,8/6/2029,5:30,2029-06-08T05:30:00,25.12,267125272015603,2029-06-08T05:30:00+00:00,2029-06-08T05:30:00+02:00,2029-06-08T05:30:00+00:00,2029-06-08T05:30:00+00:00
a8f092f2f2f2f2f2f2f2f2f3,84,7,16,9,23,75,12,94.0,47,47,23,151,9.0,60,11,51,2.2,5,2028,30,105100.0,25,94.0,sous station,9.4,202.5,23.0,60.0,16/7,16/7/2028,5:30,2028-07-16T05:30:00,25.12,267125272015603,2028-07-16T05:30:00+00:00,2028-07-16T05:30:00+02:00,2028-07-16T05:30:00+00:00,2028-07-16T05:30:00+00:00
a8eca6f2f2f2f2f2f2f2f2f3,84,7,12,10,55,75,12,94.0,47,47,23,151,9.0,60,11,51,2.2,13,2029,30,105100.0,25,94.0,sous station,9.4,202.5,23.0,60.0,12/7,12/7/2029,13:30,2029-07-12T13:30:00,25.12,267125272015603,2029-07-12T13:30:00+00:00,2029-07-12T13:30:00+02:00,2029-07-12T13:30:00+00:00,2029-07-12T13:30:00+00:00
aab0b2f2f2f2f2f2f2f2f2f3,85,5,16,11,23,75,12,94.0,47,47,23,151,9.0,60,11,51,2.2,5,2030,30,105100.0,25,94.0,sous station,9.4,202.5,23.0,60.0,16/5,16/5/2030,5:30,2030-05-16T05:30:00,25.12,267125272015603,2030-05-16T05:30:00+00:00,2030-05-16T05:30:00+02:00,2030-05-16T05:30:00+00:00,2030-05-16T05:30:00+00:00
a8d0aaf2f2f2f2f2f2f2f2f3,84,6,16,10,87,75,12,94.0,47,47,23,151,9.0,60,11,51,2.2,21,2029,30,105100.0,25,94.0,sous station,9.4,202.5,23.0,60.0,16/6,16/6/2029,21:30,2029-06-16T21:30:00,25.12,267125272015603,2029-06-16T21:30:00+00:00,2029-06-16T21:30:00+02:00,2029-06-16T21:30:00+00:00,2029-06-16T21:30:00+00:00
a8e4b8f2f2f2f2f2f2f2f2f3,84,7,4,11,71,75,12,94.0,47,47,23,151,9.0,60,11,51,2.2,17,2030,30,105100.0,25,94.0,sous station,9.4,202.5,23.0,60.0,4/7,4/7/2030,17:30,2030-07-04T17:30:00,25.12,267125272015603,2030-07-04T17:30:00+00:00,2030-07-04T17:30:00+02:00,2030-07-04T17:30:00+00:00,2030-07-04T17:30:00+00:00
aafc82f2f2f2f2f2f2f2f2f3,85,7,28,8,23,75,12,94.0,47,47,23,151,9.0,60,11,51,2.2,5,2027,30,105100.0,25,94.0,sous station,9.4,202.5,23.0,60.0,28/7,28/7/2027,5:30,2027-07-28T05:30:00,25.12,267125272015603,2027-07-28T05:30:00+00:00,2027-07-28T05:30:00+02:00,2027-07-28T05:30:00+00:00,2027-07-28T05:30:00+00:00
a990aaf2f2f2f2f2f2f2f2f3,84,12,16,10,87,75,12,94.0,47,47,23,151,9.0,60,11,51,2.2,21,2029,30,105100.0,25,94.0,sous station,9.4,202.5,23.0,60.0,16/12,16/12/2029,21:30,2029-12-16T21:30:00,25.12,267125272015603,2029-12-16T21:30:00+00:00,2029-12-16T21:30:00+01:00,2029-12-16T21:30:00+00:00,2029-12-16T21:30:00+00:00
ab04b4f2f2f2f2f2f2f2f2f3,85,8,4,11,39,75,12,94.0,47,47,23,151,9.0,60,11,51,2.2,9,2030,30,105100.0,25,94.0,sous station,9.4,202.5,23.0,60.0,4/8,4/8/2030,9:30,2030-08-04T09:30:00,25.12,267125272015603,2030-08-04T09:30:00+00:00,2030-08-04T09:30:00+02:00,2030-08-04T09:30:00+00:00,2030-08-04T09:30:00+00:00
ae6472f2f2f2f2f2f2f2f2f3,87,3,4,7,23,75,12,94.0,47,47,23,151,9.0,60,11,51,2.2,5,2026,30,105100.0,25,94.0,sous station,9.4,202.5,23.0,60.0,4/3,4/3/2026,5:30,2026-03-04T05:30:00,25.12,267125272015603,2026-03-04T05:30:00+00:00,2026-03-04T05:30:00+01:00,2026-03-04T05:30:00+00:00,2026-03-04T05:30:00+00:00
a8dcb2f2f2f2f2f2f2f2f2f3,84,6,28,11,23,75,12,94.0,47,47,23,151,9.0,60,11,51,2.2,5,2030,30,105100.0,25,94.0,sous station,9.4,202.5,23.0,60.0,28/6,28/6/2030,5:30,2030-06-28T05:30:00,25.12,267125272015603,2030-06-28T05:30:00+00:00,2030-06-28T05:30:00+02:00,2030-06-28T05:30:00+00:00,2030-06-28T05:30:00+00:00
a8e4b2f2f2f2f2f2f2f2f2f3,84,7,4,11,23,75,12,94.0,47,47,23,151,9.0,60,11,51,2.2,5,2030,30,105100.0,25,94.0,sous station,9.4,202.5,23.0,60.0,4/7,4/7/2030,5:30,2030-07-04T05:30:00,25.12,267125272015603,2030-07-04T05:30:00+00:00,2030-07-04T05:30:00+02:00,2030-07-04T05:30:00+00:00,2030-07-04T05:30:00+00:00
a8ecb6f2f2f2f2f2f2f2f2f3,84,7,12,11,55,75,12,94.0,47,47,23,151,9.0,60,11,51,2.2,13,2030,30,105100.0,25,94.0,sous station,9.4,202.5,23.0,60.0,12/7,12/7/2030,13:30,2030-07-12T13:30:00,25.12,267125272015603,2030-07-12T13:30:00+00:00,2030-07-12T13:30:00+02:00,2030-07-12T13:30:00+00:00,2030-07-12T13:30:00+00:00
a950b4f2f2f2f2f2f2f2f2f3,84,10,16,11,39,75,12,94.0,47,47,23,151,9.0,60,11,51,2.2,9,2030,30,105100.0,25,94.0,sous station,9.4,202.5,23.0,60.0,16/10,16/10/2030,9:30,2030-10-16T09:30:00,25.12,267125272015603,2030-10-16T09:30:00+00:00,2030-10-16T09:30:00+02:00,2030-10-16T09:30:00+00:00,2030-10-16T09:30:00+00:00
a898aaf2f2f2f2f2f2f2f2f3,84,4,24,10,87,75,12,94.0,47,47,23,151,9.0,60,11,51,2.2,21,2029,30,105100.0,25,94.0,sous station,9.4,202.5,23.0,60.0,24/4,24/4/2029,21:30,2029-04-24T21:30:00,25.12,267125272015603,2029-04-24T21:30:00+00:00,2029-04-24T21:30:00+02:00,2029-04-24T21:30:00+00:00,2029-04-24T21:30:00+00:00
a898b6f2f2f2f2f2f2f2f2f3,84,4,24,11,55,75,12,94.0,47,47,23,151,9.0,60,11,51,2.2,13,2030,30,105100.0,25,94.0,sous station,9.4,202.5,23.0,60.0,24/4,24/4/2030,13:30,2030-04-24T13:30:00,25.12,267125272015603,2030-04-24T13:30:00+00:00,2030-04-24T13:30:00+02:00,2030-04-24T13:30:00+00:00,2030-04-24T13:30:00+00:00
a88caaf2f2f2f2f2f2f2f2f3,84,4,12,10,87,75,12,94.0,47,47,23,151,9.0,60,11,51,2.2,21,2029,30,105100.0,25,94.0,sous station,9.4,202.5,23.0,60.0,12/4,12/4/2029,21:30,2029-04-12T21:30:00,25.12,267125272015603,2029-04-12T21:30:00+00:00,2029-04-12T21:30:00+02:00,2029-04-12T21:30:00+00:00,2029-04-12T21:30:00+00:00
a888a2f2f2f2f2f2f2f2f2f3,84,4,8,10,23,75,12,94.0,47,47,23,151,9.0,60,11,51,2.2,5,2029,30,105100.0,25,94.0,sous station,9.4,202.5,23.0,60.0,8/4,8/4/2029,5:30,2029-04-08T05:30:00,25.12,267125272015603,2029-04-08T05:30:00+00:00,2029-04-08T05:30:00+02:00,2029-04-08T05:30:00+00:00,2029-04-08T05:30:00+00:00
a8a4a8f2f2f2f2f2f2f2f2f3,84,5,4,10,71,75,12,94.0,47,47,23,151,9.0,60,11,51,2.2,17,2029,30,105100.0,25,94.0,sous station,9.4,202.5,23.0,60.0,4/5,4/5/2029,17:30,2029-05-04T17:30:00,25.12,267125272015603,2029-05-04T17:30:00+00:00,2029-05-04T17:30:00+02:00,2029-05-04T17:30:00+00:00,2029-05-04T17:30:00+00:00
a99480f2f2f2f2f2f2f2f2f3,84,12,20,8,7,75,12,94.0,47,47,23,151,9.0,60,11,51,2.2,1,2027,30,105100.0,25,94.0,sous station,9.4,202.5,23.0,60.0,20/12,20/12/2027,1:30,2027-12-20T01:30:00,25.12,267125272015603,2027-12-20T01:30:00+00:00,2027-12-20T01:30:00+01:00,2027-12-20T01:30:00+00:00,2027-12-20T01:30:00+00:00
a8ac88f2f2f2f2f2f2f2f2f3,84,5,12,8,71,75,12,94.0,47,47,23,151,9.0,60,11,51,2.2,17,2027,30,105100.0,25,94.0,sous station,9.4,202.5,23.0,60.0,12/5,12/5/2027,17:30,2027-05-12T17:30:00,25.12,267125272015603,2027-05-12T17:30:00+00:00,2027-05-12T17:30:00+02:00,2027-05-12T17:30:00+00:00,2027-05-12T17:30:00+00:00
a8a8a2f2f2f2f2f2f2f2f2f3,84,5,8,10,23,75,12,94.0,47,47,23,151,9.0,60,11,51,2.2,5,2029,30,105100.0,25,94.0,sous station,9.4,202.5,23.0,60.0,8/5,8/5/2029,5:30,2029-05-08T05:30:00,25.12,267125272015603,2029-05-08T05:30:00+00:00,2029-05-08T05:30:00+02:00,2029-05-08T05:30:00+00:00,2029-05-08T05:30:00+00:00
a988a6f2f2f2f2f2f2f2f2f3,84,12,8,10,55,75,12,94.0,47,47,23,151,9.0,60,11,51,2.2,13,2029,30,105100.0,25,94.0,sous station,9.4,202.5,23.0,60.0,8/12,8/12/2029,13:30,2029-12-08T13:30:00,25.12,267125272015603,2029-12-08T13:30:00+00:00,2029-12-08T13:30:00+01:00,2029-12-08T13:30:00+00:00,2029-12-08T13:30:00+00:00
a994aaf2f2f2f2f2f2f2f2f3,84,12,20,10,87,75,12,94.0,47,47,23,151,9.0,60,11,51,2.2,21,2029,30,105100.0,25,94.0,sous station,9.4,202.5,23.0,60.0,20/12,20/12/2029,21:30,2029-12-20T21:30:00,25.12,267125272015603,2029-12-20T21:30:00+00:00,2029-12-20T21:30:00+01:00,2029-12-20T21:30:00+00:00,2029-12-20T21:30:00+00:00
a8acb2f2f2f2f2f2f2f2f2f3,84,5,12,11,23,75,12,94.0,47,47,23,151,9.0,60,11,51,2.2,5,2030,30,105100.0,25,94.0,sous station,9.4,202.5,23.0,60.0,12/5,12/5/2030,5:30,2030-05-12T05:30:00,25.12,267125272015603,2030-05-12T05:30:00+00:00,2030-05-12T05:30:00+02:00,2030-05-12T05:30:00+00:00,2030-05-12T05:30:00+00:00
a8b49af2f2f2f2f2f2f2f2f3,84,5,20,9,87,75,12,94.0,47,47,23,151,9.0,60,11,51,2.2,21,2028,30,105100.0,25,94.0,sous station,9.4,202.5,23.0,60.0,20/5,20/5/2028,21:30,2028-05-20T21:30:00,25.12,267125272015603,2028-05-20T21:30:00+00:00,2028-05-20T21:30:00+02:00,2028-05-20T21:30:00+00:00,2028-05-20T21:30:00+00:00
a8bc96f2f2f2f2f2f2f2f2f3,84,5,28,9,55,75,12,94.0,47,47,23,151,9.0,60,11,51,2.2,13,2028,30,105100.0,25,94.0,sous station,9.4,202.5,23.0,60.0,28/5,28/5/2028,13:30,2028-05-28T13:30:00,25.12,267125272015603,2028-05-28T13:30:00+00:00,2028-05-28T13:30:00+02:00,2028-05-28T13:30:00+00:00,2028-05-28T13:30:00+00:00
a8ccb4f2f2f2f2f2f2f2f2f3,84,6,12,11,39,75,12,94.0,47,47,23,151,9.0,60,11,51,2.2,9,2030,30,105100.0,25,94.0,sous station,9.4,202.5,23.0,60.0,12/6,12/6/2030,9:30,2030-06-12T09:30:00,25.12,267125272015603,2030-06-12T09:30:00+00:00,2030-06-12T09:30:00+02:00,2030-06-12T09:30:00+00:00,2030-06-12T09:30:00+00:00
a908b6f2f2f2f2f2f2f2f2f3,84,8,8,11,55,75,12,94.0,47,47,23,151,9.0,60,11,51,2.2,13,2030,30,105100.0,25,94.0,sous station,9.4,202.5,23.0,60.0,8/8,8/8/2030,13:30,2030-08-08T13:30:00,25.12,267125272015603,2030-08-08T13:30:00+00:00,2030-08-08T13:30:00+02:00,2030-08-08T13:30:00+00:00,2030-08-08T13:30:00+00:00
a91480f2f2f2f2f2f2f2f2f3,84,8,20,8,7,75,12,94.0,47,47,23,151,9.0,60,11,51,2.2,1,2027,30,105100.0,25,94.0,sous station,9.4,202.5,23.0,60.0,20/8,20/8/2027,1:30,2027-08-20T01:30:00,25.12,267125272015603,2027-08-20T01:30:00+00:00,2027-08-20T01:30:00+02:00,2027-08-20T01:30:00+00:00,2027-08-20T01:30:00+00:00
a914b8f2f2f2f2f2f2f2f2f3,84,8,20,11,71,75,12,94.0,47,47,23,151,9.0,60,11,51,2.2,17,2030,30,105100.0,25,94.0,sous station,9.4,202.5,23.0,60.0,20/8,20/8/2030,17:30,2030-08-20T17:30:00,25.12,267125272015603,2030-08-20T17:30:00+00:00,2030-08-20T17:30:00+02:00,2030-08-20T17:30:00+00:00,2030-08-20T17:30:00+00:00
a9089af2f2f2f2f2f2f2f2f3,84,8,8,9,87,75,12,94.0,47,47,23,151,9.0,60,11,51,2.2,21,2028,30,105100.0,25,94.0,sous station,9.4,202.5,23.0,60.0,8/8,8/8/2028,21:30,2028-08-08T21:30:00,25.12,267125272015603,2028-08-08T21:30:00+00:00,2028-08-08T21:30:00+02:00,2028-08-08T21:30:00+00:00,2028-08-08T21:30:00+00:00
ab54b2f2f2f2f2f2f2f2f2f3,85,10,20,11,23,75,12,94.0,47,47,23,151,9.0,60,11,51,2.2,5,2030,30,105100.0,25,94.0,sous station,9.4,202.5,23.0,60.0,20/10,20/10/2030,5:30,2030-10-20T05:30:00,25.12,267125272015603,2030-10-20T05:30:00+00:00,2030-10-20T05:30:00+02:00,2030-10-20T05:30:00+00:00,2030-10-20T05:30:00+00:00
a93ca8f2f2f2f2f2f2f2f2f3,84,9,28,10,71,75,12,94.0,47,47,23,151,9.0,60,11,51,2.2,17,2029,30,105100.0,25,94.0,sous station,9.4,202.5,23.0,60.0,28/9,28/9/2029,17:30,2029-09-28T17:30:00,25.12,267125272015603,2029-09-28T17:30:00+00:00,2029-09-28T17:30:00+02:00,2029-09-28T17:30:00+00:00,2029-09-28T17:30:00+00:00
a91894f2f2f2f2f2f2f2f2f3,84,8,24,9,39,75,12,94.0,47,47,23,151,9.0,60,11,51,2.2,9,2028,30,105100.0,25,94.0,sous station,9.4,202.5,23.0,60.0,24/8,24/8/2028,9:30,2028-08-24T09:30:00,25.12,267125272015603,2028-08-24T09:30:00+00:00,2028-08-24T09:30:00+02:00,2028-08-24T09:30:00+00:00,2028-08-24T09:30:00+00:00
a934b2f2f2f2f2f2f2f2f2f3,84,9,20,11,23,75,12,94.0,47,47,23,151,9.0,60,11,51,2.2,5,2030,30,105100.0,25,94.0,sous station,9.4,202.5,23.0,60.0,20/9,20/9/2030,5:30,2030-09-20T05:30:00,25.12,267125272015603,2030-09-20T05:30:00+00:00,2030-09-20T05:30:00+02:00,2030-09-20T05:30:00+00:00,2030-09-20T05:30:00+00:00
a934b4f2f2f2f2f2f2f2f2f3,84,9,20,11,39,75,12,94.0,47,47,23,151,9.0,60,11,51,2.2,9,2030,30,105100.0,25,94.0,sous station,9.4,202.5,23.0,60.0,20/9,20/9/2030,9:30,2030-09-20T09:30:00,25.12,267125272015603,2030-09-20T09:30:00+00:00,2030-09-20T09:30:00+02:00,2030-09-20T09:30:00+00:00,2030-09-20T09:30:00+00:00
ab84a2f2f2f2f2f2f2f2f2f3,85,12,4,10,23,75,12,94.0,47,47,23,151,9.0,60,11,51,2.2,5,2029,30,105100.0,25,94.0,sous station,9.4,202.5,23.0,60.0,4/12,4/12/2029,5:30,2029-12-04T05:30:00,25.12,267125272015603,2029-12-04T05:30:00+00:00,2029-12-04T05:30:00+01:00,2029-12-04T05:30:00+00:00,2029-12-04T05:30:00+00:00
ae487af2f2f2f2f2f2f2f2f3,87,2,8,7,87,75,12,94.0,47,47,23,151,9.0,60,11,51,2.2,21,2026,30,105100.0,25,94.0,sous station,9.4,202.5,23.0,60.0,8/2,8/2/2026,21:30,2026-02-08T21:30:00,25.12,267125272015603,2026-02-08T21:30:00+00:00,2026-02-08T21:30:00+01:00,2026-02-08T21:30:00+00:00,2026-02-08T21:30:00+00:00
a964b6f2f2f2f2f2f2f2f2f3,84,11,4,11,55,75,12,94.0,47,47,23,151,9.0,60,11,51,2.2,13,2030,30,105100.0,25,94.0,sous station,9.4,202.5,23.0,60.0,4/11,4/11/2030,13:30,2030-11-04T13:30:00,25.12,267125272015603,2030-11-04T13:30:00+00:00,2030-11-04T13:30:00+01:00,2030-11-04T13:30:00+00:00,2030-11-04T13:30:00+00:00
a968aaf2f2f2f2f2f2f2f2f3,84,11,8,10,87,75,12,94.0,47,47,23,151,9.0,60,11,51,2.2,21,2029,30,105100.0,25,94.0,sous station,9.4,202.5,23.0,60.0,8/11,8/11/2029,21:30,2029-11-08T21:30:00,25.12,267125272015603,2029-11-08T21:30:00+00:00,2029-11-08T21:30:00+01:00,2029-11-08T21:30:00+00:00,2029-11-08T21:30:00+00:00
a9649af2f2f2f2f2f2f2f2f3,84,11,4,9,87,75,12,94.0,47,47,23,151,9.0,60,11,51,2.2,21,2028,30,105100.0,25,94.0,sous station,9.4,202.5,23.0,60.0,4/11,4/11/2028,21:30,2028-11-04T21:30:00,25.12,267125272015603,2028-11-04T21:30:00+00:00,2028-11-04T21:30:00+01:00,2028-11-04T21:30:00+00:00,2028-11-04T21:30:00+00:00
a92c98f2f2f2f2f2f2f2f2f3,84,9,12,9,71,75,12,94.0,47,47,23,151,9.0,60,11,51,2.2,17,2028,30,105100.0,25,94.0,sous station,9.4,202.5,23.0,60.0,12/9,12/9/2028,17:30,2028-09-12T17:30:00,25.12,267125272015603,2028-09-12T17:30:00+00:00,2028-09-12T17:30:00+02:00,2028-09-12T17:30:00+00:00,2028-09-12T17:30:00+00:00
aa3c96f2f2f2f2f2f2f2f2f3,85,1,28,9,55,75,12,94.0,47,47,23,151,9.0,60,11,51,2.2,13,2028,30,105100.0,25,94.0,sous station,9.4,202.5,23.0,60.0,28/1,28/1/2028,13:30,2028-01-28T13:30:00,25.12,267125272015603,2028-01-28T13:30:00+00:00,2028-01-28T13:30:00+01:00,2028-01-28T13:30:00+00:00,2028-01-28T13:30:00+00:00
aa3cb8f2f2f2f2f2f2f2f2f3,85,1,28,11,71,75,12,94.0,47,47,23,151,9.0,60,11,51,2.2,17,2030,30,105100.0,25,94.0,sous station,9.4,202.5,23.0,60.0,28/1,28/1/2030,17:30,2030-01-28T17:30:00,25.12,267125272015603,2030-01-28T17:30:00+00:00,2030-01-28T17:30:00+01:00,2030-01-28T17:30:00+00:00,2030-01-28T17:30:00+00:00
a99084f2f2f2f2f2f2f2f2f3,84,12,16,8,39,75,12,94.0,47,47,23,151,9.0,60,11,51,2.2,9,2027,30,105100.0,25,94.0,sous station,9.4,202.5,23.0,60.0,16/12,16/12/2027,9:30,2027-12-16T09:30:00,25.12,267125272015603,2027-12-16T09:30:00+00:00,2027-12-16T09:30:00+01:00,2027-12-16T09:30:00+00:00,2027-12-16T09:30:00+00:00
a93494f2f2f2f2f2f2f2f2f3,84,9,20,9,39,75,12,94.0,47,47,23,151,9.0,60,11,51,2.2,9,2028,30,105100.0,25,94.0,sous station,9.4,202.5,23.0,60.0,20/9,20/9/2028,9:30,2028-09-20T09:30:00,25.12,267125272015603,2028-09-20T09:30:00+00:00,2028-09-20T09:30:00+02:00,2028-09-20T09:30:00+00:00,2028-09-20T09:30:00+00:00
aa90a0f2f2f2f2f2f2f2f2f3,85,4,16,10,7,75,12,94.0,47,47,23,151,9.0,60,11,51,2.2,1,2029,30,105100.0,25,94.0,sous station,9.4,202.5,23.0,60.0,16/4,16/4/2029,1:30,2029-04-16T01:30:00,25.12,267125272015603,2029-04-16T01:30:00+00:00,2029-04-16T01:30:00+02:00,2029-04-16T01:30:00+00:00,2029-04-16T01:30:00+00:00
aa6c98f2f2f2f2f2f2f2f2f3,85,3,12,9,71,75,12,94.0,47,47,23,151,9.0,60,11,51,2.2,17,2028,30,105100.0,25,94.0,sous station,9.4,202.5,23.0,60.0,12/3,12/3/2028,17:30,2028-03-12T17:30:00,25.12,267125272015603,2028-03-12T17:30:00+00:00,2028-03-12T17:30:00+01:00,2028-03-12T17:30:00+00:00,2028-03-12T17:30:00+00:00
aa5ca8f2f2f2f2f2f2f2f2f3,85,2,28,10,71,75,12,94.0,47,47,23,151,9.0,60,11,51,2.2,17,2029,30,105100.0,25,94.0,sous station,9.4,202.5,23.0,60.0,28/2,28/2/2029,17:30,2029-02-28T17:30:00,25.12,267125272015603,2029-02-28T17:30:00+00:00,2029-02-28T17:30:00+01:00,2029-02-28T17:30:00+00:00,2029-02-28T17:30:00+00:00
aa7496f2f2f2f2f2f2f2f2f3,85,3,20,9,55,75,12,94.0,47,47,23,151,9.0,60,11,51,2.2,13,2028,30,105100.0,25,94.0,sous station,9.4,202.5,23.0,60.0,20/3,20/3/2028,13:30,2028-03-20T13:30:00,25.12,267125272015603,2028-03-20T13:30:00+00:00,2028-03-20T13:30:00+01:00,2028-03-20T13:30:00+00:00,2028-03-20T13:30:00+00:00
a89880f2f2f2f2f2f2f2f2f3,84,4,24,8,7,75,12,94.0,47,47,23,151,9.0,60,11,51,2.2,1,2027,30,105100.0,25,94.0,sous station,9.4,202.5,23.0,60.0,24/4,24/4/2027,1:30,2027-04-24T01:30:00,25.12,267125272015603,2027-04-24T01:30:00+00:00,2027-04-24T01:30:00+02:00,2027-04-24T01:30:00+00:00,2027-04-24T01:30:00+00:00
aa78b4f2f2f2f2f2f2f2f2f3,85,3,24,11,39,75,12,94.0,47,47,23,151,9.0,60,11,51,2.2,9,2030,30,105100.0,25,94.0,sous station,9.4,202.5,23.0,60.0,24/3,24/3/2030,9:30,2030-03-24T09:30:00,25.12,267125272015603,2030-03-24T09:30:00+00:00,2030-03-24T09:30:00+01:00,2030-03-24T09:30:00+00:00,2030-03-24T09:30:00+00:00
aabc8af2f2f2f2f2f2f2f2f3,85,5,28,8,87,75,12,94.0,47,47,23,151,9.0,60,11,51,2.2,21,2027,30,105100.0,25,94.0,sous station,9.4,202.5,23.0,60.0,28/5,28/5/2027,21:30,2027-05-28T21:30:00,25.12,267125272015603,2027-05-28T21:30:00+00:00,2027-05-28T21:30:00+02:00,2027-05-28T21:30:00+00:00,2027-05-28T21:30:00+00:00
aa64a0f2f2f2f2f2f2f2f2f3,85,3,4,10,7,75,12,94.0,47,47,23,151,9.0,60,11,51,2.2,1,2029,30,105100.0,25,94.0,sous station,9.4,202.5,23.0,60.0,4/3,4/3/2029,1:30,2029-03-04T01:30:00,25.12,267125272015603,2029-03-04T01:30:00+00:00,2029-03-04T01:30:00+01:00,2029-03-04T01:30:00+00:00,2029-03-04T01:30:00+00:00
aa8492f2f2f2f2f2f2f2f2f3,85,4,4,9,23,75,12,94.0,47,47,23,151,9.0,60,11,51,2.2,5,2028,30,105100.0,25,94.0,sous station,9.4,202.5,23.0,60.0,4/4,4/4/2028,5:30,2028-04-04T05:30:00,25.12,267125272015603,2028-04-04T05:30:00+00:00,2028-04-04T05:30:00+02:00,2028-04-04T05:30:00+00:00,2028-04-04T05:30:00+00:00
aaa4b0f2f2f2f2f2f2f2f2f3,85,5,4,11,7,75,12,94.0,47,47,23,151,9.0,60,11,51,2.2,1,2030,30,105100.0,25,94.0,sous station,9.4,202.5,23.0,60.0,4/5,4/5/2030,1:30,2030-05-04T01:30:00,25.12,267125272015603,2030-05-04T01:30:00+00:00,2030-05-04T01:30:00+02:00,2030-05-04T01:30:00+00:00,2030-05-04T01:30:00+00:00
aab49af2f2f2f2f2f2f2f2f3,85,5,20,9,87,75,12,94.0,47,47,23,151,9.0,60,11,51,2.2,21,2028,30,105100.0,25,94.0,sous station,9.4,202.5,23.0,60.0,20/5,20/5/2028,21:30,2028-05-20T21:30:00,25.12,267125272015603,2028-05-20T21:30:00+00:00,2028-05-20T21:30:00+02:00,2028-05-20T21:30:00+00:00,2028-05-20T21:30:00+00:00
aa70b8f2f2f2f2f2f2f2f2f3,85,3,16,11,71,75,12,94.0,47,47,23,151,9.0,60,11,51,2.2,17,2030,30,105100.0,25,94.0,sous station,9.4,202.5,23.0,60.0,16/3,16/3/2030,17:30,2030-03-16T17:30:00,25.12,267125272015603,2030-03-16T17:30:00+00:00,2030-03-16T17:30:00+01:00,2030-03-16T17:30:00+00:00,2030-03-16T17:30:00+00:00
a88c92f2f2f2f2f2f2f2f2f3,84,4,12,9,23,75,12,94.0,47,47,23,151,9.0,60,11,51,2.2,5,2028,30,105100.0,25,94.0,sous station,9.4,202.5,23.0,60.0,12/4,12/4/2028,5:30,2028-04-12T05:30:00,25.12,267125272015603,2028-04-12T05:30:00+00:00,2028-04-12T05:30:00+02:00,2028-04-12T05:30:00+00:00,2028-04-12T05:30:00+00:00
aaa8b4f2f2f2f2f2f2f2f2f3,85,5,8,11,39,75,12,94.0,47,47,23,151,9.0,60,11,51,2.2,9,2030,30,105100.0,25,94.0,sous station,9.4,202.5,23.0,60.0,8/5,8/5/2030,9:30,2030-05-08T09:30:00,25.12,267125272015603,2030-05-08T09:30:00+00:00,2030-05-08T09:30:00+02:00,2030-05-08T09:30:00+00:00,2030-05-08T09:30:00+00:00
aabc9af2f2f2f2f2f2f2f2f3,85,5,28,9,87,75,12,94.0,47,47,23,151,9.0,60,11,51,2.2,21,2028,30,105100.0,25,94.0,sous station,9.4,202.5,23.0,60.0,28/5,28/5/2028,21:30,2028-05-28T21:30:00,25.12,267125272015603,2028-05-28T21:30:00+00:00,2028-05-28T21:30:00+02:00,2028-05-28T21:30:00+00:00,2028-05-28T21:30:00+00:00
a8bcb0f2f2f2f2f2f2f2f2f3,84,5,28,11,7,75,12,94.0,47,47,23,151,9.0,60,11,51,2.2,1,2030,30,105100.0,25,94.0,sous station,9.4,202.5,23.0,60.0,28/5,28/5/2030,1:30,2030-05-28T01:30:00,25.12,267125272015603,2030-05-28T01:30:00+00:00,2030-05-28T01:30:00+02:00,2030-05-28T01:30:00+00:00,2030-05-28T01:30:00+00:00
a8dc98f2f2f2f2f2f2f2f2f3,84,6,28,9,71,75,12,94.0,47,47,23,151,9.0,60,11,51,2.2,17,2028,30,105100.0,25,94.0,sous station,9.4,202.5,23.0,60.0,28/6,28/6/2028,17:30,2028-06-28T17:30:00,25.12,267125272015603,2028-06-28T17:30:00+00:00,2028-06-28T17:30:00+02:00,2028-06-28T17:30:00+00:00,2028-06-28T17:30:00+00:00
aac4aaf2f2f2f2f2f2f2f2f3,85,6,4,10,87,75,12,94.0,47,47,23,151,9.0,60,11,51,2.2,21,2029,30,105100.0,25,94.0,sous station,9.4,202.5,23.0,60.0,4/6,4/6/2029,21:30,2029-06-04T21:30:00,25.12,267125272015603,2029-06-04T21:30:00+00:00,2029-06-04T21:30:00+02:00,2029-06-04T21:30:00+00:00,2029-06-04T21:30:00+00:00
a8f0a6f2f2f2f2f2f2f2f2f3,84,7,16,10,55,75,12,94.0,47,47,23,151,9.0,60,11,51,2.2,13,2029,30,105100.0,25,94.0,sous station,9.4,202.5,23.0,60.0,16/7,16/7/2029,13:30,2029-07-16T13:30:00,25.12,267125272015603,2029-07-16T13:30:00+00:00,2029-07-16T13:30:00+02:00,2029-07-16T13:30:00+00:00,2029-07-16T13:30:00+00:00
a8ecb0f2f2f2f2f2f2f2f2f3,84,7,12,11,7,75,12,94.0,47,47,23,151,9.0,60,11,51,2.2,1,2030,30,105100.0,25,94.0,sous station,9.4,202.5,23.0,60.0,12/7,12/7/2030,1:30,2030-07-12T01:30:00,25.12,267125272015603,2030-07-12T01:30:00+00:00,2030-07-12T01:30:00+02:00,2030-07-12T01:30:00+00:00,2030-07-12T01:30:00+00:00
a90c98f2f2f2f2f2f2f2f2f3,84,8,12,9,71,75,12,94.0,47,47,23,151,9.0,60,11,51,2.2,17,2028,30,105100.0,25,94.0,sous station,9.4,202.5,23.0,60.0,12/8,12/8/2028,17:30,2028-08-12T17:30:00,25.12,267125272015603,2028-08-12T17:30:00+00:00,2028-08-12T17:30:00+02:00,2028-08-12T17:30:00+00:00,2028-08-12T17:30:00+00:00
aabcb2f2f2f2f2f2f2f2f2f3,85,5,28,11,23,75,12,94.0,47,47,23,151,9.0,60,11,51,2.2,5,2030,30,105100.0,25,94.0,sous station,9.4,202.5,23.0,60.0,28/5,28/5/2030,5:30,2030-05-28T05:30:00,25.12,267125272015603,2030-05-28T05:30:00+00:00,2030-05-28T05:30:00+02:00,2030-05-28T05:30:00+00:00,2030-05-28T05:30:00+00:00
aac492f2f2f2f2f2f2f2f2f3,85,6,4,9,23,75,12,94.0,47,47,23,151,9.0,60,11,51,2.2,5,2028,30,105100.0,25,94.0,sous station,9.4,202.5,23.0,60.0,4/6,4/6/2028,5:30,2028-06-04T05:30:00,25.12,267125272015603,2028-06-04T05:30:00+00:00,2028-06-04T05:30:00+02:00,2028-06-04T05:30:00+00:00,2028-06-04T05:30:00+00:00
a910b4f2f2f2f2f2f2f2f2f3,84,8,16,11,39,75,12,94.0,47,47,23,151,9.0,60,11,51,2.2,9,2030,30,105100.0,25,94.0,sous station,9.4,202.5,23.0,60.0,16/8,16/8/2030,9:30,2030-08-16T09:30:00,25.12,267125272015603,2030-08-16T09:30:00+00:00,2030-08-16T09:30:00+02:00,2030-08-16T09:30:00+00:00,2030-08-16T09:30:00+00:00
aac8a8f2f2f2f2f2f2f2f2f3,85,6,8,10,71,75,12,94.0,47,47,23,151,9.0,60,11,51,2.2,17,2029,30,105100.0,25,94.0,sous station,9.4,202.5,23.0,60.0,8/6,8/6/2029,17:30,2029-06-08T17:30:00,25.12,267125272015603,2029-06-08T17:30:00+00:00,2029-06-08T17:30:00+02:00,2029-06-08T17:30:00+00:00,2029-06-08T17:30:00+00:00
a914aaf2f2f2f2f2f2f2f2f3,84,8,20,10,87,75,12,94.0,47,47,23,151,9.0,60,11,51,2.2,21,2029,30,105100.0,25,94.0,sous station,9.4,202.5,23.0,60.0,20/8,20/8/2029,21:30,2029-08-20T21:30:00,25.12,267125272015603,2029-08-20T21:30:00+00:00,2029-08-20T21:30:00+02:00,2029-08-20T21:30:00+00:00,2029-08-20T21:30:00+00:00
aac8b4f2f2f2f2f2f2f2f2f3,85,6,8,11,39,75,12,94.0,47,47,23,151,9.0,60,11,51,2.2,9,2030,30,105100.0,25,94.0,sous station,9.4,202.5,23.0,60.0,8/6,8/6/2030,9:30,2030-06-08T09:30:00,25.12,267125272015603,2030-06-08T09:30:00+00:00,2030-06-08T09:30:00+02:00,2030-06-08T09:30:00+00:00,2030-06-08T09:30:00+00:00
aae892f2f2f2f2f2f2f2f2f3,85,7,8,9,23,75,12,94.0,47,47,23,151,9.0,60,11,51,2.2,5,2028,30,105100.0,25,94.0,sous station,9.4,202.5,23.0,60.0,8/7,8/7/2028,5:30,2028-07-08T05:30:00,25.12,267125272015603,2028-07-08T05:30:00+00:00,2028-07-08T05:30:00+02:00,2028-07-08T05:30:00+00:00,2028-07-08T05:30:00+00:00
aaa496f2f2f2f2f2f2f2f2f3,85,5,4,9,55,75,12,94.0,47,47,23,151,9.0,60,11,51,2.2,13,2028,30,105100.0,25,94.0,sous station,9.4,202.5,23.0,60.0,4/5,4/5/2028,13:30,2028-05-04T13:30:00,25.12,267125272015603,2028-05-04T13:30:00+00:00,2028-05-04T13:30:00+02:00,2028-05-04T13:30:00+00:00,2028-05-04T13:30:00+00:00
ac2498f2f2f2f2f2f2f2f2f3,86,1,4,9,71,75,12,94.0,47,47,23,151,9.0,60,11,51,2.2,17,2028,30,105100.0,25,94.0,sous station,9.4,202.5,23.0,60.0,4/1,4/1/2028,17:30,2028-01-04T17:30:00,25.12,267125272015603,2028-01-04T17:30:00+00:00,2028-01-04T17:30:00+01:00,2028-01-04T17:30:00+00:00,2028-01-04T17:30:00+00:00
aa34b8f2f2f2f2f2f2f2f2f3,85,1,20,11,71,75,12,94.0,47,47,23,151,9.0,60,11,51,2.2,17,2030,30,105100.0,25,94.0,sous station,9.4,202.5,23.0,60.0,20/1,20/1/2030,17:30,2030-01-20T17:30:00,25.12,267125272015603,2030-01-20T17:30:00+00:00,2030-01-20T17:30:00+01:00,2030-01-20T17:30:00+00:00,2030-01-20T17:30:00+00:00
aa44baf2f2f2f2f2f2f2f2f3,85,2,4,11,87,75,12,94.0,47,47,23,151,9.0,60,11,51,2.2,21,2030,30,105100.0,25,94.0,sous station,9.4,202.5,23.0,60.0,4/2,4/2/2030,21:30,2030-02-04T21:30:00,25.12,267125272015603,2030-02-04T21:30:00+00:00,2030-02-04T21:30:00+01:00,2030-02-04T21:30:00+00:00,2030-02-04T21:30:00+00:00
aaa8b6f2f2f2f2f2f2f2f2f3,85,5,8,11,55,75,12,94.0,47,47,23,151,9.0,60,11,51,2.2,13,2030,30,105100.0,25,94.0,sous station,9.4,202.5,23.0,60.0,8/5,8/5/2030,13:30,2030-05-08T13:30:00,25.12,267125272015603,2030-05-08T13:30:00+00:00,2030-05-08T13:30:00+02:00,2030-05-08T13:30:00+00:00,2030-05-08T13:30:00+00:00
aa58b6f2f2f2f2f2f2f2f2f3,85,2,24,11,55,75,12,94.0,47,47,23,151,9.0,60,11,51,2.2,13,2030,30,105100.0,25,94.0,sous station,9.4,202.5,23.0,60.0,24/2,24/2/2030,13:30,2030-02-24T13:30:00,25.12,267125272015603,2030-02-24T13:30:00+00:00,2030-02-24T13:30:00+01:00,2030-02-24T13:30:00+00:00,2030-02-24T13:30:00+00:00
aabc98f2f2f2f2f2f2f2f2f3,85,5,28,9,71,75,12,94.0,47,47,23,151,9.0,60,11,51,2.2,17,2028,30,105100.0,25,94.0,sous station,9.4,202.5,23.0,60.0,28/5,28/5/2028,17:30,2028-05-28T17:30:00,25.12,267125272015603,2028-05-28T17:30:00+00:00,2028-05-28T17:30:00+02:00,2028-05-28T17:30:00+00:00,2028-05-28T17:30:00+00:00
aac894f2f2f2f2f2f2f2f2f3,85,6,8,9,39,75,12,94.0,47,47,23,151,9.0,60,11,51,2.2,9,2028,30,105100.0,25,94.0,sous station,9.4,202.5,23.0,60.0,8/6,8/6/2028,9:30,2028-06-08T09:30:00,25.12,267125272015603,2028-06-08T09:30:00+00:00,2028-06-08T09:30:00+02:00,2028-06-08T09:30:00+00:00,2028-06-08T09:30:00+00:00
aad4b8f2f2f2f2f2f2f2f2f3,85,6,20,11,71,75,12,94.0,47,47,23,151,9.0,60,11,51,2.2,17,2030,30,105100.0,25,94.0,sous station,9.4,202.5,23.0,60.0,20/6,20/6/2030,17:30,2030-06-20T17:30:00,25.12,267125272015603,2030-06-20T17:30:00+00:00,2030-06-20T17:30:00+02:00,2030-06-20T17:30:00+00:00,2030-06-20T17:30:00+00:00
aaf0a0f2f2f2f2f2f2f2f2f3,85,7,16,10,7,75,12,94.0,47,47,23,151,9.0,60,11,51,2.2,1,2029,30,105100.0,25,94.0,sous station,9.4,202.5,23.0,60.0,16/7,16/7/2029,1:30,2029-07-16T01:30:00,25.12,267125272015603,2029-07-16T01:30:00+00:00,2029-07-16T01:30:00+02:00,2029-07-16T01:30:00+00:00,2029-07-16T01:30:00+00:00
aae8a4f2f2f2f2f2f2f2f2f3,85,7,8,10,39,75,12,94.0,47,47,23,151,9.0,60,11,51,2.2,9,2029,30,105100.0,25,94.0,sous station,9.4,202.5,23.0,60.0,8/7,8/7/2029,9:30,2029-07-08T09:30:00,25.12,267125272015603,2029-07-08T09:30:00+00:00,2029-07-08T09:30:00+02:00,2029-07-08T09:30:00+00:00,2029-07-08T09:30:00+00:00
ab0486f2f2f2f2f2f2f2f2f3,85,8,4,8,55,75,12,94.0,47,47,23,151,9.0,60,11,51,2.2,13,2027,30,105100.0,25,94.0,sous station,9.4,202.5,23.0,60.0,4/8,4/8/2027,13:30,2027-08-04T13:30:00,25.12,267125272015603,2027-08-04T13:30:00+00:00,2027-08-04T13:30:00+02:00,2027-08-04T13:30:00+00:00,2027-08-04T13:30:00+00:00
aae8b6f2f2f2f2f2f2f2f2f3,85,7,8,11,55,75,12,94.0,47,47,23,151,9.0,60,11,51,2.2,13,2030,30,105100.0,25,94.0,sous station,9.4,202.5,23.0,60.0,8/7,8/7/2030,13:30,2030-07-08T13:30:00,25.12,267125272015603,2030-07-08T13:30:00+00:00,2030-07-08T13:30:00+02:00,2030-07-08T13:30:00+00:00,2030-07-08T13:30:00+00:00
ab58baf2f2f2f2f2f2f2f2f3,85,10,24,11,87,75,12,94.0,47,47,23,151,9.0,60,11,51,2.2,21,2030,30,105100.0,25,94.0,sous station,9.4,202.5,23.0,60.0,24/10,24/10/2030,21:30,2030-10-24T21:30:00,25.12,267125272015603,2030-10-24T21:30:00+00:00,2030-10-24T21:30:00+02:00,2030-10-24T21:30:00+00:00,2030-10-24T21:30:00+00:00
ab5892f2f2f2f2f2f2f2f2f3,85,10,24,9,23,75,12,94.0,47,47,23,151,9.0,60,11,51,2.2,5,2028,30,105100.0,25,94.0,sous station,9.4,202.5,23.0,60.0,24/10,24/10/2028,5:30,2028-10-24T05:30:00,25.12,267125272015603,2028-10-24T05:30:00+00:00,2028-10-24T05:30:00+02:00,2028-10-24T05:30:00+00:00,2028-10-24T05:30:00+00:00
ab68b8f2f2f2f2f2f2f2f2f3,85,11,8,11,71,75,12,94.0,47,47,23,151,9.0,60,11,51,2.2,17,2030,30,105100.0,25,94.0,sous station,9.4,202.5,23.0,60.0,8/11,8/11/2030,17:30,2030-11-08T17:30:00,25.12,267125272015603,2030-11-08T17:30:00+00:00,2030-11-08T17:30:00+01:00,2030-11-08T17:30:00+00:00,2030-11-08T17:30:00+00:00
ab6894f2f2f2f2f2f2f2f2f3,85,11,8,9,39,75,12,94.0,47,47,23,151,9.0,60,11,51,2.2,9,2028,30,105100.0,25,94.0,sous station,9.4,202.5,23.0,60.0,8/11,8/11/2028,9:30,2028-11-08T09:30:00,25.12,267125272015603,2028-11-08T09:30:00+00:00,2028-11-08T09:30:00+01:00,2028-11-08T09:30:00+00:00,2028-11-08T09:30:00+00:00
ab6cb8f2f2f2f2f2f2f2f2f3,85,11,12,11,71,75,12,94.0,47,47,23,151,9.0,60,11,51,2.2,17,2030,30,105100.0,25,94.0,sous station,9.4,202.5,23.0,60.0,12/11,12/11/2030,17:30,2030-11-12T17:30:00,25.12,267125272015603,2030-11-12T17:30:00+00:00,2030-11-12T17:30:00+01:00,2030-11-12T17:30:00+00:00,2030-11-12T17:30:00+00:00
ab1c86f2f2f2f2f2f2f2f2f3,85,8,28,8,55,75,12,94.0,47,47,23,151,9.0,60,11,51,2.2,13,2027,30,105100.0,25,94.0,sous station,9.4,202.5,23.0,60.0,28/8,28/8/2027,13:30,2027-08-28T13:30:00,25.12,267125272015603,2027-08-28T13:30:00+00:00,2027-08-28T13:30:00+02:00,2027-08-28T13:30:00+00:00,2027-08-28T13:30:00+00:00
ab1ca6f2f2f2f2f2f2f2f2f3,85,8,28,10,55,75,12,94.0,47,47,23,151,9.0,60,11,51,2.2,13,2029,30,105100.0,25,94.0,sous station,9.4,202.5,23.0,60.0,28/8,28/8/2029,13:30,2029-08-28T13:30:00,25.12,267125272015603,2029-08-28T13:30:00+00:00,2029-08-28T13:30:00+02:00,2029-08-28T13:30:00+00:00,2029-08-28T13:30:00+00:00
ab7892f2f2f2f2f2f2f2f2f3,85,11,24,9,23,75,12,94.0,47,47,23,151,9.0,60,11,51,2.2,5,2028,30,105100.0,25,94.0,sous station,9.4,202.5,23.0,60.0,24/11,24/11/2028,5:30,2028-11-24T05:30:00,25.12,267125272015603,2028-11-24T05:30:00+00:00,2028-11-24T05:30:00+01:00,2028-11-24T05:30:00+00:00,2028-11-24T05:30:00+00:00
ab78a4f2f2f2f2f2f2f2f2f3,85,11,24,10,39,75,12,94.0,47,47,23,151,9.0,60,11,51,2.2,9,2029,30,105100.0,25,94.0,sous station,9.4,202.5,23.0,60.0,24/11,24/11/2029,9:30,2029-11-24T09:30:00,25.12,267125272015603,2029-11-24T09:30:00+00:00,2029-11-24T09:30:00+01:00,2029-11-24T09:30:00+00:00,2029-11-24T09:30:00+00:00
ab78a8f2f2f2f2f2f2f2f2f3,85,11,24,10,71,75,12,94.0,47,47,23,151,9.0,60,11,51,2.2,17,2029,30,105100.0,25,94.0,sous station,9.4,202.5,23.0,60.0,24/11,24/11/2029,17:30,2029-11-24T17:30:00,25.12,267125272015603,2029-11-24T17:30:00+00:00,2029-11-24T17:30:00+01:00,2029-11-24T17:30:00+00:00,2029-11-24T17:30:00+00:00
ab1894f2f2f2f2f2f2f2f2f3,85,8,24,9,39,75,12,94.0,47,47,23,151,9.0,60,11,51,2.2,9,2028,30,105100.0,25,94.0,sous station,9.4,202.5,23.0,60.0,24/8,24/8/2028,9:30,2028-08-24T09:30:00,25.12,267125272015603,2028-08-24T09:30:00+00:00,2028-08-24T09:30:00+02:00,2028-08-24T09:30:00+00:00,2028-08-24T09:30:00+00:00
ab2896f2f2f2f2f2f2f2f2f3,85,9,8,9,55,75,12,94.0,47,47,23,151,9.0,60,11,51,2.2,13,2028,30,105100.0,25,94.0,sous station,9.4,202.5,23.0,60.0,8/9,8/9/2028,13:30,2028-09-08T13:30:00,25.12,267125272015603,2028-09-08T13:30:00+00:00,2028-09-08T13:30:00+02:00,2028-09-08T13:30:00+00:00,2028-09-08T13:30:00+00:00
ab28a4f2f2f2f2f2f2f2f2f3,85,9,8,10,39,75,12,94.0,47,47,23,151,9.0,60,11,51,2.2,9,2029,30,105100.0,25,94.0,sous station,9.4,202.5,23.0,60.0,8/9,8/9/2029,9:30,2029-09-08T09:30:00,25.12,267125272015603,2029-09-08T09:30:00+00:00,2029-09-08T09:30:00+02:00,2029-09-08T09:30:00+00:00,2029-09-08T09:30:00+00:00
ab24a2f2f2f2f2f2f2f2f2f3,85,9,4,10,23,75,12,94.0,47,47,23,151,9.0,60,11,51,2.2,5,2029,30,105100.0,25,94.0,sous station,9.4,202.5,23.0,60.0,4/9,4/9/2029,5:30,2029-09-04T05:30:00,25.12,267125272015603,2029-09-04T05:30:00+00:00,2029-09-04T05:30:00+02:00,2029-09-04T05:30:00+00:00,2029-09-04T05:30:00+00:00
ab2494f2f2f2f2f2f2f2f2f3,85,9,4,9,39,75,12,94.0,47,47,23,151,9.0,60,11,51,2.2,9,2028,30,105100.0,25,94.0,sous station,9.4,202.5,23.0,60.0,4/9,4/9/2028,9:30,2028-09-04T09:30:00,25.12,267125272015603,2028-09-04T09:30:00+00:00,2028-09-04T09:30:00+02:00,2028-09-04T09:30:00+00:00,2028-09-04T09:30:00+00:00
ab28b6f2f2f2f2f2f2f2f2f3,85,9,8,11,55,75,12,94.0,47,47,23,151,9.0,60,11,51,2.2,13,2030,30,105100.0,25,94.0,sous station,9.4,202.5,23.0,60.0,8/9,8/9/2030,13:30,2030-09-08T13:30:00,25.12,267125272015603,2030-09-08T13:30:00+00:00,2030-09-08T13:30:00+02:00,2030-09-08T13:30:00+00:00,2030-09-08T13:30:00+00:00
ab4494f2f2f2f2f2f2f2f2f3,85,10,4,9,39,75,12,94.0,47,47,23,151,9.0,60,11,51,2.2,9,2028,30,105100.0,25,94.0,sous station,9.4,202.5,23.0,60.0,4/10,4/10/2028,9:30,2028-10-04T09:30:00,25.12,267125272015603,2028-10-04T09:30:00+00:00,2028-10-04T09:30:00+02:00,2028-10-04T09:30:00+00:00,2028-10-04T09:30:00+00:00
a898b2f2f2f2f2f2f2f2f2f3,84,4,24,11,23,75,12,94.0,47,47,23,151,9.0,60,11,51,2.2,5,2030,30,105100.0,25,94.0,sous station,9.4,202.5,23.0,60.0,24/4,24/4/2030,5:30,2030-04-24T05:30:00,25.12,267125272015603,2030-04-24T05:30:00+00:00,2030-04-24T05:30:00+02:00,2030-04-24T05:30:00+00:00,2030-04-24T05:30:00+00:00
a8b486f2f2f2f2f2f2f2f2f3,84,5,20,8,55,75,12,94.0,47,47,23,151,9.0,60,11,51,2.2,13,2027,30,105100.0,25,94.0,sous station,9.4,202.5,23.0,60.0,20/5,20/5/2027,13:30,2027-05-20T13:30:00,25.12,267125272015603,2027-05-20T13:30:00+00:00,2027-05-20T13:30:00+02:00,2027-05-20T13:30:00+00:00,2027-05-20T13:30:00+00:00
a8b8aaf2f2f2f2f2f2f2f2f3,84,5,24,10,87,75,12,94.0,47,47,23,151,9.0,60,11,51,2.2,21,2029,30,105100.0,25,94.0,sous station,9.4,202.5,23.0,60.0,24/5,24/5/2029,21:30,2029-05-24T21:30:00,25.12,267125272015603,2029-05-24T21:30:00+00:00,2029-05-24T21:30:00+02:00,2029-05-24T21:30:00+00:00,2029-05-24T21:30:00+00:00
a908a8f2f2f2f2f2f2f2f2f3,84,8,8,10,71,75,12,94.0,47,47,23,151,9.0,60,11,51,2.2,17,2029,30,105100.0,25,94.0,sous station,9.4,202.5,23.0,60.0,8/8,8/8/2029,17:30,2029-08-08T17:30:00,25.12,267125272015603,2029-08-08T17:30:00+00:00,2029-08-08T17:30:00+02:00,2029-08-08T17:30:00+00:00,2029-08-08T17:30:00+00:00
a8c498f2f2f2f2f2f2f2f2f3,84,6,4,9,71,75,12,94.0,47,47,23,151,9.0,60,11,51,2.2,17,2028,30,105100.0,25,94.0,sous station,9.4,202.5,23.0,60.0,4/6,4/6/2028,17:30,2028-06-04T17:30:00,25.12,267125272015603,2028-06-04T17:30:00+00:00,2028-06-04T17:30:00+02:00,2028-06-04T17:30:00+00:00,2028-06-04T17:30:00+00:00
a914b2f2f2f2f2f2f2f2f2f3,84,8,20,11,23,75,12,94.0,47,47,23,151,9.0,60,11,51,2.2,5,2030,30,105100.0,25,94.0,sous station,9.4,202.5,23.0,60.0,20/8,20/8/2030,5:30,2030-08-20T05:30:00,25.12,267125272015603,2030-08-20T05:30:00+00:00,2030-08-20T05:30:00+02:00,2030-08-20T05:30:00+00:00,2030-08-20T05:30:00+00:00
ab84b6f2f2f2f2f2f2f2f2f3,85,12,4,11,55,75,12,94.0,47,47,23,151,9.0,60,11,51,2.2,13,2030,30,105100.0,25,94.0,sous station,9.4,202.5,23.0,60.0,4/12,4/12/2030,13:30,2030-12-04T13:30:00,25.12,267125272015603,2030-12-04T13:30:00+00:00,2030-12-04T13:30:00+01:00,2030-12-04T13:30:00+00:00,2030-12-04T13:30:00+00:00
a8cca6f2f2f2f2f2f2f2f2f3,84,6,12,10,55,75,12,94.0,47,47,23,151,9.0,60,11,51,2.2,13,2029,30,105100.0,25,94.0,sous station,9.4,202.5,23.0,60.0,12/6,12/6/2029,13:30,2029-06-12T13:30:00,25.12,267125272015603,2029-06-12T13:30:00+00:00,2029-06-12T13:30:00+02:00,2029-06-12T13:30:00+00:00,2029-06-12T13:30:00+00:00
a8eca4f2f2f2f2f2f2f2f2f3,84,7,12,10,39,75,12,94.0,47,47,23,151,9.0,60,11,51,2.2,9,2029,30,105100.0,25,94.0,sous station,9.4,202.5,23.0,60.0,12/7,12/7/2029,9:30,2029-07-12T09:30:00,25.12,267125272015603,2029-07-12T09:30:00+00:00,2029-07-12T09:30:00+02:00,2029-07-12T09:30:00+00:00,2029-07-12T09:30:00+00:00
a88cb4f2f2f2f2f2f2f2f2f3,84,4,12,11,39,75,12,94.0,47,47,23,151,9.0,60,11,51,2.2,9,2030,30,105100.0,25,94.0,sous station,9.4,202.5,23.0,60.0,12/4,12/4/2030,9:30,2030-04-12T09:30:00,25.12,267125272015603,2030-04-12T09:30:00+00:00,2030-04-12T09:30:00+02:00,2030-04-12T09:30:00+00:00,2030-04-12T09:30:00+00:00
a91082f2f2f2f2f2f2f2f2f3,84,8,16,8,23,75,12,94.0,47,47,23,151,9.0,60,11,51,2.2,5,2027,30,105100.0,25,94.0,sous station,9.4,202.5,23.0,60.0,16/8,16/8/2027,5:30,2027-08-16T05:30:00,25.12,267125272015603,2027-08-16T05:30:00+00:00,2027-08-16T05:30:00+02:00,2027-08-16T05:30:00+00:00,2027-08-16T05:30:00+00:00
a918a8f2f2f2f2f2f2f2f2f3,84,8,24,10,71,75,12,94.0,47,47,23,151,9.0,60,11,51,2.2,17,2029,30,105100.0,25,94.0,sous station,9.4,202.5,23.0,60.0,24/8,24/8/2029,17:30,2029-08-24T17:30:00,25.12,267125272015603,2029-08-24T17:30:00+00:00,2029-08-24T17:30:00+02:00,2029-08-24T17:30:00+00:00,2029-08-24T17:30:00+00:00
a8a4a6f2f2f2f2f2f2f2f2f3,84,5,4,10,55,75,12,94.0,47,47,23,151,9.0,60,11,51,2.2,13,2029,30,105100.0,25,94.0,sous station,9.4,202.5,23.0,60.0,4/5,4/5/2029,13:30,2029-05-04T13:30:00,25.12,267125272015603,2029-05-04T13:30:00+00:00,2029-05-04T13:30:00+02:00,2029-05-04T13:30:00+00:00,2029-05-04T13:30:00+00:00
a8a898f2f2f2f2f2f2f2f2f3,84,5,8,9,71,75,12,94.0,47,47,23,151,9.0,60,11,51,2.2,17,2028,30,105100.0,25,94.0,sous station,9.4,202.5,23.0,60.0,8/5,8/5/2028,17:30,2028-05-08T17:30:00,25.12,267125272015603,2028-05-08T17:30:00+00:00,2028-05-08T17:30:00+02:00,2028-05-08T17:30:00+00:00,2028-05-08T17:30:00+00:00
a90cb8f2f2f2f2f2f2f2f2f3,84,8,12,11,71,75,12,94.0,47,47,23,151,9.0,60,11,51,2.2,17,2030,30,105100.0,25,94.0,sous station,9.4,202.5,23.0,60.0,12/8,12/8/2030,17:30,2030-08-12T17:30:00,25.12,267125272015603,2030-08-12T17:30:00+00:00,2030-08-12T17:30:00+02:00,2030-08-12T17:30:00+00:00,2030-08-12T17:30:00+00:00
a90886f2f2f2f2f2f2f2f2f3,84,8,8,8,55,75,12,94.0,47,47,23,151,9.0,60,11,51,2.2,13,2027,30,105100.0,25,94.0,sous station,9.4,202.5,23.0,60.0,8/8,8/8/2027,13:30,2027-08-08T13:30:00,25.12,267125272015603,2027-08-08T13:30:00+00:00,2027-08-08T13:30:00+02:00,2027-08-08T13:30:00+00:00,2027-08-08T13:30:00+00:00
a90c84f2f2f2f2f2f2f2f2f3,84,8,12,8,39,75,12,94.0,47,47,23,151,9.0,60,11,51,2.2,9,2027,30,105100.0,25,94.0,sous station,9.4,202.5,23.0,60.0,12/8,12/8/2027,9:30,2027-08-12T09:30:00,25.12,267125272015603,2027-08-12T09:30:00+00:00,2027-08-12T09:30:00+02:00,2027-08-12T09:30:00+00:00,2027-08-12T09:30:00+00:00
a99882f2f2f2f2f2f2f2f2f3,84,12,24,8,23,75,12,94.0,47,47,23,151,9.0,60,11,51,2.2,5,2027,30,105100.0,25,94.0,sous station,9.4,202.5,23.0,60.0,24/12,24/12/2027,5:30,2027-12-24T05:30:00,25.12,267125272015603,2027-12-24T05:30:00+00:00,2027-12-24T05:30:00+01:00,2027-12-24T05:30:00+00:00,2027-12-24T05:30:00+00:00
a9949af2f2f2f2f2f2f2f2f3,84,12,20,9,87,75,12,94.0,47,47,23,151,9.0,60,11,51,2.2,21,2028,30,105100.0,25,94.0,sous station,9.4,202.5,23.0,60.0,20/12,20/12/2028,21:30,2028-12-20T21:30:00,25.12,267125272015603,2028-12-20T21:30:00+00:00,2028-12-20T21:30:00+01:00,2028-12-20T21:30:00+00:00,2028-12-20T21:30:00+00:00
a994b8f2f2f2f2f2f2f2f2f3,84,12,20,11,71,75,12,94.0,47,47,23,151,9.0,60,11,51,2.2,17,2030,30,105100.0,25,94.0,sous station,9.4,202.5,23.0,60.0,20/12,20/12/2030,17:30,2030-12-20T17:30:00,25.12,267125272015603,2030-12-20T17:30:00+00:00,2030-12-20T17:30:00+01:00,2030-12-20T17:30:00+00:00,2030-12-20T17:30:00+00:00
a91c92f2f2f2f2f2f2f2f2f3,84,8,28,9,23,75,12,94.0,47,47,23,151,9.0,60,11,51,2.2,5,2028,30,105100.0,25,94.0,sous station,9.4,202.5,23.0,60.0,28/8,28/8/2028,5:30,2028-08-28T05:30:00,25.12,267125272015603,2028-08-28T05:30:00+00:00,2028-08-28T05:30:00+02:00,2028-08-28T05:30:00+00:00,2028-08-28T05:30:00+00:00
a93c88f2f2f2f2f2f2f2f2f3,84,9,28,8,71,75,12,94.0,47,47,23,151,9.0,60,11,51,2.2,17,2027,30,105100.0,25,94.0,sous station,9.4,202.5,23.0,60.0,28/9,28/9/2027,17:30,2027-09-28T17:30:00,25.12,267125272015603,2027-09-28T17:30:00+00:00,2027-09-28T17:30:00+02:00,2027-09-28T17:30:00+00:00,2027-09-28T17:30:00+00:00
a92cb4f2f2f2f2f2f2f2f2f3,84,9,12,11,39,75,12,94.0,47,47,23,151,9.0,60,11,51,2.2,9,2030,30,105100.0,25,94.0,sous station,9.4,202.5,23.0,60.0,12/9,12/9/2030,9:30,2030-09-12T09:30:00,25.12,267125272015603,2030-09-12T09:30:00+00:00,2030-09-12T09:30:00+02:00,2030-09-12T09:30:00+00:00,2030-09-12T09:30:00+00:00
a9908af2f2f2f2f2f2f2f2f3,84,12,16,8,87,75,12,94.0,47,47,23,151,9.0,60,11,51,2.2,21,2027,30,105100.0,25,94.0,sous station,9.4,202.5,23.0,60.0,16/12,16/12/2027,21:30,2027-12-16T21:30:00,25.12,267125272015603,2027-12-16T21:30:00+00:00,2027-12-16T21:30:00+01:00,2027-12-16T21:30:00+00:00,2027-12-16T21:30:00+00:00
ae287af2f2f2f2f2f2f2f2f3,87,1,8,7,87,75,12,94.0,47,47,23,151,9.0,60,11,51,2.2,21,2026,30,105100.0,25,94.0,sous station,9.4,202.5,23.0,60.0,8/1,8/1/2026,21:30,2026-01-08T21:30:00,25.12,267125272015603,2026-01-08T21:30:00+00:00,2026-01-08T21:30:00+01:00,2026-01-08T21:30:00+00:00,2026-01-08T21:30:00+00:00
a95894f2f2f2f2f2f2f2f2f3,84,10,24,9,39,75,12,94.0,47,47,23,151,9.0,60,11,51,2.2,9,2028,30,105100.0,25,94.0,sous station,9.4,202.5,23.0,60.0,24/10,24/10/2028,9:30,2028-10-24T09:30:00,25.12,267125272015603,2028-10-24T09:30:00+00:00,2028-10-24T09:30:00+02:00,2028-10-24T09:30:00+00:00,2028-10-24T09:30:00+00:00
a95880f2f2f2f2f2f2f2f2f3,84,10,24,8,7,75,12,94.0,47,47,23,151,9.0,60,11,51,2.2,1,2027,30,105100.0,25,94.0,sous station,9.4,202.5,23.0,60.0,24/10,24/10/2027,1:30,2027-10-24T01:30:00,25.12,267125272015603,2027-10-24T01:30:00+00:00,2027-10-24T01:30:00+02:00,2027-10-24T01:30:00+00:00,2027-10-24T01:30:00+00:00
a90c96f2f2f2f2f2f2f2f2f3,84,8,12,9,55,75,12,94.0,47,47,23,151,9.0,60,11,51,2.2,13,2028,30,105100.0,25,94.0,sous station,9.4,202.5,23.0,60.0,12/8,12/8/2028,13:30,2028-08-12T13:30:00,25.12,267125272015603,2028-08-12T13:30:00+00:00,2028-08-12T13:30:00+02:00,2028-08-12T13:30:00+00:00,2028-08-12T13:30:00+00:00
a954b0f2f2f2f2f2f2f2f2f3,84,10,20,11,7,75,12,94.0,47,47,23,151,9.0,60,11,51,2.2,1,2030,30,105100.0,25,94.0,sous station,9.4,202.5,23.0,60.0,20/10,20/10/2030,1:30,2030-10-20T01:30:00,25.12,267125272015603,2030-10-20T01:30:00+00:00,2030-10-20T01:30:00+02:00,2030-10-20T01:30:00+00:00,2030-10-20T01:30:00+00:00
a914a4f2f2f2f2f2f2f2f2f3,84,8,20,10,39,75,12,94.0,47,47,23,151,9.0,60,11,51,2.2,9,2029,30,105100.0,25,94.0,sous station,9.4,202.5,23.0,60.0,20/8,20/8/2029,9:30,2029-08-20T09:30:00,25.12,267125272015603,2029-08-20T09:30:00+00:00,2029-08-20T09:30:00+02:00,2029-08-20T09:30:00+00:00,2029-08-20T09:30:00+00:00
a93cb8f2f2f2f2f2f2f2f2f3,84,9,28,11,71,75,12,94.0,47,47,23,151,9.0,60,11,51,2.2,17,2030,30,105100.0,25,94.0,sous station,9.4,202.5,23.0,60.0,28/9,28/9/2030,17:30,2030-09-28T17:30:00,25.12,267125272015603,2030-09-28T17:30:00+00:00,2030-09-28T17:30:00+02:00,2030-09-28T17:30:00+00:00,2030-09-28T17:30:00+00:00
a93cbaf2f2f2f2f2f2f2f2f3,84,9,28,11,87,75,12,94.0,47,47,23,151,9.0,60,11,51,2.2,21,2030,30,105100.0,25,94.0,sous station,9.4,202.5,23.0,60.0,28/9,28/9/2030,21:30,2030-09-28T21:30:00,25.12,267125272015603,2030-09-28T21:30:00+00:00,2030-09-28T21:30:00+02:00,2030-09-28T21:30:00+00:00,2030-09-28T21:30:00+00:00
a9448af2f2f2f2f2f2f2f2f3,84,10,4,8,87,75,12,94.0,47,47,23,151,9.0,60,11,51,2.2,21,2027,30,105100.0,25,94.0,sous station,9.4,202.5,23.0,60.0,4/10,4/10/2027,21:30,2027-10-04T21:30:00,25.12,267125272015603,2027-10-04T21:30:00+00:00,2027-10-04T21:30:00+02:00,2027-10-04T21:30:00+00:00,2027-10-04T21:30:00+00:00
a970a2f2f2f2f2f2f2f2f2f3,84,11,16,10,23,75,12,94.0,47,47,23,151,9.0,60,11,51,2.2,5,2029,30,105100.0,25,94.0,sous station,9.4,202.5,23.0,60.0,16/11,16/11/2029,5:30,2029-11-16T05:30:00,25.12,267125272015603,2029-11-16T05:30:00+00:00,2029-11-16T05:30:00+01:00,2029-11-16T05:30:00+00:00,2029-11-16T05:30:00+00:00
a8b096f2f2f2f2f2f2f2f2f3,84,5,16,9,55,75,12,94.0,47,47,23,151,9.0,60,11,51,2.2,13,2028,30,105100.0,25,94.0,sous station,9.4,202.5,23.0,60.0,16/5,16/5/2028,13:30,2028-05-16T13:30:00,25.12,267125272015603,2028-05-16T13:30:00+00:00,2028-05-16T13:30:00+02:00,2028-05-16T13:30:00+00:00,2028-05-16T13:30:00+00:00
a8b886f2f2f2f2f2f2f2f2f3,84,5,24,8,55,75,12,94.0,47,47,23,151,9.0,60,11,51,2.2,13,2027,30,105100.0,25,94.0,sous station,9.4,202.5,23.0,60.0,24/5,24/5/2027,13:30,2027-05-24T13:30:00,25.12,267125272015603,2027-05-24T13:30:00+00:00,2027-05-24T13:30:00+02:00,2027-05-24T13:30:00+00:00,2027-05-24T13:30:00+00:00
a92cb6f2f2f2f2f2f2f2f2f3,84,9,12,11,55,75,12,94.0,47,47,23,151,9.0,60,11,51,2.2,13,2030,30,105100.0,25,94.0,sous station,9.4,202.5,23.0,60.0,12/9,12/9/2030,13:30,2030-09-12T13:30:00,25.12,267125272015603,2030-09-12T13:30:00+00:00,2030-09-12T13:30:00+02:00,2030-09-12T13:30:00+00:00,2030-09-12T13:30:00+00:00
a954b6f2f2f2f2f2f2f2f2f3,84,10,20,11,55,75,12,94.0,47,47,23,151,9.0,60,11,51,2.2,13,2030,30,105100.0,25,94.0,sous station,9.4,202.5,23.0,60.0,20/10,20/10/2030,13:30,2030-10-20T13:30:00,25.12,267125272015603,2030-10-20T13:30:00+00:00,2030-10-20T13:30:00+02:00,2030-10-20T13:30:00+00:00,2030-10-20T13:30:00+00:00
a94c90f2f2f2f2f2f2f2f2f3,84,10,12,9,7,75,12,94.0,47,47,23,151,9.0,60,11,51,2.2,1,2028,30,105100.0,25,94.0,sous station,9.4,202.5,23.0,60.0,12/10,12/10/2028,1:30,2028-10-12T01:30:00,25.12,267125272015603,2028-10-12T01:30:00+00:00,2028-10-12T01:30:00+02:00,2028-10-12T01:30:00+00:00,2028-10-12T01:30:00+00:00
a8dc92f2f2f2f2f2f2f2f2f3,84,6,28,9,23,75,12,94.0,47,47,23,151,9.0,60,11,51,2.2,5,2028,30,105100.0,25,94.0,sous station,9.4,202.5,23.0,60.0,28/6,28/6/2028,5:30,2028-06-28T05:30:00,25.12,267125272015603,2028-06-28T05:30:00+00:00,2028-06-28T05:30:00+02:00,2028-06-28T05:30:00+00:00,2028-06-28T05:30:00+00:00
a994a8f2f2f2f2f2f2f2f2f3,84,12,20,10,71,75,12,94.0,47,47,23,151,9.0,60,11,51,2.2,17,2029,30,105100.0,25,94.0,sous station,9.4,202.5,23.0,60.0,20/12,20/12/2029,17:30,2029-12-20T17:30:00,25.12,267125272015603,2029-12-20T17:30:00+00:00,2029-12-20T17:30:00+01:00,2029-12-20T17:30:00+00:00,2029-12-20T17:30:00+00:00
a8cc98f2f2f2f2f2f2f2f2f3,84,6,12,9,71,75,12,94.0,47,47,23,151,9.0,60,11,51,2.2,17,2028,30,105100.0,25,94.0,sous station,9.4,202.5,23.0,60.0,12/6,12/6/2028,17:30,2028-06-12T17:30:00,25.12,267125272015603,2028-06-12T17:30:00+00:00,2028-06-12T17:30:00+02:00,2028-06-12T17:30:00+00:00,2028-06-12T17:30:00+00:00
aa28b2f2f2f2f2f2f2f2f2f3,85,1,8,11,23,75,12,94.0,47,47,23,151,9.0,60,11,51,2.2,5,2030,30,105100.0,25,94.0,sous station,9.4,202.5,23.0,60.0,8/1,8/1/2030,5:30,2030-01-08T05:30:00,25.12,267125272015603,2030-01-08T05:30:00+00:00,2030-01-08T05:30:00+01:00,2030-01-08T05:30:00+00:00,2030-01-08T05:30:00+00:00
aa2ca0f2f2f2f2f2f2f2f2f3,85,1,12,10,7,75,12,94.0,47,47,23,151,9.0,60,11,51,2.2,1,2029,30,105100.0,25,94.0,sous station,9.4,202.5,23.0,60.0,12/1,12/1/2029,1:30,2029-01-12T01:30:00,25.12,267125272015603,2029-01-12T01:30:00+00:00,2029-01-12T01:30:00+01:00,2029-01-12T01:30:00+00:00,2029-01-12T01:30:00+00:00
aa388af2f2f2f2f2f2f2f2f3,85,1,24,8,87,75,12,94.0,47,47,23,151,9.0,60,11,51,2.2,21,2027,30,105100.0,25,94.0,sous station,9.4,202.5,23.0,60.0,24/1,24/1/2027,21:30,2027-01-24T21:30:00,25.12,267125272015603,2027-01-24T21:30:00+00:00,2027-01-24T21:30:00+01:00,2027-01-24T21:30:00+00:00,2027-01-24T21:30:00+00:00
a8ec82f2f2f2f2f2f2f2f2f3,84,7,12,8,23,75,12,94.0,47,47,23,151,9.0,60,11,51,2.2,5,2027,30,105100.0,25,94.0,sous station,9.4,202.5,23.0,60.0,12/7,12/7/2027,5:30,2027-07-12T05:30:00,25.12,267125272015603,2027-07-12T05:30:00+00:00,2027-07-12T05:30:00+02:00,2027-07-12T05:30:00+00:00,2027-07-12T05:30:00+00:00
aa4898f2f2f2f2f2f2f2f2f3,85,2,8,9,71,75,12,94.0,47,47,23,151,9.0,60,11,51,2.2,17,2028,30,105100.0,25,94.0,sous station,9.4,202.5,23.0,60.0,8/2,8/2/2028,17:30,2028-02-08T17:30:00,25.12,267125272015603,2028-02-08T17:30:00+00:00,2028-02-08T17:30:00+01:00,2028-02-08T17:30:00+00:00,2028-02-08T17:30:00+00:00
ae587af2f2f2f2f2f2f2f2f3,87,2,24,7,87,75,12,94.0,47,47,23,151,9.0,60,11,51,2.2,21,2026,30,105100.0,25,94.0,sous station,9.4,202.5,23.0,60.0,24/2,24/2/2026,21:30,2026-02-24T21:30:00,25.12,267125272015603,2026-02-24T21:30:00+00:00,2026-02-24T21:30:00+01:00,2026-02-24T21:30:00+00:00,2026-02-24T21:30:00+00:00
a894b8f2f2f2f2f2f2f2f2f3,84,4,20,11,71,75,12,94.0,47,47,23,151,9.0,60,11,51,2.2,17,2030,30,105100.0,25,94.0,sous station,9.4,202.5,23.0,60.0,20/4,20/4/2030,17:30,2030-04-20T17:30:00,25.12,267125272015603,2030-04-20T17:30:00+00:00,2030-04-20T17:30:00+02:00,2030-04-20T17:30:00+00:00,2030-04-20T17:30:00+00:00
a89888f2f2f2f2f2f2f2f2f3,84,4,24,8,71,75,12,94.0,47,47,23,151,9.0,60,11,51,2.2,17,2027,30,105100.0,25,94.0,sous station,9.4,202.5,23.0,60.0,24/4,24/4/2027,17:30,2027-04-24T17:30:00,25.12,267125272015603,2027-04-24T17:30:00+00:00,2027-04-24T17:30:00+02:00,2027-04-24T17:30:00+00:00,2027-04-24T17:30:00+00:00
aa44b2f2f2f2f2f2f2f2f2f3,85,2,4,11,23,75,12,94.0,47,47,23,151,9.0,60,11,51,2.2,5,2030,30,105100.0,25,94.0,sous station,9.4,202.5,23.0,60.0,4/2,4/2/2030,5:30,2030-02-04T05:30:00,25.12,267125272015603,2030-02-04T05:30:00+00:00,2030-02-04T05:30:00+01:00,2030-02-04T05:30:00+00:00,2030-02-04T05:30:00+00:00
a890b6f2f2f2f2f2f2f2f2f3,84,4,16,11,55,75,12,94.0,47,47,23,151,9.0,60,11,51,2.2,13,2030,30,105100.0,25,94.0,sous station,9.4,202.5,23.0,60.0,16/4,16/4/2030,13:30,2030-04-16T13:30:00,25.12,267125272015603,2030-04-16T13:30:00+00:00,2030-04-16T13:30:00+02:00,2030-04-16T13:30:00+00:00,2030-04-16T13:30:00+00:00
ae687af2f2f2f2f2f2f2f2f3,87,3,8,7,87,75,12,94.0,47,47,23,151,9.0,60,11,51,2.2,21,2026,30,105100.0,25,94.0,sous station,9.4,202.5,23.0,60.0,8/3,8/3/2026,21:30,2026-03-08T21:30:00,25.12,267125272015603,2026-03-08T21:30:00+00:00,2026-03-08T21:30:00+01:00,2026-03-08T21:30:00+00:00,2026-03-08T21:30:00+00:00
ae7076f2f2f2f2f2f2f2f2f3,87,3,16,7,55,75,12,94.0,47,47,23,151,9.0,60,11,51,2.2,13,2026,30,105100.0,25,94.0,sous station,9.4,202.5,23.0,60.0,16/3,16/3/2026,13:30,2026-03-16T13:30:00,25.12,267125272015603,2026-03-16T13:30:00+00:00,2026-03-16T13:30:00+01:00,2026-03-16T13:30:00+00:00,2026-03-16T13:30:00+00:00
a8849af2f2f2f2f2f2f2f2f3,84,4,4,9,87,75,12,94.0,47,47,23,151,9.0,60,11,51,2.2,21,2028,30,105100.0,25,94.0,sous station,9.4,202.5,23.0,60.0,4/4,4/4/2028,21:30,2028-04-04T21:30:00,25.12,267125272015603,2028-04-04T21:30:00+00:00,2028-04-04T21:30:00+02:00,2028-04-04T21:30:00+00:00,2028-04-04T21:30:00+00:00
a8a8a0f2f2f2f2f2f2f2f2f3,84,5,8,10,7,75,12,94.0,47,47,23,151,9.0,60,11,51,2.2,1,2029,30,105100.0,25,94.0,sous station,9.4,202.5,23.0,60.0,8/5,8/5/2029,1:30,2029-05-08T01:30:00,25.12,267125272015603,2029-05-08T01:30:00+00:00,2029-05-08T01:30:00+02:00,2029-05-08T01:30:00+00:00,2029-05-08T01:30:00+00:00
a888b2f2f2f2f2f2f2f2f2f3,84,4,8,11,23,75,12,94.0,47,47,23,151,9.0,60,11,51,2.2,5,2030,30,105100.0,25,94.0,sous station,9.4,202.5,23.0,60.0,8/4,8/4/2030,5:30,2030-04-08T05:30:00,25.12,267125272015603,2030-04-08T05:30:00+00:00,2030-04-08T05:30:00+02:00,2030-04-08T05:30:00+00:00,2030-04-08T05:30:00+00:00
a884aaf2f2f2f2f2f2f2f2f3,84,4,4,10,87,75,12,94.0,47,47,23,151,9.0,60,11,51,2.2,21,2029,30,105100.0,25,94.0,sous station,9.4,202.5,23.0,60.0,4/4,4/4/2029,21:30,2029-04-04T21:30:00,25.12,267125272015603,2029-04-04T21:30:00+00:00,2029-04-04T21:30:00+02:00,2029-04-04T21:30:00+00:00,2029-04-04T21:30:00+00:00
a98ca0f2f2f2f2f2f2f2f2f3,84,12,12,10,7,75,12,94.0,47,47,23,151,9.0,60,11,51,2.2,1,2029,30,105100.0,25,94.0,sous station,9.4,202.5,23.0,60.0,12/12,12/12/2029,1:30,2029-12-12T01:30:00,25.12,267125272015603,2029-12-12T01:30:00+00:00,2029-12-12T01:30:00+01:00,2029-12-12T01:30:00+00:00,2029-12-12T01:30:00+00:00
a8988af2f2f2f2f2f2f2f2f3,84,4,24,8,87,75,12,94.0,47,47,23,151,9.0,60,11,51,2.2,21,2027,30,105100.0,25,94.0,sous station,9.4,202.5,23.0,60.0,24/4,24/4/2027,21:30,2027-04-24T21:30:00,25.12,267125272015603,2027-04-24T21:30:00+00:00,2027-04-24T21:30:00+02:00,2027-04-24T21:30:00+00:00,2027-04-24T21:30:00+00:00
a898a2f2f2f2f2f2f2f2f2f3,84,4,24,10,23,75,12,94.0,47,47,23,151,9.0,60,11,51,2.2,5,2029,30,105100.0,25,94.0,sous station,9.4,202.5,23.0,60.0,24/4,24/4/2029,5:30,2029-04-24T05:30:00,25.12,267125272015603,2029-04-24T05:30:00+00:00,2029-04-24T05:30:00+02:00,2029-04-24T05:30:00+00:00,2029-04-24T05:30:00+00:00
a890b0f2f2f2f2f2f2f2f2f3,84,4,16,11,7,75,12,94.0,47,47,23,151,9.0,60,11,51,2.2,1,2030,30,105100.0,25,94.0,sous station,9.4,202.5,23.0,60.0,16/4,16/4/2030,1:30,2030-04-16T01:30:00,25.12,267125272015603,2030-04-16T01:30:00+00:00,2030-04-16T01:30:00+02:00,2030-04-16T01:30:00+00:00,2030-04-16T01:30:00+00:00
a910b0f2f2f2f2f2f2f2f2f3,84,8,16,11,7,75,12,94.0,47,47,23,151,9.0,60,11,51,2.2,1,2030,30,105100.0,25,94.0,sous station,9.4,202.5,23.0,60.0,16/8,16/8/2030,1:30,2030-08-16T01:30:00,25.12,267125272015603,2030-08-16T01:30:00+00:00,2030-08-16T01:30:00+02:00,2030-08-16T01:30:00+00:00,2030-08-16T01:30:00+00:00
a910baf2f2f2f2f2f2f2f2f3,84,8,16,11,87,75,12,94.0,47,47,23,151,9.0,60,11,51,2.2,21,2030,30,105100.0,25,94.0,sous station,9.4,202.5,23.0,60.0,16/8,16/8/2030,21:30,2030-08-16T21:30:00,25.12,267125272015603,2030-08-16T21:30:00+00:00,2030-08-16T21:30:00+02:00,2030-08-16T21:30:00+00:00,2030-08-16T21:30:00+00:00
a91498f2f2f2f2f2f2f2f2f3,84,8,20,9,71,75,12,94.0,47,47,23,151,9.0,60,11,51,2.2,17,2028,30,105100.0,25,94.0,sous station,9.4,202.5,23.0,60.0,20/8,20/8/2028,17:30,2028-08-20T17:30:00,25.12,267125272015603,2028-08-20T17:30:00+00:00,2028-08-20T17:30:00+02:00,2028-08-20T17:30:00+00:00,2028-08-20T17:30:00+00:00
a9149af2f2f2f2f2f2f2f2f3,84,8,20,9,87,75,12,94.0,47,47,23,151,9.0,60,11,51,2.2,21,2028,30,105100.0,25,94.0,sous station,9.4,202.5,23.0,60.0,20/8,20/8/2028,21:30,2028-08-20T21:30:00,25.12,267125272015603,2028-08-20T21:30:00+00:00,2028-08-20T21:30:00+02:00,2028-08-20T21:30:00+00:00,2028-08-20T21:30:00+00:00
a92c80f2f2f2f2f2f2f2f2f3,84,9,12,8,7,75,12,94.0,47,47,23,151,9.0,60,11,51,2.2,1,2027,30,105100.0,25,94.0,sous station,9.4,202.5,23.0,60.0,12/9,12/9/2027,1:30,2027-09-12T01:30:00,25.12,267125272015603,2027-09-12T01:30:00+00:00,2027-09-12T01:30:00+02:00,2027-09-12T01:30:00+00:00,2027-09-12T01:30:00+00:00
aa84a8f2f2f2f2f2f2f2f2f3,85,4,4,10,71,75,12,94.0,47,47,23,151,9.0,60,11,51,2.2,17,2029,30,105100.0,25,94.0,sous station,9.4,202.5,23.0,60.0,4/4,4/4/2029,17:30,2029-04-04T17:30:00,25.12,267125272015603,2029-04-04T17:30:00+00:00,2029-04-04T17:30:00+02:00,2029-04-04T17:30:00+00:00,2029-04-04T17:30:00+00:00
aa8880f2f2f2f2f2f2f2f2f3,85,4,8,8,7,75,12,94.0,47,47,23,151,9.0,60,11,51,2.2,1,2027,30,105100.0,25,94.0,sous station,9.4,202.5,23.0,60.0,8/4,8/4/2027,1:30,2027-04-08T01:30:00,25.12,267125272015603,2027-04-08T01:30:00+00:00,2027-04-08T01:30:00+02:00,2027-04-08T01:30:00+00:00,2027-04-08T01:30:00+00:00
a8cca0f2f2f2f2f2f2f2f2f3,84,6,12,10,7,75,12,94.0,47,47,23,151,9.0,60,11,51,2.2,1,2029,30,105100.0,25,94.0,sous station,9.4,202.5,23.0,60.0,12/6,12/6/2029,1:30,2029-06-12T01:30:00,25.12,267125272015603,2029-06-12T01:30:00+00:00,2029-06-12T01:30:00+02:00,2029-06-12T01:30:00+00:00,2029-06-12T01:30:00+00:00
a8d898f2f2f2f2f2f2f2f2f3,84,6,24,9,71,75,12,94.0,47,47,23,151,9.0,60,11,51,2.2,17,2028,30,105100.0,25,94.0,sous station,9.4,202.5,23.0,60.0,24/6,24/6/2028,17:30,2028-06-24T17:30:00,25.12,267125272015603,2028-06-24T17:30:00+00:00,2028-06-24T17:30:00+02:00,2028-06-24T17:30:00+00:00,2028-06-24T17:30:00+00:00
a938a0f2f2f2f2f2f2f2f2f3,84,9,24,10,7,75,12,94.0,47,47,23,151,9.0,60,11,51,2.2,1,2029,30,105100.0,25,94.0,sous station,9.4,202.5,23.0,60.0,24/9,24/9/2029,1:30,2029-09-24T01:30:00,25.12,267125272015603,2029-09-24T01:30:00+00:00,2029-09-24T01:30:00+02:00,2029-09-24T01:30:00+00:00,2029-09-24T01:30:00+00:00
a924b2f2f2f2f2f2f2f2f2f3,84,9,4,11,23,75,12,94.0,47,47,23,151,9.0,60,11,51,2.2,5,2030,30,105100.0,25,94.0,sous station,9.4,202.5,23.0,60.0,4/9,4/9/2030,5:30,2030-09-04T05:30:00,25.12,267125272015603,2030-09-04T05:30:00+00:00,2030-09-04T05:30:00+02:00,2030-09-04T05:30:00+00:00,2030-09-04T05:30:00+00:00
a924b8f2f2f2f2f2f2f2f2f3,84,9,4,11,71,75,12,94.0,47,47,23,151,9.0,60,11,51,2.2,17,2030,30,105100.0,25,94.0,sous station,9.4,202.5,23.0,60.0,4/9,4/9/2030,17:30,2030-09-04T17:30:00,25.12,267125272015603,2030-09-04T17:30:00+00:00,2030-09-04T17:30:00+02:00,2030-09-04T17:30:00+00:00,2030-09-04T17:30:00+00:00
a9249af2f2f2f2f2f2f2f2f3,84,9,4,9,87,75,12,94.0,47,47,23,151,9.0,60,11,51,2.2,21,2028,30,105100.0,25,94.0,sous station,9.4,202.5,23.0,60.0,4/9,4/9/2028,21:30,2028-09-04T21:30:00,25.12,267125272015603,2028-09-04T21:30:00+00:00,2028-09-04T21:30:00+02:00,2028-09-04T21:30:00+00:00,2028-09-04T21:30:00+00:00
a924a6f2f2f2f2f2f2f2f2f3,84,9,4,10,55,75,12,94.0,47,47,23,151,9.0,60,11,51,2.2,13,2029,30,105100.0,25,94.0,sous station,9.4,202.5,23.0,60.0,4/9,4/9/2029,13:30,2029-09-04T13:30:00,25.12,267125272015603,2029-09-04T13:30:00+00:00,2029-09-04T13:30:00+02:00,2029-09-04T13:30:00+00:00,2029-09-04T13:30:00+00:00
a8ec86f2f2f2f2f2f2f2f2f3,84,7,12,8,55,75,12,94.0,47,47,23,151,9.0,60,11,51,2.2,13,2027,30,105100.0,25,94.0,sous station,9.4,202.5,23.0,60.0,12/7,12/7/2027,13:30,2027-07-12T13:30:00,25.12,267125272015603,2027-07-12T13:30:00+00:00,2027-07-12T13:30:00+02:00,2027-07-12T13:30:00+00:00,2027-07-12T13:30:00+00:00
a934b0f2f2f2f2f2f2f2f2f3,84,9,20,11,7,75,12,94.0,47,47,23,151,9.0,60,11,51,2.2,1,2030,30,105100.0,25,94.0,sous station,9.4,202.5,23.0,60.0,20/9,20/9/2030,1:30,2030-09-20T01:30:00,25.12,267125272015603,2030-09-20T01:30:00+00:00,2030-09-20T01:30:00+02:00,2030-09-20T01:30:00+00:00,2030-09-20T01:30:00+00:00
a96cb6f2f2f2f2f2f2f2f2f3,84,11,12,11,55,75,12,94.0,47,47,23,151,9.0,60,11,51,2.2,13,2030,30,105100.0,25,94.0,sous station,9.4,202.5,23.0,60.0,12/11,12/11/2030,13:30,2030-11-12T13:30:00,25.12,267125272015603,2030-11-12T13:30:00+00:00,2030-11-12T13:30:00+01:00,2030-11-12T13:30:00+00:00,2030-11-12T13:30:00+00:00
ae3472f2f2f2f2f2f2f2f2f3,87,1,20,7,23,75,12,94.0,47,47,23,151,9.0,60,11,51,2.2,5,2026,30,105100.0,25,94.0,sous station,9.4,202.5,23.0,60.0,20/1,20/1/2026,5:30,2026-01-20T05:30:00,25.12,267125272015603,2026-01-20T05:30:00+00:00,2026-01-20T05:30:00+01:00,2026-01-20T05:30:00+00:00,2026-01-20T05:30:00+00:00
a968b0f2f2f2f2f2f2f2f2f3,84,11,8,11,7,75,12,94.0,47,47,23,151,9.0,60,11,51,2.2,1,2030,30,105100.0,25,94.0,sous station,9.4,202.5,23.0,60.0,8/11,8/11/2030,1:30,2030-11-08T01:30:00,25.12,267125272015603,2030-11-08T01:30:00+00:00,2030-11-08T01:30:00+01:00,2030-11-08T01:30:00+00:00,2030-11-08T01:30:00+00:00
a970b8f2f2f2f2f2f2f2f2f3,84,11,16,11,71,75,12,94.0,47,47,23,151,9.0,60,11,51,2.2,17,2030,30,105100.0,25,94.0,sous station,9.4,202.5,23.0,60.0,16/11,16/11/2030,17:30,2030-11-16T17:30:00,25.12,267125272015603,2030-11-16T17:30:00+00:00,2030-11-16T17:30:00+01:00,2030-11-16T17:30:00+00:00,2030-11-16T17:30:00+00:00
a9909af2f2f2f2f2f2f2f2f3,84,12,16,9,87,75,12,94.0,47,47,23,151,9.0,60,11,51,2.2,21,2028,30,105100.0,25,94.0,sous station,9.4,202.5,23.0,60.0,16/12,16/12/2028,21:30,2028-12-16T21:30:00,25.12,267125272015603,2028-12-16T21:30:00+00:00,2028-12-16T21:30:00+01:00,2028-12-16T21:30:00+00:00,2028-12-16T21:30:00+00:00
aa2c98f2f2f2f2f2f2f2f2f3,85,1,12,9,71,75,12,94.0,47,47,23,151,9.0,60,11,51,2.2,17,2028,30,105100.0,25,94.0,sous station,9.4,202.5,23.0,60.0,12/1,12/1/2028,17:30,2028-01-12T17:30:00,25.12,267125272015603,2028-01-12T17:30:00+00:00,2028-01-12T17:30:00+01:00,2028-01-12T17:30:00+00:00,2028-01-12T17:30:00+00:00
aa3080f2f2f2f2f2f2f2f2f3,85,1,16,8,7,75,12,94.0,47,47,23,151,9.0,60,11,51,2.2,1,2027,30,105100.0,25,94.0,sous station,9.4,202.5,23.0,60.0,16/1,16/1/2027,1:30,2027-01-16T01:30:00,25.12,267125272015603,2027-01-16T01:30:00+00:00,2027-01-16T01:30:00+01:00,2027-01-16T01:30:00+00:00,2027-01-16T01:30:00+00:00
a88ca2f2f2f2f2f2f2f2f2f3,84,4,12,10,23,75,12,94.0,47,47,23,151,9.0,60,11,51,2.2,5,2029,30,105100.0,25,94.0,sous station,9.4,202.5,23.0,60.0,12/4,12/4/2029,5:30,2029-04-12T05:30:00,25.12,267125272015603,2029-04-12T05:30:00+00:00,2029-04-12T05:30:00+02:00,2029-04-12T05:30:00+00:00,2029-04-12T05:30:00+00:00
ae7c7af2f2f2f2f2f2f2f2f3,87,3,28,7,87,75,12,94.0,47,47,23,151,9.0,60,11,51,2.2,21,2026,30,105100.0,25,94.0,sous station,9.4,202.5,23.0,60.0,28/3,28/3/2026,21:30,2026-03-28T21:30:00,25.12,267125272015603,2026-03-28T21:30:00+00:00,2026-03-28T21:30:00+01:00,2026-03-28T21:30:00+00:00,2026-03-28T21:30:00+00:00
a8bcb6f2f2f2f2f2f2f2f2f3,84,5,28,11,55,75,12,94.0,47,47,23,151,9.0,60,11,51,2.2,13,2030,30,105100.0,25,94.0,sous station,9.4,202.5,23.0,60.0,28/5,28/5/2030,13:30,2030-05-28T13:30:00,25.12,267125272015603,2030-05-28T13:30:00+00:00,2030-05-28T13:30:00+02:00,2030-05-28T13:30:00+00:00,2030-05-28T13:30:00+00:00
aa48b2f2f2f2f2f2f2f2f2f3,85,2,8,11,23,75,12,94.0,47,47,23,151,9.0,60,11,51,2.2,5,2030,30,105100.0,25,94.0,sous station,9.4,202.5,23.0,60.0,8/2,8/2/2030,5:30,2030-02-08T05:30:00,25.12,267125272015603,2030-02-08T05:30:00+00:00,2030-02-08T05:30:00+01:00,2030-02-08T05:30:00+00:00,2030-02-08T05:30:00+00:00
a8f482f2f2f2f2f2f2f2f2f3,84,7,20,8,23,75,12,94.0,47,47,23,151,9.0,60,11,51,2.2,5,2027,30,105100.0,25,94.0,sous station,9.4,202.5,23.0,60.0,20/7,20/7/2027,5:30,2027-07-20T05:30:00,25.12,267125272015603,2027-07-20T05:30:00+00:00,2027-07-20T05:30:00+02:00,2027-07-20T05:30:00+00:00,2027-07-20T05:30:00+00:00
a898b4f2f2f2f2f2f2f2f2f3,84,4,24,11,39,75,12,94.0,47,47,23,151,9.0,60,11,51,2.2,9,2030,30,105100.0,25,94.0,sous station,9.4,202.5,23.0,60.0,24/4,24/4/2030,9:30,2030-04-24T09:30:00,25.12,267125272015603,2030-04-24T09:30:00+00:00,2030-04-24T09:30:00+02:00,2030-04-24T09:30:00+00:00,2030-04-24T09:30:00+00:00
a898baf2f2f2f2f2f2f2f2f3,84,4,24,11,87,75,12,94.0,47,47,23,151,9.0,60,11,51,2.2,21,2030,30,105100.0,25,94.0,sous station,9.4,202.5,23.0,60.0,24/4,24/4/2030,21:30,2030-04-24T21:30:00,25.12,267125272015603,2030-04-24T21:30:00+00:00,2030-04-24T21:30:00+02:00,2030-04-24T21:30:00+00:00,2030-04-24T21:30:00+00:00
a88cb6f2f2f2f2f2f2f2f2f3,84,4,12,11,55,75,12,94.0,47,47,23,151,9.0,60,11,51,2.2,13,2030,30,105100.0,25,94.0,sous station,9.4,202.5,23.0,60.0,12/4,12/4/2030,13:30,2030-04-12T13:30:00,25.12,267125272015603,2030-04-12T13:30:00+00:00,2030-04-12T13:30:00+02:00,2030-04-12T13:30:00+00:00,2030-04-12T13:30:00+00:00
a8fcaaf2f2f2f2f2f2f2f2f3,84,7,28,10,87,75,12,94.0,47,47,23,151,9.0,60,11,51,2.2,21,2029,30,105100.0,25,94.0,sous station,9.4,202.5,23.0,60.0,28/7,28/7/2029,21:30,2029-07-28T21:30:00,25.12,267125272015603,2029-07-28T21:30:00+00:00,2029-07-28T21:30:00+02:00,2029-07-28T21:30:00+00:00,2029-07-28T21:30:00+00:00
a8bc82f2f2f2f2f2f2f2f2f3,84,5,28,8,23,75,12,94.0,47,47,23,151,9.0,60,11,51,2.2,5,2027,30,105100.0,25,94.0,sous station,9.4,202.5,23.0,60.0,28/5,28/5/2027,5:30,2027-05-28T05:30:00,25.12,267125272015603,2027-05-28T05:30:00+00:00,2027-05-28T05:30:00+02:00,2027-05-28T05:30:00+00:00,2027-05-28T05:30:00+00:00
a8fca6f2f2f2f2f2f2f2f2f3,84,7,28,10,55,75,12,94.0,47,47,23,151,9.0,60,11,51,2.2,13,2029,30,105100.0,25,94.0,sous station,9.4,202.5,23.0,60.0,28/7,28/7/2029,13:30,2029-07-28T13:30:00,25.12,267125272015603,2029-07-28T13:30:00+00:00,2029-07-28T13:30:00+02:00,2029-07-28T13:30:00+00:00,2029-07-28T13:30:00+00:00
a90ca2f2f2f2f2f2f2f2f2f3,84,8,12,10,23,75,12,94.0,47,47,23,151,9.0,60,11,51,2.2,5,2029,30,105100.0,25,94.0,sous station,9.4,202.5,23.0,60.0,12/8,12/8/2029,5:30,2029-08-12T05:30:00,25.12,267125272015603,2029-08-12T05:30:00+00:00,2029-08-12T05:30:00+02:00,2029-08-12T05:30:00+00:00,2029-08-12T05:30:00+00:00
a8c8a4f2f2f2f2f2f2f2f2f3,84,6,8,10,39,75,12,94.0,47,47,23,151,9.0,60,11,51,2.2,9,2029,30,105100.0,25,94.0,sous station,9.4,202.5,23.0,60.0,8/6,8/6/2029,9:30,2029-06-08T09:30:00,25.12,267125272015603,2029-06-08T09:30:00+00:00,2029-06-08T09:30:00+02:00,2029-06-08T09:30:00+00:00,2029-06-08T09:30:00+00:00
a8d8b6f2f2f2f2f2f2f2f2f3,84,6,24,11,55,75,12,94.0,47,47,23,151,9.0,60,11,51,2.2,13,2030,30,105100.0,25,94.0,sous station,9.4,202.5,23.0,60.0,24/6,24/6/2030,13:30,2030-06-24T13:30:00,25.12,267125272015603,2030-06-24T13:30:00+00:00,2030-06-24T13:30:00+02:00,2030-06-24T13:30:00+00:00,2030-06-24T13:30:00+00:00
a8dc8af2f2f2f2f2f2f2f2f3,84,6,28,8,87,75,12,94.0,47,47,23,151,9.0,60,11,51,2.2,21,2027,30,105100.0,25,94.0,sous station,9.4,202.5,23.0,60.0,28/6,28/6/2027,21:30,2027-06-28T21:30:00,25.12,267125272015603,2027-06-28T21:30:00+00:00,2027-06-28T21:30:00+02:00,2027-06-28T21:30:00+00:00,2027-06-28T21:30:00+00:00
a8dcaaf2f2f2f2f2f2f2f2f3,84,6,28,10,87,75,12,94.0,47,47,23,151,9.0,60,11,51,2.2,21,2029,30,105100.0,25,94.0,sous station,9.4,202.5,23.0,60.0,28/6,28/6/2029,21:30,2029-06-28T21:30:00,25.12,267125272015603,2029-06-28T21:30:00+00:00,2029-06-28T21:30:00+02:00,2029-06-28T21:30:00+00:00,2029-06-28T21:30:00+00:00
a8f4a6f2f2f2f2f2f2f2f2f3,84,7,20,10,55,75,12,94.0,47,47,23,151,9.0,60,11,51,2.2,13,2029,30,105100.0,25,94.0,sous station,9.4,202.5,23.0,60.0,20/7,20/7/2029,13:30,2029-07-20T13:30:00,25.12,267125272015603,2029-07-20T13:30:00+00:00,2029-07-20T13:30:00+02:00,2029-07-20T13:30:00+00:00,2029-07-20T13:30:00+00:00
aa68b8f2f2f2f2f2f2f2f2f3,85,3,8,11,71,75,12,94.0,47,47,23,151,9.0,60,11,51,2.2,17,2030,30,105100.0,25,94.0,sous station,9.4,202.5,23.0,60.0,8/3,8/3/2030,17:30,2030-03-08T17:30:00,25.12,267125272015603,2030-03-08T17:30:00+00:00,2030-03-08T17:30:00+01:00,2030-03-08T17:30:00+00:00,2030-03-08T17:30:00+00:00
aab0b8f2f2f2f2f2f2f2f2f3,85,5,16,11,71,75,12,94.0,47,47,23,151,9.0,60,11,51,2.2,17,2030,30,105100.0,25,94.0,sous station,9.4,202.5,23.0,60.0,16/5,16/5/2030,17:30,2030-05-16T17:30:00,25.12,267125272015603,2030-05-16T17:30:00+00:00,2030-05-16T17:30:00+02:00,2030-05-16T17:30:00+00:00,2030-05-16T17:30:00+00:00
aa6cb2f2f2f2f2f2f2f2f2f3,85,3,12,11,23,75,12,94.0,47,47,23,151,9.0,60,11,51,2.2,5,2030,30,105100.0,25,94.0,sous station,9.4,202.5,23.0,60.0,12/3,12/3/2030,5:30,2030-03-12T05:30:00,25.12,267125272015603,2030-03-12T05:30:00+00:00,2030-03-12T05:30:00+01:00,2030-03-12T05:30:00+00:00,2030-03-12T05:30:00+00:00
aa70aaf2f2f2f2f2f2f2f2f3,85,3,16,10,87,75,12,94.0,47,47,23,151,9.0,60,11,51,2.2,21,2029,30,105100.0,25,94.0,sous station,9.4,202.5,23.0,60.0,16/3,16/3/2029,21:30,2029-03-16T21:30:00,25.12,267125272015603,2029-03-16T21:30:00+00:00,2029-03-16T21:30:00+01:00,2029-03-16T21:30:00+00:00,2029-03-16T21:30:00+00:00
aac4b4f2f2f2f2f2f2f2f2f3,85,6,4,11,39,75,12,94.0,47,47,23,151,9.0,60,11,51,2.2,9,2030,30,105100.0,25,94.0,sous station,9.4,202.5,23.0,60.0,4/6,4/6/2030,9:30,2030-06-04T09:30:00,25.12,267125272015603,2030-06-04T09:30:00+00:00,2030-06-04T09:30:00+02:00,2030-06-04T09:30:00+00:00,2030-06-04T09:30:00+00:00
aabc86f2f2f2f2f2f2f2f2f3,85,5,28,8,55,75,12,94.0,47,47,23,151,9.0,60,11,51,2.2,13,2027,30,105100.0,25,94.0,sous station,9.4,202.5,23.0,60.0,28/5,28/5/2027,13:30,2027-05-28T13:30:00,25.12,267125272015603,2027-05-28T13:30:00+00:00,2027-05-28T13:30:00+02:00,2027-05-28T13:30:00+00:00,2027-05-28T13:30:00+00:00
aaacb0f2f2f2f2f2f2f2f2f3,85,5,12,11,7,75,12,94.0,47,47,23,151,9.0,60,11,51,2.2,1,2030,30,105100.0,25,94.0,sous station,9.4,202.5,23.0,60.0,12/5,12/5/2030,1:30,2030-05-12T01:30:00,25.12,267125272015603,2030-05-12T01:30:00+00:00,2030-05-12T01:30:00+02:00,2030-05-12T01:30:00+00:00,2030-05-12T01:30:00+00:00
aaacb4f2f2f2f2f2f2f2f2f3,85,5,12,11,39,75,12,94.0,47,47,23,151,9.0,60,11,51,2.2,9,2030,30,105100.0,25,94.0,sous station,9.4,202.5,23.0,60.0,12/5,12/5/2030,9:30,2030-05-12T09:30:00,25.12,267125272015603,2030-05-12T09:30:00+00:00,2030-05-12T09:30:00+02:00,2030-05-12T09:30:00+00:00,2030-05-12T09:30:00+00:00
aab4a6f2f2f2f2f2f2f2f2f3,85,5,20,10,55,75,12,94.0,47,47,23,151,9.0,60,11,51,2.2,13,2029,30,105100.0,25,94.0,sous station,9.4,202.5,23.0,60.0,20/5,20/5/2029,13:30,2029-05-20T13:30:00,25.12,267125272015603,2029-05-20T13:30:00+00:00,2029-05-20T13:30:00+02:00,2029-05-20T13:30:00+00:00,2029-05-20T13:30:00+00:00
aac8a2f2f2f2f2f2f2f2f2f3,85,6,8,10,23,75,12,94.0,47,47,23,151,9.0,60,11,51,2.2,5,2029,30,105100.0,25,94.0,sous station,9.4,202.5,23.0,60.0,8/6,8/6/2029,5:30,2029-06-08T05:30:00,25.12,267125272015603,2029-06-08T05:30:00+00:00,2029-06-08T05:30:00+02:00,2029-06-08T05:30:00+00:00,2029-06-08T05:30:00+00:00
aa90b0f2f2f2f2f2f2f2f2f3,85,4,16,11,7,75,12,94.0,47,47,23,151,9.0,60,11,51,2.2,1,2030,30,105100.0,25,94.0,sous station,9.4,202.5,23.0,60.0,16/4,16/4/2030,1:30,2030-04-16T01:30:00,25.12,267125272015603,2030-04-16T01:30:00+00:00,2030-04-16T01:30:00+02:00,2030-04-16T01:30:00+00:00,2030-04-16T01:30:00+00:00
aa5c98f2f2f2f2f2f2f2f2f3,85,2,28,9,71,75,12,94.0,47,47,23,151,9.0,60,11,51,2.2,17,2028,30,105100.0,25,94.0,sous station,9.4,202.5,23.0,60.0,28/2,28/2/2028,17:30,2028-02-28T17:30:00,25.12,267125272015603,2028-02-28T17:30:00+00:00,2028-02-28T17:30:00+01:00,2028-02-28T17:30:00+00:00,2028-02-28T17:30:00+00:00
aab4aaf2f2f2f2f2f2f2f2f3,85,5,20,10,87,75,12,94.0,47,47,23,151,9.0,60,11,51,2.2,21,2029,30,105100.0,25,94.0,sous station,9.4,202.5,23.0,60.0,20/5,20/5/2029,21:30,2029-05-20T21:30:00,25.12,267125272015603,2029-05-20T21:30:00+00:00,2029-05-20T21:30:00+02:00,2029-05-20T21:30:00+00:00,2029-05-20T21:30:00+00:00
ae3878f2f2f2f2f2f2f2f2f3,87,1,24,7,71,75,12,94.0,47,47,23,151,9.0,60,11,51,2.2,17,2026,30,105100.0,25,94.0,sous station,9.4,202.5,23.0,60.0,24/1,24/1/2026,17:30,2026-01-24T17:30:00,25.12,267125272015603,2026-01-24T17:30:00+00:00,2026-01-24T17:30:00+01:00,2026-01-24T17:30:00+00:00,2026-01-24T17:30:00+00:00
aacc92f2f2f2f2f2f2f2f2f3,85,6,12,9,23,75,12,94.0,47,47,23,151,9.0,60,11,51,2.2,5,2028,30,105100.0,25,94.0,sous station,9.4,202.5,23.0,60.0,12/6,12/6/2028,5:30,2028-06-12T05:30:00,25.12,267125272015603,2028-06-12T05:30:00+00:00,2028-06-12T05:30:00+02:00,2028-06-12T05:30:00+00:00,2028-06-12T05:30:00+00:00
aaccb8f2f2f2f2f2f2f2f2f3,85,6,12,11,71,75,12,94.0,47,47,23,151,9.0,60,11,51,2.2,17,2030,30,105100.0,25,94.0,sous station,9.4,202.5,23.0,60.0,12/6,12/6/2030,17:30,2030-06-12T17:30:00,25.12,267125272015603,2030-06-12T17:30:00+00:00,2030-06-12T17:30:00+02:00,2030-06-12T17:30:00+00:00,2030-06-12T17:30:00+00:00
aaa8a0f2f2f2f2f2f2f2f2f3,85,5,8,10,7,75,12,94.0,47,47,23,151,9.0,60,11,51,2.2,1,2029,30,105100.0,25,94.0,sous station,9.4,202.5,23.0,60.0,8/5,8/5/2029,1:30,2029-05-08T01:30:00,25.12,267125272015603,2029-05-08T01:30:00+00:00,2029-05-08T01:30:00+02:00,2029-05-08T01:30:00+00:00,2029-05-08T01:30:00+00:00
aa88a0f2f2f2f2f2f2f2f2f3,85,4,8,10,7,75,12,94.0,47,47,23,151,9.0,60,11,51,2.2,1,2029,30,105100.0,25,94.0,sous station,9.4,202.5,23.0,60.0,8/4,8/4/2029,1:30,2029-04-08T01:30:00,25.12,267125272015603,2029-04-08T01:30:00+00:00,2029-04-08T01:30:00+02:00,2029-04-08T01:30:00+00:00,2029-04-08T01:30:00+00:00
aa88b2f2f2f2f2f2f2f2f2f3,85,4,8,11,23,75,12,94.0,47,47,23,151,9.0,60,11,51,2.2,5,2030,30,105100.0,25,94.0,sous station,9.4,202.5,23.0,60.0,8/4,8/4/2030,5:30,2030-04-08T05:30:00,25.12,267125272015603,2030-04-08T05:30:00+00:00,2030-04-08T05:30:00+02:00,2030-04-08T05:30:00+00:00,2030-04-08T05:30:00+00:00
aa9ca2f2f2f2f2f2f2f2f2f3,85,4,28,10,23,75,12,94.0,47,47,23,151,9.0,60,11,51,2.2,5,2029,30,105100.0,25,94.0,sous station,9.4,202.5,23.0,60.0,28/4,28/4/2029,5:30,2029-04-28T05:30:00,25.12,267125272015603,2029-04-28T05:30:00+00:00,2029-04-28T05:30:00+02:00,2029-04-28T05:30:00+00:00,2029-04-28T05:30:00+00:00
aaa4aaf2f2f2f2f2f2f2f2f3,85,5,4,10,87,75,12,94.0,47,47,23,151,9.0,60,11,51,2.2,21,2029,30,105100.0,25,94.0,sous station,9.4,202.5,23.0,60.0,4/5,4/5/2029,21:30,2029-05-04T21:30:00,25.12,267125272015603,2029-05-04T21:30:00+00:00,2029-05-04T21:30:00+02:00,2029-05-04T21:30:00+00:00,2029-05-04T21:30:00+00:00
aaa498f2f2f2f2f2f2f2f2f3,85,5,4,9,71,75,12,94.0,47,47,23,151,9.0,60,11,51,2.2,17,2028,30,105100.0,25,94.0,sous station,9.4,202.5,23.0,60.0,4/5,4/5/2028,17:30,2028-05-04T17:30:00,25.12,267125272015603,2028-05-04T17:30:00+00:00,2028-05-04T17:30:00+02:00,2028-05-04T17:30:00+00:00,2028-05-04T17:30:00+00:00
ae5078f2f2f2f2f2f2f2f2f3,87,2,16,7,71,75,12,94.0,47,47,23,151,9.0,60,11,51,2.2,17,2026,30,105100.0,25,94.0,sous station,9.4,202.5,23.0,60.0,16/2,16/2/2026,17:30,2026-02-16T17:30:00,25.12,267125272015603,2026-02-16T17:30:00+00:00,2026-02-16T17:30:00+01:00,2026-02-16T17:30:00+00:00,2026-02-16T17:30:00+00:00
aad896f2f2f2f2f2f2f2f2f3,85,6,24,9,55,75,12,94.0,47,47,23,151,9.0,60,11,51,2.2,13,2028,30,105100.0,25,94.0,sous station,9.4,202.5,23.0,60.0,24/6,24/6/2028,13:30,2028-06-24T13:30:00,25.12,267125272015603,2028-06-24T13:30:00+00:00,2028-06-24T13:30:00+02:00,2028-06-24T13:30:00+00:00,2028-06-24T13:30:00+00:00
ae5076f2f2f2f2f2f2f2f2f3,87,2,16,7,55,75,12,94.0,47,47,23,151,9.0,60,11,51,2.2,13,2026,30,105100.0,25,94.0,sous station,9.4,202.5,23.0,60.0,16/2,16/2/2026,13:30,2026-02-16T13:30:00,25.12,267125272015603,2026-02-16T13:30:00+00:00,2026-02-16T13:30:00+01:00,2026-02-16T13:30:00+00:00,2026-02-16T13:30:00+00:00
a8aca4f2f2f2f2f2f2f2f2f3,84,5,12,10,39,75,12,94.0,47,47,23,151,9.0,60,11,51,2.2,9,2029,30,105100.0,25,94.0,sous station,9.4,202.5,23.0,60.0,12/5,12/5/2029,9:30,2029-05-12T09:30:00,25.12,267125272015603,2029-05-12T09:30:00+00:00,2029-05-12T09:30:00+02:00,2029-05-12T09:30:00+00:00,2029-05-12T09:30:00+00:00
a8b8a2f2f2f2f2f2f2f2f2f3,84,5,24,10,23,75,12,94.0,47,47,23,151,9.0,60,11,51,2.2,5,2029,30,105100.0,25,94.0,sous station,9.4,202.5,23.0,60.0,24/5,24/5/2029,5:30,2029-05-24T05:30:00,25.12,267125272015603,2029-05-24T05:30:00+00:00,2029-05-24T05:30:00+02:00,2029-05-24T05:30:00+00:00,2029-05-24T05:30:00+00:00
a8b8a4f2f2f2f2f2f2f2f2f3,84,5,24,10,39,75,12,94.0,47,47,23,151,9.0,60,11,51,2.2,9,2029,30,105100.0,25,94.0,sous station,9.4,202.5,23.0,60.0,24/5,24/5/2029,9:30,2029-05-24T09:30:00,25.12,267125272015603,2029-05-24T09:30:00+00:00,2029-05-24T09:30:00+02:00,2029-05-24T09:30:00+00:00,2029-05-24T09:30:00+00:00
a948a4f2f2f2f2f2f2f2f2f3,84,10,8,10,39,75,12,94.0,47,47,23,151,9.0,60,11,51,2.2,9,2029,30,105100.0,25,94.0,sous station,9.4,202.5,23.0,60.0,8/10,8/10/2029,9:30,2029-10-08T09:30:00,25.12,267125272015603,2029-10-08T09:30:00+00:00,2029-10-08T09:30:00+02:00,2029-10-08T09:30:00+00:00,2029-10-08T09:30:00+00:00
a94880f2f2f2f2f2f2f2f2f3,84,10,8,8,7,75,12,94.0,47,47,23,151,9.0,60,11,51,2.2,1,2027,30,105100.0,25,94.0,sous station,9.4,202.5,23.0,60.0,8/10,8/10/2027,1:30,2027-10-08T01:30:00,25.12,267125272015603,2027-10-08T01:30:00+00:00,2027-10-08T01:30:00+02:00,2027-10-08T01:30:00+00:00,2027-10-08T01:30:00+00:00
a94888f2f2f2f2f2f2f2f2f3,84,10,8,8,71,75,12,94.0,47,47,23,151,9.0,60,11,51,2.2,17,2027,30,105100.0,25,94.0,sous station,9.4,202.5,23.0,60.0,8/10,8/10/2027,17:30,2027-10-08T17:30:00,25.12,267125272015603,2027-10-08T17:30:00+00:00,2027-10-08T17:30:00+02:00,2027-10-08T17:30:00+00:00,2027-10-08T17:30:00+00:00
a94890f2f2f2f2f2f2f2f2f3,84,10,8,9,7,75,12,94.0,47,47,23,151,9.0,60,11,51,2.2,1,2028,30,105100.0,25,94.0,sous station,9.4,202.5,23.0,60.0,8/10,8/10/2028,1:30,2028-10-08T01:30:00,25.12,267125272015603,2028-10-08T01:30:00+00:00,2028-10-08T01:30:00+02:00,2028-10-08T01:30:00+00:00,2028-10-08T01:30:00+00:00
a95096f2f2f2f2f2f2f2f2f3,84,10,16,9,55,75,12,94.0,47,47,23,151,9.0,60,11,51,2.2,13,2028,30,105100.0,25,94.0,sous station,9.4,202.5,23.0,60.0,16/10,16/10/2028,13:30,2028-10-16T13:30:00,25.12,267125272015603,2028-10-16T13:30:00+00:00,2028-10-16T13:30:00+02:00,2028-10-16T13:30:00+00:00,2028-10-16T13:30:00+00:00
a96898f2f2f2f2f2f2f2f2f3,84,11,8,9,71,75,12,94.0,47,47,23,151,9.0,60,11,51,2.2,17,2028,30,105100.0,25,94.0,sous station,9.4,202.5,23.0,60.0,8/11,8/11/2028,17:30,2028-11-08T17:30:00,25.12,267125272015603,2028-11-08T17:30:00+00:00,2028-11-08T17:30:00+01:00,2028-11-08T17:30:00+00:00,2028-11-08T17:30:00+00:00
a910a0f2f2f2f2f2f2f2f2f3,84,8,16,10,7,75,12,94.0,47,47,23,151,9.0,60,11,51,2.2,1,2029,30,105100.0,25,94.0,sous station,9.4,202.5,23.0,60.0,16/8,16/8/2029,1:30,2029-08-16T01:30:00,25.12,267125272015603,2029-08-16T01:30:00+00:00,2029-08-16T01:30:00+02:00,2029-08-16T01:30:00+00:00,2029-08-16T01:30:00+00:00
a910aaf2f2f2f2f2f2f2f2f3,84,8,16,10,87,75,12,94.0,47,47,23,151,9.0,60,11,51,2.2,21,2029,30,105100.0,25,94.0,sous station,9.4,202.5,23.0,60.0,16/8,16/8/2029,21:30,2029-08-16T21:30:00,25.12,267125272015603,2029-08-16T21:30:00+00:00,2029-08-16T21:30:00+02:00,2029-08-16T21:30:00+00:00,2029-08-16T21:30:00+00:00
a948baf2f2f2f2f2f2f2f2f3,84,10,8,11,87,75,12,94.0,47,47,23,151,9.0,60,11,51,2.2,21,2030,30,105100.0,25,94.0,sous station,9.4,202.5,23.0,60.0,8/10,8/10/2030,21:30,2030-10-08T21:30:00,25.12,267125272015603,2030-10-08T21:30:00+00:00,2030-10-08T21:30:00+02:00,2030-10-08T21:30:00+00:00,2030-10-08T21:30:00+00:00
a930b2f2f2f2f2f2f2f2f2f3,84,9,16,11,23,75,12,94.0,47,47,23,151,9.0,60,11,51,2.2,5,2030,30,105100.0,25,94.0,sous station,9.4,202.5,23.0,60.0,16/9,16/9/2030,5:30,2030-09-16T05:30:00,25.12,267125272015603,2030-09-16T05:30:00+00:00,2030-09-16T05:30:00+02:00,2030-09-16T05:30:00+00:00,2030-09-16T05:30:00+00:00
a970b4f2f2f2f2f2f2f2f2f3,84,11,16,11,39,75,12,94.0,47,47,23,151,9.0,60,11,51,2.2,9,2030,30,105100.0,25,94.0,sous station,9.4,202.5,23.0,60.0,16/11,16/11/2030,9:30,2030-11-16T09:30:00,25.12,267125272015603,2030-11-16T09:30:00+00:00,2030-11-16T09:30:00+01:00,2030-11-16T09:30:00+00:00,2030-11-16T09:30:00+00:00
a96ca0f2f2f2f2f2f2f2f2f3,84,11,12,10,7,75,12,94.0,47,47,23,151,9.0,60,11,51,2.2,1,2029,30,105100.0,25,94.0,sous station,9.4,202.5,23.0,60.0,12/11,12/11/2029,1:30,2029-11-12T01:30:00,25.12,267125272015603,2029-11-12T01:30:00+00:00,2029-11-12T01:30:00+01:00,2029-11-12T01:30:00+00:00,2029-11-12T01:30:00+00:00
a96ca6f2f2f2f2f2f2f2f2f3,84,11,12,10,55,75,12,94.0,47,47,23,151,9.0,60,11,51,2.2,13,2029,30,105100.0,25,94.0,sous station,9.4,202.5,23.0,60.0,12/11,12/11/2029,13:30,2029-11-12T13:30:00,25.12,267125272015603,2029-11-12T13:30:00+00:00,2029-11-12T13:30:00+01:00,2029-11-12T13:30:00+00:00,2029-11-12T13:30:00+00:00
a92ca6f2f2f2f2f2f2f2f2f3,84,9,12,10,55,75,12,94.0,47,47,23,151,9.0,60,11,51,2.2,13,2029,30,105100.0,25,94.0,sous station,9.4,202.5,23.0,60.0,12/9,12/9/2029,13:30,2029-09-12T13:30:00,25.12,267125272015603,2029-09-12T13:30:00+00:00,2029-09-12T13:30:00+02:00,2029-09-12T13:30:00+00:00,2029-09-12T13:30:00+00:00
a98c88f2f2f2f2f2f2f2f2f3,84,12,12,8,71,75,12,94.0,47,47,23,151,9.0,60,11,51,2.2,17,2027,30,105100.0,25,94.0,sous station,9.4,202.5,23.0,60.0,12/12,12/12/2027,17:30,2027-12-12T17:30:00,25.12,267125272015603,2027-12-12T17:30:00+00:00,2027-12-12T17:30:00+01:00,2027-12-12T17:30:00+00:00,2027-12-12T17:30:00+00:00
aa28b8f2f2f2f2f2f2f2f2f3,85,1,8,11,71,75,12,94.0,47,47,23,151,9.0,60,11,51,2.2,17,2030,30,105100.0,25,94.0,sous station,9.4,202.5,23.0,60.0,8/1,8/1/2030,17:30,2030-01-08T17:30:00,25.12,267125272015603,2030-01-08T17:30:00+00:00,2030-01-08T17:30:00+01:00,2030-01-08T17:30:00+00:00,2030-01-08T17:30:00+00:00
aae4aaf2f2f2f2f2f2f2f2f3,85,7,4,10,87,75,12,94.0,47,47,23,151,9.0,60,11,51,2.2,21,2029,30,105100.0,25,94.0,sous station,9.4,202.5,23.0,60.0,4/7,4/7/2029,21:30,2029-07-04T21:30:00,25.12,267125272015603,2029-07-04T21:30:00+00:00,2029-07-04T21:30:00+02:00,2029-07-04T21:30:00+00:00,2029-07-04T21:30:00+00:00
aae4b0f2f2f2f2f2f2f2f2f3,85,7,4,11,7,75,12,94.0,47,47,23,151,9.0,60,11,51,2.2,1,2030,30,105100.0,25,94.0,sous station,9.4,202.5,23.0,60.0,4/7,4/7/2030,1:30,2030-07-04T01:30:00,25.12,267125272015603,2030-07-04T01:30:00+00:00,2030-07-04T01:30:00+02:00,2030-07-04T01:30:00+00:00,2030-07-04T01:30:00+00:00
aae8a8f2f2f2f2f2f2f2f2f3,85,7,8,10,71,75,12,94.0,47,47,23,151,9.0,60,11,51,2.2,17,2029,30,105100.0,25,94.0,sous station,9.4,202.5,23.0,60.0,8/7,8/7/2029,17:30,2029-07-08T17:30:00,25.12,267125272015603,2029-07-08T17:30:00+00:00,2029-07-08T17:30:00+02:00,2029-07-08T17:30:00+00:00,2029-07-08T17:30:00+00:00
aa3894f2f2f2f2f2f2f2f2f3,85,1,24,9,39,75,12,94.0,47,47,23,151,9.0,60,11,51,2.2,9,2028,30,105100.0,25,94.0,sous station,9.4,202.5,23.0,60.0,24/1,24/1/2028,9:30,2028-01-24T09:30:00,25.12,267125272015603,2028-01-24T09:30:00+00:00,2028-01-24T09:30:00+01:00,2028-01-24T09:30:00+00:00,2028-01-24T09:30:00+00:00
aa4884f2f2f2f2f2f2f2f2f3,85,2,8,8,39,75,12,94.0,47,47,23,151,9.0,60,11,51,2.2,9,2027,30,105100.0,25,94.0,sous station,9.4,202.5,23.0,60.0,8/2,8/2/2027,9:30,2027-02-08T09:30:00,25.12,267125272015603,2027-02-08T09:30:00+00:00,2027-02-08T09:30:00+01:00,2027-02-08T09:30:00+00:00,2027-02-08T09:30:00+00:00
aa5c96f2f2f2f2f2f2f2f2f3,85,2,28,9,55,75,12,94.0,47,47,23,151,9.0,60,11,51,2.2,13,2028,30,105100.0,25,94.0,sous station,9.4,202.5,23.0,60.0,28/2,28/2/2028,13:30,2028-02-28T13:30:00,25.12,267125272015603,2028-02-28T13:30:00+00:00,2028-02-28T13:30:00+01:00,2028-02-28T13:30:00+00:00,2028-02-28T13:30:00+00:00
aa78b2f2f2f2f2f2f2f2f2f3,85,3,24,11,23,75,12,94.0,47,47,23,151,9.0,60,11,51,2.2,5,2030,30,105100.0,25,94.0,sous station,9.4,202.5,23.0,60.0,24/3,24/3/2030,5:30,2030-03-24T05:30:00,25.12,267125272015603,2030-03-24T05:30:00+00:00,2030-03-24T05:30:00+01:00,2030-03-24T05:30:00+00:00,2030-03-24T05:30:00+00:00
aa8488f2f2f2f2f2f2f2f2f3,85,4,4,8,71,75,12,94.0,47,47,23,151,9.0,60,11,51,2.2,17,2027,30,105100.0,25,94.0,sous station,9.4,202.5,23.0,60.0,4/4,4/4/2027,17:30,2027-04-04T17:30:00,25.12,267125272015603,2027-04-04T17:30:00+00:00,2027-04-04T17:30:00+02:00,2027-04-04T17:30:00+00:00,2027-04-04T17:30:00+00:00
a8ac82f2f2f2f2f2f2f2f2f3,84,5,12,8,23,75,12,94.0,47,47,23,151,9.0,60,11,51,2.2,5,2027,30,105100.0,25,94.0,sous station,9.4,202.5,23.0,60.0,12/5,12/5/2027,5:30,2027-05-12T05:30:00,25.12,267125272015603,2027-05-12T05:30:00+00:00,2027-05-12T05:30:00+02:00,2027-05-12T05:30:00+00:00,2027-05-12T05:30:00+00:00
aa6ca8f2f2f2f2f2f2f2f2f3,85,3,12,10,71,75,12,94.0,47,47,23,151,9.0,60,11,51,2.2,17,2029,30,105100.0,25,94.0,sous station,9.4,202.5,23.0,60.0,12/3,12/3/2029,17:30,2029-03-12T17:30:00,25.12,267125272015603,2029-03-12T17:30:00+00:00,2029-03-12T17:30:00+01:00,2029-03-12T17:30:00+00:00,2029-03-12T17:30:00+00:00
aa70b4f2f2f2f2f2f2f2f2f3,85,3,16,11,39,75,12,94.0,47,47,23,151,9.0,60,11,51,2.2,9,2030,30,105100.0,25,94.0,sous station,9.4,202.5,23.0,60.0,16/3,16/3/2030,9:30,2030-03-16T09:30:00,25.12,267125272015603,2030-03-16T09:30:00+00:00,2030-03-16T09:30:00+01:00,2030-03-16T09:30:00+00:00,2030-03-16T09:30:00+00:00
a890b8f2f2f2f2f2f2f2f2f3,84,4,16,11,71,75,12,94.0,47,47,23,151,9.0,60,11,51,2.2,17,2030,30,105100.0,25,94.0,sous station,9.4,202.5,23.0,60.0,16/4,16/4/2030,17:30,2030-04-16T17:30:00,25.12,267125272015603,2030-04-16T17:30:00+00:00,2030-04-16T17:30:00+02:00,2030-04-16T17:30:00+00:00,2030-04-16T17:30:00+00:00
a8aca2f2f2f2f2f2f2f2f2f3,84,5,12,10,23,75,12,94.0,47,47,23,151,9.0,60,11,51,2.2,5,2029,30,105100.0,25,94.0,sous station,9.4,202.5,23.0,60.0,12/5,12/5/2029,5:30,2029-05-12T05:30:00,25.12,267125272015603,2029-05-12T05:30:00+00:00,2029-05-12T05:30:00+02:00,2029-05-12T05:30:00+00:00,2029-05-12T05:30:00+00:00
a8bc9af2f2f2f2f2f2f2f2f3,84,5,28,9,87,75,12,94.0,47,47,23,151,9.0,60,11,51,2.2,21,2028,30,105100.0,25,94.0,sous station,9.4,202.5,23.0,60.0,28/5,28/5/2028,21:30,2028-05-28T21:30:00,25.12,267125272015603,2028-05-28T21:30:00+00:00,2028-05-28T21:30:00+02:00,2028-05-28T21:30:00+00:00,2028-05-28T21:30:00+00:00
a8ccb0f2f2f2f2f2f2f2f2f3,84,6,12,11,7,75,12,94.0,47,47,23,151,9.0,60,11,51,2.2,1,2030,30,105100.0,25,94.0,sous station,9.4,202.5,23.0,60.0,12/6,12/6/2030,1:30,2030-06-12T01:30:00,25.12,267125272015603,2030-06-12T01:30:00+00:00,2030-06-12T01:30:00+02:00,2030-06-12T01:30:00+00:00,2030-06-12T01:30:00+00:00
a8dcb6f2f2f2f2f2f2f2f2f3,84,6,28,11,55,75,12,94.0,47,47,23,151,9.0,60,11,51,2.2,13,2030,30,105100.0,25,94.0,sous station,9.4,202.5,23.0,60.0,28/6,28/6/2030,13:30,2030-06-28T13:30:00,25.12,267125272015603,2030-06-28T13:30:00+00:00,2030-06-28T13:30:00+02:00,2030-06-28T13:30:00+00:00,2030-06-28T13:30:00+00:00
a8d0b4f2f2f2f2f2f2f2f2f3,84,6,16,11,39,75,12,94.0,47,47,23,151,9.0,60,11,51,2.2,9,2030,30,105100.0,25,94.0,sous station,9.4,202.5,23.0,60.0,16/6,16/6/2030,9:30,2030-06-16T09:30:00,25.12,267125272015603,2030-06-16T09:30:00+00:00,2030-06-16T09:30:00+02:00,2030-06-16T09:30:00+00:00,2030-06-16T09:30:00+00:00
a8dca0f2f2f2f2f2f2f2f2f3,84,6,28,10,7,75,12,94.0,47,47,23,151,9.0,60,11,51,2.2,1,2029,30,105100.0,25,94.0,sous station,9.4,202.5,23.0,60.0,28/6,28/6/2029,1:30,2029-06-28T01:30:00,25.12,267125272015603,2029-06-28T01:30:00+00:00,2029-06-28T01:30:00+02:00,2029-06-28T01:30:00+00:00,2029-06-28T01:30:00+00:00
a8ec94f2f2f2f2f2f2f2f2f3,84,7,12,9,39,75,12,94.0,47,47,23,151,9.0,60,11,51,2.2,9,2028,30,105100.0,25,94.0,sous station,9.4,202.5,23.0,60.0,12/7,12/7/2028,9:30,2028-07-12T09:30:00,25.12,267125272015603,2028-07-12T09:30:00+00:00,2028-07-12T09:30:00+02:00,2028-07-12T09:30:00+00:00,2028-07-12T09:30:00+00:00
a8f8b4f2f2f2f2f2f2f2f2f3,84,7,24,11,39,75,12,94.0,47,47,23,151,9.0,60,11,51,2.2,9,2030,30,105100.0,25,94.0,sous station,9.4,202.5,23.0,60.0,24/7,24/7/2030,9:30,2030-07-24T09:30:00,25.12,267125272015603,2030-07-24T09:30:00+00:00,2030-07-24T09:30:00+02:00,2030-07-24T09:30:00+00:00,2030-07-24T09:30:00+00:00
a944a0f2f2f2f2f2f2f2f2f3,84,10,4,10,7,75,12,94.0,47,47,23,151,9.0,60,11,51,2.2,1,2029,30,105100.0,25,94.0,sous station,9.4,202.5,23.0,60.0,4/10,4/10/2029,1:30,2029-10-04T01:30:00,25.12,267125272015603,2029-10-04T01:30:00+00:00,2029-10-04T01:30:00+02:00,2029-10-04T01:30:00+00:00,2029-10-04T01:30:00+00:00
aa3c98f2f2f2f2f2f2f2f2f3,85,1,28,9,71,75,12,94.0,47,47,23,151,9.0,60,11,51,2.2,17,2028,30,105100.0,25,94.0,sous station,9.4,202.5,23.0,60.0,28/1,28/1/2028,17:30,2028-01-28T17:30:00,25.12,267125272015603,2028-01-28T17:30:00+00:00,2028-01-28T17:30:00+01:00,2028-01-28T17:30:00+00:00,2028-01-28T17:30:00+00:00
aa389af2f2f2f2f2f2f2f2f3,85,1,24,9,87,75,12,94.0,47,47,23,151,9.0,60,11,51,2.2,21,2028,30,105100.0,25,94.0,sous station,9.4,202.5,23.0,60.0,24/1,24/1/2028,21:30,2028-01-24T21:30:00,25.12,267125272015603,2028-01-24T21:30:00+00:00,2028-01-24T21:30:00+01:00,2028-01-24T21:30:00+00:00,2028-01-24T21:30:00+00:00
aa589af2f2f2f2f2f2f2f2f3,85,2,24,9,87,75,12,94.0,47,47,23,151,9.0,60,11,51,2.2,21,2028,30,105100.0,25,94.0,sous station,9.4,202.5,23.0,60.0,24/2,24/2/2028,21:30,2028-02-24T21:30:00,25.12,267125272015603,2028-02-24T21:30:00+00:00,2028-02-24T21:30:00+01:00,2028-02-24T21:30:00+00:00,2028-02-24T21:30:00+00:00
a95c84f2f2f2f2f2f2f2f2f3,84,10,28,8,39,75,12,94.0,47,47,23,151,9.0,60,11,51,2.2,9,2027,30,105100.0,25,94.0,sous station,9.4,202.5,23.0,60.0,28/10,28/10/2027,9:30,2027-10-28T09:30:00,25.12,267125272015603,2027-10-28T09:30:00+00:00,2027-10-28T09:30:00+02:00,2027-10-28T09:30:00+00:00,2027-10-28T09:30:00+00:00
a96cbaf2f2f2f2f2f2f2f2f3,84,11,12,11,87,75,12,94.0,47,47,23,151,9.0,60,11,51,2.2,21,2030,30,105100.0,25,94.0,sous station,9.4,202.5,23.0,60.0,12/11,12/11/2030,21:30,2030-11-12T21:30:00,25.12,267125272015603,2030-11-12T21:30:00+00:00,2030-11-12T21:30:00+01:00,2030-11-12T21:30:00+00:00,2030-11-12T21:30:00+00:00
aacc96f2f2f2f2f2f2f2f2f3,85,6,12,9,55,75,12,94.0,47,47,23,151,9.0,60,11,51,2.2,13,2028,30,105100.0,25,94.0,sous station,9.4,202.5,23.0,60.0,12/6,12/6/2028,13:30,2028-06-12T13:30:00,25.12,267125272015603,2028-06-12T13:30:00+00:00,2028-06-12T13:30:00+02:00,2028-06-12T13:30:00+00:00,2028-06-12T13:30:00+00:00
aa848af2f2f2f2f2f2f2f2f3,85,4,4,8,87,75,12,94.0,47,47,23,151,9.0,60,11,51,2.2,21,2027,30,105100.0,25,94.0,sous station,9.4,202.5,23.0,60.0,4/4,4/4/2027,21:30,2027-04-04T21:30:00,25.12,267125272015603,2027-04-04T21:30:00+00:00,2027-04-04T21:30:00+02:00,2027-04-04T21:30:00+00:00,2027-04-04T21:30:00+00:00
ab2484f2f2f2f2f2f2f2f2f3,85,9,4,8,39,75,12,94.0,47,47,23,151,9.0,60,11,51,2.2,9,2027,30,105100.0,25,94.0,sous station,9.4,202.5,23.0,60.0,4/9,4/9/2027,9:30,2027-09-04T09:30:00,25.12,267125272015603,2027-09-04T09:30:00+00:00,2027-09-04T09:30:00+02:00,2027-09-04T09:30:00+00:00,2027-09-04T09:30:00+00:00
ab4c90f2f2f2f2f2f2f2f2f3,85,10,12,9,7,75,12,94.0,47,47,23,151,9.0,60,11,51,2.2,1,2028,30,105100.0,25,94.0,sous station,9.4,202.5,23.0,60.0,12/10,12/10/2028,1:30,2028-10-12T01:30:00,25.12,267125272015603,2028-10-12T01:30:00+00:00,2028-10-12T01:30:00+02:00,2028-10-12T01:30:00+00:00,2028-10-12T01:30:00+00:00
aac8a0f2f2f2f2f2f2f2f2f3,85,6,8,10,7,75,12,94.0,47,47,23,151,9.0,60,11,51,2.2,1,2029,30,105100.0,25,94.0,sous station,9.4,202.5,23.0,60.0,8/6,8/6/2029,1:30,2029-06-08T01:30:00,25.12,267125272015603,2029-06-08T01:30:00+00:00,2029-06-08T01:30:00+02:00,2029-06-08T01:30:00+00:00,2029-06-08T01:30:00+00:00
aaa492f2f2f2f2f2f2f2f2f3,85,5,4,9,23,75,12,94.0,47,47,23,151,9.0,60,11,51,2.2,5,2028,30,105100.0,25,94.0,sous station,9.4,202.5,23.0,60.0,4/5,4/5/2028,5:30,2028-05-04T05:30:00,25.12,267125272015603,2028-05-04T05:30:00+00:00,2028-05-04T05:30:00+02:00,2028-05-04T05:30:00+00:00,2028-05-04T05:30:00+00:00
aaa4a4f2f2f2f2f2f2f2f2f3,85,5,4,10,39,75,12,94.0,47,47,23,151,9.0,60,11,51,2.2,9,2029,30,105100.0,25,94.0,sous station,9.4,202.5,23.0,60.0,4/5,4/5/2029,9:30,2029-05-04T09:30:00,25.12,267125272015603,2029-05-04T09:30:00+00:00,2029-05-04T09:30:00+02:00,2029-05-04T09:30:00+00:00,2029-05-04T09:30:00+00:00
aab8baf2f2f2f2f2f2f2f2f3,85,5,24,11,87,75,12,94.0,47,47,23,151,9.0,60,11,51,2.2,21,2030,30,105100.0,25,94.0,sous station,9.4,202.5,23.0,60.0,24/5,24/5/2030,21:30,2030-05-24T21:30:00,25.12,267125272015603,2030-05-24T21:30:00+00:00,2030-05-24T21:30:00+02:00,2030-05-24T21:30:00+00:00,2030-05-24T21:30:00+00:00
aaccb6f2f2f2f2f2f2f2f2f3,85,6,12,11,55,75,12,94.0,47,47,23,151,9.0,60,11,51,2.2,13,2030,30,105100.0,25,94.0,sous station,9.4,202.5,23.0,60.0,12/6,12/6/2030,13:30,2030-06-12T13:30:00,25.12,267125272015603,2030-06-12T13:30:00+00:00,2030-06-12T13:30:00+02:00,2030-06-12T13:30:00+00:00,2030-06-12T13:30:00+00:00
aad0a6f2f2f2f2f2f2f2f2f3,85,6,16,10,55,75,12,94.0,47,47,23,151,9.0,60,11,51,2.2,13,2029,30,105100.0,25,94.0,sous station,9.4,202.5,23.0,60.0,16/6,16/6/2029,13:30,2029-06-16T13:30:00,25.12,267125272015603,2029-06-16T13:30:00+00:00,2029-06-16T13:30:00+02:00,2029-06-16T13:30:00+00:00,2029-06-16T13:30:00+00:00
aad0b2f2f2f2f2f2f2f2f2f3,85,6,16,11,23,75,12,94.0,47,47,23,151,9.0,60,11,51,2.2,5,2030,30,105100.0,25,94.0,sous station,9.4,202.5,23.0,60.0,16/6,16/6/2030,5:30,2030-06-16T05:30:00,25.12,267125272015603,2030-06-16T05:30:00+00:00,2030-06-16T05:30:00+02:00,2030-06-16T05:30:00+00:00,2030-06-16T05:30:00+00:00
a89494f2f2f2f2f2f2f2f2f3,84,4,20,9,39,75,12,94.0,47,47,23,151,9.0,60,11,51,2.2,9,2028,30,105100.0,25,94.0,sous station,9.4,202.5,23.0,60.0,20/4,20/4/2028,9:30,2028-04-20T09:30:00,25.12,267125272015603,2028-04-20T09:30:00+00:00,2028-04-20T09:30:00+02:00,2028-04-20T09:30:00+00:00,2028-04-20T09:30:00+00:00
a894aaf2f2f2f2f2f2f2f2f3,84,4,20,10,87,75,12,94.0,47,47,23,151,9.0,60,11,51,2.2,21,2029,30,105100.0,25,94.0,sous station,9.4,202.5,23.0,60.0,20/4,20/4/2029,21:30,2029-04-20T21:30:00,25.12,267125272015603,2029-04-20T21:30:00+00:00,2029-04-20T21:30:00+02:00,2029-04-20T21:30:00+00:00,2029-04-20T21:30:00+00:00
a894b0f2f2f2f2f2f2f2f2f3,84,4,20,11,7,75,12,94.0,47,47,23,151,9.0,60,11,51,2.2,1,2030,30,105100.0,25,94.0,sous station,9.4,202.5,23.0,60.0,20/4,20/4/2030,1:30,2030-04-20T01:30:00,25.12,267125272015603,2030-04-20T01:30:00+00:00,2030-04-20T01:30:00+02:00,2030-04-20T01:30:00+00:00,2030-04-20T01:30:00+00:00
a888a4f2f2f2f2f2f2f2f2f3,84,4,8,10,39,75,12,94.0,47,47,23,151,9.0,60,11,51,2.2,9,2029,30,105100.0,25,94.0,sous station,9.4,202.5,23.0,60.0,8/4,8/4/2029,9:30,2029-04-08T09:30:00,25.12,267125272015603,2029-04-08T09:30:00+00:00,2029-04-08T09:30:00+02:00,2029-04-08T09:30:00+00:00,2029-04-08T09:30:00+00:00
a8b8a6f2f2f2f2f2f2f2f2f3,84,5,24,10,55,75,12,94.0,47,47,23,151,9.0,60,11,51,2.2,13,2029,30,105100.0,25,94.0,sous station,9.4,202.5,23.0,60.0,24/5,24/5/2029,13:30,2029-05-24T13:30:00,25.12,267125272015603,2029-05-24T13:30:00+00:00,2029-05-24T13:30:00+02:00,2029-05-24T13:30:00+00:00,2029-05-24T13:30:00+00:00
ae2c74f2f2f2f2f2f2f2f2f3,87,1,12,7,39,75,12,94.0,47,47,23,151,9.0,60,11,51,2.2,9,2026,30,105100.0,25,94.0,sous station,9.4,202.5,23.0,60.0,12/1,12/1/2026,9:30,2026-01-12T09:30:00,25.12,267125272015603,2026-01-12T09:30:00+00:00,2026-01-12T09:30:00+01:00,2026-01-12T09:30:00+00:00,2026-01-12T09:30:00+00:00
ae2c76f2f2f2f2f2f2f2f2f3,87,1,12,7,55,75,12,94.0,47,47,23,151,9.0,60,11,51,2.2,13,2026,30,105100.0,25,94.0,sous station,9.4,202.5,23.0,60.0,12/1,12/1/2026,13:30,2026-01-12T13:30:00,25.12,267125272015603,2026-01-12T13:30:00+00:00,2026-01-12T13:30:00+01:00,2026-01-12T13:30:00+00:00,2026-01-12T13:30:00+00:00
ae3076f2f2f2f2f2f2f2f2f3,87,1,16,7,55,75,12,94.0,47,47,23,151,9.0,60,11,51,2.2,13,2026,30,105100.0,25,94.0,sous station,9.4,202.5,23.0,60.0,16/1,16/1/2026,13:30,2026-01-16T13:30:00,25.12,267125272015603,2026-01-16T13:30:00+00:00,2026-01-16T13:30:00+01:00,2026-01-16T13:30:00+00:00,2026-01-16T13:30:00+00:00
ae3c76f2f2f2f2f2f2f2f2f3,87,1,28,7,55,75,12,94.0,47,47,23,151,9.0,60,11,51,2.2,13,2026,30,105100.0,25,94.0,sous station,9.4,202.5,23.0,60.0,28/1,28/1/2026,13:30,2026-01-28T13:30:00,25.12,267125272015603,2026-01-28T13:30:00+00:00,2026-01-28T13:30:00+01:00,2026-01-28T13:30:00+00:00,2026-01-28T13:30:00+00:00
a8d49af2f2f2f2f2f2f2f2f3,84,6,20,9,87,75,12,94.0,47,47,23,151,9.0,60,11,51,2.2,21,2028,30,105100.0,25,94.0,sous station,9.4,202.5,23.0,60.0,20/6,20/6/2028,21:30,2028-06-20T21:30:00,25.12,267125272015603,2028-06-20T21:30:00+00:00,2028-06-20T21:30:00+02:00,2028-06-20T21:30:00+00:00,2028-06-20T21:30:00+00:00
a8dcb8f2f2f2f2f2f2f2f2f3,84,6,28,11,71,75,12,94.0,47,47,23,151,9.0,60,11,51,2.2,17,2030,30,105100.0,25,94.0,sous station,9.4,202.5,23.0,60.0,28/6,28/6/2030,17:30,2030-06-28T17:30:00,25.12,267125272015603,2030-06-28T17:30:00+00:00,2030-06-28T17:30:00+02:00,2030-06-28T17:30:00+00:00,2030-06-28T17:30:00+00:00
a924aaf2f2f2f2f2f2f2f2f3,84,9,4,10,87,75,12,94.0,47,47,23,151,9.0,60,11,51,2.2,21,2029,30,105100.0,25,94.0,sous station,9.4,202.5,23.0,60.0,4/9,4/9/2029,21:30,2029-09-04T21:30:00,25.12,267125272015603,2029-09-04T21:30:00+00:00,2029-09-04T21:30:00+02:00,2029-09-04T21:30:00+00:00,2029-09-04T21:30:00+00:00
a92892f2f2f2f2f2f2f2f2f3,84,9,8,9,23,75,12,94.0,47,47,23,151,9.0,60,11,51,2.2,5,2028,30,105100.0,25,94.0,sous station,9.4,202.5,23.0,60.0,8/9,8/9/2028,5:30,2028-09-08T05:30:00,25.12,267125272015603,2028-09-08T05:30:00+00:00,2028-09-08T05:30:00+02:00,2028-09-08T05:30:00+00:00,2028-09-08T05:30:00+00:00
a92cb2f2f2f2f2f2f2f2f2f3,84,9,12,11,23,75,12,94.0,47,47,23,151,9.0,60,11,51,2.2,5,2030,30,105100.0,25,94.0,sous station,9.4,202.5,23.0,60.0,12/9,12/9/2030,5:30,2030-09-12T05:30:00,25.12,267125272015603,2030-09-12T05:30:00+00:00,2030-09-12T05:30:00+02:00,2030-09-12T05:30:00+00:00,2030-09-12T05:30:00+00:00
a88c8af2f2f2f2f2f2f2f2f3,84,4,12,8,87,75,12,94.0,47,47,23,151,9.0,60,11,51,2.2,21,2027,30,105100.0,25,94.0,sous station,9.4,202.5,23.0,60.0,12/4,12/4/2027,21:30,2027-04-12T21:30:00,25.12,267125272015603,2027-04-12T21:30:00+00:00,2027-04-12T21:30:00+02:00,2027-04-12T21:30:00+00:00,2027-04-12T21:30:00+00:00
a88ca6f2f2f2f2f2f2f2f2f3,84,4,12,10,55,75,12,94.0,47,47,23,151,9.0,60,11,51,2.2,13,2029,30,105100.0,25,94.0,sous station,9.4,202.5,23.0,60.0,12/4,12/4/2029,13:30,2029-04-12T13:30:00,25.12,267125272015603,2029-04-12T13:30:00+00:00,2029-04-12T13:30:00+02:00,2029-04-12T13:30:00+00:00,2029-04-12T13:30:00+00:00
a884b6f2f2f2f2f2f2f2f2f3,84,4,4,11,55,75,12,94.0,47,47,23,151,9.0,60,11,51,2.2,13,2030,30,105100.0,25,94.0,sous station,9.4,202.5,23.0,60.0,4/4,4/4/2030,13:30,2030-04-04T13:30:00,25.12,267125272015603,2030-04-04T13:30:00+00:00,2030-04-04T13:30:00+02:00,2030-04-04T13:30:00+00:00,2030-04-04T13:30:00+00:00
a98c86f2f2f2f2f2f2f2f2f3,84,12,12,8,55,75,12,94.0,47,47,23,151,9.0,60,11,51,2.2,13,2027,30,105100.0,25,94.0,sous station,9.4,202.5,23.0,60.0,12/12,12/12/2027,13:30,2027-12-12T13:30:00,25.12,267125272015603,2027-12-12T13:30:00+00:00,2027-12-12T13:30:00+01:00,2027-12-12T13:30:00+00:00,2027-12-12T13:30:00+00:00
a99080f2f2f2f2f2f2f2f2f3,84,12,16,8,7,75,12,94.0,47,47,23,151,9.0,60,11,51,2.2,1,2027,30,105100.0,25,94.0,sous station,9.4,202.5,23.0,60.0,16/12,16/12/2027,1:30,2027-12-16T01:30:00,25.12,267125272015603,2027-12-16T01:30:00+00:00,2027-12-16T01:30:00+01:00,2027-12-16T01:30:00+00:00,2027-12-16T01:30:00+00:00
a94ca8f2f2f2f2f2f2f2f2f3,84,10,12,10,71,75,12,94.0,47,47,23,151,9.0,60,11,51,2.2,17,2029,30,105100.0,25,94.0,sous station,9.4,202.5,23.0,60.0,12/10,12/10/2029,17:30,2029-10-12T17:30:00,25.12,267125272015603,2029-10-12T17:30:00+00:00,2029-10-12T17:30:00+02:00,2029-10-12T17:30:00+00:00,2029-10-12T17:30:00+00:00
aa289af2f2f2f2f2f2f2f2f3,85,1,8,9,87,75,12,94.0,47,47,23,151,9.0,60,11,51,2.2,21,2028,30,105100.0,25,94.0,sous station,9.4,202.5,23.0,60.0,8/1,8/1/2028,21:30,2028-01-08T21:30:00,25.12,267125272015603,2028-01-08T21:30:00+00:00,2028-01-08T21:30:00+01:00,2028-01-08T21:30:00+00:00,2028-01-08T21:30:00+00:00
aa3084f2f2f2f2f2f2f2f2f3,85,1,16,8,39,75,12,94.0,47,47,23,151,9.0,60,11,51,2.2,9,2027,30,105100.0,25,94.0,sous station,9.4,202.5,23.0,60.0,16/1,16/1/2027,9:30,2027-01-16T09:30:00,25.12,267125272015603,2027-01-16T09:30:00+00:00,2027-01-16T09:30:00+01:00,2027-01-16T09:30:00+00:00,2027-01-16T09:30:00+00:00
aa34baf2f2f2f2f2f2f2f2f3,85,1,20,11,87,75,12,94.0,47,47,23,151,9.0,60,11,51,2.2,21,2030,30,105100.0,25,94.0,sous station,9.4,202.5,23.0,60.0,20/1,20/1/2030,21:30,2030-01-20T21:30:00,25.12,267125272015603,2030-01-20T21:30:00+00:00,2030-01-20T21:30:00+01:00,2030-01-20T21:30:00+00:00,2030-01-20T21:30:00+00:00
aaa49af2f2f2f2f2f2f2f2f3,85,5,4,9,87,75,12,94.0,47,47,23,151,9.0,60,11,51,2.2,21,2028,30,105100.0,25,94.0,sous station,9.4,202.5,23.0,60.0,4/5,4/5/2028,21:30,2028-05-04T21:30:00,25.12,267125272015603,2028-05-04T21:30:00+00:00,2028-05-04T21:30:00+02:00,2028-05-04T21:30:00+00:00,2028-05-04T21:30:00+00:00
aaa4a6f2f2f2f2f2f2f2f2f3,85,5,4,10,55,75,12,94.0,47,47,23,151,9.0,60,11,51,2.2,13,2029,30,105100.0,25,94.0,sous station,9.4,202.5,23.0,60.0,4/5,4/5/2029,13:30,2029-05-04T13:30:00,25.12,267125272015603,2029-05-04T13:30:00+00:00,2029-05-04T13:30:00+02:00,2029-05-04T13:30:00+00:00,2029-05-04T13:30:00+00:00
a8aca8f2f2f2f2f2f2f2f2f3,84,5,12,10,71,75,12,94.0,47,47,23,151,9.0,60,11,51,2.2,17,2029,30,105100.0,25,94.0,sous station,9.4,202.5,23.0,60.0,12/5,12/5/2029,17:30,2029-05-12T17:30:00,25.12,267125272015603,2029-05-12T17:30:00+00:00,2029-05-12T17:30:00+02:00,2029-05-12T17:30:00+00:00,2029-05-12T17:30:00+00:00
a8b894f2f2f2f2f2f2f2f2f3,84,5,24,9,39,75,12,94.0,47,47,23,151,9.0,60,11,51,2.2,9,2028,30,105100.0,25,94.0,sous station,9.4,202.5,23.0,60.0,24/5,24/5/2028,9:30,2028-05-24T09:30:00,25.12,267125272015603,2028-05-24T09:30:00+00:00,2028-05-24T09:30:00+02:00,2028-05-24T09:30:00+00:00,2028-05-24T09:30:00+00:00
aab0b0f2f2f2f2f2f2f2f2f3,85,5,16,11,7,75,12,94.0,47,47,23,151,9.0,60,11,51,2.2,1,2030,30,105100.0,25,94.0,sous station,9.4,202.5,23.0,60.0,16/5,16/5/2030,1:30,2030-05-16T01:30:00,25.12,267125272015603,2030-05-16T01:30:00+00:00,2030-05-16T01:30:00+02:00,2030-05-16T01:30:00+00:00,2030-05-16T01:30:00+00:00
aa84aaf2f2f2f2f2f2f2f2f3,85,4,4,10,87,75,12,94.0,47,47,23,151,9.0,60,11,51,2.2,21,2029,30,105100.0,25,94.0,sous station,9.4,202.5,23.0,60.0,4/4,4/4/2029,21:30,2029-04-04T21:30:00,25.12,267125272015603,2029-04-04T21:30:00+00:00,2029-04-04T21:30:00+02:00,2029-04-04T21:30:00+00:00,2029-04-04T21:30:00+00:00
aa88a6f2f2f2f2f2f2f2f2f3,85,4,8,10,55,75,12,94.0,47,47,23,151,9.0,60,11,51,2.2,13,2029,30,105100.0,25,94.0,sous station,9.4,202.5,23.0,60.0,8/4,8/4/2029,13:30,2029-04-08T13:30:00,25.12,267125272015603,2029-04-08T13:30:00+00:00,2029-04-08T13:30:00+02:00,2029-04-08T13:30:00+00:00,2029-04-08T13:30:00+00:00
a8d0baf2f2f2f2f2f2f2f2f3,84,6,16,11,87,75,12,94.0,47,47,23,151,9.0,60,11,51,2.2,21,2030,30,105100.0,25,94.0,sous station,9.4,202.5,23.0,60.0,16/6,16/6/2030,21:30,2030-06-16T21:30:00,25.12,267125272015603,2030-06-16T21:30:00+00:00,2030-06-16T21:30:00+02:00,2030-06-16T21:30:00+00:00,2030-06-16T21:30:00+00:00
a8d4a2f2f2f2f2f2f2f2f2f3,84,6,20,10,23,75,12,94.0,47,47,23,151,9.0,60,11,51,2.2,5,2029,30,105100.0,25,94.0,sous station,9.4,202.5,23.0,60.0,20/6,20/6/2029,5:30,2029-06-20T05:30:00,25.12,267125272015603,2029-06-20T05:30:00+00:00,2029-06-20T05:30:00+02:00,2029-06-20T05:30:00+00:00,2029-06-20T05:30:00+00:00
a8f084f2f2f2f2f2f2f2f2f3,84,7,16,8,39,75,12,94.0,47,47,23,151,9.0,60,11,51,2.2,9,2027,30,105100.0,25,94.0,sous station,9.4,202.5,23.0,60.0,16/7,16/7/2027,9:30,2027-07-16T09:30:00,25.12,267125272015603,2027-07-16T09:30:00+00:00,2027-07-16T09:30:00+02:00,2027-07-16T09:30:00+00:00,2027-07-16T09:30:00+00:00
a8e8aaf2f2f2f2f2f2f2f2f3,84,7,8,10,87,75,12,94.0,47,47,23,151,9.0,60,11,51,2.2,21,2029,30,105100.0,25,94.0,sous station,9.4,202.5,23.0,60.0,8/7,8/7/2029,21:30,2029-07-08T21:30:00,25.12,267125272015603,2029-07-08T21:30:00+00:00,2029-07-08T21:30:00+02:00,2029-07-08T21:30:00+00:00,2029-07-08T21:30:00+00:00
aab4b0f2f2f2f2f2f2f2f2f3,85,5,20,11,7,75,12,94.0,47,47,23,151,9.0,60,11,51,2.2,1,2030,30,105100.0,25,94.0,sous station,9.4,202.5,23.0,60.0,20/5,20/5/2030,1:30,2030-05-20T01:30:00,25.12,267125272015603,2030-05-20T01:30:00+00:00,2030-05-20T01:30:00+02:00,2030-05-20T01:30:00+00:00,2030-05-20T01:30:00+00:00
aab4baf2f2f2f2f2f2f2f2f3,85,5,20,11,87,75,12,94.0,47,47,23,151,9.0,60,11,51,2.2,21,2030,30,105100.0,25,94.0,sous station,9.4,202.5,23.0,60.0,20/5,20/5/2030,21:30,2030-05-20T21:30:00,25.12,267125272015603,2030-05-20T21:30:00+00:00,2030-05-20T21:30:00+02:00,2030-05-20T21:30:00+00:00,2030-05-20T21:30:00+00:00
a90c86f2f2f2f2f2f2f2f2f3,84,8,12,8,55,75,12,94.0,47,47,23,151,9.0,60,11,51,2.2,13,2027,30,105100.0,25,94.0,sous station,9.4,202.5,23.0,60.0,12/8,12/8/2027,13:30,2027-08-12T13:30:00,25.12,267125272015603,2027-08-12T13:30:00+00:00,2027-08-12T13:30:00+02:00,2027-08-12T13:30:00+00:00,2027-08-12T13:30:00+00:00
a91484f2f2f2f2f2f2f2f2f3,84,8,20,8,39,75,12,94.0,47,47,23,151,9.0,60,11,51,2.2,9,2027,30,105100.0,25,94.0,sous station,9.4,202.5,23.0,60.0,20/8,20/8/2027,9:30,2027-08-20T09:30:00,25.12,267125272015603,2027-08-20T09:30:00+00:00,2027-08-20T09:30:00+02:00,2027-08-20T09:30:00+00:00,2027-08-20T09:30:00+00:00
ae3070f2f2f2f2f2f2f2f2f3,87,1,16,7,7,75,12,94.0,47,47,23,151,9.0,60,11,51,2.2,1,2026,30,105100.0,25,94.0,sous station,9.4,202.5,23.0,60.0,16/1,16/1/2026,1:30,2026-01-16T01:30:00,25.12,267125272015603,2026-01-16T01:30:00+00:00,2026-01-16T01:30:00+01:00,2026-01-16T01:30:00+00:00,2026-01-16T01:30:00+00:00
aa24aaf2f2f2f2f2f2f2f2f3,85,1,4,10,87,75,12,94.0,47,47,23,151,9.0,60,11,51,2.2,21,2029,30,105100.0,25,94.0,sous station,9.4,202.5,23.0,60.0,4/1,4/1/2029,21:30,2029-01-04T21:30:00,25.12,267125272015603,2029-01-04T21:30:00+00:00,2029-01-04T21:30:00+01:00,2029-01-04T21:30:00+00:00,2029-01-04T21:30:00+00:00
a888b0f2f2f2f2f2f2f2f2f3,84,4,8,11,7,75,12,94.0,47,47,23,151,9.0,60,11,51,2.2,1,2030,30,105100.0,25,94.0,sous station,9.4,202.5,23.0,60.0,8/4,8/4/2030,1:30,2030-04-08T01:30:00,25.12,267125272015603,2030-04-08T01:30:00+00:00,2030-04-08T01:30:00+02:00,2030-04-08T01:30:00+00:00,2030-04-08T01:30:00+00:00
aa2c92f2f2f2f2f2f2f2f2f3,85,1,12,9,23,75,12,94.0,47,47,23,151,9.0,60,11,51,2.2,5,2028,30,105100.0,25,94.0,sous station,9.4,202.5,23.0,60.0,12/1,12/1/2028,5:30,2028-01-12T05:30:00,25.12,267125272015603,2028-01-12T05:30:00+00:00,2028-01-12T05:30:00+01:00,2028-01-12T05:30:00+00:00,2028-01-12T05:30:00+00:00
aa38b6f2f2f2f2f2f2f2f2f3,85,1,24,11,55,75,12,94.0,47,47,23,151,9.0,60,11,51,2.2,13,2030,30,105100.0,25,94.0,sous station,9.4,202.5,23.0,60.0,24/1,24/1/2030,13:30,2030-01-24T13:30:00,25.12,267125272015603,2030-01-24T13:30:00+00:00,2030-01-24T13:30:00+01:00,2030-01-24T13:30:00+00:00,2030-01-24T13:30:00+00:00
aa4ca6f2f2f2f2f2f2f2f2f3,85,2,12,10,55,75,12,94.0,47,47,23,151,9.0,60,11,51,2.2,13,2029,30,105100.0,25,94.0,sous station,9.4,202.5,23.0,60.0,12/2,12/2/2029,13:30,2029-02-12T13:30:00,25.12,267125272015603,2029-02-12T13:30:00+00:00,2029-02-12T13:30:00+01:00,2029-02-12T13:30:00+00:00,2029-02-12T13:30:00+00:00
aa6896f2f2f2f2f2f2f2f2f3,85,3,8,9,55,75,12,94.0,47,47,23,151,9.0,60,11,51,2.2,13,2028,30,105100.0,25,94.0,sous station,9.4,202.5,23.0,60.0,8/3,8/3/2028,13:30,2028-03-08T13:30:00,25.12,267125272015603,2028-03-08T13:30:00+00:00,2028-03-08T13:30:00+01:00,2028-03-08T13:30:00+00:00,2028-03-08T13:30:00+00:00
a8a896f2f2f2f2f2f2f2f2f3,84,5,8,9,55,75,12,94.0,47,47,23,151,9.0,60,11,51,2.2,13,2028,30,105100.0,25,94.0,sous station,9.4,202.5,23.0,60.0,8/5,8/5/2028,13:30,2028-05-08T13:30:00,25.12,267125272015603,2028-05-08T13:30:00+00:00,2028-05-08T13:30:00+02:00,2028-05-08T13:30:00+00:00,2028-05-08T13:30:00+00:00
aa5ca2f2f2f2f2f2f2f2f2f3,85,2,28,10,23,75,12,94.0,47,47,23,151,9.0,60,11,51,2.2,5,2029,30,105100.0,25,94.0,sous station,9.4,202.5,23.0,60.0,28/2,28/2/2029,5:30,2029-02-28T05:30:00,25.12,267125272015603,2029-02-28T05:30:00+00:00,2029-02-28T05:30:00+01:00,2029-02-28T05:30:00+00:00,2029-02-28T05:30:00+00:00
a8dc88f2f2f2f2f2f2f2f2f3,84,6,28,8,71,75,12,94.0,47,47,23,151,9.0,60,11,51,2.2,17,2027,30,105100.0,25,94.0,sous station,9.4,202.5,23.0,60.0,28/6,28/6/2027,17:30,2027-06-28T17:30:00,25.12,267125272015603,2027-06-28T17:30:00+00:00,2027-06-28T17:30:00+02:00,2027-06-28T17:30:00+00:00,2027-06-28T17:30:00+00:00
a8f4b6f2f2f2f2f2f2f2f2f3,84,7,20,11,55,75,12,94.0,47,47,23,151,9.0,60,11,51,2.2,13,2030,30,105100.0,25,94.0,sous station,9.4,202.5,23.0,60.0,20/7,20/7/2030,13:30,2030-07-20T13:30:00,25.12,267125272015603,2030-07-20T13:30:00+00:00,2030-07-20T13:30:00+02:00,2030-07-20T13:30:00+00:00,2030-07-20T13:30:00+00:00
a8f4b0f2f2f2f2f2f2f2f2f3,84,7,20,11,7,75,12,94.0,47,47,23,151,9.0,60,11,51,2.2,1,2030,30,105100.0,25,94.0,sous station,9.4,202.5,23.0,60.0,20/7,20/7/2030,1:30,2030-07-20T01:30:00,25.12,267125272015603,2030-07-20T01:30:00+00:00,2030-07-20T01:30:00+02:00,2030-07-20T01:30:00+00:00,2030-07-20T01:30:00+00:00
a8e4b4f2f2f2f2f2f2f2f2f3,84,7,4,11,39,75,12,94.0,47,47,23,151,9.0,60,11,51,2.2,9,2030,30,105100.0,25,94.0,sous station,9.4,202.5,23.0,60.0,4/7,4/7/2030,9:30,2030-07-04T09:30:00,25.12,267125272015603,2030-07-04T09:30:00+00:00,2030-07-04T09:30:00+02:00,2030-07-04T09:30:00+00:00,2030-07-04T09:30:00+00:00
aacca8f2f2f2f2f2f2f2f2f3,85,6,12,10,71,75,12,94.0,47,47,23,151,9.0,60,11,51,2.2,17,2029,30,105100.0,25,94.0,sous station,9.4,202.5,23.0,60.0,12/6,12/6/2029,17:30,2029-06-12T17:30:00,25.12,267125272015603,2029-06-12T17:30:00+00:00,2029-06-12T17:30:00+02:00,2029-06-12T17:30:00+00:00,2029-06-12T17:30:00+00:00
aa74a4f2f2f2f2f2f2f2f2f3,85,3,20,10,39,75,12,94.0,47,47,23,151,9.0,60,11,51,2.2,9,2029,30,105100.0,25,94.0,sous station,9.4,202.5,23.0,60.0,20/3,20/3/2029,9:30,2029-03-20T09:30:00,25.12,267125272015603,2029-03-20T09:30:00+00:00,2029-03-20T09:30:00+01:00,2029-03-20T09:30:00+00:00,2029-03-20T09:30:00+00:00
aa74b0f2f2f2f2f2f2f2f2f3,85,3,20,11,7,75,12,94.0,47,47,23,151,9.0,60,11,51,2.2,1,2030,30,105100.0,25,94.0,sous station,9.4,202.5,23.0,60.0,20/3,20/3/2030,1:30,2030-03-20T01:30:00,25.12,267125272015603,2030-03-20T01:30:00+00:00,2030-03-20T01:30:00+01:00,2030-03-20T01:30:00+00:00,2030-03-20T01:30:00+00:00
aa84a0f2f2f2f2f2f2f2f2f3,85,4,4,10,7,75,12,94.0,47,47,23,151,9.0,60,11,51,2.2,1,2029,30,105100.0,25,94.0,sous station,9.4,202.5,23.0,60.0,4/4,4/4/2029,1:30,2029-04-04T01:30:00,25.12,267125272015603,2029-04-04T01:30:00+00:00,2029-04-04T01:30:00+02:00,2029-04-04T01:30:00+00:00,2029-04-04T01:30:00+00:00
aaa486f2f2f2f2f2f2f2f2f3,85,5,4,8,55,75,12,94.0,47,47,23,151,9.0,60,11,51,2.2,13,2027,30,105100.0,25,94.0,sous station,9.4,202.5,23.0,60.0,4/5,4/5/2027,13:30,2027-05-04T13:30:00,25.12,267125272015603,2027-05-04T13:30:00+00:00,2027-05-04T13:30:00+02:00,2027-05-04T13:30:00+00:00,2027-05-04T13:30:00+00:00
aaac92f2f2f2f2f2f2f2f2f3,85,5,12,9,23,75,12,94.0,47,47,23,151,9.0,60,11,51,2.2,5,2028,30,105100.0,25,94.0,sous station,9.4,202.5,23.0,60.0,12/5,12/5/2028,5:30,2028-05-12T05:30:00,25.12,267125272015603,2028-05-12T05:30:00+00:00,2028-05-12T05:30:00+02:00,2028-05-12T05:30:00+00:00,2028-05-12T05:30:00+00:00
aae482f2f2f2f2f2f2f2f2f3,85,7,4,8,23,75,12,94.0,47,47,23,151,9.0,60,11,51,2.2,5,2027,30,105100.0,25,94.0,sous station,9.4,202.5,23.0,60.0,4/7,4/7/2027,5:30,2027-07-04T05:30:00,25.12,267125272015603,2027-07-04T05:30:00+00:00,2027-07-04T05:30:00+02:00,2027-07-04T05:30:00+00:00,2027-07-04T05:30:00+00:00
a93c84f2f2f2f2f2f2f2f2f3,84,9,28,8,39,75,12,94.0,47,47,23,151,9.0,60,11,51,2.2,9,2027,30,105100.0,25,94.0,sous station,9.4,202.5,23.0,60.0,28/9,28/9/2027,9:30,2027-09-28T09:30:00,25.12,267125272015603,2027-09-28T09:30:00+00:00,2027-09-28T09:30:00+02:00,2027-09-28T09:30:00+00:00,2027-09-28T09:30:00+00:00
aad0baf2f2f2f2f2f2f2f2f3,85,6,16,11,87,75,12,94.0,47,47,23,151,9.0,60,11,51,2.2,21,2030,30,105100.0,25,94.0,sous station,9.4,202.5,23.0,60.0,16/6,16/6/2030,21:30,2030-06-16T21:30:00,25.12,267125272015603,2030-06-16T21:30:00+00:00,2030-06-16T21:30:00+02:00,2030-06-16T21:30:00+00:00,2030-06-16T21:30:00+00:00
a998b2f2f2f2f2f2f2f2f2f3,84,12,24,11,23,75,12,94.0,47,47,23,151,9.0,60,11,51,2.2,5,2030,30,105100.0,25,94.0,sous station,9.4,202.5,23.0,60.0,24/12,24/12/2030,5:30,2030-12-24T05:30:00,25.12,267125272015603,2030-12-24T05:30:00+00:00,2030-12-24T05:30:00+01:00,2030-12-24T05:30:00+00:00,2030-12-24T05:30:00+00:00
aab09af2f2f2f2f2f2f2f2f3,85,5,16,9,87,75,12,94.0,47,47,23,151,9.0,60,11,51,2.2,21,2028,30,105100.0,25,94.0,sous station,9.4,202.5,23.0,60.0,16/5,16/5/2028,21:30,2028-05-16T21:30:00,25.12,267125272015603,2028-05-16T21:30:00+00:00,2028-05-16T21:30:00+02:00,2028-05-16T21:30:00+00:00,2028-05-16T21:30:00+00:00
aad894f2f2f2f2f2f2f2f2f3,85,6,24,9,39,75,12,94.0,47,47,23,151,9.0,60,11,51,2.2,9,2028,30,105100.0,25,94.0,sous station,9.4,202.5,23.0,60.0,24/6,24/6/2028,9:30,2028-06-24T09:30:00,25.12,267125272015603,2028-06-24T09:30:00+00:00,2028-06-24T09:30:00+02:00,2028-06-24T09:30:00+00:00,2028-06-24T09:30:00+00:00
aad89af2f2f2f2f2f2f2f2f3,85,6,24,9,87,75,12,94.0,47,47,23,151,9.0,60,11,51,2.2,21,2028,30,105100.0,25,94.0,sous station,9.4,202.5,23.0,60.0,24/6,24/6/2028,21:30,2028-06-24T21:30:00,25.12,267125272015603,2028-06-24T21:30:00+00:00,2028-06-24T21:30:00+02:00,2028-06-24T21:30:00+00:00,2028-06-24T21:30:00+00:00
aa9c94f2f2f2f2f2f2f2f2f3,85,4,28,9,39,75,12,94.0,47,47,23,151,9.0,60,11,51,2.2,9,2028,30,105100.0,25,94.0,sous station,9.4,202.5,23.0,60.0,28/4,28/4/2028,9:30,2028-04-28T09:30:00,25.12,267125272015603,2028-04-28T09:30:00+00:00,2028-04-28T09:30:00+02:00,2028-04-28T09:30:00+00:00,2028-04-28T09:30:00+00:00
aa78a4f2f2f2f2f2f2f2f2f3,85,3,24,10,39,75,12,94.0,47,47,23,151,9.0,60,11,51,2.2,9,2029,30,105100.0,25,94.0,sous station,9.4,202.5,23.0,60.0,24/3,24/3/2029,9:30,2029-03-24T09:30:00,25.12,267125272015603,2029-03-24T09:30:00+00:00,2029-03-24T09:30:00+01:00,2029-03-24T09:30:00+00:00,2029-03-24T09:30:00+00:00
ab188af2f2f2f2f2f2f2f2f3,85,8,24,8,87,75,12,94.0,47,47,23,151,9.0,60,11,51,2.2,21,2027,30,105100.0,25,94.0,sous station,9.4,202.5,23.0,60.0,24/8,24/8/2027,21:30,2027-08-24T21:30:00,25.12,267125272015603,2027-08-24T21:30:00+00:00,2027-08-24T21:30:00+02:00,2027-08-24T21:30:00+00:00,2027-08-24T21:30:00+00:00
ab2488f2f2f2f2f2f2f2f2f3,85,9,4,8,71,75,12,94.0,47,47,23,151,9.0,60,11,51,2.2,17,2027,30,105100.0,25,94.0,sous station,9.4,202.5,23.0,60.0,4/9,4/9/2027,17:30,2027-09-04T17:30:00,25.12,267125272015603,2027-09-04T17:30:00+00:00,2027-09-04T17:30:00+02:00,2027-09-04T17:30:00+00:00,2027-09-04T17:30:00+00:00
ab1c92f2f2f2f2f2f2f2f2f3,85,8,28,9,23,75,12,94.0,47,47,23,151,9.0,60,11,51,2.2,5,2028,30,105100.0,25,94.0,sous station,9.4,202.5,23.0,60.0,28/8,28/8/2028,5:30,2028-08-28T05:30:00,25.12,267125272015603,2028-08-28T05:30:00+00:00,2028-08-28T05:30:00+02:00,2028-08-28T05:30:00+00:00,2028-08-28T05:30:00+00:00
ab1c80f2f2f2f2f2f2f2f2f3,85,8,28,8,7,75,12,94.0,47,47,23,151,9.0,60,11,51,2.2,1,2027,30,105100.0,25,94.0,sous station,9.4,202.5,23.0,60.0,28/8,28/8/2027,1:30,2027-08-28T01:30:00,25.12,267125272015603,2027-08-28T01:30:00+00:00,2027-08-28T01:30:00+02:00,2027-08-28T01:30:00+00:00,2027-08-28T01:30:00+00:00
ab8c90f2f2f2f2f2f2f2f2f3,85,12,12,9,7,75,12,94.0,47,47,23,151,9.0,60,11,51,2.2,1,2028,30,105100.0,25,94.0,sous station,9.4,202.5,23.0,60.0,12/12,12/12/2028,1:30,2028-12-12T01:30:00,25.12,267125272015603,2028-12-12T01:30:00+00:00,2028-12-12T01:30:00+01:00,2028-12-12T01:30:00+00:00,2028-12-12T01:30:00+00:00
ab94b2f2f2f2f2f2f2f2f2f3,85,12,20,11,23,75,12,94.0,47,47,23,151,9.0,60,11,51,2.2,5,2030,30,105100.0,25,94.0,sous station,9.4,202.5,23.0,60.0,20/12,20/12/2030,5:30,2030-12-20T05:30:00,25.12,267125272015603,2030-12-20T05:30:00+00:00,2030-12-20T05:30:00+01:00,2030-12-20T05:30:00+00:00,2030-12-20T05:30:00+00:00
ab3cb2f2f2f2f2f2f2f2f2f3,85,9,28,11,23,75,12,94.0,47,47,23,151,9.0,60,11,51,2.2,5,2030,30,105100.0,25,94.0,sous station,9.4,202.5,23.0,60.0,28/9,28/9/2030,5:30,2030-09-28T05:30:00,25.12,267125272015603,2030-09-28T05:30:00+00:00,2030-09-28T05:30:00+02:00,2030-09-28T05:30:00+00:00,2030-09-28T05:30:00+00:00
ab488af2f2f2f2f2f2f2f2f3,85,10,8,8,87,75,12,94.0,47,47,23,151,9.0,60,11,51,2.2,21,2027,30,105100.0,25,94.0,sous station,9.4,202.5,23.0,60.0,8/10,8/10/2027,21:30,2027-10-08T21:30:00,25.12,267125272015603,2027-10-08T21:30:00+00:00,2027-10-08T21:30:00+02:00,2027-10-08T21:30:00+00:00,2027-10-08T21:30:00+00:00
ab48a2f2f2f2f2f2f2f2f2f3,85,10,8,10,23,75,12,94.0,47,47,23,151,9.0,60,11,51,2.2,5,2029,30,105100.0,25,94.0,sous station,9.4,202.5,23.0,60.0,8/10,8/10/2029,5:30,2029-10-08T05:30:00,25.12,267125272015603,2029-10-08T05:30:00+00:00,2029-10-08T05:30:00+02:00,2029-10-08T05:30:00+00:00,2029-10-08T05:30:00+00:00
ab8490f2f2f2f2f2f2f2f2f3,85,12,4,9,7,75,12,94.0,47,47,23,151,9.0,60,11,51,2.2,1,2028,30,105100.0,25,94.0,sous station,9.4,202.5,23.0,60.0,4/12,4/12/2028,1:30,2028-12-04T01:30:00,25.12,267125272015603,2028-12-04T01:30:00+00:00,2028-12-04T01:30:00+01:00,2028-12-04T01:30:00+00:00,2028-12-04T01:30:00+00:00
ab8898f2f2f2f2f2f2f2f2f3,85,12,8,9,71,75,12,94.0,47,47,23,151,9.0,60,11,51,2.2,17,2028,30,105100.0,25,94.0,sous station,9.4,202.5,23.0,60.0,8/12,8/12/2028,17:30,2028-12-08T17:30:00,25.12,267125272015603,2028-12-08T17:30:00+00:00,2028-12-08T17:30:00+01:00,2028-12-08T17:30:00+00:00,2028-12-08T17:30:00+00:00
ab50a4f2f2f2f2f2f2f2f2f3,85,10,16,10,39,75,12,94.0,47,47,23,151,9.0,60,11,51,2.2,9,2029,30,105100.0,25,94.0,sous station,9.4,202.5,23.0,60.0,16/10,16/10/2029,9:30,2029-10-16T09:30:00,25.12,267125272015603,2029-10-16T09:30:00+00:00,2029-10-16T09:30:00+02:00,2029-10-16T09:30:00+00:00,2029-10-16T09:30:00+00:00
ab8ca4f2f2f2f2f2f2f2f2f3,85,12,12,10,39,75,12,94.0,47,47,23,151,9.0,60,11,51,2.2,9,2029,30,105100.0,25,94.0,sous station,9.4,202.5,23.0,60.0,12/12,12/12/2029,9:30,2029-12-12T09:30:00,25.12,267125272015603,2029-12-12T09:30:00+00:00,2029-12-12T09:30:00+01:00,2029-12-12T09:30:00+00:00,2029-12-12T09:30:00+00:00
ab988af2f2f2f2f2f2f2f2f3,85,12,24,8,87,75,12,94.0,47,47,23,151,9.0,60,11,51,2.2,21,2027,30,105100.0,25,94.0,sous station,9.4,202.5,23.0,60.0,24/12,24/12/2027,21:30,2027-12-24T21:30:00,25.12,267125272015603,2027-12-24T21:30:00+00:00,2027-12-24T21:30:00+01:00,2027-12-24T21:30:00+00:00,2027-12-24T21:30:00+00:00
ab9086f2f2f2f2f2f2f2f2f3,85,12,16,8,55,75,12,94.0,47,47,23,151,9.0,60,11,51,2.2,13,2027,30,105100.0,25,94.0,sous station,9.4,202.5,23.0,60.0,16/12,16/12/2027,13:30,2027-12-16T13:30:00,25.12,267125272015603,2027-12-16T13:30:00+00:00,2027-12-16T13:30:00+01:00,2027-12-16T13:30:00+00:00,2027-12-16T13:30:00+00:00
ab689af2f2f2f2f2f2f2f2f3,85,11,8,9,87,75,12,94.0,47,47,23,151,9.0,60,11,51,2.2,21,2028,30,105100.0,25,94.0,sous station,9.4,202.5,23.0,60.0,8/11,8/11/2028,21:30,2028-11-08T21:30:00,25.12,267125272015603,2028-11-08T21:30:00+00:00,2028-11-08T21:30:00+01:00,2028-11-08T21:30:00+00:00,2028-11-08T21:30:00+00:00
ab6ca0f2f2f2f2f2f2f2f2f3,85,11,12,10,7,75,12,94.0,47,47,23,151,9.0,60,11,51,2.2,1,2029,30,105100.0,25,94.0,sous station,9.4,202.5,23.0,60.0,12/11,12/11/2029,1:30,2029-11-12T01:30:00,25.12,267125272015603,2029-11-12T01:30:00+00:00,2029-11-12T01:30:00+01:00,2029-11-12T01:30:00+00:00,2029-11-12T01:30:00+00:00
ab1880f2f2f2f2f2f2f2f2f3,85,8,24,8,7,75,12,94.0,47,47,23,151,9.0,60,11,51,2.2,1,2027,30,105100.0,25,94.0,sous station,9.4,202.5,23.0,60.0,24/8,24/8/2027,1:30,2027-08-24T01:30:00,25.12,267125272015603,2027-08-24T01:30:00+00:00,2027-08-24T01:30:00+02:00,2027-08-24T01:30:00+00:00,2027-08-24T01:30:00+00:00
ac2492f2f2f2f2f2f2f2f2f3,86,1,4,9,23,75,12,94.0,47,47,23,151,9.0,60,11,51,2.2,5,2028,30,105100.0,25,94.0,sous station,9.4,202.5,23.0,60.0,4/1,4/1/2028,5:30,2028-01-04T05:30:00,25.12,267125272015603,2028-01-04T05:30:00+00:00,2028-01-04T05:30:00+01:00,2028-01-04T05:30:00+00:00,2028-01-04T05:30:00+00:00
ab1086f2f2f2f2f2f2f2f2f3,85,8,16,8,55,75,12,94.0,47,47,23,151,9.0,60,11,51,2.2,13,2027,30,105100.0,25,94.0,sous station,9.4,202.5,23.0,60.0,16/8,16/8/2027,13:30,2027-08-16T13:30:00,25.12,267125272015603,2027-08-16T13:30:00+00:00,2027-08-16T13:30:00+02:00,2027-08-16T13:30:00+00:00,2027-08-16T13:30:00+00:00
ab1896f2f2f2f2f2f2f2f2f3,85,8,24,9,55,75,12,94.0,47,47,23,151,9.0,60,11,51,2.2,13,2028,30,105100.0,25,94.0,sous station,9.4,202.5,23.0,60.0,24/8,24/8/2028,13:30,2028-08-24T13:30:00,25.12,267125272015603,2028-08-24T13:30:00+00:00,2028-08-24T13:30:00+02:00,2028-08-24T13:30:00+00:00,2028-08-24T13:30:00+00:00
ab1494f2f2f2f2f2f2f2f2f3,85,8,20,9,39,75,12,94.0,47,47,23,151,9.0,60,11,51,2.2,9,2028,30,105100.0,25,94.0,sous station,9.4,202.5,23.0,60.0,20/8,20/8/2028,9:30,2028-08-20T09:30:00,25.12,267125272015603,2028-08-20T09:30:00+00:00,2028-08-20T09:30:00+02:00,2028-08-20T09:30:00+00:00,2028-08-20T09:30:00+00:00
ab1496f2f2f2f2f2f2f2f2f3,85,8,20,9,55,75,12,94.0,47,47,23,151,9.0,60,11,51,2.2,13,2028,30,105100.0,25,94.0,sous station,9.4,202.5,23.0,60.0,20/8,20/8/2028,13:30,2028-08-20T13:30:00,25.12,267125272015603,2028-08-20T13:30:00+00:00,2028-08-20T13:30:00+02:00,2028-08-20T13:30:00+00:00,2028-08-20T13:30:00+00:00
ab2498f2f2f2f2f2f2f2f2f3,85,9,4,9,71,75,12,94.0,47,47,23,151,9.0,60,11,51,2.2,17,2028,30,105100.0,25,94.0,sous station,9.4,202.5,23.0,60.0,4/9,4/9/2028,17:30,2028-09-04T17:30:00,25.12,267125272015603,2028-09-04T17:30:00+00:00,2028-09-04T17:30:00+02:00,2028-09-04T17:30:00+00:00,2028-09-04T17:30:00+00:00
aaf0b8f2f2f2f2f2f2f2f2f3,85,7,16,11,71,75,12,94.0,47,47,23,151,9.0,60,11,51,2.2,17,2030,30,105100.0,25,94.0,sous station,9.4,202.5,23.0,60.0,16/7,16/7/2030,17:30,2030-07-16T17:30:00,25.12,267125272015603,2030-07-16T17:30:00+00:00,2030-07-16T17:30:00+02:00,2030-07-16T17:30:00+00:00,2030-07-16T17:30:00+00:00
aaf8b2f2f2f2f2f2f2f2f2f3,85,7,24,11,23,75,12,94.0,47,47,23,151,9.0,60,11,51,2.2,5,2030,30,105100.0,25,94.0,sous station,9.4,202.5,23.0,60.0,24/7,24/7/2030,5:30,2030-07-24T05:30:00,25.12,267125272015603,2030-07-24T05:30:00+00:00,2030-07-24T05:30:00+02:00,2030-07-24T05:30:00+00:00,2030-07-24T05:30:00+00:00
ab7488f2f2f2f2f2f2f2f2f3,85,11,20,8,71,75,12,94.0,47,47,23,151,9.0,60,11,51,2.2,17,2027,30,105100.0,25,94.0,sous station,9.4,202.5,23.0,60.0,20/11,20/11/2027,17:30,2027-11-20T17:30:00,25.12,267125272015603,2027-11-20T17:30:00+00:00,2027-11-20T17:30:00+01:00,2027-11-20T17:30:00+00:00,2027-11-20T17:30:00+00:00
aae8b4f2f2f2f2f2f2f2f2f3,85,7,8,11,39,75,12,94.0,47,47,23,151,9.0,60,11,51,2.2,9,2030,30,105100.0,25,94.0,sous station,9.4,202.5,23.0,60.0,8/7,8/7/2030,9:30,2030-07-08T09:30:00,25.12,267125272015603,2030-07-08T09:30:00+00:00,2030-07-08T09:30:00+02:00,2030-07-08T09:30:00+00:00,2030-07-08T09:30:00+00:00
aae49af2f2f2f2f2f2f2f2f3,85,7,4,9,87,75,12,94.0,47,47,23,151,9.0,60,11,51,2.2,21,2028,30,105100.0,25,94.0,sous station,9.4,202.5,23.0,60.0,4/7,4/7/2028,21:30,2028-07-04T21:30:00,25.12,267125272015603,2028-07-04T21:30:00+00:00,2028-07-04T21:30:00+02:00,2028-07-04T21:30:00+00:00,2028-07-04T21:30:00+00:00
aaf8baf2f2f2f2f2f2f2f2f3,85,7,24,11,87,75,12,94.0,47,47,23,151,9.0,60,11,51,2.2,21,2030,30,105100.0,25,94.0,sous station,9.4,202.5,23.0,60.0,24/7,24/7/2030,21:30,2030-07-24T21:30:00,25.12,267125272015603,2030-07-24T21:30:00+00:00,2030-07-24T21:30:00+02:00,2030-07-24T21:30:00+00:00,2030-07-24T21:30:00+00:00
ab08a8f2f2f2f2f2f2f2f2f3,85,8,8,10,71,75,12,94.0,47,47,23,151,9.0,60,11,51,2.2,17,2029,30,105100.0,25,94.0,sous station,9.4,202.5,23.0,60.0,8/8,8/8/2029,17:30,2029-08-08T17:30:00,25.12,267125272015603,2029-08-08T17:30:00+00:00,2029-08-08T17:30:00+02:00,2029-08-08T17:30:00+00:00,2029-08-08T17:30:00+00:00
aafca2f2f2f2f2f2f2f2f2f3,85,7,28,10,23,75,12,94.0,47,47,23,151,9.0,60,11,51,2.2,5,2029,30,105100.0,25,94.0,sous station,9.4,202.5,23.0,60.0,28/7,28/7/2029,5:30,2029-07-28T05:30:00,25.12,267125272015603,2029-07-28T05:30:00+00:00,2029-07-28T05:30:00+02:00,2029-07-28T05:30:00+00:00,2029-07-28T05:30:00+00:00
ab0492f2f2f2f2f2f2f2f2f3,85,8,4,9,23,75,12,94.0,47,47,23,151,9.0,60,11,51,2.2,5,2028,30,105100.0,25,94.0,sous station,9.4,202.5,23.0,60.0,4/8,4/8/2028,5:30,2028-08-04T05:30:00,25.12,267125272015603,2028-08-04T05:30:00+00:00,2028-08-04T05:30:00+02:00,2028-08-04T05:30:00+00:00,2028-08-04T05:30:00+00:00
ab98a4f2f2f2f2f2f2f2f2f3,85,12,24,10,39,75,12,94.0,47,47,23,151,9.0,60,11,51,2.2,9,2029,30,105100.0,25,94.0,sous station,9.4,202.5,23.0,60.0,24/12,24/12/2029,9:30,2029-12-24T09:30:00,25.12,267125272015603,2029-12-24T09:30:00+00:00,2029-12-24T09:30:00+01:00,2029-12-24T09:30:00+00:00,2029-12-24T09:30:00+00:00
ab8498f2f2f2f2f2f2f2f2f3,85,12,4,9,71,75,12,94.0,47,47,23,151,9.0,60,11,51,2.2,17,2028,30,105100.0,25,94.0,sous station,9.4,202.5,23.0,60.0,4/12,4/12/2028,17:30,2028-12-04T17:30:00,25.12,267125272015603,2028-12-04T17:30:00+00:00,2028-12-04T17:30:00+01:00,2028-12-04T17:30:00+00:00,2028-12-04T17:30:00+00:00
ab84b0f2f2f2f2f2f2f2f2f3,85,12,4,11,7,75,12,94.0,47,47,23,151,9.0,60,11,51,2.2,1,2030,30,105100.0,25,94.0,sous station,9.4,202.5,23.0,60.0,4/12,4/12/2030,1:30,2030-12-04T01:30:00,25.12,267125272015603,2030-12-04T01:30:00+00:00,2030-12-04T01:30:00+01:00,2030-12-04T01:30:00+00:00,2030-12-04T01:30:00+00:00
ae247af2f2f2f2f2f2f2f2f3,87,1,4,7,87,75,12,94.0,47,47,23,151,9.0,60,11,51,2.2,21,2026,30,105100.0,25,94.0,sous station,9.4,202.5,23.0,60.0,4/1,4/1/2026,21:30,2026-01-04T21:30:00,25.12,267125272015603,2026-01-04T21:30:00+00:00,2026-01-04T21:30:00+01:00,2026-01-04T21:30:00+00:00,2026-01-04T21:30:00+00:00
a91488f2f2f2f2f2f2f2f2f3,84,8,20,8,71,75,12,94.0,47,47,23,151,9.0,60,11,51,2.2,17,2027,30,105100.0,25,94.0,sous station,9.4,202.5,23.0,60.0,20/8,20/8/2027,17:30,2027-08-20T17:30:00,25.12,267125272015603,2027-08-20T17:30:00+00:00,2027-08-20T17:30:00+02:00,2027-08-20T17:30:00+00:00,2027-08-20T17:30:00+00:00
a9148af2f2f2f2f2f2f2f2f3,84,8,20,8,87,75,12,94.0,47,47,23,151,9.0,60,11,51,2.2,21,2027,30,105100.0,25,94.0,sous station,9.4,202.5,23.0,60.0,20/8,20/8/2027,21:30,2027-08-20T21:30:00,25.12,267125272015603,2027-08-20T21:30:00+00:00,2027-08-20T21:30:00+02:00,2027-08-20T21:30:00+00:00,2027-08-20T21:30:00+00:00
a914a0f2f2f2f2f2f2f2f2f3,84,8,20,10,7,75,12,94.0,47,47,23,151,9.0,60,11,51,2.2,1,2029,30,105100.0,25,94.0,sous station,9.4,202.5,23.0,60.0,20/8,20/8/2029,1:30,2029-08-20T01:30:00,25.12,267125272015603,2029-08-20T01:30:00+00:00,2029-08-20T01:30:00+02:00,2029-08-20T01:30:00+00:00,2029-08-20T01:30:00+00:00
a91882f2f2f2f2f2f2f2f2f3,84,8,24,8,23,75,12,94.0,47,47,23,151,9.0,60,11,51,2.2,5,2027,30,105100.0,25,94.0,sous station,9.4,202.5,23.0,60.0,24/8,24/8/2027,5:30,2027-08-24T05:30:00,25.12,267125272015603,2027-08-24T05:30:00+00:00,2027-08-24T05:30:00+02:00,2027-08-24T05:30:00+00:00,2027-08-24T05:30:00+00:00
a904b4f2f2f2f2f2f2f2f2f3,84,8,4,11,39,75,12,94.0,47,47,23,151,9.0,60,11,51,2.2,9,2030,30,105100.0,25,94.0,sous station,9.4,202.5,23.0,60.0,4/8,4/8/2030,9:30,2030-08-04T09:30:00,25.12,267125272015603,2030-08-04T09:30:00+00:00,2030-08-04T09:30:00+02:00,2030-08-04T09:30:00+00:00,2030-08-04T09:30:00+00:00
a91ca0f2f2f2f2f2f2f2f2f3,84,8,28,10,7,75,12,94.0,47,47,23,151,9.0,60,11,51,2.2,1,2029,30,105100.0,25,94.0,sous station,9.4,202.5,23.0,60.0,28/8,28/8/2029,1:30,2029-08-28T01:30:00,25.12,267125272015603,2029-08-28T01:30:00+00:00,2029-08-28T01:30:00+02:00,2029-08-28T01:30:00+00:00,2029-08-28T01:30:00+00:00
a888baf2f2f2f2f2f2f2f2f3,84,4,8,11,87,75,12,94.0,47,47,23,151,9.0,60,11,51,2.2,21,2030,30,105100.0,25,94.0,sous station,9.4,202.5,23.0,60.0,8/4,8/4/2030,21:30,2030-04-08T21:30:00,25.12,267125272015603,2030-04-08T21:30:00+00:00,2030-04-08T21:30:00+02:00,2030-04-08T21:30:00+00:00,2030-04-08T21:30:00+00:00
a894a2f2f2f2f2f2f2f2f2f3,84,4,20,10,23,75,12,94.0,47,47,23,151,9.0,60,11,51,2.2,5,2029,30,105100.0,25,94.0,sous station,9.4,202.5,23.0,60.0,20/4,20/4/2029,5:30,2029-04-20T05:30:00,25.12,267125272015603,2029-04-20T05:30:00+00:00,2029-04-20T05:30:00+02:00,2029-04-20T05:30:00+00:00,2029-04-20T05:30:00+00:00
ae5c72f2f2f2f2f2f2f2f2f3,87,2,28,7,23,75,12,94.0,47,47,23,151,9.0,60,11,51,2.2,5,2026,30,105100.0,25,94.0,sous station,9.4,202.5,23.0,60.0,28/2,28/2/2026,5:30,2026-02-28T05:30:00,25.12,267125272015603,2026-02-28T05:30:00+00:00,2026-02-28T05:30:00+01:00,2026-02-28T05:30:00+00:00,2026-02-28T05:30:00+00:00
ab0cb0f2f2f2f2f2f2f2f2f3,85,8,12,11,7,75,12,94.0,47,47,23,151,9.0,60,11,51,2.2,1,2030,30,105100.0,25,94.0,sous station,9.4,202.5,23.0,60.0,12/8,12/8/2030,1:30,2030-08-12T01:30:00,25.12,267125272015603,2030-08-12T01:30:00+00:00,2030-08-12T01:30:00+02:00,2030-08-12T01:30:00+00:00,2030-08-12T01:30:00+00:00
ae3478f2f2f2f2f2f2f2f2f3,87,1,20,7,71,75,12,94.0,47,47,23,151,9.0,60,11,51,2.2,17,2026,30,105100.0,25,94.0,sous station,9.4,202.5,23.0,60.0,20/1,20/1/2026,17:30,2026-01-20T17:30:00,25.12,267125272015603,2026-01-20T17:30:00+00:00,2026-01-20T17:30:00+01:00,2026-01-20T17:30:00+00:00,2026-01-20T17:30:00+00:00
ae3870f2f2f2f2f2f2f2f2f3,87,1,24,7,7,75,12,94.0,47,47,23,151,9.0,60,11,51,2.2,1,2026,30,105100.0,25,94.0,sous station,9.4,202.5,23.0,60.0,24/1,24/1/2026,1:30,2026-01-24T01:30:00,25.12,267125272015603,2026-01-24T01:30:00+00:00,2026-01-24T01:30:00+01:00,2026-01-24T01:30:00+00:00,2026-01-24T01:30:00+00:00
ab14b0f2f2f2f2f2f2f2f2f3,85,8,20,11,7,75,12,94.0,47,47,23,151,9.0,60,11,51,2.2,1,2030,30,105100.0,25,94.0,sous station,9.4,202.5,23.0,60.0,20/8,20/8/2030,1:30,2030-08-20T01:30:00,25.12,267125272015603,2030-08-20T01:30:00+00:00,2030-08-20T01:30:00+02:00,2030-08-20T01:30:00+00:00,2030-08-20T01:30:00+00:00
a8e8baf2f2f2f2f2f2f2f2f3,84,7,8,11,87,75,12,94.0,47,47,23,151,9.0,60,11,51,2.2,21,2030,30,105100.0,25,94.0,sous station,9.4,202.5,23.0,60.0,8/7,8/7/2030,21:30,2030-07-08T21:30:00,25.12,267125272015603,2030-07-08T21:30:00+00:00,2030-07-08T21:30:00+02:00,2030-07-08T21:30:00+00:00,2030-07-08T21:30:00+00:00
ab5496f2f2f2f2f2f2f2f2f3,85,10,20,9,55,75,12,94.0,47,47,23,151,9.0,60,11,51,2.2,13,2028,30,105100.0,25,94.0,sous station,9.4,202.5,23.0,60.0,20/10,20/10/2028,13:30,2028-10-20T13:30:00,25.12,267125272015603,2028-10-20T13:30:00+00:00,2028-10-20T13:30:00+02:00,2028-10-20T13:30:00+00:00,2028-10-20T13:30:00+00:00
a8d4aaf2f2f2f2f2f2f2f2f3,84,6,20,10,87,75,12,94.0,47,47,23,151,9.0,60,11,51,2.2,21,2029,30,105100.0,25,94.0,sous station,9.4,202.5,23.0,60.0,20/6,20/6/2029,21:30,2029-06-20T21:30:00,25.12,267125272015603,2029-06-20T21:30:00+00:00,2029-06-20T21:30:00+02:00,2029-06-20T21:30:00+00:00,2029-06-20T21:30:00+00:00
a8d4b4f2f2f2f2f2f2f2f2f3,84,6,20,11,39,75,12,94.0,47,47,23,151,9.0,60,11,51,2.2,9,2030,30,105100.0,25,94.0,sous station,9.4,202.5,23.0,60.0,20/6,20/6/2030,9:30,2030-06-20T09:30:00,25.12,267125272015603,2030-06-20T09:30:00+00:00,2030-06-20T09:30:00+02:00,2030-06-20T09:30:00+00:00,2030-06-20T09:30:00+00:00
a8d4b6f2f2f2f2f2f2f2f2f3,84,6,20,11,55,75,12,94.0,47,47,23,151,9.0,60,11,51,2.2,13,2030,30,105100.0,25,94.0,sous station,9.4,202.5,23.0,60.0,20/6,20/6/2030,13:30,2030-06-20T13:30:00,25.12,267125272015603,2030-06-20T13:30:00+00:00,2030-06-20T13:30:00+02:00,2030-06-20T13:30:00+00:00,2030-06-20T13:30:00+00:00
a8f08af2f2f2f2f2f2f2f2f3,84,7,16,8,87,75,12,94.0,47,47,23,151,9.0,60,11,51,2.2,21,2027,30,105100.0,25,94.0,sous station,9.4,202.5,23.0,60.0,16/7,16/7/2027,21:30,2027-07-16T21:30:00,25.12,267125272015603,2027-07-16T21:30:00+00:00,2027-07-16T21:30:00+02:00,2027-07-16T21:30:00+00:00,2027-07-16T21:30:00+00:00
ab44b6f2f2f2f2f2f2f2f2f3,85,10,4,11,55,75,12,94.0,47,47,23,151,9.0,60,11,51,2.2,13,2030,30,105100.0,25,94.0,sous station,9.4,202.5,23.0,60.0,4/10,4/10/2030,13:30,2030-10-04T13:30:00,25.12,267125272015603,2030-10-04T13:30:00+00:00,2030-10-04T13:30:00+02:00,2030-10-04T13:30:00+00:00,2030-10-04T13:30:00+00:00
a944b8f2f2f2f2f2f2f2f2f3,84,10,4,11,71,75,12,94.0,47,47,23,151,9.0,60,11,51,2.2,17,2030,30,105100.0,25,94.0,sous station,9.4,202.5,23.0,60.0,4/10,4/10/2030,17:30,2030-10-04T17:30:00,25.12,267125272015603,2030-10-04T17:30:00+00:00,2030-10-04T17:30:00+02:00,2030-10-04T17:30:00+00:00,2030-10-04T17:30:00+00:00
a94c88f2f2f2f2f2f2f2f2f3,84,10,12,8,71,75,12,94.0,47,47,23,151,9.0,60,11,51,2.2,17,2027,30,105100.0,25,94.0,sous station,9.4,202.5,23.0,60.0,12/10,12/10/2027,17:30,2027-10-12T17:30:00,25.12,267125272015603,2027-10-12T17:30:00+00:00,2027-10-12T17:30:00+02:00,2027-10-12T17:30:00+00:00,2027-10-12T17:30:00+00:00
a954b8f2f2f2f2f2f2f2f2f3,84,10,20,11,71,75,12,94.0,47,47,23,151,9.0,60,11,51,2.2,17,2030,30,105100.0,25,94.0,sous station,9.4,202.5,23.0,60.0,20/10,20/10/2030,17:30,2030-10-20T17:30:00,25.12,267125272015603,2030-10-20T17:30:00+00:00,2030-10-20T17:30:00+02:00,2030-10-20T17:30:00+00:00,2030-10-20T17:30:00+00:00
a964a6f2f2f2f2f2f2f2f2f3,84,11,4,10,55,75,12,94.0,47,47,23,151,9.0,60,11,51,2.2,13,2029,30,105100.0,25,94.0,sous station,9.4,202.5,23.0,60.0,4/11,4/11/2029,13:30,2029-11-04T13:30:00,25.12,267125272015603,2029-11-04T13:30:00+00:00,2029-11-04T13:30:00+01:00,2029-11-04T13:30:00+00:00,2029-11-04T13:30:00+00:00
a964b0f2f2f2f2f2f2f2f2f3,84,11,4,11,7,75,12,94.0,47,47,23,151,9.0,60,11,51,2.2,1,2030,30,105100.0,25,94.0,sous station,9.4,202.5,23.0,60.0,4/11,4/11/2030,1:30,2030-11-04T01:30:00,25.12,267125272015603,2030-11-04T01:30:00+00:00,2030-11-04T01:30:00+01:00,2030-11-04T01:30:00+00:00,2030-11-04T01:30:00+00:00
a95c86f2f2f2f2f2f2f2f2f3,84,10,28,8,55,75,12,94.0,47,47,23,151,9.0,60,11,51,2.2,13,2027,30,105100.0,25,94.0,sous station,9.4,202.5,23.0,60.0,28/10,28/10/2027,13:30,2027-10-28T13:30:00,25.12,267125272015603,2027-10-28T13:30:00+00:00,2027-10-28T13:30:00+02:00,2027-10-28T13:30:00+00:00,2027-10-28T13:30:00+00:00
a998b0f2f2f2f2f2f2f2f2f3,84,12,24,11,7,75,12,94.0,47,47,23,151,9.0,60,11,51,2.2,1,2030,30,105100.0,25,94.0,sous station,9.4,202.5,23.0,60.0,24/12,24/12/2030,1:30,2030-12-24T01:30:00,25.12,267125272015603,2030-12-24T01:30:00+00:00,2030-12-24T01:30:00+01:00,2030-12-24T01:30:00+00:00,2030-12-24T01:30:00+00:00
aad496f2f2f2f2f2f2f2f2f3,85,6,20,9,55,75,12,94.0,47,47,23,151,9.0,60,11,51,2.2,13,2028,30,105100.0,25,94.0,sous station,9.4,202.5,23.0,60.0,20/6,20/6/2028,13:30,2028-06-20T13:30:00,25.12,267125272015603,2028-06-20T13:30:00+00:00,2028-06-20T13:30:00+02:00,2028-06-20T13:30:00+00:00,2028-06-20T13:30:00+00:00
aabc88f2f2f2f2f2f2f2f2f3,85,5,28,8,71,75,12,94.0,47,47,23,151,9.0,60,11,51,2.2,17,2027,30,105100.0,25,94.0,sous station,9.4,202.5,23.0,60.0,28/5,28/5/2027,17:30,2027-05-28T17:30:00,25.12,267125272015603,2027-05-28T17:30:00+00:00,2027-05-28T17:30:00+02:00,2027-05-28T17:30:00+00:00,2027-05-28T17:30:00+00:00
aaf0a6f2f2f2f2f2f2f2f2f3,85,7,16,10,55,75,12,94.0,47,47,23,151,9.0,60,11,51,2.2,13,2029,30,105100.0,25,94.0,sous station,9.4,202.5,23.0,60.0,16/7,16/7/2029,13:30,2029-07-16T13:30:00,25.12,267125272015603,2029-07-16T13:30:00+00:00,2029-07-16T13:30:00+02:00,2029-07-16T13:30:00+00:00,2029-07-16T13:30:00+00:00
aacca0f2f2f2f2f2f2f2f2f3,85,6,12,10,7,75,12,94.0,47,47,23,151,9.0,60,11,51,2.2,1,2029,30,105100.0,25,94.0,sous station,9.4,202.5,23.0,60.0,12/6,12/6/2029,1:30,2029-06-12T01:30:00,25.12,267125272015603,2029-06-12T01:30:00+00:00,2029-06-12T01:30:00+02:00,2029-06-12T01:30:00+00:00,2029-06-12T01:30:00+00:00
aacca4f2f2f2f2f2f2f2f2f3,85,6,12,10,39,75,12,94.0,47,47,23,151,9.0,60,11,51,2.2,9,2029,30,105100.0,25,94.0,sous station,9.4,202.5,23.0,60.0,12/6,12/6/2029,9:30,2029-06-12T09:30:00,25.12,267125272015603,2029-06-12T09:30:00+00:00,2029-06-12T09:30:00+02:00,2029-06-12T09:30:00+00:00,2029-06-12T09:30:00+00:00
ab48b8f2f2f2f2f2f2f2f2f3,85,10,8,11,71,75,12,94.0,47,47,23,151,9.0,60,11,51,2.2,17,2030,30,105100.0,25,94.0,sous station,9.4,202.5,23.0,60.0,8/10,8/10/2030,17:30,2030-10-08T17:30:00,25.12,267125272015603,2030-10-08T17:30:00+00:00,2030-10-08T17:30:00+02:00,2030-10-08T17:30:00+00:00,2030-10-08T17:30:00+00:00
ab5088f2f2f2f2f2f2f2f2f3,85,10,16,8,71,75,12,94.0,47,47,23,151,9.0,60,11,51,2.2,17,2027,30,105100.0,25,94.0,sous station,9.4,202.5,23.0,60.0,16/10,16/10/2027,17:30,2027-10-16T17:30:00,25.12,267125272015603,2027-10-16T17:30:00+00:00,2027-10-16T17:30:00+02:00,2027-10-16T17:30:00+00:00,2027-10-16T17:30:00+00:00
ab90a2f2f2f2f2f2f2f2f2f3,85,12,16,10,23,75,12,94.0,47,47,23,151,9.0,60,11,51,2.2,5,2029,30,105100.0,25,94.0,sous station,9.4,202.5,23.0,60.0,16/12,16/12/2029,5:30,2029-12-16T05:30:00,25.12,267125272015603,2029-12-16T05:30:00+00:00,2029-12-16T05:30:00+01:00,2029-12-16T05:30:00+00:00,2029-12-16T05:30:00+00:00
ab98a6f2f2f2f2f2f2f2f2f3,85,12,24,10,55,75,12,94.0,47,47,23,151,9.0,60,11,51,2.2,13,2029,30,105100.0,25,94.0,sous station,9.4,202.5,23.0,60.0,24/12,24/12/2029,13:30,2029-12-24T13:30:00,25.12,267125272015603,2029-12-24T13:30:00+00:00,2029-12-24T13:30:00+01:00,2029-12-24T13:30:00+00:00,2029-12-24T13:30:00+00:00
ab98baf2f2f2f2f2f2f2f2f3,85,12,24,11,87,75,12,94.0,47,47,23,151,9.0,60,11,51,2.2,21,2030,30,105100.0,25,94.0,sous station,9.4,202.5,23.0,60.0,24/12,24/12/2030,21:30,2030-12-24T21:30:00,25.12,267125272015603,2030-12-24T21:30:00+00:00,2030-12-24T21:30:00+01:00,2030-12-24T21:30:00+00:00,2030-12-24T21:30:00+00:00
ab9896f2f2f2f2f2f2f2f2f3,85,12,24,9,55,75,12,94.0,47,47,23,151,9.0,60,11,51,2.2,13,2028,30,105100.0,25,94.0,sous station,9.4,202.5,23.0,60.0,24/12,24/12/2028,13:30,2028-12-24T13:30:00,25.12,267125272015603,2028-12-24T13:30:00+00:00,2028-12-24T13:30:00+01:00,2028-12-24T13:30:00+00:00,2028-12-24T13:30:00+00:00
ab6ca4f2f2f2f2f2f2f2f2f3,85,11,12,10,39,75,12,94.0,47,47,23,151,9.0,60,11,51,2.2,9,2029,30,105100.0,25,94.0,sous station,9.4,202.5,23.0,60.0,12/11,12/11/2029,9:30,2029-11-12T09:30:00,25.12,267125272015603,2029-11-12T09:30:00+00:00,2029-11-12T09:30:00+01:00,2029-11-12T09:30:00+00:00,2029-11-12T09:30:00+00:00
ab90aaf2f2f2f2f2f2f2f2f3,85,12,16,10,87,75,12,94.0,47,47,23,151,9.0,60,11,51,2.2,21,2029,30,105100.0,25,94.0,sous station,9.4,202.5,23.0,60.0,16/12,16/12/2029,21:30,2029-12-16T21:30:00,25.12,267125272015603,2029-12-16T21:30:00+00:00,2029-12-16T21:30:00+01:00,2029-12-16T21:30:00+00:00,2029-12-16T21:30:00+00:00
ab98b0f2f2f2f2f2f2f2f2f3,85,12,24,11,7,75,12,94.0,47,47,23,151,9.0,60,11,51,2.2,1,2030,30,105100.0,25,94.0,sous station,9.4,202.5,23.0,60.0,24/12,24/12/2030,1:30,2030-12-24T01:30:00,25.12,267125272015603,2030-12-24T01:30:00+00:00,2030-12-24T01:30:00+01:00,2030-12-24T01:30:00+00:00,2030-12-24T01:30:00+00:00
ab98b8f2f2f2f2f2f2f2f2f3,85,12,24,11,71,75,12,94.0,47,47,23,151,9.0,60,11,51,2.2,17,2030,30,105100.0,25,94.0,sous station,9.4,202.5,23.0,60.0,24/12,24/12/2030,17:30,2030-12-24T17:30:00,25.12,267125272015603,2030-12-24T17:30:00+00:00,2030-12-24T17:30:00+01:00,2030-12-24T17:30:00+00:00,2030-12-24T17:30:00+00:00
ab9c98f2f2f2f2f2f2f2f2f3,85,12,28,9,71,75,12,94.0,47,47,23,151,9.0,60,11,51,2.2,17,2028,30,105100.0,25,94.0,sous station,9.4,202.5,23.0,60.0,28/12,28/12/2028,17:30,2028-12-28T17:30:00,25.12,267125272015603,2028-12-28T17:30:00+00:00,2028-12-28T17:30:00+01:00,2028-12-28T17:30:00+00:00,2028-12-28T17:30:00+00:00
ab84a0f2f2f2f2f2f2f2f2f3,85,12,4,10,7,75,12,94.0,47,47,23,151,9.0,60,11,51,2.2,1,2029,30,105100.0,25,94.0,sous station,9.4,202.5,23.0,60.0,4/12,4/12/2029,1:30,2029-12-04T01:30:00,25.12,267125272015603,2029-12-04T01:30:00+00:00,2029-12-04T01:30:00+01:00,2029-12-04T01:30:00+00:00,2029-12-04T01:30:00+00:00
ab549af2f2f2f2f2f2f2f2f3,85,10,20,9,87,75,12,94.0,47,47,23,151,9.0,60,11,51,2.2,21,2028,30,105100.0,25,94.0,sous station,9.4,202.5,23.0,60.0,20/10,20/10/2028,21:30,2028-10-20T21:30:00,25.12,267125272015603,2028-10-20T21:30:00+00:00,2028-10-20T21:30:00+02:00,2028-10-20T21:30:00+00:00,2028-10-20T21:30:00+00:00
ab54a8f2f2f2f2f2f2f2f2f3,85,10,20,10,71,75,12,94.0,47,47,23,151,9.0,60,11,51,2.2,17,2029,30,105100.0,25,94.0,sous station,9.4,202.5,23.0,60.0,20/10,20/10/2029,17:30,2029-10-20T17:30:00,25.12,267125272015603,2029-10-20T17:30:00+00:00,2029-10-20T17:30:00+02:00,2029-10-20T17:30:00+00:00,2029-10-20T17:30:00+00:00
ab64b6f2f2f2f2f2f2f2f2f3,85,11,4,11,55,75,12,94.0,47,47,23,151,9.0,60,11,51,2.2,13,2030,30,105100.0,25,94.0,sous station,9.4,202.5,23.0,60.0,4/11,4/11/2030,13:30,2030-11-04T13:30:00,25.12,267125272015603,2030-11-04T13:30:00+00:00,2030-11-04T13:30:00+01:00,2030-11-04T13:30:00+00:00,2030-11-04T13:30:00+00:00
ab6c94f2f2f2f2f2f2f2f2f3,85,11,12,9,39,75,12,94.0,47,47,23,151,9.0,60,11,51,2.2,9,2028,30,105100.0,25,94.0,sous station,9.4,202.5,23.0,60.0,12/11,12/11/2028,9:30,2028-11-12T09:30:00,25.12,267125272015603,2028-11-12T09:30:00+00:00,2028-11-12T09:30:00+01:00,2028-11-12T09:30:00+00:00,2028-11-12T09:30:00+00:00
ab9096f2f2f2f2f2f2f2f2f3,85,12,16,9,55,75,12,94.0,47,47,23,151,9.0,60,11,51,2.2,13,2028,30,105100.0,25,94.0,sous station,9.4,202.5,23.0,60.0,16/12,16/12/2028,13:30,2028-12-16T13:30:00,25.12,267125272015603,2028-12-16T13:30:00+00:00,2028-12-16T13:30:00+01:00,2028-12-16T13:30:00+00:00,2028-12-16T13:30:00+00:00
ab8caaf2f2f2f2f2f2f2f2f3,85,12,12,10,87,75,12,94.0,47,47,23,151,9.0,60,11,51,2.2,21,2029,30,105100.0,25,94.0,sous station,9.4,202.5,23.0,60.0,12/12,12/12/2029,21:30,2029-12-12T21:30:00,25.12,267125272015603,2029-12-12T21:30:00+00:00,2029-12-12T21:30:00+01:00,2029-12-12T21:30:00+00:00,2029-12-12T21:30:00+00:00
ab0c98f2f2f2f2f2f2f2f2f3,85,8,12,9,71,75,12,94.0,47,47,23,151,9.0,60,11,51,2.2,17,2028,30,105100.0,25,94.0,sous station,9.4,202.5,23.0,60.0,12/8,12/8/2028,17:30,2028-08-12T17:30:00,25.12,267125272015603,2028-08-12T17:30:00+00:00,2028-08-12T17:30:00+02:00,2028-08-12T17:30:00+00:00,2028-08-12T17:30:00+00:00
ab9caaf2f2f2f2f2f2f2f2f3,85,12,28,10,87,75,12,94.0,47,47,23,151,9.0,60,11,51,2.2,21,2029,30,105100.0,25,94.0,sous station,9.4,202.5,23.0,60.0,28/12,28/12/2029,21:30,2029-12-28T21:30:00,25.12,267125272015603,2029-12-28T21:30:00+00:00,2029-12-28T21:30:00+01:00,2029-12-28T21:30:00+00:00,2029-12-28T21:30:00+00:00
ab9cbaf2f2f2f2f2f2f2f2f3,85,12,28,11,87,75,12,94.0,47,47,23,151,9.0,60,11,51,2.2,21,2030,30,105100.0,25,94.0,sous station,9.4,202.5,23.0,60.0,28/12,28/12/2030,21:30,2030-12-28T21:30:00,25.12,267125272015603,2030-12-28T21:30:00+00:00,2030-12-28T21:30:00+01:00,2030-12-28T21:30:00+00:00,2030-12-28T21:30:00+00:00
ac24a4f2f2f2f2f2f2f2f2f3,86,1,4,10,39,75,12,94.0,47,47,23,151,9.0,60,11,51,2.2,9,2029,30,105100.0,25,94.0,sous station,9.4,202.5,23.0,60.0,4/1,4/1/2029,9:30,2029-01-04T09:30:00,25.12,267125272015603,2029-01-04T09:30:00+00:00,2029-01-04T09:30:00+01:00,2029-01-04T09:30:00+00:00,2029-01-04T09:30:00+00:00
ac24a6f2f2f2f2f2f2f2f2f3,86,1,4,10,55,75,12,94.0,47,47,23,151,9.0,60,11,51,2.2,13,2029,30,105100.0,25,94.0,sous station,9.4,202.5,23.0,60.0,4/1,4/1/2029,13:30,2029-01-04T13:30:00,25.12,267125272015603,2029-01-04T13:30:00+00:00,2029-01-04T13:30:00+01:00,2029-01-04T13:30:00+00:00,2029-01-04T13:30:00+00:00
a93c90f2f2f2f2f2f2f2f2f3,84,9,28,9,7,75,12,94.0,47,47,23,151,9.0,60,11,51,2.2,1,2028,30,105100.0,25,94.0,sous station,9.4,202.5,23.0,60.0,28/9,28/9/2028,1:30,2028-09-28T01:30:00,25.12,267125272015603,2028-09-28T01:30:00+00:00,2028-09-28T01:30:00+02:00,2028-09-28T01:30:00+00:00,2028-09-28T01:30:00+00:00
a93cb6f2f2f2f2f2f2f2f2f3,84,9,28,11,55,75,12,94.0,47,47,23,151,9.0,60,11,51,2.2,13,2030,30,105100.0,25,94.0,sous station,9.4,202.5,23.0,60.0,28/9,28/9/2030,13:30,2030-09-28T13:30:00,25.12,267125272015603,2030-09-28T13:30:00+00:00,2030-09-28T13:30:00+02:00,2030-09-28T13:30:00+00:00,2030-09-28T13:30:00+00:00
a95c88f2f2f2f2f2f2f2f2f3,84,10,28,8,71,75,12,94.0,47,47,23,151,9.0,60,11,51,2.2,17,2027,30,105100.0,25,94.0,sous station,9.4,202.5,23.0,60.0,28/10,28/10/2027,17:30,2027-10-28T17:30:00,25.12,267125272015603,2027-10-28T17:30:00+00:00,2027-10-28T17:30:00+02:00,2027-10-28T17:30:00+00:00,2027-10-28T17:30:00+00:00
a958a2f2f2f2f2f2f2f2f2f3,84,10,24,10,23,75,12,94.0,47,47,23,151,9.0,60,11,51,2.2,5,2029,30,105100.0,25,94.0,sous station,9.4,202.5,23.0,60.0,24/10,24/10/2029,5:30,2029-10-24T05:30:00,25.12,267125272015603,2029-10-24T05:30:00+00:00,2029-10-24T05:30:00+02:00,2029-10-24T05:30:00+00:00,2029-10-24T05:30:00+00:00
a95098f2f2f2f2f2f2f2f2f3,84,10,16,9,71,75,12,94.0,47,47,23,151,9.0,60,11,51,2.2,17,2028,30,105100.0,25,94.0,sous station,9.4,202.5,23.0,60.0,16/10,16/10/2028,17:30,2028-10-16T17:30:00,25.12,267125272015603,2028-10-16T17:30:00+00:00,2028-10-16T17:30:00+02:00,2028-10-16T17:30:00+00:00,2028-10-16T17:30:00+00:00
a95cb2f2f2f2f2f2f2f2f2f3,84,10,28,11,23,75,12,94.0,47,47,23,151,9.0,60,11,51,2.2,5,2030,30,105100.0,25,94.0,sous station,9.4,202.5,23.0,60.0,28/10,28/10/2030,5:30,2030-10-28T05:30:00,25.12,267125272015603,2030-10-28T05:30:00+00:00,2030-10-28T05:30:00+01:00,2030-10-28T05:30:00+00:00,2030-10-28T05:30:00+00:00
a988a0f2f2f2f2f2f2f2f2f3,84,12,8,10,7,75,12,94.0,47,47,23,151,9.0,60,11,51,2.2,1,2029,30,105100.0,25,94.0,sous station,9.4,202.5,23.0,60.0,8/12,8/12/2029,1:30,2029-12-08T01:30:00,25.12,267125272015603,2029-12-08T01:30:00+00:00,2029-12-08T01:30:00+01:00,2029-12-08T01:30:00+00:00,2029-12-08T01:30:00+00:00
a988b6f2f2f2f2f2f2f2f2f3,84,12,8,11,55,75,12,94.0,47,47,23,151,9.0,60,11,51,2.2,13,2030,30,105100.0,25,94.0,sous station,9.4,202.5,23.0,60.0,8/12,8/12/2030,13:30,2030-12-08T13:30:00,25.12,267125272015603,2030-12-08T13:30:00+00:00,2030-12-08T13:30:00+01:00,2030-12-08T13:30:00+00:00,2030-12-08T13:30:00+00:00
a99488f2f2f2f2f2f2f2f2f3,84,12,20,8,71,75,12,94.0,47,47,23,151,9.0,60,11,51,2.2,17,2027,30,105100.0,25,94.0,sous station,9.4,202.5,23.0,60.0,20/12,20/12/2027,17:30,2027-12-20T17:30:00,25.12,267125272015603,2027-12-20T17:30:00+00:00,2027-12-20T17:30:00+01:00,2027-12-20T17:30:00+00:00,2027-12-20T17:30:00+00:00
a998b8f2f2f2f2f2f2f2f2f3,84,12,24,11,71,75,12,94.0,47,47,23,151,9.0,60,11,51,2.2,17,2030,30,105100.0,25,94.0,sous station,9.4,202.5,23.0,60.0,24/12,24/12/2030,17:30,2030-12-24T17:30:00,25.12,267125272015603,2030-12-24T17:30:00+00:00,2030-12-24T17:30:00+01:00,2030-12-24T17:30:00+00:00,2030-12-24T17:30:00+00:00
ab54a0f2f2f2f2f2f2f2f2f3,85,10,20,10,7,75,12,94.0,47,47,23,151,9.0,60,11,51,2.2,1,2029,30,105100.0,25,94.0,sous station,9.4,202.5,23.0,60.0,20/10,20/10/2029,1:30,2029-10-20T01:30:00,25.12,267125272015603,2029-10-20T01:30:00+00:00,2029-10-20T01:30:00+02:00,2029-10-20T01:30:00+00:00,2029-10-20T01:30:00+00:00
ab54a6f2f2f2f2f2f2f2f2f3,85,10,20,10,55,75,12,94.0,47,47,23,151,9.0,60,11,51,2.2,13,2029,30,105100.0,25,94.0,sous station,9.4,202.5,23.0,60.0,20/10,20/10/2029,13:30,2029-10-20T13:30:00,25.12,267125272015603,2029-10-20T13:30:00+00:00,2029-10-20T13:30:00+02:00,2029-10-20T13:30:00+00:00,2029-10-20T13:30:00+00:00
a98c98f2f2f2f2f2f2f2f2f3,84,12,12,9,71,75,12,94.0,47,47,23,151,9.0,60,11,51,2.2,17,2028,30,105100.0,25,94.0,sous station,9.4,202.5,23.0,60.0,12/12,12/12/2028,17:30,2028-12-12T17:30:00,25.12,267125272015603,2028-12-12T17:30:00+00:00,2028-12-12T17:30:00+01:00,2028-12-12T17:30:00+00:00,2028-12-12T17:30:00+00:00
a98ca4f2f2f2f2f2f2f2f2f3,84,12,12,10,39,75,12,94.0,47,47,23,151,9.0,60,11,51,2.2,9,2029,30,105100.0,25,94.0,sous station,9.4,202.5,23.0,60.0,12/12,12/12/2029,9:30,2029-12-12T09:30:00,25.12,267125272015603,2029-12-12T09:30:00+00:00,2029-12-12T09:30:00+01:00,2029-12-12T09:30:00+00:00,2029-12-12T09:30:00+00:00
a98ca8f2f2f2f2f2f2f2f2f3,84,12,12,10,71,75,12,94.0,47,47,23,151,9.0,60,11,51,2.2,17,2029,30,105100.0,25,94.0,sous station,9.4,202.5,23.0,60.0,12/12,12/12/2029,17:30,2029-12-12T17:30:00,25.12,267125272015603,2029-12-12T17:30:00+00:00,2029-12-12T17:30:00+01:00,2029-12-12T17:30:00+00:00,2029-12-12T17:30:00+00:00
ab1c84f2f2f2f2f2f2f2f2f3,85,8,28,8,39,75,12,94.0,47,47,23,151,9.0,60,11,51,2.2,9,2027,30,105100.0,25,94.0,sous station,9.4,202.5,23.0,60.0,28/8,28/8/2027,9:30,2027-08-28T09:30:00,25.12,267125272015603,2027-08-28T09:30:00+00:00,2027-08-28T09:30:00+02:00,2027-08-28T09:30:00+00:00,2027-08-28T09:30:00+00:00
ab08b6f2f2f2f2f2f2f2f2f3,85,8,8,11,55,75,12,94.0,47,47,23,151,9.0,60,11,51,2.2,13,2030,30,105100.0,25,94.0,sous station,9.4,202.5,23.0,60.0,8/8,8/8/2030,13:30,2030-08-08T13:30:00,25.12,267125272015603,2030-08-08T13:30:00+00:00,2030-08-08T13:30:00+02:00,2030-08-08T13:30:00+00:00,2030-08-08T13:30:00+00:00
ab0cb4f2f2f2f2f2f2f2f2f3,85,8,12,11,39,75,12,94.0,47,47,23,151,9.0,60,11,51,2.2,9,2030,30,105100.0,25,94.0,sous station,9.4,202.5,23.0,60.0,12/8,12/8/2030,9:30,2030-08-12T09:30:00,25.12,267125272015603,2030-08-12T09:30:00+00:00,2030-08-12T09:30:00+02:00,2030-08-12T09:30:00+00:00,2030-08-12T09:30:00+00:00
ab9c94f2f2f2f2f2f2f2f2f3,85,12,28,9,39,75,12,94.0,47,47,23,151,9.0,60,11,51,2.2,9,2028,30,105100.0,25,94.0,sous station,9.4,202.5,23.0,60.0,28/12,28/12/2028,9:30,2028-12-28T09:30:00,25.12,267125272015603,2028-12-28T09:30:00+00:00,2028-12-28T09:30:00+01:00,2028-12-28T09:30:00+00:00,2028-12-28T09:30:00+00:00
ab10a0f2f2f2f2f2f2f2f2f3,85,8,16,10,7,75,12,94.0,47,47,23,151,9.0,60,11,51,2.2,1,2029,30,105100.0,25,94.0,sous station,9.4,202.5,23.0,60.0,16/8,16/8/2029,1:30,2029-08-16T01:30:00,25.12,267125272015603,2029-08-16T01:30:00+00:00,2029-08-16T01:30:00+02:00,2029-08-16T01:30:00+00:00,2029-08-16T01:30:00+00:00
ab089af2f2f2f2f2f2f2f2f3,85,8,8,9,87,75,12,94.0,47,47,23,151,9.0,60,11,51,2.2,21,2028,30,105100.0,25,94.0,sous station,9.4,202.5,23.0,60.0,8/8,8/8/2028,21:30,2028-08-08T21:30:00,25.12,267125272015603,2028-08-08T21:30:00+00:00,2028-08-08T21:30:00+02:00,2028-08-08T21:30:00+00:00,2028-08-08T21:30:00+00:00
ab0cbaf2f2f2f2f2f2f2f2f3,85,8,12,11,87,75,12,94.0,47,47,23,151,9.0,60,11,51,2.2,21,2030,30,105100.0,25,94.0,sous station,9.4,202.5,23.0,60.0,12/8,12/8/2030,21:30,2030-08-12T21:30:00,25.12,267125272015603,2030-08-12T21:30:00+00:00,2030-08-12T21:30:00+02:00,2030-08-12T21:30:00+00:00,2030-08-12T21:30:00+00:00
ab14b4f2f2f2f2f2f2f2f2f3,85,8,20,11,39,75,12,94.0,47,47,23,151,9.0,60,11,51,2.2,9,2030,30,105100.0,25,94.0,sous station,9.4,202.5,23.0,60.0,20/8,20/8/2030,9:30,2030-08-20T09:30:00,25.12,267125272015603,2030-08-20T09:30:00+00:00,2030-08-20T09:30:00+02:00,2030-08-20T09:30:00+00:00,2030-08-20T09:30:00+00:00
aa68b0f2f2f2f2f2f2f2f2f3,85,3,8,11,7,75,12,94.0,47,47,23,151,9.0,60,11,51,2.2,1,2030,30,105100.0,25,94.0,sous station,9.4,202.5,23.0,60.0,8/3,8/3/2030,1:30,2030-03-08T01:30:00,25.12,267125272015603,2030-03-08T01:30:00+00:00,2030-03-08T01:30:00+01:00,2030-03-08T01:30:00+00:00,2030-03-08T01:30:00+00:00
ab84a6f2f2f2f2f2f2f2f2f3,85,12,4,10,55,75,12,94.0,47,47,23,151,9.0,60,11,51,2.2,13,2029,30,105100.0,25,94.0,sous station,9.4,202.5,23.0,60.0,4/12,4/12/2029,13:30,2029-12-04T13:30:00,25.12,267125272015603,2029-12-04T13:30:00+00:00,2029-12-04T13:30:00+01:00,2029-12-04T13:30:00+00:00,2029-12-04T13:30:00+00:00
aa449af2f2f2f2f2f2f2f2f3,85,2,4,9,87,75,12,94.0,47,47,23,151,9.0,60,11,51,2.2,21,2028,30,105100.0,25,94.0,sous station,9.4,202.5,23.0,60.0,4/2,4/2/2028,21:30,2028-02-04T21:30:00,25.12,267125272015603,2028-02-04T21:30:00+00:00,2028-02-04T21:30:00+01:00,2028-02-04T21:30:00+00:00,2028-02-04T21:30:00+00:00
aa44a0f2f2f2f2f2f2f2f2f3,85,2,4,10,7,75,12,94.0,47,47,23,151,9.0,60,11,51,2.2,1,2029,30,105100.0,25,94.0,sous station,9.4,202.5,23.0,60.0,4/2,4/2/2029,1:30,2029-02-04T01:30:00,25.12,267125272015603,2029-02-04T01:30:00+00:00,2029-02-04T01:30:00+01:00,2029-02-04T01:30:00+00:00,2029-02-04T01:30:00+00:00
aa44b0f2f2f2f2f2f2f2f2f3,85,2,4,11,7,75,12,94.0,47,47,23,151,9.0,60,11,51,2.2,1,2030,30,105100.0,25,94.0,sous station,9.4,202.5,23.0,60.0,4/2,4/2/2030,1:30,2030-02-04T01:30:00,25.12,267125272015603,2030-02-04T01:30:00+00:00,2030-02-04T01:30:00+01:00,2030-02-04T01:30:00+00:00,2030-02-04T01:30:00+00:00
aa4896f2f2f2f2f2f2f2f2f3,85,2,8,9,55,75,12,94.0,47,47,23,151,9.0,60,11,51,2.2,13,2028,30,105100.0,25,94.0,sous station,9.4,202.5,23.0,60.0,8/2,8/2/2028,13:30,2028-02-08T13:30:00,25.12,267125272015603,2028-02-08T13:30:00+00:00,2028-02-08T13:30:00+01:00,2028-02-08T13:30:00+00:00,2028-02-08T13:30:00+00:00
ac24b0f2f2f2f2f2f2f2f2f3,86,1,4,11,7,75,12,94.0,47,47,23,151,9.0,60,11,51,2.2,1,2030,30,105100.0,25,94.0,sous station,9.4,202.5,23.0,60.0,4/1,4/1/2030,1:30,2030-01-04T01:30:00,25.12,267125272015603,2030-01-04T01:30:00+00:00,2030-01-04T01:30:00+01:00,2030-01-04T01:30:00+00:00,2030-01-04T01:30:00+00:00
ac24b2f2f2f2f2f2f2f2f2f3,86,1,4,11,23,75,12,94.0,47,47,23,151,9.0,60,11,51,2.2,5,2030,30,105100.0,25,94.0,sous station,9.4,202.5,23.0,60.0,4/1,4/1/2030,5:30,2030-01-04T05:30:00,25.12,267125272015603,2030-01-04T05:30:00+00:00,2030-01-04T05:30:00+01:00,2030-01-04T05:30:00+00:00,2030-01-04T05:30:00+00:00
aa6492f2f2f2f2f2f2f2f2f3,85,3,4,9,23,75,12,94.0,47,47,23,151,9.0,60,11,51,2.2,5,2028,30,105100.0,25,94.0,sous station,9.4,202.5,23.0,60.0,4/3,4/3/2028,5:30,2028-03-04T05:30:00,25.12,267125272015603,2028-03-04T05:30:00+00:00,2028-03-04T05:30:00+01:00,2028-03-04T05:30:00+00:00,2028-03-04T05:30:00+00:00
aafcb0f2f2f2f2f2f2f2f2f3,85,7,28,11,7,75,12,94.0,47,47,23,151,9.0,60,11,51,2.2,1,2030,30,105100.0,25,94.0,sous station,9.4,202.5,23.0,60.0,28/7,28/7/2030,1:30,2030-07-28T01:30:00,25.12,267125272015603,2030-07-28T01:30:00+00:00,2030-07-28T01:30:00+02:00,2030-07-28T01:30:00+00:00,2030-07-28T01:30:00+00:00
ab18a2f2f2f2f2f2f2f2f2f3,85,8,24,10,23,75,12,94.0,47,47,23,151,9.0,60,11,51,2.2,5,2029,30,105100.0,25,94.0,sous station,9.4,202.5,23.0,60.0,24/8,24/8/2029,5:30,2029-08-24T05:30:00,25.12,267125272015603,2029-08-24T05:30:00+00:00,2029-08-24T05:30:00+02:00,2029-08-24T05:30:00+00:00,2029-08-24T05:30:00+00:00
ab4c88f2f2f2f2f2f2f2f2f3,85,10,12,8,71,75,12,94.0,47,47,23,151,9.0,60,11,51,2.2,17,2027,30,105100.0,25,94.0,sous station,9.4,202.5,23.0,60.0,12/10,12/10/2027,17:30,2027-10-12T17:30:00,25.12,267125272015603,2027-10-12T17:30:00+00:00,2027-10-12T17:30:00+02:00,2027-10-12T17:30:00+00:00,2027-10-12T17:30:00+00:00
ab18b2f2f2f2f2f2f2f2f2f3,85,8,24,11,23,75,12,94.0,47,47,23,151,9.0,60,11,51,2.2,5,2030,30,105100.0,25,94.0,sous station,9.4,202.5,23.0,60.0,24/8,24/8/2030,5:30,2030-08-24T05:30:00,25.12,267125272015603,2030-08-24T05:30:00+00:00,2030-08-24T05:30:00+02:00,2030-08-24T05:30:00+00:00,2030-08-24T05:30:00+00:00
ab4cbaf2f2f2f2f2f2f2f2f3,85,10,12,11,87,75,12,94.0,47,47,23,151,9.0,60,11,51,2.2,21,2030,30,105100.0,25,94.0,sous station,9.4,202.5,23.0,60.0,12/10,12/10/2030,21:30,2030-10-12T21:30:00,25.12,267125272015603,2030-10-12T21:30:00+00:00,2030-10-12T21:30:00+02:00,2030-10-12T21:30:00+00:00,2030-10-12T21:30:00+00:00
ab4c94f2f2f2f2f2f2f2f2f3,85,10,12,9,39,75,12,94.0,47,47,23,151,9.0,60,11,51,2.2,9,2028,30,105100.0,25,94.0,sous station,9.4,202.5,23.0,60.0,12/10,12/10/2028,9:30,2028-10-12T09:30:00,25.12,267125272015603,2028-10-12T09:30:00+00:00,2028-10-12T09:30:00+02:00,2028-10-12T09:30:00+00:00,2028-10-12T09:30:00+00:00
ab5084f2f2f2f2f2f2f2f2f3,85,10,16,8,39,75,12,94.0,47,47,23,151,9.0,60,11,51,2.2,9,2027,30,105100.0,25,94.0,sous station,9.4,202.5,23.0,60.0,16/10,16/10/2027,9:30,2027-10-16T09:30:00,25.12,267125272015603,2027-10-16T09:30:00+00:00,2027-10-16T09:30:00+02:00,2027-10-16T09:30:00+00:00,2027-10-16T09:30:00+00:00
ab109af2f2f2f2f2f2f2f2f3,85,8,16,9,87,75,12,94.0,47,47,23,151,9.0,60,11,51,2.2,21,2028,30,105100.0,25,94.0,sous station,9.4,202.5,23.0,60.0,16/8,16/8/2028,21:30,2028-08-16T21:30:00,25.12,267125272015603,2028-08-16T21:30:00+00:00,2028-08-16T21:30:00+02:00,2028-08-16T21:30:00+00:00,2028-08-16T21:30:00+00:00
ab50b4f2f2f2f2f2f2f2f2f3,85,10,16,11,39,75,12,94.0,47,47,23,151,9.0,60,11,51,2.2,9,2030,30,105100.0,25,94.0,sous station,9.4,202.5,23.0,60.0,16/10,16/10/2030,9:30,2030-10-16T09:30:00,25.12,267125272015603,2030-10-16T09:30:00+00:00,2030-10-16T09:30:00+02:00,2030-10-16T09:30:00+00:00,2030-10-16T09:30:00+00:00
ab5c8af2f2f2f2f2f2f2f2f3,85,10,28,8,87,75,12,94.0,47,47,23,151,9.0,60,11,51,2.2,21,2027,30,105100.0,25,94.0,sous station,9.4,202.5,23.0,60.0,28/10,28/10/2027,21:30,2027-10-28T21:30:00,25.12,267125272015603,2027-10-28T21:30:00+00:00,2027-10-28T21:30:00+02:00,2027-10-28T21:30:00+00:00,2027-10-28T21:30:00+00:00
ab5c94f2f2f2f2f2f2f2f2f3,85,10,28,9,39,75,12,94.0,47,47,23,151,9.0,60,11,51,2.2,9,2028,30,105100.0,25,94.0,sous station,9.4,202.5,23.0,60.0,28/10,28/10/2028,9:30,2028-10-28T09:30:00,25.12,267125272015603,2028-10-28T09:30:00+00:00,2028-10-28T09:30:00+02:00,2028-10-28T09:30:00+00:00,2028-10-28T09:30:00+00:00
ab98aaf2f2f2f2f2f2f2f2f3,85,12,24,10,87,75,12,94.0,47,47,23,151,9.0,60,11,51,2.2,21,2029,30,105100.0,25,94.0,sous station,9.4,202.5,23.0,60.0,24/12,24/12/2029,21:30,2029-12-24T21:30:00,25.12,267125272015603,2029-12-24T21:30:00+00:00,2029-12-24T21:30:00+01:00,2029-12-24T21:30:00+00:00,2029-12-24T21:30:00+00:00
ab5492f2f2f2f2f2f2f2f2f3,85,10,20,9,23,75,12,94.0,47,47,23,151,9.0,60,11,51,2.2,5,2028,30,105100.0,25,94.0,sous station,9.4,202.5,23.0,60.0,20/10,20/10/2028,5:30,2028-10-20T05:30:00,25.12,267125272015603,2028-10-20T05:30:00+00:00,2028-10-20T05:30:00+02:00,2028-10-20T05:30:00+00:00,2028-10-20T05:30:00+00:00
ab58b4f2f2f2f2f2f2f2f2f3,85,10,24,11,39,75,12,94.0,47,47,23,151,9.0,60,11,51,2.2,9,2030,30,105100.0,25,94.0,sous station,9.4,202.5,23.0,60.0,24/10,24/10/2030,9:30,2030-10-24T09:30:00,25.12,267125272015603,2030-10-24T09:30:00+00:00,2030-10-24T09:30:00+02:00,2030-10-24T09:30:00+00:00,2030-10-24T09:30:00+00:00
ab58b8f2f2f2f2f2f2f2f2f3,85,10,24,11,71,75,12,94.0,47,47,23,151,9.0,60,11,51,2.2,17,2030,30,105100.0,25,94.0,sous station,9.4,202.5,23.0,60.0,24/10,24/10/2030,17:30,2030-10-24T17:30:00,25.12,267125272015603,2030-10-24T17:30:00+00:00,2030-10-24T17:30:00+02:00,2030-10-24T17:30:00+00:00,2030-10-24T17:30:00+00:00
ab88b6f2f2f2f2f2f2f2f2f3,85,12,8,11,55,75,12,94.0,47,47,23,151,9.0,60,11,51,2.2,13,2030,30,105100.0,25,94.0,sous station,9.4,202.5,23.0,60.0,8/12,8/12/2030,13:30,2030-12-08T13:30:00,25.12,267125272015603,2030-12-08T13:30:00+00:00,2030-12-08T13:30:00+01:00,2030-12-08T13:30:00+00:00,2030-12-08T13:30:00+00:00
ab8cbaf2f2f2f2f2f2f2f2f3,85,12,12,11,87,75,12,94.0,47,47,23,151,9.0,60,11,51,2.2,21,2030,30,105100.0,25,94.0,sous station,9.4,202.5,23.0,60.0,12/12,12/12/2030,21:30,2030-12-12T21:30:00,25.12,267125272015603,2030-12-12T21:30:00+00:00,2030-12-12T21:30:00+01:00,2030-12-12T21:30:00+00:00,2030-12-12T21:30:00+00:00
ac2496f2f2f2f2f2f2f2f2f3,86,1,4,9,55,75,12,94.0,47,47,23,151,9.0,60,11,51,2.2,13,2028,30,105100.0,25,94.0,sous station,9.4,202.5,23.0,60.0,4/1,4/1/2028,13:30,2028-01-04T13:30:00,25.12,267125272015603,2028-01-04T13:30:00+00:00,2028-01-04T13:30:00+01:00,2028-01-04T13:30:00+00:00,2028-01-04T13:30:00+00:00
aa5c9af2f2f2f2f2f2f2f2f3,85,2,28,9,87,75,12,94.0,47,47,23,151,9.0,60,11,51,2.2,21,2028,30,105100.0,25,94.0,sous station,9.4,202.5,23.0,60.0,28/2,28/2/2028,21:30,2028-02-28T21:30:00,25.12,267125272015603,2028-02-28T21:30:00+00:00,2028-02-28T21:30:00+01:00,2028-02-28T21:30:00+00:00,2028-02-28T21:30:00+00:00
ab888af2f2f2f2f2f2f2f2f3,85,12,8,8,87,75,12,94.0,47,47,23,151,9.0,60,11,51,2.2,21,2027,30,105100.0,25,94.0,sous station,9.4,202.5,23.0,60.0,8/12,8/12/2027,21:30,2027-12-08T21:30:00,25.12,267125272015603,2027-12-08T21:30:00+00:00,2027-12-08T21:30:00+01:00,2027-12-08T21:30:00+00:00,2027-12-08T21:30:00+00:00
ab88a0f2f2f2f2f2f2f2f2f3,85,12,8,10,7,75,12,94.0,47,47,23,151,9.0,60,11,51,2.2,1,2029,30,105100.0,25,94.0,sous station,9.4,202.5,23.0,60.0,8/12,8/12/2029,1:30,2029-12-08T01:30:00,25.12,267125272015603,2029-12-08T01:30:00+00:00,2029-12-08T01:30:00+01:00,2029-12-08T01:30:00+00:00,2029-12-08T01:30:00+00:00
ab9ca8f2f2f2f2f2f2f2f2f3,85,12,28,10,71,75,12,94.0,47,47,23,151,9.0,60,11,51,2.2,17,2029,30,105100.0,25,94.0,sous station,9.4,202.5,23.0,60.0,28/12,28/12/2029,17:30,2029-12-28T17:30:00,25.12,267125272015603,2029-12-28T17:30:00+00:00,2029-12-28T17:30:00+01:00,2029-12-28T17:30:00+00:00,2029-12-28T17:30:00+00:00
ab8c96f2f2f2f2f2f2f2f2f3,85,12,12,9,55,75,12,94.0,47,47,23,151,9.0,60,11,51,2.2,13,2028,30,105100.0,25,94.0,sous station,9.4,202.5,23.0,60.0,12/12,12/12/2028,13:30,2028-12-12T13:30:00,25.12,267125272015603,2028-12-12T13:30:00+00:00,2028-12-12T13:30:00+01:00,2028-12-12T13:30:00+00:00,2028-12-12T13:30:00+00:00
a88498f2f2f2f2f2f2f2f2f3,84,4,4,9,71,75,12,94.0,47,47,23,151,9.0,60,11,51,2.2,17,2028,30,105100.0,25,94.0,sous station,9.4,202.5,23.0,60.0,4/4,4/4/2028,17:30,2028-04-04T17:30:00,25.12,267125272015603,2028-04-04T17:30:00+00:00,2028-04-04T17:30:00+02:00,2028-04-04T17:30:00+00:00,2028-04-04T17:30:00+00:00
a8b488f2f2f2f2f2f2f2f2f3,84,5,20,8,71,75,12,94.0,47,47,23,151,9.0,60,11,51,2.2,17,2027,30,105100.0,25,94.0,sous station,9.4,202.5,23.0,60.0,20/5,20/5/2027,17:30,2027-05-20T17:30:00,25.12,267125272015603,2027-05-20T17:30:00+00:00,2027-05-20T17:30:00+02:00,2027-05-20T17:30:00+00:00,2027-05-20T17:30:00+00:00
a8b498f2f2f2f2f2f2f2f2f3,84,5,20,9,71,75,12,94.0,47,47,23,151,9.0,60,11,51,2.2,17,2028,30,105100.0,25,94.0,sous station,9.4,202.5,23.0,60.0,20/5,20/5/2028,17:30,2028-05-20T17:30:00,25.12,267125272015603,2028-05-20T17:30:00+00:00,2028-05-20T17:30:00+02:00,2028-05-20T17:30:00+00:00,2028-05-20T17:30:00+00:00
a8c4b6f2f2f2f2f2f2f2f2f3,84,6,4,11,55,75,12,94.0,47,47,23,151,9.0,60,11,51,2.2,13,2030,30,105100.0,25,94.0,sous station,9.4,202.5,23.0,60.0,4/6,4/6/2030,13:30,2030-06-04T13:30:00,25.12,267125272015603,2030-06-04T13:30:00+00:00,2030-06-04T13:30:00+02:00,2030-06-04T13:30:00+00:00,2030-06-04T13:30:00+00:00
a8bcb4f2f2f2f2f2f2f2f2f3,84,5,28,11,39,75,12,94.0,47,47,23,151,9.0,60,11,51,2.2,9,2030,30,105100.0,25,94.0,sous station,9.4,202.5,23.0,60.0,28/5,28/5/2030,9:30,2030-05-28T09:30:00,25.12,267125272015603,2030-05-28T09:30:00+00:00,2030-05-28T09:30:00+02:00,2030-05-28T09:30:00+00:00,2030-05-28T09:30:00+00:00
a8dca2f2f2f2f2f2f2f2f2f3,84,6,28,10,23,75,12,94.0,47,47,23,151,9.0,60,11,51,2.2,5,2029,30,105100.0,25,94.0,sous station,9.4,202.5,23.0,60.0,28/6,28/6/2029,5:30,2029-06-28T05:30:00,25.12,267125272015603,2029-06-28T05:30:00+00:00,2029-06-28T05:30:00+02:00,2029-06-28T05:30:00+00:00,2029-06-28T05:30:00+00:00
a91494f2f2f2f2f2f2f2f2f3,84,8,20,9,39,75,12,94.0,47,47,23,151,9.0,60,11,51,2.2,9,2028,30,105100.0,25,94.0,sous station,9.4,202.5,23.0,60.0,20/8,20/8/2028,9:30,2028-08-20T09:30:00,25.12,267125272015603,2028-08-20T09:30:00+00:00,2028-08-20T09:30:00+02:00,2028-08-20T09:30:00+00:00,2028-08-20T09:30:00+00:00
a918baf2f2f2f2f2f2f2f2f3,84,8,24,11,87,75,12,94.0,47,47,23,151,9.0,60,11,51,2.2,21,2030,30,105100.0,25,94.0,sous station,9.4,202.5,23.0,60.0,24/8,24/8/2030,21:30,2030-08-24T21:30:00,25.12,267125272015603,2030-08-24T21:30:00+00:00,2030-08-24T21:30:00+02:00,2030-08-24T21:30:00+00:00,2030-08-24T21:30:00+00:00
a908b2f2f2f2f2f2f2f2f2f3,84,8,8,11,23,75,12,94.0,47,47,23,151,9.0,60,11,51,2.2,5,2030,30,105100.0,25,94.0,sous station,9.4,202.5,23.0,60.0,8/8,8/8/2030,5:30,2030-08-08T05:30:00,25.12,267125272015603,2030-08-08T05:30:00+00:00,2030-08-08T05:30:00+02:00,2030-08-08T05:30:00+00:00,2030-08-08T05:30:00+00:00
a91cb4f2f2f2f2f2f2f2f2f3,84,8,28,11,39,75,12,94.0,47,47,23,151,9.0,60,11,51,2.2,9,2030,30,105100.0,25,94.0,sous station,9.4,202.5,23.0,60.0,28/8,28/8/2030,9:30,2030-08-28T09:30:00,25.12,267125272015603,2030-08-28T09:30:00+00:00,2030-08-28T09:30:00+02:00,2030-08-28T09:30:00+00:00,2030-08-28T09:30:00+00:00
a92896f2f2f2f2f2f2f2f2f3,84,9,8,9,55,75,12,94.0,47,47,23,151,9.0,60,11,51,2.2,13,2028,30,105100.0,25,94.0,sous station,9.4,202.5,23.0,60.0,8/9,8/9/2028,13:30,2028-09-08T13:30:00,25.12,267125272015603,2028-09-08T13:30:00+00:00,2028-09-08T13:30:00+02:00,2028-09-08T13:30:00+00:00,2028-09-08T13:30:00+00:00
a928b0f2f2f2f2f2f2f2f2f3,84,9,8,11,7,75,12,94.0,47,47,23,151,9.0,60,11,51,2.2,1,2030,30,105100.0,25,94.0,sous station,9.4,202.5,23.0,60.0,8/9,8/9/2030,1:30,2030-09-08T01:30:00,25.12,267125272015603,2030-09-08T01:30:00+00:00,2030-09-08T01:30:00+02:00,2030-09-08T01:30:00+00:00,2030-09-08T01:30:00+00:00
a93090f2f2f2f2f2f2f2f2f3,84,9,16,9,7,75,12,94.0,47,47,23,151,9.0,60,11,51,2.2,1,2028,30,105100.0,25,94.0,sous station,9.4,202.5,23.0,60.0,16/9,16/9/2028,1:30,2028-09-16T01:30:00,25.12,267125272015603,2028-09-16T01:30:00+00:00,2028-09-16T01:30:00+02:00,2028-09-16T01:30:00+00:00,2028-09-16T01:30:00+00:00
a93496f2f2f2f2f2f2f2f2f3,84,9,20,9,55,75,12,94.0,47,47,23,151,9.0,60,11,51,2.2,13,2028,30,105100.0,25,94.0,sous station,9.4,202.5,23.0,60.0,20/9,20/9/2028,13:30,2028-09-20T13:30:00,25.12,267125272015603,2028-09-20T13:30:00+00:00,2028-09-20T13:30:00+02:00,2028-09-20T13:30:00+00:00,2028-09-20T13:30:00+00:00
a930b4f2f2f2f2f2f2f2f2f3,84,9,16,11,39,75,12,94.0,47,47,23,151,9.0,60,11,51,2.2,9,2030,30,105100.0,25,94.0,sous station,9.4,202.5,23.0,60.0,16/9,16/9/2030,9:30,2030-09-16T09:30:00,25.12,267125272015603,2030-09-16T09:30:00+00:00,2030-09-16T09:30:00+02:00,2030-09-16T09:30:00+00:00,2030-09-16T09:30:00+00:00
a98ca2f2f2f2f2f2f2f2f2f3,84,12,12,10,23,75,12,94.0,47,47,23,151,9.0,60,11,51,2.2,5,2029,30,105100.0,25,94.0,sous station,9.4,202.5,23.0,60.0,12/12,12/12/2029,5:30,2029-12-12T05:30:00,25.12,267125272015603,2029-12-12T05:30:00+00:00,2029-12-12T05:30:00+01:00,2029-12-12T05:30:00+00:00,2029-12-12T05:30:00+00:00
a98caaf2f2f2f2f2f2f2f2f3,84,12,12,10,87,75,12,94.0,47,47,23,151,9.0,60,11,51,2.2,21,2029,30,105100.0,25,94.0,sous station,9.4,202.5,23.0,60.0,12/12,12/12/2029,21:30,2029-12-12T21:30:00,25.12,267125272015603,2029-12-12T21:30:00+00:00,2029-12-12T21:30:00+01:00,2029-12-12T21:30:00+00:00,2029-12-12T21:30:00+00:00
a98cb4f2f2f2f2f2f2f2f2f3,84,12,12,11,39,75,12,94.0,47,47,23,151,9.0,60,11,51,2.2,9,2030,30,105100.0,25,94.0,sous station,9.4,202.5,23.0,60.0,12/12,12/12/2030,9:30,2030-12-12T09:30:00,25.12,267125272015603,2030-12-12T09:30:00+00:00,2030-12-12T09:30:00+01:00,2030-12-12T09:30:00+00:00,2030-12-12T09:30:00+00:00
a99884f2f2f2f2f2f2f2f2f3,84,12,24,8,39,75,12,94.0,47,47,23,151,9.0,60,11,51,2.2,9,2027,30,105100.0,25,94.0,sous station,9.4,202.5,23.0,60.0,24/12,24/12/2027,9:30,2027-12-24T09:30:00,25.12,267125272015603,2027-12-24T09:30:00+00:00,2027-12-24T09:30:00+01:00,2027-12-24T09:30:00+00:00,2027-12-24T09:30:00+00:00
a94894f2f2f2f2f2f2f2f2f3,84,10,8,9,39,75,12,94.0,47,47,23,151,9.0,60,11,51,2.2,9,2028,30,105100.0,25,94.0,sous station,9.4,202.5,23.0,60.0,8/10,8/10/2028,9:30,2028-10-08T09:30:00,25.12,267125272015603,2028-10-08T09:30:00+00:00,2028-10-08T09:30:00+02:00,2028-10-08T09:30:00+00:00,2028-10-08T09:30:00+00:00
a96894f2f2f2f2f2f2f2f2f3,84,11,8,9,39,75,12,94.0,47,47,23,151,9.0,60,11,51,2.2,9,2028,30,105100.0,25,94.0,sous station,9.4,202.5,23.0,60.0,8/11,8/11/2028,9:30,2028-11-08T09:30:00,25.12,267125272015603,2028-11-08T09:30:00+00:00,2028-11-08T09:30:00+01:00,2028-11-08T09:30:00+00:00,2028-11-08T09:30:00+00:00
a968a6f2f2f2f2f2f2f2f2f3,84,11,8,10,55,75,12,94.0,47,47,23,151,9.0,60,11,51,2.2,13,2029,30,105100.0,25,94.0,sous station,9.4,202.5,23.0,60.0,8/11,8/11/2029,13:30,2029-11-08T13:30:00,25.12,267125272015603,2029-11-08T13:30:00+00:00,2029-11-08T13:30:00+01:00,2029-11-08T13:30:00+00:00,2029-11-08T13:30:00+00:00
a968b4f2f2f2f2f2f2f2f2f3,84,11,8,11,39,75,12,94.0,47,47,23,151,9.0,60,11,51,2.2,9,2030,30,105100.0,25,94.0,sous station,9.4,202.5,23.0,60.0,8/11,8/11/2030,9:30,2030-11-08T09:30:00,25.12,267125272015603,2030-11-08T09:30:00+00:00,2030-11-08T09:30:00+01:00,2030-11-08T09:30:00+00:00,2030-11-08T09:30:00+00:00
a950a4f2f2f2f2f2f2f2f2f3,84,10,16,10,39,75,12,94.0,47,47,23,151,9.0,60,11,51,2.2,9,2029,30,105100.0,25,94.0,sous station,9.4,202.5,23.0,60.0,16/10,16/10/2029,9:30,2029-10-16T09:30:00,25.12,267125272015603,2029-10-16T09:30:00+00:00,2029-10-16T09:30:00+02:00,2029-10-16T09:30:00+00:00,2029-10-16T09:30:00+00:00
a954b2f2f2f2f2f2f2f2f2f3,84,10,20,11,23,75,12,94.0,47,47,23,151,9.0,60,11,51,2.2,5,2030,30,105100.0,25,94.0,sous station,9.4,202.5,23.0,60.0,20/10,20/10/2030,5:30,2030-10-20T05:30:00,25.12,267125272015603,2030-10-20T05:30:00+00:00,2030-10-20T05:30:00+02:00,2030-10-20T05:30:00+00:00,2030-10-20T05:30:00+00:00
a94892f2f2f2f2f2f2f2f2f3,84,10,8,9,23,75,12,94.0,47,47,23,151,9.0,60,11,51,2.2,5,2028,30,105100.0,25,94.0,sous station,9.4,202.5,23.0,60.0,8/10,8/10/2028,5:30,2028-10-08T05:30:00,25.12,267125272015603,2028-10-08T05:30:00+00:00,2028-10-08T05:30:00+02:00,2028-10-08T05:30:00+00:00,2028-10-08T05:30:00+00:00
a93ca6f2f2f2f2f2f2f2f2f3,84,9,28,10,55,75,12,94.0,47,47,23,151,9.0,60,11,51,2.2,13,2029,30,105100.0,25,94.0,sous station,9.4,202.5,23.0,60.0,28/9,28/9/2029,13:30,2029-09-28T13:30:00,25.12,267125272015603,2029-09-28T13:30:00+00:00,2029-09-28T13:30:00+02:00,2029-09-28T13:30:00+00:00,2029-09-28T13:30:00+00:00
a948a2f2f2f2f2f2f2f2f2f3,84,10,8,10,23,75,12,94.0,47,47,23,151,9.0,60,11,51,2.2,5,2029,30,105100.0,25,94.0,sous station,9.4,202.5,23.0,60.0,8/10,8/10/2029,5:30,2029-10-08T05:30:00,25.12,267125272015603,2029-10-08T05:30:00+00:00,2029-10-08T05:30:00+02:00,2029-10-08T05:30:00+00:00,2029-10-08T05:30:00+00:00
a95890f2f2f2f2f2f2f2f2f3,84,10,24,9,7,75,12,94.0,47,47,23,151,9.0,60,11,51,2.2,1,2028,30,105100.0,25,94.0,sous station,9.4,202.5,23.0,60.0,24/10,24/10/2028,1:30,2028-10-24T01:30:00,25.12,267125272015603,2028-10-24T01:30:00+00:00,2028-10-24T01:30:00+02:00,2028-10-24T01:30:00+00:00,2028-10-24T01:30:00+00:00
a95892f2f2f2f2f2f2f2f2f3,84,10,24,9,23,75,12,94.0,47,47,23,151,9.0,60,11,51,2.2,5,2028,30,105100.0,25,94.0,sous station,9.4,202.5,23.0,60.0,24/10,24/10/2028,5:30,2028-10-24T05:30:00,25.12,267125272015603,2028-10-24T05:30:00+00:00,2028-10-24T05:30:00+02:00,2028-10-24T05:30:00+00:00,2028-10-24T05:30:00+00:00
a958aaf2f2f2f2f2f2f2f2f3,84,10,24,10,87,75,12,94.0,47,47,23,151,9.0,60,11,51,2.2,21,2029,30,105100.0,25,94.0,sous station,9.4,202.5,23.0,60.0,24/10,24/10/2029,21:30,2029-10-24T21:30:00,25.12,267125272015603,2029-10-24T21:30:00+00:00,2029-10-24T21:30:00+02:00,2029-10-24T21:30:00+00:00,2029-10-24T21:30:00+00:00
a958b2f2f2f2f2f2f2f2f2f3,84,10,24,11,23,75,12,94.0,47,47,23,151,9.0,60,11,51,2.2,5,2030,30,105100.0,25,94.0,sous station,9.4,202.5,23.0,60.0,24/10,24/10/2030,5:30,2030-10-24T05:30:00,25.12,267125272015603,2030-10-24T05:30:00+00:00,2030-10-24T05:30:00+02:00,2030-10-24T05:30:00+00:00,2030-10-24T05:30:00+00:00
a950a2f2f2f2f2f2f2f2f2f3,84,10,16,10,23,75,12,94.0,47,47,23,151,9.0,60,11,51,2.2,5,2029,30,105100.0,25,94.0,sous station,9.4,202.5,23.0,60.0,16/10,16/10/2029,5:30,2029-10-16T05:30:00,25.12,267125272015603,2029-10-16T05:30:00+00:00,2029-10-16T05:30:00+02:00,2029-10-16T05:30:00+00:00,2029-10-16T05:30:00+00:00
a95ca0f2f2f2f2f2f2f2f2f3,84,10,28,10,7,75,12,94.0,47,47,23,151,9.0,60,11,51,2.2,1,2029,30,105100.0,25,94.0,sous station,9.4,202.5,23.0,60.0,28/10,28/10/2029,1:30,2029-10-28T01:30:00,25.12,267125272015603,2029-10-28T01:30:00+00:00,2029-10-28T01:30:00+02:00,2029-10-28T01:30:00+00:00,2029-10-28T01:30:00+00:00
a988aaf2f2f2f2f2f2f2f2f3,84,12,8,10,87,75,12,94.0,47,47,23,151,9.0,60,11,51,2.2,21,2029,30,105100.0,25,94.0,sous station,9.4,202.5,23.0,60.0,8/12,8/12/2029,21:30,2029-12-08T21:30:00,25.12,267125272015603,2029-12-08T21:30:00+00:00,2029-12-08T21:30:00+01:00,2029-12-08T21:30:00+00:00,2029-12-08T21:30:00+00:00
a99892f2f2f2f2f2f2f2f2f3,84,12,24,9,23,75,12,94.0,47,47,23,151,9.0,60,11,51,2.2,5,2028,30,105100.0,25,94.0,sous station,9.4,202.5,23.0,60.0,24/12,24/12/2028,5:30,2028-12-24T05:30:00,25.12,267125272015603,2028-12-24T05:30:00+00:00,2028-12-24T05:30:00+01:00,2028-12-24T05:30:00+00:00,2028-12-24T05:30:00+00:00
aa4c9af2f2f2f2f2f2f2f2f3,85,2,12,9,87,75,12,94.0,47,47,23,151,9.0,60,11,51,2.2,21,2028,30,105100.0,25,94.0,sous station,9.4,202.5,23.0,60.0,12/2,12/2/2028,21:30,2028-02-12T21:30:00,25.12,267125272015603,2028-02-12T21:30:00+00:00,2028-02-12T21:30:00+01:00,2028-02-12T21:30:00+00:00,2028-02-12T21:30:00+00:00
aa7084f2f2f2f2f2f2f2f2f3,85,3,16,8,39,75,12,94.0,47,47,23,151,9.0,60,11,51,2.2,9,2027,30,105100.0,25,94.0,sous station,9.4,202.5,23.0,60.0,16/3,16/3/2027,9:30,2027-03-16T09:30:00,25.12,267125272015603,2027-03-16T09:30:00+00:00,2027-03-16T09:30:00+01:00,2027-03-16T09:30:00+00:00,2027-03-16T09:30:00+00:00
aa5cb2f2f2f2f2f2f2f2f2f3,85,2,28,11,23,75,12,94.0,47,47,23,151,9.0,60,11,51,2.2,5,2030,30,105100.0,25,94.0,sous station,9.4,202.5,23.0,60.0,28/2,28/2/2030,5:30,2030-02-28T05:30:00,25.12,267125272015603,2030-02-28T05:30:00+00:00,2030-02-28T05:30:00+01:00,2030-02-28T05:30:00+00:00,2030-02-28T05:30:00+00:00
aa7896f2f2f2f2f2f2f2f2f3,85,3,24,9,55,75,12,94.0,47,47,23,151,9.0,60,11,51,2.2,13,2028,30,105100.0,25,94.0,sous station,9.4,202.5,23.0,60.0,24/3,24/3/2028,13:30,2028-03-24T13:30:00,25.12,267125272015603,2028-03-24T13:30:00+00:00,2028-03-24T13:30:00+01:00,2028-03-24T13:30:00+00:00,2028-03-24T13:30:00+00:00
ab1ca2f2f2f2f2f2f2f2f2f3,85,8,28,10,23,75,12,94.0,47,47,23,151,9.0,60,11,51,2.2,5,2029,30,105100.0,25,94.0,sous station,9.4,202.5,23.0,60.0,28/8,28/8/2029,5:30,2029-08-28T05:30:00,25.12,267125272015603,2029-08-28T05:30:00+00:00,2029-08-28T05:30:00+02:00,2029-08-28T05:30:00+00:00,2029-08-28T05:30:00+00:00
ab4498f2f2f2f2f2f2f2f2f3,85,10,4,9,71,75,12,94.0,47,47,23,151,9.0,60,11,51,2.2,17,2028,30,105100.0,25,94.0,sous station,9.4,202.5,23.0,60.0,4/10,4/10/2028,17:30,2028-10-04T17:30:00,25.12,267125272015603,2028-10-04T17:30:00+00:00,2028-10-04T17:30:00+02:00,2028-10-04T17:30:00+00:00,2028-10-04T17:30:00+00:00
ae3078f2f2f2f2f2f2f2f2f3,87,1,16,7,71,75,12,94.0,47,47,23,151,9.0,60,11,51,2.2,17,2026,30,105100.0,25,94.0,sous station,9.4,202.5,23.0,60.0,16/1,16/1/2026,17:30,2026-01-16T17:30:00,25.12,267125272015603,2026-01-16T17:30:00+00:00,2026-01-16T17:30:00+01:00,2026-01-16T17:30:00+00:00,2026-01-16T17:30:00+00:00
ae2c70f2f2f2f2f2f2f2f2f3,87,1,12,7,7,75,12,94.0,47,47,23,151,9.0,60,11,51,2.2,1,2026,30,105100.0,25,94.0,sous station,9.4,202.5,23.0,60.0,12/1,12/1/2026,1:30,2026-01-12T01:30:00,25.12,267125272015603,2026-01-12T01:30:00+00:00,2026-01-12T01:30:00+01:00,2026-01-12T01:30:00+00:00,2026-01-12T01:30:00+00:00
ae4c7af2f2f2f2f2f2f2f2f3,87,2,12,7,87,75,12,94.0,47,47,23,151,9.0,60,11,51,2.2,21,2026,30,105100.0,25,94.0,sous station,9.4,202.5,23.0,60.0,12/2,12/2/2026,21:30,2026-02-12T21:30:00,25.12,267125272015603,2026-02-12T21:30:00+00:00,2026-02-12T21:30:00+01:00,2026-02-12T21:30:00+00:00,2026-02-12T21:30:00+00:00
ab4c82f2f2f2f2f2f2f2f2f3,85,10,12,8,23,75,12,94.0,47,47,23,151,9.0,60,11,51,2.2,5,2027,30,105100.0,25,94.0,sous station,9.4,202.5,23.0,60.0,12/10,12/10/2027,5:30,2027-10-12T05:30:00,25.12,267125272015603,2027-10-12T05:30:00+00:00,2027-10-12T05:30:00+02:00,2027-10-12T05:30:00+00:00,2027-10-12T05:30:00+00:00
ae2870f2f2f2f2f2f2f2f2f3,87,1,8,7,7,75,12,94.0,47,47,23,151,9.0,60,11,51,2.2,1,2026,30,105100.0,25,94.0,sous station,9.4,202.5,23.0,60.0,8/1,8/1/2026,1:30,2026-01-08T01:30:00,25.12,267125272015603,2026-01-08T01:30:00+00:00,2026-01-08T01:30:00+01:00,2026-01-08T01:30:00+00:00,2026-01-08T01:30:00+00:00
a88496f2f2f2f2f2f2f2f2f3,84,4,4,9,55,75,12,94.0,47,47,23,151,9.0,60,11,51,2.2,13,2028,30,105100.0,25,94.0,sous station,9.4,202.5,23.0,60.0,4/4,4/4/2028,13:30,2028-04-04T13:30:00,25.12,267125272015603,2028-04-04T13:30:00+00:00,2028-04-04T13:30:00+02:00,2028-04-04T13:30:00+00:00,2028-04-04T13:30:00+00:00
ae4c78f2f2f2f2f2f2f2f2f3,87,2,12,7,71,75,12,94.0,47,47,23,151,9.0,60,11,51,2.2,17,2026,30,105100.0,25,94.0,sous station,9.4,202.5,23.0,60.0,12/2,12/2/2026,17:30,2026-02-12T17:30:00,25.12,267125272015603,2026-02-12T17:30:00+00:00,2026-02-12T17:30:00+01:00,2026-02-12T17:30:00+00:00,2026-02-12T17:30:00+00:00
ae387af2f2f2f2f2f2f2f2f3,87,1,24,7,87,75,12,94.0,47,47,23,151,9.0,60,11,51,2.2,21,2026,30,105100.0,25,94.0,sous station,9.4,202.5,23.0,60.0,24/1,24/1/2026,21:30,2026-01-24T21:30:00,25.12,267125272015603,2026-01-24T21:30:00+00:00,2026-01-24T21:30:00+01:00,2026-01-24T21:30:00+00:00,2026-01-24T21:30:00+00:00
a88cb2f2f2f2f2f2f2f2f2f3,84,4,12,11,23,75,12,94.0,47,47,23,151,9.0,60,11,51,2.2,5,2030,30,105100.0,25,94.0,sous station,9.4,202.5,23.0,60.0,12/4,12/4/2030,5:30,2030-04-12T05:30:00,25.12,267125272015603,2030-04-12T05:30:00+00:00,2030-04-12T05:30:00+02:00,2030-04-12T05:30:00+00:00,2030-04-12T05:30:00+00:00
ae2c7af2f2f2f2f2f2f2f2f3,87,1,12,7,87,75,12,94.0,47,47,23,151,9.0,60,11,51,2.2,21,2026,30,105100.0,25,94.0,sous station,9.4,202.5,23.0,60.0,12/1,12/1/2026,21:30,2026-01-12T21:30:00,25.12,267125272015603,2026-01-12T21:30:00+00:00,2026-01-12T21:30:00+01:00,2026-01-12T21:30:00+00:00,2026-01-12T21:30:00+00:00
a8889af2f2f2f2f2f2f2f2f3,84,4,8,9,87,75,12,94.0,47,47,23,151,9.0,60,11,51,2.2,21,2028,30,105100.0,25,94.0,sous station,9.4,202.5,23.0,60.0,8/4,8/4/2028,21:30,2028-04-08T21:30:00,25.12,267125272015603,2028-04-08T21:30:00+00:00,2028-04-08T21:30:00+02:00,2028-04-08T21:30:00+00:00,2028-04-08T21:30:00+00:00
a8bca6f2f2f2f2f2f2f2f2f3,84,5,28,10,55,75,12,94.0,47,47,23,151,9.0,60,11,51,2.2,13,2029,30,105100.0,25,94.0,sous station,9.4,202.5,23.0,60.0,28/5,28/5/2029,13:30,2029-05-28T13:30:00,25.12,267125272015603,2029-05-28T13:30:00+00:00,2029-05-28T13:30:00+02:00,2029-05-28T13:30:00+00:00,2029-05-28T13:30:00+00:00
a8ec98f2f2f2f2f2f2f2f2f3,84,7,12,9,71,75,12,94.0,47,47,23,151,9.0,60,11,51,2.2,17,2028,30,105100.0,25,94.0,sous station,9.4,202.5,23.0,60.0,12/7,12/7/2028,17:30,2028-07-12T17:30:00,25.12,267125272015603,2028-07-12T17:30:00+00:00,2028-07-12T17:30:00+02:00,2028-07-12T17:30:00+00:00,2028-07-12T17:30:00+00:00
a8f082f2f2f2f2f2f2f2f2f3,84,7,16,8,23,75,12,94.0,47,47,23,151,9.0,60,11,51,2.2,5,2027,30,105100.0,25,94.0,sous station,9.4,202.5,23.0,60.0,16/7,16/7/2027,5:30,2027-07-16T05:30:00,25.12,267125272015603,2027-07-16T05:30:00+00:00,2027-07-16T05:30:00+02:00,2027-07-16T05:30:00+00:00,2027-07-16T05:30:00+00:00
ae5870f2f2f2f2f2f2f2f2f3,87,2,24,7,7,75,12,94.0,47,47,23,151,9.0,60,11,51,2.2,1,2026,30,105100.0,25,94.0,sous station,9.4,202.5,23.0,60.0,24/2,24/2/2026,1:30,2026-02-24T01:30:00,25.12,267125272015603,2026-02-24T01:30:00+00:00,2026-02-24T01:30:00+01:00,2026-02-24T01:30:00+00:00,2026-02-24T01:30:00+00:00
a92880f2f2f2f2f2f2f2f2f3,84,9,8,8,7,75,12,94.0,47,47,23,151,9.0,60,11,51,2.2,1,2027,30,105100.0,25,94.0,sous station,9.4,202.5,23.0,60.0,8/9,8/9/2027,1:30,2027-09-08T01:30:00,25.12,267125272015603,2027-09-08T01:30:00+00:00,2027-09-08T01:30:00+02:00,2027-09-08T01:30:00+00:00,2027-09-08T01:30:00+00:00
a928b2f2f2f2f2f2f2f2f2f3,84,9,8,11,23,75,12,94.0,47,47,23,151,9.0,60,11,51,2.2,5,2030,30,105100.0,25,94.0,sous station,9.4,202.5,23.0,60.0,8/9,8/9/2030,5:30,2030-09-08T05:30:00,25.12,267125272015603,2030-09-08T05:30:00+00:00,2030-09-08T05:30:00+02:00,2030-09-08T05:30:00+00:00,2030-09-08T05:30:00+00:00
a92c82f2f2f2f2f2f2f2f2f3,84,9,12,8,23,75,12,94.0,47,47,23,151,9.0,60,11,51,2.2,5,2027,30,105100.0,25,94.0,sous station,9.4,202.5,23.0,60.0,12/9,12/9/2027,5:30,2027-09-12T05:30:00,25.12,267125272015603,2027-09-12T05:30:00+00:00,2027-09-12T05:30:00+02:00,2027-09-12T05:30:00+00:00,2027-09-12T05:30:00+00:00
aa4c90f2f2f2f2f2f2f2f2f3,85,2,12,9,7,75,12,94.0,47,47,23,151,9.0,60,11,51,2.2,1,2028,30,105100.0,25,94.0,sous station,9.4,202.5,23.0,60.0,12/2,12/2/2028,1:30,2028-02-12T01:30:00,25.12,267125272015603,2028-02-12T01:30:00+00:00,2028-02-12T01:30:00+01:00,2028-02-12T01:30:00+00:00,2028-02-12T01:30:00+00:00
aa48a0f2f2f2f2f2f2f2f2f3,85,2,8,10,7,75,12,94.0,47,47,23,151,9.0,60,11,51,2.2,1,2029,30,105100.0,25,94.0,sous station,9.4,202.5,23.0,60.0,8/2,8/2/2029,1:30,2029-02-08T01:30:00,25.12,267125272015603,2029-02-08T01:30:00+00:00,2029-02-08T01:30:00+01:00,2029-02-08T01:30:00+00:00,2029-02-08T01:30:00+00:00
aa4c82f2f2f2f2f2f2f2f2f3,85,2,12,8,23,75,12,94.0,47,47,23,151,9.0,60,11,51,2.2,5,2027,30,105100.0,25,94.0,sous station,9.4,202.5,23.0,60.0,12/2,12/2/2027,5:30,2027-02-12T05:30:00,25.12,267125272015603,2027-02-12T05:30:00+00:00,2027-02-12T05:30:00+01:00,2027-02-12T05:30:00+00:00,2027-02-12T05:30:00+00:00
aa5894f2f2f2f2f2f2f2f2f3,85,2,24,9,39,75,12,94.0,47,47,23,151,9.0,60,11,51,2.2,9,2028,30,105100.0,25,94.0,sous station,9.4,202.5,23.0,60.0,24/2,24/2/2028,9:30,2028-02-24T09:30:00,25.12,267125272015603,2028-02-24T09:30:00+00:00,2028-02-24T09:30:00+01:00,2028-02-24T09:30:00+00:00,2028-02-24T09:30:00+00:00
ae4478f2f2f2f2f2f2f2f2f3,87,2,4,7,71,75,12,94.0,47,47,23,151,9.0,60,11,51,2.2,17,2026,30,105100.0,25,94.0,sous station,9.4,202.5,23.0,60.0,4/2,4/2/2026,17:30,2026-02-04T17:30:00,25.12,267125272015603,2026-02-04T17:30:00+00:00,2026-02-04T17:30:00+01:00,2026-02-04T17:30:00+00:00,2026-02-04T17:30:00+00:00
ab50aaf2f2f2f2f2f2f2f2f3,85,10,16,10,87,75,12,94.0,47,47,23,151,9.0,60,11,51,2.2,21,2029,30,105100.0,25,94.0,sous station,9.4,202.5,23.0,60.0,16/10,16/10/2029,21:30,2029-10-16T21:30:00,25.12,267125272015603,2029-10-16T21:30:00+00:00,2029-10-16T21:30:00+02:00,2029-10-16T21:30:00+00:00,2029-10-16T21:30:00+00:00
aa6cbaf2f2f2f2f2f2f2f2f3,85,3,12,11,87,75,12,94.0,47,47,23,151,9.0,60,11,51,2.2,21,2030,30,105100.0,25,94.0,sous station,9.4,202.5,23.0,60.0,12/3,12/3/2030,21:30,2030-03-12T21:30:00,25.12,267125272015603,2030-03-12T21:30:00+00:00,2030-03-12T21:30:00+01:00,2030-03-12T21:30:00+00:00,2030-03-12T21:30:00+00:00
ae7472f2f2f2f2f2f2f2f2f3,87,3,20,7,23,75,12,94.0,47,47,23,151,9.0,60,11,51,2.2,5,2026,30,105100.0,25,94.0,sous station,9.4,202.5,23.0,60.0,20/3,20/3/2026,5:30,2026-03-20T05:30:00,25.12,267125272015603,2026-03-20T05:30:00+00:00,2026-03-20T05:30:00+01:00,2026-03-20T05:30:00+00:00,2026-03-20T05:30:00+00:00
aaacb8f2f2f2f2f2f2f2f2f3,85,5,12,11,71,75,12,94.0,47,47,23,151,9.0,60,11,51,2.2,17,2030,30,105100.0,25,94.0,sous station,9.4,202.5,23.0,60.0,12/5,12/5/2030,17:30,2030-05-12T17:30:00,25.12,267125272015603,2030-05-12T17:30:00+00:00,2030-05-12T17:30:00+02:00,2030-05-12T17:30:00+00:00,2030-05-12T17:30:00+00:00
aa8894f2f2f2f2f2f2f2f2f3,85,4,8,9,39,75,12,94.0,47,47,23,151,9.0,60,11,51,2.2,9,2028,30,105100.0,25,94.0,sous station,9.4,202.5,23.0,60.0,8/4,8/4/2028,9:30,2028-04-08T09:30:00,25.12,267125272015603,2028-04-08T09:30:00+00:00,2028-04-08T09:30:00+02:00,2028-04-08T09:30:00+00:00,2028-04-08T09:30:00+00:00
aa88a4f2f2f2f2f2f2f2f2f3,85,4,8,10,39,75,12,94.0,47,47,23,151,9.0,60,11,51,2.2,9,2029,30,105100.0,25,94.0,sous station,9.4,202.5,23.0,60.0,8/4,8/4/2029,9:30,2029-04-08T09:30:00,25.12,267125272015603,2029-04-08T09:30:00+00:00,2029-04-08T09:30:00+02:00,2029-04-08T09:30:00+00:00,2029-04-08T09:30:00+00:00
aa90b8f2f2f2f2f2f2f2f2f3,85,4,16,11,71,75,12,94.0,47,47,23,151,9.0,60,11,51,2.2,17,2030,30,105100.0,25,94.0,sous station,9.4,202.5,23.0,60.0,16/4,16/4/2030,17:30,2030-04-16T17:30:00,25.12,267125272015603,2030-04-16T17:30:00+00:00,2030-04-16T17:30:00+02:00,2030-04-16T17:30:00+00:00,2030-04-16T17:30:00+00:00
aa6884f2f2f2f2f2f2f2f2f3,85,3,8,8,39,75,12,94.0,47,47,23,151,9.0,60,11,51,2.2,9,2027,30,105100.0,25,94.0,sous station,9.4,202.5,23.0,60.0,8/3,8/3/2027,9:30,2027-03-08T09:30:00,25.12,267125272015603,2027-03-08T09:30:00+00:00,2027-03-08T09:30:00+01:00,2027-03-08T09:30:00+00:00,2027-03-08T09:30:00+00:00
aa9cb8f2f2f2f2f2f2f2f2f3,85,4,28,11,71,75,12,94.0,47,47,23,151,9.0,60,11,51,2.2,17,2030,30,105100.0,25,94.0,sous station,9.4,202.5,23.0,60.0,28/4,28/4/2030,17:30,2030-04-28T17:30:00,25.12,267125272015603,2030-04-28T17:30:00+00:00,2030-04-28T17:30:00+02:00,2030-04-28T17:30:00+00:00,2030-04-28T17:30:00+00:00
aa68a6f2f2f2f2f2f2f2f2f3,85,3,8,10,55,75,12,94.0,47,47,23,151,9.0,60,11,51,2.2,13,2029,30,105100.0,25,94.0,sous station,9.4,202.5,23.0,60.0,8/3,8/3/2029,13:30,2029-03-08T13:30:00,25.12,267125272015603,2029-03-08T13:30:00+00:00,2029-03-08T13:30:00+01:00,2029-03-08T13:30:00+00:00,2029-03-08T13:30:00+00:00
aa6c94f2f2f2f2f2f2f2f2f3,85,3,12,9,39,75,12,94.0,47,47,23,151,9.0,60,11,51,2.2,9,2028,30,105100.0,25,94.0,sous station,9.4,202.5,23.0,60.0,12/3,12/3/2028,9:30,2028-03-12T09:30:00,25.12,267125272015603,2028-03-12T09:30:00+00:00,2028-03-12T09:30:00+01:00,2028-03-12T09:30:00+00:00,2028-03-12T09:30:00+00:00
aa6ca4f2f2f2f2f2f2f2f2f3,85,3,12,10,39,75,12,94.0,47,47,23,151,9.0,60,11,51,2.2,9,2029,30,105100.0,25,94.0,sous station,9.4,202.5,23.0,60.0,12/3,12/3/2029,9:30,2029-03-12T09:30:00,25.12,267125272015603,2029-03-12T09:30:00+00:00,2029-03-12T09:30:00+01:00,2029-03-12T09:30:00+00:00,2029-03-12T09:30:00+00:00
a890a6f2f2f2f2f2f2f2f2f3,84,4,16,10,55,75,12,94.0,47,47,23,151,9.0,60,11,51,2.2,13,2029,30,105100.0,25,94.0,sous station,9.4,202.5,23.0,60.0,16/4,16/4/2029,13:30,2029-04-16T13:30:00,25.12,267125272015603,2029-04-16T13:30:00+00:00,2029-04-16T13:30:00+02:00,2029-04-16T13:30:00+00:00,2029-04-16T13:30:00+00:00
aab094f2f2f2f2f2f2f2f2f3,85,5,16,9,39,75,12,94.0,47,47,23,151,9.0,60,11,51,2.2,9,2028,30,105100.0,25,94.0,sous station,9.4,202.5,23.0,60.0,16/5,16/5/2028,9:30,2028-05-16T09:30:00,25.12,267125272015603,2028-05-16T09:30:00+00:00,2028-05-16T09:30:00+02:00,2028-05-16T09:30:00+00:00,2028-05-16T09:30:00+00:00
aac4a2f2f2f2f2f2f2f2f2f3,85,6,4,10,23,75,12,94.0,47,47,23,151,9.0,60,11,51,2.2,5,2029,30,105100.0,25,94.0,sous station,9.4,202.5,23.0,60.0,4/6,4/6/2029,5:30,2029-06-04T05:30:00,25.12,267125272015603,2029-06-04T05:30:00+00:00,2029-06-04T05:30:00+02:00,2029-06-04T05:30:00+00:00,2029-06-04T05:30:00+00:00
aa78a6f2f2f2f2f2f2f2f2f3,85,3,24,10,55,75,12,94.0,47,47,23,151,9.0,60,11,51,2.2,13,2029,30,105100.0,25,94.0,sous station,9.4,202.5,23.0,60.0,24/3,24/3/2029,13:30,2029-03-24T13:30:00,25.12,267125272015603,2029-03-24T13:30:00+00:00,2029-03-24T13:30:00+01:00,2029-03-24T13:30:00+00:00,2029-03-24T13:30:00+00:00
a8b4a8f2f2f2f2f2f2f2f2f3,84,5,20,10,71,75,12,94.0,47,47,23,151,9.0,60,11,51,2.2,17,2029,30,105100.0,25,94.0,sous station,9.4,202.5,23.0,60.0,20/5,20/5/2029,17:30,2029-05-20T17:30:00,25.12,267125272015603,2029-05-20T17:30:00+00:00,2029-05-20T17:30:00+02:00,2029-05-20T17:30:00+00:00,2029-05-20T17:30:00+00:00
a8bc98f2f2f2f2f2f2f2f2f3,84,5,28,9,71,75,12,94.0,47,47,23,151,9.0,60,11,51,2.2,17,2028,30,105100.0,25,94.0,sous station,9.4,202.5,23.0,60.0,28/5,28/5/2028,17:30,2028-05-28T17:30:00,25.12,267125272015603,2028-05-28T17:30:00+00:00,2028-05-28T17:30:00+02:00,2028-05-28T17:30:00+00:00,2028-05-28T17:30:00+00:00
a8c488f2f2f2f2f2f2f2f2f3,84,6,4,8,71,75,12,94.0,47,47,23,151,9.0,60,11,51,2.2,17,2027,30,105100.0,25,94.0,sous station,9.4,202.5,23.0,60.0,4/6,4/6/2027,17:30,2027-06-04T17:30:00,25.12,267125272015603,2027-06-04T17:30:00+00:00,2027-06-04T17:30:00+02:00,2027-06-04T17:30:00+00:00,2027-06-04T17:30:00+00:00
aadcb8f2f2f2f2f2f2f2f2f3,85,6,28,11,71,75,12,94.0,47,47,23,151,9.0,60,11,51,2.2,17,2030,30,105100.0,25,94.0,sous station,9.4,202.5,23.0,60.0,28/6,28/6/2030,17:30,2030-06-28T17:30:00,25.12,267125272015603,2030-06-28T17:30:00+00:00,2030-06-28T17:30:00+02:00,2030-06-28T17:30:00+00:00,2030-06-28T17:30:00+00:00
a8ccb6f2f2f2f2f2f2f2f2f3,84,6,12,11,55,75,12,94.0,47,47,23,151,9.0,60,11,51,2.2,13,2030,30,105100.0,25,94.0,sous station,9.4,202.5,23.0,60.0,12/6,12/6/2030,13:30,2030-06-12T13:30:00,25.12,267125272015603,2030-06-12T13:30:00+00:00,2030-06-12T13:30:00+02:00,2030-06-12T13:30:00+00:00,2030-06-12T13:30:00+00:00
a8d484f2f2f2f2f2f2f2f2f3,84,6,20,8,39,75,12,94.0,47,47,23,151,9.0,60,11,51,2.2,9,2027,30,105100.0,25,94.0,sous station,9.4,202.5,23.0,60.0,20/6,20/6/2027,9:30,2027-06-20T09:30:00,25.12,267125272015603,2027-06-20T09:30:00+00:00,2027-06-20T09:30:00+02:00,2027-06-20T09:30:00+00:00,2027-06-20T09:30:00+00:00
a8fca4f2f2f2f2f2f2f2f2f3,84,7,28,10,39,75,12,94.0,47,47,23,151,9.0,60,11,51,2.2,9,2029,30,105100.0,25,94.0,sous station,9.4,202.5,23.0,60.0,28/7,28/7/2029,9:30,2029-07-28T09:30:00,25.12,267125272015603,2029-07-28T09:30:00+00:00,2029-07-28T09:30:00+02:00,2029-07-28T09:30:00+00:00,2029-07-28T09:30:00+00:00
aae488f2f2f2f2f2f2f2f2f3,85,7,4,8,71,75,12,94.0,47,47,23,151,9.0,60,11,51,2.2,17,2027,30,105100.0,25,94.0,sous station,9.4,202.5,23.0,60.0,4/7,4/7/2027,17:30,2027-07-04T17:30:00,25.12,267125272015603,2027-07-04T17:30:00+00:00,2027-07-04T17:30:00+02:00,2027-07-04T17:30:00+00:00,2027-07-04T17:30:00+00:00
a8fc8af2f2f2f2f2f2f2f2f3,84,7,28,8,87,75,12,94.0,47,47,23,151,9.0,60,11,51,2.2,21,2027,30,105100.0,25,94.0,sous station,9.4,202.5,23.0,60.0,28/7,28/7/2027,21:30,2027-07-28T21:30:00,25.12,267125272015603,2027-07-28T21:30:00+00:00,2027-07-28T21:30:00+02:00,2027-07-28T21:30:00+00:00,2027-07-28T21:30:00+00:00
a8fcb2f2f2f2f2f2f2f2f2f3,84,7,28,11,23,75,12,94.0,47,47,23,151,9.0,60,11,51,2.2,5,2030,30,105100.0,25,94.0,sous station,9.4,202.5,23.0,60.0,28/7,28/7/2030,5:30,2030-07-28T05:30:00,25.12,267125272015603,2030-07-28T05:30:00+00:00,2030-07-28T05:30:00+02:00,2030-07-28T05:30:00+00:00,2030-07-28T05:30:00+00:00
a910a6f2f2f2f2f2f2f2f2f3,84,8,16,10,55,75,12,94.0,47,47,23,151,9.0,60,11,51,2.2,13,2029,30,105100.0,25,94.0,sous station,9.4,202.5,23.0,60.0,16/8,16/8/2029,13:30,2029-08-16T13:30:00,25.12,267125272015603,2029-08-16T13:30:00+00:00,2029-08-16T13:30:00+02:00,2029-08-16T13:30:00+00:00,2029-08-16T13:30:00+00:00
aac8a4f2f2f2f2f2f2f2f2f3,85,6,8,10,39,75,12,94.0,47,47,23,151,9.0,60,11,51,2.2,9,2029,30,105100.0,25,94.0,sous station,9.4,202.5,23.0,60.0,8/6,8/6/2029,9:30,2029-06-08T09:30:00,25.12,267125272015603,2029-06-08T09:30:00+00:00,2029-06-08T09:30:00+02:00,2029-06-08T09:30:00+00:00,2029-06-08T09:30:00+00:00
aad8a2f2f2f2f2f2f2f2f2f3,85,6,24,10,23,75,12,94.0,47,47,23,151,9.0,60,11,51,2.2,5,2029,30,105100.0,25,94.0,sous station,9.4,202.5,23.0,60.0,24/6,24/6/2029,5:30,2029-06-24T05:30:00,25.12,267125272015603,2029-06-24T05:30:00+00:00,2029-06-24T05:30:00+02:00,2029-06-24T05:30:00+00:00,2029-06-24T05:30:00+00:00
aad498f2f2f2f2f2f2f2f2f3,85,6,20,9,71,75,12,94.0,47,47,23,151,9.0,60,11,51,2.2,17,2028,30,105100.0,25,94.0,sous station,9.4,202.5,23.0,60.0,20/6,20/6/2028,17:30,2028-06-20T17:30:00,25.12,267125272015603,2028-06-20T17:30:00+00:00,2028-06-20T17:30:00+02:00,2028-06-20T17:30:00+00:00,2028-06-20T17:30:00+00:00
aae494f2f2f2f2f2f2f2f2f3,85,7,4,9,39,75,12,94.0,47,47,23,151,9.0,60,11,51,2.2,9,2028,30,105100.0,25,94.0,sous station,9.4,202.5,23.0,60.0,4/7,4/7/2028,9:30,2028-07-04T09:30:00,25.12,267125272015603,2028-07-04T09:30:00+00:00,2028-07-04T09:30:00+02:00,2028-07-04T09:30:00+00:00,2028-07-04T09:30:00+00:00
a9108af2f2f2f2f2f2f2f2f3,84,8,16,8,87,75,12,94.0,47,47,23,151,9.0,60,11,51,2.2,21,2027,30,105100.0,25,94.0,sous station,9.4,202.5,23.0,60.0,16/8,16/8/2027,21:30,2027-08-16T21:30:00,25.12,267125272015603,2027-08-16T21:30:00+00:00,2027-08-16T21:30:00+02:00,2027-08-16T21:30:00+00:00,2027-08-16T21:30:00+00:00
aa24b0f2f2f2f2f2f2f2f2f3,85,1,4,11,7,75,12,94.0,47,47,23,151,9.0,60,11,51,2.2,1,2030,30,105100.0,25,94.0,sous station,9.4,202.5,23.0,60.0,4/1,4/1/2030,1:30,2030-01-04T01:30:00,25.12,267125272015603,2030-01-04T01:30:00+00:00,2030-01-04T01:30:00+01:00,2030-01-04T01:30:00+00:00,2030-01-04T01:30:00+00:00
a918a6f2f2f2f2f2f2f2f2f3,84,8,24,10,55,75,12,94.0,47,47,23,151,9.0,60,11,51,2.2,13,2029,30,105100.0,25,94.0,sous station,9.4,202.5,23.0,60.0,24/8,24/8/2029,13:30,2029-08-24T13:30:00,25.12,267125272015603,2029-08-24T13:30:00+00:00,2029-08-24T13:30:00+02:00,2029-08-24T13:30:00+00:00,2029-08-24T13:30:00+00:00
a92886f2f2f2f2f2f2f2f2f3,84,9,8,8,55,75,12,94.0,47,47,23,151,9.0,60,11,51,2.2,13,2027,30,105100.0,25,94.0,sous station,9.4,202.5,23.0,60.0,8/9,8/9/2027,13:30,2027-09-08T13:30:00,25.12,267125272015603,2027-09-08T13:30:00+00:00,2027-09-08T13:30:00+02:00,2027-09-08T13:30:00+00:00,2027-09-08T13:30:00+00:00
ab0ca2f2f2f2f2f2f2f2f2f3,85,8,12,10,23,75,12,94.0,47,47,23,151,9.0,60,11,51,2.2,5,2029,30,105100.0,25,94.0,sous station,9.4,202.5,23.0,60.0,12/8,12/8/2029,5:30,2029-08-12T05:30:00,25.12,267125272015603,2029-08-12T05:30:00+00:00,2029-08-12T05:30:00+02:00,2029-08-12T05:30:00+00:00,2029-08-12T05:30:00+00:00
aafca0f2f2f2f2f2f2f2f2f3,85,7,28,10,7,75,12,94.0,47,47,23,151,9.0,60,11,51,2.2,1,2029,30,105100.0,25,94.0,sous station,9.4,202.5,23.0,60.0,28/7,28/7/2029,1:30,2029-07-28T01:30:00,25.12,267125272015603,2029-07-28T01:30:00+00:00,2029-07-28T01:30:00+02:00,2029-07-28T01:30:00+00:00,2029-07-28T01:30:00+00:00
ae4472f2f2f2f2f2f2f2f2f3,87,2,4,7,23,75,12,94.0,47,47,23,151,9.0,60,11,51,2.2,5,2026,30,105100.0,25,94.0,sous station,9.4,202.5,23.0,60.0,4/2,4/2/2026,5:30,2026-02-04T05:30:00,25.12,267125272015603,2026-02-04T05:30:00+00:00,2026-02-04T05:30:00+01:00,2026-02-04T05:30:00+00:00,2026-02-04T05:30:00+00:00
aa38b4f2f2f2f2f2f2f2f2f3,85,1,24,11,39,75,12,94.0,47,47,23,151,9.0,60,11,51,2.2,9,2030,30,105100.0,25,94.0,sous station,9.4,202.5,23.0,60.0,24/1,24/1/2030,9:30,2030-01-24T09:30:00,25.12,267125272015603,2030-01-24T09:30:00+00:00,2030-01-24T09:30:00+01:00,2030-01-24T09:30:00+00:00,2030-01-24T09:30:00+00:00
a92ca0f2f2f2f2f2f2f2f2f3,84,9,12,10,7,75,12,94.0,47,47,23,151,9.0,60,11,51,2.2,1,2029,30,105100.0,25,94.0,sous station,9.4,202.5,23.0,60.0,12/9,12/9/2029,1:30,2029-09-12T01:30:00,25.12,267125272015603,2029-09-12T01:30:00+00:00,2029-09-12T01:30:00+02:00,2029-09-12T01:30:00+00:00,2029-09-12T01:30:00+00:00
a91cb6f2f2f2f2f2f2f2f2f3,84,8,28,11,55,75,12,94.0,47,47,23,151,9.0,60,11,51,2.2,13,2030,30,105100.0,25,94.0,sous station,9.4,202.5,23.0,60.0,28/8,28/8/2030,13:30,2030-08-28T13:30:00,25.12,267125272015603,2030-08-28T13:30:00+00:00,2030-08-28T13:30:00+02:00,2030-08-28T13:30:00+00:00,2030-08-28T13:30:00+00:00
aa3c94f2f2f2f2f2f2f2f2f3,85,1,28,9,39,75,12,94.0,47,47,23,151,9.0,60,11,51,2.2,9,2028,30,105100.0,25,94.0,sous station,9.4,202.5,23.0,60.0,28/1,28/1/2028,9:30,2028-01-28T09:30:00,25.12,267125272015603,2028-01-28T09:30:00+00:00,2028-01-28T09:30:00+01:00,2028-01-28T09:30:00+00:00,2028-01-28T09:30:00+00:00
a934baf2f2f2f2f2f2f2f2f3,84,9,20,11,87,75,12,94.0,47,47,23,151,9.0,60,11,51,2.2,21,2030,30,105100.0,25,94.0,sous station,9.4,202.5,23.0,60.0,20/9,20/9/2030,21:30,2030-09-20T21:30:00,25.12,267125272015603,2030-09-20T21:30:00+00:00,2030-09-20T21:30:00+02:00,2030-09-20T21:30:00+00:00,2030-09-20T21:30:00+00:00
aa8496f2f2f2f2f2f2f2f2f3,85,4,4,9,55,75,12,94.0,47,47,23,151,9.0,60,11,51,2.2,13,2028,30,105100.0,25,94.0,sous station,9.4,202.5,23.0,60.0,4/4,4/4/2028,13:30,2028-04-04T13:30:00,25.12,267125272015603,2028-04-04T13:30:00+00:00,2028-04-04T13:30:00+02:00,2028-04-04T13:30:00+00:00,2028-04-04T13:30:00+00:00
a96494f2f2f2f2f2f2f2f2f3,84,11,4,9,39,75,12,94.0,47,47,23,151,9.0,60,11,51,2.2,9,2028,30,105100.0,25,94.0,sous station,9.4,202.5,23.0,60.0,4/11,4/11/2028,9:30,2028-11-04T09:30:00,25.12,267125272015603,2028-11-04T09:30:00+00:00,2028-11-04T09:30:00+01:00,2028-11-04T09:30:00+00:00,2028-11-04T09:30:00+00:00
a96ca2f2f2f2f2f2f2f2f2f3,84,11,12,10,23,75,12,94.0,47,47,23,151,9.0,60,11,51,2.2,5,2029,30,105100.0,25,94.0,sous station,9.4,202.5,23.0,60.0,12/11,12/11/2029,5:30,2029-11-12T05:30:00,25.12,267125272015603,2029-11-12T05:30:00+00:00,2029-11-12T05:30:00+01:00,2029-11-12T05:30:00+00:00,2029-11-12T05:30:00+00:00
a98884f2f2f2f2f2f2f2f2f3,84,12,8,8,39,75,12,94.0,47,47,23,151,9.0,60,11,51,2.2,9,2027,30,105100.0,25,94.0,sous station,9.4,202.5,23.0,60.0,8/12,8/12/2027,9:30,2027-12-08T09:30:00,25.12,267125272015603,2027-12-08T09:30:00+00:00,2027-12-08T09:30:00+01:00,2027-12-08T09:30:00+00:00,2027-12-08T09:30:00+00:00
aaa8a6f2f2f2f2f2f2f2f2f3,85,5,8,10,55,75,12,94.0,47,47,23,151,9.0,60,11,51,2.2,13,2029,30,105100.0,25,94.0,sous station,9.4,202.5,23.0,60.0,8/5,8/5/2029,13:30,2029-05-08T13:30:00,25.12,267125272015603,2029-05-08T13:30:00+00:00,2029-05-08T13:30:00+02:00,2029-05-08T13:30:00+00:00,2029-05-08T13:30:00+00:00
aaa8a8f2f2f2f2f2f2f2f2f3,85,5,8,10,71,75,12,94.0,47,47,23,151,9.0,60,11,51,2.2,17,2029,30,105100.0,25,94.0,sous station,9.4,202.5,23.0,60.0,8/5,8/5/2029,17:30,2029-05-08T17:30:00,25.12,267125272015603,2029-05-08T17:30:00+00:00,2029-05-08T17:30:00+02:00,2029-05-08T17:30:00+00:00,2029-05-08T17:30:00+00:00
a9989af2f2f2f2f2f2f2f2f3,84,12,24,9,87,75,12,94.0,47,47,23,151,9.0,60,11,51,2.2,21,2028,30,105100.0,25,94.0,sous station,9.4,202.5,23.0,60.0,24/12,24/12/2028,21:30,2028-12-24T21:30:00,25.12,267125272015603,2028-12-24T21:30:00+00:00,2028-12-24T21:30:00+01:00,2028-12-24T21:30:00+00:00,2028-12-24T21:30:00+00:00
aab8b4f2f2f2f2f2f2f2f2f3,85,5,24,11,39,75,12,94.0,47,47,23,151,9.0,60,11,51,2.2,9,2030,30,105100.0,25,94.0,sous station,9.4,202.5,23.0,60.0,24/5,24/5/2030,9:30,2030-05-24T09:30:00,25.12,267125272015603,2030-05-24T09:30:00+00:00,2030-05-24T09:30:00+02:00,2030-05-24T09:30:00+00:00,2030-05-24T09:30:00+00:00
aaac98f2f2f2f2f2f2f2f2f3,85,5,12,9,71,75,12,94.0,47,47,23,151,9.0,60,11,51,2.2,17,2028,30,105100.0,25,94.0,sous station,9.4,202.5,23.0,60.0,12/5,12/5/2028,17:30,2028-05-12T17:30:00,25.12,267125272015603,2028-05-12T17:30:00+00:00,2028-05-12T17:30:00+02:00,2028-05-12T17:30:00+00:00,2028-05-12T17:30:00+00:00
ab18baf2f2f2f2f2f2f2f2f3,85,8,24,11,87,75,12,94.0,47,47,23,151,9.0,60,11,51,2.2,21,2030,30,105100.0,25,94.0,sous station,9.4,202.5,23.0,60.0,24/8,24/8/2030,21:30,2030-08-24T21:30:00,25.12,267125272015603,2030-08-24T21:30:00+00:00,2030-08-24T21:30:00+02:00,2030-08-24T21:30:00+00:00,2030-08-24T21:30:00+00:00
aac8baf2f2f2f2f2f2f2f2f3,85,6,8,11,87,75,12,94.0,47,47,23,151,9.0,60,11,51,2.2,21,2030,30,105100.0,25,94.0,sous station,9.4,202.5,23.0,60.0,8/6,8/6/2030,21:30,2030-06-08T21:30:00,25.12,267125272015603,2030-06-08T21:30:00+00:00,2030-06-08T21:30:00+02:00,2030-06-08T21:30:00+00:00,2030-06-08T21:30:00+00:00
ab10a8f2f2f2f2f2f2f2f2f3,85,8,16,10,71,75,12,94.0,47,47,23,151,9.0,60,11,51,2.2,17,2029,30,105100.0,25,94.0,sous station,9.4,202.5,23.0,60.0,16/8,16/8/2029,17:30,2029-08-16T17:30:00,25.12,267125272015603,2029-08-16T17:30:00+00:00,2029-08-16T17:30:00+02:00,2029-08-16T17:30:00+00:00,2029-08-16T17:30:00+00:00
ab5c84f2f2f2f2f2f2f2f2f3,85,10,28,8,39,75,12,94.0,47,47,23,151,9.0,60,11,51,2.2,9,2027,30,105100.0,25,94.0,sous station,9.4,202.5,23.0,60.0,28/10,28/10/2027,9:30,2027-10-28T09:30:00,25.12,267125272015603,2027-10-28T09:30:00+00:00,2027-10-28T09:30:00+02:00,2027-10-28T09:30:00+00:00,2027-10-28T09:30:00+00:00
ab5cb6f2f2f2f2f2f2f2f2f3,85,10,28,11,55,75,12,94.0,47,47,23,151,9.0,60,11,51,2.2,13,2030,30,105100.0,25,94.0,sous station,9.4,202.5,23.0,60.0,28/10,28/10/2030,13:30,2030-10-28T13:30:00,25.12,267125272015603,2030-10-28T13:30:00+00:00,2030-10-28T13:30:00+01:00,2030-10-28T13:30:00+00:00,2030-10-28T13:30:00+00:00
ae3c72f2f2f2f2f2f2f2f2f3,87,1,28,7,23,75,12,94.0,47,47,23,151,9.0,60,11,51,2.2,5,2026,30,105100.0,25,94.0,sous station,9.4,202.5,23.0,60.0,28/1,28/1/2026,5:30,2026-01-28T05:30:00,25.12,267125272015603,2026-01-28T05:30:00+00:00,2026-01-28T05:30:00+01:00,2026-01-28T05:30:00+00:00,2026-01-28T05:30:00+00:00
ae4c72f2f2f2f2f2f2f2f2f3,87,2,12,7,23,75,12,94.0,47,47,23,151,9.0,60,11,51,2.2,5,2026,30,105100.0,25,94.0,sous station,9.4,202.5,23.0,60.0,12/2,12/2/2026,5:30,2026-02-12T05:30:00,25.12,267125272015603,2026-02-12T05:30:00+00:00,2026-02-12T05:30:00+01:00,2026-02-12T05:30:00+00:00,2026-02-12T05:30:00+00:00
ae2c78f2f2f2f2f2f2f2f2f3,87,1,12,7,71,75,12,94.0,47,47,23,151,9.0,60,11,51,2.2,17,2026,30,105100.0,25,94.0,sous station,9.4,202.5,23.0,60.0,12/1,12/1/2026,17:30,2026-01-12T17:30:00,25.12,267125272015603,2026-01-12T17:30:00+00:00,2026-01-12T17:30:00+01:00,2026-01-12T17:30:00+00:00,2026-01-12T17:30:00+00:00
a888a0f2f2f2f2f2f2f2f2f3,84,4,8,10,7,75,12,94.0,47,47,23,151,9.0,60,11,51,2.2,1,2029,30,105100.0,25,94.0,sous station,9.4,202.5,23.0,60.0,8/4,8/4/2029,1:30,2029-04-08T01:30:00,25.12,267125272015603,2029-04-08T01:30:00+00:00,2029-04-08T01:30:00+02:00,2029-04-08T01:30:00+00:00,2029-04-08T01:30:00+00:00
a88ca4f2f2f2f2f2f2f2f2f3,84,4,12,10,39,75,12,94.0,47,47,23,151,9.0,60,11,51,2.2,9,2029,30,105100.0,25,94.0,sous station,9.4,202.5,23.0,60.0,12/4,12/4/2029,9:30,2029-04-12T09:30:00,25.12,267125272015603,2029-04-12T09:30:00+00:00,2029-04-12T09:30:00+02:00,2029-04-12T09:30:00+00:00,2029-04-12T09:30:00+00:00
a8d4a0f2f2f2f2f2f2f2f2f3,84,6,20,10,7,75,12,94.0,47,47,23,151,9.0,60,11,51,2.2,1,2029,30,105100.0,25,94.0,sous station,9.4,202.5,23.0,60.0,20/6,20/6/2029,1:30,2029-06-20T01:30:00,25.12,267125272015603,2029-06-20T01:30:00+00:00,2029-06-20T01:30:00+02:00,2029-06-20T01:30:00+00:00,2029-06-20T01:30:00+00:00
aa3096f2f2f2f2f2f2f2f2f3,85,1,16,9,55,75,12,94.0,47,47,23,151,9.0,60,11,51,2.2,13,2028,30,105100.0,25,94.0,sous station,9.4,202.5,23.0,60.0,16/1,16/1/2028,13:30,2028-01-16T13:30:00,25.12,267125272015603,2028-01-16T13:30:00+00:00,2028-01-16T13:30:00+01:00,2028-01-16T13:30:00+00:00,2028-01-16T13:30:00+00:00
ae4476f2f2f2f2f2f2f2f2f3,87,2,4,7,55,75,12,94.0,47,47,23,151,9.0,60,11,51,2.2,13,2026,30,105100.0,25,94.0,sous station,9.4,202.5,23.0,60.0,4/2,4/2/2026,13:30,2026-02-04T13:30:00,25.12,267125272015603,2026-02-04T13:30:00+00:00,2026-02-04T13:30:00+01:00,2026-02-04T13:30:00+00:00,2026-02-04T13:30:00+00:00
aa4492f2f2f2f2f2f2f2f2f3,85,2,4,9,23,75,12,94.0,47,47,23,151,9.0,60,11,51,2.2,5,2028,30,105100.0,25,94.0,sous station,9.4,202.5,23.0,60.0,4/2,4/2/2028,5:30,2028-02-04T05:30:00,25.12,267125272015603,2028-02-04T05:30:00+00:00,2028-02-04T05:30:00+01:00,2028-02-04T05:30:00+00:00,2028-02-04T05:30:00+00:00
ab94b8f2f2f2f2f2f2f2f2f3,85,12,20,11,71,75,12,94.0,47,47,23,151,9.0,60,11,51,2.2,17,2030,30,105100.0,25,94.0,sous station,9.4,202.5,23.0,60.0,20/12,20/12/2030,17:30,2030-12-20T17:30:00,25.12,267125272015603,2030-12-20T17:30:00+00:00,2030-12-20T17:30:00+01:00,2030-12-20T17:30:00+00:00,2030-12-20T17:30:00+00:00
aa9096f2f2f2f2f2f2f2f2f3,85,4,16,9,55,75,12,94.0,47,47,23,151,9.0,60,11,51,2.2,13,2028,30,105100.0,25,94.0,sous station,9.4,202.5,23.0,60.0,16/4,16/4/2028,13:30,2028-04-16T13:30:00,25.12,267125272015603,2028-04-16T13:30:00+00:00,2028-04-16T13:30:00+02:00,2028-04-16T13:30:00+00:00,2028-04-16T13:30:00+00:00
ab4890f2f2f2f2f2f2f2f2f3,85,10,8,9,7,75,12,94.0,47,47,23,151,9.0,60,11,51,2.2,1,2028,30,105100.0,25,94.0,sous station,9.4,202.5,23.0,60.0,8/10,8/10/2028,1:30,2028-10-08T01:30:00,25.12,267125272015603,2028-10-08T01:30:00+00:00,2028-10-08T01:30:00+02:00,2028-10-08T01:30:00+00:00,2028-10-08T01:30:00+00:00
ab4892f2f2f2f2f2f2f2f2f3,85,10,8,9,23,75,12,94.0,47,47,23,151,9.0,60,11,51,2.2,5,2028,30,105100.0,25,94.0,sous station,9.4,202.5,23.0,60.0,8/10,8/10/2028,5:30,2028-10-08T05:30:00,25.12,267125272015603,2028-10-08T05:30:00+00:00,2028-10-08T05:30:00+02:00,2028-10-08T05:30:00+00:00,2028-10-08T05:30:00+00:00
ab48aaf2f2f2f2f2f2f2f2f3,85,10,8,10,87,75,12,94.0,47,47,23,151,9.0,60,11,51,2.2,21,2029,30,105100.0,25,94.0,sous station,9.4,202.5,23.0,60.0,8/10,8/10/2029,21:30,2029-10-08T21:30:00,25.12,267125272015603,2029-10-08T21:30:00+00:00,2029-10-08T21:30:00+02:00,2029-10-08T21:30:00+00:00,2029-10-08T21:30:00+00:00
ab44a6f2f2f2f2f2f2f2f2f3,85,10,4,10,55,75,12,94.0,47,47,23,151,9.0,60,11,51,2.2,13,2029,30,105100.0,25,94.0,sous station,9.4,202.5,23.0,60.0,4/10,4/10/2029,13:30,2029-10-04T13:30:00,25.12,267125272015603,2029-10-04T13:30:00+00:00,2029-10-04T13:30:00+02:00,2029-10-04T13:30:00+00:00,2029-10-04T13:30:00+00:00
ab8494f2f2f2f2f2f2f2f2f3,85,12,4,9,39,75,12,94.0,47,47,23,151,9.0,60,11,51,2.2,9,2028,30,105100.0,25,94.0,sous station,9.4,202.5,23.0,60.0,4/12,4/12/2028,9:30,2028-12-04T09:30:00,25.12,267125272015603,2028-12-04T09:30:00+00:00,2028-12-04T09:30:00+01:00,2028-12-04T09:30:00+00:00,2028-12-04T09:30:00+00:00
ab8488f2f2f2f2f2f2f2f2f3,85,12,4,8,71,75,12,94.0,47,47,23,151,9.0,60,11,51,2.2,17,2027,30,105100.0,25,94.0,sous station,9.4,202.5,23.0,60.0,4/12,4/12/2027,17:30,2027-12-04T17:30:00,25.12,267125272015603,2027-12-04T17:30:00+00:00,2027-12-04T17:30:00+01:00,2027-12-04T17:30:00+00:00,2027-12-04T17:30:00+00:00
ab84a8f2f2f2f2f2f2f2f2f3,85,12,4,10,71,75,12,94.0,47,47,23,151,9.0,60,11,51,2.2,17,2029,30,105100.0,25,94.0,sous station,9.4,202.5,23.0,60.0,4/12,4/12/2029,17:30,2029-12-04T17:30:00,25.12,267125272015603,2029-12-04T17:30:00+00:00,2029-12-04T17:30:00+01:00,2029-12-04T17:30:00+00:00,2029-12-04T17:30:00+00:00
ab8884f2f2f2f2f2f2f2f2f3,85,12,8,8,39,75,12,94.0,47,47,23,151,9.0,60,11,51,2.2,9,2027,30,105100.0,25,94.0,sous station,9.4,202.5,23.0,60.0,8/12,8/12/2027,9:30,2027-12-08T09:30:00,25.12,267125272015603,2027-12-08T09:30:00+00:00,2027-12-08T09:30:00+01:00,2027-12-08T09:30:00+00:00,2027-12-08T09:30:00+00:00
a88898f2f2f2f2f2f2f2f2f3,84,4,8,9,71,75,12,94.0,47,47,23,151,9.0,60,11,51,2.2,17,2028,30,105100.0,25,94.0,sous station,9.4,202.5,23.0,60.0,8/4,8/4/2028,17:30,2028-04-08T17:30:00,25.12,267125272015603,2028-04-08T17:30:00+00:00,2028-04-08T17:30:00+02:00,2028-04-08T17:30:00+00:00,2028-04-08T17:30:00+00:00
ab509af2f2f2f2f2f2f2f2f3,85,10,16,9,87,75,12,94.0,47,47,23,151,9.0,60,11,51,2.2,21,2028,30,105100.0,25,94.0,sous station,9.4,202.5,23.0,60.0,16/10,16/10/2028,21:30,2028-10-16T21:30:00,25.12,267125272015603,2028-10-16T21:30:00+00:00,2028-10-16T21:30:00+02:00,2028-10-16T21:30:00+00:00,2028-10-16T21:30:00+00:00
aa6890f2f2f2f2f2f2f2f2f3,85,3,8,9,7,75,12,94.0,47,47,23,151,9.0,60,11,51,2.2,1,2028,30,105100.0,25,94.0,sous station,9.4,202.5,23.0,60.0,8/3,8/3/2028,1:30,2028-03-08T01:30:00,25.12,267125272015603,2028-03-08T01:30:00+00:00,2028-03-08T01:30:00+01:00,2028-03-08T01:30:00+00:00,2028-03-08T01:30:00+00:00
ab9888f2f2f2f2f2f2f2f2f3,85,12,24,8,71,75,12,94.0,47,47,23,151,9.0,60,11,51,2.2,17,2027,30,105100.0,25,94.0,sous station,9.4,202.5,23.0,60.0,24/12,24/12/2027,17:30,2027-12-24T17:30:00,25.12,267125272015603,2027-12-24T17:30:00+00:00,2027-12-24T17:30:00+01:00,2027-12-24T17:30:00+00:00,2027-12-24T17:30:00+00:00
ab5482f2f2f2f2f2f2f2f2f3,85,10,20,8,23,75,12,94.0,47,47,23,151,9.0,60,11,51,2.2,5,2027,30,105100.0,25,94.0,sous station,9.4,202.5,23.0,60.0,20/10,20/10/2027,5:30,2027-10-20T05:30:00,25.12,267125272015603,2027-10-20T05:30:00+00:00,2027-10-20T05:30:00+02:00,2027-10-20T05:30:00+00:00,2027-10-20T05:30:00+00:00
aaaca6f2f2f2f2f2f2f2f2f3,85,5,12,10,55,75,12,94.0,47,47,23,151,9.0,60,11,51,2.2,13,2029,30,105100.0,25,94.0,sous station,9.4,202.5,23.0,60.0,12/5,12/5/2029,13:30,2029-05-12T13:30:00,25.12,267125272015603,2029-05-12T13:30:00+00:00,2029-05-12T13:30:00+02:00,2029-05-12T13:30:00+00:00,2029-05-12T13:30:00+00:00
aa74b2f2f2f2f2f2f2f2f2f3,85,3,20,11,23,75,12,94.0,47,47,23,151,9.0,60,11,51,2.2,5,2030,30,105100.0,25,94.0,sous station,9.4,202.5,23.0,60.0,20/3,20/3/2030,5:30,2030-03-20T05:30:00,25.12,267125272015603,2030-03-20T05:30:00+00:00,2030-03-20T05:30:00+01:00,2030-03-20T05:30:00+00:00,2030-03-20T05:30:00+00:00
a8a89af2f2f2f2f2f2f2f2f3,84,5,8,9,87,75,12,94.0,47,47,23,151,9.0,60,11,51,2.2,21,2028,30,105100.0,25,94.0,sous station,9.4,202.5,23.0,60.0,8/5,8/5/2028,21:30,2028-05-08T21:30:00,25.12,267125272015603,2028-05-08T21:30:00+00:00,2028-05-08T21:30:00+02:00,2028-05-08T21:30:00+00:00,2028-05-08T21:30:00+00:00
a8a8b0f2f2f2f2f2f2f2f2f3,84,5,8,11,7,75,12,94.0,47,47,23,151,9.0,60,11,51,2.2,1,2030,30,105100.0,25,94.0,sous station,9.4,202.5,23.0,60.0,8/5,8/5/2030,1:30,2030-05-08T01:30:00,25.12,267125272015603,2030-05-08T01:30:00+00:00,2030-05-08T01:30:00+02:00,2030-05-08T01:30:00+00:00,2030-05-08T01:30:00+00:00
ab64aaf2f2f2f2f2f2f2f2f3,85,11,4,10,87,75,12,94.0,47,47,23,151,9.0,60,11,51,2.2,21,2029,30,105100.0,25,94.0,sous station,9.4,202.5,23.0,60.0,4/11,4/11/2029,21:30,2029-11-04T21:30:00,25.12,267125272015603,2029-11-04T21:30:00+00:00,2029-11-04T21:30:00+01:00,2029-11-04T21:30:00+00:00,2029-11-04T21:30:00+00:00
ab6886f2f2f2f2f2f2f2f2f3,85,11,8,8,55,75,12,94.0,47,47,23,151,9.0,60,11,51,2.2,13,2027,30,105100.0,25,94.0,sous station,9.4,202.5,23.0,60.0,8/11,8/11/2027,13:30,2027-11-08T13:30:00,25.12,267125272015603,2027-11-08T13:30:00+00:00,2027-11-08T13:30:00+01:00,2027-11-08T13:30:00+00:00,2027-11-08T13:30:00+00:00
ab68aaf2f2f2f2f2f2f2f2f3,85,11,8,10,87,75,12,94.0,47,47,23,151,9.0,60,11,51,2.2,21,2029,30,105100.0,25,94.0,sous station,9.4,202.5,23.0,60.0,8/11,8/11/2029,21:30,2029-11-08T21:30:00,25.12,267125272015603,2029-11-08T21:30:00+00:00,2029-11-08T21:30:00+01:00,2029-11-08T21:30:00+00:00,2029-11-08T21:30:00+00:00
a8b092f2f2f2f2f2f2f2f2f3,84,5,16,9,23,75,12,94.0,47,47,23,151,9.0,60,11,51,2.2,5,2028,30,105100.0,25,94.0,sous station,9.4,202.5,23.0,60.0,16/5,16/5/2028,5:30,2028-05-16T05:30:00,25.12,267125272015603,2028-05-16T05:30:00+00:00,2028-05-16T05:30:00+02:00,2028-05-16T05:30:00+00:00,2028-05-16T05:30:00+00:00
a8b0b6f2f2f2f2f2f2f2f2f3,84,5,16,11,55,75,12,94.0,47,47,23,151,9.0,60,11,51,2.2,13,2030,30,105100.0,25,94.0,sous station,9.4,202.5,23.0,60.0,16/5,16/5/2030,13:30,2030-05-16T13:30:00,25.12,267125272015603,2030-05-16T13:30:00+00:00,2030-05-16T13:30:00+02:00,2030-05-16T13:30:00+00:00,2030-05-16T13:30:00+00:00
aa8486f2f2f2f2f2f2f2f2f3,85,4,4,8,55,75,12,94.0,47,47,23,151,9.0,60,11,51,2.2,13,2027,30,105100.0,25,94.0,sous station,9.4,202.5,23.0,60.0,4/4,4/4/2027,13:30,2027-04-04T13:30:00,25.12,267125272015603,2027-04-04T13:30:00+00:00,2027-04-04T13:30:00+02:00,2027-04-04T13:30:00+00:00,2027-04-04T13:30:00+00:00
ab8482f2f2f2f2f2f2f2f2f3,85,12,4,8,23,75,12,94.0,47,47,23,151,9.0,60,11,51,2.2,5,2027,30,105100.0,25,94.0,sous station,9.4,202.5,23.0,60.0,4/12,4/12/2027,5:30,2027-12-04T05:30:00,25.12,267125272015603,2027-12-04T05:30:00+00:00,2027-12-04T05:30:00+01:00,2027-12-04T05:30:00+00:00,2027-12-04T05:30:00+00:00
a8b4b4f2f2f2f2f2f2f2f2f3,84,5,20,11,39,75,12,94.0,47,47,23,151,9.0,60,11,51,2.2,9,2030,30,105100.0,25,94.0,sous station,9.4,202.5,23.0,60.0,20/5,20/5/2030,9:30,2030-05-20T09:30:00,25.12,267125272015603,2030-05-20T09:30:00+00:00,2030-05-20T09:30:00+02:00,2030-05-20T09:30:00+00:00,2030-05-20T09:30:00+00:00
ab68a0f2f2f2f2f2f2f2f2f3,85,11,8,10,7,75,12,94.0,47,47,23,151,9.0,60,11,51,2.2,1,2029,30,105100.0,25,94.0,sous station,9.4,202.5,23.0,60.0,8/11,8/11/2029,1:30,2029-11-08T01:30:00,25.12,267125272015603,2029-11-08T01:30:00+00:00,2029-11-08T01:30:00+01:00,2029-11-08T01:30:00+00:00,2029-11-08T01:30:00+00:00
ab68a4f2f2f2f2f2f2f2f2f3,85,11,8,10,39,75,12,94.0,47,47,23,151,9.0,60,11,51,2.2,9,2029,30,105100.0,25,94.0,sous station,9.4,202.5,23.0,60.0,8/11,8/11/2029,9:30,2029-11-08T09:30:00,25.12,267125272015603,2029-11-08T09:30:00+00:00,2029-11-08T09:30:00+01:00,2029-11-08T09:30:00+00:00,2029-11-08T09:30:00+00:00
ab0480f2f2f2f2f2f2f2f2f3,85,8,4,8,7,75,12,94.0,47,47,23,151,9.0,60,11,51,2.2,1,2027,30,105100.0,25,94.0,sous station,9.4,202.5,23.0,60.0,4/8,4/8/2027,1:30,2027-08-04T01:30:00,25.12,267125272015603,2027-08-04T01:30:00+00:00,2027-08-04T01:30:00+02:00,2027-08-04T01:30:00+00:00,2027-08-04T01:30:00+00:00
aabc82f2f2f2f2f2f2f2f2f3,85,5,28,8,23,75,12,94.0,47,47,23,151,9.0,60,11,51,2.2,5,2027,30,105100.0,25,94.0,sous station,9.4,202.5,23.0,60.0,28/5,28/5/2027,5:30,2027-05-28T05:30:00,25.12,267125272015603,2027-05-28T05:30:00+00:00,2027-05-28T05:30:00+02:00,2027-05-28T05:30:00+00:00,2027-05-28T05:30:00+00:00
ab74baf2f2f2f2f2f2f2f2f3,85,11,20,11,87,75,12,94.0,47,47,23,151,9.0,60,11,51,2.2,21,2030,30,105100.0,25,94.0,sous station,9.4,202.5,23.0,60.0,20/11,20/11/2030,21:30,2030-11-20T21:30:00,25.12,267125272015603,2030-11-20T21:30:00+00:00,2030-11-20T21:30:00+01:00,2030-11-20T21:30:00+00:00,2030-11-20T21:30:00+00:00
ab1cb2f2f2f2f2f2f2f2f2f3,85,8,28,11,23,75,12,94.0,47,47,23,151,9.0,60,11,51,2.2,5,2030,30,105100.0,25,94.0,sous station,9.4,202.5,23.0,60.0,28/8,28/8/2030,5:30,2030-08-28T05:30:00,25.12,267125272015603,2030-08-28T05:30:00+00:00,2030-08-28T05:30:00+02:00,2030-08-28T05:30:00+00:00,2030-08-28T05:30:00+00:00
aac48af2f2f2f2f2f2f2f2f3,85,6,4,8,87,75,12,94.0,47,47,23,151,9.0,60,11,51,2.2,21,2027,30,105100.0,25,94.0,sous station,9.4,202.5,23.0,60.0,4/6,4/6/2027,21:30,2027-06-04T21:30:00,25.12,267125272015603,2027-06-04T21:30:00+00:00,2027-06-04T21:30:00+02:00,2027-06-04T21:30:00+00:00,2027-06-04T21:30:00+00:00
ab74aaf2f2f2f2f2f2f2f2f3,85,11,20,10,87,75,12,94.0,47,47,23,151,9.0,60,11,51,2.2,21,2029,30,105100.0,25,94.0,sous station,9.4,202.5,23.0,60.0,20/11,20/11/2029,21:30,2029-11-20T21:30:00,25.12,267125272015603,2029-11-20T21:30:00+00:00,2029-11-20T21:30:00+01:00,2029-11-20T21:30:00+00:00,2029-11-20T21:30:00+00:00
aadca6f2f2f2f2f2f2f2f2f3,85,6,28,10,55,75,12,94.0,47,47,23,151,9.0,60,11,51,2.2,13,2029,30,105100.0,25,94.0,sous station,9.4,202.5,23.0,60.0,28/6,28/6/2029,13:30,2029-06-28T13:30:00,25.12,267125272015603,2029-06-28T13:30:00+00:00,2029-06-28T13:30:00+02:00,2029-06-28T13:30:00+00:00,2029-06-28T13:30:00+00:00
ab04baf2f2f2f2f2f2f2f2f3,85,8,4,11,87,75,12,94.0,47,47,23,151,9.0,60,11,51,2.2,21,2030,30,105100.0,25,94.0,sous station,9.4,202.5,23.0,60.0,4/8,4/8/2030,21:30,2030-08-04T21:30:00,25.12,267125272015603,2030-08-04T21:30:00+00:00,2030-08-04T21:30:00+02:00,2030-08-04T21:30:00+00:00,2030-08-04T21:30:00+00:00
ab6496f2f2f2f2f2f2f2f2f3,85,11,4,9,55,75,12,94.0,47,47,23,151,9.0,60,11,51,2.2,13,2028,30,105100.0,25,94.0,sous station,9.4,202.5,23.0,60.0,4/11,4/11/2028,13:30,2028-11-04T13:30:00,25.12,267125272015603,2028-11-04T13:30:00+00:00,2028-11-04T13:30:00+01:00,2028-11-04T13:30:00+00:00,2028-11-04T13:30:00+00:00
ab8c92f2f2f2f2f2f2f2f2f3,85,12,12,9,23,75,12,94.0,47,47,23,151,9.0,60,11,51,2.2,5,2028,30,105100.0,25,94.0,sous station,9.4,202.5,23.0,60.0,12/12,12/12/2028,5:30,2028-12-12T05:30:00,25.12,267125272015603,2028-12-12T05:30:00+00:00,2028-12-12T05:30:00+01:00,2028-12-12T05:30:00+00:00,2028-12-12T05:30:00+00:00
a930aaf2f2f2f2f2f2f2f2f3,84,9,16,10,87,75,12,94.0,47,47,23,151,9.0,60,11,51,2.2,21,2029,30,105100.0,25,94.0,sous station,9.4,202.5,23.0,60.0,16/9,16/9/2029,21:30,2029-09-16T21:30:00,25.12,267125272015603,2029-09-16T21:30:00+00:00,2029-09-16T21:30:00+02:00,2029-09-16T21:30:00+00:00,2029-09-16T21:30:00+00:00
aa84b6f2f2f2f2f2f2f2f2f3,85,4,4,11,55,75,12,94.0,47,47,23,151,9.0,60,11,51,2.2,13,2030,30,105100.0,25,94.0,sous station,9.4,202.5,23.0,60.0,4/4,4/4/2030,13:30,2030-04-04T13:30:00,25.12,267125272015603,2030-04-04T13:30:00+00:00,2030-04-04T13:30:00+02:00,2030-04-04T13:30:00+00:00,2030-04-04T13:30:00+00:00
ab88aaf2f2f2f2f2f2f2f2f3,85,12,8,10,87,75,12,94.0,47,47,23,151,9.0,60,11,51,2.2,21,2029,30,105100.0,25,94.0,sous station,9.4,202.5,23.0,60.0,8/12,8/12/2029,21:30,2029-12-08T21:30:00,25.12,267125272015603,2029-12-08T21:30:00+00:00,2029-12-08T21:30:00+01:00,2029-12-08T21:30:00+00:00,2029-12-08T21:30:00+00:00
aa4cb0f2f2f2f2f2f2f2f2f3,85,2,12,11,7,75,12,94.0,47,47,23,151,9.0,60,11,51,2.2,1,2030,30,105100.0,25,94.0,sous station,9.4,202.5,23.0,60.0,12/2,12/2/2030,1:30,2030-02-12T01:30:00,25.12,267125272015603,2030-02-12T01:30:00+00:00,2030-02-12T01:30:00+01:00,2030-02-12T01:30:00+00:00,2030-02-12T01:30:00+00:00
aa64a8f2f2f2f2f2f2f2f2f3,85,3,4,10,71,75,12,94.0,47,47,23,151,9.0,60,11,51,2.2,17,2029,30,105100.0,25,94.0,sous station,9.4,202.5,23.0,60.0,4/3,4/3/2029,17:30,2029-03-04T17:30:00,25.12,267125272015603,2029-03-04T17:30:00+00:00,2029-03-04T17:30:00+01:00,2029-03-04T17:30:00+00:00,2029-03-04T17:30:00+00:00
aa6496f2f2f2f2f2f2f2f2f3,85,3,4,9,55,75,12,94.0,47,47,23,151,9.0,60,11,51,2.2,13,2028,30,105100.0,25,94.0,sous station,9.4,202.5,23.0,60.0,4/3,4/3/2028,13:30,2028-03-04T13:30:00,25.12,267125272015603,2028-03-04T13:30:00+00:00,2028-03-04T13:30:00+01:00,2028-03-04T13:30:00+00:00,2028-03-04T13:30:00+00:00
aadca4f2f2f2f2f2f2f2f2f3,85,6,28,10,39,75,12,94.0,47,47,23,151,9.0,60,11,51,2.2,9,2029,30,105100.0,25,94.0,sous station,9.4,202.5,23.0,60.0,28/6,28/6/2029,9:30,2029-06-28T09:30:00,25.12,267125272015603,2029-06-28T09:30:00+00:00,2029-06-28T09:30:00+02:00,2029-06-28T09:30:00+00:00,2029-06-28T09:30:00+00:00
aa5888f2f2f2f2f2f2f2f2f3,85,2,24,8,71,75,12,94.0,47,47,23,151,9.0,60,11,51,2.2,17,2027,30,105100.0,25,94.0,sous station,9.4,202.5,23.0,60.0,24/2,24/2/2027,17:30,2027-02-24T17:30:00,25.12,267125272015603,2027-02-24T17:30:00+00:00,2027-02-24T17:30:00+01:00,2027-02-24T17:30:00+00:00,2027-02-24T17:30:00+00:00
aad898f2f2f2f2f2f2f2f2f3,85,6,24,9,71,75,12,94.0,47,47,23,151,9.0,60,11,51,2.2,17,2028,30,105100.0,25,94.0,sous station,9.4,202.5,23.0,60.0,24/6,24/6/2028,17:30,2028-06-24T17:30:00,25.12,267125272015603,2028-06-24T17:30:00+00:00,2028-06-24T17:30:00+02:00,2028-06-24T17:30:00+00:00,2028-06-24T17:30:00+00:00
aab0b4f2f2f2f2f2f2f2f2f3,85,5,16,11,39,75,12,94.0,47,47,23,151,9.0,60,11,51,2.2,9,2030,30,105100.0,25,94.0,sous station,9.4,202.5,23.0,60.0,16/5,16/5/2030,9:30,2030-05-16T09:30:00,25.12,267125272015603,2030-05-16T09:30:00+00:00,2030-05-16T09:30:00+02:00,2030-05-16T09:30:00+00:00,2030-05-16T09:30:00+00:00
aabca4f2f2f2f2f2f2f2f2f3,85,5,28,10,39,75,12,94.0,47,47,23,151,9.0,60,11,51,2.2,9,2029,30,105100.0,25,94.0,sous station,9.4,202.5,23.0,60.0,28/5,28/5/2029,9:30,2029-05-28T09:30:00,25.12,267125272015603,2029-05-28T09:30:00+00:00,2029-05-28T09:30:00+02:00,2029-05-28T09:30:00+00:00,2029-05-28T09:30:00+00:00
aab8b6f2f2f2f2f2f2f2f2f3,85,5,24,11,55,75,12,94.0,47,47,23,151,9.0,60,11,51,2.2,13,2030,30,105100.0,25,94.0,sous station,9.4,202.5,23.0,60.0,24/5,24/5/2030,13:30,2030-05-24T13:30:00,25.12,267125272015603,2030-05-24T13:30:00+00:00,2030-05-24T13:30:00+02:00,2030-05-24T13:30:00+00:00,2030-05-24T13:30:00+00:00
ab8496f2f2f2f2f2f2f2f2f3,85,12,4,9,55,75,12,94.0,47,47,23,151,9.0,60,11,51,2.2,13,2028,30,105100.0,25,94.0,sous station,9.4,202.5,23.0,60.0,4/12,4/12/2028,13:30,2028-12-04T13:30:00,25.12,267125272015603,2028-12-04T13:30:00+00:00,2028-12-04T13:30:00+01:00,2028-12-04T13:30:00+00:00,2028-12-04T13:30:00+00:00
ab8890f2f2f2f2f2f2f2f2f3,85,12,8,9,7,75,12,94.0,47,47,23,151,9.0,60,11,51,2.2,1,2028,30,105100.0,25,94.0,sous station,9.4,202.5,23.0,60.0,8/12,8/12/2028,1:30,2028-12-08T01:30:00,25.12,267125272015603,2028-12-08T01:30:00+00:00,2028-12-08T01:30:00+01:00,2028-12-08T01:30:00+00:00,2028-12-08T01:30:00+00:00
ab10b2f2f2f2f2f2f2f2f2f3,85,8,16,11,23,75,12,94.0,47,47,23,151,9.0,60,11,51,2.2,5,2030,30,105100.0,25,94.0,sous station,9.4,202.5,23.0,60.0,16/8,16/8/2030,5:30,2030-08-16T05:30:00,25.12,267125272015603,2030-08-16T05:30:00+00:00,2030-08-16T05:30:00+02:00,2030-08-16T05:30:00+00:00,2030-08-16T05:30:00+00:00
ab18a4f2f2f2f2f2f2f2f2f3,85,8,24,10,39,75,12,94.0,47,47,23,151,9.0,60,11,51,2.2,9,2029,30,105100.0,25,94.0,sous station,9.4,202.5,23.0,60.0,24/8,24/8/2029,9:30,2029-08-24T09:30:00,25.12,267125272015603,2029-08-24T09:30:00+00:00,2029-08-24T09:30:00+02:00,2029-08-24T09:30:00+00:00,2029-08-24T09:30:00+00:00
ab18a8f2f2f2f2f2f2f2f2f3,85,8,24,10,71,75,12,94.0,47,47,23,151,9.0,60,11,51,2.2,17,2029,30,105100.0,25,94.0,sous station,9.4,202.5,23.0,60.0,24/8,24/8/2029,17:30,2029-08-24T17:30:00,25.12,267125272015603,2029-08-24T17:30:00+00:00,2029-08-24T17:30:00+02:00,2029-08-24T17:30:00+00:00,2029-08-24T17:30:00+00:00
ab9884f2f2f2f2f2f2f2f2f3,85,12,24,8,39,75,12,94.0,47,47,23,151,9.0,60,11,51,2.2,9,2027,30,105100.0,25,94.0,sous station,9.4,202.5,23.0,60.0,24/12,24/12/2027,9:30,2027-12-24T09:30:00,25.12,267125272015603,2027-12-24T09:30:00+00:00,2027-12-24T09:30:00+01:00,2027-12-24T09:30:00+00:00,2027-12-24T09:30:00+00:00
a8c484f2f2f2f2f2f2f2f2f3,84,6,4,8,39,75,12,94.0,47,47,23,151,9.0,60,11,51,2.2,9,2027,30,105100.0,25,94.0,sous station,9.4,202.5,23.0,60.0,4/6,4/6/2027,9:30,2027-06-04T09:30:00,25.12,267125272015603,2027-06-04T09:30:00+00:00,2027-06-04T09:30:00+02:00,2027-06-04T09:30:00+00:00,2027-06-04T09:30:00+00:00
a8e4b0f2f2f2f2f2f2f2f2f3,84,7,4,11,7,75,12,94.0,47,47,23,151,9.0,60,11,51,2.2,1,2030,30,105100.0,25,94.0,sous station,9.4,202.5,23.0,60.0,4/7,4/7/2030,1:30,2030-07-04T01:30:00,25.12,267125272015603,2030-07-04T01:30:00+00:00,2030-07-04T01:30:00+02:00,2030-07-04T01:30:00+00:00,2030-07-04T01:30:00+00:00
a8b094f2f2f2f2f2f2f2f2f3,84,5,16,9,39,75,12,94.0,47,47,23,151,9.0,60,11,51,2.2,9,2028,30,105100.0,25,94.0,sous station,9.4,202.5,23.0,60.0,16/5,16/5/2028,9:30,2028-05-16T09:30:00,25.12,267125272015603,2028-05-16T09:30:00+00:00,2028-05-16T09:30:00+02:00,2028-05-16T09:30:00+00:00,2028-05-16T09:30:00+00:00
aae486f2f2f2f2f2f2f2f2f3,85,7,4,8,55,75,12,94.0,47,47,23,151,9.0,60,11,51,2.2,13,2027,30,105100.0,25,94.0,sous station,9.4,202.5,23.0,60.0,4/7,4/7/2027,13:30,2027-07-04T13:30:00,25.12,267125272015603,2027-07-04T13:30:00+00:00,2027-07-04T13:30:00+02:00,2027-07-04T13:30:00+00:00,2027-07-04T13:30:00+00:00
a8c4b4f2f2f2f2f2f2f2f2f3,84,6,4,11,39,75,12,94.0,47,47,23,151,9.0,60,11,51,2.2,9,2030,30,105100.0,25,94.0,sous station,9.4,202.5,23.0,60.0,4/6,4/6/2030,9:30,2030-06-04T09:30:00,25.12,267125272015603,2030-06-04T09:30:00+00:00,2030-06-04T09:30:00+02:00,2030-06-04T09:30:00+00:00,2030-06-04T09:30:00+00:00
a8c8aaf2f2f2f2f2f2f2f2f3,84,6,8,10,87,75,12,94.0,47,47,23,151,9.0,60,11,51,2.2,21,2029,30,105100.0,25,94.0,sous station,9.4,202.5,23.0,60.0,8/6,8/6/2029,21:30,2029-06-08T21:30:00,25.12,267125272015603,2029-06-08T21:30:00+00:00,2029-06-08T21:30:00+02:00,2029-06-08T21:30:00+00:00,2029-06-08T21:30:00+00:00
a8d4baf2f2f2f2f2f2f2f2f3,84,6,20,11,87,75,12,94.0,47,47,23,151,9.0,60,11,51,2.2,21,2030,30,105100.0,25,94.0,sous station,9.4,202.5,23.0,60.0,20/6,20/6/2030,21:30,2030-06-20T21:30:00,25.12,267125272015603,2030-06-20T21:30:00+00:00,2030-06-20T21:30:00+02:00,2030-06-20T21:30:00+00:00,2030-06-20T21:30:00+00:00
a944baf2f2f2f2f2f2f2f2f3,84,10,4,11,87,75,12,94.0,47,47,23,151,9.0,60,11,51,2.2,21,2030,30,105100.0,25,94.0,sous station,9.4,202.5,23.0,60.0,4/10,4/10/2030,21:30,2030-10-04T21:30:00,25.12,267125272015603,2030-10-04T21:30:00+00:00,2030-10-04T21:30:00+02:00,2030-10-04T21:30:00+00:00,2030-10-04T21:30:00+00:00
a9488af2f2f2f2f2f2f2f2f3,84,10,8,8,87,75,12,94.0,47,47,23,151,9.0,60,11,51,2.2,21,2027,30,105100.0,25,94.0,sous station,9.4,202.5,23.0,60.0,8/10,8/10/2027,21:30,2027-10-08T21:30:00,25.12,267125272015603,2027-10-08T21:30:00+00:00,2027-10-08T21:30:00+02:00,2027-10-08T21:30:00+00:00,2027-10-08T21:30:00+00:00
aad4aaf2f2f2f2f2f2f2f2f3,85,6,20,10,87,75,12,94.0,47,47,23,151,9.0,60,11,51,2.2,21,2029,30,105100.0,25,94.0,sous station,9.4,202.5,23.0,60.0,20/6,20/6/2029,21:30,2029-06-20T21:30:00,25.12,267125272015603,2029-06-20T21:30:00+00:00,2029-06-20T21:30:00+02:00,2029-06-20T21:30:00+00:00,2029-06-20T21:30:00+00:00
a94c9af2f2f2f2f2f2f2f2f3,84,10,12,9,87,75,12,94.0,47,47,23,151,9.0,60,11,51,2.2,21,2028,30,105100.0,25,94.0,sous station,9.4,202.5,23.0,60.0,12/10,12/10/2028,21:30,2028-10-12T21:30:00,25.12,267125272015603,2028-10-12T21:30:00+00:00,2028-10-12T21:30:00+02:00,2028-10-12T21:30:00+00:00,2028-10-12T21:30:00+00:00
a950a8f2f2f2f2f2f2f2f2f3,84,10,16,10,71,75,12,94.0,47,47,23,151,9.0,60,11,51,2.2,17,2029,30,105100.0,25,94.0,sous station,9.4,202.5,23.0,60.0,16/10,16/10/2029,17:30,2029-10-16T17:30:00,25.12,267125272015603,2029-10-16T17:30:00+00:00,2029-10-16T17:30:00+02:00,2029-10-16T17:30:00+00:00,2029-10-16T17:30:00+00:00
a99090f2f2f2f2f2f2f2f2f3,84,12,16,9,7,75,12,94.0,47,47,23,151,9.0,60,11,51,2.2,1,2028,30,105100.0,25,94.0,sous station,9.4,202.5,23.0,60.0,16/12,16/12/2028,1:30,2028-12-16T01:30:00,25.12,267125272015603,2028-12-16T01:30:00+00:00,2028-12-16T01:30:00+01:00,2028-12-16T01:30:00+00:00,2028-12-16T01:30:00+00:00
a998a8f2f2f2f2f2f2f2f2f3,84,12,24,10,71,75,12,94.0,47,47,23,151,9.0,60,11,51,2.2,17,2029,30,105100.0,25,94.0,sous station,9.4,202.5,23.0,60.0,24/12,24/12/2029,17:30,2029-12-24T17:30:00,25.12,267125272015603,2029-12-24T17:30:00+00:00,2029-12-24T17:30:00+01:00,2029-12-24T17:30:00+00:00,2029-12-24T17:30:00+00:00
a99094f2f2f2f2f2f2f2f2f3,84,12,16,9,39,75,12,94.0,47,47,23,151,9.0,60,11,51,2.2,9,2028,30,105100.0,25,94.0,sous station,9.4,202.5,23.0,60.0,16/12,16/12/2028,9:30,2028-12-16T09:30:00,25.12,267125272015603,2028-12-16T09:30:00+00:00,2028-12-16T09:30:00+01:00,2028-12-16T09:30:00+00:00,2028-12-16T09:30:00+00:00
aad4a2f2f2f2f2f2f2f2f2f3,85,6,20,10,23,75,12,94.0,47,47,23,151,9.0,60,11,51,2.2,5,2029,30,105100.0,25,94.0,sous station,9.4,202.5,23.0,60.0,20/6,20/6/2029,5:30,2029-06-20T05:30:00,25.12,267125272015603,2029-06-20T05:30:00+00:00,2029-06-20T05:30:00+02:00,2029-06-20T05:30:00+00:00,2029-06-20T05:30:00+00:00
aadcb0f2f2f2f2f2f2f2f2f3,85,6,28,11,7,75,12,94.0,47,47,23,151,9.0,60,11,51,2.2,1,2030,30,105100.0,25,94.0,sous station,9.4,202.5,23.0,60.0,28/6,28/6/2030,1:30,2030-06-28T01:30:00,25.12,267125272015603,2030-06-28T01:30:00+00:00,2030-06-28T01:30:00+02:00,2030-06-28T01:30:00+00:00,2030-06-28T01:30:00+00:00
aa9c96f2f2f2f2f2f2f2f2f3,85,4,28,9,55,75,12,94.0,47,47,23,151,9.0,60,11,51,2.2,13,2028,30,105100.0,25,94.0,sous station,9.4,202.5,23.0,60.0,28/4,28/4/2028,13:30,2028-04-28T13:30:00,25.12,267125272015603,2028-04-28T13:30:00+00:00,2028-04-28T13:30:00+02:00,2028-04-28T13:30:00+00:00,2028-04-28T13:30:00+00:00
aaf098f2f2f2f2f2f2f2f2f3,85,7,16,9,71,75,12,94.0,47,47,23,151,9.0,60,11,51,2.2,17,2028,30,105100.0,25,94.0,sous station,9.4,202.5,23.0,60.0,16/7,16/7/2028,17:30,2028-07-16T17:30:00,25.12,267125272015603,2028-07-16T17:30:00+00:00,2028-07-16T17:30:00+02:00,2028-07-16T17:30:00+00:00,2028-07-16T17:30:00+00:00
aaf09af2f2f2f2f2f2f2f2f3,85,7,16,9,87,75,12,94.0,47,47,23,151,9.0,60,11,51,2.2,21,2028,30,105100.0,25,94.0,sous station,9.4,202.5,23.0,60.0,16/7,16/7/2028,21:30,2028-07-16T21:30:00,25.12,267125272015603,2028-07-16T21:30:00+00:00,2028-07-16T21:30:00+02:00,2028-07-16T21:30:00+00:00,2028-07-16T21:30:00+00:00
aaf0b6f2f2f2f2f2f2f2f2f3,85,7,16,11,55,75,12,94.0,47,47,23,151,9.0,60,11,51,2.2,13,2030,30,105100.0,25,94.0,sous station,9.4,202.5,23.0,60.0,16/7,16/7/2030,13:30,2030-07-16T13:30:00,25.12,267125272015603,2030-07-16T13:30:00+00:00,2030-07-16T13:30:00+02:00,2030-07-16T13:30:00+00:00,2030-07-16T13:30:00+00:00
ab5898f2f2f2f2f2f2f2f2f3,85,10,24,9,71,75,12,94.0,47,47,23,151,9.0,60,11,51,2.2,17,2028,30,105100.0,25,94.0,sous station,9.4,202.5,23.0,60.0,24/10,24/10/2028,17:30,2028-10-24T17:30:00,25.12,267125272015603,2028-10-24T17:30:00+00:00,2028-10-24T17:30:00+02:00,2028-10-24T17:30:00+00:00,2028-10-24T17:30:00+00:00
ab5ca4f2f2f2f2f2f2f2f2f3,85,10,28,10,39,75,12,94.0,47,47,23,151,9.0,60,11,51,2.2,9,2029,30,105100.0,25,94.0,sous station,9.4,202.5,23.0,60.0,28/10,28/10/2029,9:30,2029-10-28T09:30:00,25.12,267125272015603,2029-10-28T09:30:00+00:00,2029-10-28T09:30:00+01:00,2029-10-28T09:30:00+00:00,2029-10-28T09:30:00+00:00
aad8b2f2f2f2f2f2f2f2f2f3,85,6,24,11,23,75,12,94.0,47,47,23,151,9.0,60,11,51,2.2,5,2030,30,105100.0,25,94.0,sous station,9.4,202.5,23.0,60.0,24/6,24/6/2030,5:30,2030-06-24T05:30:00,25.12,267125272015603,2030-06-24T05:30:00+00:00,2030-06-24T05:30:00+02:00,2030-06-24T05:30:00+00:00,2030-06-24T05:30:00+00:00
ab3cbaf2f2f2f2f2f2f2f2f3,85,9,28,11,87,75,12,94.0,47,47,23,151,9.0,60,11,51,2.2,21,2030,30,105100.0,25,94.0,sous station,9.4,202.5,23.0,60.0,28/9,28/9/2030,21:30,2030-09-28T21:30:00,25.12,267125272015603,2030-09-28T21:30:00+00:00,2030-09-28T21:30:00+02:00,2030-09-28T21:30:00+00:00,2030-09-28T21:30:00+00:00
ab4894f2f2f2f2f2f2f2f2f3,85,10,8,9,39,75,12,94.0,47,47,23,151,9.0,60,11,51,2.2,9,2028,30,105100.0,25,94.0,sous station,9.4,202.5,23.0,60.0,8/10,8/10/2028,9:30,2028-10-08T09:30:00,25.12,267125272015603,2028-10-08T09:30:00+00:00,2028-10-08T09:30:00+02:00,2028-10-08T09:30:00+00:00,2028-10-08T09:30:00+00:00
ab48b0f2f2f2f2f2f2f2f2f3,85,10,8,11,7,75,12,94.0,47,47,23,151,9.0,60,11,51,2.2,1,2030,30,105100.0,25,94.0,sous station,9.4,202.5,23.0,60.0,8/10,8/10/2030,1:30,2030-10-08T01:30:00,25.12,267125272015603,2030-10-08T01:30:00+00:00,2030-10-08T01:30:00+02:00,2030-10-08T01:30:00+00:00,2030-10-08T01:30:00+00:00
ab44b0f2f2f2f2f2f2f2f2f3,85,10,4,11,7,75,12,94.0,47,47,23,151,9.0,60,11,51,2.2,1,2030,30,105100.0,25,94.0,sous station,9.4,202.5,23.0,60.0,4/10,4/10/2030,1:30,2030-10-04T01:30:00,25.12,267125272015603,2030-10-04T01:30:00+00:00,2030-10-04T01:30:00+02:00,2030-10-04T01:30:00+00:00,2030-10-04T01:30:00+00:00
ab58b6f2f2f2f2f2f2f2f2f3,85,10,24,11,55,75,12,94.0,47,47,23,151,9.0,60,11,51,2.2,13,2030,30,105100.0,25,94.0,sous station,9.4,202.5,23.0,60.0,24/10,24/10/2030,13:30,2030-10-24T13:30:00,25.12,267125272015603,2030-10-24T13:30:00+00:00,2030-10-24T13:30:00+02:00,2030-10-24T13:30:00+00:00,2030-10-24T13:30:00+00:00
ab8c86f2f2f2f2f2f2f2f2f3,85,12,12,8,55,75,12,94.0,47,47,23,151,9.0,60,11,51,2.2,13,2027,30,105100.0,25,94.0,sous station,9.4,202.5,23.0,60.0,12/12,12/12/2027,13:30,2027-12-12T13:30:00,25.12,267125272015603,2027-12-12T13:30:00+00:00,2027-12-12T13:30:00+01:00,2027-12-12T13:30:00+00:00,2027-12-12T13:30:00+00:00
ab8c8af2f2f2f2f2f2f2f2f3,85,12,12,8,87,75,12,94.0,47,47,23,151,9.0,60,11,51,2.2,21,2027,30,105100.0,25,94.0,sous station,9.4,202.5,23.0,60.0,12/12,12/12/2027,21:30,2027-12-12T21:30:00,25.12,267125272015603,2027-12-12T21:30:00+00:00,2027-12-12T21:30:00+01:00,2027-12-12T21:30:00+00:00,2027-12-12T21:30:00+00:00
ab5086f2f2f2f2f2f2f2f2f3,85,10,16,8,55,75,12,94.0,47,47,23,151,9.0,60,11,51,2.2,13,2027,30,105100.0,25,94.0,sous station,9.4,202.5,23.0,60.0,16/10,16/10/2027,13:30,2027-10-16T13:30:00,25.12,267125272015603,2027-10-16T13:30:00+00:00,2027-10-16T13:30:00+02:00,2027-10-16T13:30:00+00:00,2027-10-16T13:30:00+00:00
ab5092f2f2f2f2f2f2f2f2f3,85,10,16,9,23,75,12,94.0,47,47,23,151,9.0,60,11,51,2.2,5,2028,30,105100.0,25,94.0,sous station,9.4,202.5,23.0,60.0,16/10,16/10/2028,5:30,2028-10-16T05:30:00,25.12,267125272015603,2028-10-16T05:30:00+00:00,2028-10-16T05:30:00+02:00,2028-10-16T05:30:00+00:00,2028-10-16T05:30:00+00:00
ab50b0f2f2f2f2f2f2f2f2f3,85,10,16,11,7,75,12,94.0,47,47,23,151,9.0,60,11,51,2.2,1,2030,30,105100.0,25,94.0,sous station,9.4,202.5,23.0,60.0,16/10,16/10/2030,1:30,2030-10-16T01:30:00,25.12,267125272015603,2030-10-16T01:30:00+00:00,2030-10-16T01:30:00+02:00,2030-10-16T01:30:00+00:00,2030-10-16T01:30:00+00:00
ab9084f2f2f2f2f2f2f2f2f3,85,12,16,8,39,75,12,94.0,47,47,23,151,9.0,60,11,51,2.2,9,2027,30,105100.0,25,94.0,sous station,9.4,202.5,23.0,60.0,16/12,16/12/2027,9:30,2027-12-16T09:30:00,25.12,267125272015603,2027-12-16T09:30:00+00:00,2027-12-16T09:30:00+01:00,2027-12-16T09:30:00+00:00,2027-12-16T09:30:00+00:00
ab9c92f2f2f2f2f2f2f2f2f3,85,12,28,9,23,75,12,94.0,47,47,23,151,9.0,60,11,51,2.2,5,2028,30,105100.0,25,94.0,sous station,9.4,202.5,23.0,60.0,28/12,28/12/2028,5:30,2028-12-28T05:30:00,25.12,267125272015603,2028-12-28T05:30:00+00:00,2028-12-28T05:30:00+01:00,2028-12-28T05:30:00+00:00,2028-12-28T05:30:00+00:00
ab98a8f2f2f2f2f2f2f2f2f3,85,12,24,10,71,75,12,94.0,47,47,23,151,9.0,60,11,51,2.2,17,2029,30,105100.0,25,94.0,sous station,9.4,202.5,23.0,60.0,24/12,24/12/2029,17:30,2029-12-24T17:30:00,25.12,267125272015603,2029-12-24T17:30:00+00:00,2029-12-24T17:30:00+01:00,2029-12-24T17:30:00+00:00,2029-12-24T17:30:00+00:00
ab94b6f2f2f2f2f2f2f2f2f3,85,12,20,11,55,75,12,94.0,47,47,23,151,9.0,60,11,51,2.2,13,2030,30,105100.0,25,94.0,sous station,9.4,202.5,23.0,60.0,20/12,20/12/2030,13:30,2030-12-20T13:30:00,25.12,267125272015603,2030-12-20T13:30:00+00:00,2030-12-20T13:30:00+01:00,2030-12-20T13:30:00+00:00,2030-12-20T13:30:00+00:00
ab64b4f2f2f2f2f2f2f2f2f3,85,11,4,11,39,75,12,94.0,47,47,23,151,9.0,60,11,51,2.2,9,2030,30,105100.0,25,94.0,sous station,9.4,202.5,23.0,60.0,4/11,4/11/2030,9:30,2030-11-04T09:30:00,25.12,267125272015603,2030-11-04T09:30:00+00:00,2030-11-04T09:30:00+01:00,2030-11-04T09:30:00+00:00,2030-11-04T09:30:00+00:00
ab9c8af2f2f2f2f2f2f2f2f3,85,12,28,8,87,75,12,94.0,47,47,23,151,9.0,60,11,51,2.2,21,2027,30,105100.0,25,94.0,sous station,9.4,202.5,23.0,60.0,28/12,28/12/2027,21:30,2027-12-28T21:30:00,25.12,267125272015603,2027-12-28T21:30:00+00:00,2027-12-28T21:30:00+01:00,2027-12-28T21:30:00+00:00,2027-12-28T21:30:00+00:00
ab9886f2f2f2f2f2f2f2f2f3,85,12,24,8,55,75,12,94.0,47,47,23,151,9.0,60,11,51,2.2,13,2027,30,105100.0,25,94.0,sous station,9.4,202.5,23.0,60.0,24/12,24/12/2027,13:30,2027-12-24T13:30:00,25.12,267125272015603,2027-12-24T13:30:00+00:00,2027-12-24T13:30:00+01:00,2027-12-24T13:30:00+00:00,2027-12-24T13:30:00+00:00
ab4884f2f2f2f2f2f2f2f2f3,85,10,8,8,39,75,12,94.0,47,47,23,151,9.0,60,11,51,2.2,9,2027,30,105100.0,25,94.0,sous station,9.4,202.5,23.0,60.0,8/10,8/10/2027,9:30,2027-10-08T09:30:00,25.12,267125272015603,2027-10-08T09:30:00+00:00,2027-10-08T09:30:00+02:00,2027-10-08T09:30:00+00:00,2027-10-08T09:30:00+00:00
ab48b2f2f2f2f2f2f2f2f2f3,85,10,8,11,23,75,12,94.0,47,47,23,151,9.0,60,11,51,2.2,5,2030,30,105100.0,25,94.0,sous station,9.4,202.5,23.0,60.0,8/10,8/10/2030,5:30,2030-10-08T05:30:00,25.12,267125272015603,2030-10-08T05:30:00+00:00,2030-10-08T05:30:00+02:00,2030-10-08T05:30:00+00:00,2030-10-08T05:30:00+00:00
aaac96f2f2f2f2f2f2f2f2f3,85,5,12,9,55,75,12,94.0,47,47,23,151,9.0,60,11,51,2.2,13,2028,30,105100.0,25,94.0,sous station,9.4,202.5,23.0,60.0,12/5,12/5/2028,13:30,2028-05-12T13:30:00,25.12,267125272015603,2028-05-12T13:30:00+00:00,2028-05-12T13:30:00+02:00,2028-05-12T13:30:00+00:00,2028-05-12T13:30:00+00:00
aafcb2f2f2f2f2f2f2f2f2f3,85,7,28,11,23,75,12,94.0,47,47,23,151,9.0,60,11,51,2.2,5,2030,30,105100.0,25,94.0,sous station,9.4,202.5,23.0,60.0,28/7,28/7/2030,5:30,2030-07-28T05:30:00,25.12,267125272015603,2030-07-28T05:30:00+00:00,2030-07-28T05:30:00+02:00,2030-07-28T05:30:00+00:00,2030-07-28T05:30:00+00:00
ab4ca8f2f2f2f2f2f2f2f2f3,85,10,12,10,71,75,12,94.0,47,47,23,151,9.0,60,11,51,2.2,17,2029,30,105100.0,25,94.0,sous station,9.4,202.5,23.0,60.0,12/10,12/10/2029,17:30,2029-10-12T17:30:00,25.12,267125272015603,2029-10-12T17:30:00+00:00,2029-10-12T17:30:00+02:00,2029-10-12T17:30:00+00:00,2029-10-12T17:30:00+00:00
ab8894f2f2f2f2f2f2f2f2f3,85,12,8,9,39,75,12,94.0,47,47,23,151,9.0,60,11,51,2.2,9,2028,30,105100.0,25,94.0,sous station,9.4,202.5,23.0,60.0,8/12,8/12/2028,9:30,2028-12-08T09:30:00,25.12,267125272015603,2028-12-08T09:30:00+00:00,2028-12-08T09:30:00+01:00,2028-12-08T09:30:00+00:00,2028-12-08T09:30:00+00:00
ab8c9af2f2f2f2f2f2f2f2f3,85,12,12,9,87,75,12,94.0,47,47,23,151,9.0,60,11,51,2.2,21,2028,30,105100.0,25,94.0,sous station,9.4,202.5,23.0,60.0,12/12,12/12/2028,21:30,2028-12-12T21:30:00,25.12,267125272015603,2028-12-12T21:30:00+00:00,2028-12-12T21:30:00+01:00,2028-12-12T21:30:00+00:00,2028-12-12T21:30:00+00:00
ab6ca6f2f2f2f2f2f2f2f2f3,85,11,12,10,55,75,12,94.0,47,47,23,151,9.0,60,11,51,2.2,13,2029,30,105100.0,25,94.0,sous station,9.4,202.5,23.0,60.0,12/11,12/11/2029,13:30,2029-11-12T13:30:00,25.12,267125272015603,2029-11-12T13:30:00+00:00,2029-11-12T13:30:00+01:00,2029-11-12T13:30:00+00:00,2029-11-12T13:30:00+00:00
ab6cb2f2f2f2f2f2f2f2f2f3,85,11,12,11,23,75,12,94.0,47,47,23,151,9.0,60,11,51,2.2,5,2030,30,105100.0,25,94.0,sous station,9.4,202.5,23.0,60.0,12/11,12/11/2030,5:30,2030-11-12T05:30:00,25.12,267125272015603,2030-11-12T05:30:00+00:00,2030-11-12T05:30:00+01:00,2030-11-12T05:30:00+00:00,2030-11-12T05:30:00+00:00
ab50b8f2f2f2f2f2f2f2f2f3,85,10,16,11,71,75,12,94.0,47,47,23,151,9.0,60,11,51,2.2,17,2030,30,105100.0,25,94.0,sous station,9.4,202.5,23.0,60.0,16/10,16/10/2030,17:30,2030-10-16T17:30:00,25.12,267125272015603,2030-10-16T17:30:00+00:00,2030-10-16T17:30:00+02:00,2030-10-16T17:30:00+00:00,2030-10-16T17:30:00+00:00
ab1ca8f2f2f2f2f2f2f2f2f3,85,8,28,10,71,75,12,94.0,47,47,23,151,9.0,60,11,51,2.2,17,2029,30,105100.0,25,94.0,sous station,9.4,202.5,23.0,60.0,28/8,28/8/2029,17:30,2029-08-28T17:30:00,25.12,267125272015603,2029-08-28T17:30:00+00:00,2029-08-28T17:30:00+02:00,2029-08-28T17:30:00+00:00,2029-08-28T17:30:00+00:00
ab1cb6f2f2f2f2f2f2f2f2f3,85,8,28,11,55,75,12,94.0,47,47,23,151,9.0,60,11,51,2.2,13,2030,30,105100.0,25,94.0,sous station,9.4,202.5,23.0,60.0,28/8,28/8/2030,13:30,2030-08-28T13:30:00,25.12,267125272015603,2030-08-28T13:30:00+00:00,2030-08-28T13:30:00+02:00,2030-08-28T13:30:00+00:00,2030-08-28T13:30:00+00:00
ab5480f2f2f2f2f2f2f2f2f3,85,10,20,8,7,75,12,94.0,47,47,23,151,9.0,60,11,51,2.2,1,2027,30,105100.0,25,94.0,sous station,9.4,202.5,23.0,60.0,20/10,20/10/2027,1:30,2027-10-20T01:30:00,25.12,267125272015603,2027-10-20T01:30:00+00:00,2027-10-20T01:30:00+02:00,2027-10-20T01:30:00+00:00,2027-10-20T01:30:00+00:00
ab9080f2f2f2f2f2f2f2f2f3,85,12,16,8,7,75,12,94.0,47,47,23,151,9.0,60,11,51,2.2,1,2027,30,105100.0,25,94.0,sous station,9.4,202.5,23.0,60.0,16/12,16/12/2027,1:30,2027-12-16T01:30:00,25.12,267125272015603,2027-12-16T01:30:00+00:00,2027-12-16T01:30:00+01:00,2027-12-16T01:30:00+00:00,2027-12-16T01:30:00+00:00
ab74a6f2f2f2f2f2f2f2f2f3,85,11,20,10,55,75,12,94.0,47,47,23,151,9.0,60,11,51,2.2,13,2029,30,105100.0,25,94.0,sous station,9.4,202.5,23.0,60.0,20/11,20/11/2029,13:30,2029-11-20T13:30:00,25.12,267125272015603,2029-11-20T13:30:00+00:00,2029-11-20T13:30:00+01:00,2029-11-20T13:30:00+00:00,2029-11-20T13:30:00+00:00
ab6896f2f2f2f2f2f2f2f2f3,85,11,8,9,55,75,12,94.0,47,47,23,151,9.0,60,11,51,2.2,13,2028,30,105100.0,25,94.0,sous station,9.4,202.5,23.0,60.0,8/11,8/11/2028,13:30,2028-11-08T13:30:00,25.12,267125272015603,2028-11-08T13:30:00+00:00,2028-11-08T13:30:00+01:00,2028-11-08T13:30:00+00:00,2028-11-08T13:30:00+00:00
ab6c84f2f2f2f2f2f2f2f2f3,85,11,12,8,39,75,12,94.0,47,47,23,151,9.0,60,11,51,2.2,9,2027,30,105100.0,25,94.0,sous station,9.4,202.5,23.0,60.0,12/11,12/11/2027,9:30,2027-11-12T09:30:00,25.12,267125272015603,2027-11-12T09:30:00+00:00,2027-11-12T09:30:00+01:00,2027-11-12T09:30:00+00:00,2027-11-12T09:30:00+00:00
ab6cb4f2f2f2f2f2f2f2f2f3,85,11,12,11,39,75,12,94.0,47,47,23,151,9.0,60,11,51,2.2,9,2030,30,105100.0,25,94.0,sous station,9.4,202.5,23.0,60.0,12/11,12/11/2030,9:30,2030-11-12T09:30:00,25.12,267125272015603,2030-11-12T09:30:00+00:00,2030-11-12T09:30:00+01:00,2030-11-12T09:30:00+00:00,2030-11-12T09:30:00+00:00
ab10b4f2f2f2f2f2f2f2f2f3,85,8,16,11,39,75,12,94.0,47,47,23,151,9.0,60,11,51,2.2,9,2030,30,105100.0,25,94.0,sous station,9.4,202.5,23.0,60.0,16/8,16/8/2030,9:30,2030-08-16T09:30:00,25.12,267125272015603,2030-08-16T09:30:00+00:00,2030-08-16T09:30:00+02:00,2030-08-16T09:30:00+00:00,2030-08-16T09:30:00+00:00
ab2890f2f2f2f2f2f2f2f2f3,85,9,8,9,7,75,12,94.0,47,47,23,151,9.0,60,11,51,2.2,1,2028,30,105100.0,25,94.0,sous station,9.4,202.5,23.0,60.0,8/9,8/9/2028,1:30,2028-09-08T01:30:00,25.12,267125272015603,2028-09-08T01:30:00+00:00,2028-09-08T01:30:00+02:00,2028-09-08T01:30:00+00:00,2028-09-08T01:30:00+00:00
aafca6f2f2f2f2f2f2f2f2f3,85,7,28,10,55,75,12,94.0,47,47,23,151,9.0,60,11,51,2.2,13,2029,30,105100.0,25,94.0,sous station,9.4,202.5,23.0,60.0,28/7,28/7/2029,13:30,2029-07-28T13:30:00,25.12,267125272015603,2029-07-28T13:30:00+00:00,2029-07-28T13:30:00+02:00,2029-07-28T13:30:00+00:00,2029-07-28T13:30:00+00:00
ab24b8f2f2f2f2f2f2f2f2f3,85,9,4,11,71,75,12,94.0,47,47,23,151,9.0,60,11,51,2.2,17,2030,30,105100.0,25,94.0,sous station,9.4,202.5,23.0,60.0,4/9,4/9/2030,17:30,2030-09-04T17:30:00,25.12,267125272015603,2030-09-04T17:30:00+00:00,2030-09-04T17:30:00+02:00,2030-09-04T17:30:00+00:00,2030-09-04T17:30:00+00:00
ab14aaf2f2f2f2f2f2f2f2f3,85,8,20,10,87,75,12,94.0,47,47,23,151,9.0,60,11,51,2.2,21,2029,30,105100.0,25,94.0,sous station,9.4,202.5,23.0,60.0,20/8,20/8/2029,21:30,2029-08-20T21:30:00,25.12,267125272015603,2029-08-20T21:30:00+00:00,2029-08-20T21:30:00+02:00,2029-08-20T21:30:00+00:00,2029-08-20T21:30:00+00:00
ab64a8f2f2f2f2f2f2f2f2f3,85,11,4,10,71,75,12,94.0,47,47,23,151,9.0,60,11,51,2.2,17,2029,30,105100.0,25,94.0,sous station,9.4,202.5,23.0,60.0,4/11,4/11/2029,17:30,2029-11-04T17:30:00,25.12,267125272015603,2029-11-04T17:30:00+00:00,2029-11-04T17:30:00+01:00,2029-11-04T17:30:00+00:00,2029-11-04T17:30:00+00:00
ab14baf2f2f2f2f2f2f2f2f3,85,8,20,11,87,75,12,94.0,47,47,23,151,9.0,60,11,51,2.2,21,2030,30,105100.0,25,94.0,sous station,9.4,202.5,23.0,60.0,20/8,20/8/2030,21:30,2030-08-20T21:30:00,25.12,267125272015603,2030-08-20T21:30:00+00:00,2030-08-20T21:30:00+02:00,2030-08-20T21:30:00+00:00,2030-08-20T21:30:00+00:00
ab6888f2f2f2f2f2f2f2f2f3,85,11,8,8,71,75,12,94.0,47,47,23,151,9.0,60,11,51,2.2,17,2027,30,105100.0,25,94.0,sous station,9.4,202.5,23.0,60.0,8/11,8/11/2027,17:30,2027-11-08T17:30:00,25.12,267125272015603,2027-11-08T17:30:00+00:00,2027-11-08T17:30:00+01:00,2027-11-08T17:30:00+00:00,2027-11-08T17:30:00+00:00
ab74b2f2f2f2f2f2f2f2f2f3,85,11,20,11,23,75,12,94.0,47,47,23,151,9.0,60,11,51,2.2,5,2030,30,105100.0,25,94.0,sous station,9.4,202.5,23.0,60.0,20/11,20/11/2030,5:30,2030-11-20T05:30:00,25.12,267125272015603,2030-11-20T05:30:00+00:00,2030-11-20T05:30:00+01:00,2030-11-20T05:30:00+00:00,2030-11-20T05:30:00+00:00
ab08b8f2f2f2f2f2f2f2f2f3,85,8,8,11,71,75,12,94.0,47,47,23,151,9.0,60,11,51,2.2,17,2030,30,105100.0,25,94.0,sous station,9.4,202.5,23.0,60.0,8/8,8/8/2030,17:30,2030-08-08T17:30:00,25.12,267125272015603,2030-08-08T17:30:00+00:00,2030-08-08T17:30:00+02:00,2030-08-08T17:30:00+00:00,2030-08-08T17:30:00+00:00
ab08baf2f2f2f2f2f2f2f2f3,85,8,8,11,87,75,12,94.0,47,47,23,151,9.0,60,11,51,2.2,21,2030,30,105100.0,25,94.0,sous station,9.4,202.5,23.0,60.0,8/8,8/8/2030,21:30,2030-08-08T21:30:00,25.12,267125272015603,2030-08-08T21:30:00+00:00,2030-08-08T21:30:00+02:00,2030-08-08T21:30:00+00:00,2030-08-08T21:30:00+00:00
ab04b6f2f2f2f2f2f2f2f2f3,85,8,4,11,55,75,12,94.0,47,47,23,151,9.0,60,11,51,2.2,13,2030,30,105100.0,25,94.0,sous station,9.4,202.5,23.0,60.0,4/8,4/8/2030,13:30,2030-08-04T13:30:00,25.12,267125272015603,2030-08-04T13:30:00+00:00,2030-08-04T13:30:00+02:00,2030-08-04T13:30:00+00:00,2030-08-04T13:30:00+00:00
ab8cb8f2f2f2f2f2f2f2f2f3,85,12,12,11,71,75,12,94.0,47,47,23,151,9.0,60,11,51,2.2,17,2030,30,105100.0,25,94.0,sous station,9.4,202.5,23.0,60.0,12/12,12/12/2030,17:30,2030-12-12T17:30:00,25.12,267125272015603,2030-12-12T17:30:00+00:00,2030-12-12T17:30:00+01:00,2030-12-12T17:30:00+00:00,2030-12-12T17:30:00+00:00
a8b080f2f2f2f2f2f2f2f2f3,84,5,16,8,7,75,12,94.0,47,47,23,151,9.0,60,11,51,2.2,1,2027,30,105100.0,25,94.0,sous station,9.4,202.5,23.0,60.0,16/5,16/5/2027,1:30,2027-05-16T01:30:00,25.12,267125272015603,2027-05-16T01:30:00+00:00,2027-05-16T01:30:00+02:00,2027-05-16T01:30:00+00:00,2027-05-16T01:30:00+00:00
a8b088f2f2f2f2f2f2f2f2f3,84,5,16,8,71,75,12,94.0,47,47,23,151,9.0,60,11,51,2.2,17,2027,30,105100.0,25,94.0,sous station,9.4,202.5,23.0,60.0,16/5,16/5/2027,17:30,2027-05-16T17:30:00,25.12,267125272015603,2027-05-16T17:30:00+00:00,2027-05-16T17:30:00+02:00,2027-05-16T17:30:00+00:00,2027-05-16T17:30:00+00:00
a8e4aaf2f2f2f2f2f2f2f2f3,84,7,4,10,87,75,12,94.0,47,47,23,151,9.0,60,11,51,2.2,21,2029,30,105100.0,25,94.0,sous station,9.4,202.5,23.0,60.0,4/7,4/7/2029,21:30,2029-07-04T21:30:00,25.12,267125272015603,2029-07-04T21:30:00+00:00,2029-07-04T21:30:00+02:00,2029-07-04T21:30:00+00:00,2029-07-04T21:30:00+00:00
a90896f2f2f2f2f2f2f2f2f3,84,8,8,9,55,75,12,94.0,47,47,23,151,9.0,60,11,51,2.2,13,2028,30,105100.0,25,94.0,sous station,9.4,202.5,23.0,60.0,8/8,8/8/2028,13:30,2028-08-08T13:30:00,25.12,267125272015603,2028-08-08T13:30:00+00:00,2028-08-08T13:30:00+02:00,2028-08-08T13:30:00+00:00,2028-08-08T13:30:00+00:00
ae2876f2f2f2f2f2f2f2f2f3,87,1,8,7,55,75,12,94.0,47,47,23,151,9.0,60,11,51,2.2,13,2026,30,105100.0,25,94.0,sous station,9.4,202.5,23.0,60.0,8/1,8/1/2026,13:30,2026-01-08T13:30:00,25.12,267125272015603,2026-01-08T13:30:00+00:00,2026-01-08T13:30:00+01:00,2026-01-08T13:30:00+00:00,2026-01-08T13:30:00+00:00
ae5c7af2f2f2f2f2f2f2f2f3,87,2,28,7,87,75,12,94.0,47,47,23,151,9.0,60,11,51,2.2,21,2026,30,105100.0,25,94.0,sous station,9.4,202.5,23.0,60.0,28/2,28/2/2026,21:30,2026-02-28T21:30:00,25.12,267125272015603,2026-02-28T21:30:00+00:00,2026-02-28T21:30:00+01:00,2026-02-28T21:30:00+00:00,2026-02-28T21:30:00+00:00
a910a4f2f2f2f2f2f2f2f2f3,84,8,16,10,39,75,12,94.0,47,47,23,151,9.0,60,11,51,2.2,9,2029,30,105100.0,25,94.0,sous station,9.4,202.5,23.0,60.0,16/8,16/8/2029,9:30,2029-08-16T09:30:00,25.12,267125272015603,2029-08-16T09:30:00+00:00,2029-08-16T09:30:00+02:00,2029-08-16T09:30:00+00:00,2029-08-16T09:30:00+00:00
a918a2f2f2f2f2f2f2f2f2f3,84,8,24,10,23,75,12,94.0,47,47,23,151,9.0,60,11,51,2.2,5,2029,30,105100.0,25,94.0,sous station,9.4,202.5,23.0,60.0,24/8,24/8/2029,5:30,2029-08-24T05:30:00,25.12,267125272015603,2029-08-24T05:30:00+00:00,2029-08-24T05:30:00+02:00,2029-08-24T05:30:00+00:00,2029-08-24T05:30:00+00:00
a8fcb4f2f2f2f2f2f2f2f2f3,84,7,28,11,39,75,12,94.0,47,47,23,151,9.0,60,11,51,2.2,9,2030,30,105100.0,25,94.0,sous station,9.4,202.5,23.0,60.0,28/7,28/7/2030,9:30,2030-07-28T09:30:00,25.12,267125272015603,2030-07-28T09:30:00+00:00,2030-07-28T09:30:00+02:00,2030-07-28T09:30:00+00:00,2030-07-28T09:30:00+00:00
a91caaf2f2f2f2f2f2f2f2f3,84,8,28,10,87,75,12,94.0,47,47,23,151,9.0,60,11,51,2.2,21,2029,30,105100.0,25,94.0,sous station,9.4,202.5,23.0,60.0,28/8,28/8/2029,21:30,2029-08-28T21:30:00,25.12,267125272015603,2029-08-28T21:30:00+00:00,2029-08-28T21:30:00+02:00,2029-08-28T21:30:00+00:00,2029-08-28T21:30:00+00:00
ab28aaf2f2f2f2f2f2f2f2f3,85,9,8,10,87,75,12,94.0,47,47,23,151,9.0,60,11,51,2.2,21,2029,30,105100.0,25,94.0,sous station,9.4,202.5,23.0,60.0,8/9,8/9/2029,21:30,2029-09-08T21:30:00,25.12,267125272015603,2029-09-08T21:30:00+00:00,2029-09-08T21:30:00+02:00,2029-09-08T21:30:00+00:00,2029-09-08T21:30:00+00:00
a888a8f2f2f2f2f2f2f2f2f3,84,4,8,10,71,75,12,94.0,47,47,23,151,9.0,60,11,51,2.2,17,2029,30,105100.0,25,94.0,sous station,9.4,202.5,23.0,60.0,8/4,8/4/2029,17:30,2029-04-08T17:30:00,25.12,267125272015603,2029-04-08T17:30:00+00:00,2029-04-08T17:30:00+02:00,2029-04-08T17:30:00+00:00,2029-04-08T17:30:00+00:00
ae4c76f2f2f2f2f2f2f2f2f3,87,2,12,7,55,75,12,94.0,47,47,23,151,9.0,60,11,51,2.2,13,2026,30,105100.0,25,94.0,sous station,9.4,202.5,23.0,60.0,12/2,12/2/2026,13:30,2026-02-12T13:30:00,25.12,267125272015603,2026-02-12T13:30:00+00:00,2026-02-12T13:30:00+01:00,2026-02-12T13:30:00+00:00,2026-02-12T13:30:00+00:00
a8a8a8f2f2f2f2f2f2f2f2f3,84,5,8,10,71,75,12,94.0,47,47,23,151,9.0,60,11,51,2.2,17,2029,30,105100.0,25,94.0,sous station,9.4,202.5,23.0,60.0,8/5,8/5/2029,17:30,2029-05-08T17:30:00,25.12,267125272015603,2029-05-08T17:30:00+00:00,2029-05-08T17:30:00+02:00,2029-05-08T17:30:00+00:00,2029-05-08T17:30:00+00:00
ab3caaf2f2f2f2f2f2f2f2f3,85,9,28,10,87,75,12,94.0,47,47,23,151,9.0,60,11,51,2.2,21,2029,30,105100.0,25,94.0,sous station,9.4,202.5,23.0,60.0,28/9,28/9/2029,21:30,2029-09-28T21:30:00,25.12,267125272015603,2029-09-28T21:30:00+00:00,2029-09-28T21:30:00+02:00,2029-09-28T21:30:00+00:00,2029-09-28T21:30:00+00:00
ab3cb8f2f2f2f2f2f2f2f2f3,85,9,28,11,71,75,12,94.0,47,47,23,151,9.0,60,11,51,2.2,17,2030,30,105100.0,25,94.0,sous station,9.4,202.5,23.0,60.0,28/9,28/9/2030,17:30,2030-09-28T17:30:00,25.12,267125272015603,2030-09-28T17:30:00+00:00,2030-09-28T17:30:00+02:00,2030-09-28T17:30:00+00:00,2030-09-28T17:30:00+00:00
a888b8f2f2f2f2f2f2f2f2f3,84,4,8,11,71,75,12,94.0,47,47,23,151,9.0,60,11,51,2.2,17,2030,30,105100.0,25,94.0,sous station,9.4,202.5,23.0,60.0,8/4,8/4/2030,17:30,2030-04-08T17:30:00,25.12,267125272015603,2030-04-08T17:30:00+00:00,2030-04-08T17:30:00+02:00,2030-04-08T17:30:00+00:00,2030-04-08T17:30:00+00:00
a88c9af2f2f2f2f2f2f2f2f3,84,4,12,9,87,75,12,94.0,47,47,23,151,9.0,60,11,51,2.2,21,2028,30,105100.0,25,94.0,sous station,9.4,202.5,23.0,60.0,12/4,12/4/2028,21:30,2028-04-12T21:30:00,25.12,267125272015603,2028-04-12T21:30:00+00:00,2028-04-12T21:30:00+02:00,2028-04-12T21:30:00+00:00,2028-04-12T21:30:00+00:00
a890baf2f2f2f2f2f2f2f2f3,84,4,16,11,87,75,12,94.0,47,47,23,151,9.0,60,11,51,2.2,21,2030,30,105100.0,25,94.0,sous station,9.4,202.5,23.0,60.0,16/4,16/4/2030,21:30,2030-04-16T21:30:00,25.12,267125272015603,2030-04-16T21:30:00+00:00,2030-04-16T21:30:00+02:00,2030-04-16T21:30:00+00:00,2030-04-16T21:30:00+00:00
a90cb4f2f2f2f2f2f2f2f2f3,84,8,12,11,39,75,12,94.0,47,47,23,151,9.0,60,11,51,2.2,9,2030,30,105100.0,25,94.0,sous station,9.4,202.5,23.0,60.0,12/8,12/8/2030,9:30,2030-08-12T09:30:00,25.12,267125272015603,2030-08-12T09:30:00+00:00,2030-08-12T09:30:00+02:00,2030-08-12T09:30:00+00:00,2030-08-12T09:30:00+00:00
a90890f2f2f2f2f2f2f2f2f3,84,8,8,9,7,75,12,94.0,47,47,23,151,9.0,60,11,51,2.2,1,2028,30,105100.0,25,94.0,sous station,9.4,202.5,23.0,60.0,8/8,8/8/2028,1:30,2028-08-08T01:30:00,25.12,267125272015603,2028-08-08T01:30:00+00:00,2028-08-08T01:30:00+02:00,2028-08-08T01:30:00+00:00,2028-08-08T01:30:00+00:00
a914a8f2f2f2f2f2f2f2f2f3,84,8,20,10,71,75,12,94.0,47,47,23,151,9.0,60,11,51,2.2,17,2029,30,105100.0,25,94.0,sous station,9.4,202.5,23.0,60.0,20/8,20/8/2029,17:30,2029-08-20T17:30:00,25.12,267125272015603,2029-08-20T17:30:00+00:00,2029-08-20T17:30:00+02:00,2029-08-20T17:30:00+00:00,2029-08-20T17:30:00+00:00
a91890f2f2f2f2f2f2f2f2f3,84,8,24,9,7,75,12,94.0,47,47,23,151,9.0,60,11,51,2.2,1,2028,30,105100.0,25,94.0,sous station,9.4,202.5,23.0,60.0,24/8,24/8/2028,1:30,2028-08-24T01:30:00,25.12,267125272015603,2028-08-24T01:30:00+00:00,2028-08-24T01:30:00+02:00,2028-08-24T01:30:00+00:00,2028-08-24T01:30:00+00:00
a91c94f2f2f2f2f2f2f2f2f3,84,8,28,9,39,75,12,94.0,47,47,23,151,9.0,60,11,51,2.2,9,2028,30,105100.0,25,94.0,sous station,9.4,202.5,23.0,60.0,28/8,28/8/2028,9:30,2028-08-28T09:30:00,25.12,267125272015603,2028-08-28T09:30:00+00:00,2028-08-28T09:30:00+02:00,2028-08-28T09:30:00+00:00,2028-08-28T09:30:00+00:00
a94898f2f2f2f2f2f2f2f2f3,84,10,8,9,71,75,12,94.0,47,47,23,151,9.0,60,11,51,2.2,17,2028,30,105100.0,25,94.0,sous station,9.4,202.5,23.0,60.0,8/10,8/10/2028,17:30,2028-10-08T17:30:00,25.12,267125272015603,2028-10-08T17:30:00+00:00,2028-10-08T17:30:00+02:00,2028-10-08T17:30:00+00:00,2028-10-08T17:30:00+00:00
a938a4f2f2f2f2f2f2f2f2f3,84,9,24,10,39,75,12,94.0,47,47,23,151,9.0,60,11,51,2.2,9,2029,30,105100.0,25,94.0,sous station,9.4,202.5,23.0,60.0,24/9,24/9/2029,9:30,2029-09-24T09:30:00,25.12,267125272015603,2029-09-24T09:30:00+00:00,2029-09-24T09:30:00+02:00,2029-09-24T09:30:00+00:00,2029-09-24T09:30:00+00:00
a93c94f2f2f2f2f2f2f2f2f3,84,9,28,9,39,75,12,94.0,47,47,23,151,9.0,60,11,51,2.2,9,2028,30,105100.0,25,94.0,sous station,9.4,202.5,23.0,60.0,28/9,28/9/2028,9:30,2028-09-28T09:30:00,25.12,267125272015603,2028-09-28T09:30:00+00:00,2028-09-28T09:30:00+02:00,2028-09-28T09:30:00+00:00,2028-09-28T09:30:00+00:00
ae4470f2f2f2f2f2f2f2f2f3,87,2,4,7,7,75,12,94.0,47,47,23,151,9.0,60,11,51,2.2,1,2026,30,105100.0,25,94.0,sous station,9.4,202.5,23.0,60.0,4/2,4/2/2026,1:30,2026-02-04T01:30:00,25.12,267125272015603,2026-02-04T01:30:00+00:00,2026-02-04T01:30:00+01:00,2026-02-04T01:30:00+00:00,2026-02-04T01:30:00+00:00
a92c9af2f2f2f2f2f2f2f2f3,84,9,12,9,87,75,12,94.0,47,47,23,151,9.0,60,11,51,2.2,21,2028,30,105100.0,25,94.0,sous station,9.4,202.5,23.0,60.0,12/9,12/9/2028,21:30,2028-09-12T21:30:00,25.12,267125272015603,2028-09-12T21:30:00+00:00,2028-09-12T21:30:00+02:00,2028-09-12T21:30:00+00:00,2028-09-12T21:30:00+00:00
a93096f2f2f2f2f2f2f2f2f3,84,9,16,9,55,75,12,94.0,47,47,23,151,9.0,60,11,51,2.2,13,2028,30,105100.0,25,94.0,sous station,9.4,202.5,23.0,60.0,16/9,16/9/2028,13:30,2028-09-16T13:30:00,25.12,267125272015603,2028-09-16T13:30:00+00:00,2028-09-16T13:30:00+02:00,2028-09-16T13:30:00+00:00,2028-09-16T13:30:00+00:00
a930a0f2f2f2f2f2f2f2f2f3,84,9,16,10,7,75,12,94.0,47,47,23,151,9.0,60,11,51,2.2,1,2029,30,105100.0,25,94.0,sous station,9.4,202.5,23.0,60.0,16/9,16/9/2029,1:30,2029-09-16T01:30:00,25.12,267125272015603,2029-09-16T01:30:00+00:00,2029-09-16T01:30:00+02:00,2029-09-16T01:30:00+00:00,2029-09-16T01:30:00+00:00
a93c86f2f2f2f2f2f2f2f2f3,84,9,28,8,55,75,12,94.0,47,47,23,151,9.0,60,11,51,2.2,13,2027,30,105100.0,25,94.0,sous station,9.4,202.5,23.0,60.0,28/9,28/9/2027,13:30,2027-09-28T13:30:00,25.12,267125272015603,2027-09-28T13:30:00+00:00,2027-09-28T13:30:00+02:00,2027-09-28T13:30:00+00:00,2027-09-28T13:30:00+00:00
a950b8f2f2f2f2f2f2f2f2f3,84,10,16,11,71,75,12,94.0,47,47,23,151,9.0,60,11,51,2.2,17,2030,30,105100.0,25,94.0,sous station,9.4,202.5,23.0,60.0,16/10,16/10/2030,17:30,2030-10-16T17:30:00,25.12,267125272015603,2030-10-16T17:30:00+00:00,2030-10-16T17:30:00+02:00,2030-10-16T17:30:00+00:00,2030-10-16T17:30:00+00:00
a970a0f2f2f2f2f2f2f2f2f3,84,11,16,10,7,75,12,94.0,47,47,23,151,9.0,60,11,51,2.2,1,2029,30,105100.0,25,94.0,sous station,9.4,202.5,23.0,60.0,16/11,16/11/2029,1:30,2029-11-16T01:30:00,25.12,267125272015603,2029-11-16T01:30:00+00:00,2029-11-16T01:30:00+01:00,2029-11-16T01:30:00+00:00,2029-11-16T01:30:00+00:00
a94c8af2f2f2f2f2f2f2f2f3,84,10,12,8,87,75,12,94.0,47,47,23,151,9.0,60,11,51,2.2,21,2027,30,105100.0,25,94.0,sous station,9.4,202.5,23.0,60.0,12/10,12/10/2027,21:30,2027-10-12T21:30:00,25.12,267125272015603,2027-10-12T21:30:00+00:00,2027-10-12T21:30:00+02:00,2027-10-12T21:30:00+00:00,2027-10-12T21:30:00+00:00
a95ca6f2f2f2f2f2f2f2f2f3,84,10,28,10,55,75,12,94.0,47,47,23,151,9.0,60,11,51,2.2,13,2029,30,105100.0,25,94.0,sous station,9.4,202.5,23.0,60.0,28/10,28/10/2029,13:30,2029-10-28T13:30:00,25.12,267125272015603,2029-10-28T13:30:00+00:00,2029-10-28T13:30:00+01:00,2029-10-28T13:30:00+00:00,2029-10-28T13:30:00+00:00
a99890f2f2f2f2f2f2f2f2f3,84,12,24,9,7,75,12,94.0,47,47,23,151,9.0,60,11,51,2.2,1,2028,30,105100.0,25,94.0,sous station,9.4,202.5,23.0,60.0,24/12,24/12/2028,1:30,2028-12-24T01:30:00,25.12,267125272015603,2028-12-24T01:30:00+00:00,2028-12-24T01:30:00+01:00,2028-12-24T01:30:00+00:00,2028-12-24T01:30:00+00:00
aa2886f2f2f2f2f2f2f2f2f3,85,1,8,8,55,75,12,94.0,47,47,23,151,9.0,60,11,51,2.2,13,2027,30,105100.0,25,94.0,sous station,9.4,202.5,23.0,60.0,8/1,8/1/2027,13:30,2027-01-08T13:30:00,25.12,267125272015603,2027-01-08T13:30:00+00:00,2027-01-08T13:30:00+01:00,2027-01-08T13:30:00+00:00,2027-01-08T13:30:00+00:00
aa309af2f2f2f2f2f2f2f2f3,85,1,16,9,87,75,12,94.0,47,47,23,151,9.0,60,11,51,2.2,21,2028,30,105100.0,25,94.0,sous station,9.4,202.5,23.0,60.0,16/1,16/1/2028,21:30,2028-01-16T21:30:00,25.12,267125272015603,2028-01-16T21:30:00+00:00,2028-01-16T21:30:00+01:00,2028-01-16T21:30:00+00:00,2028-01-16T21:30:00+00:00
aa3880f2f2f2f2f2f2f2f2f3,85,1,24,8,7,75,12,94.0,47,47,23,151,9.0,60,11,51,2.2,1,2027,30,105100.0,25,94.0,sous station,9.4,202.5,23.0,60.0,24/1,24/1/2027,1:30,2027-01-24T01:30:00,25.12,267125272015603,2027-01-24T01:30:00+00:00,2027-01-24T01:30:00+01:00,2027-01-24T01:30:00+00:00,2027-01-24T01:30:00+00:00
ae5c74f2f2f2f2f2f2f2f2f3,87,2,28,7,39,75,12,94.0,47,47,23,151,9.0,60,11,51,2.2,9,2026,30,105100.0,25,94.0,sous station,9.4,202.5,23.0,60.0,28/2,28/2/2026,9:30,2026-02-28T09:30:00,25.12,267125272015603,2026-02-28T09:30:00+00:00,2026-02-28T09:30:00+01:00,2026-02-28T09:30:00+00:00,2026-02-28T09:30:00+00:00
aa4ca0f2f2f2f2f2f2f2f2f3,85,2,12,10,7,75,12,94.0,47,47,23,151,9.0,60,11,51,2.2,1,2029,30,105100.0,25,94.0,sous station,9.4,202.5,23.0,60.0,12/2,12/2/2029,1:30,2029-02-12T01:30:00,25.12,267125272015603,2029-02-12T01:30:00+00:00,2029-02-12T01:30:00+01:00,2029-02-12T01:30:00+00:00,2029-02-12T01:30:00+00:00
ae6874f2f2f2f2f2f2f2f2f3,87,3,8,7,39,75,12,94.0,47,47,23,151,9.0,60,11,51,2.2,9,2026,30,105100.0,25,94.0,sous station,9.4,202.5,23.0,60.0,8/3,8/3/2026,9:30,2026-03-08T09:30:00,25.12,267125272015603,2026-03-08T09:30:00+00:00,2026-03-08T09:30:00+01:00,2026-03-08T09:30:00+00:00,2026-03-08T09:30:00+00:00
a884a0f2f2f2f2f2f2f2f2f3,84,4,4,10,7,75,12,94.0,47,47,23,151,9.0,60,11,51,2.2,1,2029,30,105100.0,25,94.0,sous station,9.4,202.5,23.0,60.0,4/4,4/4/2029,1:30,2029-04-04T01:30:00,25.12,267125272015603,2029-04-04T01:30:00+00:00,2029-04-04T01:30:00+02:00,2029-04-04T01:30:00+00:00,2029-04-04T01:30:00+00:00
a888a6f2f2f2f2f2f2f2f2f3,84,4,8,10,55,75,12,94.0,47,47,23,151,9.0,60,11,51,2.2,13,2029,30,105100.0,25,94.0,sous station,9.4,202.5,23.0,60.0,8/4,8/4/2029,13:30,2029-04-08T13:30:00,25.12,267125272015603,2029-04-08T13:30:00+00:00,2029-04-08T13:30:00+02:00,2029-04-08T13:30:00+00:00,2029-04-08T13:30:00+00:00
aa74b6f2f2f2f2f2f2f2f2f3,85,3,20,11,55,75,12,94.0,47,47,23,151,9.0,60,11,51,2.2,13,2030,30,105100.0,25,94.0,sous station,9.4,202.5,23.0,60.0,20/3,20/3/2030,13:30,2030-03-20T13:30:00,25.12,267125272015603,2030-03-20T13:30:00+00:00,2030-03-20T13:30:00+01:00,2030-03-20T13:30:00+00:00,2030-03-20T13:30:00+00:00
a8a4a4f2f2f2f2f2f2f2f2f3,84,5,4,10,39,75,12,94.0,47,47,23,151,9.0,60,11,51,2.2,9,2029,30,105100.0,25,94.0,sous station,9.4,202.5,23.0,60.0,4/5,4/5/2029,9:30,2029-05-04T09:30:00,25.12,267125272015603,2029-05-04T09:30:00+00:00,2029-05-04T09:30:00+02:00,2029-05-04T09:30:00+00:00,2029-05-04T09:30:00+00:00
a8aca6f2f2f2f2f2f2f2f2f3,84,5,12,10,55,75,12,94.0,47,47,23,151,9.0,60,11,51,2.2,13,2029,30,105100.0,25,94.0,sous station,9.4,202.5,23.0,60.0,12/5,12/5/2029,13:30,2029-05-12T13:30:00,25.12,267125272015603,2029-05-12T13:30:00+00:00,2029-05-12T13:30:00+02:00,2029-05-12T13:30:00+00:00,2029-05-12T13:30:00+00:00
aaacb6f2f2f2f2f2f2f2f2f3,85,5,12,11,55,75,12,94.0,47,47,23,151,9.0,60,11,51,2.2,13,2030,30,105100.0,25,94.0,sous station,9.4,202.5,23.0,60.0,12/5,12/5/2030,13:30,2030-05-12T13:30:00,25.12,267125272015603,2030-05-12T13:30:00+00:00,2030-05-12T13:30:00+02:00,2030-05-12T13:30:00+00:00,2030-05-12T13:30:00+00:00
a8b8b6f2f2f2f2f2f2f2f2f3,84,5,24,11,55,75,12,94.0,47,47,23,151,9.0,60,11,51,2.2,13,2030,30,105100.0,25,94.0,sous station,9.4,202.5,23.0,60.0,24/5,24/5/2030,13:30,2030-05-24T13:30:00,25.12,267125272015603,2030-05-24T13:30:00+00:00,2030-05-24T13:30:00+02:00,2030-05-24T13:30:00+00:00,2030-05-24T13:30:00+00:00
a8b8b8f2f2f2f2f2f2f2f2f3,84,5,24,11,71,75,12,94.0,47,47,23,151,9.0,60,11,51,2.2,17,2030,30,105100.0,25,94.0,sous station,9.4,202.5,23.0,60.0,24/5,24/5/2030,17:30,2030-05-24T17:30:00,25.12,267125272015603,2030-05-24T17:30:00+00:00,2030-05-24T17:30:00+02:00,2030-05-24T17:30:00+00:00,2030-05-24T17:30:00+00:00
aab0baf2f2f2f2f2f2f2f2f3,85,5,16,11,87,75,12,94.0,47,47,23,151,9.0,60,11,51,2.2,21,2030,30,105100.0,25,94.0,sous station,9.4,202.5,23.0,60.0,16/5,16/5/2030,21:30,2030-05-16T21:30:00,25.12,267125272015603,2030-05-16T21:30:00+00:00,2030-05-16T21:30:00+02:00,2030-05-16T21:30:00+00:00,2030-05-16T21:30:00+00:00
aab098f2f2f2f2f2f2f2f2f3,85,5,16,9,71,75,12,94.0,47,47,23,151,9.0,60,11,51,2.2,17,2028,30,105100.0,25,94.0,sous station,9.4,202.5,23.0,60.0,16/5,16/5/2028,17:30,2028-05-16T17:30:00,25.12,267125272015603,2028-05-16T17:30:00+00:00,2028-05-16T17:30:00+02:00,2028-05-16T17:30:00+00:00,2028-05-16T17:30:00+00:00
a8c49af2f2f2f2f2f2f2f2f3,84,6,4,9,87,75,12,94.0,47,47,23,151,9.0,60,11,51,2.2,21,2028,30,105100.0,25,94.0,sous station,9.4,202.5,23.0,60.0,4/6,4/6/2028,21:30,2028-06-04T21:30:00,25.12,267125272015603,2028-06-04T21:30:00+00:00,2028-06-04T21:30:00+02:00,2028-06-04T21:30:00+00:00,2028-06-04T21:30:00+00:00
a8c884f2f2f2f2f2f2f2f2f3,84,6,8,8,39,75,12,94.0,47,47,23,151,9.0,60,11,51,2.2,9,2027,30,105100.0,25,94.0,sous station,9.4,202.5,23.0,60.0,8/6,8/6/2027,9:30,2027-06-08T09:30:00,25.12,267125272015603,2027-06-08T09:30:00+00:00,2027-06-08T09:30:00+02:00,2027-06-08T09:30:00+00:00,2027-06-08T09:30:00+00:00
a8c88af2f2f2f2f2f2f2f2f3,84,6,8,8,87,75,12,94.0,47,47,23,151,9.0,60,11,51,2.2,21,2027,30,105100.0,25,94.0,sous station,9.4,202.5,23.0,60.0,8/6,8/6/2027,21:30,2027-06-08T21:30:00,25.12,267125272015603,2027-06-08T21:30:00+00:00,2027-06-08T21:30:00+02:00,2027-06-08T21:30:00+00:00,2027-06-08T21:30:00+00:00
aa88a8f2f2f2f2f2f2f2f2f3,85,4,8,10,71,75,12,94.0,47,47,23,151,9.0,60,11,51,2.2,17,2029,30,105100.0,25,94.0,sous station,9.4,202.5,23.0,60.0,8/4,8/4/2029,17:30,2029-04-08T17:30:00,25.12,267125272015603,2029-04-08T17:30:00+00:00,2029-04-08T17:30:00+02:00,2029-04-08T17:30:00+00:00,2029-04-08T17:30:00+00:00
aacc98f2f2f2f2f2f2f2f2f3,85,6,12,9,71,75,12,94.0,47,47,23,151,9.0,60,11,51,2.2,17,2028,30,105100.0,25,94.0,sous station,9.4,202.5,23.0,60.0,12/6,12/6/2028,17:30,2028-06-12T17:30:00,25.12,267125272015603,2028-06-12T17:30:00+00:00,2028-06-12T17:30:00+02:00,2028-06-12T17:30:00+00:00,2028-06-12T17:30:00+00:00
aa4c88f2f2f2f2f2f2f2f2f3,85,2,12,8,71,75,12,94.0,47,47,23,151,9.0,60,11,51,2.2,17,2027,30,105100.0,25,94.0,sous station,9.4,202.5,23.0,60.0,12/2,12/2/2027,17:30,2027-02-12T17:30:00,25.12,267125272015603,2027-02-12T17:30:00+00:00,2027-02-12T17:30:00+01:00,2027-02-12T17:30:00+00:00,2027-02-12T17:30:00+00:00
aa5ca4f2f2f2f2f2f2f2f2f3,85,2,28,10,39,75,12,94.0,47,47,23,151,9.0,60,11,51,2.2,9,2029,30,105100.0,25,94.0,sous station,9.4,202.5,23.0,60.0,28/2,28/2/2029,9:30,2029-02-28T09:30:00,25.12,267125272015603,2029-02-28T09:30:00+00:00,2029-02-28T09:30:00+01:00,2029-02-28T09:30:00+00:00,2029-02-28T09:30:00+00:00
aa64aaf2f2f2f2f2f2f2f2f3,85,3,4,10,87,75,12,94.0,47,47,23,151,9.0,60,11,51,2.2,21,2029,30,105100.0,25,94.0,sous station,9.4,202.5,23.0,60.0,4/3,4/3/2029,21:30,2029-03-04T21:30:00,25.12,267125272015603,2029-03-04T21:30:00+00:00,2029-03-04T21:30:00+01:00,2029-03-04T21:30:00+00:00,2029-03-04T21:30:00+00:00
aa64b8f2f2f2f2f2f2f2f2f3,85,3,4,11,71,75,12,94.0,47,47,23,151,9.0,60,11,51,2.2,17,2030,30,105100.0,25,94.0,sous station,9.4,202.5,23.0,60.0,4/3,4/3/2030,17:30,2030-03-04T17:30:00,25.12,267125272015603,2030-03-04T17:30:00+00:00,2030-03-04T17:30:00+01:00,2030-03-04T17:30:00+00:00,2030-03-04T17:30:00+00:00
aac49af2f2f2f2f2f2f2f2f3,85,6,4,9,87,75,12,94.0,47,47,23,151,9.0,60,11,51,2.2,21,2028,30,105100.0,25,94.0,sous station,9.4,202.5,23.0,60.0,4/6,4/6/2028,21:30,2028-06-04T21:30:00,25.12,267125272015603,2028-06-04T21:30:00+00:00,2028-06-04T21:30:00+02:00,2028-06-04T21:30:00+00:00,2028-06-04T21:30:00+00:00
aabca2f2f2f2f2f2f2f2f2f3,85,5,28,10,23,75,12,94.0,47,47,23,151,9.0,60,11,51,2.2,5,2029,30,105100.0,25,94.0,sous station,9.4,202.5,23.0,60.0,28/5,28/5/2029,5:30,2029-05-28T05:30:00,25.12,267125272015603,2029-05-28T05:30:00+00:00,2029-05-28T05:30:00+02:00,2029-05-28T05:30:00+00:00,2029-05-28T05:30:00+00:00
aaf8aaf2f2f2f2f2f2f2f2f3,85,7,24,10,87,75,12,94.0,47,47,23,151,9.0,60,11,51,2.2,21,2029,30,105100.0,25,94.0,sous station,9.4,202.5,23.0,60.0,24/7,24/7/2029,21:30,2029-07-24T21:30:00,25.12,267125272015603,2029-07-24T21:30:00+00:00,2029-07-24T21:30:00+02:00,2029-07-24T21:30:00+00:00,2029-07-24T21:30:00+00:00
aad48af2f2f2f2f2f2f2f2f3,85,6,20,8,87,75,12,94.0,47,47,23,151,9.0,60,11,51,2.2,21,2027,30,105100.0,25,94.0,sous station,9.4,202.5,23.0,60.0,20/6,20/6/2027,21:30,2027-06-20T21:30:00,25.12,267125272015603,2027-06-20T21:30:00+00:00,2027-06-20T21:30:00+02:00,2027-06-20T21:30:00+00:00,2027-06-20T21:30:00+00:00
aaf0a2f2f2f2f2f2f2f2f2f3,85,7,16,10,23,75,12,94.0,47,47,23,151,9.0,60,11,51,2.2,5,2029,30,105100.0,25,94.0,sous station,9.4,202.5,23.0,60.0,16/7,16/7/2029,5:30,2029-07-16T05:30:00,25.12,267125272015603,2029-07-16T05:30:00+00:00,2029-07-16T05:30:00+02:00,2029-07-16T05:30:00+00:00,2029-07-16T05:30:00+00:00
aa78a2f2f2f2f2f2f2f2f2f3,85,3,24,10,23,75,12,94.0,47,47,23,151,9.0,60,11,51,2.2,5,2029,30,105100.0,25,94.0,sous station,9.4,202.5,23.0,60.0,24/3,24/3/2029,5:30,2029-03-24T05:30:00,25.12,267125272015603,2029-03-24T05:30:00+00:00,2029-03-24T05:30:00+01:00,2029-03-24T05:30:00+00:00,2029-03-24T05:30:00+00:00
aa90baf2f2f2f2f2f2f2f2f3,85,4,16,11,87,75,12,94.0,47,47,23,151,9.0,60,11,51,2.2,21,2030,30,105100.0,25,94.0,sous station,9.4,202.5,23.0,60.0,16/4,16/4/2030,21:30,2030-04-16T21:30:00,25.12,267125272015603,2030-04-16T21:30:00+00:00,2030-04-16T21:30:00+02:00,2030-04-16T21:30:00+00:00,2030-04-16T21:30:00+00:00
aaf8b6f2f2f2f2f2f2f2f2f3,85,7,24,11,55,75,12,94.0,47,47,23,151,9.0,60,11,51,2.2,13,2030,30,105100.0,25,94.0,sous station,9.4,202.5,23.0,60.0,24/7,24/7/2030,13:30,2030-07-24T13:30:00,25.12,267125272015603,2030-07-24T13:30:00+00:00,2030-07-24T13:30:00+02:00,2030-07-24T13:30:00+00:00,2030-07-24T13:30:00+00:00
aafc84f2f2f2f2f2f2f2f2f3,85,7,28,8,39,75,12,94.0,47,47,23,151,9.0,60,11,51,2.2,9,2027,30,105100.0,25,94.0,sous station,9.4,202.5,23.0,60.0,28/7,28/7/2027,9:30,2027-07-28T09:30:00,25.12,267125272015603,2027-07-28T09:30:00+00:00,2027-07-28T09:30:00+02:00,2027-07-28T09:30:00+00:00,2027-07-28T09:30:00+00:00
ab78b8f2f2f2f2f2f2f2f2f3,85,11,24,11,71,75,12,94.0,47,47,23,151,9.0,60,11,51,2.2,17,2030,30,105100.0,25,94.0,sous station,9.4,202.5,23.0,60.0,24/11,24/11/2030,17:30,2030-11-24T17:30:00,25.12,267125272015603,2030-11-24T17:30:00+00:00,2030-11-24T17:30:00+01:00,2030-11-24T17:30:00+00:00,2030-11-24T17:30:00+00:00
aafcb8f2f2f2f2f2f2f2f2f3,85,7,28,11,71,75,12,94.0,47,47,23,151,9.0,60,11,51,2.2,17,2030,30,105100.0,25,94.0,sous station,9.4,202.5,23.0,60.0,28/7,28/7/2030,17:30,2030-07-28T17:30:00,25.12,267125272015603,2030-07-28T17:30:00+00:00,2030-07-28T17:30:00+02:00,2030-07-28T17:30:00+00:00,2030-07-28T17:30:00+00:00
a91c80f2f2f2f2f2f2f2f2f3,84,8,28,8,7,75,12,94.0,47,47,23,151,9.0,60,11,51,2.2,1,2027,30,105100.0,25,94.0,sous station,9.4,202.5,23.0,60.0,28/8,28/8/2027,1:30,2027-08-28T01:30:00,25.12,267125272015603,2027-08-28T01:30:00+00:00,2027-08-28T01:30:00+02:00,2027-08-28T01:30:00+00:00,2027-08-28T01:30:00+00:00
a91c82f2f2f2f2f2f2f2f2f3,84,8,28,8,23,75,12,94.0,47,47,23,151,9.0,60,11,51,2.2,5,2027,30,105100.0,25,94.0,sous station,9.4,202.5,23.0,60.0,28/8,28/8/2027,5:30,2027-08-28T05:30:00,25.12,267125272015603,2027-08-28T05:30:00+00:00,2027-08-28T05:30:00+02:00,2027-08-28T05:30:00+00:00,2027-08-28T05:30:00+00:00
a9088af2f2f2f2f2f2f2f2f3,84,8,8,8,87,75,12,94.0,47,47,23,151,9.0,60,11,51,2.2,21,2027,30,105100.0,25,94.0,sous station,9.4,202.5,23.0,60.0,8/8,8/8/2027,21:30,2027-08-08T21:30:00,25.12,267125272015603,2027-08-08T21:30:00+00:00,2027-08-08T21:30:00+02:00,2027-08-08T21:30:00+00:00,2027-08-08T21:30:00+00:00
a904b0f2f2f2f2f2f2f2f2f3,84,8,4,11,7,75,12,94.0,47,47,23,151,9.0,60,11,51,2.2,1,2030,30,105100.0,25,94.0,sous station,9.4,202.5,23.0,60.0,4/8,4/8/2030,1:30,2030-08-04T01:30:00,25.12,267125272015603,2030-08-04T01:30:00+00:00,2030-08-04T01:30:00+02:00,2030-08-04T01:30:00+00:00,2030-08-04T01:30:00+00:00
ab18aaf2f2f2f2f2f2f2f2f3,85,8,24,10,87,75,12,94.0,47,47,23,151,9.0,60,11,51,2.2,21,2029,30,105100.0,25,94.0,sous station,9.4,202.5,23.0,60.0,24/8,24/8/2029,21:30,2029-08-24T21:30:00,25.12,267125272015603,2029-08-24T21:30:00+00:00,2029-08-24T21:30:00+02:00,2029-08-24T21:30:00+00:00,2029-08-24T21:30:00+00:00
a9288af2f2f2f2f2f2f2f2f3,84,9,8,8,87,75,12,94.0,47,47,23,151,9.0,60,11,51,2.2,21,2027,30,105100.0,25,94.0,sous station,9.4,202.5,23.0,60.0,8/9,8/9/2027,21:30,2027-09-08T21:30:00,25.12,267125272015603,2027-09-08T21:30:00+00:00,2027-09-08T21:30:00+02:00,2027-09-08T21:30:00+00:00,2027-09-08T21:30:00+00:00
ab2482f2f2f2f2f2f2f2f2f3,85,9,4,8,23,75,12,94.0,47,47,23,151,9.0,60,11,51,2.2,5,2027,30,105100.0,25,94.0,sous station,9.4,202.5,23.0,60.0,4/9,4/9/2027,5:30,2027-09-04T05:30:00,25.12,267125272015603,2027-09-04T05:30:00+00:00,2027-09-04T05:30:00+02:00,2027-09-04T05:30:00+00:00,2027-09-04T05:30:00+00:00
ae5074f2f2f2f2f2f2f2f2f3,87,2,16,7,39,75,12,94.0,47,47,23,151,9.0,60,11,51,2.2,9,2026,30,105100.0,25,94.0,sous station,9.4,202.5,23.0,60.0,16/2,16/2/2026,9:30,2026-02-16T09:30:00,25.12,267125272015603,2026-02-16T09:30:00+00:00,2026-02-16T09:30:00+01:00,2026-02-16T09:30:00+00:00,2026-02-16T09:30:00+00:00
ab2490f2f2f2f2f2f2f2f2f3,85,9,4,9,7,75,12,94.0,47,47,23,151,9.0,60,11,51,2.2,1,2028,30,105100.0,25,94.0,sous station,9.4,202.5,23.0,60.0,4/9,4/9/2028,1:30,2028-09-04T01:30:00,25.12,267125272015603,2028-09-04T01:30:00+00:00,2028-09-04T01:30:00+02:00,2028-09-04T01:30:00+00:00,2028-09-04T01:30:00+00:00
ab249af2f2f2f2f2f2f2f2f3,85,9,4,9,87,75,12,94.0,47,47,23,151,9.0,60,11,51,2.2,21,2028,30,105100.0,25,94.0,sous station,9.4,202.5,23.0,60.0,4/9,4/9/2028,21:30,2028-09-04T21:30:00,25.12,267125272015603,2028-09-04T21:30:00+00:00,2028-09-04T21:30:00+02:00,2028-09-04T21:30:00+00:00,2028-09-04T21:30:00+00:00
a8dc86f2f2f2f2f2f2f2f2f3,84,6,28,8,55,75,12,94.0,47,47,23,151,9.0,60,11,51,2.2,13,2027,30,105100.0,25,94.0,sous station,9.4,202.5,23.0,60.0,28/6,28/6/2027,13:30,2027-06-28T13:30:00,25.12,267125272015603,2027-06-28T13:30:00+00:00,2027-06-28T13:30:00+02:00,2027-06-28T13:30:00+00:00,2027-06-28T13:30:00+00:00
a894a8f2f2f2f2f2f2f2f2f3,84,4,20,10,71,75,12,94.0,47,47,23,151,9.0,60,11,51,2.2,17,2029,30,105100.0,25,94.0,sous station,9.4,202.5,23.0,60.0,20/4,20/4/2029,17:30,2029-04-20T17:30:00,25.12,267125272015603,2029-04-20T17:30:00+00:00,2029-04-20T17:30:00+02:00,2029-04-20T17:30:00+00:00,2029-04-20T17:30:00+00:00
a95498f2f2f2f2f2f2f2f2f3,84,10,20,9,71,75,12,94.0,47,47,23,151,9.0,60,11,51,2.2,17,2028,30,105100.0,25,94.0,sous station,9.4,202.5,23.0,60.0,20/10,20/10/2028,17:30,2028-10-20T17:30:00,25.12,267125272015603,2028-10-20T17:30:00+00:00,2028-10-20T17:30:00+02:00,2028-10-20T17:30:00+00:00,2028-10-20T17:30:00+00:00
a94480f2f2f2f2f2f2f2f2f3,84,10,4,8,7,75,12,94.0,47,47,23,151,9.0,60,11,51,2.2,1,2027,30,105100.0,25,94.0,sous station,9.4,202.5,23.0,60.0,4/10,4/10/2027,1:30,2027-10-04T01:30:00,25.12,267125272015603,2027-10-04T01:30:00+00:00,2027-10-04T01:30:00+02:00,2027-10-04T01:30:00+00:00,2027-10-04T01:30:00+00:00
a9588af2f2f2f2f2f2f2f2f3,84,10,24,8,87,75,12,94.0,47,47,23,151,9.0,60,11,51,2.2,21,2027,30,105100.0,25,94.0,sous station,9.4,202.5,23.0,60.0,24/10,24/10/2027,21:30,2027-10-24T21:30:00,25.12,267125272015603,2027-10-24T21:30:00+00:00,2027-10-24T21:30:00+02:00,2027-10-24T21:30:00+00:00,2027-10-24T21:30:00+00:00
ac24a0f2f2f2f2f2f2f2f2f3,86,1,4,10,7,75,12,94.0,47,47,23,151,9.0,60,11,51,2.2,1,2029,30,105100.0,25,94.0,sous station,9.4,202.5,23.0,60.0,4/1,4/1/2029,1:30,2029-01-04T01:30:00,25.12,267125272015603,2029-01-04T01:30:00+00:00,2029-01-04T01:30:00+01:00,2029-01-04T01:30:00+00:00,2029-01-04T01:30:00+00:00
a958b4f2f2f2f2f2f2f2f2f3,84,10,24,11,39,75,12,94.0,47,47,23,151,9.0,60,11,51,2.2,9,2030,30,105100.0,25,94.0,sous station,9.4,202.5,23.0,60.0,24/10,24/10/2030,9:30,2030-10-24T09:30:00,25.12,267125272015603,2030-10-24T09:30:00+00:00,2030-10-24T09:30:00+02:00,2030-10-24T09:30:00+00:00,2030-10-24T09:30:00+00:00
ab9cb8f2f2f2f2f2f2f2f2f3,85,12,28,11,71,75,12,94.0,47,47,23,151,9.0,60,11,51,2.2,17,2030,30,105100.0,25,94.0,sous station,9.4,202.5,23.0,60.0,28/12,28/12/2030,17:30,2030-12-28T17:30:00,25.12,267125272015603,2030-12-28T17:30:00+00:00,2030-12-28T17:30:00+01:00,2030-12-28T17:30:00+00:00,2030-12-28T17:30:00+00:00
a990a0f2f2f2f2f2f2f2f2f3,84,12,16,10,7,75,12,94.0,47,47,23,151,9.0,60,11,51,2.2,1,2029,30,105100.0,25,94.0,sous station,9.4,202.5,23.0,60.0,16/12,16/12/2029,1:30,2029-12-16T01:30:00,25.12,267125272015603,2029-12-16T01:30:00+00:00,2029-12-16T01:30:00+01:00,2029-12-16T01:30:00+00:00,2029-12-16T01:30:00+00:00
ac24a2f2f2f2f2f2f2f2f2f3,86,1,4,10,23,75,12,94.0,47,47,23,151,9.0,60,11,51,2.2,5,2029,30,105100.0,25,94.0,sous station,9.4,202.5,23.0,60.0,4/1,4/1/2029,5:30,2029-01-04T05:30:00,25.12,267125272015603,2029-01-04T05:30:00+00:00,2029-01-04T05:30:00+01:00,2029-01-04T05:30:00+00:00,2029-01-04T05:30:00+00:00
ab58a8f2f2f2f2f2f2f2f2f3,85,10,24,10,71,75,12,94.0,47,47,23,151,9.0,60,11,51,2.2,17,2029,30,105100.0,25,94.0,sous station,9.4,202.5,23.0,60.0,24/10,24/10/2029,17:30,2029-10-24T17:30:00,25.12,267125272015603,2029-10-24T17:30:00+00:00,2029-10-24T17:30:00+02:00,2029-10-24T17:30:00+00:00,2029-10-24T17:30:00+00:00
ab5c98f2f2f2f2f2f2f2f2f3,85,10,28,9,71,75,12,94.0,47,47,23,151,9.0,60,11,51,2.2,17,2028,30,105100.0,25,94.0,sous station,9.4,202.5,23.0,60.0,28/10,28/10/2028,17:30,2028-10-28T17:30:00,25.12,267125272015603,2028-10-28T17:30:00+00:00,2028-10-28T17:30:00+02:00,2028-10-28T17:30:00+00:00,2028-10-28T17:30:00+00:00
ab049af2f2f2f2f2f2f2f2f3,85,8,4,9,87,75,12,94.0,47,47,23,151,9.0,60,11,51,2.2,21,2028,30,105100.0,25,94.0,sous station,9.4,202.5,23.0,60.0,4/8,4/8/2028,21:30,2028-08-04T21:30:00,25.12,267125272015603,2028-08-04T21:30:00+00:00,2028-08-04T21:30:00+02:00,2028-08-04T21:30:00+00:00,2028-08-04T21:30:00+00:00
a8d4b2f2f2f2f2f2f2f2f2f3,84,6,20,11,23,75,12,94.0,47,47,23,151,9.0,60,11,51,2.2,5,2030,30,105100.0,25,94.0,sous station,9.4,202.5,23.0,60.0,20/6,20/6/2030,5:30,2030-06-20T05:30:00,25.12,267125272015603,2030-06-20T05:30:00+00:00,2030-06-20T05:30:00+02:00,2030-06-20T05:30:00+00:00,2030-06-20T05:30:00+00:00
a8dc9af2f2f2f2f2f2f2f2f3,84,6,28,9,87,75,12,94.0,47,47,23,151,9.0,60,11,51,2.2,21,2028,30,105100.0,25,94.0,sous station,9.4,202.5,23.0,60.0,28/6,28/6/2028,21:30,2028-06-28T21:30:00,25.12,267125272015603,2028-06-28T21:30:00+00:00,2028-06-28T21:30:00+02:00,2028-06-28T21:30:00+00:00,2028-06-28T21:30:00+00:00
aa94b0f2f2f2f2f2f2f2f2f3,85,4,20,11,7,75,12,94.0,47,47,23,151,9.0,60,11,51,2.2,1,2030,30,105100.0,25,94.0,sous station,9.4,202.5,23.0,60.0,20/4,20/4/2030,1:30,2030-04-20T01:30:00,25.12,267125272015603,2030-04-20T01:30:00+00:00,2030-04-20T01:30:00+02:00,2030-04-20T01:30:00+00:00,2030-04-20T01:30:00+00:00
ab5cb4f2f2f2f2f2f2f2f2f3,85,10,28,11,39,75,12,94.0,47,47,23,151,9.0,60,11,51,2.2,9,2030,30,105100.0,25,94.0,sous station,9.4,202.5,23.0,60.0,28/10,28/10/2030,9:30,2030-10-28T09:30:00,25.12,267125272015603,2030-10-28T09:30:00+00:00,2030-10-28T09:30:00+01:00,2030-10-28T09:30:00+00:00,2030-10-28T09:30:00+00:00
a8fc90f2f2f2f2f2f2f2f2f3,84,7,28,9,7,75,12,94.0,47,47,23,151,9.0,60,11,51,2.2,1,2028,30,105100.0,25,94.0,sous station,9.4,202.5,23.0,60.0,28/7,28/7/2028,1:30,2028-07-28T01:30:00,25.12,267125272015603,2028-07-28T01:30:00+00:00,2028-07-28T01:30:00+02:00,2028-07-28T01:30:00+00:00,2028-07-28T01:30:00+00:00
a908a0f2f2f2f2f2f2f2f2f3,84,8,8,10,7,75,12,94.0,47,47,23,151,9.0,60,11,51,2.2,1,2029,30,105100.0,25,94.0,sous station,9.4,202.5,23.0,60.0,8/8,8/8/2029,1:30,2029-08-08T01:30:00,25.12,267125272015603,2029-08-08T01:30:00+00:00,2029-08-08T01:30:00+02:00,2029-08-08T01:30:00+00:00,2029-08-08T01:30:00+00:00
aac8a6f2f2f2f2f2f2f2f2f3,85,6,8,10,55,75,12,94.0,47,47,23,151,9.0,60,11,51,2.2,13,2029,30,105100.0,25,94.0,sous station,9.4,202.5,23.0,60.0,8/6,8/6/2029,13:30,2029-06-08T13:30:00,25.12,267125272015603,2029-06-08T13:30:00+00:00,2029-06-08T13:30:00+02:00,2029-06-08T13:30:00+00:00,2029-06-08T13:30:00+00:00
ab9ca2f2f2f2f2f2f2f2f2f3,85,12,28,10,23,75,12,94.0,47,47,23,151,9.0,60,11,51,2.2,5,2029,30,105100.0,25,94.0,sous station,9.4,202.5,23.0,60.0,28/12,28/12/2029,5:30,2029-12-28T05:30:00,25.12,267125272015603,2029-12-28T05:30:00+00:00,2029-12-28T05:30:00+01:00,2029-12-28T05:30:00+00:00,2029-12-28T05:30:00+00:00
a918a4f2f2f2f2f2f2f2f2f3,84,8,24,10,39,75,12,94.0,47,47,23,151,9.0,60,11,51,2.2,9,2029,30,105100.0,25,94.0,sous station,9.4,202.5,23.0,60.0,24/8,24/8/2029,9:30,2029-08-24T09:30:00,25.12,267125272015603,2029-08-24T09:30:00+00:00,2029-08-24T09:30:00+02:00,2029-08-24T09:30:00+00:00,2029-08-24T09:30:00+00:00
aa64b0f2f2f2f2f2f2f2f2f3,85,3,4,11,7,75,12,94.0,47,47,23,151,9.0,60,11,51,2.2,1,2030,30,105100.0,25,94.0,sous station,9.4,202.5,23.0,60.0,4/3,4/3/2030,1:30,2030-03-04T01:30:00,25.12,267125272015603,2030-03-04T01:30:00+00:00,2030-03-04T01:30:00+01:00,2030-03-04T01:30:00+00:00,2030-03-04T01:30:00+00:00
aa58a6f2f2f2f2f2f2f2f2f3,85,2,24,10,55,75,12,94.0,47,47,23,151,9.0,60,11,51,2.2,13,2029,30,105100.0,25,94.0,sous station,9.4,202.5,23.0,60.0,24/2,24/2/2029,13:30,2029-02-24T13:30:00,25.12,267125272015603,2029-02-24T13:30:00+00:00,2029-02-24T13:30:00+01:00,2029-02-24T13:30:00+00:00,2029-02-24T13:30:00+00:00
ab74b8f2f2f2f2f2f2f2f2f3,85,11,20,11,71,75,12,94.0,47,47,23,151,9.0,60,11,51,2.2,17,2030,30,105100.0,25,94.0,sous station,9.4,202.5,23.0,60.0,20/11,20/11/2030,17:30,2030-11-20T17:30:00,25.12,267125272015603,2030-11-20T17:30:00+00:00,2030-11-20T17:30:00+01:00,2030-11-20T17:30:00+00:00,2030-11-20T17:30:00+00:00
ab989af2f2f2f2f2f2f2f2f3,85,12,24,9,87,75,12,94.0,47,47,23,151,9.0,60,11,51,2.2,21,2028,30,105100.0,25,94.0,sous station,9.4,202.5,23.0,60.0,24/12,24/12/2028,21:30,2028-12-24T21:30:00,25.12,267125272015603,2028-12-24T21:30:00+00:00,2028-12-24T21:30:00+01:00,2028-12-24T21:30:00+00:00,2028-12-24T21:30:00+00:00
aa24a2f2f2f2f2f2f2f2f2f3,85,1,4,10,23,75,12,94.0,47,47,23,151,9.0,60,11,51,2.2,5,2029,30,105100.0,25,94.0,sous station,9.4,202.5,23.0,60.0,4/1,4/1/2029,5:30,2029-01-04T05:30:00,25.12,267125272015603,2029-01-04T05:30:00+00:00,2029-01-04T05:30:00+01:00,2029-01-04T05:30:00+00:00,2029-01-04T05:30:00+00:00
aa34b6f2f2f2f2f2f2f2f2f3,85,1,20,11,55,75,12,94.0,47,47,23,151,9.0,60,11,51,2.2,13,2030,30,105100.0,25,94.0,sous station,9.4,202.5,23.0,60.0,20/1,20/1/2030,13:30,2030-01-20T13:30:00,25.12,267125272015603,2030-01-20T13:30:00+00:00,2030-01-20T13:30:00+01:00,2030-01-20T13:30:00+00:00,2030-01-20T13:30:00+00:00
aa288af2f2f2f2f2f2f2f2f3,85,1,8,8,87,75,12,94.0,47,47,23,151,9.0,60,11,51,2.2,21,2027,30,105100.0,25,94.0,sous station,9.4,202.5,23.0,60.0,8/1,8/1/2027,21:30,2027-01-08T21:30:00,25.12,267125272015603,2027-01-08T21:30:00+00:00,2027-01-08T21:30:00+01:00,2027-01-08T21:30:00+00:00,2027-01-08T21:30:00+00:00
aa2cb6f2f2f2f2f2f2f2f2f3,85,1,12,11,55,75,12,94.0,47,47,23,151,9.0,60,11,51,2.2,13,2030,30,105100.0,25,94.0,sous station,9.4,202.5,23.0,60.0,12/1,12/1/2030,13:30,2030-01-12T13:30:00,25.12,267125272015603,2030-01-12T13:30:00+00:00,2030-01-12T13:30:00+01:00,2030-01-12T13:30:00+00:00,2030-01-12T13:30:00+00:00
aa2cbaf2f2f2f2f2f2f2f2f3,85,1,12,11,87,75,12,94.0,47,47,23,151,9.0,60,11,51,2.2,21,2030,30,105100.0,25,94.0,sous station,9.4,202.5,23.0,60.0,12/1,12/1/2030,21:30,2030-01-12T21:30:00,25.12,267125272015603,2030-01-12T21:30:00+00:00,2030-01-12T21:30:00+01:00,2030-01-12T21:30:00+00:00,2030-01-12T21:30:00+00:00
aae496f2f2f2f2f2f2f2f2f3,85,7,4,9,55,75,12,94.0,47,47,23,151,9.0,60,11,51,2.2,13,2028,30,105100.0,25,94.0,sous station,9.4,202.5,23.0,60.0,4/7,4/7/2028,13:30,2028-07-04T13:30:00,25.12,267125272015603,2028-07-04T13:30:00+00:00,2028-07-04T13:30:00+02:00,2028-07-04T13:30:00+00:00,2028-07-04T13:30:00+00:00
aa30b6f2f2f2f2f2f2f2f2f3,85,1,16,11,55,75,12,94.0,47,47,23,151,9.0,60,11,51,2.2,13,2030,30,105100.0,25,94.0,sous station,9.4,202.5,23.0,60.0,16/1,16/1/2030,13:30,2030-01-16T13:30:00,25.12,267125272015603,2030-01-16T13:30:00+00:00,2030-01-16T13:30:00+01:00,2030-01-16T13:30:00+00:00,2030-01-16T13:30:00+00:00
aa2494f2f2f2f2f2f2f2f2f3,85,1,4,9,39,75,12,94.0,47,47,23,151,9.0,60,11,51,2.2,9,2028,30,105100.0,25,94.0,sous station,9.4,202.5,23.0,60.0,4/1,4/1/2028,9:30,2028-01-04T09:30:00,25.12,267125272015603,2028-01-04T09:30:00+00:00,2028-01-04T09:30:00+01:00,2028-01-04T09:30:00+00:00,2028-01-04T09:30:00+00:00
aa44a2f2f2f2f2f2f2f2f2f3,85,2,4,10,23,75,12,94.0,47,47,23,151,9.0,60,11,51,2.2,5,2029,30,105100.0,25,94.0,sous station,9.4,202.5,23.0,60.0,4/2,4/2/2029,5:30,2029-02-04T05:30:00,25.12,267125272015603,2029-02-04T05:30:00+00:00,2029-02-04T05:30:00+01:00,2029-02-04T05:30:00+00:00,2029-02-04T05:30:00+00:00
aa4892f2f2f2f2f2f2f2f2f3,85,2,8,9,23,75,12,94.0,47,47,23,151,9.0,60,11,51,2.2,5,2028,30,105100.0,25,94.0,sous station,9.4,202.5,23.0,60.0,8/2,8/2/2028,5:30,2028-02-08T05:30:00,25.12,267125272015603,2028-02-08T05:30:00+00:00,2028-02-08T05:30:00+01:00,2028-02-08T05:30:00+00:00,2028-02-08T05:30:00+00:00
aa709af2f2f2f2f2f2f2f2f3,85,3,16,9,87,75,12,94.0,47,47,23,151,9.0,60,11,51,2.2,21,2028,30,105100.0,25,94.0,sous station,9.4,202.5,23.0,60.0,16/3,16/3/2028,21:30,2028-03-16T21:30:00,25.12,267125272015603,2028-03-16T21:30:00+00:00,2028-03-16T21:30:00+01:00,2028-03-16T21:30:00+00:00,2028-03-16T21:30:00+00:00
aa70a8f2f2f2f2f2f2f2f2f3,85,3,16,10,71,75,12,94.0,47,47,23,151,9.0,60,11,51,2.2,17,2029,30,105100.0,25,94.0,sous station,9.4,202.5,23.0,60.0,16/3,16/3/2029,17:30,2029-03-16T17:30:00,25.12,267125272015603,2029-03-16T17:30:00+00:00,2029-03-16T17:30:00+01:00,2029-03-16T17:30:00+00:00,2029-03-16T17:30:00+00:00
aa74b4f2f2f2f2f2f2f2f2f3,85,3,20,11,39,75,12,94.0,47,47,23,151,9.0,60,11,51,2.2,9,2030,30,105100.0,25,94.0,sous station,9.4,202.5,23.0,60.0,20/3,20/3/2030,9:30,2030-03-20T09:30:00,25.12,267125272015603,2030-03-20T09:30:00+00:00,2030-03-20T09:30:00+01:00,2030-03-20T09:30:00+00:00,2030-03-20T09:30:00+00:00
aa78b0f2f2f2f2f2f2f2f2f3,85,3,24,11,7,75,12,94.0,47,47,23,151,9.0,60,11,51,2.2,1,2030,30,105100.0,25,94.0,sous station,9.4,202.5,23.0,60.0,24/3,24/3/2030,1:30,2030-03-24T01:30:00,25.12,267125272015603,2030-03-24T01:30:00+00:00,2030-03-24T01:30:00+01:00,2030-03-24T01:30:00+00:00,2030-03-24T01:30:00+00:00
ab14a2f2f2f2f2f2f2f2f2f3,85,8,20,10,23,75,12,94.0,47,47,23,151,9.0,60,11,51,2.2,5,2029,30,105100.0,25,94.0,sous station,9.4,202.5,23.0,60.0,20/8,20/8/2029,5:30,2029-08-20T05:30:00,25.12,267125272015603,2029-08-20T05:30:00+00:00,2029-08-20T05:30:00+02:00,2029-08-20T05:30:00+00:00,2029-08-20T05:30:00+00:00
aa4c92f2f2f2f2f2f2f2f2f3,85,2,12,9,23,75,12,94.0,47,47,23,151,9.0,60,11,51,2.2,5,2028,30,105100.0,25,94.0,sous station,9.4,202.5,23.0,60.0,12/2,12/2/2028,5:30,2028-02-12T05:30:00,25.12,267125272015603,2028-02-12T05:30:00+00:00,2028-02-12T05:30:00+01:00,2028-02-12T05:30:00+00:00,2028-02-12T05:30:00+00:00
aa4ca2f2f2f2f2f2f2f2f2f3,85,2,12,10,23,75,12,94.0,47,47,23,151,9.0,60,11,51,2.2,5,2029,30,105100.0,25,94.0,sous station,9.4,202.5,23.0,60.0,12/2,12/2/2029,5:30,2029-02-12T05:30:00,25.12,267125272015603,2029-02-12T05:30:00+00:00,2029-02-12T05:30:00+01:00,2029-02-12T05:30:00+00:00,2029-02-12T05:30:00+00:00
aa68a2f2f2f2f2f2f2f2f2f3,85,3,8,10,23,75,12,94.0,47,47,23,151,9.0,60,11,51,2.2,5,2029,30,105100.0,25,94.0,sous station,9.4,202.5,23.0,60.0,8/3,8/3/2029,5:30,2029-03-08T05:30:00,25.12,267125272015603,2029-03-08T05:30:00+00:00,2029-03-08T05:30:00+01:00,2029-03-08T05:30:00+00:00,2029-03-08T05:30:00+00:00
aa5caaf2f2f2f2f2f2f2f2f3,85,2,28,10,87,75,12,94.0,47,47,23,151,9.0,60,11,51,2.2,21,2029,30,105100.0,25,94.0,sous station,9.4,202.5,23.0,60.0,28/2,28/2/2029,21:30,2029-02-28T21:30:00,25.12,267125272015603,2029-02-28T21:30:00+00:00,2029-02-28T21:30:00+01:00,2029-02-28T21:30:00+00:00,2029-02-28T21:30:00+00:00
aa64a4f2f2f2f2f2f2f2f2f3,85,3,4,10,39,75,12,94.0,47,47,23,151,9.0,60,11,51,2.2,9,2029,30,105100.0,25,94.0,sous station,9.4,202.5,23.0,60.0,4/3,4/3/2029,9:30,2029-03-04T09:30:00,25.12,267125272015603,2029-03-04T09:30:00+00:00,2029-03-04T09:30:00+01:00,2029-03-04T09:30:00+00:00,2029-03-04T09:30:00+00:00
aad096f2f2f2f2f2f2f2f2f3,85,6,16,9,55,75,12,94.0,47,47,23,151,9.0,60,11,51,2.2,13,2028,30,105100.0,25,94.0,sous station,9.4,202.5,23.0,60.0,16/6,16/6/2028,13:30,2028-06-16T13:30:00,25.12,267125272015603,2028-06-16T13:30:00+00:00,2028-06-16T13:30:00+02:00,2028-06-16T13:30:00+00:00,2028-06-16T13:30:00+00:00
aad0a4f2f2f2f2f2f2f2f2f3,85,6,16,10,39,75,12,94.0,47,47,23,151,9.0,60,11,51,2.2,9,2029,30,105100.0,25,94.0,sous station,9.4,202.5,23.0,60.0,16/6,16/6/2029,9:30,2029-06-16T09:30:00,25.12,267125272015603,2029-06-16T09:30:00+00:00,2029-06-16T09:30:00+02:00,2029-06-16T09:30:00+00:00,2029-06-16T09:30:00+00:00
a93094f2f2f2f2f2f2f2f2f3,84,9,16,9,39,75,12,94.0,47,47,23,151,9.0,60,11,51,2.2,9,2028,30,105100.0,25,94.0,sous station,9.4,202.5,23.0,60.0,16/9,16/9/2028,9:30,2028-09-16T09:30:00,25.12,267125272015603,2028-09-16T09:30:00+00:00,2028-09-16T09:30:00+02:00,2028-09-16T09:30:00+00:00,2028-09-16T09:30:00+00:00
a930a8f2f2f2f2f2f2f2f2f3,84,9,16,10,71,75,12,94.0,47,47,23,151,9.0,60,11,51,2.2,17,2029,30,105100.0,25,94.0,sous station,9.4,202.5,23.0,60.0,16/9,16/9/2029,17:30,2029-09-16T17:30:00,25.12,267125272015603,2029-09-16T17:30:00+00:00,2029-09-16T17:30:00+02:00,2029-09-16T17:30:00+00:00,2029-09-16T17:30:00+00:00
aad490f2f2f2f2f2f2f2f2f3,85,6,20,9,7,75,12,94.0,47,47,23,151,9.0,60,11,51,2.2,1,2028,30,105100.0,25,94.0,sous station,9.4,202.5,23.0,60.0,20/6,20/6/2028,1:30,2028-06-20T01:30:00,25.12,267125272015603,2028-06-20T01:30:00+00:00,2028-06-20T01:30:00+02:00,2028-06-20T01:30:00+00:00,2028-06-20T01:30:00+00:00
ae7072f2f2f2f2f2f2f2f2f3,87,3,16,7,23,75,12,94.0,47,47,23,151,9.0,60,11,51,2.2,5,2026,30,105100.0,25,94.0,sous station,9.4,202.5,23.0,60.0,16/3,16/3/2026,5:30,2026-03-16T05:30:00,25.12,267125272015603,2026-03-16T05:30:00+00:00,2026-03-16T05:30:00+01:00,2026-03-16T05:30:00+00:00,2026-03-16T05:30:00+00:00
ae7c70f2f2f2f2f2f2f2f2f3,87,3,28,7,7,75,12,94.0,47,47,23,151,9.0,60,11,51,2.2,1,2026,30,105100.0,25,94.0,sous station,9.4,202.5,23.0,60.0,28/3,28/3/2026,1:30,2026-03-28T01:30:00,25.12,267125272015603,2026-03-28T01:30:00+00:00,2026-03-28T01:30:00+01:00,2026-03-28T01:30:00+00:00,2026-03-28T01:30:00+00:00
a894b6f2f2f2f2f2f2f2f2f3,84,4,20,11,55,75,12,94.0,47,47,23,151,9.0,60,11,51,2.2,13,2030,30,105100.0,25,94.0,sous station,9.4,202.5,23.0,60.0,20/4,20/4/2030,13:30,2030-04-20T13:30:00,25.12,267125272015603,2030-04-20T13:30:00+00:00,2030-04-20T13:30:00+02:00,2030-04-20T13:30:00+00:00,2030-04-20T13:30:00+00:00
a8eca2f2f2f2f2f2f2f2f2f3,84,7,12,10,23,75,12,94.0,47,47,23,151,9.0,60,11,51,2.2,5,2029,30,105100.0,25,94.0,sous station,9.4,202.5,23.0,60.0,12/7,12/7/2029,5:30,2029-07-12T05:30:00,25.12,267125272015603,2029-07-12T05:30:00+00:00,2029-07-12T05:30:00+02:00,2029-07-12T05:30:00+00:00,2029-07-12T05:30:00+00:00
a91880f2f2f2f2f2f2f2f2f3,84,8,24,8,7,75,12,94.0,47,47,23,151,9.0,60,11,51,2.2,1,2027,30,105100.0,25,94.0,sous station,9.4,202.5,23.0,60.0,24/8,24/8/2027,1:30,2027-08-24T01:30:00,25.12,267125272015603,2027-08-24T01:30:00+00:00,2027-08-24T01:30:00+02:00,2027-08-24T01:30:00+00:00,2027-08-24T01:30:00+00:00
a8acb0f2f2f2f2f2f2f2f2f3,84,5,12,11,7,75,12,94.0,47,47,23,151,9.0,60,11,51,2.2,1,2030,30,105100.0,25,94.0,sous station,9.4,202.5,23.0,60.0,12/5,12/5/2030,1:30,2030-05-12T01:30:00,25.12,267125272015603,2030-05-12T01:30:00+00:00,2030-05-12T01:30:00+02:00,2030-05-12T01:30:00+00:00,2030-05-12T01:30:00+00:00
a95ca4f2f2f2f2f2f2f2f2f3,84,10,28,10,39,75,12,94.0,47,47,23,151,9.0,60,11,51,2.2,9,2029,30,105100.0,25,94.0,sous station,9.4,202.5,23.0,60.0,28/10,28/10/2029,9:30,2029-10-28T09:30:00,25.12,267125272015603,2029-10-28T09:30:00+00:00,2029-10-28T09:30:00+01:00,2029-10-28T09:30:00+00:00,2029-10-28T09:30:00+00:00
a8b0a2f2f2f2f2f2f2f2f2f3,84,5,16,10,23,75,12,94.0,47,47,23,151,9.0,60,11,51,2.2,5,2029,30,105100.0,25,94.0,sous station,9.4,202.5,23.0,60.0,16/5,16/5/2029,5:30,2029-05-16T05:30:00,25.12,267125272015603,2029-05-16T05:30:00+00:00,2029-05-16T05:30:00+02:00,2029-05-16T05:30:00+00:00,2029-05-16T05:30:00+00:00
a964a4f2f2f2f2f2f2f2f2f3,84,11,4,10,39,75,12,94.0,47,47,23,151,9.0,60,11,51,2.2,9,2029,30,105100.0,25,94.0,sous station,9.4,202.5,23.0,60.0,4/11,4/11/2029,9:30,2029-11-04T09:30:00,25.12,267125272015603,2029-11-04T09:30:00+00:00,2029-11-04T09:30:00+01:00,2029-11-04T09:30:00+00:00,2029-11-04T09:30:00+00:00
a964aaf2f2f2f2f2f2f2f2f3,84,11,4,10,87,75,12,94.0,47,47,23,151,9.0,60,11,51,2.2,21,2029,30,105100.0,25,94.0,sous station,9.4,202.5,23.0,60.0,4/11,4/11/2029,21:30,2029-11-04T21:30:00,25.12,267125272015603,2029-11-04T21:30:00+00:00,2029-11-04T21:30:00+01:00,2029-11-04T21:30:00+00:00,2029-11-04T21:30:00+00:00
a964b2f2f2f2f2f2f2f2f2f3,84,11,4,11,23,75,12,94.0,47,47,23,151,9.0,60,11,51,2.2,5,2030,30,105100.0,25,94.0,sous station,9.4,202.5,23.0,60.0,4/11,4/11/2030,5:30,2030-11-04T05:30:00,25.12,267125272015603,2030-11-04T05:30:00+00:00,2030-11-04T05:30:00+01:00,2030-11-04T05:30:00+00:00,2030-11-04T05:30:00+00:00
a96c9af2f2f2f2f2f2f2f2f3,84,11,12,9,87,75,12,94.0,47,47,23,151,9.0,60,11,51,2.2,21,2028,30,105100.0,25,94.0,sous station,9.4,202.5,23.0,60.0,12/11,12/11/2028,21:30,2028-11-12T21:30:00,25.12,267125272015603,2028-11-12T21:30:00+00:00,2028-11-12T21:30:00+01:00,2028-11-12T21:30:00+00:00,2028-11-12T21:30:00+00:00
a9888af2f2f2f2f2f2f2f2f3,84,12,8,8,87,75,12,94.0,47,47,23,151,9.0,60,11,51,2.2,21,2027,30,105100.0,25,94.0,sous station,9.4,202.5,23.0,60.0,8/12,8/12/2027,21:30,2027-12-08T21:30:00,25.12,267125272015603,2027-12-08T21:30:00+00:00,2027-12-08T21:30:00+01:00,2027-12-08T21:30:00+00:00,2027-12-08T21:30:00+00:00
a96498f2f2f2f2f2f2f2f2f3,84,11,4,9,71,75,12,94.0,47,47,23,151,9.0,60,11,51,2.2,17,2028,30,105100.0,25,94.0,sous station,9.4,202.5,23.0,60.0,4/11,4/11/2028,17:30,2028-11-04T17:30:00,25.12,267125272015603,2028-11-04T17:30:00+00:00,2028-11-04T17:30:00+01:00,2028-11-04T17:30:00+00:00,2028-11-04T17:30:00+00:00
a95c8af2f2f2f2f2f2f2f2f3,84,10,28,8,87,75,12,94.0,47,47,23,151,9.0,60,11,51,2.2,21,2027,30,105100.0,25,94.0,sous station,9.4,202.5,23.0,60.0,28/10,28/10/2027,21:30,2027-10-28T21:30:00,25.12,267125272015603,2027-10-28T21:30:00+00:00,2027-10-28T21:30:00+02:00,2027-10-28T21:30:00+00:00,2027-10-28T21:30:00+00:00
a988a4f2f2f2f2f2f2f2f2f3,84,12,8,10,39,75,12,94.0,47,47,23,151,9.0,60,11,51,2.2,9,2029,30,105100.0,25,94.0,sous station,9.4,202.5,23.0,60.0,8/12,8/12/2029,9:30,2029-12-08T09:30:00,25.12,267125272015603,2029-12-08T09:30:00+00:00,2029-12-08T09:30:00+01:00,2029-12-08T09:30:00+00:00,2029-12-08T09:30:00+00:00
a988b4f2f2f2f2f2f2f2f2f3,84,12,8,11,39,75,12,94.0,47,47,23,151,9.0,60,11,51,2.2,9,2030,30,105100.0,25,94.0,sous station,9.4,202.5,23.0,60.0,8/12,8/12/2030,9:30,2030-12-08T09:30:00,25.12,267125272015603,2030-12-08T09:30:00+00:00,2030-12-08T09:30:00+01:00,2030-12-08T09:30:00+00:00,2030-12-08T09:30:00+00:00
a9948af2f2f2f2f2f2f2f2f3,84,12,20,8,87,75,12,94.0,47,47,23,151,9.0,60,11,51,2.2,21,2027,30,105100.0,25,94.0,sous station,9.4,202.5,23.0,60.0,20/12,20/12/2027,21:30,2027-12-20T21:30:00,25.12,267125272015603,2027-12-20T21:30:00+00:00,2027-12-20T21:30:00+01:00,2027-12-20T21:30:00+00:00,2027-12-20T21:30:00+00:00
a98898f2f2f2f2f2f2f2f2f3,84,12,8,9,71,75,12,94.0,47,47,23,151,9.0,60,11,51,2.2,17,2028,30,105100.0,25,94.0,sous station,9.4,202.5,23.0,60.0,8/12,8/12/2028,17:30,2028-12-08T17:30:00,25.12,267125272015603,2028-12-08T17:30:00+00:00,2028-12-08T17:30:00+01:00,2028-12-08T17:30:00+00:00,2028-12-08T17:30:00+00:00
a990b6f2f2f2f2f2f2f2f2f3,84,12,16,11,55,75,12,94.0,47,47,23,151,9.0,60,11,51,2.2,13,2030,30,105100.0,25,94.0,sous station,9.4,202.5,23.0,60.0,16/12,16/12/2030,13:30,2030-12-16T13:30:00,25.12,267125272015603,2030-12-16T13:30:00+00:00,2030-12-16T13:30:00+01:00,2030-12-16T13:30:00+00:00,2030-12-16T13:30:00+00:00
a99496f2f2f2f2f2f2f2f2f3,84,12,20,9,55,75,12,94.0,47,47,23,151,9.0,60,11,51,2.2,13,2028,30,105100.0,25,94.0,sous station,9.4,202.5,23.0,60.0,20/12,20/12/2028,13:30,2028-12-20T13:30:00,25.12,267125272015603,2028-12-20T13:30:00+00:00,2028-12-20T13:30:00+01:00,2028-12-20T13:30:00+00:00,2028-12-20T13:30:00+00:00
a994a6f2f2f2f2f2f2f2f2f3,84,12,20,10,55,75,12,94.0,47,47,23,151,9.0,60,11,51,2.2,13,2029,30,105100.0,25,94.0,sous station,9.4,202.5,23.0,60.0,20/12,20/12/2029,13:30,2029-12-20T13:30:00,25.12,267125272015603,2029-12-20T13:30:00+00:00,2029-12-20T13:30:00+01:00,2029-12-20T13:30:00+00:00,2029-12-20T13:30:00+00:00
aae89af2f2f2f2f2f2f2f2f3,85,7,8,9,87,75,12,94.0,47,47,23,151,9.0,60,11,51,2.2,21,2028,30,105100.0,25,94.0,sous station,9.4,202.5,23.0,60.0,8/7,8/7/2028,21:30,2028-07-08T21:30:00,25.12,267125272015603,2028-07-08T21:30:00+00:00,2028-07-08T21:30:00+02:00,2028-07-08T21:30:00+00:00,2028-07-08T21:30:00+00:00
ab28a8f2f2f2f2f2f2f2f2f3,85,9,8,10,71,75,12,94.0,47,47,23,151,9.0,60,11,51,2.2,17,2029,30,105100.0,25,94.0,sous station,9.4,202.5,23.0,60.0,8/9,8/9/2029,17:30,2029-09-08T17:30:00,25.12,267125272015603,2029-09-08T17:30:00+00:00,2029-09-08T17:30:00+02:00,2029-09-08T17:30:00+00:00,2029-09-08T17:30:00+00:00
ab88b4f2f2f2f2f2f2f2f2f3,85,12,8,11,39,75,12,94.0,47,47,23,151,9.0,60,11,51,2.2,9,2030,30,105100.0,25,94.0,sous station,9.4,202.5,23.0,60.0,8/12,8/12/2030,9:30,2030-12-08T09:30:00,25.12,267125272015603,2030-12-08T09:30:00+00:00,2030-12-08T09:30:00+01:00,2030-12-08T09:30:00+00:00,2030-12-08T09:30:00+00:00
aac8b6f2f2f2f2f2f2f2f2f3,85,6,8,11,55,75,12,94.0,47,47,23,151,9.0,60,11,51,2.2,13,2030,30,105100.0,25,94.0,sous station,9.4,202.5,23.0,60.0,8/6,8/6/2030,13:30,2030-06-08T13:30:00,25.12,267125272015603,2030-06-08T13:30:00+00:00,2030-06-08T13:30:00+02:00,2030-06-08T13:30:00+00:00,2030-06-08T13:30:00+00:00
a888b4f2f2f2f2f2f2f2f2f3,84,4,8,11,39,75,12,94.0,47,47,23,151,9.0,60,11,51,2.2,9,2030,30,105100.0,25,94.0,sous station,9.4,202.5,23.0,60.0,8/4,8/4/2030,9:30,2030-04-08T09:30:00,25.12,267125272015603,2030-04-08T09:30:00+00:00,2030-04-08T09:30:00+02:00,2030-04-08T09:30:00+00:00,2030-04-08T09:30:00+00:00
a8949af2f2f2f2f2f2f2f2f3,84,4,20,9,87,75,12,94.0,47,47,23,151,9.0,60,11,51,2.2,21,2028,30,105100.0,25,94.0,sous station,9.4,202.5,23.0,60.0,20/4,20/4/2028,21:30,2028-04-20T21:30:00,25.12,267125272015603,2028-04-20T21:30:00+00:00,2028-04-20T21:30:00+02:00,2028-04-20T21:30:00+00:00,2028-04-20T21:30:00+00:00
ae7c72f2f2f2f2f2f2f2f2f3,87,3,28,7,23,75,12,94.0,47,47,23,151,9.0,60,11,51,2.2,5,2026,30,105100.0,25,94.0,sous station,9.4,202.5,23.0,60.0,28/3,28/3/2026,5:30,2026-03-28T05:30:00,25.12,267125272015603,2026-03-28T05:30:00+00:00,2026-03-28T05:30:00+01:00,2026-03-28T05:30:00+00:00,2026-03-28T05:30:00+00:00
a884a8f2f2f2f2f2f2f2f2f3,84,4,4,10,71,75,12,94.0,47,47,23,151,9.0,60,11,51,2.2,17,2029,30,105100.0,25,94.0,sous station,9.4,202.5,23.0,60.0,4/4,4/4/2029,17:30,2029-04-04T17:30:00,25.12,267125272015603,2029-04-04T17:30:00+00:00,2029-04-04T17:30:00+02:00,2029-04-04T17:30:00+00:00,2029-04-04T17:30:00+00:00
a8dcbaf2f2f2f2f2f2f2f2f3,84,6,28,11,87,75,12,94.0,47,47,23,151,9.0,60,11,51,2.2,21,2030,30,105100.0,25,94.0,sous station,9.4,202.5,23.0,60.0,28/6,28/6/2030,21:30,2030-06-28T21:30:00,25.12,267125272015603,2030-06-28T21:30:00+00:00,2030-06-28T21:30:00+02:00,2030-06-28T21:30:00+00:00,2030-06-28T21:30:00+00:00
a8c8b2f2f2f2f2f2f2f2f2f3,84,6,8,11,23,75,12,94.0,47,47,23,151,9.0,60,11,51,2.2,5,2030,30,105100.0,25,94.0,sous station,9.4,202.5,23.0,60.0,8/6,8/6/2030,5:30,2030-06-08T05:30:00,25.12,267125272015603,2030-06-08T05:30:00+00:00,2030-06-08T05:30:00+02:00,2030-06-08T05:30:00+00:00,2030-06-08T05:30:00+00:00
a8c8b4f2f2f2f2f2f2f2f2f3,84,6,8,11,39,75,12,94.0,47,47,23,151,9.0,60,11,51,2.2,9,2030,30,105100.0,25,94.0,sous station,9.4,202.5,23.0,60.0,8/6,8/6/2030,9:30,2030-06-08T09:30:00,25.12,267125272015603,2030-06-08T09:30:00+00:00,2030-06-08T09:30:00+02:00,2030-06-08T09:30:00+00:00,2030-06-08T09:30:00+00:00
a928a6f2f2f2f2f2f2f2f2f3,84,9,8,10,55,75,12,94.0,47,47,23,151,9.0,60,11,51,2.2,13,2029,30,105100.0,25,94.0,sous station,9.4,202.5,23.0,60.0,8/9,8/9/2029,13:30,2029-09-08T13:30:00,25.12,267125272015603,2029-09-08T13:30:00+00:00,2029-09-08T13:30:00+02:00,2029-09-08T13:30:00+00:00,2029-09-08T13:30:00+00:00
aa48b4f2f2f2f2f2f2f2f2f3,85,2,8,11,39,75,12,94.0,47,47,23,151,9.0,60,11,51,2.2,9,2030,30,105100.0,25,94.0,sous station,9.4,202.5,23.0,60.0,8/2,8/2/2030,9:30,2030-02-08T09:30:00,25.12,267125272015603,2030-02-08T09:30:00+00:00,2030-02-08T09:30:00+01:00,2030-02-08T09:30:00+00:00,2030-02-08T09:30:00+00:00
ac249af2f2f2f2f2f2f2f2f3,86,1,4,9,87,75,12,94.0,47,47,23,151,9.0,60,11,51,2.2,21,2028,30,105100.0,25,94.0,sous station,9.4,202.5,23.0,60.0,4/1,4/1/2028,21:30,2028-01-04T21:30:00,25.12,267125272015603,2028-01-04T21:30:00+00:00,2028-01-04T21:30:00+01:00,2028-01-04T21:30:00+00:00,2028-01-04T21:30:00+00:00
ac24b8f2f2f2f2f2f2f2f2f3,86,1,4,11,71,75,12,94.0,47,47,23,151,9.0,60,11,51,2.2,17,2030,30,105100.0,25,94.0,sous station,9.4,202.5,23.0,60.0,4/1,4/1/2030,17:30,2030-01-04T17:30:00,25.12,267125272015603,2030-01-04T17:30:00+00:00,2030-01-04T17:30:00+01:00,2030-01-04T17:30:00+00:00,2030-01-04T17:30:00+00:00
a8a4b6f2f2f2f2f2f2f2f2f3,84,5,4,11,55,75,12,94.0,47,47,23,151,9.0,60,11,51,2.2,13,2030,30,105100.0,25,94.0,sous station,9.4,202.5,23.0,60.0,4/5,4/5/2030,13:30,2030-05-04T13:30:00,25.12,267125272015603,2030-05-04T13:30:00+00:00,2030-05-04T13:30:00+02:00,2030-05-04T13:30:00+00:00,2030-05-04T13:30:00+00:00
a8bc88f2f2f2f2f2f2f2f2f3,84,5,28,8,71,75,12,94.0,47,47,23,151,9.0,60,11,51,2.2,17,2027,30,105100.0,25,94.0,sous station,9.4,202.5,23.0,60.0,28/5,28/5/2027,17:30,2027-05-28T17:30:00,25.12,267125272015603,2027-05-28T17:30:00+00:00,2027-05-28T17:30:00+02:00,2027-05-28T17:30:00+00:00,2027-05-28T17:30:00+00:00
a8b4a6f2f2f2f2f2f2f2f2f3,84,5,20,10,55,75,12,94.0,47,47,23,151,9.0,60,11,51,2.2,13,2029,30,105100.0,25,94.0,sous station,9.4,202.5,23.0,60.0,20/5,20/5/2029,13:30,2029-05-20T13:30:00,25.12,267125272015603,2029-05-20T13:30:00+00:00,2029-05-20T13:30:00+02:00,2029-05-20T13:30:00+00:00,2029-05-20T13:30:00+00:00
a8b888f2f2f2f2f2f2f2f2f3,84,5,24,8,71,75,12,94.0,47,47,23,151,9.0,60,11,51,2.2,17,2027,30,105100.0,25,94.0,sous station,9.4,202.5,23.0,60.0,24/5,24/5/2027,17:30,2027-05-24T17:30:00,25.12,267125272015603,2027-05-24T17:30:00+00:00,2027-05-24T17:30:00+02:00,2027-05-24T17:30:00+00:00,2027-05-24T17:30:00+00:00
a8c890f2f2f2f2f2f2f2f2f3,84,6,8,9,7,75,12,94.0,47,47,23,151,9.0,60,11,51,2.2,1,2028,30,105100.0,25,94.0,sous station,9.4,202.5,23.0,60.0,8/6,8/6/2028,1:30,2028-06-08T01:30:00,25.12,267125272015603,2028-06-08T01:30:00+00:00,2028-06-08T01:30:00+02:00,2028-06-08T01:30:00+00:00,2028-06-08T01:30:00+00:00
ae6470f2f2f2f2f2f2f2f2f3,87,3,4,7,7,75,12,94.0,47,47,23,151,9.0,60,11,51,2.2,1,2026,30,105100.0,25,94.0,sous station,9.4,202.5,23.0,60.0,4/3,4/3/2026,1:30,2026-03-04T01:30:00,25.12,267125272015603,2026-03-04T01:30:00+00:00,2026-03-04T01:30:00+01:00,2026-03-04T01:30:00+00:00,2026-03-04T01:30:00+00:00
a8ac98f2f2f2f2f2f2f2f2f3,84,5,12,9,71,75,12,94.0,47,47,23,151,9.0,60,11,51,2.2,17,2028,30,105100.0,25,94.0,sous station,9.4,202.5,23.0,60.0,12/5,12/5/2028,17:30,2028-05-12T17:30:00,25.12,267125272015603,2028-05-12T17:30:00+00:00,2028-05-12T17:30:00+02:00,2028-05-12T17:30:00+00:00,2028-05-12T17:30:00+00:00
aafc94f2f2f2f2f2f2f2f2f3,85,7,28,9,39,75,12,94.0,47,47,23,151,9.0,60,11,51,2.2,9,2028,30,105100.0,25,94.0,sous station,9.4,202.5,23.0,60.0,28/7,28/7/2028,9:30,2028-07-28T09:30:00,25.12,267125272015603,2028-07-28T09:30:00+00:00,2028-07-28T09:30:00+02:00,2028-07-28T09:30:00+00:00,2028-07-28T09:30:00+00:00
a8d8aaf2f2f2f2f2f2f2f2f3,84,6,24,10,87,75,12,94.0,47,47,23,151,9.0,60,11,51,2.2,21,2029,30,105100.0,25,94.0,sous station,9.4,202.5,23.0,60.0,24/6,24/6/2029,21:30,2029-06-24T21:30:00,25.12,267125272015603,2029-06-24T21:30:00+00:00,2029-06-24T21:30:00+02:00,2029-06-24T21:30:00+00:00,2029-06-24T21:30:00+00:00
a8dc96f2f2f2f2f2f2f2f2f3,84,6,28,9,55,75,12,94.0,47,47,23,151,9.0,60,11,51,2.2,13,2028,30,105100.0,25,94.0,sous station,9.4,202.5,23.0,60.0,28/6,28/6/2028,13:30,2028-06-28T13:30:00,25.12,267125272015603,2028-06-28T13:30:00+00:00,2028-06-28T13:30:00+02:00,2028-06-28T13:30:00+00:00,2028-06-28T13:30:00+00:00
a8f080f2f2f2f2f2f2f2f2f3,84,7,16,8,7,75,12,94.0,47,47,23,151,9.0,60,11,51,2.2,1,2027,30,105100.0,25,94.0,sous station,9.4,202.5,23.0,60.0,16/7,16/7/2027,1:30,2027-07-16T01:30:00,25.12,267125272015603,2027-07-16T01:30:00+00:00,2027-07-16T01:30:00+02:00,2027-07-16T01:30:00+00:00,2027-07-16T01:30:00+00:00
a8f492f2f2f2f2f2f2f2f2f3,84,7,20,9,23,75,12,94.0,47,47,23,151,9.0,60,11,51,2.2,5,2028,30,105100.0,25,94.0,sous station,9.4,202.5,23.0,60.0,20/7,20/7/2028,5:30,2028-07-20T05:30:00,25.12,267125272015603,2028-07-20T05:30:00+00:00,2028-07-20T05:30:00+02:00,2028-07-20T05:30:00+00:00,2028-07-20T05:30:00+00:00
a8e8b8f2f2f2f2f2f2f2f2f3,84,7,8,11,71,75,12,94.0,47,47,23,151,9.0,60,11,51,2.2,17,2030,30,105100.0,25,94.0,sous station,9.4,202.5,23.0,60.0,8/7,8/7/2030,17:30,2030-07-08T17:30:00,25.12,267125272015603,2030-07-08T17:30:00+00:00,2030-07-08T17:30:00+02:00,2030-07-08T17:30:00+00:00,2030-07-08T17:30:00+00:00
aae898f2f2f2f2f2f2f2f2f3,85,7,8,9,71,75,12,94.0,47,47,23,151,9.0,60,11,51,2.2,17,2028,30,105100.0,25,94.0,sous station,9.4,202.5,23.0,60.0,8/7,8/7/2028,17:30,2028-07-08T17:30:00,25.12,267125272015603,2028-07-08T17:30:00+00:00,2028-07-08T17:30:00+02:00,2028-07-08T17:30:00+00:00,2028-07-08T17:30:00+00:00
ae5878f2f2f2f2f2f2f2f2f3,87,2,24,7,71,75,12,94.0,47,47,23,151,9.0,60,11,51,2.2,17,2026,30,105100.0,25,94.0,sous station,9.4,202.5,23.0,60.0,24/2,24/2/2026,17:30,2026-02-24T17:30:00,25.12,267125272015603,2026-02-24T17:30:00+00:00,2026-02-24T17:30:00+01:00,2026-02-24T17:30:00+00:00,2026-02-24T17:30:00+00:00
ab5894f2f2f2f2f2f2f2f2f3,85,10,24,9,39,75,12,94.0,47,47,23,151,9.0,60,11,51,2.2,9,2028,30,105100.0,25,94.0,sous station,9.4,202.5,23.0,60.0,24/10,24/10/2028,9:30,2028-10-24T09:30:00,25.12,267125272015603,2028-10-24T09:30:00+00:00,2028-10-24T09:30:00+02:00,2028-10-24T09:30:00+00:00,2028-10-24T09:30:00+00:00
a8fc84f2f2f2f2f2f2f2f2f3,84,7,28,8,39,75,12,94.0,47,47,23,151,9.0,60,11,51,2.2,9,2027,30,105100.0,25,94.0,sous station,9.4,202.5,23.0,60.0,28/7,28/7/2027,9:30,2027-07-28T09:30:00,25.12,267125272015603,2027-07-28T09:30:00+00:00,2027-07-28T09:30:00+02:00,2027-07-28T09:30:00+00:00,2027-07-28T09:30:00+00:00
a8fcb8f2f2f2f2f2f2f2f2f3,84,7,28,11,71,75,12,94.0,47,47,23,151,9.0,60,11,51,2.2,17,2030,30,105100.0,25,94.0,sous station,9.4,202.5,23.0,60.0,28/7,28/7/2030,17:30,2030-07-28T17:30:00,25.12,267125272015603,2030-07-28T17:30:00+00:00,2030-07-28T17:30:00+02:00,2030-07-28T17:30:00+00:00,2030-07-28T17:30:00+00:00
a8fc9af2f2f2f2f2f2f2f2f3,84,7,28,9,87,75,12,94.0,47,47,23,151,9.0,60,11,51,2.2,21,2028,30,105100.0,25,94.0,sous station,9.4,202.5,23.0,60.0,28/7,28/7/2028,21:30,2028-07-28T21:30:00,25.12,267125272015603,2028-07-28T21:30:00+00:00,2028-07-28T21:30:00+02:00,2028-07-28T21:30:00+00:00,2028-07-28T21:30:00+00:00
a918aaf2f2f2f2f2f2f2f2f3,84,8,24,10,87,75,12,94.0,47,47,23,151,9.0,60,11,51,2.2,21,2029,30,105100.0,25,94.0,sous station,9.4,202.5,23.0,60.0,24/8,24/8/2029,21:30,2029-08-24T21:30:00,25.12,267125272015603,2029-08-24T21:30:00+00:00,2029-08-24T21:30:00+02:00,2029-08-24T21:30:00+00:00,2029-08-24T21:30:00+00:00
a91c98f2f2f2f2f2f2f2f2f3,84,8,28,9,71,75,12,94.0,47,47,23,151,9.0,60,11,51,2.2,17,2028,30,105100.0,25,94.0,sous station,9.4,202.5,23.0,60.0,28/8,28/8/2028,17:30,2028-08-28T17:30:00,25.12,267125272015603,2028-08-28T17:30:00+00:00,2028-08-28T17:30:00+02:00,2028-08-28T17:30:00+00:00,2028-08-28T17:30:00+00:00
ab6882f2f2f2f2f2f2f2f2f3,85,11,8,8,23,75,12,94.0,47,47,23,151,9.0,60,11,51,2.2,5,2027,30,105100.0,25,94.0,sous station,9.4,202.5,23.0,60.0,8/11,8/11/2027,5:30,2027-11-08T05:30:00,25.12,267125272015603,2027-11-08T05:30:00+00:00,2027-11-08T05:30:00+01:00,2027-11-08T05:30:00+00:00,2027-11-08T05:30:00+00:00
ab78aaf2f2f2f2f2f2f2f2f3,85,11,24,10,87,75,12,94.0,47,47,23,151,9.0,60,11,51,2.2,21,2029,30,105100.0,25,94.0,sous station,9.4,202.5,23.0,60.0,24/11,24/11/2029,21:30,2029-11-24T21:30:00,25.12,267125272015603,2029-11-24T21:30:00+00:00,2029-11-24T21:30:00+01:00,2029-11-24T21:30:00+00:00,2029-11-24T21:30:00+00:00
ab9ca4f2f2f2f2f2f2f2f2f3,85,12,28,10,39,75,12,94.0,47,47,23,151,9.0,60,11,51,2.2,9,2029,30,105100.0,25,94.0,sous station,9.4,202.5,23.0,60.0,28/12,28/12/2029,9:30,2029-12-28T09:30:00,25.12,267125272015603,2029-12-28T09:30:00+00:00,2029-12-28T09:30:00+01:00,2029-12-28T09:30:00+00:00,2029-12-28T09:30:00+00:00
ab0ca8f2f2f2f2f2f2f2f2f3,85,8,12,10,71,75,12,94.0,47,47,23,151,9.0,60,11,51,2.2,17,2029,30,105100.0,25,94.0,sous station,9.4,202.5,23.0,60.0,12/8,12/8/2029,17:30,2029-08-12T17:30:00,25.12,267125272015603,2029-08-12T17:30:00+00:00,2029-08-12T17:30:00+02:00,2029-08-12T17:30:00+00:00,2029-08-12T17:30:00+00:00
a90ca8f2f2f2f2f2f2f2f2f3,84,8,12,10,71,75,12,94.0,47,47,23,151,9.0,60,11,51,2.2,17,2029,30,105100.0,25,94.0,sous station,9.4,202.5,23.0,60.0,12/8,12/8/2029,17:30,2029-08-12T17:30:00,25.12,267125272015603,2029-08-12T17:30:00+00:00,2029-08-12T17:30:00+02:00,2029-08-12T17:30:00+00:00,2029-08-12T17:30:00+00:00
ab10a2f2f2f2f2f2f2f2f2f3,85,8,16,10,23,75,12,94.0,47,47,23,151,9.0,60,11,51,2.2,5,2029,30,105100.0,25,94.0,sous station,9.4,202.5,23.0,60.0,16/8,16/8/2029,5:30,2029-08-16T05:30:00,25.12,267125272015603,2029-08-16T05:30:00+00:00,2029-08-16T05:30:00+02:00,2029-08-16T05:30:00+00:00,2029-08-16T05:30:00+00:00
a92882f2f2f2f2f2f2f2f2f3,84,9,8,8,23,75,12,94.0,47,47,23,151,9.0,60,11,51,2.2,5,2027,30,105100.0,25,94.0,sous station,9.4,202.5,23.0,60.0,8/9,8/9/2027,5:30,2027-09-08T05:30:00,25.12,267125272015603,2027-09-08T05:30:00+00:00,2027-09-08T05:30:00+02:00,2027-09-08T05:30:00+00:00,2027-09-08T05:30:00+00:00
a928aaf2f2f2f2f2f2f2f2f3,84,9,8,10,87,75,12,94.0,47,47,23,151,9.0,60,11,51,2.2,21,2029,30,105100.0,25,94.0,sous station,9.4,202.5,23.0,60.0,8/9,8/9/2029,21:30,2029-09-08T21:30:00,25.12,267125272015603,2029-09-08T21:30:00+00:00,2029-09-08T21:30:00+02:00,2029-09-08T21:30:00+00:00,2029-09-08T21:30:00+00:00
a8f096f2f2f2f2f2f2f2f2f3,84,7,16,9,55,75,12,94.0,47,47,23,151,9.0,60,11,51,2.2,13,2028,30,105100.0,25,94.0,sous station,9.4,202.5,23.0,60.0,16/7,16/7/2028,13:30,2028-07-16T13:30:00,25.12,267125272015603,2028-07-16T13:30:00+00:00,2028-07-16T13:30:00+02:00,2028-07-16T13:30:00+00:00,2028-07-16T13:30:00+00:00
ab28b0f2f2f2f2f2f2f2f2f3,85,9,8,11,7,75,12,94.0,47,47,23,151,9.0,60,11,51,2.2,1,2030,30,105100.0,25,94.0,sous station,9.4,202.5,23.0,60.0,8/9,8/9/2030,1:30,2030-09-08T01:30:00,25.12,267125272015603,2030-09-08T01:30:00+00:00,2030-09-08T01:30:00+02:00,2030-09-08T01:30:00+00:00,2030-09-08T01:30:00+00:00
ab28b4f2f2f2f2f2f2f2f2f3,85,9,8,11,39,75,12,94.0,47,47,23,151,9.0,60,11,51,2.2,9,2030,30,105100.0,25,94.0,sous station,9.4,202.5,23.0,60.0,8/9,8/9/2030,9:30,2030-09-08T09:30:00,25.12,267125272015603,2030-09-08T09:30:00+00:00,2030-09-08T09:30:00+02:00,2030-09-08T09:30:00+00:00,2030-09-08T09:30:00+00:00
a92cb0f2f2f2f2f2f2f2f2f3,84,9,12,11,7,75,12,94.0,47,47,23,151,9.0,60,11,51,2.2,1,2030,30,105100.0,25,94.0,sous station,9.4,202.5,23.0,60.0,12/9,12/9/2030,1:30,2030-09-12T01:30:00,25.12,267125272015603,2030-09-12T01:30:00+00:00,2030-09-12T01:30:00+02:00,2030-09-12T01:30:00+00:00,2030-09-12T01:30:00+00:00
a938aaf2f2f2f2f2f2f2f2f3,84,9,24,10,87,75,12,94.0,47,47,23,151,9.0,60,11,51,2.2,21,2029,30,105100.0,25,94.0,sous station,9.4,202.5,23.0,60.0,24/9,24/9/2029,21:30,2029-09-24T21:30:00,25.12,267125272015603,2029-09-24T21:30:00+00:00,2029-09-24T21:30:00+02:00,2029-09-24T21:30:00+00:00,2029-09-24T21:30:00+00:00
ab7896f2f2f2f2f2f2f2f2f3,85,11,24,9,55,75,12,94.0,47,47,23,151,9.0,60,11,51,2.2,13,2028,30,105100.0,25,94.0,sous station,9.4,202.5,23.0,60.0,24/11,24/11/2028,13:30,2028-11-24T13:30:00,25.12,267125272015603,2028-11-24T13:30:00+00:00,2028-11-24T13:30:00+01:00,2028-11-24T13:30:00+00:00,2028-11-24T13:30:00+00:00
ab749af2f2f2f2f2f2f2f2f3,85,11,20,9,87,75,12,94.0,47,47,23,151,9.0,60,11,51,2.2,21,2028,30,105100.0,25,94.0,sous station,9.4,202.5,23.0,60.0,20/11,20/11/2028,21:30,2028-11-20T21:30:00,25.12,267125272015603,2028-11-20T21:30:00+00:00,2028-11-20T21:30:00+01:00,2028-11-20T21:30:00+00:00,2028-11-20T21:30:00+00:00
a90c94f2f2f2f2f2f2f2f2f3,84,8,12,9,39,75,12,94.0,47,47,23,151,9.0,60,11,51,2.2,9,2028,30,105100.0,25,94.0,sous station,9.4,202.5,23.0,60.0,12/8,12/8/2028,9:30,2028-08-12T09:30:00,25.12,267125272015603,2028-08-12T09:30:00+00:00,2028-08-12T09:30:00+02:00,2028-08-12T09:30:00+00:00,2028-08-12T09:30:00+00:00
a99092f2f2f2f2f2f2f2f2f3,84,12,16,9,23,75,12,94.0,47,47,23,151,9.0,60,11,51,2.2,5,2028,30,105100.0,25,94.0,sous station,9.4,202.5,23.0,60.0,16/12,16/12/2028,5:30,2028-12-16T05:30:00,25.12,267125272015603,2028-12-16T05:30:00+00:00,2028-12-16T05:30:00+01:00,2028-12-16T05:30:00+00:00,2028-12-16T05:30:00+00:00
a99880f2f2f2f2f2f2f2f2f3,84,12,24,8,7,75,12,94.0,47,47,23,151,9.0,60,11,51,2.2,1,2027,30,105100.0,25,94.0,sous station,9.4,202.5,23.0,60.0,24/12,24/12/2027,1:30,2027-12-24T01:30:00,25.12,267125272015603,2027-12-24T01:30:00+00:00,2027-12-24T01:30:00+01:00,2027-12-24T01:30:00+00:00,2027-12-24T01:30:00+00:00
a91ca8f2f2f2f2f2f2f2f2f3,84,8,28,10,71,75,12,94.0,47,47,23,151,9.0,60,11,51,2.2,17,2029,30,105100.0,25,94.0,sous station,9.4,202.5,23.0,60.0,28/8,28/8/2029,17:30,2029-08-28T17:30:00,25.12,267125272015603,2029-08-28T17:30:00+00:00,2029-08-28T17:30:00+02:00,2029-08-28T17:30:00+00:00,2029-08-28T17:30:00+00:00
a968a0f2f2f2f2f2f2f2f2f3,84,11,8,10,7,75,12,94.0,47,47,23,151,9.0,60,11,51,2.2,1,2029,30,105100.0,25,94.0,sous station,9.4,202.5,23.0,60.0,8/11,8/11/2029,1:30,2029-11-08T01:30:00,25.12,267125272015603,2029-11-08T01:30:00+00:00,2029-11-08T01:30:00+01:00,2029-11-08T01:30:00+00:00,2029-11-08T01:30:00+00:00
a94496f2f2f2f2f2f2f2f2f3,84,10,4,9,55,75,12,94.0,47,47,23,151,9.0,60,11,51,2.2,13,2028,30,105100.0,25,94.0,sous station,9.4,202.5,23.0,60.0,4/10,4/10/2028,13:30,2028-10-04T13:30:00,25.12,267125272015603,2028-10-04T13:30:00+00:00,2028-10-04T13:30:00+02:00,2028-10-04T13:30:00+00:00,2028-10-04T13:30:00+00:00
a93490f2f2f2f2f2f2f2f2f3,84,9,20,9,7,75,12,94.0,47,47,23,151,9.0,60,11,51,2.2,1,2028,30,105100.0,25,94.0,sous station,9.4,202.5,23.0,60.0,20/9,20/9/2028,1:30,2028-09-20T01:30:00,25.12,267125272015603,2028-09-20T01:30:00+00:00,2028-09-20T01:30:00+02:00,2028-09-20T01:30:00+00:00,2028-09-20T01:30:00+00:00
a95494f2f2f2f2f2f2f2f2f3,84,10,20,9,39,75,12,94.0,47,47,23,151,9.0,60,11,51,2.2,9,2028,30,105100.0,25,94.0,sous station,9.4,202.5,23.0,60.0,20/10,20/10/2028,9:30,2028-10-20T09:30:00,25.12,267125272015603,2028-10-20T09:30:00+00:00,2028-10-20T09:30:00+02:00,2028-10-20T09:30:00+00:00,2028-10-20T09:30:00+00:00
a948a0f2f2f2f2f2f2f2f2f3,84,10,8,10,7,75,12,94.0,47,47,23,151,9.0,60,11,51,2.2,1,2029,30,105100.0,25,94.0,sous station,9.4,202.5,23.0,60.0,8/10,8/10/2029,1:30,2029-10-08T01:30:00,25.12,267125272015603,2029-10-08T01:30:00+00:00,2029-10-08T01:30:00+02:00,2029-10-08T01:30:00+00:00,2029-10-08T01:30:00+00:00
ae2470f2f2f2f2f2f2f2f2f3,87,1,4,7,7,75,12,94.0,47,47,23,151,9.0,60,11,51,2.2,1,2026,30,105100.0,25,94.0,sous station,9.4,202.5,23.0,60.0,4/1,4/1/2026,1:30,2026-01-04T01:30:00,25.12,267125272015603,2026-01-04T01:30:00+00:00,2026-01-04T01:30:00+01:00,2026-01-04T01:30:00+00:00,2026-01-04T01:30:00+00:00
a89496f2f2f2f2f2f2f2f2f3,84,4,20,9,55,75,12,94.0,47,47,23,151,9.0,60,11,51,2.2,13,2028,30,105100.0,25,94.0,sous station,9.4,202.5,23.0,60.0,20/4,20/4/2028,13:30,2028-04-20T13:30:00,25.12,267125272015603,2028-04-20T13:30:00+00:00,2028-04-20T13:30:00+02:00,2028-04-20T13:30:00+00:00,2028-04-20T13:30:00+00:00
ae7c74f2f2f2f2f2f2f2f2f3,87,3,28,7,39,75,12,94.0,47,47,23,151,9.0,60,11,51,2.2,9,2026,30,105100.0,25,94.0,sous station,9.4,202.5,23.0,60.0,28/3,28/3/2026,9:30,2026-03-28T09:30:00,25.12,267125272015603,2026-03-28T09:30:00+00:00,2026-03-28T09:30:00+01:00,2026-03-28T09:30:00+00:00,2026-03-28T09:30:00+00:00
a8ac84f2f2f2f2f2f2f2f2f3,84,5,12,8,39,75,12,94.0,47,47,23,151,9.0,60,11,51,2.2,9,2027,30,105100.0,25,94.0,sous station,9.4,202.5,23.0,60.0,12/5,12/5/2027,9:30,2027-05-12T09:30:00,25.12,267125272015603,2027-05-12T09:30:00+00:00,2027-05-12T09:30:00+02:00,2027-05-12T09:30:00+00:00,2027-05-12T09:30:00+00:00
a8b0b2f2f2f2f2f2f2f2f2f3,84,5,16,11,23,75,12,94.0,47,47,23,151,9.0,60,11,51,2.2,5,2030,30,105100.0,25,94.0,sous station,9.4,202.5,23.0,60.0,16/5,16/5/2030,5:30,2030-05-16T05:30:00,25.12,267125272015603,2030-05-16T05:30:00+00:00,2030-05-16T05:30:00+02:00,2030-05-16T05:30:00+00:00,2030-05-16T05:30:00+00:00
a8aca0f2f2f2f2f2f2f2f2f3,84,5,12,10,7,75,12,94.0,47,47,23,151,9.0,60,11,51,2.2,1,2029,30,105100.0,25,94.0,sous station,9.4,202.5,23.0,60.0,12/5,12/5/2029,1:30,2029-05-12T01:30:00,25.12,267125272015603,2029-05-12T01:30:00+00:00,2029-05-12T01:30:00+02:00,2029-05-12T01:30:00+00:00,2029-05-12T01:30:00+00:00
a8bca4f2f2f2f2f2f2f2f2f3,84,5,28,10,39,75,12,94.0,47,47,23,151,9.0,60,11,51,2.2,9,2029,30,105100.0,25,94.0,sous station,9.4,202.5,23.0,60.0,28/5,28/5/2029,9:30,2029-05-28T09:30:00,25.12,267125272015603,2029-05-28T09:30:00+00:00,2029-05-28T09:30:00+02:00,2029-05-28T09:30:00+00:00,2029-05-28T09:30:00+00:00
a8b0baf2f2f2f2f2f2f2f2f3,84,5,16,11,87,75,12,94.0,47,47,23,151,9.0,60,11,51,2.2,21,2030,30,105100.0,25,94.0,sous station,9.4,202.5,23.0,60.0,16/5,16/5/2030,21:30,2030-05-16T21:30:00,25.12,267125272015603,2030-05-16T21:30:00+00:00,2030-05-16T21:30:00+02:00,2030-05-16T21:30:00+00:00,2030-05-16T21:30:00+00:00
a8d4a6f2f2f2f2f2f2f2f2f3,84,6,20,10,55,75,12,94.0,47,47,23,151,9.0,60,11,51,2.2,13,2029,30,105100.0,25,94.0,sous station,9.4,202.5,23.0,60.0,20/6,20/6/2029,13:30,2029-06-20T13:30:00,25.12,267125272015603,2029-06-20T13:30:00+00:00,2029-06-20T13:30:00+02:00,2029-06-20T13:30:00+00:00,2029-06-20T13:30:00+00:00
a8c480f2f2f2f2f2f2f2f2f3,84,6,4,8,7,75,12,94.0,47,47,23,151,9.0,60,11,51,2.2,1,2027,30,105100.0,25,94.0,sous station,9.4,202.5,23.0,60.0,4/6,4/6/2027,1:30,2027-06-04T01:30:00,25.12,267125272015603,2027-06-04T01:30:00+00:00,2027-06-04T01:30:00+02:00,2027-06-04T01:30:00+00:00,2027-06-04T01:30:00+00:00
a8c4b8f2f2f2f2f2f2f2f2f3,84,6,4,11,71,75,12,94.0,47,47,23,151,9.0,60,11,51,2.2,17,2030,30,105100.0,25,94.0,sous station,9.4,202.5,23.0,60.0,4/6,4/6/2030,17:30,2030-06-04T17:30:00,25.12,267125272015603,2030-06-04T17:30:00+00:00,2030-06-04T17:30:00+02:00,2030-06-04T17:30:00+00:00,2030-06-04T17:30:00+00:00
a8c482f2f2f2f2f2f2f2f2f3,84,6,4,8,23,75,12,94.0,47,47,23,151,9.0,60,11,51,2.2,5,2027,30,105100.0,25,94.0,sous station,9.4,202.5,23.0,60.0,4/6,4/6/2027,5:30,2027-06-04T05:30:00,25.12,267125272015603,2027-06-04T05:30:00+00:00,2027-06-04T05:30:00+02:00,2027-06-04T05:30:00+00:00,2027-06-04T05:30:00+00:00
a8e8b4f2f2f2f2f2f2f2f2f3,84,7,8,11,39,75,12,94.0,47,47,23,151,9.0,60,11,51,2.2,9,2030,30,105100.0,25,94.0,sous station,9.4,202.5,23.0,60.0,8/7,8/7/2030,9:30,2030-07-08T09:30:00,25.12,267125272015603,2030-07-08T09:30:00+00:00,2030-07-08T09:30:00+02:00,2030-07-08T09:30:00+00:00,2030-07-08T09:30:00+00:00
ae5876f2f2f2f2f2f2f2f2f3,87,2,24,7,55,75,12,94.0,47,47,23,151,9.0,60,11,51,2.2,13,2026,30,105100.0,25,94.0,sous station,9.4,202.5,23.0,60.0,24/2,24/2/2026,13:30,2026-02-24T13:30:00,25.12,267125272015603,2026-02-24T13:30:00+00:00,2026-02-24T13:30:00+01:00,2026-02-24T13:30:00+00:00,2026-02-24T13:30:00+00:00
ae7070f2f2f2f2f2f2f2f2f3,87,3,16,7,7,75,12,94.0,47,47,23,151,9.0,60,11,51,2.2,1,2026,30,105100.0,25,94.0,sous station,9.4,202.5,23.0,60.0,16/3,16/3/2026,1:30,2026-03-16T01:30:00,25.12,267125272015603,2026-03-16T01:30:00+00:00,2026-03-16T01:30:00+01:00,2026-03-16T01:30:00+00:00,2026-03-16T01:30:00+00:00
aa7092f2f2f2f2f2f2f2f2f3,85,3,16,9,23,75,12,94.0,47,47,23,151,9.0,60,11,51,2.2,5,2028,30,105100.0,25,94.0,sous station,9.4,202.5,23.0,60.0,16/3,16/3/2028,5:30,2028-03-16T05:30:00,25.12,267125272015603,2028-03-16T05:30:00+00:00,2028-03-16T05:30:00+01:00,2028-03-16T05:30:00+00:00,2028-03-16T05:30:00+00:00
aabca8f2f2f2f2f2f2f2f2f3,85,5,28,10,71,75,12,94.0,47,47,23,151,9.0,60,11,51,2.2,17,2029,30,105100.0,25,94.0,sous station,9.4,202.5,23.0,60.0,28/5,28/5/2029,17:30,2029-05-28T17:30:00,25.12,267125272015603,2029-05-28T17:30:00+00:00,2029-05-28T17:30:00+02:00,2029-05-28T17:30:00+00:00,2029-05-28T17:30:00+00:00
aaaca4f2f2f2f2f2f2f2f2f3,85,5,12,10,39,75,12,94.0,47,47,23,151,9.0,60,11,51,2.2,9,2029,30,105100.0,25,94.0,sous station,9.4,202.5,23.0,60.0,12/5,12/5/2029,9:30,2029-05-12T09:30:00,25.12,267125272015603,2029-05-12T09:30:00+00:00,2029-05-12T09:30:00+02:00,2029-05-12T09:30:00+00:00,2029-05-12T09:30:00+00:00
aaa4b2f2f2f2f2f2f2f2f2f3,85,5,4,11,23,75,12,94.0,47,47,23,151,9.0,60,11,51,2.2,5,2030,30,105100.0,25,94.0,sous station,9.4,202.5,23.0,60.0,4/5,4/5/2030,5:30,2030-05-04T05:30:00,25.12,267125272015603,2030-05-04T05:30:00+00:00,2030-05-04T05:30:00+02:00,2030-05-04T05:30:00+00:00,2030-05-04T05:30:00+00:00
aab4a8f2f2f2f2f2f2f2f2f3,85,5,20,10,71,75,12,94.0,47,47,23,151,9.0,60,11,51,2.2,17,2029,30,105100.0,25,94.0,sous station,9.4,202.5,23.0,60.0,20/5,20/5/2029,17:30,2029-05-20T17:30:00,25.12,267125272015603,2029-05-20T17:30:00+00:00,2029-05-20T17:30:00+02:00,2029-05-20T17:30:00+00:00,2029-05-20T17:30:00+00:00
aab4a4f2f2f2f2f2f2f2f2f3,85,5,20,10,39,75,12,94.0,47,47,23,151,9.0,60,11,51,2.2,9,2029,30,105100.0,25,94.0,sous station,9.4,202.5,23.0,60.0,20/5,20/5/2029,9:30,2029-05-20T09:30:00,25.12,267125272015603,2029-05-20T09:30:00+00:00,2029-05-20T09:30:00+02:00,2029-05-20T09:30:00+00:00,2029-05-20T09:30:00+00:00
aac486f2f2f2f2f2f2f2f2f3,85,6,4,8,55,75,12,94.0,47,47,23,151,9.0,60,11,51,2.2,13,2027,30,105100.0,25,94.0,sous station,9.4,202.5,23.0,60.0,4/6,4/6/2027,13:30,2027-06-04T13:30:00,25.12,267125272015603,2027-06-04T13:30:00+00:00,2027-06-04T13:30:00+02:00,2027-06-04T13:30:00+00:00,2027-06-04T13:30:00+00:00
aac498f2f2f2f2f2f2f2f2f3,85,6,4,9,71,75,12,94.0,47,47,23,151,9.0,60,11,51,2.2,17,2028,30,105100.0,25,94.0,sous station,9.4,202.5,23.0,60.0,4/6,4/6/2028,17:30,2028-06-04T17:30:00,25.12,267125272015603,2028-06-04T17:30:00+00:00,2028-06-04T17:30:00+02:00,2028-06-04T17:30:00+00:00,2028-06-04T17:30:00+00:00
aabc94f2f2f2f2f2f2f2f2f3,85,5,28,9,39,75,12,94.0,47,47,23,151,9.0,60,11,51,2.2,9,2028,30,105100.0,25,94.0,sous station,9.4,202.5,23.0,60.0,28/5,28/5/2028,9:30,2028-05-28T09:30:00,25.12,267125272015603,2028-05-28T09:30:00+00:00,2028-05-28T09:30:00+02:00,2028-05-28T09:30:00+00:00,2028-05-28T09:30:00+00:00
ae3470f2f2f2f2f2f2f2f2f3,87,1,20,7,7,75,12,94.0,47,47,23,151,9.0,60,11,51,2.2,1,2026,30,105100.0,25,94.0,sous station,9.4,202.5,23.0,60.0,20/1,20/1/2026,1:30,2026-01-20T01:30:00,25.12,267125272015603,2026-01-20T01:30:00+00:00,2026-01-20T01:30:00+01:00,2026-01-20T01:30:00+00:00,2026-01-20T01:30:00+00:00
a890aaf2f2f2f2f2f2f2f2f3,84,4,16,10,87,75,12,94.0,47,47,23,151,9.0,60,11,51,2.2,21,2029,30,105100.0,25,94.0,sous station,9.4,202.5,23.0,60.0,16/4,16/4/2029,21:30,2029-04-16T21:30:00,25.12,267125272015603,2029-04-16T21:30:00+00:00,2029-04-16T21:30:00+02:00,2029-04-16T21:30:00+00:00,2029-04-16T21:30:00+00:00
a91492f2f2f2f2f2f2f2f2f3,84,8,20,9,23,75,12,94.0,47,47,23,151,9.0,60,11,51,2.2,5,2028,30,105100.0,25,94.0,sous station,9.4,202.5,23.0,60.0,20/8,20/8/2028,5:30,2028-08-20T05:30:00,25.12,267125272015603,2028-08-20T05:30:00+00:00,2028-08-20T05:30:00+02:00,2028-08-20T05:30:00+00:00,2028-08-20T05:30:00+00:00
a90888f2f2f2f2f2f2f2f2f3,84,8,8,8,71,75,12,94.0,47,47,23,151,9.0,60,11,51,2.2,17,2027,30,105100.0,25,94.0,sous station,9.4,202.5,23.0,60.0,8/8,8/8/2027,17:30,2027-08-08T17:30:00,25.12,267125272015603,2027-08-08T17:30:00+00:00,2027-08-08T17:30:00+02:00,2027-08-08T17:30:00+00:00,2027-08-08T17:30:00+00:00
a884b8f2f2f2f2f2f2f2f2f3,84,4,4,11,71,75,12,94.0,47,47,23,151,9.0,60,11,51,2.2,17,2030,30,105100.0,25,94.0,sous station,9.4,202.5,23.0,60.0,4/4,4/4/2030,17:30,2030-04-04T17:30:00,25.12,267125272015603,2030-04-04T17:30:00+00:00,2030-04-04T17:30:00+02:00,2030-04-04T17:30:00+00:00,2030-04-04T17:30:00+00:00
a8d8a4f2f2f2f2f2f2f2f2f3,84,6,24,10,39,75,12,94.0,47,47,23,151,9.0,60,11,51,2.2,9,2029,30,105100.0,25,94.0,sous station,9.4,202.5,23.0,60.0,24/6,24/6/2029,9:30,2029-06-24T09:30:00,25.12,267125272015603,2029-06-24T09:30:00+00:00,2029-06-24T09:30:00+02:00,2029-06-24T09:30:00+00:00,2029-06-24T09:30:00+00:00
a8dc82f2f2f2f2f2f2f2f2f3,84,6,28,8,23,75,12,94.0,47,47,23,151,9.0,60,11,51,2.2,5,2027,30,105100.0,25,94.0,sous station,9.4,202.5,23.0,60.0,28/6,28/6/2027,5:30,2027-06-28T05:30:00,25.12,267125272015603,2027-06-28T05:30:00+00:00,2027-06-28T05:30:00+02:00,2027-06-28T05:30:00+00:00,2027-06-28T05:30:00+00:00
a93082f2f2f2f2f2f2f2f2f3,84,9,16,8,23,75,12,94.0,47,47,23,151,9.0,60,11,51,2.2,5,2027,30,105100.0,25,94.0,sous station,9.4,202.5,23.0,60.0,16/9,16/9/2027,5:30,2027-09-16T05:30:00,25.12,267125272015603,2027-09-16T05:30:00+00:00,2027-09-16T05:30:00+02:00,2027-09-16T05:30:00+00:00,2027-09-16T05:30:00+00:00
a8ec80f2f2f2f2f2f2f2f2f3,84,7,12,8,7,75,12,94.0,47,47,23,151,9.0,60,11,51,2.2,1,2027,30,105100.0,25,94.0,sous station,9.4,202.5,23.0,60.0,12/7,12/7/2027,1:30,2027-07-12T01:30:00,25.12,267125272015603,2027-07-12T01:30:00+00:00,2027-07-12T01:30:00+02:00,2027-07-12T01:30:00+00:00,2027-07-12T01:30:00+00:00
a88cbaf2f2f2f2f2f2f2f2f3,84,4,12,11,87,75,12,94.0,47,47,23,151,9.0,60,11,51,2.2,21,2030,30,105100.0,25,94.0,sous station,9.4,202.5,23.0,60.0,12/4,12/4/2030,21:30,2030-04-12T21:30:00,25.12,267125272015603,2030-04-12T21:30:00+00:00,2030-04-12T21:30:00+02:00,2030-04-12T21:30:00+00:00,2030-04-12T21:30:00+00:00
a8fca2f2f2f2f2f2f2f2f2f3,84,7,28,10,23,75,12,94.0,47,47,23,151,9.0,60,11,51,2.2,5,2029,30,105100.0,25,94.0,sous station,9.4,202.5,23.0,60.0,28/7,28/7/2029,5:30,2029-07-28T05:30:00,25.12,267125272015603,2029-07-28T05:30:00+00:00,2029-07-28T05:30:00+02:00,2029-07-28T05:30:00+00:00,2029-07-28T05:30:00+00:00
a90ca0f2f2f2f2f2f2f2f2f3,84,8,12,10,7,75,12,94.0,47,47,23,151,9.0,60,11,51,2.2,1,2029,30,105100.0,25,94.0,sous station,9.4,202.5,23.0,60.0,12/8,12/8/2029,1:30,2029-08-12T01:30:00,25.12,267125272015603,2029-08-12T01:30:00+00:00,2029-08-12T01:30:00+02:00,2029-08-12T01:30:00+00:00,2029-08-12T01:30:00+00:00
a88c84f2f2f2f2f2f2f2f2f3,84,4,12,8,39,75,12,94.0,47,47,23,151,9.0,60,11,51,2.2,9,2027,30,105100.0,25,94.0,sous station,9.4,202.5,23.0,60.0,12/4,12/4/2027,9:30,2027-04-12T09:30:00,25.12,267125272015603,2027-04-12T09:30:00+00:00,2027-04-12T09:30:00+02:00,2027-04-12T09:30:00+00:00,2027-04-12T09:30:00+00:00
a90882f2f2f2f2f2f2f2f2f3,84,8,8,8,23,75,12,94.0,47,47,23,151,9.0,60,11,51,2.2,5,2027,30,105100.0,25,94.0,sous station,9.4,202.5,23.0,60.0,8/8,8/8/2027,5:30,2027-08-08T05:30:00,25.12,267125272015603,2027-08-08T05:30:00+00:00,2027-08-08T05:30:00+02:00,2027-08-08T05:30:00+00:00,2027-08-08T05:30:00+00:00
a90884f2f2f2f2f2f2f2f2f3,84,8,8,8,39,75,12,94.0,47,47,23,151,9.0,60,11,51,2.2,9,2027,30,105100.0,25,94.0,sous station,9.4,202.5,23.0,60.0,8/8,8/8/2027,9:30,2027-08-08T09:30:00,25.12,267125272015603,2027-08-08T09:30:00+00:00,2027-08-08T09:30:00+02:00,2027-08-08T09:30:00+00:00,2027-08-08T09:30:00+00:00
aa308af2f2f2f2f2f2f2f2f3,85,1,16,8,87,75,12,94.0,47,47,23,151,9.0,60,11,51,2.2,21,2027,30,105100.0,25,94.0,sous station,9.4,202.5,23.0,60.0,16/1,16/1/2027,21:30,2027-01-16T21:30:00,25.12,267125272015603,2027-01-16T21:30:00+00:00,2027-01-16T21:30:00+01:00,2027-01-16T21:30:00+00:00,2027-01-16T21:30:00+00:00
a928b8f2f2f2f2f2f2f2f2f3,84,9,8,11,71,75,12,94.0,47,47,23,151,9.0,60,11,51,2.2,17,2030,30,105100.0,25,94.0,sous station,9.4,202.5,23.0,60.0,8/9,8/9/2030,17:30,2030-09-08T17:30:00,25.12,267125272015603,2030-09-08T17:30:00+00:00,2030-09-08T17:30:00+02:00,2030-09-08T17:30:00+00:00,2030-09-08T17:30:00+00:00
aa84b0f2f2f2f2f2f2f2f2f3,85,4,4,11,7,75,12,94.0,47,47,23,151,9.0,60,11,51,2.2,1,2030,30,105100.0,25,94.0,sous station,9.4,202.5,23.0,60.0,4/4,4/4/2030,1:30,2030-04-04T01:30:00,25.12,267125272015603,2030-04-04T01:30:00+00:00,2030-04-04T01:30:00+02:00,2030-04-04T01:30:00+00:00,2030-04-04T01:30:00+00:00
aa909af2f2f2f2f2f2f2f2f3,85,4,16,9,87,75,12,94.0,47,47,23,151,9.0,60,11,51,2.2,21,2028,30,105100.0,25,94.0,sous station,9.4,202.5,23.0,60.0,16/4,16/4/2028,21:30,2028-04-16T21:30:00,25.12,267125272015603,2028-04-16T21:30:00+00:00,2028-04-16T21:30:00+02:00,2028-04-16T21:30:00+00:00,2028-04-16T21:30:00+00:00
aa58b8f2f2f2f2f2f2f2f2f3,85,2,24,11,71,75,12,94.0,47,47,23,151,9.0,60,11,51,2.2,17,2030,30,105100.0,25,94.0,sous station,9.4,202.5,23.0,60.0,24/2,24/2/2030,17:30,2030-02-24T17:30:00,25.12,267125272015603,2030-02-24T17:30:00+00:00,2030-02-24T17:30:00+01:00,2030-02-24T17:30:00+00:00,2030-02-24T17:30:00+00:00
aa58a4f2f2f2f2f2f2f2f2f3,85,2,24,10,39,75,12,94.0,47,47,23,151,9.0,60,11,51,2.2,9,2029,30,105100.0,25,94.0,sous station,9.4,202.5,23.0,60.0,24/2,24/2/2029,9:30,2029-02-24T09:30:00,25.12,267125272015603,2029-02-24T09:30:00+00:00,2029-02-24T09:30:00+01:00,2029-02-24T09:30:00+00:00,2029-02-24T09:30:00+00:00
aa94b6f2f2f2f2f2f2f2f2f3,85,4,20,11,55,75,12,94.0,47,47,23,151,9.0,60,11,51,2.2,13,2030,30,105100.0,25,94.0,sous station,9.4,202.5,23.0,60.0,20/4,20/4/2030,13:30,2030-04-20T13:30:00,25.12,267125272015603,2030-04-20T13:30:00+00:00,2030-04-20T13:30:00+02:00,2030-04-20T13:30:00+00:00,2030-04-20T13:30:00+00:00
aa5892f2f2f2f2f2f2f2f2f3,85,2,24,9,23,75,12,94.0,47,47,23,151,9.0,60,11,51,2.2,5,2028,30,105100.0,25,94.0,sous station,9.4,202.5,23.0,60.0,24/2,24/2/2028,5:30,2028-02-24T05:30:00,25.12,267125272015603,2028-02-24T05:30:00+00:00,2028-02-24T05:30:00+01:00,2028-02-24T05:30:00+00:00,2028-02-24T05:30:00+00:00
aab496f2f2f2f2f2f2f2f2f3,85,5,20,9,55,75,12,94.0,47,47,23,151,9.0,60,11,51,2.2,13,2028,30,105100.0,25,94.0,sous station,9.4,202.5,23.0,60.0,20/5,20/5/2028,13:30,2028-05-20T13:30:00,25.12,267125272015603,2028-05-20T13:30:00+00:00,2028-05-20T13:30:00+02:00,2028-05-20T13:30:00+00:00,2028-05-20T13:30:00+00:00
aab498f2f2f2f2f2f2f2f2f3,85,5,20,9,71,75,12,94.0,47,47,23,151,9.0,60,11,51,2.2,17,2028,30,105100.0,25,94.0,sous station,9.4,202.5,23.0,60.0,20/5,20/5/2028,17:30,2028-05-20T17:30:00,25.12,267125272015603,2028-05-20T17:30:00+00:00,2028-05-20T17:30:00+02:00,2028-05-20T17:30:00+00:00,2028-05-20T17:30:00+00:00
aac8aaf2f2f2f2f2f2f2f2f3,85,6,8,10,87,75,12,94.0,47,47,23,151,9.0,60,11,51,2.2,21,2029,30,105100.0,25,94.0,sous station,9.4,202.5,23.0,60.0,8/6,8/6/2029,21:30,2029-06-08T21:30:00,25.12,267125272015603,2029-06-08T21:30:00+00:00,2029-06-08T21:30:00+02:00,2029-06-08T21:30:00+00:00,2029-06-08T21:30:00+00:00
aac4a0f2f2f2f2f2f2f2f2f3,85,6,4,10,7,75,12,94.0,47,47,23,151,9.0,60,11,51,2.2,1,2029,30,105100.0,25,94.0,sous station,9.4,202.5,23.0,60.0,4/6,4/6/2029,1:30,2029-06-04T01:30:00,25.12,267125272015603,2029-06-04T01:30:00+00:00,2029-06-04T01:30:00+02:00,2029-06-04T01:30:00+00:00,2029-06-04T01:30:00+00:00
aac4baf2f2f2f2f2f2f2f2f3,85,6,4,11,87,75,12,94.0,47,47,23,151,9.0,60,11,51,2.2,21,2030,30,105100.0,25,94.0,sous station,9.4,202.5,23.0,60.0,4/6,4/6/2030,21:30,2030-06-04T21:30:00,25.12,267125272015603,2030-06-04T21:30:00+00:00,2030-06-04T21:30:00+02:00,2030-06-04T21:30:00+00:00,2030-06-04T21:30:00+00:00
aabcb6f2f2f2f2f2f2f2f2f3,85,5,28,11,55,75,12,94.0,47,47,23,151,9.0,60,11,51,2.2,13,2030,30,105100.0,25,94.0,sous station,9.4,202.5,23.0,60.0,28/5,28/5/2030,13:30,2030-05-28T13:30:00,25.12,267125272015603,2030-05-28T13:30:00+00:00,2030-05-28T13:30:00+02:00,2030-05-28T13:30:00+00:00,2030-05-28T13:30:00+00:00
aaccb2f2f2f2f2f2f2f2f2f3,85,6,12,11,23,75,12,94.0,47,47,23,151,9.0,60,11,51,2.2,5,2030,30,105100.0,25,94.0,sous station,9.4,202.5,23.0,60.0,12/6,12/6/2030,5:30,2030-06-12T05:30:00,25.12,267125272015603,2030-06-12T05:30:00+00:00,2030-06-12T05:30:00+02:00,2030-06-12T05:30:00+00:00,2030-06-12T05:30:00+00:00
aad488f2f2f2f2f2f2f2f2f3,85,6,20,8,71,75,12,94.0,47,47,23,151,9.0,60,11,51,2.2,17,2027,30,105100.0,25,94.0,sous station,9.4,202.5,23.0,60.0,20/6,20/6/2027,17:30,2027-06-20T17:30:00,25.12,267125272015603,2027-06-20T17:30:00+00:00,2027-06-20T17:30:00+02:00,2027-06-20T17:30:00+00:00,2027-06-20T17:30:00+00:00
aaccb4f2f2f2f2f2f2f2f2f3,85,6,12,11,39,75,12,94.0,47,47,23,151,9.0,60,11,51,2.2,9,2030,30,105100.0,25,94.0,sous station,9.4,202.5,23.0,60.0,12/6,12/6/2030,9:30,2030-06-12T09:30:00,25.12,267125272015603,2030-06-12T09:30:00+00:00,2030-06-12T09:30:00+02:00,2030-06-12T09:30:00+00:00,2030-06-12T09:30:00+00:00
a89894f2f2f2f2f2f2f2f2f3,84,4,24,9,39,75,12,94.0,47,47,23,151,9.0,60,11,51,2.2,9,2028,30,105100.0,25,94.0,sous station,9.4,202.5,23.0,60.0,24/4,24/4/2028,9:30,2028-04-24T09:30:00,25.12,267125272015603,2028-04-24T09:30:00+00:00,2028-04-24T09:30:00+02:00,2028-04-24T09:30:00+00:00,2028-04-24T09:30:00+00:00
aad486f2f2f2f2f2f2f2f2f3,85,6,20,8,55,75,12,94.0,47,47,23,151,9.0,60,11,51,2.2,13,2027,30,105100.0,25,94.0,sous station,9.4,202.5,23.0,60.0,20/6,20/6/2027,13:30,2027-06-20T13:30:00,25.12,267125272015603,2027-06-20T13:30:00+00:00,2027-06-20T13:30:00+02:00,2027-06-20T13:30:00+00:00,2027-06-20T13:30:00+00:00
ab14b8f2f2f2f2f2f2f2f2f3,85,8,20,11,71,75,12,94.0,47,47,23,151,9.0,60,11,51,2.2,17,2030,30,105100.0,25,94.0,sous station,9.4,202.5,23.0,60.0,20/8,20/8/2030,17:30,2030-08-20T17:30:00,25.12,267125272015603,2030-08-20T17:30:00+00:00,2030-08-20T17:30:00+02:00,2030-08-20T17:30:00+00:00,2030-08-20T17:30:00+00:00
ab4888f2f2f2f2f2f2f2f2f3,85,10,8,8,71,75,12,94.0,47,47,23,151,9.0,60,11,51,2.2,17,2027,30,105100.0,25,94.0,sous station,9.4,202.5,23.0,60.0,8/10,8/10/2027,17:30,2027-10-08T17:30:00,25.12,267125272015603,2027-10-08T17:30:00+00:00,2027-10-08T17:30:00+02:00,2027-10-08T17:30:00+00:00,2027-10-08T17:30:00+00:00
a8c492f2f2f2f2f2f2f2f2f3,84,6,4,9,23,75,12,94.0,47,47,23,151,9.0,60,11,51,2.2,5,2028,30,105100.0,25,94.0,sous station,9.4,202.5,23.0,60.0,4/6,4/6/2028,5:30,2028-06-04T05:30:00,25.12,267125272015603,2028-06-04T05:30:00+00:00,2028-06-04T05:30:00+02:00,2028-06-04T05:30:00+00:00,2028-06-04T05:30:00+00:00
a8b898f2f2f2f2f2f2f2f2f3,84,5,24,9,71,75,12,94.0,47,47,23,151,9.0,60,11,51,2.2,17,2028,30,105100.0,25,94.0,sous station,9.4,202.5,23.0,60.0,24/5,24/5/2028,17:30,2028-05-24T17:30:00,25.12,267125272015603,2028-05-24T17:30:00+00:00,2028-05-24T17:30:00+02:00,2028-05-24T17:30:00+00:00,2028-05-24T17:30:00+00:00
ab5094f2f2f2f2f2f2f2f2f3,85,10,16,9,39,75,12,94.0,47,47,23,151,9.0,60,11,51,2.2,9,2028,30,105100.0,25,94.0,sous station,9.4,202.5,23.0,60.0,16/10,16/10/2028,9:30,2028-10-16T09:30:00,25.12,267125272015603,2028-10-16T09:30:00+00:00,2028-10-16T09:30:00+02:00,2028-10-16T09:30:00+00:00,2028-10-16T09:30:00+00:00
a8dca8f2f2f2f2f2f2f2f2f3,84,6,28,10,71,75,12,94.0,47,47,23,151,9.0,60,11,51,2.2,17,2029,30,105100.0,25,94.0,sous station,9.4,202.5,23.0,60.0,28/6,28/6/2029,17:30,2029-06-28T17:30:00,25.12,267125272015603,2029-06-28T17:30:00+00:00,2029-06-28T17:30:00+02:00,2029-06-28T17:30:00+00:00,2029-06-28T17:30:00+00:00
a8dcb0f2f2f2f2f2f2f2f2f3,84,6,28,11,7,75,12,94.0,47,47,23,151,9.0,60,11,51,2.2,1,2030,30,105100.0,25,94.0,sous station,9.4,202.5,23.0,60.0,28/6,28/6/2030,1:30,2030-06-28T01:30:00,25.12,267125272015603,2030-06-28T01:30:00+00:00,2030-06-28T01:30:00+02:00,2030-06-28T01:30:00+00:00,2030-06-28T01:30:00+00:00
ab54b6f2f2f2f2f2f2f2f2f3,85,10,20,11,55,75,12,94.0,47,47,23,151,9.0,60,11,51,2.2,13,2030,30,105100.0,25,94.0,sous station,9.4,202.5,23.0,60.0,20/10,20/10/2030,13:30,2030-10-20T13:30:00,25.12,267125272015603,2030-10-20T13:30:00+00:00,2030-10-20T13:30:00+02:00,2030-10-20T13:30:00+00:00,2030-10-20T13:30:00+00:00
ab5cb0f2f2f2f2f2f2f2f2f3,85,10,28,11,7,75,12,94.0,47,47,23,151,9.0,60,11,51,2.2,1,2030,30,105100.0,25,94.0,sous station,9.4,202.5,23.0,60.0,28/10,28/10/2030,1:30,2030-10-28T01:30:00,25.12,267125272015603,2030-10-28T01:30:00+00:00,2030-10-28T01:30:00+01:00,2030-10-28T01:30:00+00:00,2030-10-28T01:30:00+00:00
ab54a2f2f2f2f2f2f2f2f2f3,85,10,20,10,23,75,12,94.0,47,47,23,151,9.0,60,11,51,2.2,5,2029,30,105100.0,25,94.0,sous station,9.4,202.5,23.0,60.0,20/10,20/10/2029,5:30,2029-10-20T05:30:00,25.12,267125272015603,2029-10-20T05:30:00+00:00,2029-10-20T05:30:00+02:00,2029-10-20T05:30:00+00:00,2029-10-20T05:30:00+00:00
a8bc80f2f2f2f2f2f2f2f2f3,84,5,28,8,7,75,12,94.0,47,47,23,151,9.0,60,11,51,2.2,1,2027,30,105100.0,25,94.0,sous station,9.4,202.5,23.0,60.0,28/5,28/5/2027,1:30,2027-05-28T01:30:00,25.12,267125272015603,2027-05-28T01:30:00+00:00,2027-05-28T01:30:00+02:00,2027-05-28T01:30:00+00:00,2027-05-28T01:30:00+00:00
ab688af2f2f2f2f2f2f2f2f3,85,11,8,8,87,75,12,94.0,47,47,23,151,9.0,60,11,51,2.2,21,2027,30,105100.0,25,94.0,sous station,9.4,202.5,23.0,60.0,8/11,8/11/2027,21:30,2027-11-08T21:30:00,25.12,267125272015603,2027-11-08T21:30:00+00:00,2027-11-08T21:30:00+01:00,2027-11-08T21:30:00+00:00,2027-11-08T21:30:00+00:00
ab6892f2f2f2f2f2f2f2f2f3,85,11,8,9,23,75,12,94.0,47,47,23,151,9.0,60,11,51,2.2,5,2028,30,105100.0,25,94.0,sous station,9.4,202.5,23.0,60.0,8/11,8/11/2028,5:30,2028-11-08T05:30:00,25.12,267125272015603,2028-11-08T05:30:00+00:00,2028-11-08T05:30:00+01:00,2028-11-08T05:30:00+00:00,2028-11-08T05:30:00+00:00
ab78a0f2f2f2f2f2f2f2f2f3,85,11,24,10,7,75,12,94.0,47,47,23,151,9.0,60,11,51,2.2,1,2029,30,105100.0,25,94.0,sous station,9.4,202.5,23.0,60.0,24/11,24/11/2029,1:30,2029-11-24T01:30:00,25.12,267125272015603,2029-11-24T01:30:00+00:00,2029-11-24T01:30:00+01:00,2029-11-24T01:30:00+00:00,2029-11-24T01:30:00+00:00
a8c8b8f2f2f2f2f2f2f2f2f3,84,6,8,11,71,75,12,94.0,47,47,23,151,9.0,60,11,51,2.2,17,2030,30,105100.0,25,94.0,sous station,9.4,202.5,23.0,60.0,8/6,8/6/2030,17:30,2030-06-08T17:30:00,25.12,267125272015603,2030-06-08T17:30:00+00:00,2030-06-08T17:30:00+02:00,2030-06-08T17:30:00+00:00,2030-06-08T17:30:00+00:00
a8c8baf2f2f2f2f2f2f2f2f3,84,6,8,11,87,75,12,94.0,47,47,23,151,9.0,60,11,51,2.2,21,2030,30,105100.0,25,94.0,sous station,9.4,202.5,23.0,60.0,8/6,8/6/2030,21:30,2030-06-08T21:30:00,25.12,267125272015603,2030-06-08T21:30:00+00:00,2030-06-08T21:30:00+02:00,2030-06-08T21:30:00+00:00,2030-06-08T21:30:00+00:00
aadca2f2f2f2f2f2f2f2f2f3,85,6,28,10,23,75,12,94.0,47,47,23,151,9.0,60,11,51,2.2,5,2029,30,105100.0,25,94.0,sous station,9.4,202.5,23.0,60.0,28/6,28/6/2029,5:30,2029-06-28T05:30:00,25.12,267125272015603,2029-06-28T05:30:00+00:00,2029-06-28T05:30:00+02:00,2029-06-28T05:30:00+00:00,2029-06-28T05:30:00+00:00
ab24baf2f2f2f2f2f2f2f2f3,85,9,4,11,87,75,12,94.0,47,47,23,151,9.0,60,11,51,2.2,21,2030,30,105100.0,25,94.0,sous station,9.4,202.5,23.0,60.0,4/9,4/9/2030,21:30,2030-09-04T21:30:00,25.12,267125272015603,2030-09-04T21:30:00+00:00,2030-09-04T21:30:00+02:00,2030-09-04T21:30:00+00:00,2030-09-04T21:30:00+00:00
aad4a4f2f2f2f2f2f2f2f2f3,85,6,20,10,39,75,12,94.0,47,47,23,151,9.0,60,11,51,2.2,9,2029,30,105100.0,25,94.0,sous station,9.4,202.5,23.0,60.0,20/6,20/6/2029,9:30,2029-06-20T09:30:00,25.12,267125272015603,2029-06-20T09:30:00+00:00,2029-06-20T09:30:00+02:00,2029-06-20T09:30:00+00:00,2029-06-20T09:30:00+00:00
a914a2f2f2f2f2f2f2f2f2f3,84,8,20,10,23,75,12,94.0,47,47,23,151,9.0,60,11,51,2.2,5,2029,30,105100.0,25,94.0,sous station,9.4,202.5,23.0,60.0,20/8,20/8/2029,5:30,2029-08-20T05:30:00,25.12,267125272015603,2029-08-20T05:30:00+00:00,2029-08-20T05:30:00+02:00,2029-08-20T05:30:00+00:00,2029-08-20T05:30:00+00:00
a93cb4f2f2f2f2f2f2f2f2f3,84,9,28,11,39,75,12,94.0,47,47,23,151,9.0,60,11,51,2.2,9,2030,30,105100.0,25,94.0,sous station,9.4,202.5,23.0,60.0,28/9,28/9/2030,9:30,2030-09-28T09:30:00,25.12,267125272015603,2030-09-28T09:30:00+00:00,2030-09-28T09:30:00+02:00,2030-09-28T09:30:00+00:00,2030-09-28T09:30:00+00:00
a904b2f2f2f2f2f2f2f2f2f3,84,8,4,11,23,75,12,94.0,47,47,23,151,9.0,60,11,51,2.2,5,2030,30,105100.0,25,94.0,sous station,9.4,202.5,23.0,60.0,4/8,4/8/2030,5:30,2030-08-04T05:30:00,25.12,267125272015603,2030-08-04T05:30:00+00:00,2030-08-04T05:30:00+02:00,2030-08-04T05:30:00+00:00,2030-08-04T05:30:00+00:00
aad8a4f2f2f2f2f2f2f2f2f3,85,6,24,10,39,75,12,94.0,47,47,23,151,9.0,60,11,51,2.2,9,2029,30,105100.0,25,94.0,sous station,9.4,202.5,23.0,60.0,24/6,24/6/2029,9:30,2029-06-24T09:30:00,25.12,267125272015603,2029-06-24T09:30:00+00:00,2029-06-24T09:30:00+02:00,2029-06-24T09:30:00+00:00,2029-06-24T09:30:00+00:00
aae4a4f2f2f2f2f2f2f2f2f3,85,7,4,10,39,75,12,94.0,47,47,23,151,9.0,60,11,51,2.2,9,2029,30,105100.0,25,94.0,sous station,9.4,202.5,23.0,60.0,4/7,4/7/2029,9:30,2029-07-04T09:30:00,25.12,267125272015603,2029-07-04T09:30:00+00:00,2029-07-04T09:30:00+02:00,2029-07-04T09:30:00+00:00,2029-07-04T09:30:00+00:00
aa8890f2f2f2f2f2f2f2f2f3,85,4,8,9,7,75,12,94.0,47,47,23,151,9.0,60,11,51,2.2,1,2028,30,105100.0,25,94.0,sous station,9.4,202.5,23.0,60.0,8/4,8/4/2028,1:30,2028-04-08T01:30:00,25.12,267125272015603,2028-04-08T01:30:00+00:00,2028-04-08T01:30:00+02:00,2028-04-08T01:30:00+00:00,2028-04-08T01:30:00+00:00
ae5072f2f2f2f2f2f2f2f2f3,87,2,16,7,23,75,12,94.0,47,47,23,151,9.0,60,11,51,2.2,5,2026,30,105100.0,25,94.0,sous station,9.4,202.5,23.0,60.0,16/2,16/2/2026,5:30,2026-02-16T05:30:00,25.12,267125272015603,2026-02-16T05:30:00+00:00,2026-02-16T05:30:00+01:00,2026-02-16T05:30:00+00:00,2026-02-16T05:30:00+00:00
ab1084f2f2f2f2f2f2f2f2f3,85,8,16,8,39,75,12,94.0,47,47,23,151,9.0,60,11,51,2.2,9,2027,30,105100.0,25,94.0,sous station,9.4,202.5,23.0,60.0,16/8,16/8/2027,9:30,2027-08-16T09:30:00,25.12,267125272015603,2027-08-16T09:30:00+00:00,2027-08-16T09:30:00+02:00,2027-08-16T09:30:00+00:00,2027-08-16T09:30:00+00:00
aaf8a6f2f2f2f2f2f2f2f2f3,85,7,24,10,55,75,12,94.0,47,47,23,151,9.0,60,11,51,2.2,13,2029,30,105100.0,25,94.0,sous station,9.4,202.5,23.0,60.0,24/7,24/7/2029,13:30,2029-07-24T13:30:00,25.12,267125272015603,2029-07-24T13:30:00+00:00,2029-07-24T13:30:00+02:00,2029-07-24T13:30:00+00:00,2029-07-24T13:30:00+00:00
aaf8a8f2f2f2f2f2f2f2f2f3,85,7,24,10,71,75,12,94.0,47,47,23,151,9.0,60,11,51,2.2,17,2029,30,105100.0,25,94.0,sous station,9.4,202.5,23.0,60.0,24/7,24/7/2029,17:30,2029-07-24T17:30:00,25.12,267125272015603,2029-07-24T17:30:00+00:00,2029-07-24T17:30:00+02:00,2029-07-24T17:30:00+00:00,2029-07-24T17:30:00+00:00
ae6c74f2f2f2f2f2f2f2f2f3,87,3,12,7,39,75,12,94.0,47,47,23,151,9.0,60,11,51,2.2,9,2026,30,105100.0,25,94.0,sous station,9.4,202.5,23.0,60.0,12/3,12/3/2026,9:30,2026-03-12T09:30:00,25.12,267125272015603,2026-03-12T09:30:00+00:00,2026-03-12T09:30:00+01:00,2026-03-12T09:30:00+00:00,2026-03-12T09:30:00+00:00
ab0896f2f2f2f2f2f2f2f2f3,85,8,8,9,55,75,12,94.0,47,47,23,151,9.0,60,11,51,2.2,13,2028,30,105100.0,25,94.0,sous station,9.4,202.5,23.0,60.0,8/8,8/8/2028,13:30,2028-08-08T13:30:00,25.12,267125272015603,2028-08-08T13:30:00+00:00,2028-08-08T13:30:00+02:00,2028-08-08T13:30:00+00:00,2028-08-08T13:30:00+00:00
aafca8f2f2f2f2f2f2f2f2f3,85,7,28,10,71,75,12,94.0,47,47,23,151,9.0,60,11,51,2.2,17,2029,30,105100.0,25,94.0,sous station,9.4,202.5,23.0,60.0,28/7,28/7/2029,17:30,2029-07-28T17:30:00,25.12,267125272015603,2029-07-28T17:30:00+00:00,2029-07-28T17:30:00+02:00,2029-07-28T17:30:00+00:00,2029-07-28T17:30:00+00:00
aafcb4f2f2f2f2f2f2f2f2f3,85,7,28,11,39,75,12,94.0,47,47,23,151,9.0,60,11,51,2.2,9,2030,30,105100.0,25,94.0,sous station,9.4,202.5,23.0,60.0,28/7,28/7/2030,9:30,2030-07-28T09:30:00,25.12,267125272015603,2030-07-28T09:30:00+00:00,2030-07-28T09:30:00+02:00,2030-07-28T09:30:00+00:00,2030-07-28T09:30:00+00:00
ab0ca6f2f2f2f2f2f2f2f2f3,85,8,12,10,55,75,12,94.0,47,47,23,151,9.0,60,11,51,2.2,13,2029,30,105100.0,25,94.0,sous station,9.4,202.5,23.0,60.0,12/8,12/8/2029,13:30,2029-08-12T13:30:00,25.12,267125272015603,2029-08-12T13:30:00+00:00,2029-08-12T13:30:00+02:00,2029-08-12T13:30:00+00:00,2029-08-12T13:30:00+00:00
ab1080f2f2f2f2f2f2f2f2f3,85,8,16,8,7,75,12,94.0,47,47,23,151,9.0,60,11,51,2.2,1,2027,30,105100.0,25,94.0,sous station,9.4,202.5,23.0,60.0,16/8,16/8/2027,1:30,2027-08-16T01:30:00,25.12,267125272015603,2027-08-16T01:30:00+00:00,2027-08-16T01:30:00+02:00,2027-08-16T01:30:00+00:00,2027-08-16T01:30:00+00:00
ab1088f2f2f2f2f2f2f2f2f3,85,8,16,8,71,75,12,94.0,47,47,23,151,9.0,60,11,51,2.2,17,2027,30,105100.0,25,94.0,sous station,9.4,202.5,23.0,60.0,16/8,16/8/2027,17:30,2027-08-16T17:30:00,25.12,267125272015603,2027-08-16T17:30:00+00:00,2027-08-16T17:30:00+02:00,2027-08-16T17:30:00+00:00,2027-08-16T17:30:00+00:00
ae3872f2f2f2f2f2f2f2f2f3,87,1,24,7,23,75,12,94.0,47,47,23,151,9.0,60,11,51,2.2,5,2026,30,105100.0,25,94.0,sous station,9.4,202.5,23.0,60.0,24/1,24/1/2026,5:30,2026-01-24T05:30:00,25.12,267125272015603,2026-01-24T05:30:00+00:00,2026-01-24T05:30:00+01:00,2026-01-24T05:30:00+00:00,2026-01-24T05:30:00+00:00
ab14b2f2f2f2f2f2f2f2f2f3,85,8,20,11,23,75,12,94.0,47,47,23,151,9.0,60,11,51,2.2,5,2030,30,105100.0,25,94.0,sous station,9.4,202.5,23.0,60.0,20/8,20/8/2030,5:30,2030-08-20T05:30:00,25.12,267125272015603,2030-08-20T05:30:00+00:00,2030-08-20T05:30:00+02:00,2030-08-20T05:30:00+00:00,2030-08-20T05:30:00+00:00
ab1888f2f2f2f2f2f2f2f2f3,85,8,24,8,71,75,12,94.0,47,47,23,151,9.0,60,11,51,2.2,17,2027,30,105100.0,25,94.0,sous station,9.4,202.5,23.0,60.0,24/8,24/8/2027,17:30,2027-08-24T17:30:00,25.12,267125272015603,2027-08-24T17:30:00+00:00,2027-08-24T17:30:00+02:00,2027-08-24T17:30:00+00:00,2027-08-24T17:30:00+00:00
aae894f2f2f2f2f2f2f2f2f3,85,7,8,9,39,75,12,94.0,47,47,23,151,9.0,60,11,51,2.2,9,2028,30,105100.0,25,94.0,sous station,9.4,202.5,23.0,60.0,8/7,8/7/2028,9:30,2028-07-08T09:30:00,25.12,267125272015603,2028-07-08T09:30:00+00:00,2028-07-08T09:30:00+02:00,2028-07-08T09:30:00+00:00,2028-07-08T09:30:00+00:00
a8c494f2f2f2f2f2f2f2f2f3,84,6,4,9,39,75,12,94.0,47,47,23,151,9.0,60,11,51,2.2,9,2028,30,105100.0,25,94.0,sous station,9.4,202.5,23.0,60.0,4/6,4/6/2028,9:30,2028-06-04T09:30:00,25.12,267125272015603,2028-06-04T09:30:00+00:00,2028-06-04T09:30:00+02:00,2028-06-04T09:30:00+00:00,2028-06-04T09:30:00+00:00
a958a0f2f2f2f2f2f2f2f2f3,84,10,24,10,7,75,12,94.0,47,47,23,151,9.0,60,11,51,2.2,1,2029,30,105100.0,25,94.0,sous station,9.4,202.5,23.0,60.0,24/10,24/10/2029,1:30,2029-10-24T01:30:00,25.12,267125272015603,2029-10-24T01:30:00+00:00,2029-10-24T01:30:00+02:00,2029-10-24T01:30:00+00:00,2029-10-24T01:30:00+00:00
a8e8b6f2f2f2f2f2f2f2f2f3,84,7,8,11,55,75,12,94.0,47,47,23,151,9.0,60,11,51,2.2,13,2030,30,105100.0,25,94.0,sous station,9.4,202.5,23.0,60.0,8/7,8/7/2030,13:30,2030-07-08T13:30:00,25.12,267125272015603,2030-07-08T13:30:00+00:00,2030-07-08T13:30:00+02:00,2030-07-08T13:30:00+00:00,2030-07-08T13:30:00+00:00
a8ec84f2f2f2f2f2f2f2f2f3,84,7,12,8,39,75,12,94.0,47,47,23,151,9.0,60,11,51,2.2,9,2027,30,105100.0,25,94.0,sous station,9.4,202.5,23.0,60.0,12/7,12/7/2027,9:30,2027-07-12T09:30:00,25.12,267125272015603,2027-07-12T09:30:00+00:00,2027-07-12T09:30:00+02:00,2027-07-12T09:30:00+00:00,2027-07-12T09:30:00+00:00
ae6c72f2f2f2f2f2f2f2f2f3,87,3,12,7,23,75,12,94.0,47,47,23,151,9.0,60,11,51,2.2,5,2026,30,105100.0,25,94.0,sous station,9.4,202.5,23.0,60.0,12/3,12/3/2026,5:30,2026-03-12T05:30:00,25.12,267125272015603,2026-03-12T05:30:00+00:00,2026-03-12T05:30:00+01:00,2026-03-12T05:30:00+00:00,2026-03-12T05:30:00+00:00
aae4b2f2f2f2f2f2f2f2f2f3,85,7,4,11,23,75,12,94.0,47,47,23,151,9.0,60,11,51,2.2,5,2030,30,105100.0,25,94.0,sous station,9.4,202.5,23.0,60.0,4/7,4/7/2030,5:30,2030-07-04T05:30:00,25.12,267125272015603,2030-07-04T05:30:00+00:00,2030-07-04T05:30:00+02:00,2030-07-04T05:30:00+00:00,2030-07-04T05:30:00+00:00
a8c4a0f2f2f2f2f2f2f2f2f3,84,6,4,10,7,75,12,94.0,47,47,23,151,9.0,60,11,51,2.2,1,2029,30,105100.0,25,94.0,sous station,9.4,202.5,23.0,60.0,4/6,4/6/2029,1:30,2029-06-04T01:30:00,25.12,267125272015603,2029-06-04T01:30:00+00:00,2029-06-04T01:30:00+02:00,2029-06-04T01:30:00+00:00,2029-06-04T01:30:00+00:00
aad4a0f2f2f2f2f2f2f2f2f3,85,6,20,10,7,75,12,94.0,47,47,23,151,9.0,60,11,51,2.2,1,2029,30,105100.0,25,94.0,sous station,9.4,202.5,23.0,60.0,20/6,20/6/2029,1:30,2029-06-20T01:30:00,25.12,267125272015603,2029-06-20T01:30:00+00:00,2029-06-20T01:30:00+02:00,2029-06-20T01:30:00+00:00,2029-06-20T01:30:00+00:00
a8f0b8f2f2f2f2f2f2f2f2f3,84,7,16,11,71,75,12,94.0,47,47,23,151,9.0,60,11,51,2.2,17,2030,30,105100.0,25,94.0,sous station,9.4,202.5,23.0,60.0,16/7,16/7/2030,17:30,2030-07-16T17:30:00,25.12,267125272015603,2030-07-16T17:30:00+00:00,2030-07-16T17:30:00+02:00,2030-07-16T17:30:00+00:00,2030-07-16T17:30:00+00:00
aadc80f2f2f2f2f2f2f2f2f3,85,6,28,8,7,75,12,94.0,47,47,23,151,9.0,60,11,51,2.2,1,2027,30,105100.0,25,94.0,sous station,9.4,202.5,23.0,60.0,28/6,28/6/2027,1:30,2027-06-28T01:30:00,25.12,267125272015603,2027-06-28T01:30:00+00:00,2027-06-28T01:30:00+02:00,2027-06-28T01:30:00+00:00,2027-06-28T01:30:00+00:00
aac8b2f2f2f2f2f2f2f2f2f3,85,6,8,11,23,75,12,94.0,47,47,23,151,9.0,60,11,51,2.2,5,2030,30,105100.0,25,94.0,sous station,9.4,202.5,23.0,60.0,8/6,8/6/2030,5:30,2030-06-08T05:30:00,25.12,267125272015603,2030-06-08T05:30:00+00:00,2030-06-08T05:30:00+02:00,2030-06-08T05:30:00+00:00,2030-06-08T05:30:00+00:00
a894a6f2f2f2f2f2f2f2f2f3,84,4,20,10,55,75,12,94.0,47,47,23,151,9.0,60,11,51,2.2,13,2029,30,105100.0,25,94.0,sous station,9.4,202.5,23.0,60.0,20/4,20/4/2029,13:30,2029-04-20T13:30:00,25.12,267125272015603,2029-04-20T13:30:00+00:00,2029-04-20T13:30:00+02:00,2029-04-20T13:30:00+00:00,2029-04-20T13:30:00+00:00
a894b4f2f2f2f2f2f2f2f2f3,84,4,20,11,39,75,12,94.0,47,47,23,151,9.0,60,11,51,2.2,9,2030,30,105100.0,25,94.0,sous station,9.4,202.5,23.0,60.0,20/4,20/4/2030,9:30,2030-04-20T09:30:00,25.12,267125272015603,2030-04-20T09:30:00+00:00,2030-04-20T09:30:00+02:00,2030-04-20T09:30:00+00:00,2030-04-20T09:30:00+00:00
a94caaf2f2f2f2f2f2f2f2f3,84,10,12,10,87,75,12,94.0,47,47,23,151,9.0,60,11,51,2.2,21,2029,30,105100.0,25,94.0,sous station,9.4,202.5,23.0,60.0,12/10,12/10/2029,21:30,2029-10-12T21:30:00,25.12,267125272015603,2029-10-12T21:30:00+00:00,2029-10-12T21:30:00+02:00,2029-10-12T21:30:00+00:00,2029-10-12T21:30:00+00:00
a944b2f2f2f2f2f2f2f2f2f3,84,10,4,11,23,75,12,94.0,47,47,23,151,9.0,60,11,51,2.2,5,2030,30,105100.0,25,94.0,sous station,9.4,202.5,23.0,60.0,4/10,4/10/2030,5:30,2030-10-04T05:30:00,25.12,267125272015603,2030-10-04T05:30:00+00:00,2030-10-04T05:30:00+02:00,2030-10-04T05:30:00+00:00,2030-10-04T05:30:00+00:00
a88894f2f2f2f2f2f2f2f2f3,84,4,8,9,39,75,12,94.0,47,47,23,151,9.0,60,11,51,2.2,9,2028,30,105100.0,25,94.0,sous station,9.4,202.5,23.0,60.0,8/4,8/4/2028,9:30,2028-04-08T09:30:00,25.12,267125272015603,2028-04-08T09:30:00+00:00,2028-04-08T09:30:00+02:00,2028-04-08T09:30:00+00:00,2028-04-08T09:30:00+00:00
a890a2f2f2f2f2f2f2f2f2f3,84,4,16,10,23,75,12,94.0,47,47,23,151,9.0,60,11,51,2.2,5,2029,30,105100.0,25,94.0,sous station,9.4,202.5,23.0,60.0,16/4,16/4/2029,5:30,2029-04-16T05:30:00,25.12,267125272015603,2029-04-16T05:30:00+00:00,2029-04-16T05:30:00+02:00,2029-04-16T05:30:00+00:00,2029-04-16T05:30:00+00:00
a958a8f2f2f2f2f2f2f2f2f3,84,10,24,10,71,75,12,94.0,47,47,23,151,9.0,60,11,51,2.2,17,2029,30,105100.0,25,94.0,sous station,9.4,202.5,23.0,60.0,24/10,24/10/2029,17:30,2029-10-24T17:30:00,25.12,267125272015603,2029-10-24T17:30:00+00:00,2029-10-24T17:30:00+02:00,2029-10-24T17:30:00+00:00,2029-10-24T17:30:00+00:00
a94cb4f2f2f2f2f2f2f2f2f3,84,10,12,11,39,75,12,94.0,47,47,23,151,9.0,60,11,51,2.2,9,2030,30,105100.0,25,94.0,sous station,9.4,202.5,23.0,60.0,12/10,12/10/2030,9:30,2030-10-12T09:30:00,25.12,267125272015603,2030-10-12T09:30:00+00:00,2030-10-12T09:30:00+02:00,2030-10-12T09:30:00+00:00,2030-10-12T09:30:00+00:00
a96cb2f2f2f2f2f2f2f2f2f3,84,11,12,11,23,75,12,94.0,47,47,23,151,9.0,60,11,51,2.2,5,2030,30,105100.0,25,94.0,sous station,9.4,202.5,23.0,60.0,12/11,12/11/2030,5:30,2030-11-12T05:30:00,25.12,267125272015603,2030-11-12T05:30:00+00:00,2030-11-12T05:30:00+01:00,2030-11-12T05:30:00+00:00,2030-11-12T05:30:00+00:00
a98888f2f2f2f2f2f2f2f2f3,84,12,8,8,71,75,12,94.0,47,47,23,151,9.0,60,11,51,2.2,17,2027,30,105100.0,25,94.0,sous station,9.4,202.5,23.0,60.0,8/12,8/12/2027,17:30,2027-12-08T17:30:00,25.12,267125272015603,2027-12-08T17:30:00+00:00,2027-12-08T17:30:00+01:00,2027-12-08T17:30:00+00:00,2027-12-08T17:30:00+00:00
aad4b2f2f2f2f2f2f2f2f2f3,85,6,20,11,23,75,12,94.0,47,47,23,151,9.0,60,11,51,2.2,5,2030,30,105100.0,25,94.0,sous station,9.4,202.5,23.0,60.0,20/6,20/6/2030,5:30,2030-06-20T05:30:00,25.12,267125272015603,2030-06-20T05:30:00+00:00,2030-06-20T05:30:00+02:00,2030-06-20T05:30:00+00:00,2030-06-20T05:30:00+00:00
a998a0f2f2f2f2f2f2f2f2f3,84,12,24,10,7,75,12,94.0,47,47,23,151,9.0,60,11,51,2.2,1,2029,30,105100.0,25,94.0,sous station,9.4,202.5,23.0,60.0,24/12,24/12/2029,1:30,2029-12-24T01:30:00,25.12,267125272015603,2029-12-24T01:30:00+00:00,2029-12-24T01:30:00+01:00,2029-12-24T01:30:00+00:00,2029-12-24T01:30:00+00:00
aa2880f2f2f2f2f2f2f2f2f3,85,1,8,8,7,75,12,94.0,47,47,23,151,9.0,60,11,51,2.2,1,2027,30,105100.0,25,94.0,sous station,9.4,202.5,23.0,60.0,8/1,8/1/2027,1:30,2027-01-08T01:30:00,25.12,267125272015603,2027-01-08T01:30:00+00:00,2027-01-08T01:30:00+01:00,2027-01-08T01:30:00+00:00,2027-01-08T01:30:00+00:00
a9988af2f2f2f2f2f2f2f2f3,84,12,24,8,87,75,12,94.0,47,47,23,151,9.0,60,11,51,2.2,21,2027,30,105100.0,25,94.0,sous station,9.4,202.5,23.0,60.0,24/12,24/12/2027,21:30,2027-12-24T21:30:00,25.12,267125272015603,2027-12-24T21:30:00+00:00,2027-12-24T21:30:00+01:00,2027-12-24T21:30:00+00:00,2027-12-24T21:30:00+00:00
a998aaf2f2f2f2f2f2f2f2f3,84,12,24,10,87,75,12,94.0,47,47,23,151,9.0,60,11,51,2.2,21,2029,30,105100.0,25,94.0,sous station,9.4,202.5,23.0,60.0,24/12,24/12/2029,21:30,2029-12-24T21:30:00,25.12,267125272015603,2029-12-24T21:30:00+00:00,2029-12-24T21:30:00+01:00,2029-12-24T21:30:00+00:00,2029-12-24T21:30:00+00:00
aa3c88f2f2f2f2f2f2f2f2f3,85,1,28,8,71,75,12,94.0,47,47,23,151,9.0,60,11,51,2.2,17,2027,30,105100.0,25,94.0,sous station,9.4,202.5,23.0,60.0,28/1,28/1/2027,17:30,2027-01-28T17:30:00,25.12,267125272015603,2027-01-28T17:30:00+00:00,2027-01-28T17:30:00+01:00,2027-01-28T17:30:00+00:00,2027-01-28T17:30:00+00:00
aae48af2f2f2f2f2f2f2f2f3,85,7,4,8,87,75,12,94.0,47,47,23,151,9.0,60,11,51,2.2,21,2027,30,105100.0,25,94.0,sous station,9.4,202.5,23.0,60.0,4/7,4/7/2027,21:30,2027-07-04T21:30:00,25.12,267125272015603,2027-07-04T21:30:00+00:00,2027-07-04T21:30:00+02:00,2027-07-04T21:30:00+00:00,2027-07-04T21:30:00+00:00
aa3896f2f2f2f2f2f2f2f2f3,85,1,24,9,55,75,12,94.0,47,47,23,151,9.0,60,11,51,2.2,13,2028,30,105100.0,25,94.0,sous station,9.4,202.5,23.0,60.0,24/1,24/1/2028,13:30,2028-01-24T13:30:00,25.12,267125272015603,2028-01-24T13:30:00+00:00,2028-01-24T13:30:00+01:00,2028-01-24T13:30:00+00:00,2028-01-24T13:30:00+00:00
aa68b6f2f2f2f2f2f2f2f2f3,85,3,8,11,55,75,12,94.0,47,47,23,151,9.0,60,11,51,2.2,13,2030,30,105100.0,25,94.0,sous station,9.4,202.5,23.0,60.0,8/3,8/3/2030,13:30,2030-03-08T13:30:00,25.12,267125272015603,2030-03-08T13:30:00+00:00,2030-03-08T13:30:00+01:00,2030-03-08T13:30:00+00:00,2030-03-08T13:30:00+00:00
ab68a2f2f2f2f2f2f2f2f2f3,85,11,8,10,23,75,12,94.0,47,47,23,151,9.0,60,11,51,2.2,5,2029,30,105100.0,25,94.0,sous station,9.4,202.5,23.0,60.0,8/11,8/11/2029,5:30,2029-11-08T05:30:00,25.12,267125272015603,2029-11-08T05:30:00+00:00,2029-11-08T05:30:00+01:00,2029-11-08T05:30:00+00:00,2029-11-08T05:30:00+00:00
ab68b0f2f2f2f2f2f2f2f2f3,85,11,8,11,7,75,12,94.0,47,47,23,151,9.0,60,11,51,2.2,1,2030,30,105100.0,25,94.0,sous station,9.4,202.5,23.0,60.0,8/11,8/11/2030,1:30,2030-11-08T01:30:00,25.12,267125272015603,2030-11-08T01:30:00+00:00,2030-11-08T01:30:00+01:00,2030-11-08T01:30:00+00:00,2030-11-08T01:30:00+00:00
ab68b2f2f2f2f2f2f2f2f2f3,85,11,8,11,23,75,12,94.0,47,47,23,151,9.0,60,11,51,2.2,5,2030,30,105100.0,25,94.0,sous station,9.4,202.5,23.0,60.0,8/11,8/11/2030,5:30,2030-11-08T05:30:00,25.12,267125272015603,2030-11-08T05:30:00+00:00,2030-11-08T05:30:00+01:00,2030-11-08T05:30:00+00:00,2030-11-08T05:30:00+00:00
ab2886f2f2f2f2f2f2f2f2f3,85,9,8,8,55,75,12,94.0,47,47,23,151,9.0,60,11,51,2.2,13,2027,30,105100.0,25,94.0,sous station,9.4,202.5,23.0,60.0,8/9,8/9/2027,13:30,2027-09-08T13:30:00,25.12,267125272015603,2027-09-08T13:30:00+00:00,2027-09-08T13:30:00+02:00,2027-09-08T13:30:00+00:00,2027-09-08T13:30:00+00:00
ab28a2f2f2f2f2f2f2f2f2f3,85,9,8,10,23,75,12,94.0,47,47,23,151,9.0,60,11,51,2.2,5,2029,30,105100.0,25,94.0,sous station,9.4,202.5,23.0,60.0,8/9,8/9/2029,5:30,2029-09-08T05:30:00,25.12,267125272015603,2029-09-08T05:30:00+00:00,2029-09-08T05:30:00+02:00,2029-09-08T05:30:00+00:00,2029-09-08T05:30:00+00:00
aa78a8f2f2f2f2f2f2f2f2f3,85,3,24,10,71,75,12,94.0,47,47,23,151,9.0,60,11,51,2.2,17,2029,30,105100.0,25,94.0,sous station,9.4,202.5,23.0,60.0,24/3,24/3/2029,17:30,2029-03-24T17:30:00,25.12,267125272015603,2029-03-24T17:30:00+00:00,2029-03-24T17:30:00+01:00,2029-03-24T17:30:00+00:00,2029-03-24T17:30:00+00:00
aa78b8f2f2f2f2f2f2f2f2f3,85,3,24,11,71,75,12,94.0,47,47,23,151,9.0,60,11,51,2.2,17,2030,30,105100.0,25,94.0,sous station,9.4,202.5,23.0,60.0,24/3,24/3/2030,17:30,2030-03-24T17:30:00,25.12,267125272015603,2030-03-24T17:30:00+00:00,2030-03-24T17:30:00+01:00,2030-03-24T17:30:00+00:00,2030-03-24T17:30:00+00:00
aa78baf2f2f2f2f2f2f2f2f3,85,3,24,11,87,75,12,94.0,47,47,23,151,9.0,60,11,51,2.2,21,2030,30,105100.0,25,94.0,sous station,9.4,202.5,23.0,60.0,24/3,24/3/2030,21:30,2030-03-24T21:30:00,25.12,267125272015603,2030-03-24T21:30:00+00:00,2030-03-24T21:30:00+01:00,2030-03-24T21:30:00+00:00,2030-03-24T21:30:00+00:00
aad8a6f2f2f2f2f2f2f2f2f3,85,6,24,10,55,75,12,94.0,47,47,23,151,9.0,60,11,51,2.2,13,2029,30,105100.0,25,94.0,sous station,9.4,202.5,23.0,60.0,24/6,24/6/2029,13:30,2029-06-24T13:30:00,25.12,267125272015603,2029-06-24T13:30:00+00:00,2029-06-24T13:30:00+02:00,2029-06-24T13:30:00+00:00,2029-06-24T13:30:00+00:00
a8a8b6f2f2f2f2f2f2f2f2f3,84,5,8,11,55,75,12,94.0,47,47,23,151,9.0,60,11,51,2.2,13,2030,30,105100.0,25,94.0,sous station,9.4,202.5,23.0,60.0,8/5,8/5/2030,13:30,2030-05-08T13:30:00,25.12,267125272015603,2030-05-08T13:30:00+00:00,2030-05-08T13:30:00+02:00,2030-05-08T13:30:00+00:00,2030-05-08T13:30:00+00:00
a8a8baf2f2f2f2f2f2f2f2f3,84,5,8,11,87,75,12,94.0,47,47,23,151,9.0,60,11,51,2.2,21,2030,30,105100.0,25,94.0,sous station,9.4,202.5,23.0,60.0,8/5,8/5/2030,21:30,2030-05-08T21:30:00,25.12,267125272015603,2030-05-08T21:30:00+00:00,2030-05-08T21:30:00+02:00,2030-05-08T21:30:00+00:00,2030-05-08T21:30:00+00:00
a8a8b4f2f2f2f2f2f2f2f2f3,84,5,8,11,39,75,12,94.0,47,47,23,151,9.0,60,11,51,2.2,9,2030,30,105100.0,25,94.0,sous station,9.4,202.5,23.0,60.0,8/5,8/5/2030,9:30,2030-05-08T09:30:00,25.12,267125272015603,2030-05-08T09:30:00+00:00,2030-05-08T09:30:00+02:00,2030-05-08T09:30:00+00:00,2030-05-08T09:30:00+00:00
a88c98f2f2f2f2f2f2f2f2f3,84,4,12,9,71,75,12,94.0,47,47,23,151,9.0,60,11,51,2.2,17,2028,30,105100.0,25,94.0,sous station,9.4,202.5,23.0,60.0,12/4,12/4/2028,17:30,2028-04-12T17:30:00,25.12,267125272015603,2028-04-12T17:30:00+00:00,2028-04-12T17:30:00+02:00,2028-04-12T17:30:00+00:00,2028-04-12T17:30:00+00:00
a89096f2f2f2f2f2f2f2f2f3,84,4,16,9,55,75,12,94.0,47,47,23,151,9.0,60,11,51,2.2,13,2028,30,105100.0,25,94.0,sous station,9.4,202.5,23.0,60.0,16/4,16/4/2028,13:30,2028-04-16T13:30:00,25.12,267125272015603,2028-04-16T13:30:00+00:00,2028-04-16T13:30:00+02:00,2028-04-16T13:30:00+00:00,2028-04-16T13:30:00+00:00
ab8cb2f2f2f2f2f2f2f2f2f3,85,12,12,11,23,75,12,94.0,47,47,23,151,9.0,60,11,51,2.2,5,2030,30,105100.0,25,94.0,sous station,9.4,202.5,23.0,60.0,12/12,12/12/2030,5:30,2030-12-12T05:30:00,25.12,267125272015603,2030-12-12T05:30:00+00:00,2030-12-12T05:30:00+01:00,2030-12-12T05:30:00+00:00,2030-12-12T05:30:00+00:00
ab909af2f2f2f2f2f2f2f2f3,85,12,16,9,87,75,12,94.0,47,47,23,151,9.0,60,11,51,2.2,21,2028,30,105100.0,25,94.0,sous station,9.4,202.5,23.0,60.0,16/12,16/12/2028,21:30,2028-12-16T21:30:00,25.12,267125272015603,2028-12-16T21:30:00+00:00,2028-12-16T21:30:00+01:00,2028-12-16T21:30:00+00:00,2028-12-16T21:30:00+00:00
aa9ca6f2f2f2f2f2f2f2f2f3,85,4,28,10,55,75,12,94.0,47,47,23,151,9.0,60,11,51,2.2,13,2029,30,105100.0,25,94.0,sous station,9.4,202.5,23.0,60.0,28/4,28/4/2029,13:30,2029-04-28T13:30:00,25.12,267125272015603,2029-04-28T13:30:00+00:00,2029-04-28T13:30:00+02:00,2029-04-28T13:30:00+00:00,2029-04-28T13:30:00+00:00
aa9ca0f2f2f2f2f2f2f2f2f3,85,4,28,10,7,75,12,94.0,47,47,23,151,9.0,60,11,51,2.2,1,2029,30,105100.0,25,94.0,sous station,9.4,202.5,23.0,60.0,28/4,28/4/2029,1:30,2029-04-28T01:30:00,25.12,267125272015603,2029-04-28T01:30:00+00:00,2029-04-28T01:30:00+02:00,2029-04-28T01:30:00+00:00,2029-04-28T01:30:00+00:00
ab7484f2f2f2f2f2f2f2f2f3,85,11,20,8,39,75,12,94.0,47,47,23,151,9.0,60,11,51,2.2,9,2027,30,105100.0,25,94.0,sous station,9.4,202.5,23.0,60.0,20/11,20/11/2027,9:30,2027-11-20T09:30:00,25.12,267125272015603,2027-11-20T09:30:00+00:00,2027-11-20T09:30:00+01:00,2027-11-20T09:30:00+00:00,2027-11-20T09:30:00+00:00
ab78b4f2f2f2f2f2f2f2f2f3,85,11,24,11,39,75,12,94.0,47,47,23,151,9.0,60,11,51,2.2,9,2030,30,105100.0,25,94.0,sous station,9.4,202.5,23.0,60.0,24/11,24/11/2030,9:30,2030-11-24T09:30:00,25.12,267125272015603,2030-11-24T09:30:00+00:00,2030-11-24T09:30:00+01:00,2030-11-24T09:30:00+00:00,2030-11-24T09:30:00+00:00
a8b0aaf2f2f2f2f2f2f2f2f3,84,5,16,10,87,75,12,94.0,47,47,23,151,9.0,60,11,51,2.2,21,2029,30,105100.0,25,94.0,sous station,9.4,202.5,23.0,60.0,16/5,16/5/2029,21:30,2029-05-16T21:30:00,25.12,267125272015603,2029-05-16T21:30:00+00:00,2029-05-16T21:30:00+02:00,2029-05-16T21:30:00+00:00,2029-05-16T21:30:00+00:00
a8b0b0f2f2f2f2f2f2f2f2f3,84,5,16,11,7,75,12,94.0,47,47,23,151,9.0,60,11,51,2.2,1,2030,30,105100.0,25,94.0,sous station,9.4,202.5,23.0,60.0,16/5,16/5/2030,1:30,2030-05-16T01:30:00,25.12,267125272015603,2030-05-16T01:30:00+00:00,2030-05-16T01:30:00+02:00,2030-05-16T01:30:00+00:00,2030-05-16T01:30:00+00:00
a8b494f2f2f2f2f2f2f2f2f3,84,5,20,9,39,75,12,94.0,47,47,23,151,9.0,60,11,51,2.2,9,2028,30,105100.0,25,94.0,sous station,9.4,202.5,23.0,60.0,20/5,20/5/2028,9:30,2028-05-20T09:30:00,25.12,267125272015603,2028-05-20T09:30:00+00:00,2028-05-20T09:30:00+02:00,2028-05-20T09:30:00+00:00,2028-05-20T09:30:00+00:00
a8b496f2f2f2f2f2f2f2f2f3,84,5,20,9,55,75,12,94.0,47,47,23,151,9.0,60,11,51,2.2,13,2028,30,105100.0,25,94.0,sous station,9.4,202.5,23.0,60.0,20/5,20/5/2028,13:30,2028-05-20T13:30:00,25.12,267125272015603,2028-05-20T13:30:00+00:00,2028-05-20T13:30:00+02:00,2028-05-20T13:30:00+00:00,2028-05-20T13:30:00+00:00
a8b892f2f2f2f2f2f2f2f2f3,84,5,24,9,23,75,12,94.0,47,47,23,151,9.0,60,11,51,2.2,5,2028,30,105100.0,25,94.0,sous station,9.4,202.5,23.0,60.0,24/5,24/5/2028,5:30,2028-05-24T05:30:00,25.12,267125272015603,2028-05-24T05:30:00+00:00,2028-05-24T05:30:00+02:00,2028-05-24T05:30:00+00:00,2028-05-24T05:30:00+00:00
a8d494f2f2f2f2f2f2f2f2f3,84,6,20,9,39,75,12,94.0,47,47,23,151,9.0,60,11,51,2.2,9,2028,30,105100.0,25,94.0,sous station,9.4,202.5,23.0,60.0,20/6,20/6/2028,9:30,2028-06-20T09:30:00,25.12,267125272015603,2028-06-20T09:30:00+00:00,2028-06-20T09:30:00+02:00,2028-06-20T09:30:00+00:00,2028-06-20T09:30:00+00:00
a8ccbaf2f2f2f2f2f2f2f2f3,84,6,12,11,87,75,12,94.0,47,47,23,151,9.0,60,11,51,2.2,21,2030,30,105100.0,25,94.0,sous station,9.4,202.5,23.0,60.0,12/6,12/6/2030,21:30,2030-06-12T21:30:00,25.12,267125272015603,2030-06-12T21:30:00+00:00,2030-06-12T21:30:00+02:00,2030-06-12T21:30:00+00:00,2030-06-12T21:30:00+00:00
aaccbaf2f2f2f2f2f2f2f2f3,85,6,12,11,87,75,12,94.0,47,47,23,151,9.0,60,11,51,2.2,21,2030,30,105100.0,25,94.0,sous station,9.4,202.5,23.0,60.0,12/6,12/6/2030,21:30,2030-06-12T21:30:00,25.12,267125272015603,2030-06-12T21:30:00+00:00,2030-06-12T21:30:00+02:00,2030-06-12T21:30:00+00:00,2030-06-12T21:30:00+00:00
a8f0b2f2f2f2f2f2f2f2f2f3,84,7,16,11,23,75,12,94.0,47,47,23,151,9.0,60,11,51,2.2,5,2030,30,105100.0,25,94.0,sous station,9.4,202.5,23.0,60.0,16/7,16/7/2030,5:30,2030-07-16T05:30:00,25.12,267125272015603,2030-07-16T05:30:00+00:00,2030-07-16T05:30:00+02:00,2030-07-16T05:30:00+00:00,2030-07-16T05:30:00+00:00
a8f498f2f2f2f2f2f2f2f2f3,84,7,20,9,71,75,12,94.0,47,47,23,151,9.0,60,11,51,2.2,17,2028,30,105100.0,25,94.0,sous station,9.4,202.5,23.0,60.0,20/7,20/7/2028,17:30,2028-07-20T17:30:00,25.12,267125272015603,2028-07-20T17:30:00+00:00,2028-07-20T17:30:00+02:00,2028-07-20T17:30:00+00:00,2028-07-20T17:30:00+00:00
a8f4aaf2f2f2f2f2f2f2f2f3,84,7,20,10,87,75,12,94.0,47,47,23,151,9.0,60,11,51,2.2,21,2029,30,105100.0,25,94.0,sous station,9.4,202.5,23.0,60.0,20/7,20/7/2029,21:30,2029-07-20T21:30:00,25.12,267125272015603,2029-07-20T21:30:00+00:00,2029-07-20T21:30:00+02:00,2029-07-20T21:30:00+00:00,2029-07-20T21:30:00+00:00
ab78b6f2f2f2f2f2f2f2f2f3,85,11,24,11,55,75,12,94.0,47,47,23,151,9.0,60,11,51,2.2,13,2030,30,105100.0,25,94.0,sous station,9.4,202.5,23.0,60.0,24/11,24/11/2030,13:30,2030-11-24T13:30:00,25.12,267125272015603,2030-11-24T13:30:00+00:00,2030-11-24T13:30:00+01:00,2030-11-24T13:30:00+00:00,2030-11-24T13:30:00+00:00
a8f494f2f2f2f2f2f2f2f2f3,84,7,20,9,39,75,12,94.0,47,47,23,151,9.0,60,11,51,2.2,9,2028,30,105100.0,25,94.0,sous station,9.4,202.5,23.0,60.0,20/7,20/7/2028,9:30,2028-07-20T09:30:00,25.12,267125272015603,2028-07-20T09:30:00+00:00,2028-07-20T09:30:00+02:00,2028-07-20T09:30:00+00:00,2028-07-20T09:30:00+00:00
aa4886f2f2f2f2f2f2f2f2f3,85,2,8,8,55,75,12,94.0,47,47,23,151,9.0,60,11,51,2.2,13,2027,30,105100.0,25,94.0,sous station,9.4,202.5,23.0,60.0,8/2,8/2/2027,13:30,2027-02-08T13:30:00,25.12,267125272015603,2027-02-08T13:30:00+00:00,2027-02-08T13:30:00+01:00,2027-02-08T13:30:00+00:00,2027-02-08T13:30:00+00:00
aafcb6f2f2f2f2f2f2f2f2f3,85,7,28,11,55,75,12,94.0,47,47,23,151,9.0,60,11,51,2.2,13,2030,30,105100.0,25,94.0,sous station,9.4,202.5,23.0,60.0,28/7,28/7/2030,13:30,2030-07-28T13:30:00,25.12,267125272015603,2030-07-28T13:30:00+00:00,2030-07-28T13:30:00+02:00,2030-07-28T13:30:00+00:00,2030-07-28T13:30:00+00:00
ab1498f2f2f2f2f2f2f2f2f3,85,8,20,9,71,75,12,94.0,47,47,23,151,9.0,60,11,51,2.2,17,2028,30,105100.0,25,94.0,sous station,9.4,202.5,23.0,60.0,20/8,20/8/2028,17:30,2028-08-20T17:30:00,25.12,267125272015603,2028-08-20T17:30:00+00:00,2028-08-20T17:30:00+02:00,2028-08-20T17:30:00+00:00,2028-08-20T17:30:00+00:00
aa74a6f2f2f2f2f2f2f2f2f3,85,3,20,10,55,75,12,94.0,47,47,23,151,9.0,60,11,51,2.2,13,2029,30,105100.0,25,94.0,sous station,9.4,202.5,23.0,60.0,20/3,20/3/2029,13:30,2029-03-20T13:30:00,25.12,267125272015603,2029-03-20T13:30:00+00:00,2029-03-20T13:30:00+01:00,2029-03-20T13:30:00+00:00,2029-03-20T13:30:00+00:00
ab14a8f2f2f2f2f2f2f2f2f3,85,8,20,10,71,75,12,94.0,47,47,23,151,9.0,60,11,51,2.2,17,2029,30,105100.0,25,94.0,sous station,9.4,202.5,23.0,60.0,20/8,20/8/2029,17:30,2029-08-20T17:30:00,25.12,267125272015603,2029-08-20T17:30:00+00:00,2029-08-20T17:30:00+02:00,2029-08-20T17:30:00+00:00,2029-08-20T17:30:00+00:00
ab14b6f2f2f2f2f2f2f2f2f3,85,8,20,11,55,75,12,94.0,47,47,23,151,9.0,60,11,51,2.2,13,2030,30,105100.0,25,94.0,sous station,9.4,202.5,23.0,60.0,20/8,20/8/2030,13:30,2030-08-20T13:30:00,25.12,267125272015603,2030-08-20T13:30:00+00:00,2030-08-20T13:30:00+02:00,2030-08-20T13:30:00+00:00,2030-08-20T13:30:00+00:00
ab1884f2f2f2f2f2f2f2f2f3,85,8,24,8,39,75,12,94.0,47,47,23,151,9.0,60,11,51,2.2,9,2027,30,105100.0,25,94.0,sous station,9.4,202.5,23.0,60.0,24/8,24/8/2027,9:30,2027-08-24T09:30:00,25.12,267125272015603,2027-08-24T09:30:00+00:00,2027-08-24T09:30:00+02:00,2027-08-24T09:30:00+00:00,2027-08-24T09:30:00+00:00
ab1882f2f2f2f2f2f2f2f2f3,85,8,24,8,23,75,12,94.0,47,47,23,151,9.0,60,11,51,2.2,5,2027,30,105100.0,25,94.0,sous station,9.4,202.5,23.0,60.0,24/8,24/8/2027,5:30,2027-08-24T05:30:00,25.12,267125272015603,2027-08-24T05:30:00+00:00,2027-08-24T05:30:00+02:00,2027-08-24T05:30:00+00:00,2027-08-24T05:30:00+00:00
ab1886f2f2f2f2f2f2f2f2f3,85,8,24,8,55,75,12,94.0,47,47,23,151,9.0,60,11,51,2.2,13,2027,30,105100.0,25,94.0,sous station,9.4,202.5,23.0,60.0,24/8,24/8/2027,13:30,2027-08-24T13:30:00,25.12,267125272015603,2027-08-24T13:30:00+00:00,2027-08-24T13:30:00+02:00,2027-08-24T13:30:00+00:00,2027-08-24T13:30:00+00:00
ab1890f2f2f2f2f2f2f2f2f3,85,8,24,9,7,75,12,94.0,47,47,23,151,9.0,60,11,51,2.2,1,2028,30,105100.0,25,94.0,sous station,9.4,202.5,23.0,60.0,24/8,24/8/2028,1:30,2028-08-24T01:30:00,25.12,267125272015603,2028-08-24T01:30:00+00:00,2028-08-24T01:30:00+02:00,2028-08-24T01:30:00+00:00,2028-08-24T01:30:00+00:00
ab88b8f2f2f2f2f2f2f2f2f3,85,12,8,11,71,75,12,94.0,47,47,23,151,9.0,60,11,51,2.2,17,2030,30,105100.0,25,94.0,sous station,9.4,202.5,23.0,60.0,8/12,8/12/2030,17:30,2030-12-08T17:30:00,25.12,267125272015603,2030-12-08T17:30:00+00:00,2030-12-08T17:30:00+01:00,2030-12-08T17:30:00+00:00,2030-12-08T17:30:00+00:00
ab08a4f2f2f2f2f2f2f2f2f3,85,8,8,10,39,75,12,94.0,47,47,23,151,9.0,60,11,51,2.2,9,2029,30,105100.0,25,94.0,sous station,9.4,202.5,23.0,60.0,8/8,8/8/2029,9:30,2029-08-08T09:30:00,25.12,267125272015603,2029-08-08T09:30:00+00:00,2029-08-08T09:30:00+02:00,2029-08-08T09:30:00+00:00,2029-08-08T09:30:00+00:00
ab50b2f2f2f2f2f2f2f2f2f3,85,10,16,11,23,75,12,94.0,47,47,23,151,9.0,60,11,51,2.2,5,2030,30,105100.0,25,94.0,sous station,9.4,202.5,23.0,60.0,16/10,16/10/2030,5:30,2030-10-16T05:30:00,25.12,267125272015603,2030-10-16T05:30:00+00:00,2030-10-16T05:30:00+02:00,2030-10-16T05:30:00+00:00,2030-10-16T05:30:00+00:00
ab5c92f2f2f2f2f2f2f2f2f3,85,10,28,9,23,75,12,94.0,47,47,23,151,9.0,60,11,51,2.2,5,2028,30,105100.0,25,94.0,sous station,9.4,202.5,23.0,60.0,28/10,28/10/2028,5:30,2028-10-28T05:30:00,25.12,267125272015603,2028-10-28T05:30:00+00:00,2028-10-28T05:30:00+02:00,2028-10-28T05:30:00+00:00,2028-10-28T05:30:00+00:00
aa44b6f2f2f2f2f2f2f2f2f3,85,2,4,11,55,75,12,94.0,47,47,23,151,9.0,60,11,51,2.2,13,2030,30,105100.0,25,94.0,sous station,9.4,202.5,23.0,60.0,4/2,4/2/2030,13:30,2030-02-04T13:30:00,25.12,267125272015603,2030-02-04T13:30:00+00:00,2030-02-04T13:30:00+01:00,2030-02-04T13:30:00+00:00,2030-02-04T13:30:00+00:00
aa38aaf2f2f2f2f2f2f2f2f3,85,1,24,10,87,75,12,94.0,47,47,23,151,9.0,60,11,51,2.2,21,2029,30,105100.0,25,94.0,sous station,9.4,202.5,23.0,60.0,24/1,24/1/2029,21:30,2029-01-24T21:30:00,25.12,267125272015603,2029-01-24T21:30:00+00:00,2029-01-24T21:30:00+01:00,2029-01-24T21:30:00+00:00,2029-01-24T21:30:00+00:00
aa70a6f2f2f2f2f2f2f2f2f3,85,3,16,10,55,75,12,94.0,47,47,23,151,9.0,60,11,51,2.2,13,2029,30,105100.0,25,94.0,sous station,9.4,202.5,23.0,60.0,16/3,16/3/2029,13:30,2029-03-16T13:30:00,25.12,267125272015603,2029-03-16T13:30:00+00:00,2029-03-16T13:30:00+01:00,2029-03-16T13:30:00+00:00,2029-03-16T13:30:00+00:00
a8e8b2f2f2f2f2f2f2f2f2f3,84,7,8,11,23,75,12,94.0,47,47,23,151,9.0,60,11,51,2.2,5,2030,30,105100.0,25,94.0,sous station,9.4,202.5,23.0,60.0,8/7,8/7/2030,5:30,2030-07-08T05:30:00,25.12,267125272015603,2030-07-08T05:30:00+00:00,2030-07-08T05:30:00+02:00,2030-07-08T05:30:00+00:00,2030-07-08T05:30:00+00:00
aa58b4f2f2f2f2f2f2f2f2f3,85,2,24,11,39,75,12,94.0,47,47,23,151,9.0,60,11,51,2.2,9,2030,30,105100.0,25,94.0,sous station,9.4,202.5,23.0,60.0,24/2,24/2/2030,9:30,2030-02-24T09:30:00,25.12,267125272015603,2030-02-24T09:30:00+00:00,2030-02-24T09:30:00+01:00,2030-02-24T09:30:00+00:00,2030-02-24T09:30:00+00:00
aa6892f2f2f2f2f2f2f2f2f3,85,3,8,9,23,75,12,94.0,47,47,23,151,9.0,60,11,51,2.2,5,2028,30,105100.0,25,94.0,sous station,9.4,202.5,23.0,60.0,8/3,8/3/2028,5:30,2028-03-08T05:30:00,25.12,267125272015603,2028-03-08T05:30:00+00:00,2028-03-08T05:30:00+01:00,2028-03-08T05:30:00+00:00,2028-03-08T05:30:00+00:00
aa64a2f2f2f2f2f2f2f2f2f3,85,3,4,10,23,75,12,94.0,47,47,23,151,9.0,60,11,51,2.2,5,2029,30,105100.0,25,94.0,sous station,9.4,202.5,23.0,60.0,4/3,4/3/2029,5:30,2029-03-04T05:30:00,25.12,267125272015603,2029-03-04T05:30:00+00:00,2029-03-04T05:30:00+01:00,2029-03-04T05:30:00+00:00,2029-03-04T05:30:00+00:00
aa6490f2f2f2f2f2f2f2f2f3,85,3,4,9,7,75,12,94.0,47,47,23,151,9.0,60,11,51,2.2,1,2028,30,105100.0,25,94.0,sous station,9.4,202.5,23.0,60.0,4/3,4/3/2028,1:30,2028-03-04T01:30:00,25.12,267125272015603,2028-03-04T01:30:00+00:00,2028-03-04T01:30:00+01:00,2028-03-04T01:30:00+00:00,2028-03-04T01:30:00+00:00
aab4a0f2f2f2f2f2f2f2f2f3,85,5,20,10,7,75,12,94.0,47,47,23,151,9.0,60,11,51,2.2,1,2029,30,105100.0,25,94.0,sous station,9.4,202.5,23.0,60.0,20/5,20/5/2029,1:30,2029-05-20T01:30:00,25.12,267125272015603,2029-05-20T01:30:00+00:00,2029-05-20T01:30:00+02:00,2029-05-20T01:30:00+00:00,2029-05-20T01:30:00+00:00
aab4a2f2f2f2f2f2f2f2f2f3,85,5,20,10,23,75,12,94.0,47,47,23,151,9.0,60,11,51,2.2,5,2029,30,105100.0,25,94.0,sous station,9.4,202.5,23.0,60.0,20/5,20/5/2029,5:30,2029-05-20T05:30:00,25.12,267125272015603,2029-05-20T05:30:00+00:00,2029-05-20T05:30:00+02:00,2029-05-20T05:30:00+00:00,2029-05-20T05:30:00+00:00
aab4b6f2f2f2f2f2f2f2f2f3,85,5,20,11,55,75,12,94.0,47,47,23,151,9.0,60,11,51,2.2,13,2030,30,105100.0,25,94.0,sous station,9.4,202.5,23.0,60.0,20/5,20/5/2030,13:30,2030-05-20T13:30:00,25.12,267125272015603,2030-05-20T13:30:00+00:00,2030-05-20T13:30:00+02:00,2030-05-20T13:30:00+00:00,2030-05-20T13:30:00+00:00
a91c96f2f2f2f2f2f2f2f2f3,84,8,28,9,55,75,12,94.0,47,47,23,151,9.0,60,11,51,2.2,13,2028,30,105100.0,25,94.0,sous station,9.4,202.5,23.0,60.0,28/8,28/8/2028,13:30,2028-08-28T13:30:00,25.12,267125272015603,2028-08-28T13:30:00+00:00,2028-08-28T13:30:00+02:00,2028-08-28T13:30:00+00:00,2028-08-28T13:30:00+00:00
a904b6f2f2f2f2f2f2f2f2f3,84,8,4,11,55,75,12,94.0,47,47,23,151,9.0,60,11,51,2.2,13,2030,30,105100.0,25,94.0,sous station,9.4,202.5,23.0,60.0,4/8,4/8/2030,13:30,2030-08-04T13:30:00,25.12,267125272015603,2030-08-04T13:30:00+00:00,2030-08-04T13:30:00+02:00,2030-08-04T13:30:00+00:00,2030-08-04T13:30:00+00:00
a904baf2f2f2f2f2f2f2f2f3,84,8,4,11,87,75,12,94.0,47,47,23,151,9.0,60,11,51,2.2,21,2030,30,105100.0,25,94.0,sous station,9.4,202.5,23.0,60.0,4/8,4/8/2030,21:30,2030-08-04T21:30:00,25.12,267125272015603,2030-08-04T21:30:00+00:00,2030-08-04T21:30:00+02:00,2030-08-04T21:30:00+00:00,2030-08-04T21:30:00+00:00
aac896f2f2f2f2f2f2f2f2f3,85,6,8,9,55,75,12,94.0,47,47,23,151,9.0,60,11,51,2.2,13,2028,30,105100.0,25,94.0,sous station,9.4,202.5,23.0,60.0,8/6,8/6/2028,13:30,2028-06-08T13:30:00,25.12,267125272015603,2028-06-08T13:30:00+00:00,2028-06-08T13:30:00+02:00,2028-06-08T13:30:00+00:00,2028-06-08T13:30:00+00:00
a90c8af2f2f2f2f2f2f2f2f3,84,8,12,8,87,75,12,94.0,47,47,23,151,9.0,60,11,51,2.2,21,2027,30,105100.0,25,94.0,sous station,9.4,202.5,23.0,60.0,12/8,12/8/2027,21:30,2027-08-12T21:30:00,25.12,267125272015603,2027-08-12T21:30:00+00:00,2027-08-12T21:30:00+02:00,2027-08-12T21:30:00+00:00,2027-08-12T21:30:00+00:00
aae4a2f2f2f2f2f2f2f2f2f3,85,7,4,10,23,75,12,94.0,47,47,23,151,9.0,60,11,51,2.2,5,2029,30,105100.0,25,94.0,sous station,9.4,202.5,23.0,60.0,4/7,4/7/2029,5:30,2029-07-04T05:30:00,25.12,267125272015603,2029-07-04T05:30:00+00:00,2029-07-04T05:30:00+02:00,2029-07-04T05:30:00+00:00,2029-07-04T05:30:00+00:00
a91c88f2f2f2f2f2f2f2f2f3,84,8,28,8,71,75,12,94.0,47,47,23,151,9.0,60,11,51,2.2,17,2027,30,105100.0,25,94.0,sous station,9.4,202.5,23.0,60.0,28/8,28/8/2027,17:30,2027-08-28T17:30:00,25.12,267125272015603,2027-08-28T17:30:00+00:00,2027-08-28T17:30:00+02:00,2027-08-28T17:30:00+00:00,2027-08-28T17:30:00+00:00
a930b6f2f2f2f2f2f2f2f2f3,84,9,16,11,55,75,12,94.0,47,47,23,151,9.0,60,11,51,2.2,13,2030,30,105100.0,25,94.0,sous station,9.4,202.5,23.0,60.0,16/9,16/9/2030,13:30,2030-09-16T13:30:00,25.12,267125272015603,2030-09-16T13:30:00+00:00,2030-09-16T13:30:00+02:00,2030-09-16T13:30:00+00:00,2030-09-16T13:30:00+00:00
ab5096f2f2f2f2f2f2f2f2f3,85,10,16,9,55,75,12,94.0,47,47,23,151,9.0,60,11,51,2.2,13,2028,30,105100.0,25,94.0,sous station,9.4,202.5,23.0,60.0,16/10,16/10/2028,13:30,2028-10-16T13:30:00,25.12,267125272015603,2028-10-16T13:30:00+00:00,2028-10-16T13:30:00+02:00,2028-10-16T13:30:00+00:00,2028-10-16T13:30:00+00:00
aae8a6f2f2f2f2f2f2f2f2f3,85,7,8,10,55,75,12,94.0,47,47,23,151,9.0,60,11,51,2.2,13,2029,30,105100.0,25,94.0,sous station,9.4,202.5,23.0,60.0,8/7,8/7/2029,13:30,2029-07-08T13:30:00,25.12,267125272015603,2029-07-08T13:30:00+00:00,2029-07-08T13:30:00+02:00,2029-07-08T13:30:00+00:00,2029-07-08T13:30:00+00:00
ab5494f2f2f2f2f2f2f2f2f3,85,10,20,9,39,75,12,94.0,47,47,23,151,9.0,60,11,51,2.2,9,2028,30,105100.0,25,94.0,sous station,9.4,202.5,23.0,60.0,20/10,20/10/2028,9:30,2028-10-20T09:30:00,25.12,267125272015603,2028-10-20T09:30:00+00:00,2028-10-20T09:30:00+02:00,2028-10-20T09:30:00+00:00,2028-10-20T09:30:00+00:00
a968b6f2f2f2f2f2f2f2f2f3,84,11,8,11,55,75,12,94.0,47,47,23,151,9.0,60,11,51,2.2,13,2030,30,105100.0,25,94.0,sous station,9.4,202.5,23.0,60.0,8/11,8/11/2030,13:30,2030-11-08T13:30:00,25.12,267125272015603,2030-11-08T13:30:00+00:00,2030-11-08T13:30:00+01:00,2030-11-08T13:30:00+00:00,2030-11-08T13:30:00+00:00
a958b6f2f2f2f2f2f2f2f2f3,84,10,24,11,55,75,12,94.0,47,47,23,151,9.0,60,11,51,2.2,13,2030,30,105100.0,25,94.0,sous station,9.4,202.5,23.0,60.0,24/10,24/10/2030,13:30,2030-10-24T13:30:00,25.12,267125272015603,2030-10-24T13:30:00+00:00,2030-10-24T13:30:00+02:00,2030-10-24T13:30:00+00:00,2030-10-24T13:30:00+00:00
aaccaaf2f2f2f2f2f2f2f2f3,85,6,12,10,87,75,12,94.0,47,47,23,151,9.0,60,11,51,2.2,21,2029,30,105100.0,25,94.0,sous station,9.4,202.5,23.0,60.0,12/6,12/6/2029,21:30,2029-06-12T21:30:00,25.12,267125272015603,2029-06-12T21:30:00+00:00,2029-06-12T21:30:00+02:00,2029-06-12T21:30:00+00:00,2029-06-12T21:30:00+00:00
aaa8aaf2f2f2f2f2f2f2f2f3,85,5,8,10,87,75,12,94.0,47,47,23,151,9.0,60,11,51,2.2,21,2029,30,105100.0,25,94.0,sous station,9.4,202.5,23.0,60.0,8/5,8/5/2029,21:30,2029-05-08T21:30:00,25.12,267125272015603,2029-05-08T21:30:00+00:00,2029-05-08T21:30:00+02:00,2029-05-08T21:30:00+00:00,2029-05-08T21:30:00+00:00
aaa896f2f2f2f2f2f2f2f2f3,85,5,8,9,55,75,12,94.0,47,47,23,151,9.0,60,11,51,2.2,13,2028,30,105100.0,25,94.0,sous station,9.4,202.5,23.0,60.0,8/5,8/5/2028,13:30,2028-05-08T13:30:00,25.12,267125272015603,2028-05-08T13:30:00+00:00,2028-05-08T13:30:00+02:00,2028-05-08T13:30:00+00:00,2028-05-08T13:30:00+00:00
aaa4baf2f2f2f2f2f2f2f2f3,85,5,4,11,87,75,12,94.0,47,47,23,151,9.0,60,11,51,2.2,21,2030,30,105100.0,25,94.0,sous station,9.4,202.5,23.0,60.0,4/5,4/5/2030,21:30,2030-05-04T21:30:00,25.12,267125272015603,2030-05-04T21:30:00+00:00,2030-05-04T21:30:00+02:00,2030-05-04T21:30:00+00:00,2030-05-04T21:30:00+00:00
a96caaf2f2f2f2f2f2f2f2f3,84,11,12,10,87,75,12,94.0,47,47,23,151,9.0,60,11,51,2.2,21,2029,30,105100.0,25,94.0,sous station,9.4,202.5,23.0,60.0,12/11,12/11/2029,21:30,2029-11-12T21:30:00,25.12,267125272015603,2029-11-12T21:30:00+00:00,2029-11-12T21:30:00+01:00,2029-11-12T21:30:00+00:00,2029-11-12T21:30:00+00:00
aa8498f2f2f2f2f2f2f2f2f3,85,4,4,9,71,75,12,94.0,47,47,23,151,9.0,60,11,51,2.2,17,2028,30,105100.0,25,94.0,sous station,9.4,202.5,23.0,60.0,4/4,4/4/2028,17:30,2028-04-04T17:30:00,25.12,267125272015603,2028-04-04T17:30:00+00:00,2028-04-04T17:30:00+02:00,2028-04-04T17:30:00+00:00,2028-04-04T17:30:00+00:00
aae492f2f2f2f2f2f2f2f2f3,85,7,4,9,23,75,12,94.0,47,47,23,151,9.0,60,11,51,2.2,5,2028,30,105100.0,25,94.0,sous station,9.4,202.5,23.0,60.0,4/7,4/7/2028,5:30,2028-07-04T05:30:00,25.12,267125272015603,2028-07-04T05:30:00+00:00,2028-07-04T05:30:00+02:00,2028-07-04T05:30:00+00:00,2028-07-04T05:30:00+00:00
aadc84f2f2f2f2f2f2f2f2f3,85,6,28,8,39,75,12,94.0,47,47,23,151,9.0,60,11,51,2.2,9,2027,30,105100.0,25,94.0,sous station,9.4,202.5,23.0,60.0,28/6,28/6/2027,9:30,2027-06-28T09:30:00,25.12,267125272015603,2027-06-28T09:30:00+00:00,2027-06-28T09:30:00+02:00,2027-06-28T09:30:00+00:00,2027-06-28T09:30:00+00:00
aab0a2f2f2f2f2f2f2f2f2f3,85,5,16,10,23,75,12,94.0,47,47,23,151,9.0,60,11,51,2.2,5,2029,30,105100.0,25,94.0,sous station,9.4,202.5,23.0,60.0,16/5,16/5/2029,5:30,2029-05-16T05:30:00,25.12,267125272015603,2029-05-16T05:30:00+00:00,2029-05-16T05:30:00+02:00,2029-05-16T05:30:00+00:00,2029-05-16T05:30:00+00:00
ab9cb0f2f2f2f2f2f2f2f2f3,85,12,28,11,7,75,12,94.0,47,47,23,151,9.0,60,11,51,2.2,1,2030,30,105100.0,25,94.0,sous station,9.4,202.5,23.0,60.0,28/12,28/12/2030,1:30,2030-12-28T01:30:00,25.12,267125272015603,2030-12-28T01:30:00+00:00,2030-12-28T01:30:00+01:00,2030-12-28T01:30:00+00:00,2030-12-28T01:30:00+00:00
ab9cb4f2f2f2f2f2f2f2f2f3,85,12,28,11,39,75,12,94.0,47,47,23,151,9.0,60,11,51,2.2,9,2030,30,105100.0,25,94.0,sous station,9.4,202.5,23.0,60.0,28/12,28/12/2030,9:30,2030-12-28T09:30:00,25.12,267125272015603,2030-12-28T09:30:00+00:00,2030-12-28T09:30:00+01:00,2030-12-28T09:30:00+00:00,2030-12-28T09:30:00+00:00
a914b6f2f2f2f2f2f2f2f2f3,84,8,20,11,55,75,12,94.0,47,47,23,151,9.0,60,11,51,2.2,13,2030,30,105100.0,25,94.0,sous station,9.4,202.5,23.0,60.0,20/8,20/8/2030,13:30,2030-08-20T13:30:00,25.12,267125272015603,2030-08-20T13:30:00+00:00,2030-08-20T13:30:00+02:00,2030-08-20T13:30:00+00:00,2030-08-20T13:30:00+00:00
a90898f2f2f2f2f2f2f2f2f3,84,8,8,9,71,75,12,94.0,47,47,23,151,9.0,60,11,51,2.2,17,2028,30,105100.0,25,94.0,sous station,9.4,202.5,23.0,60.0,8/8,8/8/2028,17:30,2028-08-08T17:30:00,25.12,267125272015603,2028-08-08T17:30:00+00:00,2028-08-08T17:30:00+02:00,2028-08-08T17:30:00+00:00,2028-08-08T17:30:00+00:00
a924a2f2f2f2f2f2f2f2f2f3,84,9,4,10,23,75,12,94.0,47,47,23,151,9.0,60,11,51,2.2,5,2029,30,105100.0,25,94.0,sous station,9.4,202.5,23.0,60.0,4/9,4/9/2029,5:30,2029-09-04T05:30:00,25.12,267125272015603,2029-09-04T05:30:00+00:00,2029-09-04T05:30:00+02:00,2029-09-04T05:30:00+00:00,2029-09-04T05:30:00+00:00
ae3074f2f2f2f2f2f2f2f2f3,87,1,16,7,39,75,12,94.0,47,47,23,151,9.0,60,11,51,2.2,9,2026,30,105100.0,25,94.0,sous station,9.4,202.5,23.0,60.0,16/1,16/1/2026,9:30,2026-01-16T09:30:00,25.12,267125272015603,2026-01-16T09:30:00+00:00,2026-01-16T09:30:00+01:00,2026-01-16T09:30:00+00:00,2026-01-16T09:30:00+00:00
ae3874f2f2f2f2f2f2f2f2f3,87,1,24,7,39,75,12,94.0,47,47,23,151,9.0,60,11,51,2.2,9,2026,30,105100.0,25,94.0,sous station,9.4,202.5,23.0,60.0,24/1,24/1/2026,9:30,2026-01-24T09:30:00,25.12,267125272015603,2026-01-24T09:30:00+00:00,2026-01-24T09:30:00+01:00,2026-01-24T09:30:00+00:00,2026-01-24T09:30:00+00:00
a8cca4f2f2f2f2f2f2f2f2f3,84,6,12,10,39,75,12,94.0,47,47,23,151,9.0,60,11,51,2.2,9,2029,30,105100.0,25,94.0,sous station,9.4,202.5,23.0,60.0,12/6,12/6/2029,9:30,2029-06-12T09:30:00,25.12,267125272015603,2029-06-12T09:30:00+00:00,2029-06-12T09:30:00+02:00,2029-06-12T09:30:00+00:00,2029-06-12T09:30:00+00:00
a8d486f2f2f2f2f2f2f2f2f3,84,6,20,8,55,75,12,94.0,47,47,23,151,9.0,60,11,51,2.2,13,2027,30,105100.0,25,94.0,sous station,9.4,202.5,23.0,60.0,20/6,20/6/2027,13:30,2027-06-20T13:30:00,25.12,267125272015603,2027-06-20T13:30:00+00:00,2027-06-20T13:30:00+02:00,2027-06-20T13:30:00+00:00,2027-06-20T13:30:00+00:00
a8f086f2f2f2f2f2f2f2f2f3,84,7,16,8,55,75,12,94.0,47,47,23,151,9.0,60,11,51,2.2,13,2027,30,105100.0,25,94.0,sous station,9.4,202.5,23.0,60.0,16/7,16/7/2027,13:30,2027-07-16T13:30:00,25.12,267125272015603,2027-07-16T13:30:00+00:00,2027-07-16T13:30:00+02:00,2027-07-16T13:30:00+00:00,2027-07-16T13:30:00+00:00
a8b4b0f2f2f2f2f2f2f2f2f3,84,5,20,11,7,75,12,94.0,47,47,23,151,9.0,60,11,51,2.2,1,2030,30,105100.0,25,94.0,sous station,9.4,202.5,23.0,60.0,20/5,20/5/2030,1:30,2030-05-20T01:30:00,25.12,267125272015603,2030-05-20T01:30:00+00:00,2030-05-20T01:30:00+02:00,2030-05-20T01:30:00+00:00,2030-05-20T01:30:00+00:00
a8e4b6f2f2f2f2f2f2f2f2f3,84,7,4,11,55,75,12,94.0,47,47,23,151,9.0,60,11,51,2.2,13,2030,30,105100.0,25,94.0,sous station,9.4,202.5,23.0,60.0,4/7,4/7/2030,13:30,2030-07-04T13:30:00,25.12,267125272015603,2030-07-04T13:30:00+00:00,2030-07-04T13:30:00+02:00,2030-07-04T13:30:00+00:00,2030-07-04T13:30:00+00:00
a8fc80f2f2f2f2f2f2f2f2f3,84,7,28,8,7,75,12,94.0,47,47,23,151,9.0,60,11,51,2.2,1,2027,30,105100.0,25,94.0,sous station,9.4,202.5,23.0,60.0,28/7,28/7/2027,1:30,2027-07-28T01:30:00,25.12,267125272015603,2027-07-28T01:30:00+00:00,2027-07-28T01:30:00+02:00,2027-07-28T01:30:00+00:00,2027-07-28T01:30:00+00:00
a8c496f2f2f2f2f2f2f2f2f3,84,6,4,9,55,75,12,94.0,47,47,23,151,9.0,60,11,51,2.2,13,2028,30,105100.0,25,94.0,sous station,9.4,202.5,23.0,60.0,4/6,4/6/2028,13:30,2028-06-04T13:30:00,25.12,267125272015603,2028-06-04T13:30:00+00:00,2028-06-04T13:30:00+02:00,2028-06-04T13:30:00+00:00,2028-06-04T13:30:00+00:00
a8c8a0f2f2f2f2f2f2f2f2f3,84,6,8,10,7,75,12,94.0,47,47,23,151,9.0,60,11,51,2.2,1,2029,30,105100.0,25,94.0,sous station,9.4,202.5,23.0,60.0,8/6,8/6/2029,1:30,2029-06-08T01:30:00,25.12,267125272015603,2029-06-08T01:30:00+00:00,2029-06-08T01:30:00+02:00,2029-06-08T01:30:00+00:00,2029-06-08T01:30:00+00:00
a8d4b0f2f2f2f2f2f2f2f2f3,84,6,20,11,7,75,12,94.0,47,47,23,151,9.0,60,11,51,2.2,1,2030,30,105100.0,25,94.0,sous station,9.4,202.5,23.0,60.0,20/6,20/6/2030,1:30,2030-06-20T01:30:00,25.12,267125272015603,2030-06-20T01:30:00+00:00,2030-06-20T01:30:00+02:00,2030-06-20T01:30:00+00:00,2030-06-20T01:30:00+00:00
a8dc80f2f2f2f2f2f2f2f2f3,84,6,28,8,7,75,12,94.0,47,47,23,151,9.0,60,11,51,2.2,1,2027,30,105100.0,25,94.0,sous station,9.4,202.5,23.0,60.0,28/6,28/6/2027,1:30,2027-06-28T01:30:00,25.12,267125272015603,2027-06-28T01:30:00+00:00,2027-06-28T01:30:00+02:00,2027-06-28T01:30:00+00:00,2027-06-28T01:30:00+00:00
a91c84f2f2f2f2f2f2f2f2f3,84,8,28,8,39,75,12,94.0,47,47,23,151,9.0,60,11,51,2.2,9,2027,30,105100.0,25,94.0,sous station,9.4,202.5,23.0,60.0,28/8,28/8/2027,9:30,2027-08-28T09:30:00,25.12,267125272015603,2027-08-28T09:30:00+00:00,2027-08-28T09:30:00+02:00,2027-08-28T09:30:00+00:00,2027-08-28T09:30:00+00:00
a8dc90f2f2f2f2f2f2f2f2f3,84,6,28,9,7,75,12,94.0,47,47,23,151,9.0,60,11,51,2.2,1,2028,30,105100.0,25,94.0,sous station,9.4,202.5,23.0,60.0,28/6,28/6/2028,1:30,2028-06-28T01:30:00,25.12,267125272015603,2028-06-28T01:30:00+00:00,2028-06-28T01:30:00+02:00,2028-06-28T01:30:00+00:00,2028-06-28T01:30:00+00:00
aa2c9af2f2f2f2f2f2f2f2f3,85,1,12,9,87,75,12,94.0,47,47,23,151,9.0,60,11,51,2.2,21,2028,30,105100.0,25,94.0,sous station,9.4,202.5,23.0,60.0,12/1,12/1/2028,21:30,2028-01-12T21:30:00,25.12,267125272015603,2028-01-12T21:30:00+00:00,2028-01-12T21:30:00+01:00,2028-01-12T21:30:00+00:00,2028-01-12T21:30:00+00:00
aa3890f2f2f2f2f2f2f2f2f3,85,1,24,9,7,75,12,94.0,47,47,23,151,9.0,60,11,51,2.2,1,2028,30,105100.0,25,94.0,sous station,9.4,202.5,23.0,60.0,24/1,24/1/2028,1:30,2028-01-24T01:30:00,25.12,267125272015603,2028-01-24T01:30:00+00:00,2028-01-24T01:30:00+01:00,2028-01-24T01:30:00+00:00,2028-01-24T01:30:00+00:00
a8ecb4f2f2f2f2f2f2f2f2f3,84,7,12,11,39,75,12,94.0,47,47,23,151,9.0,60,11,51,2.2,9,2030,30,105100.0,25,94.0,sous station,9.4,202.5,23.0,60.0,12/7,12/7/2030,9:30,2030-07-12T09:30:00,25.12,267125272015603,2030-07-12T09:30:00+00:00,2030-07-12T09:30:00+02:00,2030-07-12T09:30:00+00:00,2030-07-12T09:30:00+00:00
a8f0baf2f2f2f2f2f2f2f2f3,84,7,16,11,87,75,12,94.0,47,47,23,151,9.0,60,11,51,2.2,21,2030,30,105100.0,25,94.0,sous station,9.4,202.5,23.0,60.0,16/7,16/7/2030,21:30,2030-07-16T21:30:00,25.12,267125272015603,2030-07-16T21:30:00+00:00,2030-07-16T21:30:00+02:00,2030-07-16T21:30:00+00:00,2030-07-16T21:30:00+00:00
a8ec90f2f2f2f2f2f2f2f2f3,84,7,12,9,7,75,12,94.0,47,47,23,151,9.0,60,11,51,2.2,1,2028,30,105100.0,25,94.0,sous station,9.4,202.5,23.0,60.0,12/7,12/7/2028,1:30,2028-07-12T01:30:00,25.12,267125272015603,2028-07-12T01:30:00+00:00,2028-07-12T01:30:00+02:00,2028-07-12T01:30:00+00:00,2028-07-12T01:30:00+00:00
a90c80f2f2f2f2f2f2f2f2f3,84,8,12,8,7,75,12,94.0,47,47,23,151,9.0,60,11,51,2.2,1,2027,30,105100.0,25,94.0,sous station,9.4,202.5,23.0,60.0,12/8,12/8/2027,1:30,2027-08-12T01:30:00,25.12,267125272015603,2027-08-12T01:30:00+00:00,2027-08-12T01:30:00+02:00,2027-08-12T01:30:00+00:00,2027-08-12T01:30:00+00:00
a90c90f2f2f2f2f2f2f2f2f3,84,8,12,9,7,75,12,94.0,47,47,23,151,9.0,60,11,51,2.2,1,2028,30,105100.0,25,94.0,sous station,9.4,202.5,23.0,60.0,12/8,12/8/2028,1:30,2028-08-12T01:30:00,25.12,267125272015603,2028-08-12T01:30:00+00:00,2028-08-12T01:30:00+02:00,2028-08-12T01:30:00+00:00,2028-08-12T01:30:00+00:00
aa34a8f2f2f2f2f2f2f2f2f3,85,1,20,10,71,75,12,94.0,47,47,23,151,9.0,60,11,51,2.2,17,2029,30,105100.0,25,94.0,sous station,9.4,202.5,23.0,60.0,20/1,20/1/2029,17:30,2029-01-20T17:30:00,25.12,267125272015603,2029-01-20T17:30:00+00:00,2029-01-20T17:30:00+01:00,2029-01-20T17:30:00+00:00,2029-01-20T17:30:00+00:00
ae6476f2f2f2f2f2f2f2f2f3,87,3,4,7,55,75,12,94.0,47,47,23,151,9.0,60,11,51,2.2,13,2026,30,105100.0,25,94.0,sous station,9.4,202.5,23.0,60.0,4/3,4/3/2026,13:30,2026-03-04T13:30:00,25.12,267125272015603,2026-03-04T13:30:00+00:00,2026-03-04T13:30:00+01:00,2026-03-04T13:30:00+00:00,2026-03-04T13:30:00+00:00
a94cb2f2f2f2f2f2f2f2f2f3,84,10,12,11,23,75,12,94.0,47,47,23,151,9.0,60,11,51,2.2,5,2030,30,105100.0,25,94.0,sous station,9.4,202.5,23.0,60.0,12/10,12/10/2030,5:30,2030-10-12T05:30:00,25.12,267125272015603,2030-10-12T05:30:00+00:00,2030-10-12T05:30:00+02:00,2030-10-12T05:30:00+00:00,2030-10-12T05:30:00+00:00
a950aaf2f2f2f2f2f2f2f2f3,84,10,16,10,87,75,12,94.0,47,47,23,151,9.0,60,11,51,2.2,21,2029,30,105100.0,25,94.0,sous station,9.4,202.5,23.0,60.0,16/10,16/10/2029,21:30,2029-10-16T21:30:00,25.12,267125272015603,2029-10-16T21:30:00+00:00,2029-10-16T21:30:00+02:00,2029-10-16T21:30:00+00:00,2029-10-16T21:30:00+00:00
a950b0f2f2f2f2f2f2f2f2f3,84,10,16,11,7,75,12,94.0,47,47,23,151,9.0,60,11,51,2.2,1,2030,30,105100.0,25,94.0,sous station,9.4,202.5,23.0,60.0,16/10,16/10/2030,1:30,2030-10-16T01:30:00,25.12,267125272015603,2030-10-16T01:30:00+00:00,2030-10-16T01:30:00+02:00,2030-10-16T01:30:00+00:00,2030-10-16T01:30:00+00:00
a9709af2f2f2f2f2f2f2f2f3,84,11,16,9,87,75,12,94.0,47,47,23,151,9.0,60,11,51,2.2,21,2028,30,105100.0,25,94.0,sous station,9.4,202.5,23.0,60.0,16/11,16/11/2028,21:30,2028-11-16T21:30:00,25.12,267125272015603,2028-11-16T21:30:00+00:00,2028-11-16T21:30:00+01:00,2028-11-16T21:30:00+00:00,2028-11-16T21:30:00+00:00
aa7094f2f2f2f2f2f2f2f2f3,85,3,16,9,39,75,12,94.0,47,47,23,151,9.0,60,11,51,2.2,9,2028,30,105100.0,25,94.0,sous station,9.4,202.5,23.0,60.0,16/3,16/3/2028,9:30,2028-03-16T09:30:00,25.12,267125272015603,2028-03-16T09:30:00+00:00,2028-03-16T09:30:00+01:00,2028-03-16T09:30:00+00:00,2028-03-16T09:30:00+00:00
aa7492f2f2f2f2f2f2f2f2f3,85,3,20,9,23,75,12,94.0,47,47,23,151,9.0,60,11,51,2.2,5,2028,30,105100.0,25,94.0,sous station,9.4,202.5,23.0,60.0,20/3,20/3/2028,5:30,2028-03-20T05:30:00,25.12,267125272015603,2028-03-20T05:30:00+00:00,2028-03-20T05:30:00+01:00,2028-03-20T05:30:00+00:00,2028-03-20T05:30:00+00:00
aab4b8f2f2f2f2f2f2f2f2f3,85,5,20,11,71,75,12,94.0,47,47,23,151,9.0,60,11,51,2.2,17,2030,30,105100.0,25,94.0,sous station,9.4,202.5,23.0,60.0,20/5,20/5/2030,17:30,2030-05-20T17:30:00,25.12,267125272015603,2030-05-20T17:30:00+00:00,2030-05-20T17:30:00+02:00,2030-05-20T17:30:00+00:00,2030-05-20T17:30:00+00:00
ae5472f2f2f2f2f2f2f2f2f3,87,2,20,7,23,75,12,94.0,47,47,23,151,9.0,60,11,51,2.2,5,2026,30,105100.0,25,94.0,sous station,9.4,202.5,23.0,60.0,20/2,20/2/2026,5:30,2026-02-20T05:30:00,25.12,267125272015603,2026-02-20T05:30:00+00:00,2026-02-20T05:30:00+01:00,2026-02-20T05:30:00+00:00,2026-02-20T05:30:00+00:00
aadcb6f2f2f2f2f2f2f2f2f3,85,6,28,11,55,75,12,94.0,47,47,23,151,9.0,60,11,51,2.2,13,2030,30,105100.0,25,94.0,sous station,9.4,202.5,23.0,60.0,28/6,28/6/2030,13:30,2030-06-28T13:30:00,25.12,267125272015603,2030-06-28T13:30:00+00:00,2030-06-28T13:30:00+02:00,2030-06-28T13:30:00+00:00,2030-06-28T13:30:00+00:00
a8ac80f2f2f2f2f2f2f2f2f3,84,5,12,8,7,75,12,94.0,47,47,23,151,9.0,60,11,51,2.2,1,2027,30,105100.0,25,94.0,sous station,9.4,202.5,23.0,60.0,12/5,12/5/2027,1:30,2027-05-12T01:30:00,25.12,267125272015603,2027-05-12T01:30:00+00:00,2027-05-12T01:30:00+02:00,2027-05-12T01:30:00+00:00,2027-05-12T01:30:00+00:00
a98c80f2f2f2f2f2f2f2f2f3,84,12,12,8,7,75,12,94.0,47,47,23,151,9.0,60,11,51,2.2,1,2027,30,105100.0,25,94.0,sous station,9.4,202.5,23.0,60.0,12/12,12/12/2027,1:30,2027-12-12T01:30:00,25.12,267125272015603,2027-12-12T01:30:00+00:00,2027-12-12T01:30:00+01:00,2027-12-12T01:30:00+00:00,2027-12-12T01:30:00+00:00
aa9cb6f2f2f2f2f2f2f2f2f3,85,4,28,11,55,75,12,94.0,47,47,23,151,9.0,60,11,51,2.2,13,2030,30,105100.0,25,94.0,sous station,9.4,202.5,23.0,60.0,28/4,28/4/2030,13:30,2030-04-28T13:30:00,25.12,267125272015603,2030-04-28T13:30:00+00:00,2030-04-28T13:30:00+02:00,2030-04-28T13:30:00+00:00,2030-04-28T13:30:00+00:00
a92494f2f2f2f2f2f2f2f2f3,84,9,4,9,39,75,12,94.0,47,47,23,151,9.0,60,11,51,2.2,9,2028,30,105100.0,25,94.0,sous station,9.4,202.5,23.0,60.0,4/9,4/9/2028,9:30,2028-09-04T09:30:00,25.12,267125272015603,2028-09-04T09:30:00+00:00,2028-09-04T09:30:00+02:00,2028-09-04T09:30:00+00:00,2028-09-04T09:30:00+00:00
a918b8f2f2f2f2f2f2f2f2f3,84,8,24,11,71,75,12,94.0,47,47,23,151,9.0,60,11,51,2.2,17,2030,30,105100.0,25,94.0,sous station,9.4,202.5,23.0,60.0,24/8,24/8/2030,17:30,2030-08-24T17:30:00,25.12,267125272015603,2030-08-24T17:30:00+00:00,2030-08-24T17:30:00+02:00,2030-08-24T17:30:00+00:00,2030-08-24T17:30:00+00:00
a96cb8f2f2f2f2f2f2f2f2f3,84,11,12,11,71,75,12,94.0,47,47,23,151,9.0,60,11,51,2.2,17,2030,30,105100.0,25,94.0,sous station,9.4,202.5,23.0,60.0,12/11,12/11/2030,17:30,2030-11-12T17:30:00,25.12,267125272015603,2030-11-12T17:30:00+00:00,2030-11-12T17:30:00+01:00,2030-11-12T17:30:00+00:00,2030-11-12T17:30:00+00:00
a970b2f2f2f2f2f2f2f2f2f3,84,11,16,11,23,75,12,94.0,47,47,23,151,9.0,60,11,51,2.2,5,2030,30,105100.0,25,94.0,sous station,9.4,202.5,23.0,60.0,16/11,16/11/2030,5:30,2030-11-16T05:30:00,25.12,267125272015603,2030-11-16T05:30:00+00:00,2030-11-16T05:30:00+01:00,2030-11-16T05:30:00+00:00,2030-11-16T05:30:00+00:00
a96c96f2f2f2f2f2f2f2f2f3,84,11,12,9,55,75,12,94.0,47,47,23,151,9.0,60,11,51,2.2,13,2028,30,105100.0,25,94.0,sous station,9.4,202.5,23.0,60.0,12/11,12/11/2028,13:30,2028-11-12T13:30:00,25.12,267125272015603,2028-11-12T13:30:00+00:00,2028-11-12T13:30:00+01:00,2028-11-12T13:30:00+00:00,2028-11-12T13:30:00+00:00
a96c98f2f2f2f2f2f2f2f2f3,84,11,12,9,71,75,12,94.0,47,47,23,151,9.0,60,11,51,2.2,17,2028,30,105100.0,25,94.0,sous station,9.4,202.5,23.0,60.0,12/11,12/11/2028,17:30,2028-11-12T17:30:00,25.12,267125272015603,2028-11-12T17:30:00+00:00,2028-11-12T17:30:00+01:00,2028-11-12T17:30:00+00:00,2028-11-12T17:30:00+00:00
ab0c96f2f2f2f2f2f2f2f2f3,85,8,12,9,55,75,12,94.0,47,47,23,151,9.0,60,11,51,2.2,13,2028,30,105100.0,25,94.0,sous station,9.4,202.5,23.0,60.0,12/8,12/8/2028,13:30,2028-08-12T13:30:00,25.12,267125272015603,2028-08-12T13:30:00+00:00,2028-08-12T13:30:00+02:00,2028-08-12T13:30:00+00:00,2028-08-12T13:30:00+00:00
ab10b6f2f2f2f2f2f2f2f2f3,85,8,16,11,55,75,12,94.0,47,47,23,151,9.0,60,11,51,2.2,13,2030,30,105100.0,25,94.0,sous station,9.4,202.5,23.0,60.0,16/8,16/8/2030,13:30,2030-08-16T13:30:00,25.12,267125272015603,2030-08-16T13:30:00+00:00,2030-08-16T13:30:00+02:00,2030-08-16T13:30:00+00:00,2030-08-16T13:30:00+00:00
a95896f2f2f2f2f2f2f2f2f3,84,10,24,9,55,75,12,94.0,47,47,23,151,9.0,60,11,51,2.2,13,2028,30,105100.0,25,94.0,sous station,9.4,202.5,23.0,60.0,24/10,24/10/2028,13:30,2028-10-24T13:30:00,25.12,267125272015603,2028-10-24T13:30:00+00:00,2028-10-24T13:30:00+02:00,2028-10-24T13:30:00+00:00,2028-10-24T13:30:00+00:00
a954b4f2f2f2f2f2f2f2f2f3,84,10,20,11,39,75,12,94.0,47,47,23,151,9.0,60,11,51,2.2,9,2030,30,105100.0,25,94.0,sous station,9.4,202.5,23.0,60.0,20/10,20/10/2030,9:30,2030-10-20T09:30:00,25.12,267125272015603,2030-10-20T09:30:00+00:00,2030-10-20T09:30:00+02:00,2030-10-20T09:30:00+00:00,2030-10-20T09:30:00+00:00
a888b6f2f2f2f2f2f2f2f2f3,84,4,8,11,55,75,12,94.0,47,47,23,151,9.0,60,11,51,2.2,13,2030,30,105100.0,25,94.0,sous station,9.4,202.5,23.0,60.0,8/4,8/4/2030,13:30,2030-04-08T13:30:00,25.12,267125272015603,2030-04-08T13:30:00+00:00,2030-04-08T13:30:00+02:00,2030-04-08T13:30:00+00:00,2030-04-08T13:30:00+00:00
aa6880f2f2f2f2f2f2f2f2f3,85,3,8,8,7,75,12,94.0,47,47,23,151,9.0,60,11,51,2.2,1,2027,30,105100.0,25,94.0,sous station,9.4,202.5,23.0,60.0,8/3,8/3/2027,1:30,2027-03-08T01:30:00,25.12,267125272015603,2027-03-08T01:30:00+00:00,2027-03-08T01:30:00+01:00,2027-03-08T01:30:00+00:00,2027-03-08T01:30:00+00:00
aa6894f2f2f2f2f2f2f2f2f3,85,3,8,9,39,75,12,94.0,47,47,23,151,9.0,60,11,51,2.2,9,2028,30,105100.0,25,94.0,sous station,9.4,202.5,23.0,60.0,8/3,8/3/2028,9:30,2028-03-08T09:30:00,25.12,267125272015603,2028-03-08T09:30:00+00:00,2028-03-08T09:30:00+01:00,2028-03-08T09:30:00+00:00,2028-03-08T09:30:00+00:00
aa6cb8f2f2f2f2f2f2f2f2f3,85,3,12,11,71,75,12,94.0,47,47,23,151,9.0,60,11,51,2.2,17,2030,30,105100.0,25,94.0,sous station,9.4,202.5,23.0,60.0,12/3,12/3/2030,17:30,2030-03-12T17:30:00,25.12,267125272015603,2030-03-12T17:30:00+00:00,2030-03-12T17:30:00+01:00,2030-03-12T17:30:00+00:00,2030-03-12T17:30:00+00:00
aaa8b2f2f2f2f2f2f2f2f2f3,85,5,8,11,23,75,12,94.0,47,47,23,151,9.0,60,11,51,2.2,5,2030,30,105100.0,25,94.0,sous station,9.4,202.5,23.0,60.0,8/5,8/5/2030,5:30,2030-05-08T05:30:00,25.12,267125272015603,2030-05-08T05:30:00+00:00,2030-05-08T05:30:00+02:00,2030-05-08T05:30:00+00:00,2030-05-08T05:30:00+00:00
aab0a6f2f2f2f2f2f2f2f2f3,85,5,16,10,55,75,12,94.0,47,47,23,151,9.0,60,11,51,2.2,13,2029,30,105100.0,25,94.0,sous station,9.4,202.5,23.0,60.0,16/5,16/5/2029,13:30,2029-05-16T13:30:00,25.12,267125272015603,2029-05-16T13:30:00+00:00,2029-05-16T13:30:00+02:00,2029-05-16T13:30:00+00:00,2029-05-16T13:30:00+00:00
a8cc9af2f2f2f2f2f2f2f2f3,84,6,12,9,87,75,12,94.0,47,47,23,151,9.0,60,11,51,2.2,21,2028,30,105100.0,25,94.0,sous station,9.4,202.5,23.0,60.0,12/6,12/6/2028,21:30,2028-06-12T21:30:00,25.12,267125272015603,2028-06-12T21:30:00+00:00,2028-06-12T21:30:00+02:00,2028-06-12T21:30:00+00:00,2028-06-12T21:30:00+00:00
ab64a6f2f2f2f2f2f2f2f2f3,85,11,4,10,55,75,12,94.0,47,47,23,151,9.0,60,11,51,2.2,13,2029,30,105100.0,25,94.0,sous station,9.4,202.5,23.0,60.0,4/11,4/11/2029,13:30,2029-11-04T13:30:00,25.12,267125272015603,2029-11-04T13:30:00+00:00,2029-11-04T13:30:00+01:00,2029-11-04T13:30:00+00:00,2029-11-04T13:30:00+00:00
ab64b2f2f2f2f2f2f2f2f2f3,85,11,4,11,23,75,12,94.0,47,47,23,151,9.0,60,11,51,2.2,5,2030,30,105100.0,25,94.0,sous station,9.4,202.5,23.0,60.0,4/11,4/11/2030,5:30,2030-11-04T05:30:00,25.12,267125272015603,2030-11-04T05:30:00+00:00,2030-11-04T05:30:00+01:00,2030-11-04T05:30:00+00:00,2030-11-04T05:30:00+00:00
ab6c92f2f2f2f2f2f2f2f2f3,85,11,12,9,23,75,12,94.0,47,47,23,151,9.0,60,11,51,2.2,5,2028,30,105100.0,25,94.0,sous station,9.4,202.5,23.0,60.0,12/11,12/11/2028,5:30,2028-11-12T05:30:00,25.12,267125272015603,2028-11-12T05:30:00+00:00,2028-11-12T05:30:00+01:00,2028-11-12T05:30:00+00:00,2028-11-12T05:30:00+00:00
ab6cb0f2f2f2f2f2f2f2f2f3,85,11,12,11,7,75,12,94.0,47,47,23,151,9.0,60,11,51,2.2,1,2030,30,105100.0,25,94.0,sous station,9.4,202.5,23.0,60.0,12/11,12/11/2030,1:30,2030-11-12T01:30:00,25.12,267125272015603,2030-11-12T01:30:00+00:00,2030-11-12T01:30:00+01:00,2030-11-12T01:30:00+00:00,2030-11-12T01:30:00+00:00
aadc88f2f2f2f2f2f2f2f2f3,85,6,28,8,71,75,12,94.0,47,47,23,151,9.0,60,11,51,2.2,17,2027,30,105100.0,25,94.0,sous station,9.4,202.5,23.0,60.0,28/6,28/6/2027,17:30,2027-06-28T17:30:00,25.12,267125272015603,2027-06-28T17:30:00+00:00,2027-06-28T17:30:00+02:00,2027-06-28T17:30:00+00:00,2027-06-28T17:30:00+00:00
ab74a4f2f2f2f2f2f2f2f2f3,85,11,20,10,39,75,12,94.0,47,47,23,151,9.0,60,11,51,2.2,9,2029,30,105100.0,25,94.0,sous station,9.4,202.5,23.0,60.0,20/11,20/11/2029,9:30,2029-11-20T09:30:00,25.12,267125272015603,2029-11-20T09:30:00+00:00,2029-11-20T09:30:00+01:00,2029-11-20T09:30:00+00:00,2029-11-20T09:30:00+00:00
ab7898f2f2f2f2f2f2f2f2f3,85,11,24,9,71,75,12,94.0,47,47,23,151,9.0,60,11,51,2.2,17,2028,30,105100.0,25,94.0,sous station,9.4,202.5,23.0,60.0,24/11,24/11/2028,17:30,2028-11-24T17:30:00,25.12,267125272015603,2028-11-24T17:30:00+00:00,2028-11-24T17:30:00+01:00,2028-11-24T17:30:00+00:00,2028-11-24T17:30:00+00:00
ab8ca0f2f2f2f2f2f2f2f2f3,85,12,12,10,7,75,12,94.0,47,47,23,151,9.0,60,11,51,2.2,1,2029,30,105100.0,25,94.0,sous station,9.4,202.5,23.0,60.0,12/12,12/12/2029,1:30,2029-12-12T01:30:00,25.12,267125272015603,2029-12-12T01:30:00+00:00,2029-12-12T01:30:00+01:00,2029-12-12T01:30:00+00:00,2029-12-12T01:30:00+00:00
ab8cb4f2f2f2f2f2f2f2f2f3,85,12,12,11,39,75,12,94.0,47,47,23,151,9.0,60,11,51,2.2,9,2030,30,105100.0,25,94.0,sous station,9.4,202.5,23.0,60.0,12/12,12/12/2030,9:30,2030-12-12T09:30:00,25.12,267125272015603,2030-12-12T09:30:00+00:00,2030-12-12T09:30:00+01:00,2030-12-12T09:30:00+00:00,2030-12-12T09:30:00+00:00
ab9c86f2f2f2f2f2f2f2f2f3,85,12,28,8,55,75,12,94.0,47,47,23,151,9.0,60,11,51,2.2,13,2027,30,105100.0,25,94.0,sous station,9.4,202.5,23.0,60.0,28/12,28/12/2027,13:30,2027-12-28T13:30:00,25.12,267125272015603,2027-12-28T13:30:00+00:00,2027-12-28T13:30:00+01:00,2027-12-28T13:30:00+00:00,2027-12-28T13:30:00+00:00
aa48a2f2f2f2f2f2f2f2f2f3,85,2,8,10,23,75,12,94.0,47,47,23,151,9.0,60,11,51,2.2,5,2029,30,105100.0,25,94.0,sous station,9.4,202.5,23.0,60.0,8/2,8/2/2029,5:30,2029-02-08T05:30:00,25.12,267125272015603,2029-02-08T05:30:00+00:00,2029-02-08T05:30:00+01:00,2029-02-08T05:30:00+00:00,2029-02-08T05:30:00+00:00
ac24baf2f2f2f2f2f2f2f2f3,86,1,4,11,87,75,12,94.0,47,47,23,151,9.0,60,11,51,2.2,21,2030,30,105100.0,25,94.0,sous station,9.4,202.5,23.0,60.0,4/1,4/1/2030,21:30,2030-01-04T21:30:00,25.12,267125272015603,2030-01-04T21:30:00+00:00,2030-01-04T21:30:00+01:00,2030-01-04T21:30:00+00:00,2030-01-04T21:30:00+00:00
aa4ca4f2f2f2f2f2f2f2f2f3,85,2,12,10,39,75,12,94.0,47,47,23,151,9.0,60,11,51,2.2,9,2029,30,105100.0,25,94.0,sous station,9.4,202.5,23.0,60.0,12/2,12/2/2029,9:30,2029-02-12T09:30:00,25.12,267125272015603,2029-02-12T09:30:00+00:00,2029-02-12T09:30:00+01:00,2029-02-12T09:30:00+00:00,2029-02-12T09:30:00+00:00
aa48aaf2f2f2f2f2f2f2f2f3,85,2,8,10,87,75,12,94.0,47,47,23,151,9.0,60,11,51,2.2,21,2029,30,105100.0,25,94.0,sous station,9.4,202.5,23.0,60.0,8/2,8/2/2029,21:30,2029-02-08T21:30:00,25.12,267125272015603,2029-02-08T21:30:00+00:00,2029-02-08T21:30:00+01:00,2029-02-08T21:30:00+00:00,2029-02-08T21:30:00+00:00
aa4cb4f2f2f2f2f2f2f2f2f3,85,2,12,11,39,75,12,94.0,47,47,23,151,9.0,60,11,51,2.2,9,2030,30,105100.0,25,94.0,sous station,9.4,202.5,23.0,60.0,12/2,12/2/2030,9:30,2030-02-12T09:30:00,25.12,267125272015603,2030-02-12T09:30:00+00:00,2030-02-12T09:30:00+01:00,2030-02-12T09:30:00+00:00,2030-02-12T09:30:00+00:00
aa5896f2f2f2f2f2f2f2f2f3,85,2,24,9,55,75,12,94.0,47,47,23,151,9.0,60,11,51,2.2,13,2028,30,105100.0,25,94.0,sous station,9.4,202.5,23.0,60.0,24/2,24/2/2028,13:30,2028-02-24T13:30:00,25.12,267125272015603,2028-02-24T13:30:00+00:00,2028-02-24T13:30:00+01:00,2028-02-24T13:30:00+00:00,2028-02-24T13:30:00+00:00
aa648af2f2f2f2f2f2f2f2f3,85,3,4,8,87,75,12,94.0,47,47,23,151,9.0,60,11,51,2.2,21,2027,30,105100.0,25,94.0,sous station,9.4,202.5,23.0,60.0,4/3,4/3/2027,21:30,2027-03-04T21:30:00,25.12,267125272015603,2027-03-04T21:30:00+00:00,2027-03-04T21:30:00+01:00,2027-03-04T21:30:00+00:00,2027-03-04T21:30:00+00:00
aa64b2f2f2f2f2f2f2f2f2f3,85,3,4,11,23,75,12,94.0,47,47,23,151,9.0,60,11,51,2.2,5,2030,30,105100.0,25,94.0,sous station,9.4,202.5,23.0,60.0,4/3,4/3/2030,5:30,2030-03-04T05:30:00,25.12,267125272015603,2030-03-04T05:30:00+00:00,2030-03-04T05:30:00+01:00,2030-03-04T05:30:00+00:00,2030-03-04T05:30:00+00:00
aae4a6f2f2f2f2f2f2f2f2f3,85,7,4,10,55,75,12,94.0,47,47,23,151,9.0,60,11,51,2.2,13,2029,30,105100.0,25,94.0,sous station,9.4,202.5,23.0,60.0,4/7,4/7/2029,13:30,2029-07-04T13:30:00,25.12,267125272015603,2029-07-04T13:30:00+00:00,2029-07-04T13:30:00+02:00,2029-07-04T13:30:00+00:00,2029-07-04T13:30:00+00:00
aafc86f2f2f2f2f2f2f2f2f3,85,7,28,8,55,75,12,94.0,47,47,23,151,9.0,60,11,51,2.2,13,2027,30,105100.0,25,94.0,sous station,9.4,202.5,23.0,60.0,28/7,28/7/2027,13:30,2027-07-28T13:30:00,25.12,267125272015603,2027-07-28T13:30:00+00:00,2027-07-28T13:30:00+02:00,2027-07-28T13:30:00+00:00,2027-07-28T13:30:00+00:00
a928a0f2f2f2f2f2f2f2f2f3,84,9,8,10,7,75,12,94.0,47,47,23,151,9.0,60,11,51,2.2,1,2029,30,105100.0,25,94.0,sous station,9.4,202.5,23.0,60.0,8/9,8/9/2029,1:30,2029-09-08T01:30:00,25.12,267125272015603,2029-09-08T01:30:00+00:00,2029-09-08T01:30:00+02:00,2029-09-08T01:30:00+00:00,2029-09-08T01:30:00+00:00
a92c84f2f2f2f2f2f2f2f2f3,84,9,12,8,39,75,12,94.0,47,47,23,151,9.0,60,11,51,2.2,9,2027,30,105100.0,25,94.0,sous station,9.4,202.5,23.0,60.0,12/9,12/9/2027,9:30,2027-09-12T09:30:00,25.12,267125272015603,2027-09-12T09:30:00+00:00,2027-09-12T09:30:00+02:00,2027-09-12T09:30:00+00:00,2027-09-12T09:30:00+00:00
ae7074f2f2f2f2f2f2f2f2f3,87,3,16,7,39,75,12,94.0,47,47,23,151,9.0,60,11,51,2.2,9,2026,30,105100.0,25,94.0,sous station,9.4,202.5,23.0,60.0,16/3,16/3/2026,9:30,2026-03-16T09:30:00,25.12,267125272015603,2026-03-16T09:30:00+00:00,2026-03-16T09:30:00+01:00,2026-03-16T09:30:00+00:00,2026-03-16T09:30:00+00:00
ab6884f2f2f2f2f2f2f2f2f3,85,11,8,8,39,75,12,94.0,47,47,23,151,9.0,60,11,51,2.2,9,2027,30,105100.0,25,94.0,sous station,9.4,202.5,23.0,60.0,8/11,8/11/2027,9:30,2027-11-08T09:30:00,25.12,267125272015603,2027-11-08T09:30:00+00:00,2027-11-08T09:30:00+01:00,2027-11-08T09:30:00+00:00,2027-11-08T09:30:00+00:00
aaa488f2f2f2f2f2f2f2f2f3,85,5,4,8,71,75,12,94.0,47,47,23,151,9.0,60,11,51,2.2,17,2027,30,105100.0,25,94.0,sous station,9.4,202.5,23.0,60.0,4/5,4/5/2027,17:30,2027-05-04T17:30:00,25.12,267125272015603,2027-05-04T17:30:00+00:00,2027-05-04T17:30:00+02:00,2027-05-04T17:30:00+00:00,2027-05-04T17:30:00+00:00
aad8b0f2f2f2f2f2f2f2f2f3,85,6,24,11,7,75,12,94.0,47,47,23,151,9.0,60,11,51,2.2,1,2030,30,105100.0,25,94.0,sous station,9.4,202.5,23.0,60.0,24/6,24/6/2030,1:30,2030-06-24T01:30:00,25.12,267125272015603,2030-06-24T01:30:00+00:00,2030-06-24T01:30:00+02:00,2030-06-24T01:30:00+00:00,2030-06-24T01:30:00+00:00
aadc92f2f2f2f2f2f2f2f2f3,85,6,28,9,23,75,12,94.0,47,47,23,151,9.0,60,11,51,2.2,5,2028,30,105100.0,25,94.0,sous station,9.4,202.5,23.0,60.0,28/6,28/6/2028,5:30,2028-06-28T05:30:00,25.12,267125272015603,2028-06-28T05:30:00+00:00,2028-06-28T05:30:00+02:00,2028-06-28T05:30:00+00:00,2028-06-28T05:30:00+00:00
aadc9af2f2f2f2f2f2f2f2f3,85,6,28,9,87,75,12,94.0,47,47,23,151,9.0,60,11,51,2.2,21,2028,30,105100.0,25,94.0,sous station,9.4,202.5,23.0,60.0,28/6,28/6/2028,21:30,2028-06-28T21:30:00,25.12,267125272015603,2028-06-28T21:30:00+00:00,2028-06-28T21:30:00+02:00,2028-06-28T21:30:00+00:00,2028-06-28T21:30:00+00:00
aadcbaf2f2f2f2f2f2f2f2f3,85,6,28,11,87,75,12,94.0,47,47,23,151,9.0,60,11,51,2.2,21,2030,30,105100.0,25,94.0,sous station,9.4,202.5,23.0,60.0,28/6,28/6/2030,21:30,2030-06-28T21:30:00,25.12,267125272015603,2030-06-28T21:30:00+00:00,2030-06-28T21:30:00+02:00,2030-06-28T21:30:00+00:00,2030-06-28T21:30:00+00:00
ab90a0f2f2f2f2f2f2f2f2f3,85,12,16,10,7,75,12,94.0,47,47,23,151,9.0,60,11,51,2.2,1,2029,30,105100.0,25,94.0,sous station,9.4,202.5,23.0,60.0,16/12,16/12/2029,1:30,2029-12-16T01:30:00,25.12,267125272015603,2029-12-16T01:30:00+00:00,2029-12-16T01:30:00+01:00,2029-12-16T01:30:00+00:00,2029-12-16T01:30:00+00:00
ab90b6f2f2f2f2f2f2f2f2f3,85,12,16,11,55,75,12,94.0,47,47,23,151,9.0,60,11,51,2.2,13,2030,30,105100.0,25,94.0,sous station,9.4,202.5,23.0,60.0,16/12,16/12/2030,13:30,2030-12-16T13:30:00,25.12,267125272015603,2030-12-16T13:30:00+00:00,2030-12-16T13:30:00+01:00,2030-12-16T13:30:00+00:00,2030-12-16T13:30:00+00:00
a898a0f2f2f2f2f2f2f2f2f3,84,4,24,10,7,75,12,94.0,47,47,23,151,9.0,60,11,51,2.2,1,2029,30,105100.0,25,94.0,sous station,9.4,202.5,23.0,60.0,24/4,24/4/2029,1:30,2029-04-24T01:30:00,25.12,267125272015603,2029-04-24T01:30:00+00:00,2029-04-24T01:30:00+02:00,2029-04-24T01:30:00+00:00,2029-04-24T01:30:00+00:00
ab0ca0f2f2f2f2f2f2f2f2f3,85,8,12,10,7,75,12,94.0,47,47,23,151,9.0,60,11,51,2.2,1,2029,30,105100.0,25,94.0,sous station,9.4,202.5,23.0,60.0,12/8,12/8/2029,1:30,2029-08-12T01:30:00,25.12,267125272015603,2029-08-12T01:30:00+00:00,2029-08-12T01:30:00+02:00,2029-08-12T01:30:00+00:00,2029-08-12T01:30:00+00:00
ab6ca2f2f2f2f2f2f2f2f2f3,85,11,12,10,23,75,12,94.0,47,47,23,151,9.0,60,11,51,2.2,5,2029,30,105100.0,25,94.0,sous station,9.4,202.5,23.0,60.0,12/11,12/11/2029,5:30,2029-11-12T05:30:00,25.12,267125272015603,2029-11-12T05:30:00+00:00,2029-11-12T05:30:00+01:00,2029-11-12T05:30:00+00:00,2029-11-12T05:30:00+00:00
ab8892f2f2f2f2f2f2f2f2f3,85,12,8,9,23,75,12,94.0,47,47,23,151,9.0,60,11,51,2.2,5,2028,30,105100.0,25,94.0,sous station,9.4,202.5,23.0,60.0,8/12,8/12/2028,5:30,2028-12-08T05:30:00,25.12,267125272015603,2028-12-08T05:30:00+00:00,2028-12-08T05:30:00+01:00,2028-12-08T05:30:00+00:00,2028-12-08T05:30:00+00:00
ae4870f2f2f2f2f2f2f2f2f3,87,2,8,7,7,75,12,94.0,47,47,23,151,9.0,60,11,51,2.2,1,2026,30,105100.0,25,94.0,sous station,9.4,202.5,23.0,60.0,8/2,8/2/2026,1:30,2026-02-08T01:30:00,25.12,267125272015603,2026-02-08T01:30:00+00:00,2026-02-08T01:30:00+01:00,2026-02-08T01:30:00+00:00,2026-02-08T01:30:00+00:00
aad4b4f2f2f2f2f2f2f2f2f3,85,6,20,11,39,75,12,94.0,47,47,23,151,9.0,60,11,51,2.2,9,2030,30,105100.0,25,94.0,sous station,9.4,202.5,23.0,60.0,20/6,20/6/2030,9:30,2030-06-20T09:30:00,25.12,267125272015603,2030-06-20T09:30:00+00:00,2030-06-20T09:30:00+02:00,2030-06-20T09:30:00+00:00,2030-06-20T09:30:00+00:00
a8f4b4f2f2f2f2f2f2f2f2f3,84,7,20,11,39,75,12,94.0,47,47,23,151,9.0,60,11,51,2.2,9,2030,30,105100.0,25,94.0,sous station,9.4,202.5,23.0,60.0,20/7,20/7/2030,9:30,2030-07-20T09:30:00,25.12,267125272015603,2030-07-20T09:30:00+00:00,2030-07-20T09:30:00+02:00,2030-07-20T09:30:00+00:00,2030-07-20T09:30:00+00:00
a95094f2f2f2f2f2f2f2f2f3,84,10,16,9,39,75,12,94.0,47,47,23,151,9.0,60,11,51,2.2,9,2028,30,105100.0,25,94.0,sous station,9.4,202.5,23.0,60.0,16/10,16/10/2028,9:30,2028-10-16T09:30:00,25.12,267125272015603,2028-10-16T09:30:00+00:00,2028-10-16T09:30:00+02:00,2028-10-16T09:30:00+00:00,2028-10-16T09:30:00+00:00
ae3474f2f2f2f2f2f2f2f2f3,87,1,20,7,39,75,12,94.0,47,47,23,151,9.0,60,11,51,2.2,9,2026,30,105100.0,25,94.0,sous station,9.4,202.5,23.0,60.0,20/1,20/1/2026,9:30,2026-01-20T09:30:00,25.12,267125272015603,2026-01-20T09:30:00+00:00,2026-01-20T09:30:00+01:00,2026-01-20T09:30:00+00:00,2026-01-20T09:30:00+00:00
a96cb0f2f2f2f2f2f2f2f2f3,84,11,12,11,7,75,12,94.0,47,47,23,151,9.0,60,11,51,2.2,1,2030,30,105100.0,25,94.0,sous station,9.4,202.5,23.0,60.0,12/11,12/11/2030,1:30,2030-11-12T01:30:00,25.12,267125272015603,2030-11-12T01:30:00+00:00,2030-11-12T01:30:00+01:00,2030-11-12T01:30:00+00:00,2030-11-12T01:30:00+00:00
ab6494f2f2f2f2f2f2f2f2f3,85,11,4,9,39,75,12,94.0,47,47,23,151,9.0,60,11,51,2.2,9,2028,30,105100.0,25,94.0,sous station,9.4,202.5,23.0,60.0,4/11,4/11/2028,9:30,2028-11-04T09:30:00,25.12,267125272015603,2028-11-04T09:30:00+00:00,2028-11-04T09:30:00+01:00,2028-11-04T09:30:00+00:00,2028-11-04T09:30:00+00:00
ab64a4f2f2f2f2f2f2f2f2f3,85,11,4,10,39,75,12,94.0,47,47,23,151,9.0,60,11,51,2.2,9,2029,30,105100.0,25,94.0,sous station,9.4,202.5,23.0,60.0,4/11,4/11/2029,9:30,2029-11-04T09:30:00,25.12,267125272015603,2029-11-04T09:30:00+00:00,2029-11-04T09:30:00+01:00,2029-11-04T09:30:00+00:00,2029-11-04T09:30:00+00:00
ab64baf2f2f2f2f2f2f2f2f3,85,11,4,11,87,75,12,94.0,47,47,23,151,9.0,60,11,51,2.2,21,2030,30,105100.0,25,94.0,sous station,9.4,202.5,23.0,60.0,4/11,4/11/2030,21:30,2030-11-04T21:30:00,25.12,267125272015603,2030-11-04T21:30:00+00:00,2030-11-04T21:30:00+01:00,2030-11-04T21:30:00+00:00,2030-11-04T21:30:00+00:00
aad8baf2f2f2f2f2f2f2f2f3,85,6,24,11,87,75,12,94.0,47,47,23,151,9.0,60,11,51,2.2,21,2030,30,105100.0,25,94.0,sous station,9.4,202.5,23.0,60.0,24/6,24/6/2030,21:30,2030-06-24T21:30:00,25.12,267125272015603,2030-06-24T21:30:00+00:00,2030-06-24T21:30:00+02:00,2030-06-24T21:30:00+00:00,2030-06-24T21:30:00+00:00
ab9cb2f2f2f2f2f2f2f2f2f3,85,12,28,11,23,75,12,94.0,47,47,23,151,9.0,60,11,51,2.2,5,2030,30,105100.0,25,94.0,sous station,9.4,202.5,23.0,60.0,28/12,28/12/2030,5:30,2030-12-28T05:30:00,25.12,267125272015603,2030-12-28T05:30:00+00:00,2030-12-28T05:30:00+01:00,2030-12-28T05:30:00+00:00,2030-12-28T05:30:00+00:00
ab84a4f2f2f2f2f2f2f2f2f3,85,12,4,10,39,75,12,94.0,47,47,23,151,9.0,60,11,51,2.2,9,2029,30,105100.0,25,94.0,sous station,9.4,202.5,23.0,60.0,4/12,4/12/2029,9:30,2029-12-04T09:30:00,25.12,267125272015603,2029-12-04T09:30:00+00:00,2029-12-04T09:30:00+01:00,2029-12-04T09:30:00+00:00,2029-12-04T09:30:00+00:00
ab84baf2f2f2f2f2f2f2f2f3,85,12,4,11,87,75,12,94.0,47,47,23,151,9.0,60,11,51,2.2,21,2030,30,105100.0,25,94.0,sous station,9.4,202.5,23.0,60.0,4/12,4/12/2030,21:30,2030-12-04T21:30:00,25.12,267125272015603,2030-12-04T21:30:00+00:00,2030-12-04T21:30:00+01:00,2030-12-04T21:30:00+00:00,2030-12-04T21:30:00+00:00
ab8886f2f2f2f2f2f2f2f2f3,85,12,8,8,55,75,12,94.0,47,47,23,151,9.0,60,11,51,2.2,13,2027,30,105100.0,25,94.0,sous station,9.4,202.5,23.0,60.0,8/12,8/12/2027,13:30,2027-12-08T13:30:00,25.12,267125272015603,2027-12-08T13:30:00+00:00,2027-12-08T13:30:00+01:00,2027-12-08T13:30:00+00:00,2027-12-08T13:30:00+00:00
ab88baf2f2f2f2f2f2f2f2f3,85,12,8,11,87,75,12,94.0,47,47,23,151,9.0,60,11,51,2.2,21,2030,30,105100.0,25,94.0,sous station,9.4,202.5,23.0,60.0,8/12,8/12/2030,21:30,2030-12-08T21:30:00,25.12,267125272015603,2030-12-08T21:30:00+00:00,2030-12-08T21:30:00+01:00,2030-12-08T21:30:00+00:00,2030-12-08T21:30:00+00:00
ab8ca8f2f2f2f2f2f2f2f2f3,85,12,12,10,71,75,12,94.0,47,47,23,151,9.0,60,11,51,2.2,17,2029,30,105100.0,25,94.0,sous station,9.4,202.5,23.0,60.0,12/12,12/12/2029,17:30,2029-12-12T17:30:00,25.12,267125272015603,2029-12-12T17:30:00+00:00,2029-12-12T17:30:00+01:00,2029-12-12T17:30:00+00:00,2029-12-12T17:30:00+00:00
ab8cb6f2f2f2f2f2f2f2f2f3,85,12,12,11,55,75,12,94.0,47,47,23,151,9.0,60,11,51,2.2,13,2030,30,105100.0,25,94.0,sous station,9.4,202.5,23.0,60.0,12/12,12/12/2030,13:30,2030-12-12T13:30:00,25.12,267125272015603,2030-12-12T13:30:00+00:00,2030-12-12T13:30:00+01:00,2030-12-12T13:30:00+00:00,2030-12-12T13:30:00+00:00
ab94b4f2f2f2f2f2f2f2f2f3,85,12,20,11,39,75,12,94.0,47,47,23,151,9.0,60,11,51,2.2,9,2030,30,105100.0,25,94.0,sous station,9.4,202.5,23.0,60.0,20/12,20/12/2030,9:30,2030-12-20T09:30:00,25.12,267125272015603,2030-12-20T09:30:00+00:00,2030-12-20T09:30:00+01:00,2030-12-20T09:30:00+00:00,2030-12-20T09:30:00+00:00
ab9890f2f2f2f2f2f2f2f2f3,85,12,24,9,7,75,12,94.0,47,47,23,151,9.0,60,11,51,2.2,1,2028,30,105100.0,25,94.0,sous station,9.4,202.5,23.0,60.0,24/12,24/12/2028,1:30,2028-12-24T01:30:00,25.12,267125272015603,2028-12-24T01:30:00+00:00,2028-12-24T01:30:00+01:00,2028-12-24T01:30:00+00:00,2028-12-24T01:30:00+00:00
ab9c80f2f2f2f2f2f2f2f2f3,85,12,28,8,7,75,12,94.0,47,47,23,151,9.0,60,11,51,2.2,1,2027,30,105100.0,25,94.0,sous station,9.4,202.5,23.0,60.0,28/12,28/12/2027,1:30,2027-12-28T01:30:00,25.12,267125272015603,2027-12-28T01:30:00+00:00,2027-12-28T01:30:00+01:00,2027-12-28T01:30:00+00:00,2027-12-28T01:30:00+00:00
ab9c82f2f2f2f2f2f2f2f2f3,85,12,28,8,23,75,12,94.0,47,47,23,151,9.0,60,11,51,2.2,5,2027,30,105100.0,25,94.0,sous station,9.4,202.5,23.0,60.0,28/12,28/12/2027,5:30,2027-12-28T05:30:00,25.12,267125272015603,2027-12-28T05:30:00+00:00,2027-12-28T05:30:00+01:00,2027-12-28T05:30:00+00:00,2027-12-28T05:30:00+00:00
ab2882f2f2f2f2f2f2f2f2f3,85,9,8,8,23,75,12,94.0,47,47,23,151,9.0,60,11,51,2.2,5,2027,30,105100.0,25,94.0,sous station,9.4,202.5,23.0,60.0,8/9,8/9/2027,5:30,2027-09-08T05:30:00,25.12,267125272015603,2027-09-08T05:30:00+00:00,2027-09-08T05:30:00+02:00,2027-09-08T05:30:00+00:00,2027-09-08T05:30:00+00:00
a8f0aaf2f2f2f2f2f2f2f2f3,84,7,16,10,87,75,12,94.0,47,47,23,151,9.0,60,11,51,2.2,21,2029,30,105100.0,25,94.0,sous station,9.4,202.5,23.0,60.0,16/7,16/7/2029,21:30,2029-07-16T21:30:00,25.12,267125272015603,2029-07-16T21:30:00+00:00,2029-07-16T21:30:00+02:00,2029-07-16T21:30:00+00:00,2029-07-16T21:30:00+00:00
a8f0b4f2f2f2f2f2f2f2f2f3,84,7,16,11,39,75,12,94.0,47,47,23,151,9.0,60,11,51,2.2,9,2030,30,105100.0,25,94.0,sous station,9.4,202.5,23.0,60.0,16/7,16/7/2030,9:30,2030-07-16T09:30:00,25.12,267125272015603,2030-07-16T09:30:00+00:00,2030-07-16T09:30:00+02:00,2030-07-16T09:30:00+00:00,2030-07-16T09:30:00+00:00
a8e8b0f2f2f2f2f2f2f2f2f3,84,7,8,11,7,75,12,94.0,47,47,23,151,9.0,60,11,51,2.2,1,2030,30,105100.0,25,94.0,sous station,9.4,202.5,23.0,60.0,8/7,8/7/2030,1:30,2030-07-08T01:30:00,25.12,267125272015603,2030-07-08T01:30:00+00:00,2030-07-08T01:30:00+02:00,2030-07-08T01:30:00+00:00,2030-07-08T01:30:00+00:00
a8f8aaf2f2f2f2f2f2f2f2f3,84,7,24,10,87,75,12,94.0,47,47,23,151,9.0,60,11,51,2.2,21,2029,30,105100.0,25,94.0,sous station,9.4,202.5,23.0,60.0,24/7,24/7/2029,21:30,2029-07-24T21:30:00,25.12,267125272015603,2029-07-24T21:30:00+00:00,2029-07-24T21:30:00+02:00,2029-07-24T21:30:00+00:00,2029-07-24T21:30:00+00:00
a90894f2f2f2f2f2f2f2f2f3,84,8,8,9,39,75,12,94.0,47,47,23,151,9.0,60,11,51,2.2,9,2028,30,105100.0,25,94.0,sous station,9.4,202.5,23.0,60.0,8/8,8/8/2028,9:30,2028-08-08T09:30:00,25.12,267125272015603,2028-08-08T09:30:00+00:00,2028-08-08T09:30:00+02:00,2028-08-08T09:30:00+00:00,2028-08-08T09:30:00+00:00
a908a4f2f2f2f2f2f2f2f2f3,84,8,8,10,39,75,12,94.0,47,47,23,151,9.0,60,11,51,2.2,9,2029,30,105100.0,25,94.0,sous station,9.4,202.5,23.0,60.0,8/8,8/8/2029,9:30,2029-08-08T09:30:00,25.12,267125272015603,2029-08-08T09:30:00+00:00,2029-08-08T09:30:00+02:00,2029-08-08T09:30:00+00:00,2029-08-08T09:30:00+00:00
a948b6f2f2f2f2f2f2f2f2f3,84,10,8,11,55,75,12,94.0,47,47,23,151,9.0,60,11,51,2.2,13,2030,30,105100.0,25,94.0,sous station,9.4,202.5,23.0,60.0,8/10,8/10/2030,13:30,2030-10-08T13:30:00,25.12,267125272015603,2030-10-08T13:30:00+00:00,2030-10-08T13:30:00+02:00,2030-10-08T13:30:00+00:00,2030-10-08T13:30:00+00:00
aac496f2f2f2f2f2f2f2f2f3,85,6,4,9,55,75,12,94.0,47,47,23,151,9.0,60,11,51,2.2,13,2028,30,105100.0,25,94.0,sous station,9.4,202.5,23.0,60.0,4/6,4/6/2028,13:30,2028-06-04T13:30:00,25.12,267125272015603,2028-06-04T13:30:00+00:00,2028-06-04T13:30:00+02:00,2028-06-04T13:30:00+00:00,2028-06-04T13:30:00+00:00
a970baf2f2f2f2f2f2f2f2f3,84,11,16,11,87,75,12,94.0,47,47,23,151,9.0,60,11,51,2.2,21,2030,30,105100.0,25,94.0,sous station,9.4,202.5,23.0,60.0,16/11,16/11/2030,21:30,2030-11-16T21:30:00,25.12,267125272015603,2030-11-16T21:30:00+00:00,2030-11-16T21:30:00+01:00,2030-11-16T21:30:00+00:00,2030-11-16T21:30:00+00:00
a94482f2f2f2f2f2f2f2f2f3,84,10,4,8,23,75,12,94.0,47,47,23,151,9.0,60,11,51,2.2,5,2027,30,105100.0,25,94.0,sous station,9.4,202.5,23.0,60.0,4/10,4/10/2027,5:30,2027-10-04T05:30:00,25.12,267125272015603,2027-10-04T05:30:00+00:00,2027-10-04T05:30:00+02:00,2027-10-04T05:30:00+00:00,2027-10-04T05:30:00+00:00
a944a8f2f2f2f2f2f2f2f2f3,84,10,4,10,71,75,12,94.0,47,47,23,151,9.0,60,11,51,2.2,17,2029,30,105100.0,25,94.0,sous station,9.4,202.5,23.0,60.0,4/10,4/10/2029,17:30,2029-10-04T17:30:00,25.12,267125272015603,2029-10-04T17:30:00+00:00,2029-10-04T17:30:00+02:00,2029-10-04T17:30:00+00:00,2029-10-04T17:30:00+00:00
a94494f2f2f2f2f2f2f2f2f3,84,10,4,9,39,75,12,94.0,47,47,23,151,9.0,60,11,51,2.2,9,2028,30,105100.0,25,94.0,sous station,9.4,202.5,23.0,60.0,4/10,4/10/2028,9:30,2028-10-04T09:30:00,25.12,267125272015603,2028-10-04T09:30:00+00:00,2028-10-04T09:30:00+02:00,2028-10-04T09:30:00+00:00,2028-10-04T09:30:00+00:00
a95884f2f2f2f2f2f2f2f2f3,84,10,24,8,39,75,12,94.0,47,47,23,151,9.0,60,11,51,2.2,9,2027,30,105100.0,25,94.0,sous station,9.4,202.5,23.0,60.0,24/10,24/10/2027,9:30,2027-10-24T09:30:00,25.12,267125272015603,2027-10-24T09:30:00+00:00,2027-10-24T09:30:00+02:00,2027-10-24T09:30:00+00:00,2027-10-24T09:30:00+00:00
aabcb0f2f2f2f2f2f2f2f2f3,85,5,28,11,7,75,12,94.0,47,47,23,151,9.0,60,11,51,2.2,1,2030,30,105100.0,25,94.0,sous station,9.4,202.5,23.0,60.0,28/5,28/5/2030,1:30,2030-05-28T01:30:00,25.12,267125272015603,2030-05-28T01:30:00+00:00,2030-05-28T01:30:00+02:00,2030-05-28T01:30:00+00:00,2030-05-28T01:30:00+00:00
aabcbaf2f2f2f2f2f2f2f2f3,85,5,28,11,87,75,12,94.0,47,47,23,151,9.0,60,11,51,2.2,21,2030,30,105100.0,25,94.0,sous station,9.4,202.5,23.0,60.0,28/5,28/5/2030,21:30,2030-05-28T21:30:00,25.12,267125272015603,2030-05-28T21:30:00+00:00,2030-05-28T21:30:00+02:00,2030-05-28T21:30:00+00:00,2030-05-28T21:30:00+00:00
a95ca2f2f2f2f2f2f2f2f2f3,84,10,28,10,23,75,12,94.0,47,47,23,151,9.0,60,11,51,2.2,5,2029,30,105100.0,25,94.0,sous station,9.4,202.5,23.0,60.0,28/10,28/10/2029,5:30,2029-10-28T05:30:00,25.12,267125272015603,2029-10-28T05:30:00+00:00,2029-10-28T05:30:00+01:00,2029-10-28T05:30:00+00:00,2029-10-28T05:30:00+00:00
a964b8f2f2f2f2f2f2f2f2f3,84,11,4,11,71,75,12,94.0,47,47,23,151,9.0,60,11,51,2.2,17,2030,30,105100.0,25,94.0,sous station,9.4,202.5,23.0,60.0,4/11,4/11/2030,17:30,2030-11-04T17:30:00,25.12,267125272015603,2030-11-04T17:30:00+00:00,2030-11-04T17:30:00+01:00,2030-11-04T17:30:00+00:00,2030-11-04T17:30:00+00:00
aadc86f2f2f2f2f2f2f2f2f3,85,6,28,8,55,75,12,94.0,47,47,23,151,9.0,60,11,51,2.2,13,2027,30,105100.0,25,94.0,sous station,9.4,202.5,23.0,60.0,28/6,28/6/2027,13:30,2027-06-28T13:30:00,25.12,267125272015603,2027-06-28T13:30:00+00:00,2027-06-28T13:30:00+02:00,2027-06-28T13:30:00+00:00,2027-06-28T13:30:00+00:00
a8dca6f2f2f2f2f2f2f2f2f3,84,6,28,10,55,75,12,94.0,47,47,23,151,9.0,60,11,51,2.2,13,2029,30,105100.0,25,94.0,sous station,9.4,202.5,23.0,60.0,28/6,28/6/2029,13:30,2029-06-28T13:30:00,25.12,267125272015603,2029-06-28T13:30:00+00:00,2029-06-28T13:30:00+02:00,2029-06-28T13:30:00+00:00,2029-06-28T13:30:00+00:00
a8f480f2f2f2f2f2f2f2f2f3,84,7,20,8,7,75,12,94.0,47,47,23,151,9.0,60,11,51,2.2,1,2027,30,105100.0,25,94.0,sous station,9.4,202.5,23.0,60.0,20/7,20/7/2027,1:30,2027-07-20T01:30:00,25.12,267125272015603,2027-07-20T01:30:00+00:00,2027-07-20T01:30:00+02:00,2027-07-20T01:30:00+00:00,2027-07-20T01:30:00+00:00
aac4b8f2f2f2f2f2f2f2f2f3,85,6,4,11,71,75,12,94.0,47,47,23,151,9.0,60,11,51,2.2,17,2030,30,105100.0,25,94.0,sous station,9.4,202.5,23.0,60.0,4/6,4/6/2030,17:30,2030-06-04T17:30:00,25.12,267125272015603,2030-06-04T17:30:00+00:00,2030-06-04T17:30:00+02:00,2030-06-04T17:30:00+00:00,2030-06-04T17:30:00+00:00
a8fcb0f2f2f2f2f2f2f2f2f3,84,7,28,11,7,75,12,94.0,47,47,23,151,9.0,60,11,51,2.2,1,2030,30,105100.0,25,94.0,sous station,9.4,202.5,23.0,60.0,28/7,28/7/2030,1:30,2030-07-28T01:30:00,25.12,267125272015603,2030-07-28T01:30:00+00:00,2030-07-28T01:30:00+02:00,2030-07-28T01:30:00+00:00,2030-07-28T01:30:00+00:00
aa2ca4f2f2f2f2f2f2f2f2f3,85,1,12,10,39,75,12,94.0,47,47,23,151,9.0,60,11,51,2.2,9,2029,30,105100.0,25,94.0,sous station,9.4,202.5,23.0,60.0,12/1,12/1/2029,9:30,2029-01-12T09:30:00,25.12,267125272015603,2029-01-12T09:30:00+00:00,2029-01-12T09:30:00+01:00,2029-01-12T09:30:00+00:00,2029-01-12T09:30:00+00:00
aa3082f2f2f2f2f2f2f2f2f3,85,1,16,8,23,75,12,94.0,47,47,23,151,9.0,60,11,51,2.2,5,2027,30,105100.0,25,94.0,sous station,9.4,202.5,23.0,60.0,16/1,16/1/2027,5:30,2027-01-16T05:30:00,25.12,267125272015603,2027-01-16T05:30:00+00:00,2027-01-16T05:30:00+01:00,2027-01-16T05:30:00+00:00,2027-01-16T05:30:00+00:00
a8ec8af2f2f2f2f2f2f2f2f3,84,7,12,8,87,75,12,94.0,47,47,23,151,9.0,60,11,51,2.2,21,2027,30,105100.0,25,94.0,sous station,9.4,202.5,23.0,60.0,12/7,12/7/2027,21:30,2027-07-12T21:30:00,25.12,267125272015603,2027-07-12T21:30:00+00:00,2027-07-12T21:30:00+02:00,2027-07-12T21:30:00+00:00,2027-07-12T21:30:00+00:00
a908b4f2f2f2f2f2f2f2f2f3,84,8,8,11,39,75,12,94.0,47,47,23,151,9.0,60,11,51,2.2,9,2030,30,105100.0,25,94.0,sous station,9.4,202.5,23.0,60.0,8/8,8/8/2030,9:30,2030-08-08T09:30:00,25.12,267125272015603,2030-08-08T09:30:00+00:00,2030-08-08T09:30:00+02:00,2030-08-08T09:30:00+00:00,2030-08-08T09:30:00+00:00
a908a6f2f2f2f2f2f2f2f2f3,84,8,8,10,55,75,12,94.0,47,47,23,151,9.0,60,11,51,2.2,13,2029,30,105100.0,25,94.0,sous station,9.4,202.5,23.0,60.0,8/8,8/8/2029,13:30,2029-08-08T13:30:00,25.12,267125272015603,2029-08-08T13:30:00+00:00,2029-08-08T13:30:00+02:00,2029-08-08T13:30:00+00:00,2029-08-08T13:30:00+00:00
a918a0f2f2f2f2f2f2f2f2f3,84,8,24,10,7,75,12,94.0,47,47,23,151,9.0,60,11,51,2.2,1,2029,30,105100.0,25,94.0,sous station,9.4,202.5,23.0,60.0,24/8,24/8/2029,1:30,2029-08-24T01:30:00,25.12,267125272015603,2029-08-24T01:30:00+00:00,2029-08-24T01:30:00+02:00,2029-08-24T01:30:00+00:00,2029-08-24T01:30:00+00:00
a90c88f2f2f2f2f2f2f2f2f3,84,8,12,8,71,75,12,94.0,47,47,23,151,9.0,60,11,51,2.2,17,2027,30,105100.0,25,94.0,sous station,9.4,202.5,23.0,60.0,12/8,12/8/2027,17:30,2027-08-12T17:30:00,25.12,267125272015603,2027-08-12T17:30:00+00:00,2027-08-12T17:30:00+02:00,2027-08-12T17:30:00+00:00,2027-08-12T17:30:00+00:00
a91490f2f2f2f2f2f2f2f2f3,84,8,20,9,7,75,12,94.0,47,47,23,151,9.0,60,11,51,2.2,1,2028,30,105100.0,25,94.0,sous station,9.4,202.5,23.0,60.0,20/8,20/8/2028,1:30,2028-08-20T01:30:00,25.12,267125272015603,2028-08-20T01:30:00+00:00,2028-08-20T01:30:00+02:00,2028-08-20T01:30:00+00:00,2028-08-20T01:30:00+00:00
a91884f2f2f2f2f2f2f2f2f3,84,8,24,8,39,75,12,94.0,47,47,23,151,9.0,60,11,51,2.2,9,2027,30,105100.0,25,94.0,sous station,9.4,202.5,23.0,60.0,24/8,24/8/2027,9:30,2027-08-24T09:30:00,25.12,267125272015603,2027-08-24T09:30:00+00:00,2027-08-24T09:30:00+02:00,2027-08-24T09:30:00+00:00,2027-08-24T09:30:00+00:00
a91888f2f2f2f2f2f2f2f2f3,84,8,24,8,71,75,12,94.0,47,47,23,151,9.0,60,11,51,2.2,17,2027,30,105100.0,25,94.0,sous station,9.4,202.5,23.0,60.0,24/8,24/8/2027,17:30,2027-08-24T17:30:00,25.12,267125272015603,2027-08-24T17:30:00+00:00,2027-08-24T17:30:00+02:00,2027-08-24T17:30:00+00:00,2027-08-24T17:30:00+00:00
a89098f2f2f2f2f2f2f2f2f3,84,4,16,9,71,75,12,94.0,47,47,23,151,9.0,60,11,51,2.2,17,2028,30,105100.0,25,94.0,sous station,9.4,202.5,23.0,60.0,16/4,16/4/2028,17:30,2028-04-16T17:30:00,25.12,267125272015603,2028-04-16T17:30:00+00:00,2028-04-16T17:30:00+02:00,2028-04-16T17:30:00+00:00,2028-04-16T17:30:00+00:00
a890a8f2f2f2f2f2f2f2f2f3,84,4,16,10,71,75,12,94.0,47,47,23,151,9.0,60,11,51,2.2,17,2029,30,105100.0,25,94.0,sous station,9.4,202.5,23.0,60.0,16/4,16/4/2029,17:30,2029-04-16T17:30:00,25.12,267125272015603,2029-04-16T17:30:00+00:00,2029-04-16T17:30:00+02:00,2029-04-16T17:30:00+00:00,2029-04-16T17:30:00+00:00
aa30baf2f2f2f2f2f2f2f2f3,85,1,16,11,87,75,12,94.0,47,47,23,151,9.0,60,11,51,2.2,21,2030,30,105100.0,25,94.0,sous station,9.4,202.5,23.0,60.0,16/1,16/1/2030,21:30,2030-01-16T21:30:00,25.12,267125272015603,2030-01-16T21:30:00+00:00,2030-01-16T21:30:00+01:00,2030-01-16T21:30:00+00:00,2030-01-16T21:30:00+00:00
aa30aaf2f2f2f2f2f2f2f2f3,85,1,16,10,87,75,12,94.0,47,47,23,151,9.0,60,11,51,2.2,21,2029,30,105100.0,25,94.0,sous station,9.4,202.5,23.0,60.0,16/1,16/1/2029,21:30,2029-01-16T21:30:00,25.12,267125272015603,2029-01-16T21:30:00+00:00,2029-01-16T21:30:00+01:00,2029-01-16T21:30:00+00:00,2029-01-16T21:30:00+00:00
aa30a8f2f2f2f2f2f2f2f2f3,85,1,16,10,71,75,12,94.0,47,47,23,151,9.0,60,11,51,2.2,17,2029,30,105100.0,25,94.0,sous station,9.4,202.5,23.0,60.0,16/1,16/1/2029,17:30,2029-01-16T17:30:00,25.12,267125272015603,2029-01-16T17:30:00+00:00,2029-01-16T17:30:00+01:00,2029-01-16T17:30:00+00:00,2029-01-16T17:30:00+00:00
a8a894f2f2f2f2f2f2f2f2f3,84,5,8,9,39,75,12,94.0,47,47,23,151,9.0,60,11,51,2.2,9,2028,30,105100.0,25,94.0,sous station,9.4,202.5,23.0,60.0,8/5,8/5/2028,9:30,2028-05-08T09:30:00,25.12,267125272015603,2028-05-08T09:30:00+00:00,2028-05-08T09:30:00+02:00,2028-05-08T09:30:00+00:00,2028-05-08T09:30:00+00:00
a8a4b8f2f2f2f2f2f2f2f2f3,84,5,4,11,71,75,12,94.0,47,47,23,151,9.0,60,11,51,2.2,17,2030,30,105100.0,25,94.0,sous station,9.4,202.5,23.0,60.0,4/5,4/5/2030,17:30,2030-05-04T17:30:00,25.12,267125272015603,2030-05-04T17:30:00+00:00,2030-05-04T17:30:00+02:00,2030-05-04T17:30:00+00:00,2030-05-04T17:30:00+00:00
a898a8f2f2f2f2f2f2f2f2f3,84,4,24,10,71,75,12,94.0,47,47,23,151,9.0,60,11,51,2.2,17,2029,30,105100.0,25,94.0,sous station,9.4,202.5,23.0,60.0,24/4,24/4/2029,17:30,2029-04-24T17:30:00,25.12,267125272015603,2029-04-24T17:30:00+00:00,2029-04-24T17:30:00+02:00,2029-04-24T17:30:00+00:00,2029-04-24T17:30:00+00:00
a884baf2f2f2f2f2f2f2f2f3,84,4,4,11,87,75,12,94.0,47,47,23,151,9.0,60,11,51,2.2,21,2030,30,105100.0,25,94.0,sous station,9.4,202.5,23.0,60.0,4/4,4/4/2030,21:30,2030-04-04T21:30:00,25.12,267125272015603,2030-04-04T21:30:00+00:00,2030-04-04T21:30:00+02:00,2030-04-04T21:30:00+00:00,2030-04-04T21:30:00+00:00
a8d490f2f2f2f2f2f2f2f2f3,84,6,20,9,7,75,12,94.0,47,47,23,151,9.0,60,11,51,2.2,1,2028,30,105100.0,25,94.0,sous station,9.4,202.5,23.0,60.0,20/6,20/6/2028,1:30,2028-06-20T01:30:00,25.12,267125272015603,2028-06-20T01:30:00+00:00,2028-06-20T01:30:00+02:00,2028-06-20T01:30:00+00:00,2028-06-20T01:30:00+00:00
a8d492f2f2f2f2f2f2f2f2f3,84,6,20,9,23,75,12,94.0,47,47,23,151,9.0,60,11,51,2.2,5,2028,30,105100.0,25,94.0,sous station,9.4,202.5,23.0,60.0,20/6,20/6/2028,5:30,2028-06-20T05:30:00,25.12,267125272015603,2028-06-20T05:30:00+00:00,2028-06-20T05:30:00+02:00,2028-06-20T05:30:00+00:00,2028-06-20T05:30:00+00:00
a8fc92f2f2f2f2f2f2f2f2f3,84,7,28,9,23,75,12,94.0,47,47,23,151,9.0,60,11,51,2.2,5,2028,30,105100.0,25,94.0,sous station,9.4,202.5,23.0,60.0,28/7,28/7/2028,5:30,2028-07-28T05:30:00,25.12,267125272015603,2028-07-28T05:30:00+00:00,2028-07-28T05:30:00+02:00,2028-07-28T05:30:00+00:00,2028-07-28T05:30:00+00:00
ae6c70f2f2f2f2f2f2f2f2f3,87,3,12,7,7,75,12,94.0,47,47,23,151,9.0,60,11,51,2.2,1,2026,30,105100.0,25,94.0,sous station,9.4,202.5,23.0,60.0,12/3,12/3/2026,1:30,2026-03-12T01:30:00,25.12,267125272015603,2026-03-12T01:30:00+00:00,2026-03-12T01:30:00+01:00,2026-03-12T01:30:00+00:00,2026-03-12T01:30:00+00:00
aa6c92f2f2f2f2f2f2f2f2f3,85,3,12,9,23,75,12,94.0,47,47,23,151,9.0,60,11,51,2.2,5,2028,30,105100.0,25,94.0,sous station,9.4,202.5,23.0,60.0,12/3,12/3/2028,5:30,2028-03-12T05:30:00,25.12,267125272015603,2028-03-12T05:30:00+00:00,2028-03-12T05:30:00+01:00,2028-03-12T05:30:00+00:00,2028-03-12T05:30:00+00:00
ab4ca0f2f2f2f2f2f2f2f2f3,85,10,12,10,7,75,12,94.0,47,47,23,151,9.0,60,11,51,2.2,1,2029,30,105100.0,25,94.0,sous station,9.4,202.5,23.0,60.0,12/10,12/10/2029,1:30,2029-10-12T01:30:00,25.12,267125272015603,2029-10-12T01:30:00+00:00,2029-10-12T01:30:00+02:00,2029-10-12T01:30:00+00:00,2029-10-12T01:30:00+00:00
ab4caaf2f2f2f2f2f2f2f2f3,85,10,12,10,87,75,12,94.0,47,47,23,151,9.0,60,11,51,2.2,21,2029,30,105100.0,25,94.0,sous station,9.4,202.5,23.0,60.0,12/10,12/10/2029,21:30,2029-10-12T21:30:00,25.12,267125272015603,2029-10-12T21:30:00+00:00,2029-10-12T21:30:00+02:00,2029-10-12T21:30:00+00:00,2029-10-12T21:30:00+00:00
a8f0b6f2f2f2f2f2f2f2f2f3,84,7,16,11,55,75,12,94.0,47,47,23,151,9.0,60,11,51,2.2,13,2030,30,105100.0,25,94.0,sous station,9.4,202.5,23.0,60.0,16/7,16/7/2030,13:30,2030-07-16T13:30:00,25.12,267125272015603,2030-07-16T13:30:00+00:00,2030-07-16T13:30:00+02:00,2030-07-16T13:30:00+00:00,2030-07-16T13:30:00+00:00
ab5090f2f2f2f2f2f2f2f2f3,85,10,16,9,7,75,12,94.0,47,47,23,151,9.0,60,11,51,2.2,1,2028,30,105100.0,25,94.0,sous station,9.4,202.5,23.0,60.0,16/10,16/10/2028,1:30,2028-10-16T01:30:00,25.12,267125272015603,2028-10-16T01:30:00+00:00,2028-10-16T01:30:00+02:00,2028-10-16T01:30:00+00:00,2028-10-16T01:30:00+00:00
a910b8f2f2f2f2f2f2f2f2f3,84,8,16,11,71,75,12,94.0,47,47,23,151,9.0,60,11,51,2.2,17,2030,30,105100.0,25,94.0,sous station,9.4,202.5,23.0,60.0,16/8,16/8/2030,17:30,2030-08-16T17:30:00,25.12,267125272015603,2030-08-16T17:30:00+00:00,2030-08-16T17:30:00+02:00,2030-08-16T17:30:00+00:00,2030-08-16T17:30:00+00:00
a91084f2f2f2f2f2f2f2f2f3,84,8,16,8,39,75,12,94.0,47,47,23,151,9.0,60,11,51,2.2,9,2027,30,105100.0,25,94.0,sous station,9.4,202.5,23.0,60.0,16/8,16/8/2027,9:30,2027-08-16T09:30:00,25.12,267125272015603,2027-08-16T09:30:00+00:00,2027-08-16T09:30:00+02:00,2027-08-16T09:30:00+00:00,2027-08-16T09:30:00+00:00
a91088f2f2f2f2f2f2f2f2f3,84,8,16,8,71,75,12,94.0,47,47,23,151,9.0,60,11,51,2.2,17,2027,30,105100.0,25,94.0,sous station,9.4,202.5,23.0,60.0,16/8,16/8/2027,17:30,2027-08-16T17:30:00,25.12,267125272015603,2027-08-16T17:30:00+00:00,2027-08-16T17:30:00+02:00,2027-08-16T17:30:00+00:00,2027-08-16T17:30:00+00:00
a918b2f2f2f2f2f2f2f2f2f3,84,8,24,11,23,75,12,94.0,47,47,23,151,9.0,60,11,51,2.2,5,2030,30,105100.0,25,94.0,sous station,9.4,202.5,23.0,60.0,24/8,24/8/2030,5:30,2030-08-24T05:30:00,25.12,267125272015603,2030-08-24T05:30:00+00:00,2030-08-24T05:30:00+02:00,2030-08-24T05:30:00+00:00,2030-08-24T05:30:00+00:00
a930b0f2f2f2f2f2f2f2f2f3,84,9,16,11,7,75,12,94.0,47,47,23,151,9.0,60,11,51,2.2,1,2030,30,105100.0,25,94.0,sous station,9.4,202.5,23.0,60.0,16/9,16/9/2030,1:30,2030-09-16T01:30:00,25.12,267125272015603,2030-09-16T01:30:00+00:00,2030-09-16T01:30:00+02:00,2030-09-16T01:30:00+00:00,2030-09-16T01:30:00+00:00
a98cb0f2f2f2f2f2f2f2f2f3,84,12,12,11,7,75,12,94.0,47,47,23,151,9.0,60,11,51,2.2,1,2030,30,105100.0,25,94.0,sous station,9.4,202.5,23.0,60.0,12/12,12/12/2030,1:30,2030-12-12T01:30:00,25.12,267125272015603,2030-12-12T01:30:00+00:00,2030-12-12T01:30:00+01:00,2030-12-12T01:30:00+00:00,2030-12-12T01:30:00+00:00
a94486f2f2f2f2f2f2f2f2f3,84,10,4,8,55,75,12,94.0,47,47,23,151,9.0,60,11,51,2.2,13,2027,30,105100.0,25,94.0,sous station,9.4,202.5,23.0,60.0,4/10,4/10/2027,13:30,2027-10-04T13:30:00,25.12,267125272015603,2027-10-04T13:30:00+00:00,2027-10-04T13:30:00+02:00,2027-10-04T13:30:00+00:00,2027-10-04T13:30:00+00:00
a988a2f2f2f2f2f2f2f2f2f3,84,12,8,10,23,75,12,94.0,47,47,23,151,9.0,60,11,51,2.2,5,2029,30,105100.0,25,94.0,sous station,9.4,202.5,23.0,60.0,8/12,8/12/2029,5:30,2029-12-08T05:30:00,25.12,267125272015603,2029-12-08T05:30:00+00:00,2029-12-08T05:30:00+01:00,2029-12-08T05:30:00+00:00,2029-12-08T05:30:00+00:00
a94490f2f2f2f2f2f2f2f2f3,84,10,4,9,7,75,12,94.0,47,47,23,151,9.0,60,11,51,2.2,1,2028,30,105100.0,25,94.0,sous station,9.4,202.5,23.0,60.0,4/10,4/10/2028,1:30,2028-10-04T01:30:00,25.12,267125272015603,2028-10-04T01:30:00+00:00,2028-10-04T01:30:00+02:00,2028-10-04T01:30:00+00:00,2028-10-04T01:30:00+00:00
a98886f2f2f2f2f2f2f2f2f3,84,12,8,8,55,75,12,94.0,47,47,23,151,9.0,60,11,51,2.2,13,2027,30,105100.0,25,94.0,sous station,9.4,202.5,23.0,60.0,8/12,8/12/2027,13:30,2027-12-08T13:30:00,25.12,267125272015603,2027-12-08T13:30:00+00:00,2027-12-08T13:30:00+01:00,2027-12-08T13:30:00+00:00,2027-12-08T13:30:00+00:00
a988a8f2f2f2f2f2f2f2f2f3,84,12,8,10,71,75,12,94.0,47,47,23,151,9.0,60,11,51,2.2,17,2029,30,105100.0,25,94.0,sous station,9.4,202.5,23.0,60.0,8/12,8/12/2029,17:30,2029-12-08T17:30:00,25.12,267125272015603,2029-12-08T17:30:00+00:00,2029-12-08T17:30:00+01:00,2029-12-08T17:30:00+00:00,2029-12-08T17:30:00+00:00
a99088f2f2f2f2f2f2f2f2f3,84,12,16,8,71,75,12,94.0,47,47,23,151,9.0,60,11,51,2.2,17,2027,30,105100.0,25,94.0,sous station,9.4,202.5,23.0,60.0,16/12,16/12/2027,17:30,2027-12-16T17:30:00,25.12,267125272015603,2027-12-16T17:30:00+00:00,2027-12-16T17:30:00+01:00,2027-12-16T17:30:00+00:00,2027-12-16T17:30:00+00:00
a99484f2f2f2f2f2f2f2f2f3,84,12,20,8,39,75,12,94.0,47,47,23,151,9.0,60,11,51,2.2,9,2027,30,105100.0,25,94.0,sous station,9.4,202.5,23.0,60.0,20/12,20/12/2027,9:30,2027-12-20T09:30:00,25.12,267125272015603,2027-12-20T09:30:00+00:00,2027-12-20T09:30:00+01:00,2027-12-20T09:30:00+00:00,2027-12-20T09:30:00+00:00
aadc98f2f2f2f2f2f2f2f2f3,85,6,28,9,71,75,12,94.0,47,47,23,151,9.0,60,11,51,2.2,17,2028,30,105100.0,25,94.0,sous station,9.4,202.5,23.0,60.0,28/6,28/6/2028,17:30,2028-06-28T17:30:00,25.12,267125272015603,2028-06-28T17:30:00+00:00,2028-06-28T17:30:00+02:00,2028-06-28T17:30:00+00:00,2028-06-28T17:30:00+00:00
a994b0f2f2f2f2f2f2f2f2f3,84,12,20,11,7,75,12,94.0,47,47,23,151,9.0,60,11,51,2.2,1,2030,30,105100.0,25,94.0,sous station,9.4,202.5,23.0,60.0,20/12,20/12/2030,1:30,2030-12-20T01:30:00,25.12,267125272015603,2030-12-20T01:30:00+00:00,2030-12-20T01:30:00+01:00,2030-12-20T01:30:00+00:00,2030-12-20T01:30:00+00:00
aac490f2f2f2f2f2f2f2f2f3,85,6,4,9,7,75,12,94.0,47,47,23,151,9.0,60,11,51,2.2,1,2028,30,105100.0,25,94.0,sous station,9.4,202.5,23.0,60.0,4/6,4/6/2028,1:30,2028-06-04T01:30:00,25.12,267125272015603,2028-06-04T01:30:00+00:00,2028-06-04T01:30:00+02:00,2028-06-04T01:30:00+00:00,2028-06-04T01:30:00+00:00
ae2872f2f2f2f2f2f2f2f2f3,87,1,8,7,23,75,12,94.0,47,47,23,151,9.0,60,11,51,2.2,5,2026,30,105100.0,25,94.0,sous station,9.4,202.5,23.0,60.0,8/1,8/1/2026,5:30,2026-01-08T05:30:00,25.12,267125272015603,2026-01-08T05:30:00+00:00,2026-01-08T05:30:00+01:00,2026-01-08T05:30:00+00:00,2026-01-08T05:30:00+00:00
a8d8b2f2f2f2f2f2f2f2f2f3,84,6,24,11,23,75,12,94.0,47,47,23,151,9.0,60,11,51,2.2,5,2030,30,105100.0,25,94.0,sous station,9.4,202.5,23.0,60.0,24/6,24/6/2030,5:30,2030-06-24T05:30:00,25.12,267125272015603,2030-06-24T05:30:00+00:00,2030-06-24T05:30:00+02:00,2030-06-24T05:30:00+00:00,2030-06-24T05:30:00+00:00
a918b4f2f2f2f2f2f2f2f2f3,84,8,24,11,39,75,12,94.0,47,47,23,151,9.0,60,11,51,2.2,9,2030,30,105100.0,25,94.0,sous station,9.4,202.5,23.0,60.0,24/8,24/8/2030,9:30,2030-08-24T09:30:00,25.12,267125272015603,2030-08-24T09:30:00+00:00,2030-08-24T09:30:00+02:00,2030-08-24T09:30:00+00:00,2030-08-24T09:30:00+00:00
a8cca8f2f2f2f2f2f2f2f2f3,84,6,12,10,71,75,12,94.0,47,47,23,151,9.0,60,11,51,2.2,17,2029,30,105100.0,25,94.0,sous station,9.4,202.5,23.0,60.0,12/6,12/6/2029,17:30,2029-06-12T17:30:00,25.12,267125272015603,2029-06-12T17:30:00+00:00,2029-06-12T17:30:00+02:00,2029-06-12T17:30:00+00:00,2029-06-12T17:30:00+00:00
a8ccaaf2f2f2f2f2f2f2f2f3,84,6,12,10,87,75,12,94.0,47,47,23,151,9.0,60,11,51,2.2,21,2029,30,105100.0,25,94.0,sous station,9.4,202.5,23.0,60.0,12/6,12/6/2029,21:30,2029-06-12T21:30:00,25.12,267125272015603,2029-06-12T21:30:00+00:00,2029-06-12T21:30:00+02:00,2029-06-12T21:30:00+00:00,2029-06-12T21:30:00+00:00
a928a4f2f2f2f2f2f2f2f2f3,84,9,8,10,39,75,12,94.0,47,47,23,151,9.0,60,11,51,2.2,9,2029,30,105100.0,25,94.0,sous station,9.4,202.5,23.0,60.0,8/9,8/9/2029,9:30,2029-09-08T09:30:00,25.12,267125272015603,2029-09-08T09:30:00+00:00,2029-09-08T09:30:00+02:00,2029-09-08T09:30:00+00:00,2029-09-08T09:30:00+00:00
a8c4a2f2f2f2f2f2f2f2f2f3,84,6,4,10,23,75,12,94.0,47,47,23,151,9.0,60,11,51,2.2,5,2029,30,105100.0,25,94.0,sous station,9.4,202.5,23.0,60.0,4/6,4/6/2029,5:30,2029-06-04T05:30:00,25.12,267125272015603,2029-06-04T05:30:00+00:00,2029-06-04T05:30:00+02:00,2029-06-04T05:30:00+00:00,2029-06-04T05:30:00+00:00
a90caaf2f2f2f2f2f2f2f2f3,84,8,12,10,87,75,12,94.0,47,47,23,151,9.0,60,11,51,2.2,21,2029,30,105100.0,25,94.0,sous station,9.4,202.5,23.0,60.0,12/8,12/8/2029,21:30,2029-08-12T21:30:00,25.12,267125272015603,2029-08-12T21:30:00+00:00,2029-08-12T21:30:00+02:00,2029-08-12T21:30:00+00:00,2029-08-12T21:30:00+00:00
a90cb2f2f2f2f2f2f2f2f2f3,84,8,12,11,23,75,12,94.0,47,47,23,151,9.0,60,11,51,2.2,5,2030,30,105100.0,25,94.0,sous station,9.4,202.5,23.0,60.0,12/8,12/8/2030,5:30,2030-08-12T05:30:00,25.12,267125272015603,2030-08-12T05:30:00+00:00,2030-08-12T05:30:00+02:00,2030-08-12T05:30:00+00:00,2030-08-12T05:30:00+00:00
a93c92f2f2f2f2f2f2f2f2f3,84,9,28,9,23,75,12,94.0,47,47,23,151,9.0,60,11,51,2.2,5,2028,30,105100.0,25,94.0,sous station,9.4,202.5,23.0,60.0,28/9,28/9/2028,5:30,2028-09-28T05:30:00,25.12,267125272015603,2028-09-28T05:30:00+00:00,2028-09-28T05:30:00+02:00,2028-09-28T05:30:00+00:00,2028-09-28T05:30:00+00:00
ae4c70f2f2f2f2f2f2f2f2f3,87,2,12,7,7,75,12,94.0,47,47,23,151,9.0,60,11,51,2.2,1,2026,30,105100.0,25,94.0,sous station,9.4,202.5,23.0,60.0,12/2,12/2/2026,1:30,2026-02-12T01:30:00,25.12,267125272015603,2026-02-12T01:30:00+00:00,2026-02-12T01:30:00+01:00,2026-02-12T01:30:00+00:00,2026-02-12T01:30:00+00:00
ae5070f2f2f2f2f2f2f2f2f3,87,2,16,7,7,75,12,94.0,47,47,23,151,9.0,60,11,51,2.2,1,2026,30,105100.0,25,94.0,sous station,9.4,202.5,23.0,60.0,16/2,16/2/2026,1:30,2026-02-16T01:30:00,25.12,267125272015603,2026-02-16T01:30:00+00:00,2026-02-16T01:30:00+01:00,2026-02-16T01:30:00+00:00,2026-02-16T01:30:00+00:00
ae6876f2f2f2f2f2f2f2f2f3,87,3,8,7,55,75,12,94.0,47,47,23,151,9.0,60,11,51,2.2,13,2026,30,105100.0,25,94.0,sous station,9.4,202.5,23.0,60.0,8/3,8/3/2026,13:30,2026-03-08T13:30:00,25.12,267125272015603,2026-03-08T13:30:00+00:00,2026-03-08T13:30:00+01:00,2026-03-08T13:30:00+00:00,2026-03-08T13:30:00+00:00
aa84a4f2f2f2f2f2f2f2f2f3,85,4,4,10,39,75,12,94.0,47,47,23,151,9.0,60,11,51,2.2,9,2029,30,105100.0,25,94.0,sous station,9.4,202.5,23.0,60.0,4/4,4/4/2029,9:30,2029-04-04T09:30:00,25.12,267125272015603,2029-04-04T09:30:00+00:00,2029-04-04T09:30:00+02:00,2029-04-04T09:30:00+00:00,2029-04-04T09:30:00+00:00
aa90aaf2f2f2f2f2f2f2f2f3,85,4,16,10,87,75,12,94.0,47,47,23,151,9.0,60,11,51,2.2,21,2029,30,105100.0,25,94.0,sous station,9.4,202.5,23.0,60.0,16/4,16/4/2029,21:30,2029-04-16T21:30:00,25.12,267125272015603,2029-04-16T21:30:00+00:00,2029-04-16T21:30:00+02:00,2029-04-16T21:30:00+00:00,2029-04-16T21:30:00+00:00
aa58baf2f2f2f2f2f2f2f2f3,85,2,24,11,87,75,12,94.0,47,47,23,151,9.0,60,11,51,2.2,21,2030,30,105100.0,25,94.0,sous station,9.4,202.5,23.0,60.0,24/2,24/2/2030,21:30,2030-02-24T21:30:00,25.12,267125272015603,2030-02-24T21:30:00+00:00,2030-02-24T21:30:00+01:00,2030-02-24T21:30:00+00:00,2030-02-24T21:30:00+00:00
aa94b2f2f2f2f2f2f2f2f2f3,85,4,20,11,23,75,12,94.0,47,47,23,151,9.0,60,11,51,2.2,5,2030,30,105100.0,25,94.0,sous station,9.4,202.5,23.0,60.0,20/4,20/4/2030,5:30,2030-04-20T05:30:00,25.12,267125272015603,2030-04-20T05:30:00+00:00,2030-04-20T05:30:00+02:00,2030-04-20T05:30:00+00:00,2030-04-20T05:30:00+00:00
aa9c98f2f2f2f2f2f2f2f2f3,85,4,28,9,71,75,12,94.0,47,47,23,151,9.0,60,11,51,2.2,17,2028,30,105100.0,25,94.0,sous station,9.4,202.5,23.0,60.0,28/4,28/4/2028,17:30,2028-04-28T17:30:00,25.12,267125272015603,2028-04-28T17:30:00+00:00,2028-04-28T17:30:00+02:00,2028-04-28T17:30:00+00:00,2028-04-28T17:30:00+00:00
aa5880f2f2f2f2f2f2f2f2f3,85,2,24,8,7,75,12,94.0,47,47,23,151,9.0,60,11,51,2.2,1,2027,30,105100.0,25,94.0,sous station,9.4,202.5,23.0,60.0,24/2,24/2/2027,1:30,2027-02-24T01:30:00,25.12,267125272015603,2027-02-24T01:30:00+00:00,2027-02-24T01:30:00+01:00,2027-02-24T01:30:00+00:00,2027-02-24T01:30:00+00:00
aa6480f2f2f2f2f2f2f2f2f3,85,3,4,8,7,75,12,94.0,47,47,23,151,9.0,60,11,51,2.2,1,2027,30,105100.0,25,94.0,sous station,9.4,202.5,23.0,60.0,4/3,4/3/2027,1:30,2027-03-04T01:30:00,25.12,267125272015603,2027-03-04T01:30:00+00:00,2027-03-04T01:30:00+01:00,2027-03-04T01:30:00+00:00,2027-03-04T01:30:00+00:00
aaa4a2f2f2f2f2f2f2f2f2f3,85,5,4,10,23,75,12,94.0,47,47,23,151,9.0,60,11,51,2.2,5,2029,30,105100.0,25,94.0,sous station,9.4,202.5,23.0,60.0,4/5,4/5/2029,5:30,2029-05-04T05:30:00,25.12,267125272015603,2029-05-04T05:30:00+00:00,2029-05-04T05:30:00+02:00,2029-05-04T05:30:00+00:00,2029-05-04T05:30:00+00:00
aa6ca2f2f2f2f2f2f2f2f2f3,85,3,12,10,23,75,12,94.0,47,47,23,151,9.0,60,11,51,2.2,5,2029,30,105100.0,25,94.0,sous station,9.4,202.5,23.0,60.0,12/3,12/3/2029,5:30,2029-03-12T05:30:00,25.12,267125272015603,2029-03-12T05:30:00+00:00,2029-03-12T05:30:00+01:00,2029-03-12T05:30:00+00:00,2029-03-12T05:30:00+00:00
aa7080f2f2f2f2f2f2f2f2f3,85,3,16,8,7,75,12,94.0,47,47,23,151,9.0,60,11,51,2.2,1,2027,30,105100.0,25,94.0,sous station,9.4,202.5,23.0,60.0,16/3,16/3/2027,1:30,2027-03-16T01:30:00,25.12,267125272015603,2027-03-16T01:30:00+00:00,2027-03-16T01:30:00+01:00,2027-03-16T01:30:00+00:00,2027-03-16T01:30:00+00:00
aa7082f2f2f2f2f2f2f2f2f3,85,3,16,8,23,75,12,94.0,47,47,23,151,9.0,60,11,51,2.2,5,2027,30,105100.0,25,94.0,sous station,9.4,202.5,23.0,60.0,16/3,16/3/2027,5:30,2027-03-16T05:30:00,25.12,267125272015603,2027-03-16T05:30:00+00:00,2027-03-16T05:30:00+01:00,2027-03-16T05:30:00+00:00,2027-03-16T05:30:00+00:00
aa7086f2f2f2f2f2f2f2f2f3,85,3,16,8,55,75,12,94.0,47,47,23,151,9.0,60,11,51,2.2,13,2027,30,105100.0,25,94.0,sous station,9.4,202.5,23.0,60.0,16/3,16/3/2027,13:30,2027-03-16T13:30:00,25.12,267125272015603,2027-03-16T13:30:00+00:00,2027-03-16T13:30:00+01:00,2027-03-16T13:30:00+00:00,2027-03-16T13:30:00+00:00
aaaca2f2f2f2f2f2f2f2f2f3,85,5,12,10,23,75,12,94.0,47,47,23,151,9.0,60,11,51,2.2,5,2029,30,105100.0,25,94.0,sous station,9.4,202.5,23.0,60.0,12/5,12/5/2029,5:30,2029-05-12T05:30:00,25.12,267125272015603,2029-05-12T05:30:00+00:00,2029-05-12T05:30:00+02:00,2029-05-12T05:30:00+00:00,2029-05-12T05:30:00+00:00
a8eca8f2f2f2f2f2f2f2f2f3,84,7,12,10,71,75,12,94.0,47,47,23,151,9.0,60,11,51,2.2,17,2029,30,105100.0,25,94.0,sous station,9.4,202.5,23.0,60.0,12/7,12/7/2029,17:30,2029-07-12T17:30:00,25.12,267125272015603,2029-07-12T17:30:00+00:00,2029-07-12T17:30:00+02:00,2029-07-12T17:30:00+00:00,2029-07-12T17:30:00+00:00
aabca6f2f2f2f2f2f2f2f2f3,85,5,28,10,55,75,12,94.0,47,47,23,151,9.0,60,11,51,2.2,13,2029,30,105100.0,25,94.0,sous station,9.4,202.5,23.0,60.0,28/5,28/5/2029,13:30,2029-05-28T13:30:00,25.12,267125272015603,2029-05-28T13:30:00+00:00,2029-05-28T13:30:00+02:00,2029-05-28T13:30:00+00:00,2029-05-28T13:30:00+00:00
aaac9af2f2f2f2f2f2f2f2f3,85,5,12,9,87,75,12,94.0,47,47,23,151,9.0,60,11,51,2.2,21,2028,30,105100.0,25,94.0,sous station,9.4,202.5,23.0,60.0,12/5,12/5/2028,21:30,2028-05-12T21:30:00,25.12,267125272015603,2028-05-12T21:30:00+00:00,2028-05-12T21:30:00+02:00,2028-05-12T21:30:00+00:00,2028-05-12T21:30:00+00:00
aab4b2f2f2f2f2f2f2f2f2f3,85,5,20,11,23,75,12,94.0,47,47,23,151,9.0,60,11,51,2.2,5,2030,30,105100.0,25,94.0,sous station,9.4,202.5,23.0,60.0,20/5,20/5/2030,5:30,2030-05-20T05:30:00,25.12,267125272015603,2030-05-20T05:30:00+00:00,2030-05-20T05:30:00+02:00,2030-05-20T05:30:00+00:00,2030-05-20T05:30:00+00:00
aac4b6f2f2f2f2f2f2f2f2f3,85,6,4,11,55,75,12,94.0,47,47,23,151,9.0,60,11,51,2.2,13,2030,30,105100.0,25,94.0,sous station,9.4,202.5,23.0,60.0,4/6,4/6/2030,13:30,2030-06-04T13:30:00,25.12,267125272015603,2030-06-04T13:30:00+00:00,2030-06-04T13:30:00+02:00,2030-06-04T13:30:00+00:00,2030-06-04T13:30:00+00:00
aaccb0f2f2f2f2f2f2f2f2f3,85,6,12,11,7,75,12,94.0,47,47,23,151,9.0,60,11,51,2.2,1,2030,30,105100.0,25,94.0,sous station,9.4,202.5,23.0,60.0,12/6,12/6/2030,1:30,2030-06-12T01:30:00,25.12,267125272015603,2030-06-12T01:30:00+00:00,2030-06-12T01:30:00+02:00,2030-06-12T01:30:00+00:00,2030-06-12T01:30:00+00:00
aadc90f2f2f2f2f2f2f2f2f3,85,6,28,9,7,75,12,94.0,47,47,23,151,9.0,60,11,51,2.2,1,2028,30,105100.0,25,94.0,sous station,9.4,202.5,23.0,60.0,28/6,28/6/2028,1:30,2028-06-28T01:30:00,25.12,267125272015603,2028-06-28T01:30:00+00:00,2028-06-28T01:30:00+02:00,2028-06-28T01:30:00+00:00,2028-06-28T01:30:00+00:00
a8f4b2f2f2f2f2f2f2f2f2f3,84,7,20,11,23,75,12,94.0,47,47,23,151,9.0,60,11,51,2.2,5,2030,30,105100.0,25,94.0,sous station,9.4,202.5,23.0,60.0,20/7,20/7/2030,5:30,2030-07-20T05:30:00,25.12,267125272015603,2030-07-20T05:30:00+00:00,2030-07-20T05:30:00+02:00,2030-07-20T05:30:00+00:00,2030-07-20T05:30:00+00:00
a8fc98f2f2f2f2f2f2f2f2f3,84,7,28,9,71,75,12,94.0,47,47,23,151,9.0,60,11,51,2.2,17,2028,30,105100.0,25,94.0,sous station,9.4,202.5,23.0,60.0,28/7,28/7/2028,17:30,2028-07-28T17:30:00,25.12,267125272015603,2028-07-28T17:30:00+00:00,2028-07-28T17:30:00+02:00,2028-07-28T17:30:00+00:00,2028-07-28T17:30:00+00:00
a944b6f2f2f2f2f2f2f2f2f3,84,10,4,11,55,75,12,94.0,47,47,23,151,9.0,60,11,51,2.2,13,2030,30,105100.0,25,94.0,sous station,9.4,202.5,23.0,60.0,4/10,4/10/2030,13:30,2030-10-04T13:30:00,25.12,267125272015603,2030-10-04T13:30:00+00:00,2030-10-04T13:30:00+02:00,2030-10-04T13:30:00+00:00,2030-10-04T13:30:00+00:00
aa8884f2f2f2f2f2f2f2f2f3,85,4,8,8,39,75,12,94.0,47,47,23,151,9.0,60,11,51,2.2,9,2027,30,105100.0,25,94.0,sous station,9.4,202.5,23.0,60.0,8/4,8/4/2027,9:30,2027-04-08T09:30:00,25.12,267125272015603,2027-04-08T09:30:00+00:00,2027-04-08T09:30:00+02:00,2027-04-08T09:30:00+00:00,2027-04-08T09:30:00+00:00
aa88a2f2f2f2f2f2f2f2f2f3,85,4,8,10,23,75,12,94.0,47,47,23,151,9.0,60,11,51,2.2,5,2029,30,105100.0,25,94.0,sous station,9.4,202.5,23.0,60.0,8/4,8/4/2029,5:30,2029-04-08T05:30:00,25.12,267125272015603,2029-04-08T05:30:00+00:00,2029-04-08T05:30:00+02:00,2029-04-08T05:30:00+00:00,2029-04-08T05:30:00+00:00
aa88aaf2f2f2f2f2f2f2f2f3,85,4,8,10,87,75,12,94.0,47,47,23,151,9.0,60,11,51,2.2,21,2029,30,105100.0,25,94.0,sous station,9.4,202.5,23.0,60.0,8/4,8/4/2029,21:30,2029-04-08T21:30:00,25.12,267125272015603,2029-04-08T21:30:00+00:00,2029-04-08T21:30:00+02:00,2029-04-08T21:30:00+00:00,2029-04-08T21:30:00+00:00
aa88b8f2f2f2f2f2f2f2f2f3,85,4,8,11,71,75,12,94.0,47,47,23,151,9.0,60,11,51,2.2,17,2030,30,105100.0,25,94.0,sous station,9.4,202.5,23.0,60.0,8/4,8/4/2030,17:30,2030-04-08T17:30:00,25.12,267125272015603,2030-04-08T17:30:00+00:00,2030-04-08T17:30:00+02:00,2030-04-08T17:30:00+00:00,2030-04-08T17:30:00+00:00
a94ca0f2f2f2f2f2f2f2f2f3,84,10,12,10,7,75,12,94.0,47,47,23,151,9.0,60,11,51,2.2,1,2029,30,105100.0,25,94.0,sous station,9.4,202.5,23.0,60.0,12/10,12/10/2029,1:30,2029-10-12T01:30:00,25.12,267125272015603,2029-10-12T01:30:00+00:00,2029-10-12T01:30:00+02:00,2029-10-12T01:30:00+00:00,2029-10-12T01:30:00+00:00
a908b8f2f2f2f2f2f2f2f2f3,84,8,8,11,71,75,12,94.0,47,47,23,151,9.0,60,11,51,2.2,17,2030,30,105100.0,25,94.0,sous station,9.4,202.5,23.0,60.0,8/8,8/8/2030,17:30,2030-08-08T17:30:00,25.12,267125272015603,2030-08-08T17:30:00+00:00,2030-08-08T17:30:00+02:00,2030-08-08T17:30:00+00:00,2030-08-08T17:30:00+00:00
a92cbaf2f2f2f2f2f2f2f2f3,84,9,12,11,87,75,12,94.0,47,47,23,151,9.0,60,11,51,2.2,21,2030,30,105100.0,25,94.0,sous station,9.4,202.5,23.0,60.0,12/9,12/9/2030,21:30,2030-09-12T21:30:00,25.12,267125272015603,2030-09-12T21:30:00+00:00,2030-09-12T21:30:00+02:00,2030-09-12T21:30:00+00:00,2030-09-12T21:30:00+00:00
a92ca8f2f2f2f2f2f2f2f2f3,84,9,12,10,71,75,12,94.0,47,47,23,151,9.0,60,11,51,2.2,17,2029,30,105100.0,25,94.0,sous station,9.4,202.5,23.0,60.0,12/9,12/9/2029,17:30,2029-09-12T17:30:00,25.12,267125272015603,2029-09-12T17:30:00+00:00,2029-09-12T17:30:00+02:00,2029-09-12T17:30:00+00:00,2029-09-12T17:30:00+00:00
a93098f2f2f2f2f2f2f2f2f3,84,9,16,9,71,75,12,94.0,47,47,23,151,9.0,60,11,51,2.2,17,2028,30,105100.0,25,94.0,sous station,9.4,202.5,23.0,60.0,16/9,16/9/2028,17:30,2028-09-16T17:30:00,25.12,267125272015603,2028-09-16T17:30:00+00:00,2028-09-16T17:30:00+02:00,2028-09-16T17:30:00+00:00,2028-09-16T17:30:00+00:00
a924a8f2f2f2f2f2f2f2f2f3,84,9,4,10,71,75,12,94.0,47,47,23,151,9.0,60,11,51,2.2,17,2029,30,105100.0,25,94.0,sous station,9.4,202.5,23.0,60.0,4/9,4/9/2029,17:30,2029-09-04T17:30:00,25.12,267125272015603,2029-09-04T17:30:00+00:00,2029-09-04T17:30:00+02:00,2029-09-04T17:30:00+00:00,2029-09-04T17:30:00+00:00
a938a8f2f2f2f2f2f2f2f2f3,84,9,24,10,71,75,12,94.0,47,47,23,151,9.0,60,11,51,2.2,17,2029,30,105100.0,25,94.0,sous station,9.4,202.5,23.0,60.0,24/9,24/9/2029,17:30,2029-09-24T17:30:00,25.12,267125272015603,2029-09-24T17:30:00+00:00,2029-09-24T17:30:00+02:00,2029-09-24T17:30:00+00:00,2029-09-24T17:30:00+00:00
a95882f2f2f2f2f2f2f2f2f3,84,10,24,8,23,75,12,94.0,47,47,23,151,9.0,60,11,51,2.2,5,2027,30,105100.0,25,94.0,sous station,9.4,202.5,23.0,60.0,24/10,24/10/2027,5:30,2027-10-24T05:30:00,25.12,267125272015603,2027-10-24T05:30:00+00:00,2027-10-24T05:30:00+02:00,2027-10-24T05:30:00+00:00,2027-10-24T05:30:00+00:00
a95c92f2f2f2f2f2f2f2f2f3,84,10,28,9,23,75,12,94.0,47,47,23,151,9.0,60,11,51,2.2,5,2028,30,105100.0,25,94.0,sous station,9.4,202.5,23.0,60.0,28/10,28/10/2028,5:30,2028-10-28T05:30:00,25.12,267125272015603,2028-10-28T05:30:00+00:00,2028-10-28T05:30:00+02:00,2028-10-28T05:30:00+00:00,2028-10-28T05:30:00+00:00
ab5498f2f2f2f2f2f2f2f2f3,85,10,20,9,71,75,12,94.0,47,47,23,151,9.0,60,11,51,2.2,17,2028,30,105100.0,25,94.0,sous station,9.4,202.5,23.0,60.0,20/10,20/10/2028,17:30,2028-10-20T17:30:00,25.12,267125272015603,2028-10-20T17:30:00+00:00,2028-10-20T17:30:00+02:00,2028-10-20T17:30:00+00:00,2028-10-20T17:30:00+00:00
ae4878f2f2f2f2f2f2f2f2f3,87,2,8,7,71,75,12,94.0,47,47,23,151,9.0,60,11,51,2.2,17,2026,30,105100.0,25,94.0,sous station,9.4,202.5,23.0,60.0,8/2,8/2/2026,17:30,2026-02-08T17:30:00,25.12,267125272015603,2026-02-08T17:30:00+00:00,2026-02-08T17:30:00+01:00,2026-02-08T17:30:00+00:00,2026-02-08T17:30:00+00:00
aae8baf2f2f2f2f2f2f2f2f3,85,7,8,11,87,75,12,94.0,47,47,23,151,9.0,60,11,51,2.2,21,2030,30,105100.0,25,94.0,sous station,9.4,202.5,23.0,60.0,8/7,8/7/2030,21:30,2030-07-08T21:30:00,25.12,267125272015603,2030-07-08T21:30:00+00:00,2030-07-08T21:30:00+02:00,2030-07-08T21:30:00+00:00,2030-07-08T21:30:00+00:00
a8b09af2f2f2f2f2f2f2f2f3,84,5,16,9,87,75,12,94.0,47,47,23,151,9.0,60,11,51,2.2,21,2028,30,105100.0,25,94.0,sous station,9.4,202.5,23.0,60.0,16/5,16/5/2028,21:30,2028-05-16T21:30:00,25.12,267125272015603,2028-05-16T21:30:00+00:00,2028-05-16T21:30:00+02:00,2028-05-16T21:30:00+00:00,2028-05-16T21:30:00+00:00
ab8896f2f2f2f2f2f2f2f2f3,85,12,8,9,55,75,12,94.0,47,47,23,151,9.0,60,11,51,2.2,13,2028,30,105100.0,25,94.0,sous station,9.4,202.5,23.0,60.0,8/12,8/12/2028,13:30,2028-12-08T13:30:00,25.12,267125272015603,2028-12-08T13:30:00+00:00,2028-12-08T13:30:00+01:00,2028-12-08T13:30:00+00:00,2028-12-08T13:30:00+00:00
a8c880f2f2f2f2f2f2f2f2f3,84,6,8,8,7,75,12,94.0,47,47,23,151,9.0,60,11,51,2.2,1,2027,30,105100.0,25,94.0,sous station,9.4,202.5,23.0,60.0,8/6,8/6/2027,1:30,2027-06-08T01:30:00,25.12,267125272015603,2027-06-08T01:30:00+00:00,2027-06-08T01:30:00+02:00,2027-06-08T01:30:00+00:00,2027-06-08T01:30:00+00:00
a8f0a8f2f2f2f2f2f2f2f2f3,84,7,16,10,71,75,12,94.0,47,47,23,151,9.0,60,11,51,2.2,17,2029,30,105100.0,25,94.0,sous station,9.4,202.5,23.0,60.0,16/7,16/7/2029,17:30,2029-07-16T17:30:00,25.12,267125272015603,2029-07-16T17:30:00+00:00,2029-07-16T17:30:00+02:00,2029-07-16T17:30:00+00:00,2029-07-16T17:30:00+00:00
a950a6f2f2f2f2f2f2f2f2f3,84,10,16,10,55,75,12,94.0,47,47,23,151,9.0,60,11,51,2.2,13,2029,30,105100.0,25,94.0,sous station,9.4,202.5,23.0,60.0,16/10,16/10/2029,13:30,2029-10-16T13:30:00,25.12,267125272015603,2029-10-16T13:30:00+00:00,2029-10-16T13:30:00+02:00,2029-10-16T13:30:00+00:00,2029-10-16T13:30:00+00:00
a98c8af2f2f2f2f2f2f2f2f3,84,12,12,8,87,75,12,94.0,47,47,23,151,9.0,60,11,51,2.2,21,2027,30,105100.0,25,94.0,sous station,9.4,202.5,23.0,60.0,12/12,12/12/2027,21:30,2027-12-12T21:30:00,25.12,267125272015603,2027-12-12T21:30:00+00:00,2027-12-12T21:30:00+01:00,2027-12-12T21:30:00+00:00,2027-12-12T21:30:00+00:00
aaf0a8f2f2f2f2f2f2f2f2f3,85,7,16,10,71,75,12,94.0,47,47,23,151,9.0,60,11,51,2.2,17,2029,30,105100.0,25,94.0,sous station,9.4,202.5,23.0,60.0,16/7,16/7/2029,17:30,2029-07-16T17:30:00,25.12,267125272015603,2029-07-16T17:30:00+00:00,2029-07-16T17:30:00+02:00,2029-07-16T17:30:00+00:00,2029-07-16T17:30:00+00:00
a98c90f2f2f2f2f2f2f2f2f3,84,12,12,9,7,75,12,94.0,47,47,23,151,9.0,60,11,51,2.2,1,2028,30,105100.0,25,94.0,sous station,9.4,202.5,23.0,60.0,12/12,12/12/2028,1:30,2028-12-12T01:30:00,25.12,267125272015603,2028-12-12T01:30:00+00:00,2028-12-12T01:30:00+01:00,2028-12-12T01:30:00+00:00,2028-12-12T01:30:00+00:00
a99490f2f2f2f2f2f2f2f2f3,84,12,20,9,7,75,12,94.0,47,47,23,151,9.0,60,11,51,2.2,1,2028,30,105100.0,25,94.0,sous station,9.4,202.5,23.0,60.0,20/12,20/12/2028,1:30,2028-12-20T01:30:00,25.12,267125272015603,2028-12-20T01:30:00+00:00,2028-12-20T01:30:00+01:00,2028-12-20T01:30:00+00:00,2028-12-20T01:30:00+00:00
ab2884f2f2f2f2f2f2f2f2f3,85,9,8,8,39,75,12,94.0,47,47,23,151,9.0,60,11,51,2.2,9,2027,30,105100.0,25,94.0,sous station,9.4,202.5,23.0,60.0,8/9,8/9/2027,9:30,2027-09-08T09:30:00,25.12,267125272015603,2027-09-08T09:30:00+00:00,2027-09-08T09:30:00+02:00,2027-09-08T09:30:00+00:00,2027-09-08T09:30:00+00:00
ab28b2f2f2f2f2f2f2f2f2f3,85,9,8,11,23,75,12,94.0,47,47,23,151,9.0,60,11,51,2.2,5,2030,30,105100.0,25,94.0,sous station,9.4,202.5,23.0,60.0,8/9,8/9/2030,5:30,2030-09-08T05:30:00,25.12,267125272015603,2030-09-08T05:30:00+00:00,2030-09-08T05:30:00+02:00,2030-09-08T05:30:00+00:00,2030-09-08T05:30:00+00:00
a968a8f2f2f2f2f2f2f2f2f3,84,11,8,10,71,75,12,94.0,47,47,23,151,9.0,60,11,51,2.2,17,2029,30,105100.0,25,94.0,sous station,9.4,202.5,23.0,60.0,8/11,8/11/2029,17:30,2029-11-08T17:30:00,25.12,267125272015603,2029-11-08T17:30:00+00:00,2029-11-08T17:30:00+01:00,2029-11-08T17:30:00+00:00,2029-11-08T17:30:00+00:00
aaf0b4f2f2f2f2f2f2f2f2f3,85,7,16,11,39,75,12,94.0,47,47,23,151,9.0,60,11,51,2.2,9,2030,30,105100.0,25,94.0,sous station,9.4,202.5,23.0,60.0,16/7,16/7/2030,9:30,2030-07-16T09:30:00,25.12,267125272015603,2030-07-16T09:30:00+00:00,2030-07-16T09:30:00+02:00,2030-07-16T09:30:00+00:00,2030-07-16T09:30:00+00:00
ab5896f2f2f2f2f2f2f2f2f3,85,10,24,9,55,75,12,94.0,47,47,23,151,9.0,60,11,51,2.2,13,2028,30,105100.0,25,94.0,sous station,9.4,202.5,23.0,60.0,24/10,24/10/2028,13:30,2028-10-24T13:30:00,25.12,267125272015603,2028-10-24T13:30:00+00:00,2028-10-24T13:30:00+02:00,2028-10-24T13:30:00+00:00,2028-10-24T13:30:00+00:00
a8acb4f2f2f2f2f2f2f2f2f3,84,5,12,11,39,75,12,94.0,47,47,23,151,9.0,60,11,51,2.2,9,2030,30,105100.0,25,94.0,sous station,9.4,202.5,23.0,60.0,12/5,12/5/2030,9:30,2030-05-12T09:30:00,25.12,267125272015603,2030-05-12T09:30:00+00:00,2030-05-12T09:30:00+02:00,2030-05-12T09:30:00+00:00,2030-05-12T09:30:00+00:00
a8acb6f2f2f2f2f2f2f2f2f3,84,5,12,11,55,75,12,94.0,47,47,23,151,9.0,60,11,51,2.2,13,2030,30,105100.0,25,94.0,sous station,9.4,202.5,23.0,60.0,12/5,12/5/2030,13:30,2030-05-12T13:30:00,25.12,267125272015603,2030-05-12T13:30:00+00:00,2030-05-12T13:30:00+02:00,2030-05-12T13:30:00+00:00,2030-05-12T13:30:00+00:00
a8bc84f2f2f2f2f2f2f2f2f3,84,5,28,8,39,75,12,94.0,47,47,23,151,9.0,60,11,51,2.2,9,2027,30,105100.0,25,94.0,sous station,9.4,202.5,23.0,60.0,28/5,28/5/2027,9:30,2027-05-28T09:30:00,25.12,267125272015603,2027-05-28T09:30:00+00:00,2027-05-28T09:30:00+02:00,2027-05-28T09:30:00+00:00,2027-05-28T09:30:00+00:00
a8bca2f2f2f2f2f2f2f2f2f3,84,5,28,10,23,75,12,94.0,47,47,23,151,9.0,60,11,51,2.2,5,2029,30,105100.0,25,94.0,sous station,9.4,202.5,23.0,60.0,28/5,28/5/2029,5:30,2029-05-28T05:30:00,25.12,267125272015603,2029-05-28T05:30:00+00:00,2029-05-28T05:30:00+02:00,2029-05-28T05:30:00+00:00,2029-05-28T05:30:00+00:00
a8b08af2f2f2f2f2f2f2f2f3,84,5,16,8,87,75,12,94.0,47,47,23,151,9.0,60,11,51,2.2,21,2027,30,105100.0,25,94.0,sous station,9.4,202.5,23.0,60.0,16/5,16/5/2027,21:30,2027-05-16T21:30:00,25.12,267125272015603,2027-05-16T21:30:00+00:00,2027-05-16T21:30:00+02:00,2027-05-16T21:30:00+00:00,2027-05-16T21:30:00+00:00
a8ac96f2f2f2f2f2f2f2f2f3,84,5,12,9,55,75,12,94.0,47,47,23,151,9.0,60,11,51,2.2,13,2028,30,105100.0,25,94.0,sous station,9.4,202.5,23.0,60.0,12/5,12/5/2028,13:30,2028-05-12T13:30:00,25.12,267125272015603,2028-05-12T13:30:00+00:00,2028-05-12T13:30:00+02:00,2028-05-12T13:30:00+00:00,2028-05-12T13:30:00+00:00
a8b8b2f2f2f2f2f2f2f2f2f3,84,5,24,11,23,75,12,94.0,47,47,23,151,9.0,60,11,51,2.2,5,2030,30,105100.0,25,94.0,sous station,9.4,202.5,23.0,60.0,24/5,24/5/2030,5:30,2030-05-24T05:30:00,25.12,267125272015603,2030-05-24T05:30:00+00:00,2030-05-24T05:30:00+02:00,2030-05-24T05:30:00+00:00,2030-05-24T05:30:00+00:00
a8d894f2f2f2f2f2f2f2f2f3,84,6,24,9,39,75,12,94.0,47,47,23,151,9.0,60,11,51,2.2,9,2028,30,105100.0,25,94.0,sous station,9.4,202.5,23.0,60.0,24/6,24/6/2028,9:30,2028-06-24T09:30:00,25.12,267125272015603,2028-06-24T09:30:00+00:00,2028-06-24T09:30:00+02:00,2028-06-24T09:30:00+00:00,2028-06-24T09:30:00+00:00
a8f0a2f2f2f2f2f2f2f2f2f3,84,7,16,10,23,75,12,94.0,47,47,23,151,9.0,60,11,51,2.2,5,2029,30,105100.0,25,94.0,sous station,9.4,202.5,23.0,60.0,16/7,16/7/2029,5:30,2029-07-16T05:30:00,25.12,267125272015603,2029-07-16T05:30:00+00:00,2029-07-16T05:30:00+02:00,2029-07-16T05:30:00+00:00,2029-07-16T05:30:00+00:00
ae7c78f2f2f2f2f2f2f2f2f3,87,3,28,7,71,75,12,94.0,47,47,23,151,9.0,60,11,51,2.2,17,2026,30,105100.0,25,94.0,sous station,9.4,202.5,23.0,60.0,28/3,28/3/2026,17:30,2026-03-28T17:30:00,25.12,267125272015603,2026-03-28T17:30:00+00:00,2026-03-28T17:30:00+01:00,2026-03-28T17:30:00+00:00,2026-03-28T17:30:00+00:00
a8b082f2f2f2f2f2f2f2f2f3,84,5,16,8,23,75,12,94.0,47,47,23,151,9.0,60,11,51,2.2,5,2027,30,105100.0,25,94.0,sous station,9.4,202.5,23.0,60.0,16/5,16/5/2027,5:30,2027-05-16T05:30:00,25.12,267125272015603,2027-05-16T05:30:00+00:00,2027-05-16T05:30:00+02:00,2027-05-16T05:30:00+00:00,2027-05-16T05:30:00+00:00
ac24a8f2f2f2f2f2f2f2f2f3,86,1,4,10,71,75,12,94.0,47,47,23,151,9.0,60,11,51,2.2,17,2029,30,105100.0,25,94.0,sous station,9.4,202.5,23.0,60.0,4/1,4/1/2029,17:30,2029-01-04T17:30:00,25.12,267125272015603,2029-01-04T17:30:00+00:00,2029-01-04T17:30:00+01:00,2029-01-04T17:30:00+00:00,2029-01-04T17:30:00+00:00
a948b2f2f2f2f2f2f2f2f2f3,84,10,8,11,23,75,12,94.0,47,47,23,151,9.0,60,11,51,2.2,5,2030,30,105100.0,25,94.0,sous station,9.4,202.5,23.0,60.0,8/10,8/10/2030,5:30,2030-10-08T05:30:00,25.12,267125272015603,2030-10-08T05:30:00+00:00,2030-10-08T05:30:00+02:00,2030-10-08T05:30:00+00:00,2030-10-08T05:30:00+00:00
a948b8f2f2f2f2f2f2f2f2f3,84,10,8,11,71,75,12,94.0,47,47,23,151,9.0,60,11,51,2.2,17,2030,30,105100.0,25,94.0,sous station,9.4,202.5,23.0,60.0,8/10,8/10/2030,17:30,2030-10-08T17:30:00,25.12,267125272015603,2030-10-08T17:30:00+00:00,2030-10-08T17:30:00+02:00,2030-10-08T17:30:00+00:00,2030-10-08T17:30:00+00:00
ac2494f2f2f2f2f2f2f2f2f3,86,1,4,9,39,75,12,94.0,47,47,23,151,9.0,60,11,51,2.2,9,2028,30,105100.0,25,94.0,sous station,9.4,202.5,23.0,60.0,4/1,4/1/2028,9:30,2028-01-04T09:30:00,25.12,267125272015603,2028-01-04T09:30:00+00:00,2028-01-04T09:30:00+01:00,2028-01-04T09:30:00+00:00,2028-01-04T09:30:00+00:00
a94896f2f2f2f2f2f2f2f2f3,84,10,8,9,55,75,12,94.0,47,47,23,151,9.0,60,11,51,2.2,13,2028,30,105100.0,25,94.0,sous station,9.4,202.5,23.0,60.0,8/10,8/10/2028,13:30,2028-10-08T13:30:00,25.12,267125272015603,2028-10-08T13:30:00+00:00,2028-10-08T13:30:00+02:00,2028-10-08T13:30:00+00:00,2028-10-08T13:30:00+00:00
a8c4a8f2f2f2f2f2f2f2f2f3,84,6,4,10,71,75,12,94.0,47,47,23,151,9.0,60,11,51,2.2,17,2029,30,105100.0,25,94.0,sous station,9.4,202.5,23.0,60.0,4/6,4/6/2029,17:30,2029-06-04T17:30:00,25.12,267125272015603,2029-06-04T17:30:00+00:00,2029-06-04T17:30:00+02:00,2029-06-04T17:30:00+00:00,2029-06-04T17:30:00+00:00
a8c48af2f2f2f2f2f2f2f2f3,84,6,4,8,87,75,12,94.0,47,47,23,151,9.0,60,11,51,2.2,21,2027,30,105100.0,25,94.0,sous station,9.4,202.5,23.0,60.0,4/6,4/6/2027,21:30,2027-06-04T21:30:00,25.12,267125272015603,2027-06-04T21:30:00+00:00,2027-06-04T21:30:00+02:00,2027-06-04T21:30:00+00:00,2027-06-04T21:30:00+00:00
a92ca2f2f2f2f2f2f2f2f2f3,84,9,12,10,23,75,12,94.0,47,47,23,151,9.0,60,11,51,2.2,5,2029,30,105100.0,25,94.0,sous station,9.4,202.5,23.0,60.0,12/9,12/9/2029,5:30,2029-09-12T05:30:00,25.12,267125272015603,2029-09-12T05:30:00+00:00,2029-09-12T05:30:00+02:00,2029-09-12T05:30:00+00:00,2029-09-12T05:30:00+00:00
ae6872f2f2f2f2f2f2f2f2f3,87,3,8,7,23,75,12,94.0,47,47,23,151,9.0,60,11,51,2.2,5,2026,30,105100.0,25,94.0,sous station,9.4,202.5,23.0,60.0,8/3,8/3/2026,5:30,2026-03-08T05:30:00,25.12,267125272015603,2026-03-08T05:30:00+00:00,2026-03-08T05:30:00+01:00,2026-03-08T05:30:00+00:00,2026-03-08T05:30:00+00:00
a934b6f2f2f2f2f2f2f2f2f3,84,9,20,11,55,75,12,94.0,47,47,23,151,9.0,60,11,51,2.2,13,2030,30,105100.0,25,94.0,sous station,9.4,202.5,23.0,60.0,20/9,20/9/2030,13:30,2030-09-20T13:30:00,25.12,267125272015603,2030-09-20T13:30:00+00:00,2030-09-20T13:30:00+02:00,2030-09-20T13:30:00+00:00,2030-09-20T13:30:00+00:00
a96496f2f2f2f2f2f2f2f2f3,84,11,4,9,55,75,12,94.0,47,47,23,151,9.0,60,11,51,2.2,13,2028,30,105100.0,25,94.0,sous station,9.4,202.5,23.0,60.0,4/11,4/11/2028,13:30,2028-11-04T13:30:00,25.12,267125272015603,2028-11-04T13:30:00+00:00,2028-11-04T13:30:00+01:00,2028-11-04T13:30:00+00:00,2028-11-04T13:30:00+00:00
a8d4a8f2f2f2f2f2f2f2f2f3,84,6,20,10,71,75,12,94.0,47,47,23,151,9.0,60,11,51,2.2,17,2029,30,105100.0,25,94.0,sous station,9.4,202.5,23.0,60.0,20/6,20/6/2029,17:30,2029-06-20T17:30:00,25.12,267125272015603,2029-06-20T17:30:00+00:00,2029-06-20T17:30:00+02:00,2029-06-20T17:30:00+00:00,2029-06-20T17:30:00+00:00
